parameter_id,parameter_name,parameter_description,chapter_id,chapter_citation,value,same_value_language_ids,value_language_count,language_count_total,count_ratio
63A,Noun Phrase Conjunction,,63,Leon Stassen. 2013. Noun Phrase Conjunction. In: Dryer; Matthew S. & Haspelmath; Martin (eds.) 2013. The World Atlas of Language Structures Online. Leipzig: Max Planck Institute for Evolutionary Anthropology. (Available online at https://wals.info/chapter/63),1,abk abm adk aeg ahu ain ala alb amh amp arc arm asm ava awt bam bej bla bre bri bsq bul bur cct chk ckl coo cre dag diy dut dyi eng est fin fre gae geo gid grk gua gum heb hin hix hun ice igb iri jab juh kat ket kha khm kho kio kku knd kor kty kwa lah lat lep lez lil lit lkt maa mal map mcf mei men mlt mnc moe mok mrd mun mut myi nar nca ngl ojs orh otm pit pol prd prs psm qim rka rom rus scr sel siu sla snh som spa squ srr swe tag tbu tgk tgr tha tiw tli tml tpi tsi tur tus usa uzb vie wap wrp yaq yid yko yur zqc,131,76475,0.0017129781
57A,Position of Pronominal Possessive Affixes,,57,Matthew S. Dryer. 2013. Position of Pronominal Possessive Affixes. In: Dryer; Matthew S. & Haspelmath; Martin (eds.) 2013. The World Atlas of Language Structures Online. Leipzig: Max Planck Institute for Evolutionary Anthropology. (Available online at https://wals.info/chapter/57),2,acl acu aeg agc ajg alk alw aly ama ame amh aml amo amp amr ams anc ane anj ann arg ari arm aro arq arw asy aym aze azi bag bak bau bbu bch bco bej ber bfg bgo bgr bia bid big bik bkr blg bma bmr bnn bre brf brh brn bsi bsk btk bto bud but bvi bwc cai cem cha chh chv cld cmh cmy dag dgo dgr did din dio dom doy dre ene eno erk esm eve evn ewe fij fin fua fut fye gbb gbs gel giz gku gln gmw gmz gok goo grs grw gud hal hau hdi heb hhu hlu hoa hun iaa igs ila irq jab jaq jar jeb jlu kad kam kar kau kbu ken ker kga kgz kha khl kkp kkt kkv klv kmk kmn kmo kms knm knr kop kos krb krc krd kre krr ktl kty kut kwk kwn kws kxo kyq laa lag lar lbu lda lel len lew lgu lil lmg lmh lon lou lul luo luv ma mbr mbt mby mdg mdm mee mgu mig mis miy mke mkh mkl mko mku mlg mme mmi mmw mna mng mnm mns mnt mnv moa moe mok mor mou mra mrg mrl mro mrt msl msm msn mss mtu mud mun mur mus mwo mxj mxp myi mzc mzh nab naj nak nan ndo neh nga ngl ngm ngn ngz nha nia nnk nog noo nsg nti ntj ntu nue nza oir ong ord ork paa pal par per pkn pkt pms pod poh pre psw pul pur qhu qui rag ras rit rov ruk rwa saa sak seb sen shi shl shm sht sia sio sis siu skp slb slp sng sno so sob sod som son sta stl swa syu tai tak tan tas tba tbo tbu teo ter tgk tgr tia tig tin tkl tla tlp tmc tno toz trm tsi tsk tum tur tuv tvo udm uli ute uyg uzb vnm wah war wat wed wem wlf wlo wol wrb wth xar yap yko ykt yng ypk yul zag zai zan zap zen zzo,355,76475,0.00464204
53A,Ordinal Numerals,,53,Thomas Stolz; Ljuba N. Veselinova. 2013. Ordinal Numerals. In: Dryer; Matthew S. & Haspelmath; Martin (eds.) 2013. The World Atlas of Language Structures Online. Leipzig: Max Planck Institute for Evolutionary Anthropology. (Available online at https://wals.info/chapter/53),6,aci aeg afr ala alb arg arm arw bak bam ben bla bma bnk bsq bur cak cch ceb cha col cop dio dre dua dut ewe ewo fea fij fni frw gae geo ger gol grb grf grn guj hau hcr heb her hin igb ing ixi kek ker kho khs kis kms knm koa kur kwe les lge lkt luv mal mam mjk mlt mly mmv msl mzc nan ndy nez nob nti nym oix orb orh oss pal pap pcm psh psj psm rap rom ses sey shn sla slb snh sup sus tag tah tml tms tna tzo wlf wly yim yko ykt zaz zul,110,76475,0.0014383786
49A,Number of Cases,,49,Oliver A. Iggesen. 2013. Number of Cases. In: Dryer; Matthew S. & Haspelmath; Martin (eds.) 2013. The World Atlas of Language Structures Online. Leipzig: Max Planck Institute for Evolutionary Anthropology. (Available online at https://wals.info/chapter/49),2,abk amh bej bma brs eng iri kho lep map may pan prs qaw rom snm squ swe tts urd yaq zqc,23,76475,0.00030075188
31A,Sex-based and Non-sex-based Gender Systems,,31,Greville G. Corbett. 2013. Sex-based and Non-sex-based Gender Systems. In: Dryer; Matthew S. & Haspelmath; Martin (eds.) 2013. The World Atlas of Language Structures Online. Leipzig: Max Planck Institute for Evolutionary Anthropology. (Available online at https://wals.info/chapter/31),1,abn aco ain ame arm asm awp bag baw bkr brh brm bsq cah car ccp cha chi chk chv cmn cnl cnt coo cyv dag djr dni don epe err eve ewe fij fin geo goo grw gua guu hai hat haw hay hmo hun iaa igb ika imo ind ite jaq kam kay kew kgz kha khk khl khm klv knr koa kob krk kse kut lad lah lan lep lez mak mal mao map mar mei mnd mns mny mok mrl mrt mss nbd ndy nez ngi nht niv ntu ork otm pai pal pil pip pit pmc prs qim ram rap san saw shk sml smt snt srn sue tab tha tho tib tol tot tsh tsi tuk tur tvl uhi una urk usa uzb vie wat wic wra yaq yel yid yko ykt ylb yor ypk yur zqc zun,145,76475,0.0018960445
50A,Asymmetrical Case-Marking,,50,Oliver A. Iggesen. 2013. Asymmetrical Case-Marking. In: Dryer; Matthew S. & Haspelmath; Martin (eds.) 2013. The World Atlas of Language Structures Online. Leipzig: Max Planck Institute for Evolutionary Anthropology. (Available online at https://wals.info/chapter/50),4,awp bec bma chk cmn fur geo hua kas knr krk mrl ntu orh pau psm tna ung yim,20,76475,0.00026152338
26A,Prefixing vs. Suffixing in Inflectional Morphology,,26,Matthew S. Dryer. 2013. Prefixing vs. Suffixing in Inflectional Morphology. In: Dryer; Matthew S. & Haspelmath; Martin (eds.) 2013. The World Atlas of Language Structures Online. Leipzig: Max Planck Institute for Evolutionary Anthropology. (Available online at https://wals.info/chapter/26),2,aar abi abn acu adn agc agt ala alb alw aly amc ame amn amp ams ana ang apt arc arm arw asm ass ath ava awa awe awp aym aze azi baa bam bco bho bii bio bkb bkr bln blr blt bmb bmr bnj bnr bnu bod brh bri brm brn brs bsk bul bun but bya cas cax cay cbo chc chv cmh cmn cmy coc cos cpy crn crp ctm cub dag dds des deu dgr dhr dhw did dig dim diy dja dji djm djn djp djr dlm dmk dms dni dom doy dsh dut dyi eip emb ene eng epe est eve evn fas fin for fre gah gal gar gbb ger ggu gim gln gon grb grk grr grw gud gug guu hai hal hay hin hmi ho hop hpd hum hun hzb ice ik ind ing inn irq irx ita ite jaq jeb jiv jms jpn kac kar kay kbu kem ken ker kew kgz kha khg khi khl kho kkp kku klm kmb kmk kmn kmo kms knc knd kni knk knn knr kob kok kol kop kor koy krc krj krn krw kta kty kuv kwo kws kwt kwz kya kyk laa lac lad lel lez lho lim lit lmg lmn lui mac mai maj map mbr mby mde mdm mee mgg mgu mhi mik mis miy mkh mlg mme mnc mnd mne mno mns mny moe mog moo mot mpt mrt mrw msg msl mss mts mtu mun mut nab nag naj nar nas nbd nca ndt nep new nga ngi ngj ngt ngw ngz nha nis nmb noc nog noo nor nsn ntu nue nyi omi orh ork oss oya paa pae pan paw pdp pkn plk pme pno pol por ppi prh prk psh pso ptw pum pur qaw qhu qim rem rit rom rum rus rwe sav scr sdw shi shk sho sia sid sin siu skp slo slp sna sno snt som spa squ srd sro sta stl sue suk svs swe syu tac tam tbu tel ter tgl thn tml tmo tny trb trm trr tru tsh ttu tuc tun tur tuv tvo twe udi udm uhi ukr una urd urn ute uyg uzb wah wak wam wao wap wat wau wbn wel wem wik win wiy wly wmu wrb wrg wrl wsk yag yal yaq yar yid yin yko ykt yng yok ypk ytu yuk yuw ywl zay,406,76475,0.0053089247
52A,Comitatives and Instrumentals,,52,Thomas Stolz; Cornelia Stroh; Aina Urdze. 2013. Comitatives and Instrumentals. In: Dryer; Matthew S. & Haspelmath; Martin (eds.) 2013. The World Atlas of Language Structures Online. Leipzig: Max Planck Institute for Evolutionary Anthropology. (Available online at https://wals.info/chapter/52),3,bam coo fon geo grf hai haw hun ice ind irq kch koy kzy lan lit mns ngl ntu nyu owc pen qay rus sre srm sup tkl uzb vot wel zya,33,76475,0.00043151356
69A,Position of Tense-Aspect Affixes,,69,Matthew S. Dryer. 2013. Position of Tense-Aspect Affixes. In: Dryer; Matthew S. & Haspelmath; Martin (eds.) 2013. The World Atlas of Language Structures Online. Leipzig: Max Planck Institute for Evolutionary Anthropology. (Available online at https://wals.info/chapter/69),2,aar abi abk abn abv acg acm aco acu adn aga agm agt ain ala alb alc alw aly amb amc ame amn amp amx ana ani ann ao apl apt apu ara arc arm arw asm ass ath atk ava avo awa awe awi awp awt aym aze azi baa bac bae bam bao baq bau bco bdm bej bel ber bgn bho bii bil bin bio bkb bkr bln blt blx bmb bmr bnj bnr bnu bod boi boj bre brh bri brm brn brr brs bry bsk bua bul bun bur but bya bzi cah car cas cax cay cba cbo cct cde chb chc che chg chi chn chv chx cld cln cmh cmn cmy cnm cnt coa coo cos cpy crn crp ctm cub cui cup dag dan daw der des deu dgo dgr dhb dhm dhr dhw dig dim diy dja dji djm djn djp djr dlm dmi dmk dms dni dom drm dsh duk dun dut dyi eip eka emb eme ene eng epe ese est eud eve evn fas fin for fqs fre fua fur fye gaa gah gal gan gar gbb gds geo ger ggu gid gim gln gnn goa gog gon grb grf grj grk grr grs grw gud gug guh guj gum gur guu hai hak hal har hay hin hix hlp hmi ho hop hpd hua hui hum hun hzb iat ice igb ign igs iha ijo ik ika imo ina ind ing inn iqu irx ita ite iwa jam jaq jeb jiv jpn jva jwr kac kar kay kbo kbu kem ker kew kfe kgu kgz kha khg khi khl kio kiw kkp kku klm klq kma kmb kmh kmj kmk kmn kmo kmp kms knb knc knd kni knk knm knn knr knw kob koe kok kol kop kor koy krc krh kri krj krk krw ksa kta kti ktl kty kum kus kuu kuv kwk kwo kwt kwz kya kyk kyq kyz lac lad lav ldu lec lep lez lho lim lit lkt lmn lng lot lui lun mab mac mag mak map mar mau mbt mcd mco mcv mde mdm mdn mdo mee mei mem mgg mgi mhi mhk mij mik mis mkg mkh mkr mme mmi mnc mnd mne mni mnm mno mns mny moe mog mom moo mos mot mou mpr mpt mqf mra mrh mri mrr mrs mrt mrw msc msg msl mss mtk mts mui mun mut nab nag nah nar nas nbd nbr nca ndo ndt nep nev new nez nga ngi ngj ngl ngn ngt ngw ngz nha nhh nhm nhn nht nis niv nkb nmb nmd noc nog non nor nph nsn nti ntj ntu nug nwd nyi nze oks olo omh omi one ong ood ord orh ork oro orw osa oss oya paa pae pan pau paw pba pdp pga pia pip pir pis pkn plk pme pno pny pol por ppi prh prk psh pso ptw pum pur pwn qaw qhu qim ram rao raw rem res ret rit rmb rom rot rum run rwa rwe sav sba sdw sem shd she shh shi shk sho shp shy sia sid sin siu skp skr slb slg slp sme smn sna snh sno snt som spa srd srn sro sta stl sue sug suk sus svs swe syu tac tam tan tao tau tba tbl tbu tbx tce tel tgl thn thu thy tir tja tkl tma tmc tmg tml tmo tnn tny tob ton tpn tps tpt trb trr tru trw tsf tsh tte ttu tuc tun tur tuv tvo tvt twe twn uby udi udm uhi ukr una urd usa usr ute uyg uzb wah wai wak wam wao wap was wat wau way wbn wch wel wem wik win wir wly wmu wog wra wrb wrg wrk wrn wsk wtm yag yah yal yaq yar ycn yid yim yin yko ykt ylm yng yok ypk yrm ytu yuc yuw ywl yyg zay zch zpr zqc zqo zqs zun,667,76475,0.008721804
82A,Order of Subject and Verb,,82,Matthew S. Dryer. 2013. Order of Subject and Verb. In: Dryer; Matthew S. & Haspelmath; Martin (eds.) 2013. The World Atlas of Language Structures Online. Leipzig: Max Planck Institute for Evolutionary Anthropology. (Available online at https://wals.info/chapter/82),1,aab aar aba abi abk abn abo abu abv acg acl acm acn aco adg adi adn ady adz aeg aga agb agh agm agt ain aja ajg akh akn ala alb alk all aln aly ama amb ame amh aml amn amp amq amt amx ana anc ane ang ani ano anu ao aoj api apt apu apw arc arg ari arj arm aro arp arq arw asm ass ath atk atm au ava avk avo awa awi awp awt awy ayi aym ayo ayr ayw aze azi baa bab baf bag bai bak bam bao bar bas baw bbl bbw bdm bdu bdw bej bel ben ber bgm bgo bgr bgs bgz bho bhu bid bii bik bin bio bir biu bka bkb bkt bku ble blt blx blz bmb bnb bni bnj bnk bnn bnu boa bob bod bok bol bon boq bra brf bri brl brm brn brp brq bry bsh bsk bsq bsr bti bua bub bud bug bum bur bus but buu buy bvi bya bzi cah cai cam can car cas cay cct cde cga chb chc chd chg chh chi chk chn chp chr chs chv chw cic cln cme cmh cml cmn cmr cnl cnt coa coc cop cpn cpy crn cro cti ctm ctw cua cuc cui cup cze dag dam dan daw day ddj dds deg der des deu dga dgb dgo dgr dha dhb dhm die dig dim din dio diy dja dji djp djr dlm dma dmi dmk dms dni dok doy drg drm dsh dua duk dul dum dun dut dyi ebi edo ega egn eip eka eko emb eme emm ene eng eno epe erk err ese est eud eve evn ewe ewo fas fin foe fon for fqs fre fri fua fur fut fye ga gah gal gam gan gap gar gav gbb gbs gds geo ger ggu ghb ghr gim gla gln gmw gmz gnb god goe gog gok gon goo grb grg grw gua gug guh guj gul gur guu guw gwa gwo gyc hai hak hal ham han har hat hau hay heb heh hem hhu hid hin hlp hma hmi hmo hna hnd hol hop hpd hua huc hui hum hun hya hzb iat iau iba ice idn idu ifm igb ige igs iha ijo ika ila imo ina ind ing inn iqu irq irr irx isa isi ite ito iwa iwm izi jab jad jar jbt jin jiv jmo jms jng joh jpn jrw juh juk jva jwr kaa kab kac kad kae kan kar kas kau kay kba kbo kbu kbw kby kch kdw kel kem ken ker ket kew kfe kga kgu kgy kha khd khg khl khm khn kho khr khs khw kie kik kil kim kin kio kir kis kiw kkp kkq kku kkv kla klg kll klq klw kma kmb kmh kmk kmn kmo kmp kmr kms kmu kmw kmz knb knc knd kng kni knk knm knn kno knr knw knz koa kob koe kok kol kom kon kor kos koy kpw kqq krc krd kre krh krk krr krw kry krz ksa kse ksg ksm ksn kta ktc kte kti ktl kty kum kun kus kuu kuv kwa kwn kwo kwt kwy kwz kxo kya kyk kyl kyn kyp kyr kyz kzy laa lab lad lag lah lai lak lal lan lao lar lav lbu lda ldo ldu leb lec leg lel len lep les let lew lez lgi lgt lho lic lim lin lis lit lkt llm lmh lmn lmp lmu lnd lon lot lou luc lug lui luo luv ma mab mad mae mag mai man mar mas mau maw max may mba mbe mbi mbm mbo mbr mbt mby mcd mda mde mdg mdl mdn mdo mds mdw mea mee mei mek mem mer mey mga mgg mgh mgi mgk mgo mgq mgu mhi mhu mie mii mij mik mil mis miz mka mkd mke mkg mkh mki mkj mkl mkq mku mkz mla mlg mlk mlm mlu mmb mmv mnc mnd mne mng mni mnm mno mns mnv mny moe mof mog mom mon moo mor mos mot mou mpa mpt mpu mqf mrc mrd mrg mrh mri mro mrr mrs mrt mru mrw msc msg msl msm msn mss mtb mto mts mtu mua mui mum mun mup mur mus muu mwe mwo mxe myg myi mym myn myr nab nad nag nah naj nak nal nam nar nas nat nav nbd nbe nbm nbr ncm ndb ndi ndj ndo ndt ndu ndy neh nep nev new ney nga ngd ngi ngj ngk ngm ngn ngo ngt ngu ngw ngz nhn nis niv nkb nke nkn nko nku nma nmb nmd nmm nnd nng nnk noc nog non noo nor nph nse nsn nti ntj nto ntu nua nue nun nup nus nwd nya nyi nyk nza nze obg obo ocu oir oks olo omh omi one ong ora ord orh ori ork oro orw ory osa oss otr owi oya paa pae pal pam pan par pat paw pba pdp per pia pir pis pit pkn plg plh plk pme pmn pms png pno pnu pny pog poh pok por pra pre prh prk prs psh pso psw ptt ptw pul pum pun pur qaf qaw qhu qim rag ral ram rao ras raw rem res ret rga rgc ria rik rim rmb rnd rny rom ron rot rpa rru rsu rum run rus rut rwa ryu sah sak san sap sar sav scr sdw sea sed sem ser ses sgb sgl sgu sha shb she shh shi shk shl shm shn sho sht sia sid sil sin sio sir sis skk skm sko skp skr sku skw sla slb sle slo sme smn sna sng snh snm snn sno snt sob sod som son spi srb src srd sre srn sro ssa sta sti stl stn sud sue suk sul sun sup sus svs swa swe syu tab tac taf taj tak tal tam tan tao tar tau taw tba tbl tbt tbu tbw tce tdi tdr tel teo ter tet tgk tgl tgn tgr tha thk thn thu thy tia tib tid tig tik tis tiv tiw tja tki tkl tkm tlf tli tlo tma tmc tmg tml tmm tmn tmo tmr tnb tnc tne tni tnk tnn tny tod ton tou toz tpr tpt trb trm trr tru trw tsf tsh tsz ttd tte ttn ttu tuc tul tum tun tur tuv tuy tvo tvt twe twn txj tye uby udh udi udm uhi ukr uld uli una ung ura urd urk url urt uru usa usr uyg uzb vai ven vie vnm wag wah wak wal wan wao wap was wau way wbn wch wed wiy wlf wlw wly wma wme wmu wn wna woi wol wom wra wrk wrm wrn wry wsk wtm wwa xam xar xas xav xbi xer xho xns xoo yah yal yam yaq yar yay ybi ycn yei yel ygr yi yid yim yin yko ykt ylm yng yor yqy ytu yuc yuk yul yur yus yuw zag zan zar zay zaz zch zhn zim zpr zul zun,1192,76475,0.015586793
43A,Third Person Pronouns and Demonstratives,,43,D.N.S. Bhat. 2013. Third Person Pronouns and Demonstratives. In: Dryer; Matthew S. & Haspelmath; Martin (eds.) 2013. The World Atlas of Language Structures Online. Leipzig: Max Planck Institute for Evolutionary Anthropology. (Available online at https://wals.info/chapter/43),2,amb bsq but cax cld cmh cub cyv dig eng heb hin hix hzb kam kha khr khs kws lav mac mar mei mhi mss myi mym ngi nht pal pan pau pms ppi pso ram ret snh snt sup tab tid tja tsh tzu wam wrd yid yim yuk yur,52,76475,0.00067996077
33A,Coding of Nominal Plurality,,33,Matthew S. Dryer. 2013. Coding of Nominal Plurality. In: Dryer; Matthew S. & Haspelmath; Martin (eds.) 2013. The World Atlas of Language Structures Online. Leipzig: Max Planck Institute for Evolutionary Anthropology. (Available online at https://wals.info/chapter/33),2,abi abk abn acg aco agt ain alb aln amh amx any ao apu ara arc arm arp arw asm ath ava avo awa awe awp awt aym aze azi baa bae bam baq bar bdm bej bgn bho bid big bkb bla bln blt bmz bnu bod bre brh bri brn brs bsk bti bud bul bun bur but bya cah cai cam car cas cax cde chb chc chg chk chn chs chv chx ckl cld cln cmh cmn cmy coc cpy cqt cre crn cro crp ctm cup cze des deu dgb dgo dhr dhw did dji djn dmk dms dom doy drg dsh dut eip emb ene eng est eve evn fin for fre fua ful ga gah gal gam gds geo ger ggu gil gim gmw gnd goa god gon grb grf grk grw gud guh gum guu gyc hai hau hay hdi heb hhu hid hin hlp hma hmi ho hop htc hui hum hun hzb ice idn ign igs ijo ik ina ing inn irq ita ite ito jaq jeb jiv jlu jpn jug jva kab kac kai kbu kdw kem ket kew kfe kgz khg khi khl kho kie kio kir kiw kkp kku kla klw kma kmh kmk kmo kms knd kni knk knn knr knw kob kok kol kop kor koy kpe krc krd kri krk krn krw kry kta kty kum kuv kws kwt kxo kyq lad lah lan lar lat lav ldu lec lel les lez lit lmg lmn lng lug lui lul lun luo ma maa mab mac mag maj man mas mba mbr mcv mde mdn mea mee meh men mer mgh mgq mgu mij miy mkg mkh mkr mlg mme mmi mna mnc mnd mne mno mns mny moe mog mor mos mot mou mpr mpt mrl mrt msl mss mts mtt mui mun mur mut muu myi mzn nab nag naj nan nar nav nbd nbr ndt nep ngi ngj ngm ngz nha nhh nhn nht niv nkb noc nog nor nrg ntu nua oir oji oks olo one ong ord ork oss oya paa pae pan pdp pga pia pip plh plk pme pol por prk prs psh psm pso ptt ptw pur pwn qhu qim ras rem res rgc rit rny rom run rus rut rwe sal sav scr sdw seb sec ser sgb shd shk shl sho shp sht shy sid sil sin siu skp sla slb slo slp smn sna sno so sob som sor spa spi src srd sta stl sug suk sup swe taj tao tar tbu tel ten tep thk thn tic tig tir tiw tkl tlf tli tma tmc tml tnc tny tob ton tou tpt trb trm trr trw tsh tsz tts ttu tuc tul tun tur tuv tvo twn tzo uby udi udm ukr urd urk urn usr ute uyg uzb wak wal wao wap wau wbn wch wel wik wly wra wrd wrk wrl xas xoo yag yam yaq yar ycn yim yin yko ykt yok ypk ytu yuk yuw ywl zay zpr zqc zun,513,76475,0.0067080744
35A,Plurality in Independent Personal Pronouns,,35,Michael Daniel. 2013. Plurality in Independent Personal Pronouns. In: Dryer; Matthew S. & Haspelmath; Martin (eds.) 2013. The World Atlas of Language Structures Online. Leipzig: Max Planck Institute for Evolutionary Anthropology. (Available online at https://wals.info/chapter/35),3,ain apu cle coo cre cyv jak kam kfe kho koa lan lkt mun oji otm pau pit psm tps tsi tun wic yuc,25,76475,0.0003269042
9A,The Velar Nasal,,9,Gregory D.S. Anderson. 2013. The Velar Nasal. In: Dryer; Matthew S. & Haspelmath; Martin (eds.) 2013. The World Atlas of Language Structures Online. Leipzig: Max Planck Institute for Evolutionary Anthropology. (Available online at https://wals.info/chapter/9),1,akb akc akk alu apk bag bam bao baw bkr bnj brm ccm cha chk chr ckh cla cle cnl cnt csc dio dol dre eip ena ene ese eve evn ewe fij frd fur fut gav ghr gll goo grb hal ham igb ind irq ite jmo jur kat kay khg khs kmp kmu knm knr koo krb krh kro krq kry kse ksi kyl lad lah lan lav lep lha lim lon lui lum luv mal mao map mau mdr mei mrt muo myi nab nai neg nga ngi niv nnk ntu nug nyk oks ong orc ork oro pai pat pit pms ptt ram rap sae sch sed sgs sml soo spi sre sti sul sup swa tab tag tbr tha thd tid tiw tmr tni tod tuk udh ulc ung vai vie wam was wik wrd yid yim yko ymd ypk zno,147,76475,0.0019221968
121A,Comparative Constructions,,121,Leon Stassen. 2013. Comparative Constructions. In: Dryer; Matthew S. & Haspelmath; Martin (eds.) 2013. The World Atlas of Language Structures Online. Leipzig: Max Planck Institute for Evolutionary Anthropology. (Available online at https://wals.info/chapter/121),1,adk amh amp amr ams arg aym bae bgi bln bma bre brm bur car ceb chk coe eve evn geo grw gua heb hin hzb jak jpn kas kbl kem kha khk kho kms knr kor kro laz lez lim maa map maw mhi mlt mnc mss mun nav ngt ntu nue pal pir pur qcu qim rap rem sal siu stl taj taz tbu tel tml tug tup tur tuv tvl uby udm uzb yap,78,76475,0.0010199412
51A,Position of Case Affixes,,51,Matthew S. Dryer. 2013. Position of Case Affixes. In: Dryer; Matthew S. & Haspelmath; Martin (eds.) 2013. The World Atlas of Language Structures Online. Leipzig: Max Planck Institute for Evolutionary Anthropology. (Available online at https://wals.info/chapter/51),1,aar abn acm acu adk adn ady aga agt alb all alw aly amh amn ams ana apw arc arm arw ass ath ats ava awa awe ayo aze azi baa bae baq bbw bej bel ben bho bii bio biu bkb blr blx bmr bnj bnr bnu bod boi brh brm brr brs bry bsk bti bun bur but bya cah cai cam cas cax cay cea chc chi chk chv cln cmh cml cmn coa coc cos cpy cre crp ctm cub cup cze dag dgr dhb dhr dhw did diy dja dji djm djn djp djr dmk dni dom drg dsh dyi emb ene esm ess est eud eve evn fin fur gah gal gam gan gds geo ger ggu gid gil gku goa god gog gon grk grr grw gug guh gum guu hin hlp hmi ho hop hua hui hum hun hup hzb ice ijo ik ing iqu ite jab jaq jeb jiv kab kac kay kbu kem ken ker ket kgu kgz kha khg khi khl kio kiw kje kkp kku klg klm klw kma kmh kmk kmo kmp kmr kms knd knn kno knw kok kol kop kor koy krc krj krn krw kry kta kty kum kuv kws kwz kya kyp kzy lad lak lat lav lec lez lho lim lit lml lmn lui mac mag mai maj map maw mba mby mcc mch mdm mdn mee men mer mgh mhi mhk mhl mii mik mir mkh mki mlk mme mnc mne mno mns mny moe mog moh moo mqf mrl mrt mrw msc msl mts mui mur mut nah nas nbr ndj nep new nez nga ngi ngj ngl ngm ngn ngt ngw nha nis niv nkb noc nog nor nsn ntj ntu nug nya nyi oir oji omi ond one ong ord orh ork orw oss otr oya pan par pba pia pir pkn pkt pme pny pol ppi prh prk psh psm pso ptt ptw puq pur pwn qim qui rem rit rmb rom rus rut rwe sav scr shb shh shi sho shp shy sia sin skp slo slp sna snh sno so sor sta stl sue suk tao tce tel ten thn thu tic tli tlo tlp tma tml tmn tpn tpt trm trr tru tsh tsz ttu tul tun tur tus tuv tvo twe twn udi udm uhi ukr uru usr ute uyg uzb wag wah wak wam wan wap was wau wed wem wic wik win wiy wly wmu wn wom wrb wrd wrg wrk wrl wrn wth xbi yag yah yam yaq yar yid yim yin yko ykt yng yok ypk ytu yuc yuk yur yuw ywl yyg zan zay zpr zqc zqo zqs zun,452,76475,0.0059104282
105A,Ditransitive Constructions: The Verb 'Give',,105,Martin Haspelmath. 2013. Ditransitive Constructions: The Verb 'Give'. In: Dryer; Matthew S. & Haspelmath; Martin (eds.) 2013. The World Atlas of Language Structures Online. Leipzig: Max Planck Institute for Evolutionary Anthropology. (Available online at https://wals.info/chapter/105),1,abk abu akh alk ame aml ano ara awp bae bag bai bak bdm ber bfg bho bii biu bkt bma boz bsq bum bur but bya bzi cct chk chn chr cnl cop dhi dja drg dug epe eve fij fin fre gam gar gdf geo ger grk gua guu hai hat heb hin hix hmo hun hzb ik imo ing irq ita itz jab jak jel jng jpn kas kda kem ker kha khs klm kly kma kmu knc knd knm knr koa kod kor kro kwa kya lad lak lat lav lep lez lgu lis mac mad mai mam mao mbb mbi mbo mdg mdr mei mgg mgu mhi mle mlt mpr mup mus mxc mym nag nbd nep nia niu nsg nua nwd orh ory pae per pms prs pta ptt pur qaf qia qim rap raw ron rus san sap skp sla sml snm sno so spa sud sue sup tam tgl tgn tha tib tig tin tis tml tms tor trb tru trw tsi tst tsz tur tzu udh udm uku urk wir wra wrm yid yim yko ytu zaq zay zaz,189,76475,0.0024713958
124A,'Want' Complement Subjects,,124,Martin Haspelmath. 2013. 'Want' Complement Subjects. In: Dryer; Matthew S. & Haspelmath; Martin (eds.) 2013. The World Atlas of Language Structures Online. Leipzig: Max Planck Institute for Evolutionary Anthropology. (Available online at https://wals.info/chapter/124),4,aga ana apu ara awp chk eve gua hum jam jpn kay kma kob kwk kyk lad mac mak mcv mku mts nab ngl nmb nmi oji olu ood pno prh qia see shk sho tgn tob tps udh yaq yir ypk ytu zch,45,76475,0.0005884276
