parameter_id,parameter_name,parameter_description,chapter_id,chapter_citation,value,same_value_language_ids,value_language_count,language_count_total,count_ratio
81A,Order of Subject; Object and Verb,,81,Matthew S. Dryer. 2013. Order of Subject; Object and Verb. In: Dryer; Matthew S. & Haspelmath; Martin (eds.) 2013. The World Atlas of Language Structures Online. Leipzig: Max Planck Institute for Evolutionary Anthropology. (Available online at https://wals.info/chapter/81),1,aba abk abn abo abv adg ady aga agm agt ain akh ala all aly amb ame amh amn amp ang ano ao api apt apw arc arw asm ass ath atm ava awa awi awp awt awy aym aze azi baa bam bao baw bdm bdw bej ben bgm bho bhu bin biu bkb bkt blt blx boa bok bon boq bri brl brm brp bsq bti bua bur bus but bzi cah can car cas cay cct cde chb chc chd chg chh chp chv cln cml cmn cnl coa cpn cpy cro ctm ctw cui cup dag dan daw dds der des deu dgr dha dhb dhm die dig dim diy dja dji djp dni drg drm dum dun edo eip eka eme ene epe ese eud eve evn foe for fqs fur gah gal gam gan gap gar gds geo ghb ghr gim gln gmw gog gon grw gug guh guj gur guu hai ham hay hhu hid hin hlp hmi hop hpd hua hui hum hzb iat idn iha ijo ika inn irq irx isa isi ite iwm jad jbt jin jiv jms jng joh jpn jrw jva kaa kab kac kae kbo kbu kem ket kew kgu kha khd khg khl kho khw kie kim kio kiw kkp kku kll klw kma kmb kmh kmn kmo kmp kmr kms kmz knb knd kng knm knn kno knr knz koa kob kok kol kor koy kqq krc krd krh krr krw kry krz kse kta kti kty kum kun kus kuv kwo kwt kya kyk kyp kyr kyz lad lah lai lal lav lep lez lis lkt lmn lot mab mag man mar maw max mde mdl mdn mek mem mer mey mgg mgh mgi mhi mij mik mis miz mka mkg mkh mki mkj mkl mku mnc mne mni mnm mno mns mnv mny mog mom mpa mpt mqf mrc mrd mrh mri mrr mrs mru msc msg msl msn mto mts mtu mun muu mym myr nab nag naj nam nar nas nat nav nbd nbr nep nev new nga ngt niv nkb nku nma nmb nmd nnd nnk noc nog ntj ntu nus nwd nyi nyk oir oks omh ong ord orh ori oro orw ory osa oss owi oya pae pan paw pba pdp pir pis pme pno pra prh prk prs psh pso ptt pum pun qaf qhu qim ral ram rao ras raw res ret rgc ria rik rmb rpa rum run rut rwa sar sav sdw ser shb she shh shi shk sho sia sid sil sko skp skw sla slb sme smn sna sng snh snm snn snt sod som spi srb src srn sro sta stl sue suk sup sus svs syu taj tak tam tao tar tau taw tba tbl tbu tce tdi tdr tel tgl tgr thk thn thu thy tib tig tja tkl tkm tlf tli tlo tma tmc tmg tml tmo tni tnn tod tpt trb trr trw tsf tsh tsz tte ttu tul tun tur tuv tuy tvo twe tye uby udh udi udm uhi una urd urk usa usr uyg uzb vai wag wah wak wao wap was way wbn wed wlw wly wme wmu wna wom wsk xas xer xns yah yal yam yaq yar yei yel ygr yid yiw yko ykt ylm yqy ytu yuc yuw zag zay zaz zim zun,564,76475,0.007374959
129A,Hand and Arm,,129,Cecil H. Brown. 2013. Hand and Arm. In: Dryer; Matthew S. & Haspelmath; Martin (eds.) 2013. The World Atlas of Language Structures Online. Leipzig: Max Planck Institute for Evolutionary Anthropology. (Available online at https://wals.info/chapter/129),2,abi abk abm abw acg acm acu afr agr agt aht akr alg aly amc amk amp amu apc api ara ati atk atq ats awp ayo bab bae bca bem beo bkd bkl blx bnb bnj bno bnv bok bor bpb bre brs bsq bur but bwa byu cac cai cam cap cas cat cav cax cct ceb cec che chi chp chu chy cla clc cle cma cmh cmn cnl cnt cog cpa cpw cqt cre crg crj crk crn cro crp crq crt csh ctc ctl cub cui cur cut dak dda des dgx dig diy dja dji djp dre dsh dut emb eng ese eve eya fij fin fox fre gae ger ghb gid gjj gmb gna gno gny goa goo gre grk gto gua gum guu gyb hai heb hid hil hmb hmd hmi hmu hpd htc hum hun hup hve ik ill ind inu iql iri ita ixc jiv juh jva kaq kas kdg kek kew kgt kgz kic kkw klm kls klz knc knd kng koa kor krc krk ksa kth ktu kun kut kws kxo kyn lao luo lus mal map mbb mca mcg mch mcn mco mcs mcv mdm mhc mic mis miz mjc mkb mku mnd mne mny moc mog moh mov mpa mpy mrl mrt mss mtg mti mtt mui mut muu mwl mwn mwp myi myo myr mzc nat nav nbr ndj nep nez ngi ngj ngn ngw nhu nhx nju nko nlu nne nnt nor nro nsk nsn ntj nug nuk nun nuu nya oca oji ojm oma ond onn osa owc pan pcm pem pia pin pip pir pit pkn pla pme pnn pno pny pol por pow ppc ppi psj psm psv pui qan qaw qca qec rap res ret rom sal sba sea sec sel shk shl sho shs shw sla slv snc spa spo sri sss sum sva tac tag tar teh tha tho tic tiw tlf tnb tnl tob tol tos toy tpa tpt trb trc tsg tsh tsi tsj tsw tty tub tun tup tur tus tut tuy twn txj uhi urk ute wam wap wat way wch wel wem wic win wir wiy wmu wnb wra wrd wrg wrl wth wwr xar xer xok yah yan ycn yir yki ypk yrt yuk yus yyg yyo zap zqs zul,389,76475,0.0050866297
130A,Finger and Hand,,130,Cecil H. Brown. 2013. Finger and Hand. In: Dryer; Matthew S. & Haspelmath; Martin (eds.) 2013. The World Atlas of Language Structures Online. Leipzig: Max Planck Institute for Evolutionary Anthropology. (Available online at https://wals.info/chapter/130),2,abi abk abm abw acg acm acu afr agr aht akr alg amh amk amr amu apc api apj ara aro arw arx atq ats awa awp aym ayo aze bab bae bam bca bem bgr bkd bkl bla blj blr blx bno bnq bnv bok bor bpb brc bre brs bsq btk bur but cab cac cai cak cam cap car cas cat cav cax cay cch cck cct ceb cec cha che chi chj chl cho chp chr chu chw cin cla clc cle cma cmh cmn cmy cnl cnt cof cog col cor cpa cre crg crk crl crn cro crp crq crt csf csh csk ctc ctl ctt ctw cub cui cur cut cuu cyn cze dak dam dca des dgx dig djp dre dsh dut efi eka emb ena eng ese eve eya fij fin for fox fre fut gad gae geo ger ghb gid git gjj gku gmb gna gno goa gre grk grm gto gua gul guu gyb hai hau heb hid hil hmb hmd hmi hmu hop hpd htc hui hum hun hve ifu igb ik ika ill ilo ind iql iri ita itw itz ixc ixi jak jeh jmo jpn juh kas kat kaz kdg kdz kea kek kew kfe kgt kgz kha khg khk kic kio kis kje kky klm klw klz kmh kmk knc knd kng knr koa kon kor kos kpn krc kro ktb kth ktu kul kun kuq kut kwa kwe kws kyn lao lau len lez lit lnw lui lus mab mai mal mao map maz mby mcg mch mcn mco mcs mcv men mer mgg mhc mhi mic mid mij mis miz mjc mkb mnc mnd mne moc mog moj mok mop mos mov mpy mrt mse msh mss mtg mti mtp mtt mui mum mup mut muy mwb mwl mxg mxu myi mym myo myr mzc nas nbd nbr nep ngn nht nhu nhx niu nju nko nkr nlu nne nnm nog nom nor npa nro nsk nsn nsz ntj nuk nun nuu nya nym oca oji oka oko olu ood ore osa osm owc pae pal pan pcm pem per pia pip pir pla pme pnn pno poh pol por pow ppc prt psj psm psv pui pul pur qan qaw qca qch qec rad ram rap res ret rgn rng rnn rom rus sal sam say sba scr sea sec sed sel shk shl shn sho shu shw sin sla slv smj smt snh sno sol son spa spo squ sri sss stl sum sus sva svk swa tac tag tar tbe tce teh tga tha tib tic tkm tlf tlp tml tna tnb tnj tnl toa tob toj tol tos tpa tpi tpt trb trc tsf tsg tsh tsi tsj tsw tty tub tuc tup tur tus tut tuy tvo twn txj tze tzo tzt udh uhi ukr ute uzb ved wap way wch wel wem wic wir wiy wmu wol wra wrd wth wwr xar xer xoo yah yak yap yar yav ycn yct yki ypk yrt yus yyo zai zaj zam zap zfl zqc zqr zqs zul zun zzo,521,76475,0.006812684
54A,Distributive Numerals,,54,David Gil. 2013. Distributive Numerals. In: Dryer; Matthew S. & Haspelmath; Martin (eds.) 2013. The World Atlas of Language Structures Online. Leipzig: Max Planck Institute for Evolutionary Anthropology. (Available online at https://wals.info/chapter/54),4,brm bsk bsq but chv cyv err eve gag hai ish jpn ket kgz kha khk kor kty mar mgn mnc nga ntu oss qcu tiw tur tvo uyg ygn ykt,32,76475,0.0004184374
30A,Number of Genders,,30,Greville G. Corbett. 2013. Number of Genders. In: Dryer; Matthew S. & Haspelmath; Martin (eds.) 2013. The World Atlas of Language Structures Online. Leipzig: Max Planck Institute for Evolutionary Anthropology. (Available online at https://wals.info/chapter/30),1,abn aco ain ame arm asm awp bag baw bkr brh brm bsq cah car ccp cha chi chk chv cmn cnl cnt coo cyv dag djr dni don epe err eve ewe fij fin geo goo grw gua guu hai hat haw hay hmo hun iaa igb ika imo ind ite jaq kam kay kew kgz kha khk khl khm klv knr koa kob krk kse kut lad lah lan lep lez mak mal mao map mar mei mnd mns mny mok mrl mrt mss nbd ndy nez ngi nht niv ntu ork otm pai pal pil pip pit pmc prs qim ram rap san saw shk sml smt snt srn sue tab tha tho tib tol tot tsh tsi tuk tur tvl uhi una urk usa uzb vie wat wic wra yaq yel yid yko ykt ylb yor ypk yur zqc zun,145,76475,0.0018960445
32A,Systems of Gender Assignment,,32,Greville G. Corbett. 2013. Systems of Gender Assignment. In: Dryer; Matthew S. & Haspelmath; Martin (eds.) 2013. The World Atlas of Language Structures Online. Leipzig: Max Planck Institute for Evolutionary Anthropology. (Available online at https://wals.info/chapter/32),1,abn aco ain ame arm asm awp bag baw bkr brh brm bsq cah car ccp cha chi chk chv cmn cnl cnt coo cyv dag djr dni don epe err eve ewe fij fin geo goo grw gua guu hai hat haw hay hmo hun iaa igb ika imo ind ite jaq kam kay kew kgz kha khk khl khm klv knr koa kob krk kse kut lad lah lan lep lez mak mal mao map mar mei mnd mns mny mok mrl mrt mss nbd ndy nez ngi nht niv ntu ork otm pai pal pil pip pit pmc prs qim ram rap san saw shk sml smt snt srn sue tab tha tho tib tol tot tsh tsi tuk tur tvl uhi una urk usa uzb vie wat wic wra yaq yel yid yko ykt ylb yor ypk yur zqc zun,145,76475,0.0018960445
83A,Order of Object and Verb,,83,Matthew S. Dryer. 2013. Order of Object and Verb. In: Dryer; Matthew S. & Haspelmath; Martin (eds.) 2013. The World Atlas of Language Structures Online. Leipzig: Max Planck Institute for Evolutionary Anthropology. (Available online at https://wals.info/chapter/83),1,aar aba abk abn abo abv acn acu adg ady aga agm agt ain akh ala aly amb amc ame amh amn amp amt amx ana ang ano ao api apl apt apw arc arw asm ass asu ath atk atm ava awa awi awp awt awy aym aze azi baa bam bao baw bbw bdm bdw bej bel ben bgm bgn bho bhu bin bio biu bkb bkt bln blt blx bnj bnu boa bod boj bok bon boq bri brl brm brp brs bry bsk bsq bsr bti bua bun bur bus but bya bzi cah can car cas cay cbo cct cde chb chc chd che chg chh chi chk chn chp chs chv cln cml cmn cmr cnl coa cpn cpy cro cti ctm ctw cub cui cup dag dan daw dds der des deu dgr dha dhb dhm die dig dim diy dja dji djp dlm dmi dmk dms dni drg drm dul dum dun dyi edo eip eka emb eme ene epe ese eud eve evn fas foe for fqs ful fur gah gal gam gan gap gar gav gds geo ghb ghr gim gln gmw god gog gon goo grw gug guh guj gur guu gyc hai ham han har hay hhu hid hin hix hlp hma hmi ho hop hpd hua hui hum hzb iat iau idn idu iha ijo ika imo inn irq irx isa isi ite iwm jad jbt jin jiv jms jng joh jpn jrw jug jva jwr kaa kab kac kae kbo kbt kbu kem ket kew kgu kgy kha khd khg khl kho khr khw kie kim kio kiw kkp kkq kku klg kll klq klr klw kma kmb kmh kmk kmn kmo kmp kmr kms kmz knb knc knd kng knm knn kno knr knw knz koa kob kok kol kop kor koy kqq krc krd krh krn krr krw kry krz ksa kse kta kti kty kum kun kus kuu kuv kwb kwo kwt kwz kxo kya kyk kyn kyp kyr kyz lad laf lah lai lak lal lar lav lep lez lho lim lis lkt lmn lot lun mab mac mag mai man mar maw max mbo mde mdl mdn mei mek mem mer mey mgg mgh mgi mhi mii mij mik mil mis miz mka mke mkg mkh mki mkj mkl mku mlk mme mnc mne mni mnm mno mns mnv mny mog mom mot mpa mpt mqf mrc mrd mrh mri mrr mrs mru msc msg msl msn mto mts mtu mui mun muu myi mym myr nab nad nag naj nam nar nas nat nav nbd nbr ndj nep nev new nga ngg ngi ngj ngn ngt nis niv nkb nku nma nmb nmd nmm nnd nnk noc nog nph nsn ntj ntu nus nwd nya nyi nyk nze oir oks omh omi ong ord orh ori ork oro orw ory osa oss owi oya pae pan par paw pba pdp pia pir pis pit pme pmn pno pra prh prk prs psh pso ptt ptw pun qaf qaw qhu qim ral ram rao ras raw rem res ret rgc ria rik rmb rpa rum run rut rwa ryu sar sav sdw sel sem ser shb she shh shi shk sho sia sid sil sin skk sko skp skr skw sla slb slg sme smn sna sng snh snm snn snt sod som spi srb src srn sro sta stl sue suk sup sus svs syu tac taj tak tam tao tar tau taw tba tbl tbt tbu tce tdi tdr tel tgl tgr thk thn thu thy tib tig tir tis tja tkl tkm tlf tli tlo tls tma tmc tmg tml tmo tnb tnc tni tnn tny tod ton tou tpt trb trr trw tsf tsh tsz tte ttu tuc tul tun tur tuv tuy tvl tvo tvt twe tye uby udh udi udm uhi una ung urd urk urn uru usa usr ute uyg uzb vaf vai wag wah wai wak wao wap was wau way wbn wed wic wlw wly wme wmu wn wna woi wom wra wsk wtm xas xer xns yah yal yam yaq yar ybi yei yel ygr yi yid yim yko ykt ylm yqy ytu yuc yuk yus yuw zag zay zaz zim zun,712,76475,0.0093102325
