parameter_id,parameter_name,parameter_description,chapter_id,chapter_citation,value,same_value_language_ids,value_language_count,language_count_total,count_ratio
130A,Finger and Hand,,130,Cecil H. Brown. 2013. Finger and Hand. In: Dryer; Matthew S. & Haspelmath; Martin (eds.) 2013. The World Atlas of Language Structures Online. Leipzig: Max Planck Institute for Evolutionary Anthropology. (Available online at https://wals.info/chapter/130),2,abi abk abm abw acg acm acu afr agr aht akr ale alg amh amk amr amu apc api apj ara aro arw arx atq ats awa awp aym aze bab bae bam bca bem bgr bkd bkl bla blj blr blx bno bnq bnv bok bor bpb brc bre brs bsq btk bur but cab cac cai cak cam cap car cas cat cav cax cay cch cck cct ceb cec cha che chi chj chl cho chp chr chu chw cin cla clc cle cma cmh cmn cmy cnl cnt cof cog col cor cpa cre crg crk crl crn cro crp crq crt csf csh csk ctc ctl ctt ctw cub cui cur cut cuu cyn cze dak dam dca des dgx dig djp dre dsh dut efi eka emb ena eng ese eve eya fij fin for fox fre fut gad gae geo ger ghb gid git gjj gku gmb gna gno goa gre grk grm gto gua gul guu gyb hai hau heb hid hil hmb hmd hmi hmu hop hpd htc hui hum hun hve ifu igb ik ika ill ilo ind iql iri ita itw itz ixc ixi jak jeh jmo jpn juh kas kat kaz kdg kdz kea kek kew kfe kgt kgz kha khg khk kic kio kis kje kky klm klw klz kmh kmk knc knd kng knr koa kon kor kos kpn krc kro ktb kth ktu kul kun kuq kut kwa kwe kws kyn lao lau len lez lit lnw lui lus mab mai mal mao map maz mby mcg mch mcn mco mcs mcv men mer mgg mhc mhi mic mid mij mis miz mjc mkb mnc mnd mne moc mog moj mok mop mos mov mpy mrt mse msh mss mtg mti mtp mtt mui mum mup mut muy mwb mwl mxg mxu myi mym myo myr mzc nas nbd nbr nep ngn nht nhu nhx niu nju nko nkr nlu nne nnm nog nom nor npa nro nsk nsn nsz ntj nuk nun nuu nya nym oca oji oka oko olu ood ore osa osm owc pae pal pan pcm pem per pia pip pir pla pme pnn pno poh pol por pow ppc prt psj psm psv pui pul pur qan qaw qca qch qec rad ram rap res ret rgn rng rnn rom rus sal sam say sba scr sea sec sed sel shk shl shn sho shu shw sin sla slv smj smt snh sno sol son spa spo squ sri sss stl sum sus sva svk swa tac tag tar tbe tce teh tga tha tib tic tkm tlf tlp tml tna tnb tnj tnl toa tob toj tol tos tpa tpi tpt trb trc tsf tsg tsh tsi tsj tsw tty tub tuc tup tur tus tut tuy tvo twn txj tze tzo tzt udh uhi ukr ute uzb ved wap way wch wel wem wic wir wiy wmu wol wra wrd wth wwr xar xer xoo yah yak yap yar yav ycn yct yki ypk yrt yus yyo zai zaj zam zap zfl zqc zqr zqs zul zun zzo,521,76475,0.006812684
83A,Order of Object and Verb,,83,Matthew S. Dryer. 2013. Order of Object and Verb. In: Dryer; Matthew S. & Haspelmath; Martin (eds.) 2013. The World Atlas of Language Structures Online. Leipzig: Max Planck Institute for Evolutionary Anthropology. (Available online at https://wals.info/chapter/83),2,aab abi abu acg acl acm adi adz aeg agb agc agd agh aja akn alb alk aln als ama ami aml amo amq amr ams anc ane anj ann anu aoj ara arg ari arj aro arp arq asy ata au avk ayi ayr ayw bab bae baf bag bai baj bak baq bar bas bbl bbu bch bco bdu ber bfg bgo bgr bgs bgz bid big bii bik bil bir bka bkl bkr bku bla ble blg blu blz bma bmb bni bnk bnn bob bol bra bre brf brn brq brr bse bsh btk bto bub bud bug bul bum buu buy bvi bwc cak cax cba ccm cea ceb cem cga cha chj chq chr chw chx cic ckl cle cme cmx cmy cnt coc coe cop cor cos cpl cqt cre crn cso ctl cua cuc cya cyv cze day deg dga dgb did dio dma dok dom don doy dre dsh dua duk ebi ega egn eko eng eno erk err esm est ewe ewo fij fin fon fre fua fut fye ga gae gbb gbs gel gir giz gjj gla gmz gnb gnd goa goe gok grb grf grk grr gto gua gud gul guw gwo hak hal hat hau haw hdi heb heh hei hem hil hlu hmo hna hnd hoa hol htc huc hun hve hya iaa iba ice ifm ifu igb ige ign igs ik ila ilo ind iqu iri irr ita ito iwa ixi izi jab jak jar jmo juh juk kad kam kan kar kas kau kba kbl kbw kby kch kdw kdz kel ken ker kfe kga kgr khm khn khs kik kil kin kir kje kkt kkv kla kls klv kmj kmu kni knk koe kom kon kos kpm kpw krb kre kri kro ksg ksm ksn ktc kte ktl kuo kut kwa kwk kwn kwy kyl kyq kzy laa lab lac lag lan lao lat lbu ldo leb leg lel len let lew lgi lgu lic lil lin lit llm lmg lmh lmp lmu lnd lon lou luc luo luv ma maa mae maj mak mal mam mao map mas mau may mba mbe mbi mbl mbm mbr mbt mby mcd mch mcv mda mdg mdm mdo mds mdw mea mee meh mga mgk mgo mgu mhu mie miy mkd mkq mkz mla mlg mlm mlu mmb mmn mmv mna mnd mng moe mof mok mon moo mor mos mov mpo mpr mpu mrg mrl mro mrq mrt msk msm msq mtb mua mum mup mur mus mut mwb mwe mwo mxc mxe mxj mxo mxp mxy myg myn mzc nak nal nan nau nbe nbm nca ncm ndb ndi ndo ndr ndt ndu ndy neh ngd ngm ngo ngu ngw ngz nhh nhm nhn nht nia nif niu nke nkn nko nnc nne nng non noo nor nse nsg nto nua nun nup nuu nym nyn nza obg obo ocu oji olo ond one ood ora otm otr paa pai pal pam pat per pga pip pkn pkt plg plh plk pms png pnn pnu pod pog poh pol por pre psm psw pul pur qui qum rag rap rga rim rny rom ron rot rov rru rsu ruk rus rwe sah sak sal sam san sap scr sea seb sed see ses sgb sgl sgu sha shl shm shn shp shs sht shu sim sio sir sis siu skm sku sle slo sml smp sno so sob son spa squ srd sre ssa sti stn sud sul sun swa swe swt tab taf tag tah tai tal tan tas tat tbo tbw tee ten teo tep ter tes tet tgh tgk tgn tha tho tia tid tim tin tiv tiw tke tki tla tlp tmm tmn tmr tna tne tng tnk tno tob toz tpn tpr tps tri trm tsg tsi tsk tsr ttd ttn tuk tum txj tzo tzu ukr uld uli ura url urt ven vie vnm wal wam war wch wec wel wem wlf wlo wma wol wrb wrk wrm wrn wry wth wwa wya xam xar xbi xho xoo yag yao yap yay ycn yin yng yok yor yul ywl zai zan zap zch zhn zpr zqc zqo zqs zul zya zzo,705,76475,0.009218699
89A,Order of Numeral and Noun,,89,Matthew S. Dryer. 2013. Order of Numeral and Noun. In: Dryer; Matthew S. & Haspelmath; Martin (eds.) 2013. The World Atlas of Language Structures Online. Leipzig: Max Planck Institute for Evolutionary Anthropology. (Available online at https://wals.info/chapter/89),1,ace aga agc agd ain ala alb als amh ami amk amr ams ani apu ara arc arg arm aro arp arq arw ata ath ava awa awp aym aze bae baq bch bel bfg bho bii bil bkr bkt bla bln bma bre brf brs bsk bsq btk bul bur but bwc bya cak cam car cav cay ccm cde cha chc chd che chh chj chk chn chp chq chr chv ckl cld cle cln cmh cml cmn cmy cnt coc coo cop cor cpl cpn cpy crn crp cso ctl cub cuc cup cya cyv cze dam daw der dgr dhi dhm dom don dre drg drm dsh dut eme eng est eve fij fin fre gae gam gds gel geo ger gjj gku gla gnb goa god gok gon goo grf grk gua guj hak hal haw heb hil hin hix hlu hmi hmo hoa hop hpd htc hua hun hup hwr hzb iaa iba ice ifu ijo ind ing iqu iri ita ite iwa jak jaq jiv joh jpn kan kas kay kbt kdz ket kgu kgz kha khg khl kho khr khs kio kiw kkp kkt kku klm klr klv kma kmh knb knd knn kno kol kop kor koy kpm krb krc krd kre kri krk krn krz ktu kty kum kuo kut kuv kwa kwo kxo kya kyz kzy lac lat ldu lec lez lgu lic lim lit lmn lmp lui mac mag mai mam map mau mco mcv mds men mer mgg mhi mie min mis mmn mna mnd mng mns moh mpr mrc mrq mrt msq mss mto mun mus mxc mxj mxo mxp mxx mxy mym naj nas nav nca ndy neh nep nev nez ngw nhh nhm nhn nht niu nne nor nsg nti ntu nun nyu obg ocu oji ood ord ork oss otm pae pal pam pan pba pip pir pkn plk pmn pnn pno pnu pny pol ppc pra prs psh pso ptt pul pur pwn qaf qhu qim qui qum rap rem res ret rom rov rpa rsu ruk rus rut rwe saa sal sar scr sec sed see shb shi shk shp sid sin sir sis siu skp slo sml smp sna som son spa squ src srd sre sta stl sun svs swe taf tag taj tar tat tbo tee tel teo tep tgh tgk tgr thn tho thu tic tim tin tiw tkm tla tli tlp tls tml tni tnk tob tpn tpt tri tru trw tsf tsh tsi tsk tsz ttu tuc tul tur tuy tvl tvo twe tzu uby udi udm ukr uli urd urk urn usr ute uzb vaf vie wak was wch wel wic wlf wlo wly wme wol wrd wrk wrw xar yag yap yaq yay yei yin yko yng yny yok ytu yur zai zap zay zaz zch zen zhn zun zya zzo,479,76475,0.0062634847
97A,Relationship between the Order of Object and Verb and the Order of Adjective and Noun,,97,Matthew S. Dryer. 2013. Relationship between the Order of Object and Verb and the Order of Adjective and Noun. In: Dryer; Matthew S. & Haspelmath; Martin (eds.) 2013. The World Atlas of Language Structures Online. Leipzig: Max Planck Institute for Evolutionary Anthropology. (Available online at https://wals.info/chapter/97),4,aab abu acg acl adi adz aeg agb agh akn alb alk aln ama aml amo amq amr ams anc ane anj anu aoj arg arj aro arq asy au ayi ayw bab bae baf bag baj baq bar bas bbl bch bdu ber bfg bia bid bik bir bkr bku ble blu blz bma bni bnk bnn bra bre brf brn bsh bto bub bud bum buu bvi bwc cax ccm cem cga chq chr chw cic cle cme coc cop cor cpl crn cso ctl cya day dga dgb did dio dma don doy dre dua duk ega egn eno erk err ewe ewo fij fni fon fre fua fut fye ga gae gel gjj gla gnd goa goe grb grf grr gto gua gul guw hal hat haw hdi heb heh hem hmo hna hnd hoa hol huc hya iba ifm igb ige igs ik ila ind iqu iri irr ita jab jar jmo juh juk kam kar kau kba kbl kbw kby kch kdz kel ker kfe kga kgr khm khs kik kin kir kje kkt kkv klv kmj kmu koe kom kon kos kpw krb kri kro ksg ksn ktc kte ktl kuo kwa kwn kwy kyl laa lab lag lan lao lbu ldo leb lel len let lew lgi lgu lic lin llm lmg lmh lmp lon lou luc luo luv maa mae mal mao mas may mba mbe mbi mbl mbm mbr mbt mby mda mdg mds mdw mea mee meh mga mgk mgo mgu mie miy mkd mkz mla mlg mlm mlu mmb mmv mna mng mof mok mon moo mor mpo mpr mpu mrg mrl mro mrq mrt msk msm mtb mua mum mup mur mwe mwo mxc mxe mxj mxo mxp mxy myn mzc nak nal nan nau ncm ndb ndi ndo ndr ndt ndu neh ngd ngm ngo ngu ngz nhh nhm nht nia nif niu nkn nko nnc non noo nse nto nua nun nup nym olo otr pai pam pat per pga pkt plg plh plk pms png pnu poh por pre psw pul pur rag rap rga rny rom rot rov rru rsu sah sak sam sap sea seb sed ses sgb sgu shl shm shn sht sim sio sis sku sle sml so sob spa srd sre sti sud sul sun swa tab taf tah tat tbo tbw ten teo ter tes tgk tgn tha tia tid tim tlp tmm tmn tmr tna tne tng tnk tno toz tpr tps tri tsg tsk ttd ttn tuk tum uld uli ura url urt ven vie vnm wal wch wel wlf wlo wma wol wrk wrm wth xam xbi xho xoo yag yao yap yay yor yul zai zap zul zya zzo,456,76475,0.0059627327
86A,Order of Genitive and Noun,,86,Matthew S. Dryer. 2013. Order of Genitive and Noun. In: Dryer; Matthew S. & Haspelmath; Martin (eds.) 2013. The World Atlas of Language Structures Online. Leipzig: Max Planck Institute for Evolutionary Anthropology. (Available online at https://wals.info/chapter/86),1,aar aba abk abu abv acg acn aco acu adg adi adk adn adz aga agm ain akh akn ala all aln als amb amc ame amh amm amn amq amt amx ana ang ani ano anu ao api apl apt apu ara arc ari arm arw asm ass ath atk ava awa awi awp awt ayi aym ayr aze baa bae bai bam baw bbw bdm bej bel bho bhu bii bik bil bin bio bkt bla bln blx bmb bnb bod bok bon bri brm brs bry bsk bsq bur bus but buu bya cah can car cas cav cax cay cbo cct cde chc che chg chh chi chk chn chs chv cln cmh cml cmn cmr cnl cnm cnt coa coc cpn cpy cro cti ctm ctw cub cup dag dan daw dds der des dga dgb dgr dha dhb dhi dhm die dig diy djn dlm dmi dni dom doy drg drm dsh dul dum dun dyi edo ega eip emb eme epe ese est eud eve ewe fas fin for fqs ful fur ga gam gan gap gar gav gds geo gjj gln gmw gnn god gon grb grj grr grw gua gur gwa gyc hai har hat hay hhu hid hin hix hma hmo ho hop hpd hua huc hui hum hun hup hzb iau idn ijo ika imo ina ing iqu irr irx iwa jab jaq jel jiv jms jng jpn juh jva kaa kab kae kas kay kbt kbw kby kch kem ket kew kfe kgu kgy kha khd khg khi khl kho khw kim kio kir kiw kje kkp kkq kku kkv kla klg kll klm klq klr klv kma kmb kmh kmk kmo kmp kms kmz knb knd kng kni knm knn kno knw knz koa kob kok kol kop kor koy kpe kpw kqq krc krk krn krw kry krz ksa kse ksg kta kti kty kum kuv kwo kwt kwz kxo kyl kyn kyr kyz kzy lab lad lah lai lal lat lav ldu lep let lez lgt lim lis lit llm lmn lng lot lug lui lul mac mag man map mar mau maw mba mbo mcc mco mde mdm mdn mea mei mek men mer mey mgg mhi mie mii mik mis miz mka mke mkg mkl mku mlm mme mnd mne mni mno mns mnv mny moh mom moo mor mos mot mpr mpt mrd mri mrr mru mrw msc msg msn mts mtu mun mut mxx mym myr nab nad nam nar nav nbd nbr ncm nep nev new ney nez ngi ngt nis niv nkn nku nma nnk noc nph nrg nsn nti ntj ntu nua nwd nyi oji oks omh omi ong ord ork oro ory osa oss owi pae pan pat pau pba pdp pia pir pis pit plh plk pme pmn pno pnu pnx pok ppc ppi pra prh psh pso ptt pul pum pun pwn qaf qaw qhu qia qim ral ram rao raw rem res ret rgc rum run rut rwe sah sar sav sdw sec sem ser sgb she shi shk sia sid sin sio skk sko skp sla slb sle slp sme smn sna sng snm sno snt sob sod src srn sro sta stl sud sue sug suk sup sus svs swe tab tac tak tam tar tau taw tba tbt tdi tel tgl tgn thk thn tho thu tib tid tir tis tiw tja tkl tkm tlf tli tlo tls tma tml tmo tnb tnc ton tou tpn tpt trb trr trt tru trw tsf tsh tsm tsz ttd tte ttn tts ttu tul tun tur tuv tvo twe tye uby udh udm uhi uli una urd urk urn usa usr ute uzb vai wah wai wak wao wap was wat way wbn wch wed wem wik win wiy wly wma wme wmu wna wog woi wom wra wrm wrw wsk wwa xam xas xav xer xoo yag yal yaq yar ybi ycn yei yel ygr yid yim yin yiw yko ykt yqy yrm ytu yuc yuk yur yus yyg zar zay zch zpr zqc zqs zun,685,76475,0.008957176
129A,Hand and Arm,,129,Cecil H. Brown. 2013. Hand and Arm. In: Dryer; Matthew S. & Haspelmath; Martin (eds.) 2013. The World Atlas of Language Structures Online. Leipzig: Max Planck Institute for Evolutionary Anthropology. (Available online at https://wals.info/chapter/129),2,abi abk abm abw acg acm acu afr agr agt aht akr ale alg aly amc amk amp amu apc api ara ati atk atq ats awp bab bae bca bem beo bkd bkl blx bnb bnj bno bnv bok bor bpb bre brs bsq bur but bwa byu cac cai cam cap cas cat cav cax cct ceb cec che chi chp chu chy cla clc cle cma cmh cmn cnl cnt cog cpa cpw cqt cre crg crj crk crn cro crp crq crt csh ctc ctl cub cui cur cut dak dda des dgx dig diy dja dji djp dre dsh dut emb eng ese eve eya fij fin fox fre gae ger ghb gid gjj gmb gna gno gny goa goo gre grk gto gua gum guu gyb hai heb hid hil hmb hmd hmi hmu hpd htc hum hun hup hve ik ill ind inu iql iri ita ixc jiv juh jva kaq kas kdg kek kew kgt kgz kic kkw klm kls klz knc knd kng koa kor krc krk ksa kth ktu kun kut kws kxo kyn lao luo lus mal map mbb mca mcg mch mcn mco mcs mcv mdm mhc mic mis miz mjc mkb mku mnd mne mny moc mog moh mov mpa mpy mrl mrt mss mtg mti mtt mui mut muu mwl mwn mwp myi myo myr mzc nat nav nbr ndj nep nez ngi ngj ngn ngw nhu nhx nju nko nlu nne nnt nor nro nsk nsn ntj nug nuk nun nuu nya oca oji ojm oma ond onn osa owc pan pcm pem pia pin pip pir pit pkn pla pme pnn pno pny pol por pow ppc ppi psj psm psv pui qan qaw qca qec rap res ret rom sal sba sea sec sel shk shl sho shs shw sla slv snc spa spo sri sss sum sva tac tag tar teh tha tho tic tiw tlf tnb tnl tob tol tos toy tpa tpt trb trc tsg tsh tsi tsj tsw tty tub tun tup tur tus tut tuy twn txj uhi urk ute wam wap wat way wch wel wem wic win wir wiy wmu wnb wra wrd wrg wrl wth wwr xar xer xok yah yan ycn yir yki ypk yrt yuk yus yyg yyo zap zqs zul,389,76475,0.0050866297
57A,Position of Pronominal Possessive Affixes,,57,Matthew S. Dryer. 2013. Position of Pronominal Possessive Affixes. In: Dryer; Matthew S. & Haspelmath; Martin (eds.) 2013. The World Atlas of Language Structures Online. Leipzig: Max Planck Institute for Evolutionary Anthropology. (Available online at https://wals.info/chapter/57),1,abk abv acg aco adg ady aga ain akn amc amx ao api apl apu ara ath atm awa awi ayr bae baq bel bil bla blx boa bod brr bry bti bua bun bur cah car cax cba cct cde che chg chj chp chx ckl cln cml cmx cnl cnm coa cor cqt cre cro cti cup die dmi dni eme ess eud ful gan gav gds gjj gnn goa grf gto gua gyc ham hat hix hlp hui hup hve ign ijo ika ina iqu irr ito iwa ixi jak jbt jrw jva kaa kbw kdw ket khg kio klg klw kma kmb kmh kmj kmr knw koa kob kok krh kri krk krw ksa ktm kyp kyz lav ldu lec lkt lng lui mac mam mar mau max may mba mco mcv mdn mea mei mek men mik mki mmv mne mno moh mot mpr mpu mrd mrs mtt mug mui mut muu nag nas nav nbd ncm nev nez nhh nhm nhn nht niv nkk nmb nsn nyu ocu ond ood pba pga pia pip pir plk pme pwn qum ram res rgc rik run sem ser sgb shp sla smn src srn sul tar tau tee tep tgn tic tid tir tja tli tlo tnc tob ton tot tpn tps tpt trr tte tun tus twn txj tzo tzu uby una urk wap was way wbn wch wic wiy wma wor wra wrk wrn wrw wsk wya xav xer yag yel yqy yuc yur zpr zqc zqo zqs,255,76475,0.003334423
82A,Order of Subject and Verb,,82,Matthew S. Dryer. 2013. Order of Subject and Verb. In: Dryer; Matthew S. & Haspelmath; Martin (eds.) 2013. The World Atlas of Language Structures Online. Leipzig: Max Planck Institute for Evolutionary Anthropology. (Available online at https://wals.info/chapter/82),1,aab aar aba abi abk abn abo abu abv acg acl acm acn aco adg adi adn ady adz aeg aga agb agh agm agt ain aja ajg akh akn ala alb ale alk all aln aly ama amb ame amh aml amn amp amq amt amx ana anc ane ang ani ano anu ao aoj api apt apu apw arc arg ari arj arm aro arp arq arw asm ass ath atk atm au ava avk avo awa awi awp awt awy ayi aym ayr ayw aze azi baa bab baf bag bai bak bam bao bar bas baw bbl bbw bdm bdu bdw bej bel ben ber bgm bgo bgr bgs bgz bho bhu bid bii bik bin bio bir biu bka bkb bkt bku ble blt blx blz bmb bnb bni bnj bnk bnn bnu boa bob bod bok bol bon boq bra brf bri brl brm brn brp brq bry bsh bsk bsq bsr bti bua bub bud bug bum bur bus but buu buy bvi bya bzi cah cai cam can car cas cay cct cde cga chb chc chd chg chh chi chk chn chp chr chs chv chw cic cln cme cmh cml cmn cmr cnl cnt coa coc cop cpn cpy crn cro cti ctm ctw cua cuc cui cup cze dag dam dan daw day ddj dds deg der des deu dga dgb dgo dgr dha dhb dhm die dig dim din dio diy dja dji djp djr dlm dma dmi dmk dms dni dok doy drg drm dsh dua duk dul dum dun dut dyi ebi edo ega egn eip eka eko emb eme emm ene eng eno epe erk err ese est eud eve evn ewe ewo fas fin foe fon for fqs fre fri fua fur fut fye ga gah gal gam gan gap gar gav gbb gbs gds geo ger ggu ghb ghr gim gla gln gmw gmz gnb god goe gog gok gon goo grb grg grw gua gug guh guj gul gur guu guw gwa gwo gyc hai hak hal ham han har hat hau hay heb heh hem hhu hid hin hlp hma hmi hmo hna hnd hol hop hpd hua huc hui hum hun hya hzb iat iau iba ice idn idu ifm igb ige igs iha ijo ika ila imo ina ind ing inn iqu irq irr irx isa isi ite ito iwa iwm izi jab jad jar jbt jin jiv jmo jms jng joh jpn jrw juh juk jva jwr kaa kab kac kad kae kan kar kas kau kay kba kbo kbu kbw kby kch kdw kel kem ken ker ket kew kfe kga kgu kgy kha khd khg khl khm khn kho khr khs khw kie kik kil kim kin kio kir kis kiw kkp kkq kku kkv kla klg kll klq klw kma kmb kmh kmk kmn kmo kmp kmr kms kmu kmw kmz knb knc knd kng kni knk knm knn kno knr knw knz koa kob koe kok kol kom kon kor kos koy kpw kqq krc krd kre krh krk krr krw kry krz ksa kse ksg ksm ksn kta ktc kte kti ktl kty kum kun kus kuu kuv kwa kwn kwo kwt kwy kwz kxo kya kyk kyl kyn kyp kyr kyz kzy laa lab lad lag lah lai lak lal lan lao lar lav lbu lda ldo ldu leb lec leg lel len lep les let lew lez lgi lgt lho lic lim lin lis lit lkt llm lmh lmn lmp lmu lnd lon lot lou luc lug lui luo luv ma mab mad mae mag mai man mar mas mau maw max may mba mbe mbi mbm mbo mbr mbt mby mcd mda mde mdg mdl mdn mdo mds mdw mea mee mei mek mem mer mey mga mgg mgh mgi mgk mgo mgq mgu mhi mhu mie mii mij mik mil mis miz mka mkd mke mkg mkh mki mkj mkl mkq mku mkz mla mlg mlk mlm mlu mmb mmv mnc mnd mne mng mni mnm mno mns mnv mny moe mof mog mom mon moo mor mos mot mou mpa mpt mpu mqf mrc mrd mrg mrh mri mro mrr mrs mrt mru mrw msc msg msl msm msn mss mtb mto mts mtu mua mui mum mun mup mur mus muu mwe mwo mxe myg myi mym myn myr nab nad nag nah naj nak nal nam nar nas nat nav nbd nbe nbm nbr ncm ndb ndi ndj ndo ndt ndu ndy neh nep nev new ney nga ngd ngi ngj ngk ngm ngn ngo ngt ngu ngw ngz nhn nis niv nkb nke nkn nko nku nma nmb nmd nmm nnd nng nnk noc nog non noo nor nph nse nsn nti ntj nto ntu nua nue nun nup nus nwd nya nyi nyk nza nze obg obo ocu oir oks olo omh omi one ong ora ord orh ori ork oro orw ory osa oss otr owi oya paa pae pal pam pan par pat paw pba pdp per pia pir pis pit pkn plg plh plk pme pmn pms png pno pnu pny pog poh pok por pra pre prh prk prs psh pso psw ptt ptw pul pum pun pur qaf qaw qhu qim rag ral ram rao ras raw rem res ret rga rgc ria rik rim rmb rnd rny rom ron rot rpa rru rsu rum run rus rut rwa ryu sah sak san sap sar sav scr sdw sea sed sem ser ses sgb sgl sgu sha shb she shh shi shk shl shm shn sho sht sia sid sil sin sio sir sis skk skm sko skp skr sku skw sla slb sle slo sme smn sna sng snh snm snn sno snt sob sod som son spi srb src srd sre srn sro ssa sta sti stl stn sud sue suk sul sun sup sus svs swa swe syu tab tac taf taj tak tal tam tan tao tar tau taw tba tbl tbt tbu tbw tce tdi tdr tel teo ter tet tgk tgl tgn tgr tha thk thn thu thy tia tib tid tig tik tis tiv tiw tja tki tkl tkm tlf tli tlo tma tmc tmg tml tmm tmn tmo tmr tnb tnc tne tni tnk tnn tny tod ton tou toz tpr tpt trb trm trr tru trw tsf tsh tsz ttd tte ttn ttu tuc tul tum tun tur tuv tuy tvo tvt twe twn txj tye uby udh udi udm uhi ukr uld uli una ung ura urd urk url urt uru usa usr uyg uzb vai ven vie vnm wag wah wak wal wan wao wap was wau way wbn wch wed wiy wlf wlw wly wma wme wmu wn wna woi wol wom wra wrk wrm wrn wry wsk wtm wwa xam xar xas xav xbi xer xho xns xoo yah yal yam yaq yar yay ybi ycn yei yel ygr yi yid yim yin yko ykt ylm yng yor yqy ytu yuc yuk yul yur yus yuw zag zan zar zay zaz zch zhn zim zpr zul zun,1192,76475,0.015586793
51A,Position of Case Affixes,,51,Matthew S. Dryer. 2013. Position of Case Affixes. In: Dryer; Matthew S. & Haspelmath; Martin (eds.) 2013. The World Atlas of Language Structures Online. Leipzig: Max Planck Institute for Evolutionary Anthropology. (Available online at https://wals.info/chapter/51),1,aar abn acm acu adk adn ady aga agt alb ale all alw aly amh amn ams ana apw arc arm arw ass ath ats ava awa awe aze azi baa bae baq bbw bej bel ben bho bii bio biu bkb blr blx bmr bnj bnr bnu bod boi brh brm brr brs bry bsk bti bun bur but bya cah cai cam cas cax cay cea chc chi chk chv cln cmh cml cmn coa coc cos cpy cre crp ctm cub cup cze dag dgr dhb dhr dhw did diy dja dji djm djn djp djr dmk dni dom drg dsh dyi emb ene esm ess est eud eve evn fin fur gah gal gam gan gds geo ger ggu gid gil gku goa god gog gon grk grr grw gug guh gum guu hin hlp hmi ho hop hua hui hum hun hup hzb ice ijo ik ing iqu ite jab jaq jeb jiv kab kac kay kbu kem ken ker ket kgu kgz kha khg khi khl kio kiw kje kkp kku klg klm klw kma kmh kmk kmo kmp kmr kms knd knn kno knw kok kol kop kor koy krc krj krn krw kry kta kty kum kuv kws kwz kya kyp kzy lad lak lat lav lec lez lho lim lit lml lmn lui mac mag mai maj map maw mba mby mcc mch mdm mdn mee men mer mgh mhi mhk mhl mii mik mir mkh mki mlk mme mnc mne mno mns mny moe mog moh moo mqf mrl mrt mrw msc msl mts mui mur mut nah nas nbr ndj nep new nez nga ngi ngj ngl ngm ngn ngt ngw nha nis niv nkb noc nog nor nsn ntj ntu nug nya nyi oir oji omi ond one ong ord orh ork orw oss otr oya pan par pba pia pir pkn pkt pme pny pol ppi prh prk psh psm pso ptt ptw puq pur pwn qim qui rem rit rmb rom rus rut rwe sav scr shb shh shi sho shp shy sia sin skp slo slp sna snh sno so sor sta stl sue suk tao tce tel ten thn thu tic tli tlo tlp tma tml tmn tpn tpt trm trr tru tsh tsz ttu tul tun tur tus tuv tvo twe twn udi udm uhi ukr uru usr ute uyg uzb wag wah wak wam wan wap was wau wed wem wic wik win wiy wly wmu wn wom wrb wrd wrg wrk wrl wrn wth xbi yag yah yam yaq yar yid yim yin yko ykt yng yok ypk ytu yuc yuk yur yuw ywl yyg zan zay zpr zqc zqo zqs zun,452,76475,0.0059104282
