parameter_id,parameter_name,parameter_description,chapter_id,chapter_citation,value,same_value_language_ids,value_language_count,language_count_total,count_ratio
94A,Order of Adverbial Subordinator and Clause,,94,Matthew S. Dryer. 2013. Order of Adverbial Subordinator and Clause. In: Dryer; Matthew S. & Haspelmath; Martin (eds.) 2013. The World Atlas of Language Structures Online. Leipzig: Max Planck Institute for Evolutionary Anthropology. (Available online at https://wals.info/chapter/94),1,abi ace acl aco adn aeg alb alk all aln alw aml amo amr ams ani apu arg arj arm arq arw asy ata au bag baj bak baq bar bbw bdu bfg bho bik bir bka bkl bkr bma bnr bnu bre brf bsh bsk btk bto bug bul bum bvi bwc ccm cem cha chk chq chr chw chx cic ckl cle cmy coo cop cpl crn cso cya cyv cze dhr did din dio djp dom dre dsh duk dut efi eng eno erk est ewe ewo fij fin fre fua fut fye ga gae geo ger ggu gmw gok grf grk grr gud guj gwa hal hau haw heb hin hmo hna hnd hoa htc hun hve iaa iba ifm ifu igb ind iri ita ite izi jak jmo juh kam kan kau kch ker kfe khl khm khs kik kil kir kis kkt kkv klm kls klv kmj knk kno koe kos krb krd kro krr kry kse ksn kty kut kwn kwy kya laa lac lao lat lbu lda lel len lgu lit llm lmb lmg lmh lmp lnd lon lou luv maa mag mai mal mam man mao mau may mbm mbr mbt mco mcv mde mds mea mee meh mek men mer mga mgu min miy mka mkg mlg mlu mmn mng mog moh mok mon mov mra mrg mro mrq msq mup mus mut mwb mxc mxj mxo mxp myg myi mzh naj nan nav nca ndo ndt ndy nez ngd ngm ngo nhh nhm nht nia niu nke nkn non noo nor nsg nua nue nyi obo ocu oji olo ond orh otm paa pai pal pan par pat pip pkt plg plh pms pnn poh pol prs psh psm pul qui rap rny rom rot rov rsu rus rwe sah sak sam san sar scr sdw shl shn sim sio siu som son spa squ srb srd sti sud sue sul sun sup sus swa swe swt tab tag tah taj tao tbo tbt tee ten teo tep ter tes tgh tgk tha thy tic tim tin tiw tla tlo tna tne tng tnn tno tob tou tri tsi tsk ttn tuk tvo txj tzo tzu udi ukr uld ung urd uzb vai vie vnm wal war wch wel wic wik wlf wlo wma wme wol xas yap yay yns yor yur zai zqo zul zzo,398,76475,0.0052043153
88A,Order of Demonstrative and Noun,,88,Matthew S. Dryer. 2013. Order of Demonstrative and Noun. In: Dryer; Matthew S. & Haspelmath; Martin (eds.) 2013. The World Atlas of Language Structures Online. Leipzig: Max Planck Institute for Evolutionary Anthropology. (Available online at https://wals.info/chapter/88),2,aab aar aba abu ace acn adg adi adz aeg agb agh agm agt ajg akh akn alk all aln aly ama ame aml amo amp amq amx anc ane ang anj ano ao aoj api aro ata au avk avo awe awi baa bab bag bai baj bak bas baw bbu bch bco bdu bdw bfi bgr bgs bid bik bin bir bka bkr ble blx blz bmb bni bol bra bre brf bri brp bry bse bsh bsi bsq bto bud bug buj bum buu bvi bwc ccm cct cem chh chj chr cic cle cme cnl coe cpl crn cro cso cya dag dan day ddj dds deg dga dgb dgo dha did die dim dio dma dng dni dok don dre dum dun edo efi ega egn eno erk err ewe ewo fas fij foe fon fua fut fye gae gbb gbs gel gim gla gln gmw gmz gnd gnn goa goe gok grb grf gug gul gwa gwo hal ham han hat heb hem hid hmo hna hnd hoa huc hya iaa iau iba ido ifm igb ige ila ind inn iri irq irr isa izi jab jak jar jmo jms juh juk kad kan kar kau kba kbw kch kel ken ker kfe kgr khd khm khn kik kir kis kkv klq klv kmb kmj kmo kmp kmu kmw kmz knc kni knk knm knr knz kob koe kom kon kos kpe kpw kqq krb kro krr kse ksg ksn kta ktc kte ktl ktu kuu kwa kwn kwy kyk kyl kyo laa lab lah lal lan lao lda ldo leb lel len les let lew lgi lgt lgu lho lic lis llm lmh lmp lnd lon lot lou lug luo luv luy mab mad mae maj mar maw may mbe mbi mbl mbm mbr mby mda mde mdg mdo mdw mea mei mey mgo mgq mgu min mka mkj mkq mku mkz mlg mlk mlm mlu mmb mmv mna mng mnm mnt mnz mof mok mon mor mou mpa mpo mpt mpu mrg mrl mro msm msn mtb mud mum mup mus mwo mxc mxe mxj mxo mxy myg myn nab nak nal nam nar nbr ncm ndb nde ndi ndo ndr ndt ndu ndy neh ney ngb ngg ngk ngm ngo ngt ngu ngz nia nif nke nkn nko nnd nne nng non noo nsg ntj nua nue nun nup nus nyi nym nza obg obo olo ora orh ori oro orw ory otr pat pit plg plh pnu poh pok prh psw pul qia rag rap ras rga rny ron rot rov rum run sah sak san sea sed see sem ser ses sgb sgu shn sht sim sio sis sko sku sle slp sml so sob son sre sro sti sud sue sul sun swa tab taf tai tak tat tbo tbt tbu tdr ten teo ter tes tet tgh tgk tgn tgo tha thy tib tid tik tim tin tiv tja tke tlo tlp tmm tmn tmo tmr tna tne tng tnk tno toz tpr trb tri tsi tsk ttd tte ttn tuk tvl uld uli ung url urt usa vai vie vif vnm wah wal war wat wch wel wlf wma wmu wn woi wol wom wsk wwa xar xbi xoo yal yao yap yay yel yi yim yiw yns yor yul yus zag zai zap zar zya zzo,562,76475,0.0073488066
136B,M in First Person Singular,,136,Johanna Nichols; David A. Peterson. 2013. M-T Pronouns. In: Dryer; Matthew S. & Haspelmath; Martin (eds.) 2013. The World Atlas of Language Structures Online. Leipzig: Max Planck Institute for Evolutionary Anthropology. (Available online at https://wals.info/chapter/136),1,abk ace aco aeg ain ala ame amh amp ane apu arp asm atk awp awt bej bel bma brk brm brs bsq bur cax cha chi cho cin cjo cku coo cre csh ctm cyv dag diy diz dji djp dni dum dyi fij fur git gku goo gua hai hat hau heb hix hmo hua hve imo ind ing jak jaq jiv jpn kay kew kho kio knd knr koa kob kor kot kri krk kro kse kut kyq lan lav lda lez lui maa mal map mar mau may mdk mei mis mlk mnd mne mrt mtp mun mxc myi nah nar nat nbr nca ngi ngl niv nmb nug ond ood orh ori pai pau pip pit pme prh pur qim qui ram rap sah sal shs sla smt snc snt squ sul tag tau tib tiw tja tkl tlf tli tmc tmr ton tpa tru tuk tun tzu uhi ung vie wap war was wch wem wic win wiy wrd wrn xok yag yaq yna yuc yuk yur ywl zqc zun,177,76475,0.002314482
97A,Relationship between the Order of Object and Verb and the Order of Adjective and Noun,,97,Matthew S. Dryer. 2013. Relationship between the Order of Object and Verb and the Order of Adjective and Noun. In: Dryer; Matthew S. & Haspelmath; Martin (eds.) 2013. The World Atlas of Language Structures Online. Leipzig: Max Planck Institute for Evolutionary Anthropology. (Available online at https://wals.info/chapter/97),4,aab abu acg acl adi adz aeg agb agh akn alb alk aln ama aml amo amq amr ams anc ane anj anu aoj arg arj aro arq asy au ayi ayo bab bae baf bag baj baq bar bas bbl bch bdu ber bfg bia bid bik bir bkr bku ble blu blz bma bni bnk bnn bra bre brf brn bsh bto bub bud bum buu bvi bwc cax ccm cem cga chq chr chw cic cle cme coc cop cor cpl crn cso ctl cya day dga dgb did dio dma don doy dre dua duk ega egn eno erk err ewe ewo fij fni fon fre fua fut fye ga gae gel gjj gla gnd goa goe grb grf grr gto gua gul guw hal hat haw hdi heb heh hem hmo hna hnd hoa hol huc hya iba ifm igb ige igs ik ila ind iqu iri irr ita jab jar jmo juh juk kam kar kau kba kbl kbw kby kch kdz kel ker kfe kga kgr khm khs kik kin kir kje kkt kkv klv kmj kmu koe kom kon kos kpw krb kri kro ksg ksn ktc kte ktl kuo kwa kwn kwy kyl laa lab lag lan lao lbu ldo leb lel len let lew lgi lgu lic lin llm lmg lmh lmp lon lou luc luo luv maa mae mal mao mas may mba mbe mbi mbl mbm mbr mbt mby mda mdg mds mdw mea mee meh mga mgk mgo mgu mie miy mkd mkz mla mlg mlm mlu mmb mmv mna mng mof mok mon moo mor mpo mpr mpu mrg mrl mro mrq mrt msk msm mtb mua mum mup mur mwe mwo mxc mxe mxj mxo mxp mxy myn mzc nak nal nan nau ncm ndb ndi ndo ndr ndt ndu neh ngd ngm ngo ngu ngz nhh nhm nht nia nif niu nkn nko nnc non noo nse nto nua nun nup nym olo otr pai pam pat per pga pkt plg plh plk pms png pnu poh por pre psw pul pur rag rap rga rny rom rot rov rru rsu sah sak sam sap sea seb sed ses sgb sgu shl shm shn sht sim sio sis sku sle sml so sob spa srd sre sti sud sul sun swa tab taf tah tat tbo tbw ten teo ter tes tgk tgn tha tia tid tim tlp tmm tmn tmr tna tne tng tnk tno toz tpr tps tri tsg tsk ttd ttn tuk tum uld uli ura url urt ven vie vnm wal wch wel wlf wlo wma wol wrk wrm wth xam xbi xho xoo yag yao yap yay yor yul zai zap zul zya zzo,456,76475,0.0059627327
81A,Order of Subject; Object and Verb,,81,Matthew S. Dryer. 2013. Order of Subject; Object and Verb. In: Dryer; Matthew S. & Haspelmath; Martin (eds.) 2013. The World Atlas of Language Structures Online. Leipzig: Max Planck Institute for Evolutionary Anthropology. (Available online at https://wals.info/chapter/81),2,aab abi abu acg acl acm adi adz aeg agb agh aja akn alb alk aln ama aml amq anc ane anu aoj apu ara arg ari arj aro arp arq au avk ayi ayr bab bae baf bag bai bak bar bas bbl bdu ber bgo bgr bgs bgz bid bii bik bir bka bku ble blz bmb bni bnk bnn bob bol bra bre brf brn brq bsh bub bud bug bul bum buu buy bvi cga chr chw cic cme cmy cnt coc cop crn ctl cua cuc cze day deg dga dgb dio dma dok don doy dsh dua duk ebi ega egn eko eng eno erk err est ewe ewo fin fon fre fua fut fye ga gbb gbs gla gmz gnb goe gok grb gua gul guw gwo hak hal hat hau heb heh hem hmo hna hnd hol htc huc hve hya iaa iba ice ifm igb ige igs ila ind iqu irr ita ito iwa izi jab jar jmo juh juk kad kan kar kas kau kba kbw kby kch kdw kel ken ker kfe kga khm khn khs kik kil kin kir kkv kla kmu kni knk koe kom kon kos kpw kre ksg ksm ksn ktc kte ktl kwa kwn kwy kyl kzy laa lab lag lan lao lat lbu ldo leb leg lel len let lew lgi lic lin lit llm lmh lmp lmu lnd lon lou luc luo luv ma mae map mas mau may mba mbe mbi mbm mbr mbt mby mcd mcv mda mdg mdo mds mdw mea mee mga mgk mgo mgu mhu mie mkd mkq mkz mla mlg mlm mlu mmb mmv mna mnd mng moe mof mok mon moo mor mos mpr mpu mrg mro mrt msm mtb mua mum mup mur mus mut mwe mwo mxe myg myn nak nal nbe nbm ncm ndb ndi ndo ndt ndu ndy neh ngb ngd ngm ngo ngu ngw ngz nhm nhn nht nke nkn nko nne nng non noo nor nse nto nua nun nup nza obg obo ocu olo one ora otr paa pal pam pat pau per pga pkn plg plh plk pms png pnu pog poh pol por pre psw pul pur rag rga rim rny rom ron rot rru rsu rus sah sak sal san sap scr sea sed ses sgb sgl sgu sha shl shm shn sht sio sir sis skm sku sle slo sno sob son spa srd sre ssa sti stn sud sul sun swa swe tab taf tal tan tbw teo tep ter tet tgk tgn tha tia tid tiv tiw tki tla tmm tmn tmr tne tnk toz tpr trm ttd ttn tum txj ukr uld uli ura url urt ven vie vnm wal wch wlf wma wol wrk wrm wrn wry wwa xam xar xbi xho xoo yao yay ycn yin yng yor yuk yul zan zch zhn zpr zqs zul,488,76475,0.0063811704
86A,Order of Genitive and Noun,,86,Matthew S. Dryer. 2013. Order of Genitive and Noun. In: Dryer; Matthew S. & Haspelmath; Martin (eds.) 2013. The World Atlas of Language Structures Online. Leipzig: Max Planck Institute for Evolutionary Anthropology. (Available online at https://wals.info/chapter/86),2,abo ace acl aeg agb agc agd agh aja alb aly ami aml amr ams anc anj any aoj arg arj aro arq asy ata awe bag baj bak baq bar bas bbu bch bco bdu bfg bfi bga bgo bgr bid bir bka bkr bku blr blz bma bni bnk bnn bob bol bra bre brf brn brp brq bsr btk bto bud bug bum buw bvi bwc cai cak cba ccm ceb cem cha chj chq chr chx cic cld cle cme cmx cmy cop cpl cqt crn cso ctl cya cyv day dgo did din dio dji dre dua duk dut egn eno erk err esm ewo fij fon fre fua fut fye gae gbb gbs gel ger gmz gnd goa goe gok grf grk gto gud gul gwo hal hau haw hdi heb hei hil hna hnd hoa htc hve iaa iba ice ifm ifu igb ign igs ila ind iri irq isa ita izi jak jar jeb jlu jmo juk kad kan kar kba kbl kbu kdz kel ken ker kga khm khs kik kis kkt kls kmj kmu knc knk knr koe kom kon kos kpm krb krd kre kri kro krr ktc ktl ktu kuo kut kwk kwm kwn kyo laa lac lag lan lao lar lbu lda ldo len lew lgi lgu lil lin lmb lmg lmp lmu lnd lon lou luo luv ma maa mae maj mal mam mao mas mbl mbm mbr mby mch mda mdg mdo mdw mee meh mga mgo mgq mgu min miy mla mlg mmn mna mng mnm mnt mnz mof mon mou mpa mrg mrl mro mrq msk msl msq mtb mtt mua mud mup mur mus mwb mwe mxa mxc mxo mxp mxy myg myn naj nak nan nca ndb nde ndi ndo ndr ndt ndu neh ngb ngd ngm ngo ngu ngz nhh nht nia niu nkb nko nnc nne nng non noo nsg nue nun nup nym nza obo orh ori orw otm otr paa pai pal par per pga pip pkt plg pms pnn pod pol por pre prs psw qui qum rag rap ras rga rny rom ron rot rov rsu ruk rus saa sak sal sam san seb sed see ses sgu sha shl shn sht shu sil sim sir sis sml so son spa squ sre sti stn sun swa swt taf tag tai taj tas tat tbo tbu tbw tee ten teo tep ter tes tet tgh tgk tgr tha thy tia tik tim tin tiv tla tlp tmm tmn tna tne tng tnk tnn tno tob toz tri tsg tsi tsk tuk tvl txj tzo tzu uld ura url urt vaf vie vif vnm war wel wlf wlo wrk wrn xbi xho yap yay yns yor yul ywr zai zap zen zul zya,468,76475,0.006119647
83A,Order of Object and Verb,,83,Matthew S. Dryer. 2013. Order of Object and Verb. In: Dryer; Matthew S. & Haspelmath; Martin (eds.) 2013. The World Atlas of Language Structures Online. Leipzig: Max Planck Institute for Evolutionary Anthropology. (Available online at https://wals.info/chapter/83),2,aab abi abu acg acl acm adi adz aeg agb agc agd agh aja akn alb alk aln als ama ami aml amo amq amr ams anc ane anj ann anu aoj ara arg ari arj aro arp arq asy ata au avk ayi ayo ayr bab bae baf bag bai baj bak baq bar bas bbl bbu bch bco bdu ber bfg bgo bgr bgs bgz bid big bii bik bil bir bka bkl bkr bku bla ble blg blu blz bma bmb bni bnk bnn bob bol bra bre brf brn brq brr bse bsh btk bto bub bud bug bul bum buu buy bvi bwc cak cax cba ccm cea ceb cem cga cha chj chq chr chw chx cic ckl cle cme cmx cmy cnt coc coe cop cor cos cpl cqt cre crn cso ctl cua cuc cya cyv cze day deg dga dgb did dio dma dok dom don doy dre dsh dua duk ebi ega egn eko eng eno erk err esm est ewe ewo fij fin fon fre fua fut fye ga gae gbb gbs gel gir giz gjj gla gmz gnb gnd goa goe gok grb grf grk grr gto gua gud gul guw gwo hak hal hat hau haw hdi heb heh hei hem hil hlu hmo hna hnd hoa hol htc huc hun hve hya iaa iba ice ifm ifu igb ige ign igs ik ila ilo ind iqu iri irr ita ito iwa ixi izi jab jak jar jmo juh juk kad kam kan kar kas kau kba kbl kbw kby kch kdw kdz kel ken ker kfe kga kgr khm khn khs kik kil kin kir kje kkt kkv kla kls klv kmj kmu kni knk koe kom kon kos kpm kpw krb kre kri kro ksg ksm ksn ktc kte ktl kuo kut kwa kwk kwn kwy kyl kyq kzy laa lab lac lag lan lao lat lbu ldo leb leg lel len let lew lgi lgu lic lil lin lit llm lmg lmh lmp lmu lnd lon lou luc luo luv ma maa mae maj mak mal mam mao map mas mau may mba mbe mbi mbl mbm mbr mbt mby mcd mch mcv mda mdg mdm mdo mds mdw mea mee meh mga mgk mgo mgu mhu mie miy mkd mkq mkz mla mlg mlm mlu mmb mmn mmv mna mnd mng moe mof mok mon moo mor mos mov mpo mpr mpu mrg mrl mro mrq mrt msk msm msq mtb mua mum mup mur mus mut mwb mwe mwo mxc mxe mxj mxo mxp mxy myg myn mzc nak nal nan nau nbe nbm nca ncm ndb ndi ndo ndr ndt ndu ndy neh ngd ngm ngo ngu ngw ngz nhh nhm nhn nht nia nif niu nke nkn nko nnc nne nng non noo nor nse nsg nto nua nun nup nuu nym nyn nza obg obo ocu oji olo ond one ood ora otm otr paa pai pal pam pat per pga pip pkn pkt plg plh plk pms png pnn pnu pod pog poh pol por pre psm psw pul pur qui qum rag rap rga rim rny rom ron rot rov rru rsu ruk rus rwe sah sak sal sam san sap scr sea seb sed see ses sgb sgl sgu sha shl shm shn shp shs sht shu sim sio sir sis siu skm sku sle slo sml smp sno so sob son spa squ srd sre ssa sti stn sud sul sun swa swe swt tab taf tag tah tai tal tan tas tat tbo tbw tee ten teo tep ter tes tet tgh tgk tgn tha tho tia tid tim tin tiv tiw tke tki tla tlp tmm tmn tmr tna tne tng tnk tno tob toz tpn tpr tps tri trm tsg tsi tsk tsr ttd ttn tuk tum txj tzo tzu ukr uld uli ura url urt ven vie vnm wal wam war wch wec wel wem wlf wlo wma wol wrb wrk wrm wrn wry wth wwa wya xam xar xbi xho xoo yag yao yap yay ycn yin yng yok yor yul ywl zai zan zap zch zhn zpr zqc zqo zqs zul zya zzo,705,76475,0.009218699
137A,N-M Pronouns,,137,Johanna Nichols; David A. Peterson. 2013. N-M Pronouns. In: Dryer; Matthew S. & Haspelmath; Martin (eds.) 2013. The World Atlas of Language Structures Online. Leipzig: Max Planck Institute for Evolutionary Anthropology. (Available online at https://wals.info/chapter/137),1,abk ace aco aeg ain ala ame amh amp ane apu arp atk awp awt bag bej bel brk brm brr brs bsq bur cha chk chv cin cjo cnl coo cre ctm cyv dag diy diz dji djp dni dyi eng fij fin fre fua fur gbb geo ger goo grk grw gua hai hat hau heb hin hix hmo hua hun hve iau imo ind ing ite jak jiv jpn juh kay ket kew kha kho kiw kmb knd koa kob kor kot kri kro kse kut lan lav lda lez lkt lug luv maa mal mar mau may mdk mei mlk mnd mot mrt mun mxc myi nah nai nar nat nbr nca ngi ngl niv nmb ntj ntu nug nuu ond orh ori oss otm pai pau pme prh prs pur qim qui rap rus sah sal san shs sla snc snm snt spa squ sul swa syu tag tau tib tiw tkl tlf tli tmc tmr ton tpa tru tuk tur tuv tzu uhi ung usa vie wao wap was wem wgl wic wiy wra wrd wrn wsk yag yim yko yna yor yuc yuk zqc zul zun,194,76475,0.0025367767
85A,Order of Adposition and Noun Phrase,,85,Matthew S. Dryer. 2013. Order of Adposition and Noun Phrase. In: Dryer; Matthew S. & Haspelmath; Martin (eds.) 2013. The World Atlas of Language Structures Online. Leipzig: Max Planck Institute for Evolutionary Anthropology. (Available online at https://wals.info/chapter/85),2,abi abu ace acl acm adz aeg agc aja alb alk aln als alw ama ami aml amq amr ams anc ane anj any arg arj aro arp arq asy ata au bab baf bag baj bak bar bas bbl bbu bco bdu bfg bfi bga bgo bid bik bir bka bkl bkr blu bma bmz bni bnk bnn bob bol bra bre brf brq bse bsh bsi btk bto bud bul bum buu bvi bwc cak cba ccm ceb cem cha chj chq chr cic ckl cld cle cmx cmy coe cop cpl cqt crn cso ctl cuc cya cyv cze did dio dng dok dom don dre dsh duk dut egn eng eno erk err esm ewo fij fre fri fua fut fye gae gbb gel ger git giz gku gla gmz gnb gnd goa goe gok grf grk grr gto gud gwo hal hat hau haw hdi heb heh hei hem hil hlu hmo hna hoa htc hve hwr hya iaa iba ice ifm ifu igb ign igs ik ila ilo ind iri irq irr ita ixi izi jak jar jlu jmo juk kam kan kar kau kbl kbw kby kdz kel ker kga kgr khm khs kik kil kin kis kkt kkv klv kmi kmj kmu knk koe kon kos kpm kpw krb krd kre kri ksg kte ktu kuo kwa kwk kwm kwn kwy kya kyo kyq laa lab lac lag lan lao lat lbu lda ldo leb lel len let lew lgi lgu lic lil lit lmb lmg lmp lnd lon lou luo luv maa mae mal mam mao mas mau may mbe mbm mcd mco mdg mdm mdo mds mea meh mga mgo mgu mig min miy mko mlg mlm mlu mmb mmi mmn mna mng mnz mof mok mon mor mov mpu mra mrg mrq msm msq mtt mua mum mup mus mwb mxa mxc mxj mxo mxp mxy myg myi mzh naj nak nal nan nca nde ndi ndo ndt ndu ndy neh ngb ngd ngm ngo ngu ngz nhh nhm nht nia nif niu nko nnc noo nor nse nsg nua nue nun nup nza obg obo ocu olo ora otm paa pai pal par pat per pip pkt plg plh plk pms png pnn pod pog poh pol por pre prs psm psw pul qum rag rap rga rny rom rot ruk rus rwe saa sah sak sal sam san scr seb sed sen ses sgb sge sgl shl shn shu sim sio sir sis slo sml so sob son spa squ srb sre sti sul sun swa swe tab tah tai taj tal tbo tbw tee teo tep ter tes tet tgh tgk tgo tgr tha tho tid tig tim tin tiv tiw tke tla tlo tlp tmr tna tne tng tnk tno tpr tpt tri trt tsg tsi tsk ttd ttn tuk tvl txj tzo tzu ukr uld uli url vie vif vnm war wch wel wlf wlo wma wol wrk wrm xar xbi xho yap yok yor yul zai zan zap zen zhn zqs zul zya,511,76475,0.0066819224
87A,Order of Adjective and Noun,,87,Matthew S. Dryer. 2013. Order of Adjective and Noun. In: Dryer; Matthew S. & Haspelmath; Martin (eds.) 2013. The World Atlas of Language Structures Online. Leipzig: Max Planck Institute for Evolutionary Anthropology. (Available online at https://wals.info/chapter/87),2,aab aar abk abn abo abu abv ace acg acl adg adi ady adz aeg agb agh agm agt ajg akh akn alb alk all aln aly ama amc ame aml amn amo amp amq amr ams amx ana anc ane ang anj ano anu any ao aoj api apl apt apu arg arj aro arq asm asy atm au awe awi awt awy ayi ayo baa bab bae baf bag baj bam baq bar bas baw bbf bbl bch bdm bdu bdw bem ber bfg bfi bgm bid bik bin bir biu bkr bku ble bln blu blx blz bma bni bnk bnn bok bon bra bre brf bri brl brm brn brp brq bry bsh bsi bsq bsr bto bub bud buj bum bun bus buu bvi bwc cai cas cav cax cbo ccm cde cem cga chb chi chq chr chw cic cld cle cme cmr cnl cnm coc cop cor cpl crn cro crp cso cti ctl ctm ctw cui cup cya dag dan daw day ddj dds dga dgb dgo dha did dig dim din dio diy dji djn dma dms don doy dre dua duk dum dun dyi edo ega egn els emb eme emm eno epe erk err ese ewe ewo fas fij foe fon fre fua ful fur fut fye ga gaa gae gan gar gav gel ggu ghr gjj gku gla gln gmw gnd gnn goa goe goo grb grf grr grw gto gua gug guh gul guu guw gwa gyc hai hal ham har hat haw hdi heb heh hem hid hix hlp hma hmo hna hnd hoa hol hpd huc hup hwr hya iba idn ifm igb ige igs ik ika ila imo ina ind inn iqu iri irq irr irx isa ita jab jad jar jbt jel jin jlu jmo jms jng jrw juh juk jva kaa kae kam kar kau kba kbl kbo kbw kby kch kdz kel ker kfe kga kgr kgu kgy khd khm khs kie kik kin kir kis kje kkt kkv kll klq klv klw kma kmb kmi kmj kmn kmo kmp kmu kmw kmz knc kng knm kno knr knz koa kob koe kok kom kon kos kpe kpw kqq krb krd krh kri krk kro krr kse ksg ksn kta ktc kte ktl ktu kuo kuu kwa kwb kwm kwn kwy kwz kya kyk kyl kyn kyo kyz laa lab lad lag lal lan lao lar lav lbu lda ldo leb lel len lep les let lew lgi lgt lgu lic lin lis lkt llm lmb lmg lmh lml lmp lon lot lou luc lug lui luo luv luy maa mab mac mad mae mal man mao mar mas maw may mba mbe mbi mbl mbm mbo mbr mbt mby mda mde mdg mdl mdn mds mdw mea mee meh mek mey mga mgk mgo mgq mgu mhk mhl mie mii mij min mis miy miz mka mkd mke mkg mkj mku mkz mla mlg mlk mlm mlu mmb mmv mmw mna mng mnm mnv moa mof mok mon moo mor mot mou mpa mpo mpr mpt mpu mra mrg mrh mrl mro mrq mrr mrt mru msc msk msl msm msn mtb mts mtu mua mud mum mup mur mwe mwo mxa mxc mxe mxj mxo mxp mxy myi myn myr mzc nab naj nak nal nam nan nar nat nau nav nax nbd nbr ncm ndb nde ndi ndj ndo ndr ndt ndu neh ney ngd ngg ngj ngk ngl ngm ngn ngo ngt ngu ngz nhh nhm nht nia nif niu nkb nkk nkn nko nku nma nnc nnd nng nnk noc non noo nph nrg nse ntj nto nua nue nun nup nus nyh nyi nyk nym nze olo omh omi orh ori ork oro orw ory osa otr pae pai pam par pat pau per pga pia pir pit pkt plg plh plk pms png pnu pnx poh pok por ppi pre prh prs psw pul pum pun pur qia rag ral ram rao rap ras raw rga rgc rny rom rot rov rru rsu rum run rwa saa sah sak sam sap sdw sea seb sed sem sen ses sgb sgu she shi shl shm shn sht sia sil sim sio sis skk sko sku sla slb sle slp sme sml smn sng snm snn snt so sob som spa spi src srd sre srn sro sti sud sue sug sul sun sup swa syu tab taf tah taj tak tao tat tau taw tba tbl tbo tbt tbu tbw tdi tdr ten teo ter tes tgk tgn tgo tha thd thy tia tib tid tik tim tkl tlf tlp tma tmm tmn tmo tmr tna tnc tne tng tnk tnn tno tny ton toz tpr tps trb tri tsg tsk tsm ttd ttn tuk tum tun tvl uhi uld uli una ung ura urk url urn urt usa ute vaf vai ven vie vif vnm wag wah wal wap wat wbn wch wed wel wic wiy wlf wlo wma wmu wn wna wog woi wol wom wra wrd wrk wrl wrm wsk wth xam xas xbi xer xho xoo yag yal yam yao yap yay yel yi yid yiw yor yrm yuc yul zag zai zap zar zaz zul zun zya zzo,879,76475,0.011493952
136A,M-T Pronouns,,136,Johanna Nichols; David A. Peterson. 2013. M-T Pronouns. In: Dryer; Matthew S. & Haspelmath; Martin (eds.) 2013. The World Atlas of Language Structures Online. Leipzig: Max Planck Institute for Evolutionary Anthropology. (Available online at https://wals.info/chapter/136),1,abk ace aco aeg ain ala ame amh amp ane apu arp asm atk awp awt bag bej bel bma brk brm brr brs bsq bur cax cha chi cho cin cjo cku cnl coo cre csh ctm cyv dag die diy diz dji djp dni dum dyi eng fij fur gbb git gku goo gua hai hat hau heb hix hmo hua hve iau imo ind ing jak jaq jiv jpn juh kat kay ket kew kho kio kiw kmb knd knr koa kob kor kot kri krk kro kse kut lan lav lda lez lug lui luv maa mal map mar mau may mco mdk mei mis mlk mnd mne mot mrt mun mxc myi nah nar nat nbr nca ngi ngl niv nmb ntj nug nuu ond ood orh ori otm pai pau pip pme prh pur qim qui ram rap sah sal san shp shs sla snc snm snt squ sul sup swa tag tau tib tiw tkl tlf tli tmc tmr ton tpa tru tuk tun tzu uhi ung vie wao wap war was wch wem wic win wiy wra wrd wrn xok yag yaq yna yor yuc yuk yur ywl zqc zul zun,200,76475,0.0026152337
