parameter_id,parameter_name,parameter_description,chapter_id,chapter_citation,value,same_value_language_ids,value_language_count,language_count_total,count_ratio
19A,Presence of Uncommon Consonants,,19,Ian Maddieson. 2013. Presence of Uncommon Consonants. In: Dryer; Matthew S. & Haspelmath; Martin (eds.) 2013. The World Atlas of Language Structures Online. Leipzig: Max Planck Institute for Evolutionary Anthropology. (Available online at https://wals.info/chapter/19),1,abi abm ach acm adk adz aht aik ain akn akw ala alw amh amp amu amz ana anc ant ao api apu arb arm arp asm awn awp aym aze bag bai baj bam baw bco bee bej ben bis bki bkr bng bno bod brd bre brh bri brr brw bsq bto bua bul bur byu cac cad cah cam car cax cay cck cha che chk chl chu chv chw cil cle cmn cnl cnt cof coo cre cso cti ctl cve cyv dad dag dar ddf der dgr die din dio diy diz djp dni dnw don dum dyi eka epe eve evn eya fas fef fin fre ful fur fuz fye gan gar gds geo ger ghb gla gmb goa goo grr grw gua hai hak ham hau haw hba hin hix hmo hmr hok hop hun hup iba ign ik ika imo ind ird irr irx ite ito iva iwm jak jaq jav jeb jeh jiv jng jom jpn jpr kad kal kas kay kch ked kef kek ker ket kew kfe kgi kgu kgz kha khm khr khs kio kiw kkn kkv klm klv kly kmp kmu knd kng knk knm knr koa kob koi kom kor kot koy krb krk kro kry kse kty kul kun kur kut kwa kwk kwo kws kya kyl kzy lad lah lam lan lat lav len lep lez lit lkt lu lua lui luo lus luv maa mab mak mal mao mau max may maz mbb mei mgg mie mku mla mlk mnc mnd mne mog mor mov mpa mrd mrg mrn mrt mss mtp mui mun mya myi mzc nai nan nap nar nas nav nax nbk ndt ndy nep new nez ngz nhn nht nim nis niv nko nkt nmb nnc nob non nor nug nun nyg nyi oca oji ond ood orh orm pac pae pai pau paw pec phl pit pms pnr poa poh pol prh prs psh psm pso puk pur qaw qui ram rap res rom ror rsc rus sab sba scs sdh seb sed sel sha shi shk shs shu sin skp sla slp sml snc snh snm snt sor sre srn sue sui sup svs tab tag tam teh tel ter tgk tha tib tic tiw tks tli tlp tmn toa tol ton tpa tru try tsg tsi tso ttn tug tuk tul tun tur tuv twn tza umb una ung urk usa uzn vie wah wam wao wap war wch wdo wic win wiy wlf wma wmu wnt woi wps wra wrd wrs wry wuc yag yan yaq yar yaw ycn yct yes ygr yid yim yko ykt yny ytu yuc yur yus zqc zun,449,76475,0.0058711995
12A,Syllable Structure,,12,Ian Maddieson. 2013. Syllable Structure. In: Dryer; Matthew S. & Haspelmath; Martin (eds.) 2013. The World Atlas of Language Structures Online. Leipzig: Max Planck Institute for Evolutionary Anthropology. (Available online at https://wals.info/chapter/12),3,abi abk aea aeg aht aiz ala alb alw amz anc arc ava awp bco bej ben bma bra brd bre brh brw bsk bsq bua bul bur cah cam chk chl chv chw cnl coo dgr dio diz djp doy eng eya fre ful geo ger grk gwa hai ham hba hin hop hun hup ik imo ind ing ird ite jeh ket kgz khm khs klm kly kmu knd kot koy kpa krd kry ktk kut kwk kzy lad lak lat lep lez lit lkt lus mab mak mar mau mku mlk mog mpa mtp myi nap nez nis niv nkt nmb non nor ntu nuu ond ood orm otm pae poh pol prs psh psm qaw rsc rus rut sab scs sel shu soq squ sre tab tas tli tmp tne tsi tso ttn ttu tug tul tuv tza uzn wlf wrd ygr ykt ytu yur zqc,151,76475,0.0019745014
9A,The Velar Nasal,,9,Gregory D.S. Anderson. 2013. The Velar Nasal. In: Dryer; Matthew S. & Haspelmath; Martin (eds.) 2013. The World Atlas of Language Structures Online. Leipzig: Max Planck Institute for Evolutionary Anthropology. (Available online at https://wals.info/chapter/9),3,abi abk abm abz aco adk ady aeg agu aho aik ain ala alb aln ame amh amr amu amz ana apu ara arb arc arm arp asm awp axv aym aze bdk bej bez bgv bla blc bma bor brh bri brr brs bsq bth car cas cav cct chc chh chi chl chm cht chv cmk cmn cmy coo cor cre crj cui cyv dag emb epe ess ets fre gag gap geo god grf grk gto gua guj guq hai hau hav heb hia hid hin hix hnk hpd hrs hun hzb ika imo ing iri ito ixi jak jbt jeb jib jpn jrn jva kab kew kfy khi kho khv kio kit klv knd koa krk krt krz ksh ksr kut kwo kws kwz lak lat lez lil lkt mak mam mar max may meh mkw mlt mma mos mov mui mxc mxt naa nam nav ndy nev nez ngz nhn nko nti oca ond orh orl osa oss otm pau pip prh prs psm pso qec qim qui rus rut san sba sel shk shw sla snm snt sod som soq spa squ sue swr tac tas tce tec teh tew til tin tli tlp tnd tps tru tsi tsz ttu tun tur twn uby udi umu usa wap war wch wic win wnb wra wrm xav yag yaq yki ykp ynm yor yrc yta yuc yur zso zun,235,76475,0.0030728995
138A,Tea,,138,Östen Dahl. 2013. Tea. In: Dryer; Matthew S. & Haspelmath; Martin (eds.) 2013. The World Atlas of Language Structures Online. Leipzig: Max Planck Institute for Evolutionary Anthropology. (Available online at https://wals.info/chapter/138),2,ace afr alt arm ast bal bdg bre bru chp cic cmh crh ctl cua dga dio dsh dua dut eng est ewe ewo fin fre gdl ger gml grt gua heb hok hre hun ice ind iri ita jav juh keu khm knr koi kos lat lin lmp lux mal mao mdr min mks mlt mnt msh mss nor nyl occ poh pro qay rbg rlo rmc ses snh sno spa sra sun swe tah tel tsw wel wlo xho xoo yor,84,76475,0.0010983981
7A,Glottalized Consonants,,7,Ian Maddieson. 2013. Glottalized Consonants. In: Dryer; Matthew S. & Haspelmath; Martin (eds.) 2013. The World Atlas of Language Structures Online. Leipzig: Max Planck Institute for Evolutionary Anthropology. (Available online at https://wals.info/chapter/7),1,abi abm ach acm adk adz aea aeg agh aik ain akn akw ala alb ald alw amc ame amo amp amu amz ana ant ao api apu arb arp asm ata awn awp aze bai baj bam baw bbf bee bej ben bir bis bki bkr bma bng bno bod brb brd bre brh bri brm brr brw bsk bsq bto bua bul bur byu cac cah cam car cax cay cck cha che chk chv cil cle cmn cnl cnt cof cre cso ctl cub cve cyv dad dag dar der dgb dgr die din dio diy djp dni don dre dts dum dyi efi eja eka eng epe eve evn ewe ewo fas fef fij fin fre ful fur fuz ga gan gar gds ger ghb gla gmb goa goo grb grk grr grw gua hak ham haw hba hin hix hmo hok hop hum hun hve iaa iba igb ign igs ijo ika imo ind ird irr irx iso iva iwm jav jiv jng jom jpn jpr kal kas kay kch ked ket kew kfe kgu kgz kha kho khr khs kiw kkn kkv kla klv kly kmp knd kng knm knr koa kob koi kot koy kpa krb krd krk kry kse kty kun kur kwa kwo kws kya kyl kzy lad lah lan lat lav len lep lit llm lu lui luo luv mab mal mao map mar mau max may mbb mei mgg mie mku mla mlk mme mnc mnd mog mor mpa mrd mrn mro mrt mss mtp mui mun mxc mxm mya myi mzc nai nan nap nar nas nax nbk ndy nep new nga ngi nhn nht nim nis niv nko nkt nnc nob non nor ntu nug nyi oca oji ond ood orm otm pae pai paw pec pit pms pnr poa poh pol prh prs psh psm puk pur ram rap res rom ror rsc rtk ruk rus sab sba scs seb sha shi shk skp slp snc snd snh snm snt som sor spa srn sue sup svs swa tab tac tag tam tas tel tgk tha tib tic tiw tks tlp tmn tmp tne toa ton tpa try tsg ttn tug tul tun tur tuv umb una ung urk usa uzn wah wam wao wdo wiy wlf wma wmu wnt woi wra wrd wrs wry wuc yag yaq yar yaw yay ycn yel yes yid yim yko ykt yny yor ytu yus zan zqc,409,76475,0.005348153
20A,Fusion of Selected Inflectional Formatives,,20,Balthasar Bickel; Johanna Nichols. 2013. Fusion of Selected Inflectional Formatives. In: Dryer; Matthew S. & Haspelmath; Martin (eds.) 2013. The World Atlas of Language Structures Online. Leipzig: Max Planck Institute for Evolutionary Anthropology. (Available online at https://wals.info/chapter/20),1,abi abk aco ala ame amp ana apu arp asm atk awp aym bag bbw bel bnj brh brm brs bsq bur cah chk cho cku cnl coo cyv dag dig dni eka eng epe eve fin fre gar geo ger grb grk grw gua hai hat hin hix hun hve hzb imo ing jak jpn kay ket kew kha kio kiw knd koa koi kor krk kro kut lav lez luv mal map mar mau may mei mot mrt mss mun mxc myi nah nav nbd ngi niv nmb ntu ond orh otm prh prs pso pur qim ram rus san shk sla snm spa squ swa tag tib tiw tli tot tur wem wic wrd wrm yag yaq yid yur zqc zul,125,76475,0.0016345211
21A,Exponence of Selected Inflectional Formatives,,21,Balthasar Bickel; Johanna Nichols. 2013. Exponence of Selected Inflectional Formatives. In: Dryer; Matthew S. & Haspelmath; Martin (eds.) 2013. The World Atlas of Language Structures Online. Leipzig: Max Planck Institute for Evolutionary Anthropology. (Available online at https://wals.info/chapter/21),1,amp ana awp aym bej bel bma bnj brh brm brs bsq bur cah dig epe gar geo goo hin hun hzb imo ing jpn kew kha kho khs knd knm koa kor lah lai lez maa mal mao mar mei mnd mrt mss mun myi nah nan nbd ngi orh prs pur qim ram rap snm spa squ tib tli tru tur wem wic wra wrd yid yor zqc,71,76475,0.000928408
118A,Predicative Adjectives,,118,Leon Stassen. 2013. Predicative Adjectives. In: Dryer; Matthew S. & Haspelmath; Martin (eds.) 2013. The World Atlas of Language Structures Online. Leipzig: Max Planck Institute for Evolutionary Anthropology. (Available online at https://wals.info/chapter/118),1,abk abm abz ace aco ady agm ain aro bag bgo bik bla blx bma bod brm brr bto ccm cct ceb cha chr cmr cnl coo cre cro din epe fij fni gar gdi gjj gll goa grb gua hcr hei hop hup iaa ik ilo ind jak jeb juh kab khm kic kio kko kls klv kpm krk kro ktl kwa kwk lah lao len lil lis lkt lnw mal mam mei men mie miz mka mnd mng moj mok mou mrl mut mwb nak nav nbb nca niu niv nuu ojs ond ood otr pai pap pau pir plh plr pna ptp rot sal sam sed sel sey siu sla snc snm squ sra sre sun tag tas tes tgk tha tiv tla tli tmr tna tng tno tpi tug tuk tus tzo tzu uby urk vie wap wlf wlo wol yaq yav yko yor yur zqc,151,76475,0.0019745014
30A,Number of Genders,,30,Greville G. Corbett. 2013. Number of Genders. In: Dryer; Matthew S. & Haspelmath; Martin (eds.) 2013. The World Atlas of Language Structures Online. Leipzig: Max Planck Institute for Evolutionary Anthropology. (Available online at https://wals.info/chapter/30),1,abn aco ain ale ame arm asm awp bag baw bkr brh brm bsq cah car cha chi chk chv cmn cnl cnt coo cyv dag djr dni don epe err eve ewe fij fin geo goo grw gua guu hai hat haw hay hmo hun iaa igb ika imo ind ite jaq kam kay kew kgz kha khk khl khm klv knr koa kob krk kse kut lad lah lan lep lez mak mal mao map mar mei mnd mns mny mok mrl mrt mss nbd ndy nez ngi nht niv ntu ork otm pai pal pil pip pit pmc prs qim ram rap san saw shk sml smt snt srn sue tab tha tho tib tol tot tsh tsi tuk tur tvl uhi una urk usa uzb vie wat wic wra yaq yel yid yko ykt ylb yor ypk yur zqc zun,145,76475,0.0018960445
6A,Uvular Consonants,,6,Ian Maddieson. 2013. Uvular Consonants. In: Dryer; Matthew S. & Haspelmath; Martin (eds.) 2013. The World Atlas of Language Structures Online. Leipzig: Max Planck Institute for Evolutionary Anthropology. (Available online at https://wals.info/chapter/6),1,abm ach aco adk adz agh aik ain aiz akn akw ala alb ald alw amc ame amh amo amp amu amz ana anc ant ao api apu arb arp asm awp aze bag bai baj bam baw bbf bee bej ben ber bet bir bis bki bkr bng bno bod bra brb brd bre brh bri brm brr brw bsq bto bua bul byu cac cad cam car cax cay cck cha che chp chq chu chv chw cil cle cmn cnl cnt cof cre cso cti ctl cub cve cyv dad dag dah dan dar der det dgb dgr din dio diy diz djp dni dnw doy dre dts dum dyi efi eja eka eng epe eve evn ewe ewo fas fef fij fin ful fur fuz fye ga gan gar gbb gds ghb gmb goa goo grb grk grr gua gwa had hak hau haw hin hix hok htc hum hun hve iaa iba igb ign igs ijo ik ika imo ind ird irr irx iso ito iva iwm jav jeb jeh jiv jng jom jpr juh kad kas kay kch ked kef ker kew kfe kgi kgu kha khm kho khr khs kio kiw kkn kkv kla klv kly kmu knd kng knk knm knr koa kob koh koi kom kor kot koy kpa kpe krb krk kro kse ksg kss ktk kty kul kun kwa kwo kws kya kyl kzy lad lam lan lat lav len lep lit lkk lkt llm lu lua lug luo luv maa mab mal mao map mau max may maz mba mbb mbm mei mie mku mla mlk mme mnc mnd mne mor mov mpa mrd mrg mrl mrn mro mrt mss mtp mui mum mun mxc mxm mya myi mzc nai nan nar nas nav nbk ndt ndy nep new nga ngi ngz nhn nht nim nis nko nkt nmb nnc nob non nor nti ntu nug nun nyg nyi oca ogb oji ond ood orh otm pac pae pau paw pec phl pit pms pnr poa poh pol prh psm puk pur qaw ram rap res rom ror rsc rtk ruk rus sab san sba scs sdh sdw seb sed sha shi shk shs sin sla slp sml snc snd snh snm snt soq sor spa sre srn sue sup svs swa tab tac tag tam tas tel ter tgk tgr tha tib tic tiw tks tlp tma tmn tmp tne toa tok tol ton tru try tsg tso ttn tuk tul tun tur tuv twn tza umb una ung urk usa vie wah wam wao wap war wdo wic wiy wlf wma wmu wnt woi wps wra wrd wrs wry wuc yag yan yap yaq yar yaw yay ycn yct yel yes yey ygr yid yim ykt yny yor yuc yul yur zan zqc zul zun,470,76475,0.006145799
23A,Locus of Marking in the Clause,,23,Johanna Nichols; Balthasar Bickel. 2013. Locus of Marking in the Clause. In: Dryer; Matthew S. & Haspelmath; Martin (eds.) 2013. The World Atlas of Language Structures Online. Leipzig: Max Planck Institute for Evolutionary Anthropology. (Available online at https://wals.info/chapter/23),3,awp aym bel brs bsq bur chk chy dji geo goo grk grw hau hin hua imo ing jiv knp knr koa kut lai map mar mot mpa mss mun myi ntu nug nyn pai pau prs qui ram rap siu spa squ tag tau ton wch wem win wrl wry wsk yaq yor ypk zqc zun,58,76475,0.00075841777
4A,Voicing in Plosives and Fricatives,,4,Ian Maddieson. 2013. Voicing in Plosives and Fricatives. In: Dryer; Matthew S. & Haspelmath; Martin (eds.) 2013. The World Atlas of Language Structures Online. Leipzig: Max Planck Institute for Evolutionary Anthropology. (Available online at https://wals.info/chapter/4),1,abi ach acm aco ain alw amc amp amz ant api apu arb asm aym bco ber bng bra brd bua byu cac cah cax che chk chl chu chw cmn cnl cnt cre dad diy djp dni don dyi eka fas fij fuz gds gmb goa goo grr hai hak ham haw hmo hok hop htc hup imo irr iwm jak jaq jav jeb jiv jom kay kek kew kgu khm kho kkv kmu kng kob kor krb krk kro kry kss kty kut kwa kya len lkk lui maa mao map mar mau max may maz mbb mku mlk mne mor mov mrt mss myi nan nas nbk nez ngi nhn nht nmb nnc nug nun nuu nyg oji ond pac pae pit pms pnr poh psm qaw rap ror rtk seb sed sel sha shi shk shs shu sin skp slp snc snm squ tam tiw tli toa tol ton tpa tuk ung urk wah wam war wch wdo wic wiy wmu wnt wra wrd wrs wry yag ycn yct yel yes yid yim yny yur zqc zun,182,76475,0.0023798626
2A,Vowel Quality Inventories,,2,Ian Maddieson. 2013. Vowel Quality Inventories. In: Dryer; Matthew S. & Haspelmath; Martin (eds.) 2013. The World Atlas of Language Structures Online. Leipzig: Max Planck Institute for Evolutionary Anthropology. (Available online at https://wals.info/chapter/2),1,abk abm adz aea alw amc amp amu ana awp aym bco bma brd byu cad cah cax cay cck chl chu cre diy djp dyi eya gds goo grr grw hai hup ign iva jaq jeb jiv kab kay kgu klm koa kut kya lak lus mal maz mbb mpa mrg mrn mrt nav new ngi nhn nug nuu oji ond pae pai pau pit prh qaw qui ram ruk sel shk shs squ tac tas teh tiw tli tpa tsg tsi wam wdo wic wps yes yid yim yny yus,93,76475,0.0012160836
24A,Locus of Marking in Possessive Noun Phrases,,24,Johanna Nichols; Balthasar Bickel. 2013. Locus of Marking in Possessive Noun Phrases. In: Dryer; Matthew S. & Haspelmath; Martin (eds.) 2013. The World Atlas of Language Structures Online. Leipzig: Max Planck Institute for Evolutionary Anthropology. (Available online at https://wals.info/chapter/24),1,abk ace aco ain ane apu brr brs buu cha cho cin cjo cku coo cre cyv dag dum fij gku gua hai hat hix hun hve iau jak ket kio kiu koa krk kut lan lav lkt map mar mis mrh nat niv nmb nsg nuu ond otm pau pip prs qui sah sla squ sup tgp tkl tlf tli tun usa war was wch wic wrn wsk xok yag yes yli yor yuc yur zun,78,76475,0.0010199412
13A,Tone,,13,Ian Maddieson. 2013. Tone. In: Dryer; Matthew S. & Haspelmath; Martin (eds.) 2013. The World Atlas of Language Structures Online. Leipzig: Max Planck Institute for Evolutionary Anthropology. (Available online at https://wals.info/chapter/13),1,abk aea aeg aht akw ala alb alw ame amh amp amu ana api apu arb arc arm arp asm ata ava awp aym aze baj bco ben bis bki bkr bma bng brd bre brh brr brw bsk bsq bto bua bul bur byu cah cam car cax cck cha chk chl chu chv cmn cnl coo cre ctl cyv dar ddf der dgr die dio diy djp dni dre dyi eng epe eve evn eya fij fin fre gan gar geo ger goo grk grr grw gua hai haw hba hin hix htc hum hun hup hzb iaa iba ika imo ind ing ird irr irx iva jak jaq jav jeb jeh jpr kab kas kay kch ked ket kfe kgu kgz kha khm khr khs kkn kkv klm klv kly kmp knd kng kob kor kot koy krb krd kry kty kun kut kwa kwk kws kya kzy lad lak lav len lez lkt lui lus mak mal mao map mar mau max may mbb mgg mku mlk mne mog mov mpa mrd mrn mrt mss mtp mun myi nai nap nep new nez nga ngi nhn nht nnc ntu nug nuu oji ood orm pac pae pai pau pit pms pnr poh pol prs psh puk pur qaw qco ram rap rom ror rsc rtk ruk rus sba scs sdh sed sel shi shk shu sml snc snh snm soq sor spa squ srn svs swa tab tac tag tas teh tel tgk tgr tiw toa tol ton tpa tru try tsg tsi tso ttn ttu tug tuk tul tur tuv tza ung urk usa uzn wam wao wap war wch wdo wic win wiy wlf wma wmu wnt woi wps wra wrd wry yan yap yar yaw ycn yel yes yid yim yko ykt yny ytu yuc yur yus zqc zun,307,76475,0.004014384
119A,Nominal and Locational Predication,,119,Leon Stassen. 2013. Nominal and Locational Predication. In: Dryer; Matthew S. & Haspelmath; Martin (eds.) 2013. The World Atlas of Language Structures Online. Leipzig: Max Planck Institute for Evolutionary Anthropology. (Available online at https://wals.info/chapter/119),2,aeg ahu alb amh amp amr apl arc arm asm ava awp bab bej ben blc bln bre brs bul bur but car cbo chc cil cze dag diy dua dut eka eng est eve evn fin fre geo god grk heb hin hix hun hup hzb ice juh kha kku knd kob kty kzy lat laz lda lit mac mbt mis mlt mme mns moe moj mrd myi nai nez ngi ngk ngl nht nko ntu orh pol prs pwn qcu qim ram ret rka rom rus scr shk shn skp smt snm sro swa swe tel tgr tli tml tur tvo ung usa uzb vot wau wic yag yav ygr yid ykt zaz zul,117,76475,0.0015299118
18A,Absence of Common Consonants,,18,Ian Maddieson. 2013. Absence of Common Consonants. In: Dryer; Matthew S. & Haspelmath; Martin (eds.) 2013. The World Atlas of Language Structures Online. Leipzig: Max Planck Institute for Evolutionary Anthropology. (Available online at https://wals.info/chapter/18),1,abi abk abm ach acm aco adz aea aeg agh aht aik ain aiz akn akw ala alb ald amc ame amh amo amu amz ana anc ani ao api apu arb arc arm arp asm ata ava awn awp aym aze bag bai baj bam baw bbf bco bee bej ben ber bet bir bis bki bkr bma bng bod bra brb bre brh bri brm brw bsk bsq bto bul bur cad cah cam car cax cay cck cha che chk chl chq chu chv chw cil cle cmn cnl cnt cof coo cre cso cti ctl cve cyv dad dag dah dan dar ddf det dgb dgr die dio diz dni dnw don doy dre dts dum efi eja eng eve evn ewe ewo fas fef fij fin fre ful fur fuz fye ga gar gbb geo ger ghb gla gmb goa grb grk grw gua gwa had hai hak ham hau hba hin hix hmo hmr hok hop htc hum hun hup hve hzb iaa iba igb ign igs ijo ik ika imo ind ing ird irq irr irx iso ite ito iva iwm jak jaq jav jeb jeh jiv jng jom jpn jpr juh kab kad kal kas kch ked kef kek ker ket kew kfe kgi kgz kha khm kho khr khs kio kiw kkn kkv klm klv kly kmp kmu knd knk knm knr koa kob koh koi kom kor kot koy kpe krd krk kro kry kse ksg kss ktk kty kul kun kur kut kwa kwk kwo kws kyl kzy lad lah lak lam lat lav len lep lez lit lkk lkt llm lu lua lug lui luo lus luv maa mab mak mal mao map mar mau may maz mba mbm mei mgg mie mla mme mnc mnd mne mog mor mov mrd mrg mrl mro mss mtp mui mum mun mxc mxm mya mzc nai nan nap nar nas nav nax nbk ndt ndy nep new nez nga ngi ngz nhn nht nim nis niv nko nkt nmb nnc nob non nor nti ntu nun nuu nyg nyi oca ogb oji ood orh orm otm pac pae pai pau paw pec phl pms poa poh pol prs psh psm pso puk pur qaw qco ram rap res rom ror rsc ruk rus rut sab san sba scs sdh sdw seb sed sel sha shi shk shs shu sin skp sla slp sml snc snd snh snm snt som soq sor spa squ sre srn sue sui sup svs swa tab tac tag tam tas teh tel ter tgk tgr tha tib tic tiw tks tlp tma tmn tmp tne toa tok tol ton tpa tru try tsg tsi tso ttn ttu tug tuk tul tun tur tuv twn tza umb una urk usa uzn vie wap wch win wiy wlf wma wnt woi wps wra wrs wuc xoo yan yap yaq yar yaw yay ycn yct yes yey ygr yko ykt yor ytu yuc yul yur yus zan zqc zul zun,503,76475,0.006577313
8A,Lateral Consonants,,8,Ian Maddieson. 2013. Lateral Consonants. In: Dryer; Matthew S. & Haspelmath; Martin (eds.) 2013. The World Atlas of Language Structures Online. Leipzig: Max Planck Institute for Evolutionary Anthropology. (Available online at https://wals.info/chapter/8),4,abm arc ava awp cck chp coo dah eya grw had hai hup hzb irq ite kal knk koa kwk lam lus mak mov mrg nav nez ngz qui sdw shu sla squ teh ter tpa tru tsi ttu twn win wiy yuc yur zul zun,47,76475,0.00061457994
3A,Consonant-Vowel Ratio,,3,Ian Maddieson. 2013. Consonant-Vowel Ratio. In: Dryer; Matthew S. & Haspelmath; Martin (eds.) 2013. The World Atlas of Language Structures Online. Leipzig: Max Planck Institute for Evolutionary Anthropology. (Available online at https://wals.info/chapter/3),4,abm adz aeg aht alw amh ana anc arm baw ber brh bsq cah cax cay cck chu cof dar dgb die geo goo grr grw hau hin hmr ign ird ite iva jak jeb jng kal kay kho khr koa kot kpa kul lam lit lkk lkt mar mbb mgg mie mog mpa mun nap nep new nez ngi niv nmb nti ntu nug oca orh pai pit pol psh pso pur qco ram res rsc ruk sdh sed shu sla soq swa tac tel tgr tiw tpa tsg tza wam wap wdo win wiy yel yim yuc yul yur,102,76475,0.0013337692
35A,Plurality in Independent Personal Pronouns,,35,Michael Daniel. 2013. Plurality in Independent Personal Pronouns. In: Dryer; Matthew S. & Haspelmath; Martin (eds.) 2013. The World Atlas of Language Structures Online. Leipzig: Max Planck Institute for Evolutionary Anthropology. (Available online at https://wals.info/chapter/35),2,brm cnl imo kio mar ond prh qaw,9,76475,0.000117685515
28A,Case Syncretism,,28,Matthew Baerman; Dunstan Brown. 2013. Case Syncretism. In: Dryer; Matthew S. & Haspelmath; Martin (eds.) 2013. The World Atlas of Language Structures Online. Leipzig: Max Planck Institute for Evolutionary Anthropology. (Available online at https://wals.info/chapter/28),4,baw brh cah epe eve gar hau hmi hun hzb ika imo ket kha knd koa lad lep mar mei mss nbd nez niv nug pai pso qim tru tur una wrd yor zqc,35,76475,0.0004576659
34A,Occurrence of Nominal Plurality,,34,Martin Haspelmath. 2013. Occurrence of Nominal Plurality. In: Dryer; Matthew S. & Haspelmath; Martin (eds.) 2013. The World Atlas of Language Structures Online. Leipzig: Max Planck Institute for Evolutionary Anthropology. (Available online at https://wals.info/chapter/34),3,ame cmh cmn coo ctm epe gaa gap jam kgu kku kma kob kod krw kut lan lel mad mto mts new nti pal per pme ram ret rot sdw sed slb sud tab tin tiw tja tmm tru,40,76475,0.00052304677
32A,Systems of Gender Assignment,,32,Greville G. Corbett. 2013. Systems of Gender Assignment. In: Dryer; Matthew S. & Haspelmath; Martin (eds.) 2013. The World Atlas of Language Structures Online. Leipzig: Max Planck Institute for Evolutionary Anthropology. (Available online at https://wals.info/chapter/32),1,abn aco ain ale ame arm asm awp bag baw bkr brh brm bsq cah car cha chi chk chv cmn cnl cnt coo cyv dag djr dni don epe err eve ewe fij fin geo goo grw gua guu hai hat haw hay hmo hun iaa igb ika imo ind ite jaq kam kay kew kgz kha khk khl khm klv knr koa kob krk kse kut lad lah lan lep lez mak mal mao map mar mei mnd mns mny mok mrl mrt mss nbd ndy nez ngi nht niv ntu ork otm pai pal pil pip pit pmc prs qim ram rap san saw shk sml smt snt srn sue tab tha tho tib tol tot tsh tsi tuk tur tvl uhi una urk usa uzb vie wat wic wra yaq yel yid yko ykt ylb yor ypk yur zqc zun,145,76475,0.0018960445
120A,Zero Copula for Predicate Nominals,,120,Leon Stassen. 2013. Zero Copula for Predicate Nominals. In: Dryer; Matthew S. & Haspelmath; Martin (eds.) 2013. The World Atlas of Language Structures Online. Leipzig: Max Planck Institute for Evolutionary Anthropology. (Available online at https://wals.info/chapter/120),1,abk abz acm aco ady ain akn ala alb amh apl arc arm ava awp bab bam bar bej bik bla blc bln blx bre bri brs bsq bto bul bur but cah ccm cct ceb cha chc che chk cmr coo cre cro cso dag dgb din dut eng est ewe fij fin fre gae gar gbb gdi geo god gol grb grk grn grw hau hcr hei hin hmr hui hup hzb iaa ice igb ilo iri jak jpn juh kab kbl ket kho khs kic kio kko kku kls knk kor kpe kpm krk kro ksm kur kwk lad lao laz lep lez lil lis lkt lnd lnw maa mal mam map maw mei men mis miz mka mnc mnd moe moj moo mrd mrl mtu mun mut mwb mxp mym nav nbb nbh nca nep nez ngi ngz nht nko nue nup nuu ond ood otm otr pai pap pir pms pna prd prs pwn ras rka rom scr sel sey shn siu sla smt snc spa squ sra sup swa swe tag tep tes tgr tiv tli tne tno tpi tur tus tvo tzo tzu uby vai vot wap wau wch wel wic wlf yav yim yko ykt yor zai zan zar zaz zqc zul,211,76475,0.0027590715
1A,Consonant Inventories,,1,Ian Maddieson. 2013. Consonant Inventories. In: Dryer; Matthew S. & Haspelmath; Martin (eds.) 2013. The World Atlas of Language Structures Online. Leipzig: Max Planck Institute for Evolutionary Anthropology. (Available online at https://wals.info/chapter/1),3,aea agh aik aiz akn alb ald alw amo amu amz ana ata aze bam baw bbf bej ber bet bir bra bre brh brw bsq bul cad cah cam cay cha chu chv chw cil cle cnt cti ctl dan ddf dgb dgr die din dio diy diz djp dnw don doy eja eng fij fre ful gan ger goo grb grk grr grw gwa hmr hok hop htc hve iba ign igs ijo ind irx ito iva jav jeb jng kad kef kek ker kgu kgz kha khm khs kio kkn klv kmu knk knm knr kob kom kor kot koy kpa kpe kro kul kur kwo kws kyl lkt llm lu lua lui maa mab map mar mba mbb mei mgg mla mme mnd mog mpa mrl mro mrt mui mum mzc nap nar new nga nko nmb non nor nug nun ogb ood orm otm pac pai pau phl prs qaw rom rsc ruk sab sba sel sha snd snh som spa srn sup tam tha tiw tks tlp tma tmp tol tru tug tuk tul tur tuv tza umb una uzn vie wch wic wiy wuc yan yap yay yct yko ykt ytu zan zun,201,76475,0.00262831
