parameter_id,parameter_name,parameter_description,chapter_id,chapter_citation,value,same_value_language_ids,value_language_count,language_count_total,count_ratio
71A,The Prohibitive,,71,Johan van der Auwera; Ludo Lejeune (Valentin Goussev). 2013. The Prohibitive. In: Dryer; Matthew S. & Haspelmath; Martin (eds.) 2013. The World Atlas of Language Structures Online. Leipzig: Max Planck Institute for Evolutionary Anthropology. (Available online at https://wals.info/chapter/71),3,abb abk aeg amo amr anl ath bbl bma bud cah ccm cle cmh cte ctl dam des dmi est evn fye glc goo ita jak jaq kte lin lno mak meh mhu mos mrt nng pny por rom sgl spa srd sva ter tgr tna tru tuy vai vot wrd wth yur zen,55,76475,0.0007191893
90A,Order of Relative Clause and Noun,,90,Matthew S. Dryer. 2013. Order of Relative Clause and Noun. In: Dryer; Matthew S. & Haspelmath; Martin (eds.) 2013. The World Atlas of Language Structures Online. Leipzig: Max Planck Institute for Evolutionary Anthropology. (Available online at https://wals.info/chapter/90),1,aar abi abo abu abv ace acg acl adi adz aeg agm ajg alb alk all aly ame aml amo amp amq amr ana anc ang anj anu any aoj apu apw arg arj aro arq arw asy awe baa bab bag baj baq bar bbl bbu bco bej ber bfg bfi bgr bid bii bik bio bir bka bkr bku blr bma bmb bni bob bok bre brf brh brn brp brs bsh bsr btk bto bud bug bul bum bus buu bvi bwc cah cak cav cax ccm cde ceb cem cha chj chp chq chr chw cic cld cle cmh cmn cmy cnm coo cop cpl crn cso ctl ctm cub cya cze dag dan day ddj deg des did din dio djm dni dom doy dre dsh duk dut dyi efi egn emb eme eng eno erk err est eud ewe ewo fij fin fon fre fri fua fur fut fye gae gap gbb gel geo ger ghb gmz gnb gnd gok grb grf grk grw gud gul gum gwa hal hat hau haw hdi heb hei hid hix hmo hna hnd hoa hol htc huc hui hup hve hwr hya iaa iau iba ice idn ifu igb ign igs ik ila ind iri irq isa ita izi jab jak jeb jmo juh juk kam kan kar kau kay kbl kbt kbw kch kel ken ker kfe kgr khl khm khs kik kir kis kje kkt klm klr klv klw kma kmj knc kni knk knm knr knz koe kos kpm kpw krb krd kre kri kro krr kse ksg ktc kte ktl kuo kwn kws kwz kyl kyo kyq lab lan lao lat lbu lda leg lel len let lew lgt lgu lit lmg lmh lmp lmu lnd lon lug lui luo luv maa mab mad maj mal mam mao mas mau maw may mbm mbr mby mco mcv mdg mdo mds mea mee meh men mga mgo mgq mgu min miy mkj mlg mlu mmb mmn mna mng mnm mno moa mof mok mos mot mou mpr mpu mrg mrl mro mrq msk msl msm mud mum mup mur mus mut mwo mxc mxe mxo mxp mxy myg myi myn naj nal nan nar nat nbd ncm ndo ndr ndt ndy neh ney nez ngl ngm ngo ngz nhh nhm nht nia nif niu nkn nko nku non noo nor nrg nua nue nug nun nup nza obg obo oji olo ood orh orw otm paa pai pal par pat pau pba per pga pip pkt plg plh pms pno pnx pod poh pol por pre prs psh psw ptt pul pur qum rag rap rny rom ron rot rov rsu run rus rwe sah sak sam san sdw sea sed see ses sgb sgu shb shn sht sio sir sis skr slb sle sml snh so sob som spa src srd sre sro sud sul sun swa swe swt tab taf tag tah tai taj tak tar tat taw tbo tbt tbu tce tee ten teo tep ter tes tgk tgn tha thy tid tim tin tiw tke tla tlp tls tmm tmr tna tne tng tnk tnn tno tny toz tpn tpt trb tri trm tsi tsk ttd ttn tun tvl txj tzu ukr uld uli ung url urt ute vaf vie vnm wah wak wal war wch wel wic wlf wlo wma wol xbi xho xoo yag yap yaq yor yuc yuk yul zag zai zch zhn zul zzo,579,76475,0.0075711017
107A,Passive Constructions,,107,Anna Siewierska. 2013. Passive Constructions. In: Dryer; Matthew S. & Haspelmath; Martin (eds.) 2013. The World Atlas of Language Structures Online. Leipzig: Max Planck Institute for Evolutionary Anthropology. (Available online at https://wals.info/chapter/107),1,aeg ain alb amh amu ana ani apu ara arm aym bar bej ber bln bma brr bsq bur car cha cle cmn cmx coo cop cri cub cyv dgr dio diz don doy dre dut eng eve fij fin fre fua fur geo ger grb grk grw hau heb hin hix hlu hmo hmr hmu hun ijo ind iri irq ita jak jpn kas kay kch ket kha kho kis kna knd knm knr koa kon kor kos krb krd krk kro kse kuk kut kws lat lep lim mab mac mal mao map mar mle mnd mrl mrt msl mss mun nad nai nav nbd nbr ndo nez nht nko noo ntu nuu oss pal par pau pip plk pny pol prs psj psm qim qui rus siu sla sml snm so spa squ sun swa tab tha tin tkl tna tpn tuk tur tzu udh vie wap war wel wik win wra yaq yuk yur zan zul zun,162,76475,0.0021183393
57A,Position of Pronominal Possessive Affixes,,57,Matthew S. Dryer. 2013. Position of Pronominal Possessive Affixes. In: Dryer; Matthew S. & Haspelmath; Martin (eds.) 2013. The World Atlas of Language Structures Online. Leipzig: Max Planck Institute for Evolutionary Anthropology. (Available online at https://wals.info/chapter/57),1,abk abv acg aco adg ady aga ain akn amc amx ao api apl apu ara ath atm awa awi ayo ayr bae baq bel bil bla blx boa bod brr bry bti bua bun bur cah car cax cba cct cde che chg chj chp chx ckl cln cml cmx cnl cnm coa cqt cre cro cti cup die dmi dni eme ess eud ful gan gav gds gjj gnn goa grf gto gua gyc ham hat hix hlp hui hup hve ign ijo ika ina iqu irr ito iwa ixi jak jbt jrw jva kaa kbw kdw ket khg kio klg klw kma kmb kmh kmj kmr knw koa kob kok krh kri krk krw ksa ktm kyp kyz lav ldu lec lkt lng lui mac mam mar mau max may mba mco mcv mdn mea mei mek men mik mki mmv mne mno moh mot mpr mpu mrd mrs mtt mug mui mut muu nag nas nav nbd ncm nev nez nhh nhm nhn nht niv nkk nmb nsn nyu ocu ond ood pba pga pia pip pir plk pme pwn qum ram res rgc rik run sem ser sgb shp sla smn src srn sul tar tau tee tep tgn tic tid tir tja tli tlo tnc tob ton tot tpn tps tpt trr tte tun tus twn txj tzo tzu uby una urk wap was way wbn wch wic wiy wma wor wra wrk wrn wrw wsk wya xav xer yag yel yqy yuc yur zpr zqc zqo zqs,255,76475,0.003334423
104A,Order of Person Markers on the Verb,,104,Anna Siewierska. 2013. Order of Person Markers on the Verb. In: Dryer; Matthew S. & Haspelmath; Martin (eds.) 2013. The World Atlas of Language Structures Online. Leipzig: Max Planck Institute for Evolutionary Anthropology. (Available online at https://wals.info/chapter/104),2,abi ace aeg ain ala amh amu ane apu ara arp au bag baw bej ber bln bma brr cax cba cbo chk cku cyv dio doy eka err ewe fij gmw grw ham hix ika kas ket kfe kjo kkv klv kom kon kos kpm krb krd ktl kut lan lrk luv map mby miz mku mlk mna moa mrd mrl msn nan ndo nez ngk nht nko nyu ond oss otm pal pip pms prh prs psj sah snt swa taw tuk uma ura wam war wch wic wrk yag zan zsq zul,96,76475,0.0012553122
103A,Third Person Zero of Verbal Person Marking,,103,Anna Siewierska. 2013. Third Person Zero of Verbal Person Marking. In: Dryer; Matthew S. & Haspelmath; Martin (eds.) 2013. The World Atlas of Language Structures Online. Leipzig: Max Planck Institute for Evolutionary Anthropology. (Available online at https://wals.info/chapter/103),4,aeg arm asm ata atk aym bya cah cmx cpn cri doy fin goo heb ika jak kgu kio knm kob lat mku myi ngl nmb ntu otm pau pec pit pms prs psm pur siu sla ton tot tur tzu wbn wrd wrk,45,76475,0.0005884276
37A,Definite Articles,,37,Matthew S. Dryer. 2013. Definite Articles. In: Dryer; Matthew S. & Haspelmath; Martin (eds.) 2013. The World Atlas of Language Structures Online. Leipzig: Max Planck Institute for Evolutionary Anthropology. (Available online at https://wals.info/chapter/37),1,abk adi agb agm ala amh amp amq anu ara aro ata awt bab bag bak bam baq bbf bco bdu bfi bgr bik bir blz bmb bre brf brp bsq bul ccm cem cha cmy coo cop crn cso day dds deg dga dgb die dim dre dut egn eng epe ewo fre fri fua fut fye ga gae gel ger gmw gnn goe goo grk gua gul gwa hau haw htc hun hve iaa iri irr ita izi jmo jms juh kan kay kba kch kel ken ker kfe khm knr koa kos kre krk kse kut kwo laa lav lep lgu lkt llm lmg lmp lnd lon lot luo mab mad mae mal mao map mar may mbi mcd mea mis miy mka mof mon mou mpt mrg mrq msg mtb mtu mum mup mus mwb myi nbr nca ndy ney ngz nif nkn nti nyu obg oks ond ood pdp pip pir pms por qia qum ram rap ron rov run rwe sam san ser sir sis skk slb spa squ svs tar taw tbu tee tep tgk tgo tgr tid tim tin tke tla tng tnk tot tsi ttn tvl txj tzu uld ung url vai vie wch wel wlf wol wrw wsk yap zag zar zay zch zqc zqs,216,76475,0.0028244525
130A,Finger and Hand,,130,Cecil H. Brown. 2013. Finger and Hand. In: Dryer; Matthew S. & Haspelmath; Martin (eds.) 2013. The World Atlas of Language Structures Online. Leipzig: Max Planck Institute for Evolutionary Anthropology. (Available online at https://wals.info/chapter/130),2,abi abk abm abw acg acm acu afr agr aht akr ale alg amh amk amr amu apc api apj ara aro arw arx atq ats awa awp aym ayo aze bab bae bam bca bem bgr bkd bkl bla blj blr blx bno bnq bnv bok bor bpb brc bre brs bsq btk bur but cab cac cai cak cam cap car cas cat cav cax cay cch cck cct ceb cec cha che chi chj chl cho chp chr chu chw cin cla clc cle cma cmh cmn cmy cnl cnt cof cog col cpa cre crg crk crl crn cro crp crq crt csf csh csk ctc ctl ctt ctw cub cui cur cut cuu cyn cze dak dam dca des dgx dig djp dre dsh dut efi eka emb ena eng ese eve eya fij fin for fox fre fut gad gae geo ger ghb gid git gjj gku gmb gna gno goa gre grk grm gto gua gul guu gyb hai hau heb hid hil hmb hmd hmi hmu hop hpd htc hui hum hun hve ifu igb ik ika ill ilo ind iql iri ita itw itz ixc ixi jak jeh jmo jpn juh kas kat kaz kdg kdz kea kek kew kfe kgt kgz kha khg khk kic kio kis kje kky klm klw klz kmh kmk knc knd kng knr koa kon kor kos kpn krc kro ktb kth ktu kul kun kuq kut kwa kwe kws kyn lao lau len lez lit lnw lui lus mab mai mal mao map maz mby mcg mch mcn mco mcs mcv men mer mgg mhc mhi mic mid mij mis miz mjc mkb mnc mnd mne moc mog moj mok mop mos mov mpy mrt mse msh mss mtg mti mtp mtt mui mum mup mut muy mwb mwl mxg mxu myi mym myo myr mzc nas nbd nbr nep ngn nht nhu nhx niu nju nko nkr nlu nne nnm nog nom nor npa nro nsk nsn nsz ntj nuk nun nuu nya nym oca oji oka oko olu ood ore osa osm owc pae pal pan pcm pem per pia pip pir pla pme pnn pno poh pol por pow ppc prt psj psm psv pui pul pur qan qaw qca qch qec rad ram rap res ret rgn rng rnn rom rus sal sam say sba scr sea sec sed sel shk shl shn sho shu shw sin sla slv smj smt snh sno sol son spa spo squ sri sss stl sum sus sva svk swa tac tag tar tbe tce teh tga tha tib tic tkm tlf tlp tml tna tnb tnj tnl toa tob toj tol tos tpa tpi tpt trb trc tsf tsg tsh tsi tsj tsw tty tub tuc tup tur tus tut tuy tvo twn txj tze tzo tzt udh uhi ukr ute uzb ved wap way wch wel wem wic wir wiy wmu wol wra wrd wth wwr xar xer xoo yah yak yap yar yav ycn yct yki ypk yrt yus yyo zai zaj zam zap zfl zqc zqr zqs zul zun zzo,521,76475,0.006812684
78A,Coding of Evidentiality,,78,Ferdinand de Haan. 2013. Coding of Evidentiality. In: Dryer; Matthew S. & Haspelmath; Martin (eds.) 2013. The World Atlas of Language Structures Online. Leipzig: Max Planck Institute for Evolutionary Anthropology. (Available online at https://wals.info/chapter/78),4,afr ana apl baq bej blx bsq cbo cha cnt coe coo ctm dmi dni epe ese gjj gua ham hlu hop iqu ito itz jak jem kic kma krk kws lah leg lim lkt mja moh mrd mxo mxs nav nhm nhn nht ond otm pau pir pit pot prc sla squ sue tac tag tew tru tsh tzo tzu urk wai way,65,76475,0.00084995094
95A,Relationship between the Order of Object and Verb and the Order of Adposition and Noun Phrase,,95,Matthew S. Dryer. 2013. Relationship between the Order of Object and Verb and the Order of Adposition and Noun Phrase. In: Dryer; Matthew S. & Haspelmath; Martin (eds.) 2013. The World Atlas of Language Structures Online. Leipzig: Max Planck Institute for Evolutionary Anthropology. (Available online at https://wals.info/chapter/95),3,acg adi ara bae bgs bil ble cea coc dga dgb est ewe fin gjj grb gua hun iqu juh kas kch kir kje kzy llm maj moe mpr nkn sle sno tpn tps trm tsr wal wry yag ycn zch,42,76475,0.00054919906
100A,Alignment of Verbal Person Marking,,100,Anna Siewierska. 2013. Alignment of Verbal Person Marking. In: Dryer; Matthew S. & Haspelmath; Martin (eds.) 2013. The World Atlas of Language Structures Online. Leipzig: Max Planck Institute for Evolutionary Anthropology. (Available online at https://wals.info/chapter/100),2,abi acm aeg ala alb ame amh ane ani anj arm asm au baa bag baw bej ber bkr bln bma brh brn brr brs bya cah can cap cba cbo cle cmn cmx coo cop cri cub dag dgr dio diz dni doy dum dut eka eng err eve ewe fij fin fre fua fur geo ger gmw goo grk grw ham hat heb hin hmu hua hun hzb ijo ind iqu iri irq ita jaq ker kfe kgu kho khs kis kkv klv knd knm knr kob kom kon kos krb krd ktl kut kwz lan lat lav lel luv mab mak mar mau may mby mis mku mlk mna mne moa mrd mrl msl msn mss mun mup mxc myi nai nak nan nav nbd ndo ngk nht nko nmb noo nti ntu nuu nyu orh oss otm pal pec pip pit plk pms pny pol prh prs pur qim qui ram rem ret rus sah sal sel sem siu sla slp snt so spa squ sue swa syu tau taw tgk tid tin tiw tja tkl tla tmr tms tol tot tpn tri tuk tur udh una ura urk usa wao war wbn wch wel win wma wra wrd wsk yap yko yur zan zqc zsq zul,212,76475,0.0027721478
88A,Order of Demonstrative and Noun,,88,Matthew S. Dryer. 2013. Order of Demonstrative and Noun. In: Dryer; Matthew S. & Haspelmath; Martin (eds.) 2013. The World Atlas of Language Structures Online. Leipzig: Max Planck Institute for Evolutionary Anthropology. (Available online at https://wals.info/chapter/88),1,abi abk abv aco adk ain ala alb als alw amb amc amh ami amk amn amr ams ana ani ann anu apt apu apw ara arc arm arp arw asm ass ath atk ats ava awa awp awt aym bae baq bar bdm bfg bho bii bil bkt bku bla blg blr blt bnb bnj bnn bnr bod brh brl brm brs bsk bub bul bur but bya cak car cas cay cde cea cha chc chd che chg chk chn chp chs chv ckl cld cln cml cmn cnm cnt coc coo cpn cpy cre crp cti ctl cup cyv cze daw des dgr dhi dhm diy djm djn djp djr dlm dmi dms dom drm dsh dua duk dul dut dyi emb eme eng epe est eud eve fin for fre fri fur ga gaa gam gar gav geo ger gid gjj gnb god gon goo grg grj grk grr gto gua guj gur guu gyc hai hak haw hay hei hhu hil hin hlu hmi hop hpd htc hua hun hup hve hwr hzb ice idn idu ifu ijo ilo ing iqu ita ite ito iwa jaq jbt jeb jng joh jpn jva kaa kab kac kae kas kay kbt kem ket kew kgy kha khg khl kho khr khs kin kio kiw kkp kkt kku kkw klm klr kls kma kmh kmn kms knd knn kno koa kok kol kor koy krc kri krk krn krw kry krz ksa ktm kty kum kuo kut kuv kwo kwt kxo kyn kyr lac lad lat ldu lec lep lez lil lim lit lmn lui lun maa mac mai mak mam map mau mcd mco mcv mdm mds mek men mgg mgi mhi mie mik mis miy mkg mmn mnd mne mns moa moh mot mra mrc mrt mru msc msg msq mss mto mtt mun mut mwb mxx myi mym naj nas nav nax nbd nca ndj nep nev new nez ngi ngl ngn ngw nhh nhm nhn nht niv nku nnc noc nor nph nrg nsn nti ntu nug nwd nyk nyn nyr nyu nze ocu oji omh omi ond ood oss otm pae pai pal pam pan pau paw pba pdp pga pia pir plk pno pny pod pol por ppc pra pre prk prs psh psm pso ptt pum pur qaf qhu qim qui qum ram raw rem res ret rgc rmb rsu ruk rus rut rwe sal sar sav scr sdw sec she shh shi shk shm sho shp sid sin siu skp sla slb slo sme smn sna sng snm snt spa spi squ src srn stl suk sup sus svs swe swt tac tah taj tam tar tau taw tbl tce tee tel tgl thd thk thn thu tic tig tiw tkl tkm tla tli tls tml tnc tni tnn tob tot tpn tps tpt trr tru trw tsf tsz ttu tuc tul tur tuv tuy tvo tvt twe txj udi udm uhi ukr una urd urk urn usr ute uzb vaf wak wam wao wap was wbn wed wem wic wik wiy wlo wly wme wra wrd wrk xam xas xer yag yaq ybi ycn yin yko ykt yng yny yok yuc yuk yur yuw zay zaz zch zqc zqs zun,542,76475,0.0070872833
72A,Imperative-Hortative Systems,,72,Johan van der Auwera; Nina Dobrushina; Valentin Goussev. 2013. Imperative-Hortative Systems. In: Dryer; Matthew S. & Haspelmath; Martin (eds.) 2013. The World Atlas of Language Structures Online. Leipzig: Max Planck Institute for Evolutionary Anthropology. (Available online at https://wals.info/chapter/72),1,acu aea ala alb ame anl ark ath awn aym bkr brs bsk bul cak chk dag dbd dio dni est eve evn fin fua gam gbk gmz goo grk gua ham haw heb her hix hun hzb ing iri irq jak jaq jeb juh kha kho kil kim klm klv kmk knd knm koa kob kon krk krn kro krq kte kui kyl lak lep lgt loz lug luv mai mal mao mcd mdk mei mgo mhi mnm mok mrg mss mwe nan nca nep nez ngi nht niv noo nti ntu nub nug ond oss pal pnn prh psm rap rav ret rom shn sla sno snt swa tbu tem tnc tot tur tvo txj tzo tzu udh uzb vot wai win wlf yid yim yko ypk ysi zul zun,133,76475,0.0017391305
52A,Comitatives and Instrumentals,,52,Thomas Stolz; Cornelia Stroh; Aina Urdze. 2013. Comitatives and Instrumentals. In: Dryer; Matthew S. & Haspelmath; Martin (eds.) 2013. The World Atlas of Language Structures Online. Leipzig: Max Planck Institute for Evolutionary Anthropology. (Available online at https://wals.info/chapter/52),2,abk acg aco aeg agt ain ala aly ame arg arm arp arr auy ava bag bah bis bla bma bnm bou brh bsq bur car cem chk cmh cmn cog com crg dah dam des dgr dmi dni dre dug efi ena eve evn fij fin fni gds gnn goa gol gon goo grj grw gua gum guu hin hix ho hua hui hup hve hzb imo ite jak jpn kam kat kay kha khm khr khs kin klv knd kng knm knr koa kob koi kor krk kro kry ktt kur kwe kwm kxo lad lah lak laz les lez lim lkt lug lui luo mah mao map maw mei mgg mjk mlt mmv mnc mnd mne moa mrd mrg mrt mrw msh mun mup myi myo nah nan nav ngi niv nkr nmi nob nti nwd nya orh ots pae pai pal per pia pol ppi prh psj pur qaw qch rap sam shn siu sla slb slp so som ssh swa syu tag tah tas tau tbs tbu tel tha tin tke tli tml tng toq tri trr tru tug tup txj uby udi uhi una urd urk usr vai ven wan way wch win wra wrg wrw wsk yaq yel yir yko ykt yor ypk yuk zch,213,76475,0.002785224
97A,Relationship between the Order of Object and Verb and the Order of Adjective and Noun,,97,Matthew S. Dryer. 2013. Relationship between the Order of Object and Verb and the Order of Adjective and Noun. In: Dryer; Matthew S. & Haspelmath; Martin (eds.) 2013. The World Atlas of Language Structures Online. Leipzig: Max Planck Institute for Evolutionary Anthropology. (Available online at https://wals.info/chapter/97),4,aab abu acg acl adi adz aeg agb agh akn alb alk aln ama aml amo amq amr ams anc ane anj anu aoj arg arj aro arq asy au ayi ayo ayw bab bae baf bag baj baq bar bas bbl bch bdu ber bfg bia bid bik bir bkr bku ble blu blz bma bni bnk bnn bra bre brf brn bsh bto bub bud bum buu bvi bwc cax ccm cem cga chq chr chw cic cle cme coc cop cpl crn cso ctl cya day dga dgb did dio dma don doy dre dua duk ega egn eno erk err ewe ewo fij fni fon fre fua fut fye ga gae gel gjj gla gnd goa goe grb grf grr gto gua gul guw hal hat haw hdi heb heh hem hmo hna hnd hoa hol huc hya iba ifm igb ige igs ik ila ind iqu iri irr ita jab jar jmo juh juk kam kar kau kba kbl kbw kby kch kdz kel ker kfe kga kgr khm khs kik kin kir kje kkt kkv klv kmj kmu koe kom kon kos kpw krb kri kro ksg ksn ktc kte ktl kuo kwa kwn kwy kyl laa lab lag lan lao lbu ldo leb lel len let lew lgi lgu lic lin llm lmg lmh lmp lon lou luc luo luv maa mae mal mao mas may mba mbe mbi mbl mbm mbr mbt mby mda mdg mds mdw mea mee meh mga mgk mgo mgu mie miy mkd mkz mla mlg mlm mlu mmb mmv mna mng mof mok mon moo mor mpo mpr mpu mrg mrl mro mrq mrt msk msm mtb mua mum mup mur mwe mwo mxc mxe mxj mxo mxp mxy myn mzc nak nal nan nau ncm ndb ndi ndo ndr ndt ndu neh ngd ngm ngo ngu ngz nhh nhm nht nia nif niu nkn nko nnc non noo nse nto nua nun nup nym olo otr pai pam pat per pga pkt plg plh plk pms png pnu poh por pre psw pul pur rag rap rga rny rom rot rov rru rsu sah sak sam sap sea seb sed ses sgb sgu shl shm shn sht sim sio sis sku sle sml so sob spa srd sre sti sud sul sun swa tab taf tah tat tbo tbw ten teo ter tes tgk tgn tha tia tid tim tlp tmm tmn tmr tna tne tng tnk tno toz tpr tps tri tsg tsk ttd ttn tuk tum uld uli ura url urt ven vie vnm wal wch wel wlf wlo wma wol wrk wrm wth xam xbi xho xoo yag yao yap yay yor yul zai zap zul zya zzo,456,76475,0.0059627327
106A,Reciprocal Constructions,,106,Elena Maslova; Vladimir P. Nedjalkov. 2013. Reciprocal Constructions. In: Dryer; Matthew S. & Haspelmath; Martin (eds.) 2013. The World Atlas of Language Structures Online. Leipzig: Max Planck Institute for Evolutionary Anthropology. (Available online at https://wals.info/chapter/106),4,bae bnw cah cup djr gim goo grw hui ika imo jak kio kng kro kws lan lui luv map mar mau max mud myi ond put qhu rap sho srr sup toq wam war wch wra wrk xer yag yaq ynk yor,44,76475,0.0005753514
102A,Verbal Person Marking,,102,Anna Siewierska. 2013. Verbal Person Marking. In: Dryer; Matthew S. & Haspelmath; Martin (eds.) 2013. The World Atlas of Language Structures Online. Leipzig: Max Planck Institute for Evolutionary Anthropology. (Available online at https://wals.info/chapter/102),5,abi abk ace acm aco aeg ain ala alb ame amh amu ane apu ara arp asm atk au aym baa bag baw bej ber bln bma brr bsq bur cah can car cax cba cbo chk cku cmn cmx coo cre cyv dag dio dni doy eka err ewe fij fua geo gmw goo grk grw gua ham hix hlu hua hun ika jak jaq kas ket kfe kjo kkv klv knm knr koa kom kon kos kpm krb krd krk ktl kut kws kwz lan lav lel lim lkt lrk luv mab mac mak map mar mau mby miz mku mlk mna moa moh mrd mrl msl msn mss mun myi nan nas nav ndo nez ngi ngk ngl nht nko nmb nti nug nyu ond oss otm pal par pec pip pit pms prh prs psj psm pur qim qui ret sah sal siu sla slp snt spa squ swa tap tau taw tiw tja tkl tli tna tol ton tot tpn tsi tuk tun tzu uma una ung ura usa wam war was wch wic wrd wrk yag yel yim ypk yuc yuk yur zan zqc zsq zul,193,76475,0.0025237005
111A,Nonperiphrastic Causative Constructions,,111,Jae Jung Song. 2013. Nonperiphrastic Causative Constructions. In: Dryer; Matthew S. & Haspelmath; Martin (eds.) 2013. The World Atlas of Language Structures Online. Leipzig: Max Planck Institute for Evolutionary Anthropology. (Available online at https://wals.info/chapter/111),2,abi abk ace aeg ain aji aly ame amh ana apu arm aro asm atc awn awp aym bab baj bal bam bej bkr bla bma brh brr brs bsq bur but cah car cax cct ceb cha chk chv cld cle cmn coa coo cre cui dgr die dio diy doy dre eng epe eve fij fin fut gar geo ger grb grw gua guj guu hai hau haw heb hin hix hmi hun hzb iaa igb ika ila ind ing irq jak jaq jpn kam kas kay kdz kem ket kew kfe kgu kha khm khs kin kio kis kls kmk knd knm knr kol kon kor kos krb krk krn kut kwa lad lan lat lav lep let lez lim lmp luv maa mab mac mak mal mao map mau mei men mhi mna mnm mns mny mrl mrt mss mwb mxc mym nbd nca ndo neh nez ngi ngl nht niu niv nko nti ntu nug nym oji ond orh orw pai pal pan pau pip pkn pny ppi prh prs psh psm pso pul pwn qim rap ret rot ruk rus sam saw sel shn shp shu sla sml snh snm son sor squ srn sun sup swa swt tab tag tah tas tel tim tiw tli tml tmr tna tng tno ton tsi tsw tuk tur tus tvl tzo uhi uli una urk usa ute uzb wam wat wch wic wma wol wra wrl yag yap yaq yel yid yko ykt ynk ypk yus yuw zul zun,254,76475,0.0033213468
70A,The Morphological Imperative,,70,Johan van der Auwera; Ludo Lejeune (Umarani Pappuswamy; Valentin Goussev). 2013. The Morphological Imperative. In: Dryer; Matthew S. & Haspelmath; Martin (eds.) 2013. The World Atlas of Language Structures Online. Leipzig: Max Planck Institute for Evolutionary Anthropology. (Available online at https://wals.info/chapter/70),1,abb abk acl aco acu adk aeg ala amh amr ana anl apl ard arg arm arp ars ath ava awp ayr azi bab bam bbw bdk bej bel bem ber bfg bma bre brh brz bsk bsq bud bul bur cah cak car cay ceb chj chv cld cle cmh cml cmn coi coo cre cyv cze dag dbd dgr die dig diz dmi dni dyi eka emb emc epe err est eve evn far fin fua fye gam gim glc gmz goj grk grw guj gum ham heb her hin hix hlu hmi hui igb ik iri irq jak jaq jeb kas ket kew khk kil kio kis kmk kmp kms knd knm knr koa kob kod koi krb krc krd krk kro krq kse kte kty kui kut kuv kwe kwr kws kyg lad lak lan lav laz lil lim lit lng lno loz luo luv mab mac mak mam man map mar mau mbg mcd mdn meh mgo mhu miy mle mlt mme mna mns moe mop mos mrd mrg mro msl mss mun mwe myi mym nan nap nbd nez nga nht niv nti ntn nub obo oix oka ood orh otm pan pau pip pms pol ppi prk psm pta pur qim qta ram ret rsu rus rwa scr sdw sgu shb shk shl shu slo sno snt so sou spa srd stn sue sug swa tag tas tau tbu tel tem ter tet tgr tir tiw tkl tml tms tna tnc tpn tsa tsh ttu tun tur tuv tvo tzo tzu udh udi ukr uld una uzb vai vot wap wau wch wel wic wlf wra wrd wrg wrk wwr yaq yim yko yng yny ypk yuk yur yus zaz zen zqc zqs zul,292,76475,0.0038182412
77A,Semantic Distinctions of Evidentiality,,77,Ferdinand de Haan. 2013. Semantic Distinctions of Evidentiality. In: Dryer; Matthew S. & Haspelmath; Martin (eds.) 2013. The World Atlas of Language Structures Online. Leipzig: Max Planck Institute for Evolutionary Anthropology. (Available online at https://wals.info/chapter/77),2,abk abm acm afr aho akr alb amc amu ana apc apu arc arg arw asm baq bco bej blx bor bsq cah cbo ccm cco cct cha che chl chp cku cmn cnt coc coe coo ctm den dmi dni dut eka epe ese est fin fox fre gar ger gjj gny goo grf grw gso gua ham hid hlu hop hzb iqu ito itz jak jem jpn kic kio kma kmk knd kng kor krk kwk kws lah lat lez lim lit lkt mam mdn mja mne moh mrd mrt mss mtg mth mtl mxo mxs myi nav nep nev nhm nhn nht nit niv nmi nsn nuu nwd omh ond ood otm pae pai pau pir pit pno pot prc psm ptw pur put pwn qui rut shk shu sla src srn srr sue swe tac tag tew tkl tml ton tpn trn tru tsh tsi tun twn tzo tzu urk wai wao way wic wra wur yam yaq yko ypk zqc,166,76475,0.002170644
