parameter_id,parameter_name,parameter_description,chapter_id,chapter_citation,value,same_value_language_ids,value_language_count,language_count_total,count_ratio
129A,Hand and Arm,,129,Cecil H. Brown. 2013. Hand and Arm. In: Dryer; Matthew S. & Haspelmath; Martin (eds.) 2013. The World Atlas of Language Structures Online. Leipzig: Max Planck Institute for Evolutionary Anthropology. (Available online at https://wals.info/chapter/129),2,abi abk abm abw acg acm acu afr agr agt aht akr ale alg aly amc amk amp amu apc api ara ati atk atq ats awp ayo bab bae bca bem beo bkd bkl blx bnb bnj bno bnv bok bor bpb bre brs bsq bur but bwa byu cac cai cam cap cas cat cav cax cct ceb cec che chi chp chu chy cla clc cle cma cmh cmn cnl cnt cog cpa cpw cqt cre crg crj crk crn cro crp crq crt csh ctc cub cui cur cut dak dda des dgx dig diy dja dji djp dre dsh dut emb eng ese eve eya fij fin fox fre gae ger ghb gid gjj gmb gna gno gny goa goo gre grk gto gua gum guu gyb hai heb hid hil hmb hmd hmi hmu hpd htc hum hun hup hve ik ill ind inu iql iri ita ixc jiv juh jva kaq kas kdg kek kew kgt kgz kic kkw klm kls klz knc knd kng koa kor krc krk ksa kth ktu kun kut kws kxo kyn lao luo lus mal map mbb mca mcg mch mcn mco mcs mcv mdm mhc mic mis miz mjc mkb mku mnd mne mny moc mog moh mov mpa mpy mrl mrt mss mtg mti mtt mui mut muu mwl mwn mwp myi myo myr mzc nat nav nbr ndj nep nez ngi ngj ngn ngw nhu nhx nju nko nlu nne nnt nor nro nsk nsn ntj nug nuk nun nuu nya oca oji ojm oma ond onn osa owc pan pcm pem pia pin pip pir pit pkn pla pme pnn pno pny pol por pow ppc ppi psj psm psv pui qan qaw qca qec rap res ret rom sal sba sea sec sel shk shl sho shs shw sla slv snc spa spo sri sss sum sva tac tag tar teh tha tho tic tiw tlf tnb tnl tob tol tos toy tpa tpt trb trc tsg tsh tsi tsj tsw tty tub tun tup tur tus tut tuy twn txj uhi urk ute wam wap wat way wch wel wem wic win wir wiy wmu wnb wra wrd wrg wrl wth wwr xar xer xok yah yan ycn yir yki ypk yrt yuk yus yyg yyo zap zqs zul,389,76475,0.0050866297
18A,Absence of Common Consonants,,18,Ian Maddieson. 2013. Absence of Common Consonants. In: Dryer; Matthew S. & Haspelmath; Martin (eds.) 2013. The World Atlas of Language Structures Online. Leipzig: Max Planck Institute for Evolutionary Anthropology. (Available online at https://wals.info/chapter/18),1,abi abk abm ach acm aco adz aea aeg agh aht aik ain aiz akn akw ala alb ald amc ame amh amo amu amz ana anc ani ao api apu arb arc arm arp asm ata ava awn awp aym aze bag bai baj bam baw bbf bco bee bej ben ber bet bir bis bki bkr bma bng bod bra brb bre brh bri brm brw bsk bsq bto bul bur cad cah cam car cax cay cck ccp cha che chk chl chq chu chv chw cil cle cmn cnl cnt cof coo cre cso cti cve cyv dad dag dah dan dar ddf det dgb dgr die dio diz dni dnw don doy dre dts dum efi eja eng eve evn ewe ewo fas fef fij fin fre ful fur fuz fye ga gar gbb geo ger ghb gla gmb goa grb grk grw gua gwa had hai hak ham hau hba hin hix hmo hmr hok hop htc hum hun hup hve hzb iaa iba igb ign igs ijo ik ika imo ind ing ird irq irr irx iso ite ito iva iwm jak jaq jav jeb jeh jiv jng jom jpn jpr juh kab kad kal kas kch ked kef kek ker ket kew kfe kgi kgz kha khm kho khr khs kio kiw kkn kkv klm klv kly kmp kmu knd knk knm knr koa kob koh koi kom kor kot koy kpe krd krk kro kry kse ksg kss ktk kty kul kun kur kut kwa kwk kwo kws kyl kzy lad lah lak lam lat lav len lep lez lit lkk lkt llm lu lua lug lui luo lus luv maa mab mak mal mao map mar mau may maz mba mbm mei mgg mie mla mme mnc mnd mne mog mor mov mrd mrg mrl mro mss mtp mui mum mun mxc mxm mya mzc nai nan nap nar nas nav nax nbk ndt ndy nep new nez nga ngi ngz nhn nht nim nis niv nko nkt nmb nnc nob non nor nti ntu nun nuu nyg nyi oca ogb oji ood orh orm otm pac pae pai pau paw pec phl pms poa poh pol prs psh psm pso puk pur qaw qco ram rap res rom ror rsc ruk rus rut sab san sba scs sdh sdw seb sed sel sha shi shk shs shu sin skp sla slp sml snc snd snh snm snt som soq sor spa squ sre srn sue sui sup svs swa tab tac tag tam tas teh tel ter tgk tgr tha tib tic tiw tks tlp tma tmn tmp tne toa tok tol ton tpa tru try tsg tsi tso ttn ttu tug tuk tul tun tur tuv twn tza umb una urk usa uzn vie wap wch win wiy wlf wma wnt woi wps wra wrs wuc xoo yan yap yaq yar yaw yay ycn yct yes yey ygr yko ykt yor ytu yuc yul yur yus zan zqc zul zun,503,76475,0.006577313
82A,Order of Subject and Verb,,82,Matthew S. Dryer. 2013. Order of Subject and Verb. In: Dryer; Matthew S. & Haspelmath; Martin (eds.) 2013. The World Atlas of Language Structures Online. Leipzig: Max Planck Institute for Evolutionary Anthropology. (Available online at https://wals.info/chapter/82),3,ace alw amc any apl ara asy bac bae baj bbu bch bil bkr bla bln blr brs btk bul bwc cav cax cbo cea che cre dhr djm don dre gid git gku gnn grj grk grr gum hup ita jam jeb klm krn kwk kws lac lat lml mac mdm meh men min miy moa moh mok mpo mpr mra msk mtt mut mxx mzh nau nez ngg ngl nha nht nne nug nym nyn pol ppi psm rit rwe shs siu sml snc spa swt tas tin tla tno tob tus tzu ute wai wam wic wik win wrd wrg wrl wrw yao ypk ywl zqs,110,76475,0.0014383786
47A,Intensifiers and Reflexive Pronouns,,47,Ekkehard König; Peter Siemund (Stephan Töpper). 2013. Intensifiers and Reflexive Pronouns. In: Dryer; Matthew S. & Haspelmath; Martin (eds.) 2013. The World Atlas of Language Structures Online. Leipzig: Max Planck Institute for Evolutionary Anthropology. (Available online at https://wals.info/chapter/47),2,abk apu awp bkr bsq bul cmn cnl coo cub dre ewe fij fre ger grk hix ice ita kch ket khs kin kio kmu knm koa krk kse ktt kut lat lit lkt luv mao map mau nav nbd nez ngi nht nti nug ond orh pau pol por prh ram rom rus shk shn som spa sup svk swa tag urk usa ven wam war wic yaq ydd yor zqc zul,74,76475,0.0009676365
115A,Negative Indefinite Pronouns and Predicate Negation,,115,Martin Haspelmath. 2013. Negative Indefinite Pronouns and Predicate Negation. In: Dryer; Matthew S. & Haspelmath; Martin (eds.) 2013. The World Atlas of Language Structures Online. Leipzig: Max Planck Institute for Evolutionary Anthropology. (Available online at https://wals.info/chapter/115),1,abk abu ace ady aeg ain ana ano ass awp bab bae bag baw bbw biu bkr bma boz brh brm bsq bud bul chk chn cnl cnt coo cop dgr dji epe eve fin fon goo grg grk grw gua guj hai hau heb hin hmo hun hzb ind iri jam jel jpn kan kas kaz ker ket kfe khm khs kio kkp kku klv kma kmh kmu knd knr koa kob kod kor kse kty kug kzy lak lat lav lel lez lil lin lit lkt mac mad mao map may mbi mby mdg mgu mhi miy mle mme mnd moe mos mto mun mym nai nav ndj nep ngi niu niv nti nua nwd oji ood orh pae pai pms pno pol pop prs qhu qia qim raw ret rom rus scr shk skp sla sno som squ sup swa tag tam tha tid tja tml tms tpn trb tru ttn tur tuv udh udm urk vie wch wlf yko ykt ytu zaq zaz zul zun,170,76475,0.0022229487
144H,NegSVO Order,,144,Matthew S. Dryer. 2013. Position of Negative Morpheme With Respect to Subject; Object; and Verb. In: Dryer; Matthew S. & Haspelmath; Martin (eds.) 2013. The World Atlas of Language Structures Online. Leipzig: Max Planck Institute for Evolutionary Anthropology. (Available online at https://wals.info/chapter/144),4,aab abu acg adi adz aeg agh aja akn alb alk aln aml amq anc ane anu ara arg arj arm aro arp arq asy au bab bae bag bai bak bar bas bbl bch ber bgo bgr bia bik bir bka bkr bku ble blz bmb bni bnn bob bol bra bre brf brn bsh bud bul bum buy bvi cai cga chr chw cic cmy cnt cze deg dga dgb dgo dio dma doy dsh dua duk dut ebi ega egn eko eng erk err est ewe ewo fin fon fre fua fut ga gbb gbs ger gku gla gmz gnb goe gok grk gua gul gwa gwo hak hal hat hau heb heh hmo hna hnd hol htc huc hun hya iaa ice ige igs ila ind irr ita izi jab jar jmo juh juk kan kar kas kau kba kbw kby kch kdw kel ken ker kfe kga khm khs kik kil kin kir kis kkv kni knk kom kon kos kpw ksg ksn ktl kwa kwy kwz kyl kzy laa lab lag lan lao lat lbu ldo ldu leb leg lel len let lew lgi lgt lic lin lit llm lmh lmp lmu lnd lon lou luc lug luv ma mad mae map mas mau may mba mbe mbm mbr mby mcd mcv mda mdg mdo mea meh mgk mgu mhu miy mkd mkz mlg mlu mmb mmv mna mnd mok mon moo mor mou mpu mrg mro mrt msm mtb mua mum mus mut mwe mwo mxe myg nak nal nbm ncm ndb ndt ndu ndy neh ngm ngo ngu ngz nhm nke nkn nko nne noo nor nse nto nua nun nup nza obg obo ocu olo one paa pal pat per pga plg plh pms png pog poh pol por pre psw pul rim rny rom ron rot rru rsu rus sah sak san sap sed sgb sgl sgu shl shm shn sht sio sir sis skm slo sob spa srd sre ssa sti stn sul sun swa swe tab taf tal tan tbw tee teo ter tet tgk tha tid tin tiv tiw tki tmm tmr tne tob ton toz tpr tru ttn twn tzu ukr uld uli url urt ven vie vnm wal wch wlf wma wol wrk wrm wrn xar xbi xho yao yin yng yor yul zan zqs zul,392,76475,0.0051258584
144I,SNegVO Order,,144,Matthew S. Dryer. 2013. Position of Negative Morpheme With Respect to Subject; Object; and Verb. In: Dryer; Matthew S. & Haspelmath; Martin (eds.) 2013. The World Atlas of Language Structures Online. Leipzig: Max Planck Institute for Evolutionary Anthropology. (Available online at https://wals.info/chapter/144),3,arp bmb chr ewo hau nke plh urt,9,76475,0.000117685515
83A,Order of Object and Verb,,83,Matthew S. Dryer. 2013. Order of Object and Verb. In: Dryer; Matthew S. & Haspelmath; Martin (eds.) 2013. The World Atlas of Language Structures Online. Leipzig: Max Planck Institute for Evolutionary Anthropology. (Available online at https://wals.info/chapter/83),2,aab abi abu acg acl acm adi adz aeg agb agc agd agh aja akn alb alk aln als ama ami aml amo amq amr ams anc ane anj ann anu aoj ara arg ari arj aro arp arq asy ata au avk ayi ayo ayr ayw bab bae baf bag bai baj bak baq bar bas bbl bbu bch bco bdu ber bfg bgo bgr bgs bgz bid big bii bik bil bir bka bkl bkr bku bla ble blg blu blz bma bmb bni bnk bnn bob bol bra bre brf brn brq brr bse bsh btk bto bub bud bug bul bum buu buy bvi bwc cak cax cba ccm cea ceb cem cga cha chj chq chr chw chx cic ckl cle cme cmx cmy cnt coc coe cop cor cos cpl cqt cre crn cso cua cuc cya cyv cze day deg dga dgb did dio dma dok dom don doy dre dsh dua duk ebi ega egn eko eng eno erk err esm est ewe ewo fij fin fon fre fua fut fye ga gae gbb gbs gel gir giz gjj gla gmz gnb gnd goa goe gok grb grf grk grr gto gua gud gul guw gwo hak hal hat hau haw hdi heb heh hei hem hil hlu hmo hna hnd hoa hol htc huc hun hve hya iaa iba ice ifm ifu igb ige ign igs ik ila ilo ind iqu iri irr ita ito iwa ixi izi jab jak jar jmo juh juk kad kam kan kar kas kau kba kbl kbw kby kch kdw kdz kel ken ker kfe kga kgr khm khn khs kik kil kin kir kje kkt kkv kla kls klv kmj kmu kni knk koe kom kon kos kpm kpw krb kre kri kro ksg ksm ksn ktc kte ktl kuo kut kwa kwk kwn kwy kyl kyq kzy laa lab lac lag lan lao lat lbu ldo leb leg lel len let lew lgi lgu lic lil lin lit llm lmg lmh lmp lmu lnd lon lou luc luo luv ma maa mae maj mak mal mam mao map mas mau may mba mbe mbi mbl mbm mbr mbt mby mcd mch mcv mda mdg mdm mdo mds mdw mea mee meh mga mgk mgo mgu mhu mie miy mkd mkq mkz mla mlg mlm mlu mmb mmn mmv mna mnd mng moe mof mok mon moo mor mos mov mpo mpr mpu mrg mrl mro mrq mrt msk msm msq mtb mua mum mup mur mus mut mwb mwe mwo mxc mxe mxj mxo mxp mxy myg myn mzc nak nal nan nau nbe nbm nca ncm ndb ndi ndo ndr ndt ndu ndy neh ngd ngm ngo ngu ngw ngz nhh nhm nhn nht nia nif niu nke nkn nko nnc nne nng non noo nor nse nsg nto nua nun nup nuu nym nyn nza obg obo ocu oji olo ond one ood ora otm otr paa pai pal pam pat per pga pip pkn pkt plg plh plk pms png pnn pnu pod pog poh pol por pre psm psw pul pur qui qum rag rap rga rim rny rom ron rot rov rru rsu ruk rus rwe sah sak sal sam san sap scr sea seb sed see ses sgb sgl sgu sha shl shm shn shp shs sht shu sim sio sir sis siu skm sku sle slo sml smp sno so sob son spa squ srd sre ssa sti stn sud sul sun swa swe swt tab taf tag tah tai tal tan tas tat tbo tbw tee ten teo tep ter tes tet tgh tgk tgn tha tho tia tid tim tin tiv tiw tke tki tla tlp tmm tmn tmr tna tne tng tnk tno tob toz tpn tpr tps tri trm tsg tsi tsk tsr ttd ttn tuk tum txj tzo tzu ukr uld uli ura url urt ven vie vnm wal wam war wch wec wel wem wlf wlo wma wol wrb wrk wrm wrn wry wth wwa wya xam xar xbi xho xoo yag yao yap yay ycn yin yng yok yor yul ywl zai zan zap zch zhn zpr zqc zqo zqs zul zya zzo,705,76475,0.009218699
112A,Negative Morphemes,,112,Matthew S. Dryer. 2013. Negative Morphemes. In: Dryer; Matthew S. & Haspelmath; Martin (eds.) 2013. The World Atlas of Language Structures Online. Leipzig: Max Planck Institute for Evolutionary Anthropology. (Available online at https://wals.info/chapter/112),2,aab abi abn aco adg adn aeg agd agh ain ajg ala alb alc alk all aln alw amb ame amq ane ani anj ann anu apu ara arg arj arp asm asy au awa aym baa bag bao baq bar bbw bdm ben bfg bgo bgr bii bik bir bka blr blx bma bmb bnn bnu brf bri bsq bto bua bud bul bum bun bwc bzi cah cai cax cea cha chc chk chp chx ckl cle cmn cmy cnl cnt coo cos cpy cre crn cso cti cup cya dag dan dga dgb dgo dhr dhw diy dja dji djn djp dmk dni dsh dua duk dum dut dyi ega eip eka eng eno ese est eud ewo fre fye gaa gae gap gbb gbs gds geo ger ggu gmw gnn gok goo grf grj grk grr grs gud guh guj guu hat hau haw hay heb hil hin hna hun hup hve ice ige igs ik imo iqu iri irr isa ita iwm jab jak jaq jar jmo kaa kad kae kan kar kau kdz kel ken ker kfe kho khr kkv klm kls klv klw kmk kmz knb knc kni knn koi kor kos kre krj krr ksa kse kti kty kum kuo kut kwa kwn kwt laa lab lac lag lan lar ldu lel lgt lin lkt lmg lmn lon lui luo maa mac mad mal mam mas mau may mba mbt mby mcd mch mco mda mde mdm mdo mdw mea meh mer mga mgg mgi mgk mgu mhu mir miz mkl mku mlk mlu mmn mna mnd mni mnm mno mns mny moe mog moh mok mos mou mpo mpu mra mrd mrg mrh mri mrl mrt mrw msm msq mss mtb mtu mum mur mus mut mxc mxj mxo mxp myg myi nab nad nag naj nar nav nca ndj ndo neh nev nez ngi ngj ngm ngu ngw ngz nha nhh nhm nht nke nkk nnk nor nse nti nua nue nug nyi nyn nyu nza nze oji oks olo omi ond one ono ood osa oss otm paa pai pal pan par paw pba pip pkn plh pno pod poh pok pol por pul pur qim qum ram raw res rik rom rov rsu rus sah sam san scr ses sgb shl shp sht shu shy sid sim sio siu skw sla slb slo sme sml sna sng snn so sob som spa src srd sta sup swe tab tac tag tah tak tam tau taw tbo tbt tce tee ten tep ter tes tgh tho thy tid tim tiw tja tkl tli tmn tmo tmr tnn tno tny tou tpn trb trr tru tsg tsh tsk tsn ttn ttu tus tzo tzu ukr uld una ung urk urt usa wag wak wal wam wch wec wel wem wic wir wiy wlm wma wmu wom wor wrb wrd wrg wrm wry wsk wya xam xav yag yap yaq yei yid yin ylm yng yok yur yuw ywl zai zch zzo,502,76475,0.0065642367
92A,Position of Polar Question Particles,,92,Matthew S. Dryer. 2013. Position of Polar Question Particles. In: Dryer; Matthew S. & Haspelmath; Martin (eds.) 2013. The World Atlas of Language Structures Online. Leipzig: Max Planck Institute for Evolutionary Anthropology. (Available online at https://wals.info/chapter/92),6,aar abk acu adz aga ala alk aml ana ang ano apl apu apw ara arc arg arm arw ass ath azi bae baf bao bco bdm bej bgz bii bik bil biu bla ble bln blt bmb bod brm brn brs bsh bti bum bur cah cai can car cba chc chi chk chv cml cmy coa cpl cpy crp cub cup cze des deu dha die dim din dio diy djm dlm dni dsh dut eip emb ene eng eno epe erk fas fij foe fri ful gae gah gal gar gdb gds geo ger ghb gim gln gmw gmz gnb grj grw guj gum gyc hay hix hmi hoa hpd htc hua hya hzb idu igb ijo ing irq irr ita ito jak jmo jug kab kae kan kay kba kbl kch kem khi kik kis kje kkp klv klw kma kmh kmk kmn kmr kmz knc kni knm knn knr knw koe kok kol kor kqq krc kro kun kuo kuu kws kwz kyk lab lad lan lbu lez lho lin lis lmh lon lot luo mab mac man mao mar mde mdn meh men mer mgg mik mku mlg mna mnc mne mng mni mnm mov mra mrl mrt msc msg msl mts mtt mwo mxc nab nad naj nbd ndi ndj ndr ndy nga ngd ngk ngo ngt ngz nha nht nif nmb nnd nnk noc nor nph nua nyk ora orh osa paa pae pai pal par pau paw pdp pip pme pms poh ppi prk psh pso psw ptt puq qaw qhu qia qui rem rny rom rov ruk run ryu sah sal sar sea ses shl sia sid skw sml smn sna snm spa src sta stl sud sue sul svs swe syu tab taf tai tar tbt tbw tbx tel ten teo thy tid tir tke tml tmo tni tob ton tps tsf tsi tsz tte tuc tun tuy tvl uby udh uli una usa usr uzb vnm wak wao wap war wem wly wma wol wra wrg wrk wrn wtm xbi yal yap yid yko yng yor zag zay zaz zch zqc zzo,355,76475,0.00464204
72A,Imperative-Hortative Systems,,72,Johan van der Auwera; Nina Dobrushina; Valentin Goussev. 2013. Imperative-Hortative Systems. In: Dryer; Matthew S. & Haspelmath; Martin (eds.) 2013. The World Atlas of Language Structures Online. Leipzig: Max Planck Institute for Evolutionary Anthropology. (Available online at https://wals.info/chapter/72),4,abk aco aeg ain amh amr ana apl apu arm arp asm ava awp ayr bag bem ber bma brh brm brr bsq bur cah car cay cha chr chv cld cmn cnl coi cop cre crg csh cze die dig dre dsh dut eka emb eng epe err ewe far fre fur fye gar geo ger grw gum hai hay hin hlu hmd hmo hum iaa ice igb ika imo ind ita jav jpn kay kek ket kew kgm kio kiw kkn kmp kmu knr kok kor krb krt ksm kut kuv lad lan lat lav laz lez lit lkt lnd lno luo mab mac mak mam map mar may mdg mik miy mkn mku mle mlt mme mna mnd mon mop mrd mrl mro mrt msg msl mul mxc myi mym nav nbd ngl nim nor nun obo oix ong orh otm pai pau pec pip pit pms pol por ppi pso pta pur qim rus scr sdw see shk shl shu slo sml snh snm so spa squ stn sue sug swe tag tgr tha thk tir tiw tja tms tsa tsf tuk ukr uma urk url vie wau wch wel wlo wrk yah yaq yur zqc,201,76475,0.00262831
2A,Vowel Quality Inventories,,2,Ian Maddieson. 2013. Vowel Quality Inventories. In: Dryer; Matthew S. & Haspelmath; Martin (eds.) 2013. The World Atlas of Language Structures Online. Leipzig: Max Planck Institute for Evolutionary Anthropology. (Available online at https://wals.info/chapter/2),3,adk agh aiz akn akw ala alb ald amh amo amz anc api arp awn aze bag bai bam bbf ben bet bir bki bkr bra brb bre brm brr brw bsk chq chv chw cnl cnt cyv dan dgr din dio dni dnw don doy dre dts dum efi eja eng epe ewe ewo fef fin fre ful fuz ga gan gbb ger gla grb ham hun hzb iaa igb ijo ik ika imo irr iso jav jeh jom kas ket kfe kgz kha khm kkn kla kmu kng knr kob koh kom kor kpe krd kro ksg kss ktk kwo kyl kzy lah lan lep llm lu lua lug luo maa mab mba mie mla mme mrl mro mtp nan nax nbk ndt nga nis nkt nnc non nor nti nyg nyi ogb otm pac phl pnr poa poh puk rom sab san sdh sed skp sml snd snh snm snt som sre srn sui sup tha tib tks tma tmn tmp tne tug tul tun tur tuv una vie wlf wnt woi wrs wuc yap yel ykt yor yul zan,184,76475,0.002406015
89A,Order of Numeral and Noun,,89,Matthew S. Dryer. 2013. Order of Numeral and Noun. In: Dryer; Matthew S. & Haspelmath; Martin (eds.) 2013. The World Atlas of Language Structures Online. Leipzig: Max Planck Institute for Evolutionary Anthropology. (Available online at https://wals.info/chapter/89),1,ace aga agc agd ain ala alb als amh ami amk amr ams ani apu ara arc arg arm aro arp arq arw ata ath ava awa awp aym ayo aze bae baq bch bel bfg bho bii bil bkr bkt bla bln bma bre brf brs bsk bsq btk bul bur but bwc bya cak cam car cav cay ccm cde cha chc chd che chh chj chk chn chp chq chr chv ckl cld cle cln cmh cml cmn cmy cnt coc coo cop cor cpl cpn cpy crn crp cso cub cuc cup cya cyv cze dam daw der dgr dhi dhm dom don dre drg drm dsh dut eme eng est eve fij fin fre gae gam gds gel geo ger gjj gku gla gnb goa god gok gon goo grf grk gua guj hak hal haw heb hil hin hix hlu hmi hmo hoa hop hpd htc hua hun hup hwr hzb iaa iba ice ifu ijo ind ing iqu iri ita ite iwa jak jaq jiv joh jpn kan kas kay kbt kdz ket kgu kgz kha khg khl kho khr khs kio kiw kkp kkt kku klm klr klv kma kmh knb knd knn kno kol kop kor koy kpm krb krc krd kre kri krk krn krz ktu kty kum kuo kut kuv kwa kwo kxo kya kyz kzy lac lat ldu lec lez lgu lic lim lit lmn lmp lui mac mag mai mam map mau mco mcv mds men mer mgg mhi mie min mis mmn mna mnd mng mns moh mpr mrc mrq mrt msq mss mto mun mus mxc mxj mxo mxp mxx mxy mym naj nas nav nca ndy neh nep nev nez ngw nhh nhm nhn nht niu nne nor nsg nti ntu nun nyu obg ocu oji ood ord ork oss otm pae pal pam pan pba pip pir pkn plk pmn pnn pno pnu pny pol ppc pra prs psh pso ptt pul pur pwn qaf qhu qim qui qum rap rem res ret rom rov rpa rsu ruk rus rut rwe saa sal sar scr sec sed see shb shi shk shp sid sin sir sis siu skp slo sml smp sna som son spa squ src srd sre sta stl sun svs swe taf tag taj tar tat tbo tee tel teo tep tgh tgk tgr thn tho thu tic tim tin tiw tkm tla tli tlp tls tml tni tnk tob tpn tpt tri tru trw tsf tsh tsi tsk tsz ttu tuc tul tur tuy tvl tvo twe tzu uby udi udm ukr uli urd urk urn usr ute uzb vaf vie wak was wch wel wic wlf wlo wly wme wol wrd wrk wrw xar yag yap yaq yay yei yin yko yng yny yok ytu yur zai zap zay zaz zch zen zhn zun zya zzo,479,76475,0.0062634847
12A,Syllable Structure,,12,Ian Maddieson. 2013. Syllable Structure. In: Dryer; Matthew S. & Haspelmath; Martin (eds.) 2013. The World Atlas of Language Structures Online. Leipzig: Max Planck Institute for Evolutionary Anthropology. (Available online at https://wals.info/chapter/12),2,aco agh aik ain akn akw ald ame amh amo amp amu ani ant ao arb arp asm awn aym aze bag bai baj baw bee ber bet bir bis bkr bng bod brm byu cac cad car cax cck cha che chp cil cle cmn cnt cre cti dad dag dan dar ddf der det dgb din diy dni dnw don dre dyi efi eja epe eve ewe ewo fef fin fur fuz fye ga gan gar gbb gds gla gmb goo grr grw hak hau hix hmo hmr hok htc hve hzb iaa iba igs ika irq irr irx iso ito iva jak jaq jeb jng jom jpn jpr kad kal kay kch ked kef ker kfe kgu kho khr kio kkv klv kmp kng knk knm knr koa kob kom kor kpe krb kro ksg kss kty kul kun kwo kya kyl lah lan lav len lkk lu lua lug luo maa mal map max mbb mei mgg mla mnd mne mrd mrl mro mrt mss mum mun mya mzc nai nan nar nav ndt ndy new nga ngi ngz nhn nht nko nnc nob nug nyg nyi ogb orh pac pai paw pec phl pit pms pnr poa puk pur ram res ruk sdw sed sha shi shk shs skp sla sml snm som sor spa sui sup tag tam tel ter tgk tgr tha tib tiw tma tmn tok tol ton tru try tsg tur una ung urk usa vie wah wam war wch win wma wmu wnt woi wps wrs xoo yag yap yaq yaw yay ycn yes yey yid yim yko yny yul yus zul zun,274,76475,0.0035828701
144A,Position of Negative Word With Respect to Subject; Object; and Verb,,144,Matthew S. Dryer. 2013. Position of Negative Morpheme With Respect to Subject; Object; and Verb. In: Dryer; Matthew S. & Haspelmath; Martin (eds.) 2013. The World Atlas of Language Structures Online. Leipzig: Max Planck Institute for Evolutionary Anthropology. (Available online at https://wals.info/chapter/144),19,adg adz aeg ame ao arp bbu bel bgo blx bmb bok bol chi chj chr cop dma ewo fre fye gbb guh hau hlp khg klw kma kmb kre kwo kwt kyz lew lmg mab mbe mgk mka mku mum mup mxe niv nke nph one paa pkt plh rap run rwe sup tar tbt ter tgl tid tja tmn tsh tsk urt woi zch,67,76475,0.0008761033
50A,Asymmetrical Case-Marking,,50,Oliver A. Iggesen. 2013. Asymmetrical Case-Marking. In: Dryer; Matthew S. & Haspelmath; Martin (eds.) 2013. The World Atlas of Language Structures Online. Leipzig: Max Planck Institute for Evolutionary Anthropology. (Available online at https://wals.info/chapter/50),3,ana arm bri bul bur dag dut eka eng fin frw gim goo hai hve ilo ita kob kse kty lep lit mal mau mku mlk nti nug pai psh rom shk sml snm sno spa sue swe tag tli tsi tts una urd usa was win wra wrd yko yur zun,53,76475,0.00069303694
