parameter_id,parameter_name,parameter_description,chapter_id,chapter_citation,value,same_value_language_ids,value_language_count,language_count_total,count_ratio
16A,Weight Factors in Weight-Sensitive Stress Systems,,16,Rob Goedemans; Harry van der Hulst. 2013. Weight Factors in Weight-Sensitive Stress Systems. In: Dryer; Matthew S. & Haspelmath; Martin (eds.) 2013. The World Atlas of Language Structures Online. Leipzig: Max Planck Institute for Evolutionary Anthropology. (Available online at https://wals.info/chapter/16),6,abk asm bkl bqg bqi bqz bso bur des dob eka grb grk hnn ita kew knm koo ktn kut lit mnd nez por pur rom rus sao sla spo sps tag tur usa wiy woi yuc,38,76475,0.0004968944
143G,Minor morphological means of signaling negation,,143,Matthew S. Dryer. 2013. Order of Negative Morpheme and Verb. In: Dryer; Matthew S. & Haspelmath; Martin (eds.) 2013. The World Atlas of Language Structures Online. Leipzig: Max Planck Institute for Evolutionary Anthropology. (Available online at https://wals.info/chapter/143),4,aab aar aba abi abk abn abu abv ace acg acl acm aco acu adg adi adz aeg agb agc agd agh agm ain aja ajg akh akn ala alb alk all aln als alw aly amb amc ame amh aml amn amo amp amq amr ams amt amx ana anc ane ang ani anj ann anu any ao aoj apl apt apu apw ara arc arg arj arm aro arp arq arw asm ass asu asy ata ath au ava awa awe awp awt aym aze azi baa bab bac bae baf bag bai baj bak bam bao baq bar bas baw bbf bbl bbu bbw bch bco bdm bej bel ben ber bfg bgn bgo bgr bho bia bid big bii bik bil bio bir biu bka bkr bku bla bln blr blt blx blz bmb bmz bni bnn bnu boa bob bod boi boj bok bol bra bre brf brh bri brl brm brn brp brr brs bsh bsk bsq bti btk bto bua bud bug bul bum bun bur bus but buw buy bvi bwc bya bzi cah cai cak cam can car cas cax cay cba cbo ccm cct cde cea cem cga cha chb chc chd che chg chh chi chj chk chn chp chq chr chs chv chw chx cic ckl cle cln cmh cml cmn cmr cmy cnl cnm cnt coa coc coo cop cos cpl cpn cpy cqt cre crn crp crt cso cti ctm cub cui cup cya cyv cze dag dan dds des deu dga dgb dgo dgr dha dhi dhm dhw did die dig dim din dio diy dja dji djm djn djp dma dmi dmk dms dni dom dre drm dsh dua duk dul dum dun dut dyi ebi efi ega eip eka eko emb eme ene eng eno eny epe erk err ese est eud eve evn ewe fij fin fon fre fua ful fur fut fye ga gaa gae gah gal gap gar gav gbb gbs gds gel geo ger ggu ghr gim gir giz gjj gku gla gln gmw gmz gnb goa god goe gok gon goo grb grf grj grk grr grs grw gua gud gug guh guj gul gur guu gwa gwo gyc hai hak hal ham han har hat hau haw hay hdi heb heh hei hid hil hin hix hlp hlu hma hmi hmo hna hnd hoa hol hop hpd htc hua huc hui hum hun hup hve hya hzb iaa iau iba ice idn ido idu ifm ifu ige ign igs ijo ik ika ila imo ina ind ing inn iqu iri irq irr irx isa ita ite iwm izi jab jak jaq jar jeb jiv jlu jmo jms jng joh jpn juh juk kaa kab kac kad kae kan kar kas kau kay kba kbl kbo kbw kby kch kdw kdz kel kem ken ker ket kew kfe kga kgr kgy kha khd khg khl khm khn kho khr khs kie kik kil kim kin kio kir kiw kkp kkt kkv kla klg kll klm kls klv klw kma kmb kmh kmi kmj kmk kmn kmo kmp kmr kms kmu kmw kmz knb knc knd kng kni knk knm knn knr knw knz koa kob koe koi kok kol kom kon kop kor kos koy kpw krb krc krd kre krh kri krj krk krn kro krr krw kry ksa kse ksg ksn kta ktc kti ktl kty kum kun kuo kus kut kuv kwa kwb kwn kwo kws kwt kwy kwz kxo kya kyl kyp kyq kyr kyz kzy laa lab lac lad lag lah lai lal lan lao lar lat lav lbu lda ldo ldu leb lec leg lel len lep les let lew lez lgi lgt lgu lho lic lim lin lis lit lkt llm lmg lmh lmn lmp lmu lnd lng lon lot lou luc lug lui luo luv ma maa mab mac mad mae mag mai maj mak mal mam man mao map mar mas mau maw may mba mbe mbi mbl mbm mbr mbt mby mcd mch mco mcv mda mde mdg mdl mdm mdn mdo mdw mea mee meh mei mek men mer mga mgg mgi mgk mgu mhi mhl mhu mie mig mii mik min mir mis miy miz mka mkd mke mkg mkh mki mkj mkl mku mkz mlg mlk mlu mmb mme mmn mmv mmw mna mnc mnd mne mni mnm mno mns mnt mny moe mog moh mok mom mon moo mor mos mot mou mov mpa mpo mpt mpu mra mrd mrg mrh mri mrl mro mrq mrr mrs mrt mru mrw msc msg msk msl msm msn msq mss mtb mts mtu mua mug mui mum mun mup mur mus mut mwb mwe mwo mxc mxe mxj mxo mxp mxx myg myi mym mzc nab nad nag nah naj nak nal nam nan nar nas nav nax nbd nbm nbr nca ncm ndb nde ndj ndo ndr ndt ndu ndy neh nep nev new nez nga ngd ngi ngj ngk ngl ngm ngn ngo ngt ngu ngw ngz nha nhh nhm nht nia nif nis niu niv nke nkk nkn nko nku nma nmb nmm nne nnk noc non noo nor nph nrg nse nsg nsn nti ntj nto ntu nua nue nug nun nup nyh nyi nyk nym nyn nyr nyu nza nze obg obo ocu oir oji oks olo omh omi ond one ong ono ood ori ork oro orw osa oss otm otr oya paa pae pai pal pan par pat pau paw pba pec per pga pia pip pis pit pkn pkt plg plh pme pms png pnn pno pnu pod pog poh pol por ppi pra pre prh prk prs psh psj psm pso psw ptt ptw pul pum pun pur pwn qaw qhu qia qim qui qum rag ram rao rap ras raw rem res ret rgc rik rim rit rnd rny rom ron rot rov rpa rru rsu ruk rum run rus rwa rwe sah sak sal sam san sap sar saw sba scr sdw sed see sel sem ser ses sgb sgl sgu shb she shh shi shk shl shm shn shp sht shu shy sia sid sil sin sio sir sis siu skk skm skw sla slb slo sme sml smn sna sng snm snn sno snt so sob sod som son sor spa squ srb src srd sre sro ssa sta sti stl stn sub sud sue sug sul sun sup svs swa swe swt syu tab tac taf tag tah taj tak tal tam tan tao tar tas tau taw tba tbo tbt tbu tbw tbx tce tdr tee tel ten teo tep ter tes tet tgh tgk tgl tgo tgr tha thn tho thu thy tib tid tig tim tin tir tis tiv tiw tja tke tki tkl tla tli tlo tlp tma tml tmm tmn tmo tmr tna tnc tne tng tnn tno tny tob tod tol ton tou toz tpa tpn tpr tpt trb tri trm trr tru tsf tsg tsh tsi tsn tsz tte ttn tts ttu tuc tuk tul tun tur tus tuv tuy tvl twe twn tye tzo tzu uby udh udi udm ukr uld uli una ung urd urk url urn urt uru usa usr ute uyg uzb vai ven vie vnm wag wah wai wak wal wam wao wap war was wat wau way wbn wch wec wed wel wem wic wik win wiy wlf wlm wlw wly wma wme wmu wna woi wol wom wor wra wrb wrd wrg wrk wrl wrm wrn wsk wtm wya xam xar xav xbi xho xns yag yam yao yap yaq yar ybi yei ygr yi yid yim yin yiw yko ykt ylm yng yok yor ypk yqy yrm yrr ytu yuc yuk yul yur yuw ywl ywr zag zai zan zap zar zay zaz zch zpr zqc zqo zqs zul zun zzo,1315,76475,0.017195161
97A,Relationship between the Order of Object and Verb and the Order of Adjective and Noun,,97,Matthew S. Dryer. 2013. Relationship between the Order of Object and Verb and the Order of Adjective and Noun. In: Dryer; Matthew S. & Haspelmath; Martin (eds.) 2013. The World Atlas of Language Structures Online. Leipzig: Max Planck Institute for Evolutionary Anthropology. (Available online at https://wals.info/chapter/97),4,aab abu acg acl adi adz aeg agb agh akn alb alk aln ama aml amo amq amr ams anc ane anj anu aoj arg arj aro arq asy au ayi ayo ayw bab bae baf bag baj baq bar bas bbl bch bdu ber bfg bia bid bik bir bkr bku ble blu blz bma bni bnk bnn bra bre brf brn bsh bto bub bud bum buu bvi bwc cax ccm cem cga chq chr chw cic cle cme coc cop cor cpl crn cso cya day dga dgb did dio dma don doy dre dua duk ega egn eno erk err ewe ewo fij fni fon fre fua fut fye ga gae gel gjj gla gnd goa goe grb grf grr gto gua gul guw hal hat haw hdi heb heh hem hmo hna hnd hoa hol huc hya iba ifm igb ige igs ik ila ind iqu iri irr ita jab jar jmo juh juk kam kar kau kba kbl kbw kby kch kdz kel ker kfe kga kgr khm khs kik kin kir kje kkt kkv klv kmj kmu koe kom kon kos kpw krb kri kro ksg ksn ktc kte ktl kuo kwa kwn kwy kyl laa lab lag lan lao lbu ldo leb lel len let lew lgi lgu lic lin llm lmg lmh lmp lon lou luc luo luv maa mae mal mao mas may mba mbe mbi mbl mbm mbr mbt mby mda mdg mds mdw mea mee meh mga mgk mgo mgu mie miy mkd mkz mla mlg mlm mlu mmb mmv mna mng mof mok mon moo mor mpo mpr mpu mrg mrl mro mrq mrt msk msm mtb mua mum mup mur mwe mwo mxc mxe mxj mxo mxp mxy myn mzc nak nal nan nau ncm ndb ndi ndo ndr ndt ndu neh ngd ngm ngo ngu ngz nhh nhm nht nia nif niu nkn nko nnc non noo nse nto nua nun nup nym olo otr pai pam pat per pga pkt plg plh plk pms png pnu poh por pre psw pul pur rag rap rga rny rom rot rov rru rsu sah sak sam sap sea seb sed ses sgb sgu shl shm shn sht sim sio sis sku sle sml so sob spa srd sre sti sud sul sun swa tab taf tah tat tbo tbw ten teo ter tes tgk tgn tha tia tid tim tlp tmm tmn tmr tna tne tng tnk tno toz tpr tps tri tsg tsk ttd ttn tuk tum uld uli ura url urt ven vie vnm wal wch wel wlf wlo wma wol wrk wrm wth xam xbi xho xoo yag yao yap yay yor yul zai zap zul zya zzo,456,76475,0.0059627327
144G,Optional Double Negation in SVO languages,,144,Matthew S. Dryer. 2013. Position of Negative Morpheme With Respect to Subject; Object; and Verb. In: Dryer; Matthew S. & Haspelmath; Martin (eds.) 2013. The World Atlas of Language Structures Online. Leipzig: Max Planck Institute for Evolutionary Anthropology. (Available online at https://wals.info/chapter/144),4,,1,76475,0.000013076169
138A,Tea,,138,Östen Dahl. 2013. Tea. In: Dryer; Matthew S. & Haspelmath; Martin (eds.) 2013. The World Atlas of Language Structures Online. Leipzig: Max Planck Institute for Evolutionary Anthropology. (Available online at https://wals.info/chapter/138),2,ace afr alt arm ast bal bdg bre bru ccp chp cic cmh crh cua dga dio dsh dua dut eng est ewe ewo fin fre gdl ger gml grt gua heb hok hre hun ice ind iri ita jav juh keu khm knr koi kos lat lin lmp lux mal mao mdr min mks mlt mnt msh mss nor nyl occ poh pro qay rbg rlo rmc ses snh sno spa sra sun swe tah tel tsw wel wlo xho xoo yor,84,76475,0.0010983981
71A,The Prohibitive,,71,Johan van der Auwera; Ludo Lejeune (Valentin Goussev). 2013. The Prohibitive. In: Dryer; Matthew S. & Haspelmath; Martin (eds.) 2013. The World Atlas of Language Structures Online. Leipzig: Max Planck Institute for Evolutionary Anthropology. (Available online at https://wals.info/chapter/71),3,abb abk aeg amo amr anl ath bbl bma bud cah ccm cle cmh cor cte dam des dmi est evn fye glc goo ita jak jaq kte lin lno mak meh mhu mos mrt nng pny por rom sgl spa srd sva ter tgr tna tru tuy vai vot wrd wth yur zen,55,76475,0.0007191893
74A,Situational Possibility,,74,Johan van der Auwera; Andreas Ammann. 2013. Situational Possibility. In: Dryer; Matthew S. & Haspelmath; Martin (eds.) 2013. The World Atlas of Language Structures Online. Leipzig: Max Planck Institute for Evolutionary Anthropology. (Available online at https://wals.info/chapter/74),2,abk ace aeg ain akn alb amh amr apu arg arm aym bab bag bal bam baw bej bma brs cle cnt cre cyv dre dsh dut eng ewe far fij fin fre fue geo ger grk hau haw heb hin hmo hzb ice igb ing iri irq ita kam kas ker ket kfe kha khm kho khs kmu knd knm knr kol kon krb kro kse kty kui lak lan lat lep lez lin lit lkt mai mak mal mao map may mcd mde mdg meh mhi mie mku mlt mna mnd mns mok mrl mun mxc mym ndy ngi niv nko ntu ond orh otm pan pau pba pol por prs psm qim rap rka rom rus san scr sel shk slo sml snm sno som spa sue sup swe tab tbu tel tgr tha tja tor tru tuk tun tuv tvl tvo udh vie vot wch wel wic wlf yaq yko yor zqc zya,158,76475,0.0020660346
130A,Finger and Hand,,130,Cecil H. Brown. 2013. Finger and Hand. In: Dryer; Matthew S. & Haspelmath; Martin (eds.) 2013. The World Atlas of Language Structures Online. Leipzig: Max Planck Institute for Evolutionary Anthropology. (Available online at https://wals.info/chapter/130),2,abi abk abm abw acg acm acu afr agr aht akr ale alg amh amk amr amu apc api apj ara aro arw arx atq ats awa awp aym ayo aze bab bae bam bca bem bgr bkd bkl bla blj blr blx bno bnq bnv bok bor bpb brc bre brs bsq btk bur but cab cac cai cak cam cap car cas cat cav cax cay cch cck cct ceb cec cha che chi chj chl cho chp chr chu chw cin cla clc cle cma cmh cmn cmy cnl cnt cof cog col cor cpa cre crg crk crl crn cro crp crq crt csf csh csk ctc ctt ctw cub cui cur cut cuu cyn cze dak dam dca des dgx dig djp dre dsh dut efi eka emb ena eng ese eve eya fij fin for fox fre fut gad gae geo ger ghb gid git gjj gku gmb gna gno goa gre grk grm gto gua gul guu gyb hai hau heb hid hil hmb hmd hmi hmu hop hpd htc hui hum hun hve ifu igb ik ika ill ilo ind iql iri ita itw itz ixc ixi jak jeh jmo jpn juh kas kat kaz kdg kdz kea kek kew kfe kgt kgz kha khg khk kic kio kis kje kky klm klw klz kmh kmk knc knd kng knr koa kon kor kos kpn krc kro ktb kth ktu kul kun kuq kut kwa kwe kws kyn lao lau len lez lit lnw lui lus mab mai mal mao map maz mby mcg mch mcn mco mcs mcv men mer mgg mhc mhi mic mid mij mis miz mjc mkb mnc mnd mne moc mog moj mok mop mos mov mpy mrt mse msh mss mtg mti mtp mtt mui mum mup mut muy mwb mwl mxg mxu myi mym myo myr mzc nas nbd nbr nep ngn nht nhu nhx niu nju nko nkr nlu nne nnm nog nom nor npa nro nsk nsn nsz ntj nuk nun nuu nya nym oca oji oka oko olu ood ore osa osm owc pae pal pan pcm pem per pia pip pir pla pme pnn pno poh pol por pow ppc prt psj psm psv pui pul pur qan qaw qca qch qec rad ram rap res ret rgn rng rnn rom rus sal sam say sba scr sea sec sed sel shk shl shn sho shu shw sin sla slv smj smt snh sno sol son spa spo squ sri sss stl sum sus sva svk swa tac tag tar tbe tce teh tga tha tib tic tkm tlf tlp tml tna tnb tnj tnl toa tob toj tol tos tpa tpi tpt trb trc tsf tsg tsh tsi tsj tsw tty tub tuc tup tur tus tut tuy tvo twn txj tze tzo tzt udh uhi ukr ute uzb ved wap way wch wel wem wic wir wiy wmu wol wra wrd wth wwr xar xer xoo yah yak yap yar yav ycn yct yki ypk yrt yus yyo zai zaj zam zap zfl zqc zqr zqs zul zun zzo,521,76475,0.006812684
1A,Consonant Inventories,,1,Ian Maddieson. 2013. Consonant Inventories. In: Dryer; Matthew S. & Haspelmath; Martin (eds.) 2013. The World Atlas of Language Structures Online. Leipzig: Max Planck Institute for Evolutionary Anthropology. (Available online at https://wals.info/chapter/1),3,aea agh aik aiz akn alb ald alw amo amu amz ana ata aze bam baw bbf bej ber bet bir bra bre brh brw bsq bul cad cah cam cay ccp cha chu chv chw cil cle cnt cti dan ddf dgb dgr die din dio diy diz djp dnw don doy eja eng fij fre ful gan ger goo grb grk grr grw gwa hmr hok hop htc hve iba ign igs ijo ind irx ito iva jav jeb jng kad kef kek ker kgu kgz kha khm khs kio kkn klv kmu knk knm knr kob kom kor kot koy kpa kpe kro kul kur kwo kws kyl lkt llm lu lua lui maa mab map mar mba mbb mei mgg mla mme mnd mog mpa mrl mro mrt mui mum mzc nap nar new nga nko nmb non nor nug nun ogb ood orm otm pac pai pau phl prs qaw rom rsc ruk sab sba sel sha snd snh som spa srn sup tam tha tiw tks tlp tma tmp tol tru tug tuk tul tur tuv tza umb una uzn vie wch wic wiy wuc yan yap yay yct yko ykt ytu zan zun,201,76475,0.00262831
87A,Order of Adjective and Noun,,87,Matthew S. Dryer. 2013. Order of Adjective and Noun. In: Dryer; Matthew S. & Haspelmath; Martin (eds.) 2013. The World Atlas of Language Structures Online. Leipzig: Max Planck Institute for Evolutionary Anthropology. (Available online at https://wals.info/chapter/87),2,aab aar abk abn abo abu abv ace acg acl adg adi ady adz aeg agb agh agm agt ajg akh akn alb alk all aln aly ama amc ame aml amn amo amp amq amr ams amx ana anc ane ang anj ano anu any ao aoj api apl apt apu arg arj aro arq asm asy atm au awe awi awt awy ayi ayo ayw baa bab bae baf bag baj bam baq bar bas baw bbf bbl bch bdm bdu bdw bem ber bfg bfi bgm bid bik bin bir biu bkr bku ble bln blu blx blz bma bni bnk bnn bok bon bra bre brf bri brl brm brn brp brq bry bsh bsi bsq bsr bto bub bud buj bum bun bus buu bvi bwc cai cas cav cax cbo ccm cde cem cga chb chi chq chr chw cic cld cle cme cmr cnl cnm coc cop cor cpl crn cro crp cso cti ctm ctw cui cup cya dag dan daw day ddj dds dga dgb dgo dha did dig dim din dio diy dji djn dma dms don doy dre dua duk dum dun dyi edo ega egn els emb eme emm eno epe erk err ese ewe ewo fas fij foe fon fre fua ful fur fut fye ga gaa gae gan gar gav gel ggu ghr gjj gku gla gln gmw gnd gnn goa goe goo grb grf grr grw gto gua gug guh gul guu guw gwa gyc hai hal ham har hat haw hdi heb heh hem hid hix hlp hma hmo hna hnd hoa hol hpd huc hup hwr hya iba idn ifm igb ige igs ik ika ila imo ina ind inn iqu iri irq irr irx isa ita jab jad jar jbt jel jin jlu jmo jms jng jrw juh juk jva kaa kae kam kar kau kba kbl kbo kbw kby kch kdz kel ker kfe kga kgr kgu kgy khd khm khs kie kik kin kir kis kje kkt kkv kll klq klv klw kma kmb kmi kmj kmn kmo kmp kmu kmw kmz knc kng knm kno knr knz koa kob koe kok kom kon kos kpe kpw kqq krb krd krh kri krk kro krr kse ksg ksn kta ktc kte ktl ktu kuo kuu kwa kwb kwm kwn kwy kwz kya kyk kyl kyn kyo kyz laa lab lad lag lal lan lao lar lav lbu lda ldo leb lel len lep les let lew lgi lgt lgu lic lin lis lkt llm lmb lmg lmh lml lmp lon lot lou luc lug lui luo luv luy maa mab mac mad mae mal man mao mar mas maw may mba mbe mbi mbl mbm mbo mbr mbt mby mda mde mdg mdl mdn mds mdw mea mee meh mek mey mga mgk mgo mgq mgu mhk mhl mie mii mij min mis miy miz mka mkd mke mkg mkj mku mkz mla mlg mlk mlm mlu mmb mmv mmw mna mng mnm mnv moa mof mok mon moo mor mot mou mpa mpo mpr mpt mpu mra mrg mrh mrl mro mrq mrr mrt mru msc msk msl msm msn mtb mts mtu mua mud mum mup mur mwe mwo mxa mxc mxe mxj mxo mxp mxy myi myn myr mzc nab naj nak nal nam nan nar nat nau nav nax nbd nbr ncm ndb nde ndi ndj ndo ndr ndt ndu neh ney ngd ngg ngj ngk ngl ngm ngn ngo ngt ngu ngz nhh nhm nht nia nif niu nkb nkk nkn nko nku nma nnc nnd nng nnk noc non noo nph nrg nse ntj nto nua nue nun nup nus nyh nyi nyk nym nze olo omh omi orh ori ork oro orw ory osa otr pae pai pam par pat pau per pga pia pir pit pkt plg plh plk pms png pnu pnx poh pok por ppi pre prh prs psw pul pum pun pur qia rag ral ram rao rap ras raw rga rgc rny rom rot rov rru rsu rum run rwa saa sah sak sam sap sdw sea seb sed sem sen ses sgb sgu she shi shl shm shn sht sia sil sim sio sis skk sko sku sla slb sle slp sme sml smn sng snm snn snt so sob som spa spi src srd sre srn sro sti sud sue sug sul sun sup swa syu tab taf tah taj tak tao tat tau taw tba tbl tbo tbt tbu tbw tdi tdr ten teo ter tes tgk tgn tgo tha thd thy tia tib tid tik tim tkl tlf tlp tma tmm tmn tmo tmr tna tnc tne tng tnk tnn tno tny ton toz tpr tps trb tri tsg tsk tsm ttd ttn tuk tum tun tvl uhi uld uli una ung ura urk url urn urt usa ute vaf vai ven vie vif vnm wag wah wal wap wat wbn wch wed wel wic wiy wlf wlo wma wmu wn wna wog woi wol wom wra wrd wrk wrl wrm wsk wth xam xas xbi xer xho xoo yag yal yam yao yap yay yel yi yid yiw yor yrm yuc yul zag zai zap zar zaz zul zun zya zzo,879,76475,0.011493952
143E,Preverbal Negative Morphemes,,143,Matthew S. Dryer. 2013. Order of Negative Morpheme and Verb. In: Dryer; Matthew S. & Haspelmath; Martin (eds.) 2013. The World Atlas of Language Structures Online. Leipzig: Max Planck Institute for Evolutionary Anthropology. (Available online at https://wals.info/chapter/143),1,abi abn abu ace acg acl acm aco adg agc agd agh ain ajg akh ala alb all als alw amb ame aml amn amo ams amx anj any aoj apu apw arg arj aro arp asy ata au awa awp aym baa bab bac bae baf bai baj bam bao baq bar bbf bbw bch bco bdm bfg bgo bho bid bii bil bkr blr blt bmb bmz bni bnn bnu bob bod boi bok bra bre brf bri brp bsq btk bto bua bug bul bun buw buy bvi bwc cah cai cak cax cea cem cha chc chd che chj chk chq chr chx ckl cle cmh cmn cmy cnt coc coo cos cpy cre crn crt cso cui cup cya dag dan dga dgb dgr dha dhw did din diy dja dji djm djn djp dma dmk doy dre dsh dua dut dyi ebi eip eka ene eng eno erk est eud eve evn ewe ewo fij fin fon fre fut fye gaa gae gap gav gbb gds gel geo ger ggu ghr gir gmw goa gok goo grb grf grj grk grr grs gua gud gug guh guj guu gwa hai hak hal han hau haw hay heb hei hil hin hlp hlu hmo hoa hop htc huc hun hup hve iaa iba ice idn ido ifm ifu ign ik imo ina ind inn iqu iri ita ite izi jak jaq jlu jng joh juh kad kae kan kbl kch kdz ket kfe khm khn khr khs kio kir kis kiw kkt kla klm kls klv klw kmk kms kmu kmw knb knc kni knk knn koe koi kom kop kor kos krb kre krj krk kro ksa kse ksg ksn ktc ktl kty kum kuo kut kwa kwb kwn kwo kws kwt kya kyq kzy lac lah lal lan lao lar ldu lgu lho lic lis lmu lou lui luo mae mai maj mak mal mam man mao mau maw mbe mbi mbt mcd mch mco mde mdl mdm men mer mga mgg mgi mgk mhu mie min mir miy mka mkg mkj mkl mku mlk mme mmn mna mnd mni mnm mno mns mnt mny moe mog mok mom mon moo mos mov mpa mpo mrd mrh mri mrl mro mrq mrr mrt mru mrw msk msn msq mss mtu mum mun mup mur mus mut mwb mwo mxc mxj mxo mxp myi nab nag nah naj nak nal nar nav nax nbr nca ncm ndj ndo ndr ndy neh nev nez nga ngd ngi ngj ngk ngu ngw nha nhh nhm nht nia nif niu nke nkk nne non nor nsg nti ntu nue nug nun nyi nyk nyn nyr nyu oir oji oks omi one ono ood oro orw oss otm otr paa pai pal pan par pau pba per pip pis pkn plg plh pnn pno pnu poh pol por ppi psm pso pul pun pur qhu qim qui qum rag ram rap raw res rik rom rot rov rpa ruk run rus rwa rwe sam sap scr sed see ses shl shp shu sid sil sir sis siu skw slb slo sml sna sng snn sno so sob som son spa squ src srd sre ssa sta sti stl stn sud sue sun sup svs swe tac taf tag tah tak tam tau taw tbo tbt tbx tce tee ten teo tep ter tes tgh tgk tgo tha tho thu thy tid tim tin tiw tja tke tkl tla tli tmm tmn tmo tmr tnc tng tnn tno tny tol tou tpa tpn tri trr tsg tsh tsi tsk tsn ttn ttu tuk tus tvl twe tye tzo tzu udh ukr uli una ung urd url urt uru usa vai vie wag wah wak wal wam war wat wch wed wel wem wic wik win wiy wlf wlm wlw wmu woi wol wor wrb wrd wrg wrk wrl wsk wya xam xar xbi xns yag yap yaq yei yi yid yin yiw ylm yng yok yor yuc yuk yur yuw ywl ywr zai zar zch zpr zqo zqs zun zzo,682,76475,0.008917947
143F,Postverbal Negative Morphemes,,143,Matthew S. Dryer. 2013. Order of Negative Morpheme and Verb. In: Dryer; Matthew S. & Haspelmath; Martin (eds.) 2013. The World Atlas of Language Structures Online. Leipzig: Max Planck Institute for Evolutionary Anthropology. (Available online at https://wals.info/chapter/143),1,aab aba abu abv acl adg adz agh agm aja ajg alk aln aml amo amq anc ane ani anu aoj ara arp asm au ava bab bag bak bas baw bbf bbu ben bgo bgr bid big bii bik bir bka blt blx bmb bob bod bok bol bre brm bud bum bus buy bzi cai cak chj chp chr chs chw cmr cnl cop cti dgo die dma dni dsh duk dum dut ega eip eka erk ese ewe ewo fre fye gbb gbs ger giz gla gmz goe gua gul gwa gwo hal hat hau hdi hlp hma hna iau ice ido ifm ige igs irr isa iwm jab jar jmo juk kaa kar kau kbl kbw kel ken ker kho kie kim kis kkv klw kmk kmz kng knk kpw kre krn kro krr ksg kti ktl kwy kxo kyl kyp laa lab lag lai lbu ldu lel len lew lgt lin lkt lmg lmh lmn lmu lnd lon lou lug luv ma mac mad mas may mba mbe mbm mbr mbt mby mda mdg mdo mdw mea meh mek mgk mgu mhi mig min miy miz mka mku mlu mmb moo mor mou mpu mrg msk msm msn mtb mtu mum mup mxe myg nag nbm ndu ngm ngo ngz nma nnk non nor nrg nse nua nup nza nze olo one ong osa otr paa pat per pis plh pod pog qaw qhu rag ron rot rsu rwe sah san saw sel sgb sgl shb shi sht shy sio skk sla sme snm sro sup swe tab tac teo ter tid tiv tja tmo tpr trb tru tsz tye udm uld urk urt wec wma wna wom wrm xav yul zan,288,76475,0.0037659365
96A,Relationship between the Order of Object and Verb and the Order of Relative Clause and Noun,,96,Matthew S. Dryer. 2013. Relationship between the Order of Object and Verb and the Order of Relative Clause and Noun. In: Dryer; Matthew S. & Haspelmath; Martin (eds.) 2013. The World Atlas of Language Structures Online. Leipzig: Max Planck Institute for Evolutionary Anthropology. (Available online at https://wals.info/chapter/96),4,abi abu acg acl adi adz aeg alb alk aml amo amq amr anc anj anu aoj arg arj aro arq asy bab bag baj baq bar bbl bbu bco ber bfg bgr bid bii bik bir bka bkr bku bma bmb bni bob bre brf brn bsh btk bto bud bug bul bum buu bvi bwc cak cax ccm ceb cem cha chj chq chr chw cic cle cmy cop cor cpl crn cso cya cze day deg did dio dom doy dre dsh duk egn eng eno erk err est ewe ewo fij fin fni fon fre fua fut fye gae gbb gel gmz gnb gnd gok grb grf grk gud gul hal hat hau haw hdi heb hei hmo hna hnd hoa hol htc huc hve hya iaa iba ice ifu igb ign igs ik ila ind iri ita izi jab jak jmo juh juk kam kan kar kau kbl kbw kch kel ken ker kfe kgr khm khs kik kir kje kkt klv kmj kni knk koe kos kpm kpw krb kre kri kro ksg ktc kte ktl kuo kwn kyl kyq lab lan lao lat lbu leg lel len let lew lgu lit lmg lmh lmp lmu lnd lon luo luv maa maj mal mam mao mas mau may mbm mbr mby mcv mdg mdo mds mea mee meh mga mgo mgu miy mlg mlu mmb mmn mna mng mof mok mos mpr mpu mrg mrl mro mrq msk msm mum mup mur mus mut mwo mxc mxe mxo mxp mxy myg myn nal nan ncm ndo ndr ndt ndy neh ngm ngo ngz nhh nhm nht nia nif niu nkn nko non noo nor nua nun nup nza obg obo oji olo ood otm paa pai pal pat per pga pip pkt plg plh pms pod poh pol por pre psw pul pur qum rag rap rny rom ron rot rov rsu rus rwe sah sak sam san sea sed see ses sgb sgu shn sht sio sir sis sle sml so sob spa srd sre sud sul sun swa swe swt tab taf tag tah tai tat tbo tee ten teo tep ter tes tgk tgn tha tid tim tin tiw tke tla tlp tmm tmr tna tne tng tnk tno toz tpn tri trm tsi tsk ttd ttn txj tzu ukr uld uli url urt vie vnm wal war wch wel wlf wlo wma wol xbi xho xoo yag yap yor yul zai zch zhn zul zzo,416,76475,0.005439686
