parameter_id,parameter_name,parameter_description,chapter_id,chapter_citation,value,same_value_language_ids,value_language_count,language_count_total,count_ratio
144B,Position of negative words relative to beginning and end of clause and with respect to adjacency to verb,,144,Matthew S. Dryer. 2013. Position of Negative Morpheme With Respect to Subject; Object; and Verb. In: Dryer; Matthew S. & Haspelmath; Martin (eds.) 2013. The World Atlas of Language Structures Online. Leipzig: Max Planck Institute for Evolutionary Anthropology. (Available online at https://wals.info/chapter/144),3,acg aeg agc agd ain akh ala alb als ams anj ann any arg arj aro arp asy ata awa awp baa bae bai baq bar bch bco bfg bho bil bkr bmb bni bnn bra brf bsq bto bul bvi cah cea cem cha chc chj chq chr chx ckl cle cmy cnt cos cre crn cso cya dag dga dgb did dji dmk dom doy dre dua dyi ebi eng est eve fij fin fon fut gae gap gds gel geo gmw gnb goa gok goo grf grk guj guu hak hau haw hay heb hei hil hin hlu hmo hoa hop htc huc hun hup iaa idn ifu ign ik ind iri ita izi jak juh kan kch kdz ket kfe khm khs kir kkt kls kmj kmw knc kni knn kom kor kos krb ksn kty kuo kut kwa kyq kzy lah lan lao lgu lic lis maa mae mai mak mal mam mau mcd mch mgg mgi mhu mkj mmn mna mnd mnm mns mok mon mov mpa mrl mro mrt mru msq mun mur mus mut mwb mwo mxc mxj mxo mxp myi nab naj nak nal nar nca ncm ndr ndy neh nga ngu nhh nhm nia nif niu nke nne nsg ntu nug nun nyi oji oks ond ood otm pai pal pan pip pkt plg plh pnn poh pol por pul qui qum rap raw rom rov ruk rus sam sap sed see shl shp shu sid sil sir sis slo sml sna sng so sob som spa squ srd sre ssa sti stl stn sun taf tag tah tak tam tau tbo tbt tee tgk tha tho thu thy tim tin tiw tke tli tmm tmr tng tpn tri trm tsg tsk ttn ttu tuk tus tvl tzo tzu udh ukr uli una ung urd url urt usa vie wag wak wal war wch wel wem wlf wol wrb wrd wrk wsk wya xar xbi yag yap yid yin yng yok yor yur zai zqc zqo zqs zzo,339,76475,0.004432821
144K,SVONeg Order,,144,Matthew S. Dryer. 2013. Position of Negative Morpheme With Respect to Subject; Object; and Verb. In: Dryer; Matthew S. & Haspelmath; Martin (eds.) 2013. The World Atlas of Language Structures Online. Leipzig: Max Planck Institute for Evolutionary Anthropology. (Available online at https://wals.info/chapter/144),4,abi acg acm adi aeg agh akn alb anu apu arg arj arm aro arq asy bae bai bar bbl bch ber bia bkr bku ble blz bni bnn bra bre brf brn bsh btk bug bul bvi bwc cga cic cmy cnt coc cop cze deg dga dgb dio dma dre dsh dua ebi egn eko eng eno err est ewo fin fon fre fua fut ga gku gnb gok grk gua gud hak hal heb heh hmo hnd hol htc huc hun hve hya iaa iba ice ila ina ind iqu ita izi juh kad kan kas kba kby kch kdw kfe kga khm khn khs kik kil kin kir klv kmu kni koe kom kos ksn ktc ktl kwa kwn kwz kzy lac lan lao lat ldo leb leg len let lgi lic lit llm lmp lmu luc luo mae maj mao map mau mbe mbt mcd mcv mga mhu mie mkd mkz mlg mmv mna mnd moe mok mon mos mro mrq mrt mua mus mut mwe mwo mxe nad nak nal ncm ndb ndo ndt ndy neh ngd ngo ngu ngw nhm nht nke nkn nko nne noo nor nse nti nto nun obg obo ocu pal pau pga pkn plg pms png pnu poh pol por pre psw pul pur rim rny rom rot rru rus sak sal sap scr sed ses sgu shl shm shn sir sis skm slo sno sob son spa srd sre ssa sti stn sud sul sun swa swe taf tal tan tbw tee ten teo tep tes tet tgk tha tin tiw tki tla tmm tmn tmr tne tob ton toz tru ttn twn tzu ukr uli url ven vie vnm wal wch wlf wol wrk wrn xam xar xbi xho yao yin yng yor yuk yul zch zpr zqs zul,304,76475,0.0039751553
70A,The Morphological Imperative,,70,Johan van der Auwera; Ludo Lejeune (Umarani Pappuswamy; Valentin Goussev). 2013. The Morphological Imperative. In: Dryer; Matthew S. & Haspelmath; Martin (eds.) 2013. The World Atlas of Language Structures Online. Leipzig: Max Planck Institute for Evolutionary Anthropology. (Available online at https://wals.info/chapter/70),2,akn alb alw api buk crg fre fri ger grb gua hau ice ijo ita jab kon lin mdk nbm ndg nen nko nma nng noo ntu occ oss por prs rav rka rom sgl sup teh ton tsf tuk tvl urk,43,76475,0.00056227524
7A,Glottalized Consonants,,7,Ian Maddieson. 2013. Glottalized Consonants. In: Dryer; Matthew S. & Haspelmath; Martin (eds.) 2013. The World Atlas of Language Structures Online. Leipzig: Max Planck Institute for Evolutionary Anthropology. (Available online at https://wals.info/chapter/7),1,abi abm ach acm adk adz aea aeg agh aik ain akn akw ala alb ald alw amc ame amo amp amu amz ana ant ao api apu arb arp asm ata awn awp aze bai baj bam baw bbf bee bej ben bir bis bki bkr bma bng bno bod brb brd bre brh bri brm brr brw bsk bsq bto bua bul bur byu cac cah cam car cax cay cck ccp cha che chk chv cil cle cmn cnl cnt cof cre cso cub cve cyv dad dag dar der dgb dgr die din dio diy djp dni don dre dts dum dyi efi eja eka eng epe eve evn ewe ewo fas fef fij fin fre ful fur fuz ga gan gar gds ger ghb gla gmb goa goo grb grk grr grw gua hak ham haw hba hin hix hmo hok hop hum hun hve iaa iba igb ign igs ijo ika imo ind ird irr irx iso iva iwm jav jiv jng jom jpn jpr kal kas kay kch ked ket kew kfe kgu kgz kha kho khr khs kiw kkn kkv kla klv kly kmp knd kng knm knr koa kob koi kot koy kpa krb krd krk kry kse kty kun kur kwa kwo kws kya kyl kzy lad lah lan lat lav len lep lit llm lu lui luo luv mab mal mao map mar mau max may mbb mei mgg mie mku mla mlk mme mnc mnd mog mor mpa mrd mrn mro mrt mss mtp mui mun mxc mxm mya myi mzc nai nan nap nar nas nax nbk ndy nep new nga ngi nhn nht nim nis niv nko nkt nnc nob non nor ntu nug nyi oca oji ond ood orm otm pae pai paw pec pit pms pnr poa poh pol prh prs psh psm puk pur ram rap res rom ror rsc rtk ruk rus sab sba scs seb sha shi shk skp slp snc snd snh snm snt som sor spa srn sue sup svs swa tab tac tag tam tas tel tgk tha tib tic tiw tks tlp tmn tmp tne toa ton tpa try tsg ttn tug tul tun tur tuv umb una ung urk usa uzn wah wam wao wdo wiy wlf wma wmu wnt woi wra wrd wrs wry wuc yag yaq yar yaw yay ycn yel yes yid yim yko ykt yny yor ytu yus zan zqc,409,76475,0.005348153
90C,Postnominal relative clauses,,90,Matthew S. Dryer. 2013. Order of Relative Clause and Noun. In: Dryer; Matthew S. & Haspelmath; Martin (eds.) 2013. The World Atlas of Language Structures Online. Leipzig: Max Planck Institute for Evolutionary Anthropology. (Available online at https://wals.info/chapter/90),1,aar abi abo abu abv ace acg acl adi adz aeg agm ajg alb alk all aly ame aml amo amp amq amr ana anc ang anj anu any aoj apu apw arg arj aro arq arw asy awe baa bab bag baj baq bar bbl bbu bco bej ber bfg bfi bgr bid bii bik bio bir bka bkr bku blr bma bmb bni bob bok bre brf brh brn brp brs bsh bsr btk bto bud bug bul bum bus buu bvi bwc cah cak cav cax ccm cde ceb cem cha chj chp chq chr chw cic cld cle cmh cmn cmy cnm coo cop cor cpl crn cso ctm cub cya cze dag dan day ddj deg des did din dio djm dni dom doy dre dsh duk dut dyi efi egn emb eme eng eno erk err est eud ewe ewo fij fin fon fre fri fua fur fut fye gae gap gbb gel geo ger ghb gmz gnb gnd gok grb grf grk grw gud gul gum gwa hal hat hau haw hdi heb hei hid hix hmo hna hnd hoa hol htc huc hui hup hve hwr hya iaa iau iba ice idn ifu igb ign igs ik ila ind iri irq isa ita izi jab jak jeb jmo juh juk kam kan kar kau kay kbl kbt kbw kch kel ken ker kfe kgr khl khm khs kik kir kis kje kkt klm klr klv klw kma kmj knc kni knk knm knr knz koe kos kpm kpw krb krd kre kri kro krr kse ksg ktc kte ktl kuo kwn kws kwz kyl kyo kyq lab lan lao lat lbu lda leg lel len let lew lgt lgu lit lmg lmh lmp lmu lnd lon lug lui luo luv maa mab mad maj mal mam mao mas mau maw may mbm mbr mby mco mcv mdg mdo mds mea mee meh men mga mgo mgq mgu min miy mkj mlg mlu mmb mmn mna mng mnm mno moa mof mok mos mot mou mpr mpu mrg mrl mro mrq msk msl msm mud mum mup mur mus mut mwo mxc mxe mxo mxp mxy myg myi myn naj nal nan nar nat nbd ncm ndo ndr ndt ndy neh ney nez ngl ngm ngo ngz nhh nhm nht nia nif niu nkn nko nku non noo nor nrg nua nue nug nun nup nza obg obo oji olo ood orh orw otm paa pai pal par pat pau pba per pga pip pkt plg plh pms pno pnx pod poh pol por pre prs psh psw ptt pul pur qum rag rap rny rom ron rot rov rsu run rus rwe sah sak sam san sdw sea sed see ses sgb sgu shb shn sht sio sir sis skr slb sle sml snh so sob som spa src srd sre sro sud sul sun swa swe swt tab taf tag tah tai taj tak tar tat taw tbo tbt tbu tce tee ten teo tep ter tes tgk tgn tha thy tid tim tin tiw tke tla tlp tls tmm tmr tna tne tng tnk tnn tno tny toz tpn tpt trb tri trm tsi tsk ttd ttn tun tvl txj tzu ukr uld uli ung url urt ute vaf vie vnm wah wak wal war wch wel wic wlf wlo wma wol xbi xho xoo yag yap yaq yor yuc yuk yul zag zai zch zhn zul zzo,579,76475,0.0075711017
101A,Expression of Pronominal Subjects,,101,Matthew S. Dryer. 2013. Expression of Pronominal Subjects. In: Dryer; Matthew S. & Haspelmath; Martin (eds.) 2013. The World Atlas of Language Structures Online. Leipzig: Max Planck Institute for Evolutionary Anthropology. (Available online at https://wals.info/chapter/101),2,aar abk acg acl aco aeg aga ain aja ala alb all amh amq amr amx ane ang any aoj apl apu apw ara arg arm arp arq arw asm ass asy ath awa awp aym ayr bae bbl bbw bco bej bel bem bfg bgr big bii bik bin bio bir bku bln blx blz bma bnb bob bol bre brf brh brp brr brs bsh bsk bsq bsr bul bum bur cah cai cax cba cct cde che chh chi chk chx cic cld cle cln cmy coo crn cro cub cyv cze dag dds des dhi die dig dim dio dlm dni dom efi eip eko emb eme ene err esm est ewe ewo fua fur ga gaa gah gds gjj gln gmw gmz goo grg grk grw gua gul gyc ham hat hay heh hix hlu hmi hnd hua hun hya ifu ige ik ika ila ina irq isa ita ite ito izi jab jam jmo kab kae kam kan kba kdw kew kfe kga kgr kgz kik kio kkv klv kma kmb kmh kmj kmp kms kmz knd knm kno knr koa kob koe kon krc krd kre krk krr krw ksa kty kwk kwn kwt kwz kyk lan lav lbu lda ldo leg len let lgi lil lim lin lit lkt llm lml luc lul luo luv luy maa mab mac maj map mar mau mbl mbo mbt mby mcc mcv mdn mea mee meh mir mkd mki mku mlu mme mmw mna mne mnm mns moe moh mou mpr mpt mpu mra mrl mro msc msl mss mtb mua myi mzh nab nag naj nan nav nbd ndb ndj nez nga ngo nhh nhm nhn nht nko nmb nnd nse nti ntu nua nue nug nwd nym nyn nyu obg obo ocu olo ond orh oro osa otm pai pan pau pga pkn pkt plh pms pog por pra pre prs pwn qim qum ram rem rim rny rru ruk run rut sak san sar scr ser sgb sgl sgu shm shu sid sio siu skm skp sla slb slo sml so sob spa squ srb src sro stn sul swa taj tar tau tbw ten tep tes tet tgh tgn tgr tiw tja tki tkl tkm tli tlo tmc tmr tna tnc tob ton toz tps trb trr tsk tsz tte tuk tun tur tus tuv tvo uby udm uld una ung ura urk urn usa usr uzb ven wai wal was way wic wiy wma wrd wrk wrm wrw wry wya yal yao yar yel ygr yim yko ypk yuc yur ywl zai zap zay zqc zul,437,76475,0.0057142857
90A,Order of Relative Clause and Noun,,90,Matthew S. Dryer. 2013. Order of Relative Clause and Noun. In: Dryer; Matthew S. & Haspelmath; Martin (eds.) 2013. The World Atlas of Language Structures Online. Leipzig: Max Planck Institute for Evolutionary Anthropology. (Available online at https://wals.info/chapter/90),1,aar abi abo abu abv ace acg acl adi adz aeg agm ajg alb alk all aly ame aml amo amp amq amr ana anc ang anj anu any aoj apu apw arg arj aro arq arw asy awe baa bab bag baj baq bar bbl bbu bco bej ber bfg bfi bgr bid bii bik bio bir bka bkr bku blr bma bmb bni bob bok bre brf brh brn brp brs bsh bsr btk bto bud bug bul bum bus buu bvi bwc cah cak cav cax ccm cde ceb cem cha chj chp chq chr chw cic cld cle cmh cmn cmy cnm coo cop cor cpl crn cso ctm cub cya cze dag dan day ddj deg des did din dio djm dni dom doy dre dsh duk dut dyi efi egn emb eme eng eno erk err est eud ewe ewo fij fin fon fre fri fua fur fut fye gae gap gbb gel geo ger ghb gmz gnb gnd gok grb grf grk grw gud gul gum gwa hal hat hau haw hdi heb hei hid hix hmo hna hnd hoa hol htc huc hui hup hve hwr hya iaa iau iba ice idn ifu igb ign igs ik ila ind iri irq isa ita izi jab jak jeb jmo juh juk kam kan kar kau kay kbl kbt kbw kch kel ken ker kfe kgr khl khm khs kik kir kis kje kkt klm klr klv klw kma kmj knc kni knk knm knr knz koe kos kpm kpw krb krd kre kri kro krr kse ksg ktc kte ktl kuo kwn kws kwz kyl kyo kyq lab lan lao lat lbu lda leg lel len let lew lgt lgu lit lmg lmh lmp lmu lnd lon lug lui luo luv maa mab mad maj mal mam mao mas mau maw may mbm mbr mby mco mcv mdg mdo mds mea mee meh men mga mgo mgq mgu min miy mkj mlg mlu mmb mmn mna mng mnm mno moa mof mok mos mot mou mpr mpu mrg mrl mro mrq msk msl msm mud mum mup mur mus mut mwo mxc mxe mxo mxp mxy myg myi myn naj nal nan nar nat nbd ncm ndo ndr ndt ndy neh ney nez ngl ngm ngo ngz nhh nhm nht nia nif niu nkn nko nku non noo nor nrg nua nue nug nun nup nza obg obo oji olo ood orh orw otm paa pai pal par pat pau pba per pga pip pkt plg plh pms pno pnx pod poh pol por pre prs psh psw ptt pul pur qum rag rap rny rom ron rot rov rsu run rus rwe sah sak sam san sdw sea sed see ses sgb sgu shb shn sht sio sir sis skr slb sle sml snh so sob som spa src srd sre sro sud sul sun swa swe swt tab taf tag tah tai taj tak tar tat taw tbo tbt tbu tce tee ten teo tep ter tes tgk tgn tha thy tid tim tin tiw tke tla tlp tls tmm tmr tna tne tng tnk tnn tno tny toz tpn tpt trb tri trm tsi tsk ttd ttn tun tvl txj tzu ukr uld uli ung url urt ute vaf vie vnm wah wak wal war wch wel wic wlf wlo wma wol xbi xho xoo yag yap yaq yor yuc yuk yul zag zai zch zhn zul zzo,579,76475,0.0075711017
88A,Order of Demonstrative and Noun,,88,Matthew S. Dryer. 2013. Order of Demonstrative and Noun. In: Dryer; Matthew S. & Haspelmath; Martin (eds.) 2013. The World Atlas of Language Structures Online. Leipzig: Max Planck Institute for Evolutionary Anthropology. (Available online at https://wals.info/chapter/88),1,abi abk abv aco adk ain ala alb als alw amb amc amh ami amk amn amr ams ana ani ann anu apt apu apw ara arc arm arp arw asm ass ath atk ats ava awa awp awt aym bae baq bar bdm bfg bho bii bil bkt bku bla blg blr blt bnb bnj bnn bnr bod brh brl brm brs bsk bub bul bur but bya cak car cas cay cde cea cha chc chd che chg chk chn chp chs chv ckl cld cln cml cmn cnm cnt coc coo cor cpn cpy cre crp cti cup cyv cze daw des dgr dhi dhm diy djm djn djp djr dlm dmi dms dom drm dsh dua duk dul dut dyi emb eme eng epe est eud eve fin for fre fri fur ga gaa gam gar gav geo ger gid gjj gnb god gon goo grg grj grk grr gto gua guj gur guu gyc hai hak haw hay hei hhu hil hin hlu hmi hop hpd htc hua hun hup hve hwr hzb ice idn idu ifu ijo ilo ing iqu ita ite ito iwa jaq jbt jeb jng joh jpn jva kaa kab kac kae kas kay kbt kem ket kew kgy kha khg khl kho khr khs kin kio kiw kkp kkt kku kkw klm klr kls kma kmh kmn kms knd knn kno koa kok kol kor koy krc kri krk krn krw kry krz ksa ktm kty kum kuo kut kuv kwo kwt kxo kyn kyr lac lad lat ldu lec lep lez lil lim lit lmn lui lun maa mac mai mak mam map mau mcd mco mcv mdm mds mek men mgg mgi mhi mie mik mis miy mkg mmn mnd mne mns moa moh mot mra mrc mrt mru msc msg msq mss mto mtt mun mut mwb mxx myi mym naj nas nav nax nbd nca ndj nep nev new nez ngi ngl ngn ngw nhh nhm nhn nht niv nku nnc noc nor nph nrg nsn nti ntu nug nwd nyk nyn nyr nyu nze ocu oji omh omi ond ood oss otm pae pai pal pam pan pau paw pba pdp pga pia pir plk pno pny pod pol por ppc pra pre prk prs psh psm pso ptt pum pur qaf qhu qim qui qum ram raw rem res ret rgc rmb rsu ruk rus rut rwe sal sar sav scr sdw sec she shh shi shk shm sho shp sid sin siu skp sla slb slo sme smn sna sng snm snt spa spi squ src srn stl suk sup sus svs swe swt tac tah taj tam tar tau taw tbl tce tee tel tgl thd thk thn thu tic tig tiw tkl tkm tla tli tls tml tnc tni tnn tob tot tpn tps tpt trr tru trw tsf tsz ttu tuc tul tur tuv tuy tvo tvt twe txj udi udm uhi ukr una urd urk urn usr ute uzb vaf wak wam wao wap was wbn wed wem wic wik wiy wlo wly wme wra wrd wrk xam xas xer yag yaq ybi ycn yin yko ykt yng yny yok yuc yuk yur yuw zay zaz zch zqc zqs zun,542,76475,0.0070872833
143C,Optional Double Negation,,143,Matthew S. Dryer. 2013. Order of Negative Morpheme and Verb. In: Dryer; Matthew S. & Haspelmath; Martin (eds.) 2013. The World Atlas of Language Structures Online. Leipzig: Max Planck Institute for Evolutionary Anthropology. (Available online at https://wals.info/chapter/143),1,arp bmb chj chr hau min mka mku plh urt,11,76475,0.00014383785
5A,Voicing and Gaps in Plosive Systems,,5,Ian Maddieson. 2013. Voicing and Gaps in Plosive Systems. In: Dryer; Matthew S. & Haspelmath; Martin (eds.) 2013. The World Atlas of Language Structures Online. Leipzig: Max Planck Institute for Evolutionary Anthropology. (Available online at https://wals.info/chapter/5),2,abk adz aik aiz akn akw ala alb ald amh amo anc ani arp awn aze bag baj bam bbf ben bet bir bis bki bkr bno bod brb bre brh bri brm brr bsk bsq bto bul bur cam car cay cha chv cle cof coo cso cti dag dah dan dar ddf der det dgb dgr din dio dnw doy dre dts eja eng epe eve evn ewe fin fre ga gan gar gbb ger grb grk gwa had hba hin hmr hok hun hzb iaa iba igb igs ijo ik ika ind ing ird irq iso iva jeh jng jpn juh kab kad kal kas ked kef ker kfe kgi kgz kha khr kio kiw kkn klm klv kly kmp knd knk koh kom kot koy kpa kpe krd ktk kun kur kwk kzy lad lah lak lam lan lat lep lez lit llm lua lug luo lus mal mba mbm mei mgg mie mla mnc mog mpa mrd mrg mrl mrn mro mui mum mun mya nai nap nax ndt ndy nep new nga ngz nim nis nko nor nti ogb ood orm otm pai pau paw pol prs psh puk pur qui ram res rom rsc ruk rus rut sab san sba scs sdh sdw sml snd snh sor sre srn sue swa tab tag tel ter tib tic tks tlp tmn tmp tok tsg tsi tul tun tur tuv twn tza uzn wao wap wlf wma woi xoo yan yap yey ygr yko ykt ytu yuc yul zan,255,76475,0.003334423
144J,SVNegO Order,,144,Matthew S. Dryer. 2013. Position of Negative Morpheme With Respect to Subject; Object; and Verb. In: Dryer; Matthew S. & Haspelmath; Martin (eds.) 2013. The World Atlas of Language Structures Online. Leipzig: Max Planck Institute for Evolutionary Anthropology. (Available online at https://wals.info/chapter/144),5,aml ble bre cop ewo gua hal ktl len lmu miy rot teo zan,15,76475,0.00019614253
49A,Number of Cases,,49,Oliver A. Iggesen. 2013. Number of Cases. In: Dryer; Matthew S. & Haspelmath; Martin (eds.) 2013. The World Atlas of Language Structures Online. Leipzig: Max Planck Institute for Evolutionary Anthropology. (Available online at https://wals.info/chapter/49),1,abi aco aeg ame arp asm bag bam bkr bul car cba cha cle cnl dio don dre dut ewe fij fre frw fua grb gua hai hau heb hix hmo hve iaa igb ilo ind ita jak juh kfe khm khs kin klv kmb kmu kob kon kos krb kse kut kyl lan lav lkt luv mak mal mao mau mdr mnd mok mrd mxc nav ndy nht nko nti ond ots pai pal pms rap san sla snt spa swa tab tag tha tin tiw tsi tuk tvl una urk vie war wch wel yor zul zun,100,76475,0.0013076168
4A,Voicing in Plosives and Fricatives,,4,Ian Maddieson. 2013. Voicing in Plosives and Fricatives. In: Dryer; Matthew S. & Haspelmath; Martin (eds.) 2013. The World Atlas of Language Structures Online. Leipzig: Max Planck Institute for Evolutionary Anthropology. (Available online at https://wals.info/chapter/4),4,abk aeg agh aik aiz akw alb ald amo ana anc arc ava awn aze bam baw bbf bet bir bis bki bma bod brb bre brh bri brm bsk bul bur chv cil cof cti dah dan dgb dgr diz dnw doy dre eng ewe ewo fef fin fre ful ga gbb geo ger ghb grk gwa hau hin hmr hum hun hzb iaa igb ijo ik ind ing ird iso jpn juh kab kad kal ker kfe kgi kgz kha kly kmp knr koh kpa kpe krd kzy lad lah lak lam lat lep lez lit llm lu lug mab mal mba mbm mgg mog mrd mrg mui mum mxc nap nax ndy ngz nko nti oca ogb orh orm otm pai pau paw phl pol prs psh puk rom rsc ruk rus rut san sba sdh snd soq sui sup swa tas ter tgr tmp tok ttu tug tur uzn yey ykt yul zan,158,76475,0.0020660346
144D,The Position of Negative Morphemes in SVO Languages,,144,Matthew S. Dryer. 2013. Position of Negative Morpheme With Respect to Subject; Object; and Verb. In: Dryer; Matthew S. & Haspelmath; Martin (eds.) 2013. The World Atlas of Language Structures Online. Leipzig: Max Planck Institute for Evolutionary Anthropology. (Available online at https://wals.info/chapter/144),15,adz aeg arp bgo bmb bol chr cop dma ewo fre fye gbb hau ina kre lew mbe mgk mum mup mxe nke one paa plh rwe ter tid tmn urt wrn zch zul,35,76475,0.0004576659
27A,Reduplication,,27,Carl Rubino. 2013. Reduplication. In: Dryer; Matthew S. & Haspelmath; Martin (eds.) 2013. The World Atlas of Language Structures Online. Leipzig: Max Planck Institute for Evolutionary Anthropology. (Available online at https://wals.info/chapter/27),3,adk agl apu awp bnw brs car eng eve fin fre gae ger grk grw hix ika iri ita kfe kio kro kut lan lez mam mja mme mne moj nav nga nsn ntu ond por prh pwn rus ser sla spa tnc tot wap wch wel wic xav yag yan yko ypk zun,55,76475,0.0007191893
17A,Rhythm Types,,17,Rob Goedemans; Harry van der Hulst. 2013. Rhythm Types. In: Dryer; Matthew S. & Haspelmath; Martin (eds.) 2013. The World Atlas of Language Structures Online. Leipzig: Max Planck Institute for Evolutionary Anthropology. (Available online at https://wals.info/chapter/17),5,agu aln ame arc ava awd bbm bbw ben bgv bnt bqb bqg bqh bql bqn bqo bqr bqz bsk bso bua chv coo cub cya dak dhu dhw djr dob dou eka for gll god gor grb htc irq irr kal ker kew kfe kha kob kop ktn lat mah mal mar mcd mea mme mmo moh nbo obk olm ond oss pai pkm psh que rit rot rus scr sea sed sio skr sla slo sly sml squ sto swe swi tah tas tgk tsa tua tun tur war wiy woi yan yir ymd yzv,98,76475,0.0012814646
76A,Overlap between Situational and Epistemic Modal Marking,,76,Johan van der Auwera; Andreas Ammann. 2013. Overlap between Situational and Epistemic Modal Marking. In: Dryer; Matthew S. & Haspelmath; Martin (eds.) 2013. The World Atlas of Language Structures Online. Leipzig: Max Planck Institute for Evolutionary Anthropology. (Available online at https://wals.info/chapter/76),2,abk ace ain alb amr arg arm awp bal bam baw brm cha cnt coo dni ewe fua fue geo hai hau haw hin hun ice igb ika irq jak jpn kam kay kfe kio koa kol kor kse kui lak lan lin mab map mss mym nav ngi ngt ntu ond orh prs rap rka san swa teo tml udh vie wel wlf zul,66,76475,0.0008630271
85A,Order of Adposition and Noun Phrase,,85,Matthew S. Dryer. 2013. Order of Adposition and Noun Phrase. In: Dryer; Matthew S. & Haspelmath; Martin (eds.) 2013. The World Atlas of Language Structures Online. Leipzig: Max Planck Institute for Evolutionary Anthropology. (Available online at https://wals.info/chapter/85),2,abi abu ace acl acm adz aeg agc aja alb alk aln als alw ama ami aml amq amr ams anc ane anj any arg arj aro arp arq asy ata au ayw bab baf bag baj bak bar bas bbl bbu bco bdu bfg bfi bga bgo bid bik bir bka bkl bkr blu bma bmz bni bnk bnn bob bol bra bre brf brq bse bsh bsi btk bto bud bul bum buu bvi bwc cak cba ccm ceb cem cha chj chq chr cic ckl cld cle cmx cmy coe cop cpl cqt crn cso cuc cya cyv cze did dio dng dok dom don dre dsh duk dut egn eng eno erk err esm ewo fij fre fri fua fut fye gae gbb gel ger git giz gku gla gmz gnb gnd goa goe gok grf grk grr gto gud gwo hal hat hau haw hdi heb heh hei hem hil hlu hmo hna hoa htc hve hwr hya iaa iba ice ifm ifu igb ign igs ik ila ilo ind iri irq irr ita ixi izi jak jar jlu jmo juk kam kan kar kau kbl kbw kby kdz kel ker kga kgr khm khs kik kil kin kis kkt kkv klv kmi kmj kmu knk koe kon kos kpm kpw krb krd kre kri ksg kte ktu kuo kwa kwk kwm kwn kwy kya kyo kyq laa lab lac lag lan lao lat lbu lda ldo leb lel len let lew lgi lgu lic lil lit lmb lmg lmp lnd lon lou luo luv maa mae mal mam mao mas mau may mbe mbm mcd mco mdg mdm mdo mds mea meh mga mgo mgu mig min miy mko mlg mlm mlu mmb mmi mmn mna mng mnz mof mok mon mor mov mpu mra mrg mrq msm msq mtt mua mum mup mus mwb mxa mxc mxj mxo mxp mxy myg myi mzh naj nak nal nan nca nde ndi ndo ndt ndu ndy neh ngb ngd ngm ngo ngu ngz nhh nhm nht nia nif niu nko nnc noo nor nse nsg nua nue nun nup nza obg obo ocu olo ora otm paa pai pal par pat per pip pkt plg plh plk pms png pnn pod pog poh pol por pre prs psm psw pul qum rag rap rga rny rom rot ruk rus rwe saa sah sak sal sam san scr seb sed sen ses sgb sge sgl shl shn shu sim sio sir sis slo sml so sob son spa squ srb sre sti sul sun swa swe tab tah tai taj tal tbo tbw tee teo tep ter tes tet tgh tgk tgo tgr tha tho tid tig tim tin tiv tiw tke tla tlo tlp tmr tna tne tng tnk tno tpr tpt tri trt tsg tsi tsk ttd ttn tuk tvl txj tzo tzu ukr uld uli url vie vif vnm war wch wel wlf wlo wma wol wrk wrm xar xbi xho yap yok yor yul zai zan zap zen zhn zqs zul zya,511,76475,0.0066819224
