parameter_id,parameter_name,parameter_description,chapter_id,chapter_citation,value,same_value_language_ids,value_language_count,language_count_total,count_ratio
8A,Lateral Consonants,,8,Ian Maddieson. 2013. Lateral Consonants. In: Dryer; Matthew S. & Haspelmath; Martin (eds.) 2013. The World Atlas of Language Structures Online. Leipzig: Max Planck Institute for Evolutionary Anthropology. (Available online at https://wals.info/chapter/8),2,abi abk acm aea aeg agh aiz alb ald alw ame amh amo amp amz ana anc ao arm arp ata awn aym aze bag bai baj bam baw bbf bco bee bej ben ber bet bir bis bki bkr bma bng bod bra brb brd bre brh brm brw bsk bsq bto bua bul bur byu cac cah cam cay cha che chl chq chu chv chw cil cle cnl cnt cso cti dan dar ddf dgb dgr die din dio diy diz djp dni dnw don doy dre dts dum dyi eng eve evn ewe ewo fij fin fre ful fur fuz fye ga gbb ger ghb gla gmb goo grb grk grr gua gwa hak hau haw hba hin hmo hmr htc hun hve iba igb ign igs ijo ik imo ind ing ird irx iso ito iva jak jaq jav jeb jeh jng juh kad kas kay kch ked kef kek ker kfe kgi kgu kgz kha khr khs kkn kkv klm klv kly kmp kmu knd knm knr kob koi kom kor kot koy kpe krd kro kry kse ksg kss ktk kty kul kun kur kwa kws kya kyl kzy lad lah lak lan lat lav len lep lez lkk lkt llm lu lua lui luo maa mab mal map mar mau maz mba mbb mbm mei mgg mie mku mla mlk mme mnc mnd mne mog mpa mrl mrn mro mrt mss mum mun mxc mxm mya myi mzc nai nan nap nar nax nbk ndt ndy nep new nga ngi nhn nis niv nkt nnc nob non nor nti ntu nug nun nyg nyi ogb oji ond orh orm otm pac pae pec phl pit pms poa poh pol prs psm pso puk pur qaw qco ram rom rsc ruk rus rut sab san sba scs sdh seb sed sel sha skp slp sml snd snh som soq sor spa sre sui sup svs swa tab tag tam tas tel tgr tha tib tiw tks tlp tma tmn tmp tne toa tok tol ton try tsg ttn tug tuk tul tun tur tuv tza umb una ung uzn vie wah wam wap wch wdo wlf wma wmu woi wrd wrs wry wuc xoo yan yap yaq yay yct yel yes yid yim yko yny yor ytu yul yus zqc,388,76475,0.0050735534
95A,Relationship between the Order of Object and Verb and the Order of Adposition and Noun Phrase,,95,Matthew S. Dryer. 2013. Relationship between the Order of Object and Verb and the Order of Adposition and Noun Phrase. In: Dryer; Matthew S. & Haspelmath; Martin (eds.) 2013. The World Atlas of Language Structures Online. Leipzig: Max Planck Institute for Evolutionary Anthropology. (Available online at https://wals.info/chapter/95),4,abi abu acl acm adz aeg agc aja alb alk aln als ama ami aml amq amr ams anc ane anj arg arj aro arp arq asy ata au ayw bab baf bag baj bak bar bas bbl bbu bco bdu bfg bgo bia bid bik bir bka bkl bkr blu bma bni bnk bnn bob bol bra bre brf bse bsh btk bto bud bul bum buu bvi bwc cak cba ccm ceb cem cha chj chq chr cic ckl cle cmx cmy coe cop cpl cqt crn cso cuc cya cyv cze did dio dok dom don dre dsh duk egn eng eno erk err esm ewo fij fni fre fua fut fye gae gbb gel giz gla gmz gnb gnd goa goe gok grf grk grr gto gud gwo hal hat hau haw hdi heb heh hei hem hil hlu hmo hna hoa htc hve hya iaa iba ice ifm ifu igb ign igs ik ila ilo ind iri irr ita ixi izi jak jar jmo juk kam kan kar kau kbl kbw kby kdz kel ker kga kgr khm khs kik kil kin kkt kkv klv kmj kmu knk koe kon kos kpm kpw krb kre kri ksg kte kuo kwa kwk kwn kwy kyq laa lab lac lag lan lao lat lbu ldo leb lel len let lew lgi lgu lic lil lit lmg lmp lnd lon lou luo luv maa mae mal mam mao mas mau may mbe mbm mcd mdg mdm mdo mds mea meh mga mgo mgu miy mlg mlm mlu mmb mmn mna mng mof mok mon mor mov mpu mrg mrq msm msq mua mum mup mus mwb mxc mxj mxo mxp mxy myg nak nal nan nca ndi ndo ndt ndu ndy neh ngb ngd ngm ngo ngu ngz nhh nhm nht nia nif niu nko nnc noo nor nse nsg nua nun nup nza obg obo ocu olo ora otm paa pai pal pat per pip pkt plg plh plk pms png pnn pod pog poh pol por pre psm psw pul qum rag rap rga rny rom rot ruk rus rwe sah sak sal sam san scr seb sed ses sgb sgl shl shn shu sim sio sir sis slo sml so sob son spa squ sre sti sul sun swa swe tab tah tai tal tbo tbw tee teo tep ter tes tet tgh tgk tha tho tid tim tin tiv tiw tke tla tlp tmr tna tne tng tnk tno tpr tri tsg tsi tsk ttd ttn tuk txj tzo tzu ukr uld uli url vie vnm war wch wel wlf wlo wma wol wrk wrm xar xbi xho yap yok yor yul zai zan zap zhn zqs zul zya,456,76475,0.0059627327
116A,Polar Questions,,116,Matthew S. Dryer. 2013. Polar Questions. In: Dryer; Matthew S. & Haspelmath; Martin (eds.) 2013. The World Atlas of Language Structures Online. Leipzig: Max Planck Institute for Evolutionary Anthropology. (Available online at https://wals.info/chapter/116),6,adz ala alk aml ano apl apu ara arg arm arw azi bae baf bdm bgz bii bik bil ble bsh bum cah cai chk cml cmy cpl cup dha dio diy djm dlm eno erk fij geo ghb gmw gnb grj guj gum hay hix hmi hoa htc hya igb irr ita jak jmo kay kba kbl kch kik kis klv kma kmz knc kni kqq kun kuo kuu kws lab lan lbu lin lmh lon luo mac man mao mde meh mer mku mlg mna mnm mov mra mrl mrt mwo nab nad naj ndi ndj ndr ndy ngd ngk ngo ngz nha nht nif nnk nua ora orh osa paa pai par pip pms poh ppi psh psw rny rom rov ruk sah sar sea ses shl sid skw sml snm sud sul svs tab taf tai tar tbt tbw ten teo thy tid tir tke tob tps tsi tvl udh uli usa vnm war wem wma wol wrg wrn xbi yap yid yko yng yor zaz zch zzo,173,76475,0.0022621772
86A,Order of Genitive and Noun,,86,Matthew S. Dryer. 2013. Order of Genitive and Noun. In: Dryer; Matthew S. & Haspelmath; Martin (eds.) 2013. The World Atlas of Language Structures Online. Leipzig: Max Planck Institute for Evolutionary Anthropology. (Available online at https://wals.info/chapter/86),2,abo ace acl aeg agb agc agd agh aja alb aly ami aml amr ams anc anj any aoj arg arj aro arq asy ata awe ayw bag baj bak baq bar bas bbu bch bco bdu bfg bfi bga bgo bgr bid bir bka bkr bku blr blz bma bni bnk bnn bob bol bra bre brf brn brp brq bsr btk bto bud bug bum buw bvi bwc cai cak cba ccm ceb cem cha chj chq chr chx cic cld cle cme cmx cmy cop cpl cqt crn cso cya cyv day dgo did din dio dji dre dua duk dut egn eno erk err esm ewo fij fon fre fua fut fye gae gbb gbs gel ger gmz gnd goa goe gok grf grk gto gud gul gwo hal hau haw hdi heb hei hil hna hnd hoa htc hve iaa iba ice ifm ifu igb ign igs ila ind iri irq isa ita izi jak jar jeb jlu jmo juk kad kan kar kba kbl kbu kdz kel ken ker kga khm khs kik kis kkt kls kmj kmu knc knk knr koe kom kon kos kpm krb krd kre kri kro krr ktc ktl ktu kuo kut kwk kwm kwn kyo laa lac lag lan lao lar lbu lda ldo len lew lgi lgu lil lin lmb lmg lmp lmu lnd lon lou luo luv ma maa mae maj mal mam mao mas mbl mbm mbr mby mch mda mdg mdo mdw mee meh mga mgo mgq mgu min miy mla mlg mmn mna mng mnm mnt mnz mof mon mou mpa mrg mrl mro mrq msk msl msq mtb mtt mua mud mup mur mus mwb mwe mxa mxc mxo mxp mxy myg myn naj nak nan nca ndb nde ndi ndo ndr ndt ndu neh ngb ngd ngm ngo ngu ngz nhh nht nia niu nkb nko nnc nne nng non noo nsg nue nun nup nym nza obo orh ori orw otm otr paa pai pal par per pga pip pkt plg pms pnn pod pol por pre prs psw qui qum rag rap ras rga rny rom ron rot rov rsu ruk rus saa sak sal sam san seb sed see ses sgu sha shl shn sht shu sil sim sir sis sml so son spa squ sre sti stn sun swa swt taf tag tai taj tas tat tbo tbu tbw tee ten teo tep ter tes tet tgh tgk tgr tha thy tia tik tim tin tiv tla tlp tmm tmn tna tne tng tnk tnn tno tob toz tri tsg tsi tsk tuk tvl txj tzo tzu uld ura url urt vaf vie vif vnm war wel wlf wlo wrk wrn xbi xho yap yay yns yor yul ywr zai zap zen zul zya,468,76475,0.006119647
19A,Presence of Uncommon Consonants,,19,Ian Maddieson. 2013. Presence of Uncommon Consonants. In: Dryer; Matthew S. & Haspelmath; Martin (eds.) 2013. The World Atlas of Language Structures Online. Leipzig: Max Planck Institute for Evolutionary Anthropology. (Available online at https://wals.info/chapter/19),1,abi abm ach acm adk adz aht aik ain akn akw ala alw amh amp amu amz ana anc ant ao api apu arb arm arp asm awn awp aym aze bag bai baj bam baw bco bee bej ben bis bki bkr bng bno bod brd bre brh bri brr brw bsq bto bua bul bur byu cac cad cah cam car cax cay cck ccp cha che chk chl chu chv chw cil cle cmn cnl cnt cof coo cre cso cti cve cyv dad dag dar ddf der dgr die din dio diy diz djp dni dnw don dum dyi eka epe eve evn eya fas fef fin fre ful fur fuz fye gan gar gds geo ger ghb gla gmb goa goo grr grw gua hai hak ham hau haw hba hin hix hmo hmr hok hop hun hup iba ign ik ika imo ind ird irr irx ite ito iva iwm jak jaq jav jeb jeh jiv jng jom jpn jpr kad kal kas kay kch ked kef kek ker ket kew kfe kgi kgu kgz kha khm khr khs kio kiw kkn kkv klm klv kly kmp kmu knd kng knk knm knr koa kob koi kom kor kot koy krb krk kro kry kse kty kul kun kur kut kwa kwk kwo kws kya kyl kzy lad lah lam lan lat lav len lep lez lit lkt lu lua lui luo lus luv maa mab mak mal mao mau max may maz mbb mei mgg mie mku mla mlk mnc mnd mne mog mor mov mpa mrd mrg mrn mrt mss mtp mui mun mya myi mzc nai nan nap nar nas nav nax nbk ndt ndy nep new nez ngz nhn nht nim nis niv nko nkt nmb nnc nob non nor nug nun nyg nyi oca oji ond ood orh orm pac pae pai pau paw pec phl pit pms pnr poa poh pol prh prs psh psm pso puk pur qaw qui ram rap res rom ror rsc rus sab sba scs sdh seb sed sel sha shi shk shs shu sin skp sla slp sml snc snh snm snt sor sre srn sue sui sup svs tab tag tam teh tel ter tgk tha tib tic tiw tks tli tlp tmn toa tol ton tpa tru try tsg tsi tso ttn tug tuk tul tun tur tuv twn tza umb una ung urk usa uzn vie wah wam wao wap war wch wdo wic win wiy wlf wma wmu wnt woi wps wra wrd wrs wry wuc yag yan yaq yar yaw ycn yct yes ygr yid yim yko ykt yny ytu yuc yur yus zqc zun,449,76475,0.0058711995
14A,Fixed Stress Locations,,14,Rob Goedemans; Harry van der Hulst. 2013. Fixed Stress Locations. In: Dryer; Matthew S. & Haspelmath; Martin (eds.) 2013. The World Atlas of Language Structures Online. Leipzig: Max Planck Institute for Evolutionary Anthropology. (Available online at https://wals.info/chapter/14),1,abe abk aeg ael agu ahs akl ala ame apa apu arc arg arh arl arm arv asy atq au ava awd bej bgg bgv bho bkl bkr bna bqg bqh bqi bqz bso bui bur bwa cap car cct ceb cha chv cle coo cpa crk cub cyg des dhu dhw die djr dsh dut eka emc eng epe eve fij for fre gay ger god gor grb guj hin hix hno hop htc hzb iga irm irq ita jav kaj ker kew kha kit klm klv knm koa kop kra krk kro ksh ktn kuu kuz kwk kws lar let lez lit lmh lui mah mai mak mam mao mcs mdm mea meb men mlc mlk mlt mly mme mmo mnd mne mng mnm mrk mrl mrs mrw mse mss mun mwn mym nav nbd ndy nep nez ngd ngi nor nya obk occ oss oto plb por prh psh psm pul ram rom ror rot rsm rus sak sao scr sdh sea ser shk sio skp skr sla slo snc snt spa spo sps srd sru sun svc swe swi tah tbl tgw tib tlo tng tno tns tnt tol tps tsh tur uli ung unm usa wam wic wiy wlo woi wrg yan yap ych yid yil yin yko ypk ysl yuc yun yuw yzv,220,76475,0.0028767572
13A,Tone,,13,Ian Maddieson. 2013. Tone. In: Dryer; Matthew S. & Haspelmath; Martin (eds.) 2013. The World Atlas of Language Structures Online. Leipzig: Max Planck Institute for Evolutionary Anthropology. (Available online at https://wals.info/chapter/13),1,abk aea aeg aht akw ala alb alw ame amh amp amu ana api apu arb arc arm arp asm ata ava awp aym aze baj bco ben bis bki bkr bma bng brd bre brh brr brw bsk bsq bto bua bul bur byu cah cam car cax cck ccp cha chk chl chu chv cmn cnl coo cre cyv dar ddf der dgr die dio diy djp dni dre dyi eng epe eve evn eya fij fin fre gan gar geo ger goo grk grr grw gua hai haw hba hin hix htc hum hun hup hzb iaa iba ika imo ind ing ird irr irx iva jak jaq jav jeb jeh jpr kab kas kay kch ked ket kfe kgu kgz kha khm khr khs kkn kkv klm klv kly kmp knd kng kob kor kot koy krb krd kry kty kun kut kwa kwk kws kya kzy lad lak lav len lez lkt lui lus mak mal mao map mar mau max may mbb mgg mku mlk mne mog mov mpa mrd mrn mrt mss mtp mun myi nai nap nep new nez nga ngi nhn nht nnc ntu nug nuu oji ood orm pac pae pai pau pit pms pnr poh pol prs psh puk pur qaw qco ram rap rom ror rsc rtk ruk rus sba scs sdh sed sel shi shk shu sml snc snh snm soq sor spa squ srn svs swa tab tac tag tas teh tel tgk tgr tiw toa tol ton tpa tru try tsg tsi tso ttn ttu tug tuk tul tur tuv tza ung urk usa uzn wam wao wap war wch wdo wic win wiy wlf wma wmu wnt woi wps wra wrd wry yan yap yar yaw ycn yel yes yid yim yko ykt yny ytu yuc yur yus zqc zun,307,76475,0.004014384
6A,Uvular Consonants,,6,Ian Maddieson. 2013. Uvular Consonants. In: Dryer; Matthew S. & Haspelmath; Martin (eds.) 2013. The World Atlas of Language Structures Online. Leipzig: Max Planck Institute for Evolutionary Anthropology. (Available online at https://wals.info/chapter/6),1,abm ach aco adk adz agh aik ain aiz akn akw ala alb ald alw amc ame amh amo amp amu amz ana anc ant ao api apu arb arp asm awp aze bag bai baj bam baw bbf bee bej ben ber bet bir bis bki bkr bng bno bod bra brb brd bre brh bri brm brr brw bsq bto bua bul byu cac cad cam car cax cay cck ccp cha che chp chq chu chv chw cil cle cmn cnl cnt cof cre cso cti cub cve cyv dad dag dah dan dar der det dgb dgr din dio diy diz djp dni dnw doy dre dts dum dyi efi eja eka eng epe eve evn ewe ewo fas fef fij fin ful fur fuz fye ga gan gar gbb gds ghb gmb goa goo grb grk grr gua gwa had hak hau haw hin hix hok htc hum hun hve iaa iba igb ign igs ijo ik ika imo ind ird irr irx iso ito iva iwm jav jeb jeh jiv jng jom jpr juh kad kas kay kch ked kef ker kew kfe kgi kgu kha khm kho khr khs kio kiw kkn kkv kla klv kly kmu knd kng knk knm knr koa kob koh koi kom kor kot koy kpa kpe krb krk kro kse ksg kss ktk kty kul kun kwa kwo kws kya kyl kzy lad lam lan lat lav len lep lit lkk lkt llm lu lua lug luo luv maa mab mal mao map mau max may maz mba mbb mbm mei mie mku mla mlk mme mnc mnd mne mor mov mpa mrd mrg mrl mrn mro mrt mss mtp mui mum mun mxc mxm mya myi mzc nai nan nar nas nav nbk ndt ndy nep new nga ngi ngz nhn nht nim nis nko nkt nmb nnc nob non nor nti ntu nug nun nyg nyi oca ogb oji ond ood orh otm pac pae pau paw pec phl pit pms pnr poa poh pol prh psm puk pur qaw ram rap res rom ror rsc rtk ruk rus sab san sba scs sdh sdw seb sed sha shi shk shs sin sla slp sml snc snd snh snm snt soq sor spa sre srn sue sup svs swa tab tac tag tam tas tel ter tgk tgr tha tib tic tiw tks tlp tma tmn tmp tne toa tok tol ton tru try tsg tso ttn tuk tul tun tur tuv twn tza umb una ung urk usa vie wah wam wao wap war wdo wic wiy wlf wma wmu wnt woi wps wra wrd wrs wry wuc yag yan yap yaq yar yaw yay ycn yct yel yes yey ygr yid yim ykt yny yor yuc yul yur zan zqc zul zun,470,76475,0.006145799
38A,Indefinite Articles,,38,Matthew S. Dryer. 2013. Indefinite Articles. In: Dryer; Matthew S. & Haspelmath; Martin (eds.) 2013. The World Atlas of Language Structures Online. Leipzig: Max Planck Institute for Evolutionary Anthropology. (Available online at https://wals.info/chapter/38),2,abk agm amh ao aoj ara arc awt aym azi bbw bin brf bsq bwc cas ccm chh chs cnt ddj fre ger gil gmw grk gwo heb hmo hoa htc ita jak kay kbw kgz khl kkp knd knn krc lah lat lav len lep lew lez lmh lon mam mea mei mgu mis moa mrq mtu mum mxy myn mzc mzn naj nca ndy nev nne nor nwd nym obo ocu osa paa por pra pur qum rap rem rom skk spa stl swe tah tam tar tce tee tep tgl tgr tid tig tmo tps tri ttn tts tur twe ura wal wme wol xbi ygr zai zar,112,76475,0.001464531
15A,Weight-Sensitive Stress,,15,Rob Goedemans; Harry van der Hulst. 2013. Weight-Sensitive Stress. In: Dryer; Matthew S. & Haspelmath; Martin (eds.) 2013. The World Atlas of Language Structures Online. Leipzig: Max Planck Institute for Evolutionary Anthropology. (Available online at https://wals.info/chapter/15),3,akl apu arg awd bgg bgv bkl bkr bna bqh bso bui ceb coo crk die emc epe eve fij fre gay guj hzb iga ita jav klv koa kuz kws let lmh meb mlc mlt mly mng mrs mun ngd occ plb por rom rot rsm sak sea sio snt spa srd sru sun swi tgw tlo tng tns tnt tol wlo yap,65,76475,0.00084995094
53A,Ordinal Numerals,,53,Thomas Stolz; Ljuba N. Veselinova. 2013. Ordinal Numerals. In: Dryer; Matthew S. & Haspelmath; Martin (eds.) 2013. The World Atlas of Language Structures Online. Leipzig: Max Planck Institute for Evolutionary Anthropology. (Available online at https://wals.info/chapter/53),7,amr blr bre bul coi crg cze dsh eng est eve far fin fno fre gbc glc gre grk grw hun ice iri ita ite izh krl ksu kty kzy lat ldn lit liv lno mcd mss nor ntu occ pol por rmc rus scr slo sno so sou spa squ srl svk swa swe ukr ute vep vot wel,61,76475,0.0007976463
143A,Order of Negative Morpheme and Verb,,143,Matthew S. Dryer. 2013. Order of Negative Morpheme and Verb. In: Dryer; Matthew S. & Haspelmath; Martin (eds.) 2013. The World Atlas of Language Structures Online. Leipzig: Max Planck Institute for Evolutionary Anthropology. (Available online at https://wals.info/chapter/143),15,adg adz aeg ame ann ao arp bbu bel bgo blx bmb bok bol chi chj chr cmh cop dma dom dun ewo fre fye gbb guh hau hlp ina khg klw kma kmb kre kwo kyz lew lmg mab mbe mgk min mka mku moh mum mup mxe mxx niv nke nph ond one paa pkt plh rap run rwe siu sup tac tar tbt ter tgl tid tja tmn tsh tsk urt wiy woi wrn zch zul,80,76475,0.0010460935
11A,Front Rounded Vowels,,11,Ian Maddieson. 2013. Front Rounded Vowels. In: Dryer; Matthew S. & Haspelmath; Martin (eds.) 2013. The World Atlas of Language Structures Online. Leipzig: Max Planck Institute for Evolutionary Anthropology. (Available online at https://wals.info/chapter/11),1,abi abk abm ach acm aco adk adz aea aeg agh aht ain aiz akn akw ala ald alw amc ame amh amo amp amu amz ana anc ani ant ao api apu arb arc arm arp asm ata ava awn awp aym bag bai baj bam baw bbf bco bee bej ben ber bet bir bis bki bkr bma bng bno bod bra brb brd brh bri brm brr brw bsq bto bua bul bur byu cac cad cah cam car cax cay cck ccp cha che chk chl chp chu chw cil cle cmn cnl cof coo cre cso cti cub cve cyv dad dag dah dan dar ddf der det dgb die din dio diy diz djp dni dnw don doy dre dts dum dyi efi eka eng epe eve evn ewe ewo eya fas fef fij ful fur fye ga gan gar gbb gds geo ghb gla gmb goa goo grb grk grr grw gua gwa had hai hak ham hau haw hba hin hix hmo hmr hok htc hum hup hve hzb iba igb ign igs ijo ik ika imo ind ing ird irq irr irx iso ite ito iva iwm jak jaq jav jeb jeh jiv jng jom jpn jpr juh kab kad kal kas kay kch ked kef kek ker ket kew kfe kgu kha khm kho khr khs kio kiw kkn kkv kla klm klv kly kmp kmu knd kng knk knm knr koa kob koh koi kom kor kot koy kpa kpe krb krd krk kro kry kse ksg kss ktk kty kul kun kur kut kwa kwk kwo kws kya kyl kzy lad lah lak lam lan lat lav len lit lkk lkt llm lu lua lug lui luo lus luv maa mab mak mal mao map mar mau max may maz mba mbb mei mgg mie mku mla mne mog mor mov mpa mrd mrg mrl mrn mro mrt mss mtp mui mum mun mxc mxm mya myi mzc nai nan nap nar nas nav ndt ndy nep new nez ngi ngz nhn nht nim nis niv nko nkt nmb nnc nob non nti ntu nug nun nuu nyg nyi oca ogb oji ond ood orh orm otm pac pae pai pau paw pec phl pit pms pnr poa poh pol prh prs psh psm pso puk pur qaw qco qui ram rap res rom ror rsc rtk ruk rus rut sab san sba scs sdh sdw seb sed sha shi shk shs shu sin sla slp sml snc snd snh snm snt som soq sor spa squ sre srn sue sui sup svs swa tab tac tag tam tas teh tel ter tgk tgr tha tic tiw tks tli tma tmn tmp tne toa tok tol ton tru try tsg tsi tso ttn ttu tug tuk tul tun twn tza umb una ung urk usa uzn vie wah wam wao wap wch wdo wic win wiy wlf wma wmu wnt woi wps wra wrd wrs wry xoo yag yan yap yaq yar yaw yay ycn yct yel yes yey ygr yid yim yny yor yuc yul yur yus zan zqc zul zun,525,76475,0.0068649887
81A,Order of Subject; Object and Verb,,81,Matthew S. Dryer. 2013. Order of Subject; Object and Verb. In: Dryer; Matthew S. & Haspelmath; Martin (eds.) 2013. The World Atlas of Language Structures Online. Leipzig: Max Planck Institute for Evolutionary Anthropology. (Available online at https://wals.info/chapter/81),2,aab abi abu acg acl acm adi adz aeg agb agh aja akn alb alk aln ama aml amq anc ane anu aoj apu ara arg ari arj aro arp arq au avk ayi ayr ayw bab bae baf bag bai bak bar bas bbl bdu ber bgo bgr bgs bgz bid bii bik bir bka bku ble blz bmb bni bnk bnn bob bol bra bre brf brn brq bsh bub bud bug bul bum buu buy bvi cga chr chw cic cme cmy cnt coc cop crn cua cuc cze day deg dga dgb dio dma dok don doy dsh dua duk ebi ega egn eko eng eno erk err est ewe ewo fin fon fre fua fut fye ga gbb gbs gla gmz gnb goe gok grb gua gul guw gwo hak hal hat hau heb heh hem hmo hna hnd hol htc huc hve hya iaa iba ice ifm igb ige igs ila ind iqu irr ita ito iwa izi jab jar jmo juh juk kad kan kar kas kau kba kbw kby kch kdw kel ken ker kfe kga khm khn khs kik kil kin kir kkv kla kmu kni knk koe kom kon kos kpw kre ksg ksm ksn ktc kte ktl kwa kwn kwy kyl kzy laa lab lag lan lao lat lbu ldo leb leg lel len let lew lgi lic lin lit llm lmh lmp lmu lnd lon lou luc luo luv ma mae map mas mau may mba mbe mbi mbm mbr mbt mby mcd mcv mda mdg mdo mds mdw mea mee mga mgk mgo mgu mhu mie mkd mkq mkz mla mlg mlm mlu mmb mmv mna mnd mng moe mof mok mon moo mor mos mpr mpu mrg mro mrt msm mtb mua mum mup mur mus mut mwe mwo mxe myg myn nak nal nbe nbm ncm ndb ndi ndo ndt ndu ndy neh ngb ngd ngm ngo ngu ngw ngz nhm nhn nht nke nkn nko nne nng non noo nor nse nto nua nun nup nza obg obo ocu olo one ora otr paa pal pam pat pau per pga pkn plg plh plk pms png pnu pog poh pol por pre psw pul pur rag rga rim rny rom ron rot rru rsu rus sah sak sal san sap scr sea sed ses sgb sgl sgu sha shl shm shn sht sio sir sis skm sku sle slo sno sob son spa srd sre ssa sti stn sud sul sun swa swe tab taf tal tan tbw teo tep ter tet tgk tgn tha tia tid tiv tiw tki tla tmm tmn tmr tne tnk toz tpr trm ttd ttn tum txj ukr uld uli ura url urt ven vie vnm wal wch wlf wma wol wrk wrm wrn wry wwa xam xar xbi xho xoo yao yay ycn yin yng yor yuk yul zan zch zhn zpr zqs zul,488,76475,0.0063811704
75A,Epistemic Possibility,,75,Johan van der Auwera; Andreas Ammann. 2013. Epistemic Possibility. In: Dryer; Matthew S. & Haspelmath; Martin (eds.) 2013. The World Atlas of Language Structures Online. Leipzig: Max Planck Institute for Evolutionary Anthropology. (Available online at https://wals.info/chapter/75),1,abk ace aeg alb amh amr arg bam bet dsh dut eng ewe far fin fre ger grb grk hau heb hin hun ice igb iri ita kam kas kfe knd kol kui lak lat lit mcd mdg meh mei mhi mlt mnd mok mym orh pan pol por rka rom rus scr sno spa sup swe tel tha tuk tuv vie wlf yor,65,76475,0.00084995094
3A,Consonant-Vowel Ratio,,3,Ian Maddieson. 2013. Consonant-Vowel Ratio. In: Dryer; Matthew S. & Haspelmath; Martin (eds.) 2013. The World Atlas of Language Structures Online. Leipzig: Max Planck Institute for Evolutionary Anthropology. (Available online at https://wals.info/chapter/3),3,abi acm aik alb ald amc ame amz apu ata awn awp bag baj bam bbf bee bej ben bir bis bng bra brd bre bri brm bsk bto bua bul byu cam cha chq cil cle cso cti ddf dgr din diz dnw don doy dre dyi eja eve evn ewe ewo fij ful ga gan gar gbb gds ghb gla gmb goa grk gua gwa hak hba hix hok hop htc hun hve hzb iaa iba igb igs ik ind irx iso ito jeh jiv jpn kad kas kch kef kek ker kew kgz khs kio kkv klv kly kmp knk knm knr koh kom koy kpe krd krk kry kse ksg ktk kty kur kwa kwo kws kya kzy lah lat lav lep llm lua lug lui luo luv mab map mau mba mei mlk mme mnc mnd mne mor mov mrd mrn mro mui mum mxc mxm mya myi mzc nai nar nax nbk ndt ndy nhn nht nko nkt nob nun oji ood orm otm pec phl pms prs psm puk rom san sba sha shk shs sin sml snd snh sor spa sre sup svs tab tag tam tib tic tks tok tol ton tru tso tug tuk tul tur twn umb ung uzn wah wch wic wlf wma wps wrd wry wuc yan yap yaq yaw yay ycn yct yes ygr yid yko ytu zan zun,234,76475,0.0030598235
52A,Comitatives and Instrumentals,,52,Thomas Stolz; Cornelia Stroh; Aina Urdze. 2013. Comitatives and Instrumentals. In: Dryer; Matthew S. & Haspelmath; Martin (eds.) 2013. The World Atlas of Language Structures Online. Leipzig: Max Planck Institute for Evolutionary Anthropology. (Available online at https://wals.info/chapter/52),1,acl adk afr alb awt aym bak bar bkl bre brs cch ccp cle cmx col dsh eng est ewe fre fur fut gbb ger grk hau heb iga ila iri ita juh ker ket khl kho kis kms kty kwr lat ldn lga mhi mhu mog mok msl mxa mzc nor pip por prs qim rbu rmc rom san sno sor srl sus swe ter tgk tik tlp tur udm url xam yct zaz,76,76475,0.0009937888
