parameter_id,parameter_name,parameter_description,chapter_id,chapter_citation,value,same_value_language_ids,value_language_count,language_count_total,count_ratio
97A,Relationship between the Order of Object and Verb and the Order of Adjective and Noun,,97,Matthew S. Dryer. 2013. Relationship between the Order of Object and Verb and the Order of Adjective and Noun. In: Dryer; Matthew S. & Haspelmath; Martin (eds.) 2013. The World Atlas of Language Structures Online. Leipzig: Max Planck Institute for Evolutionary Anthropology. (Available online at https://wals.info/chapter/97),5,abi ace acn aco adn ajg alw amm amt ani any apu arm ata avo bac bbw bej bgn bgo bio bkl blr bnb boj brs btk bua cai cam cav cct chg chs cmh coo cuc dam ddj deg der dgo dhr din djm djn djr dlm dul dut emm esm fri gah ger ggu gid gim git gmz gnn grg grj gum gwa han hil hup ido ina ite ito izi jam jeb jug kac kan kay kis kkw kla klm kmw knk kpm krj krk kut kws kwt kyr laf lah lai ldu lec les lgt lml lmu lug lui lun mad mak mam mch mcv mei men mik min mir mmn moa moh mos mou mra mrw mss mtt mxx mzh nag nas ney nez ngi ngk ngl ngw nha nhn nke nmm nti nue nug nuu nyr obo oks pau pdp pnn pnx pny pod pok ppi rit rji ruk sal see ser shk snc son swt tac tag tar tic tik tis tiv tja tla tli tot tpn trr tru tuc tus tvt twn tzu uru wan wao wik win wiy wrd wrg wrl wrw yim yin ypk yur ywr zar,198,76475,0.0025890814
18A,Absence of Common Consonants,,18,Ian Maddieson. 2013. Absence of Common Consonants. In: Dryer; Matthew S. & Haspelmath; Martin (eds.) 2013. The World Atlas of Language Structures Online. Leipzig: Max Planck Institute for Evolutionary Anthropology. (Available online at https://wals.info/chapter/18),1,abi abk abm ach acm aco adz aea aeg agh aht aik ain aiz akn akw ala alb ald amc ame amh amo amu amz ana anc ani ao api apu arb arc arm arp asm ata ava awn awp aym aze bag bai baj bam baw bbf bco bee bej ben ber bet bir bis bki bkr bma bng bod bra brb bre brh bri brm brw bsk bsq bto bul bur cad cah cam car cax cay cck ccp cha che chk chl chq chu chv chw cil cle cmn cnl cnt cof coo cre cso cti ctl cve cyv dad dag dah dan dar ddf det dgb dgr dio diz dni dnw don doy dre dts dum efi eja eng eve evn ewe ewo fas fef fij fin fre ful fur fuz fye ga gar gbb geo ger ghb gla gmb goa grb grk grw gua gwa had hai hak ham hau hba hin hix hmo hmr hok hop htc hum hun hup hve hzb iaa iba igb ign igs ijo ik ika imo ind ing ird irq irr irx iso ite ito iva iwm jak jaq jav jeb jeh jiv jng jom jpn jpr juh kab kad kal kas kch ked kef kek ker ket kew kfe kgi kgz kha khm kho khr khs kio kiw kkn kkv klm klv kly kmp kmu knd knk knm knr koa kob koh koi kom kor kot koy kpe krd krk kro kry kse ksg kss ktk kty kul kun kur kut kwa kwk kwo kws kyl kzy lad lah lak lam lat lav len lep lez lit lkk lkt llm lu lua lug lui luo lus luv maa mab mak mal mao map mar mau may maz mba mbm mei mgg mie mla mme mnc mnd mne mog mor mov mrd mrg mrl mro mss mtp mui mum mun mxc mxm mya mzc nai nan nap nar nas nav nax nbk ndt ndy nep new nez nga ngi ngz nhn nht nim nis niv nko nkt nmb nnc nob non nor nti ntu nun nuu nyg nyi oca ogb oji ood orh orm otm pac pae pai pau paw pec phl pms poa poh pol prs psh psm pso puk pur qaw qco ram rap res rom ror rsc ruk rus rut sab san sba scs sdh sdw seb sed sel sha shi shk shs shu sin skp sla slp sml snc snd snh snm snt som soq sor spa squ sre srn sue sui sup svs swa tab tac tag tam tas teh tel ter tgk tgr tha tib tic tiw tks tlp tma tmn tmp tne toa tok tol ton tpa tru try tsg tsi tso ttn ttu tug tuk tul tun tur tuv twn tza umb una urk usa uzn vie wap wch win wiy wlf wma wnt woi wps wra wrs wuc xoo yan yap yaq yar yaw yay ycn yct yes yey ygr yko ykt yor ytu yuc yul yur yus zan zqc zul zun,503,76475,0.006577313
110A,Periphrastic Causative Constructions,,110,Jae Jung Song. 2013. Periphrastic Causative Constructions. In: Dryer; Matthew S. & Haspelmath; Martin (eds.) 2013. The World Atlas of Language Structures Online. Leipzig: Max Planck Institute for Evolutionary Anthropology. (Available online at https://wals.info/chapter/110),1,ame atc bab bag diy eng epe ewe ger hau hmo igb ind kfe klv kmu knr kob lav let may mnm mul mxc nav ndy pms psm rej tab tna wch yap yay,35,76475,0.0004576659
89A,Order of Numeral and Noun,,89,Matthew S. Dryer. 2013. Order of Numeral and Noun. In: Dryer; Matthew S. & Haspelmath; Martin (eds.) 2013. The World Atlas of Language Structures Online. Leipzig: Max Planck Institute for Evolutionary Anthropology. (Available online at https://wals.info/chapter/89),2,aab aar aba abo abu abv acl acn adg adi adz agb agh agm agt ajg akh akn alk all aln aly ama amb ame aml amo amp amq amt amx anc ane ang anj ano anu any ao aoj apt apw asm atk au awe awi awt awy baa bab bag bai bak bam bar bas baw bbl bbu bdu bem ber bfi bgm bgr bid bik bin bir bka bku ble blt blx blz bmb bni bnn boa bod bok bra bri brl brm brn brp bry bud bum bus buu bvi cai cas cct cem chg chi chs chw cic cmr cro cti ctm dag dan day dds deg dga dgb dgo dha did dig dim din dio diy dlm dma dms doy duk dul dum dun dyi edo efi ega egn eip eka emb emm epe erk err ewe ewo fas fon for fua fur fye gah gal gap gar gbb gbs giz gln gmw goe grb grj grw gud gul gur guu gwa gwo gyc hai ham han hat hau hdi heh hem hma hna hnd hol huc hya iau idn idu ifm igb ige ik imo ina inn irq irr irx isa iwm jab jad jel jms jng juh juk kac kae kar kau kbw kch kel ken ker kew kfe kga kgr kgy khd khm kie kim kin kir kis kje kkv klq kmb kmi kmj kmn kmo kmp kmr kmu kmz knc kni knk knm knr knz koa kob koe kok kon kos kpe kpw kqq kro krr kse ksg ksn kta ktc kte kti kuu kwb kwn kwt kyk kyl kyo lab lad lag lah lai lal lan lao lar lav lbu lda ldo leb lel len lep les let lew lgi lgt lis lkt llm lmg lmh lml lmu lnd lon lot lug luo luv ma maa mab mad mae maj mal man mao mar mas maw may mba mbe mbl mbm mbr mbt mby mda mde mdg mdl mdn mdo mdw mea mee mei mey mga mgi mgo mgq mgu mhl mij miy miz mka mkd mkg mkl mku mlg mlk mlu mmi mmv mmw mni mnm mnv mnz mof mok mom mon moo mor mot mou mpo mpt mpu mrg mrh mri mrl mro mrr mru msc msg msk msl msm mtb mts mua mud mum mup mur mwe mwo mxe myg myn nab nal nam nan nax nbd nbr ncm nde ndi ndj ndo ndt ndu new ney ngb ngg ngk ngm ngn ngo ngt ngu ngz nis nkn nko nku nma nnk non noo nph nrg ntj nto nua nue nup nus nyh nyk nym nza nze obo olo omh omi ora orh ori oro orw otr owi paa pai par pat pau paw per pia pis pit pkt plh pms pnx pod poh pok pre prh prk psw pum pun qia rag ral ram raw rgc rny ron rot rum rwa sah sak san sdw seb sem ser sgb sgu she shl shn sht sio skk sko sku sla slb sle slp smn sng snt so sob spi sro sud sue sul sup swa tab tam tao tau taw tba tbl tbt tbu tbw tdi tdr ten ter tes tet tgl tgn tgo tha thd thk thy tib tid tik tis tkl tlf tlo tmm tmn tmo tna tne tng tnn tou toz tpr trb trr ttd tte ttn tuk tum tvt uld una ung ura urt usa vai ven vif vnm wag wah wal wap wma wmu wna woi wra wsk wwa xam xas xbi xho yal yar yel ygr yi yid yiw ylm yor yqy yuc yul zag zan zar,608,76475,0.007950311
126A,'When' Clauses,,126,Sonia Cristofaro. 2013. 'When' Clauses. In: Dryer; Matthew S. & Haspelmath; Martin (eds.) 2013. The World Atlas of Language Structures Online. Leipzig: Max Planck Institute for Evolutionary Anthropology. (Available online at https://wals.info/chapter/126),3,abk ala ame awp baw brs bur cmn dni eve gim grw ham hix ho igb ijo ika ing irq kha kio knd lez map mar mei mrt nbd ngt niv noo pit ram shk snm squ thk tml tsh tur udh vai wra wrd yag yid yko ypk zul,51,76475,0.0006668846
59A,Possessive Classification,,59,Johanna Nichols; Balthasar Bickel. 2013. Possessive Classification. In: Dryer; Matthew S. & Haspelmath; Martin (eds.) 2013. The World Atlas of Language Structures Online. Leipzig: Max Planck Institute for Evolutionary Anthropology. (Available online at https://wals.info/chapter/59),2,alw amp asm bma boa brs buu chi chy dag diy diz dni dre dum dyi eka ewe fua gbb goo grr hai hat hve iau ijo imo kat kay kch kho kim kio kiu knk knm knu koa kob koi kro lan lda lkt lug luv maa mau may mlk mne mot mrg mrh mrt myi nai nbd ngi nim nug nyn orh oss pau poh pwn qui ram rap sal snm sul tau taw ter tgp tht tiw tkl tli ton tuk tun uhi was wem win wrn wsk yko yur,94,76475,0.0012291599
87A,Order of Adjective and Noun,,87,Matthew S. Dryer. 2013. Order of Adjective and Noun. In: Dryer; Matthew S. & Haspelmath; Martin (eds.) 2013. The World Atlas of Language Structures Online. Leipzig: Max Planck Institute for Evolutionary Anthropology. (Available online at https://wals.info/chapter/87),4,cct kut ser tja,5,76475,0.000065380846
58B,Number of Possessive Nouns,,58,Balthasar Bickel; Johanna Nichols. 2013. Obligatory Possessive Inflection. In: Dryer; Matthew S. & Haspelmath; Martin (eds.) 2013. The World Atlas of Language Structures Online. Leipzig: Max Planck Institute for Evolutionary Anthropology. (Available online at https://wals.info/chapter/58),1,abk aco aeg ain ala alw ame amh amp ane apu arm arp asm awp awt aym baa bag bej bel bma boa brh brk brm brr brs bsq bur buu bzi cax chi chk cho chy cin cnl cre ctm cyv dag dig diy diz djp dni dre dum dyi eka eng epe eve ewe fin fre fua fur gbb geo ger gmz goo grb grk grr grw hai hat hau heb hin hix hmo hua hun hve iau ijo ik imo ind ing jak jpn juh kat kay kch ket kew kha kho khs kim kio kln knd knk knm knp knr knu koa kob koi kor krk kro kui kut kzy lan lav lda lez lim lkt lug luv maa mal mao map mar mau may mdk mei mlk mnd mne mot mpa mrg mrh mrt mss mto mxc myi nah nai nan nar nbd nca nez ngi nim nkk ntu nug nyn ond orh ori oss otm pai pau prh prs pso pwn qim qui ram rap res rus sah sal sam san siu sla snm snt spa squ sue sul sup swa syu tag tau taw ter tgp tha tht tib tiw tkl tlf tli ton tot tuk tun tur tuv uhi ung vie wap war wch wem wic win wra wrl wrn wrs wry wsk yag yaq yes yim yko yli yor yuc yur zqc zul,233,76475,0.0030467473
69A,Position of Tense-Aspect Affixes,,69,Matthew S. Dryer. 2013. Position of Tense-Aspect Affixes. In: Dryer; Matthew S. & Haspelmath; Martin (eds.) 2013. The World Atlas of Language Structures Online. Leipzig: Max Planck Institute for Evolutionary Anthropology. (Available online at https://wals.info/chapter/69),4,aeg agc amh amr ang anu any arg arq asy ata ats awy bag bbl bbw bdu bfg bia bkl blr bma boa bsq bti ccm chh chk chq ckl cle cya cyv cze dds dgb dio eno gae gbs gmz gnb ham heb hup hve iri ito izi jak jms kab kan kgr kik kls kmr kon kpm krd kre kro kry ktm kuo kwy laa lar lat lbu ldo leg lel lmg lml maa mbl mcc mea meh mer mga mki mmn moh mok mrg mrl msk mug mur mxo myi naj nak nam nan ncm ndb ndj ngo nym nyu ond pai per pkt poh prs qia rik rus rut sak sar shs sht sod src stn sup taj tee tep tes tic tim tli tlo tne tot tus txj tzo tzu vai wag wic wrw wya xho yei ygr yul zag,146,76475,0.0019091206
144S,SOVNeg Order,,144,Matthew S. Dryer. 2013. Position of Negative Morpheme With Respect to Subject; Object; and Verb. In: Dryer; Matthew S. & Haspelmath; Martin (eds.) 2013. The World Atlas of Language Structures Online. Leipzig: Max Planck Institute for Evolutionary Anthropology. (Available online at https://wals.info/chapter/144),1,aba abv agm ajg asm ava baw ben blt bus bzi cai chp cnl dni dum eip eka ese isa iwm kaa kho kie kim kmz kng krr kti kyp lai ldu lkt lmn mac mdw mek mhi miz mtu nag nma nnk ong osa shb shi sla sme snm sro tmo trb tru tsz udm urk wna wom,60,76475,0.0007845701
88A,Order of Demonstrative and Noun,,88,Matthew S. Dryer. 2013. Order of Demonstrative and Noun. In: Dryer; Matthew S. & Haspelmath; Martin (eds.) 2013. The World Atlas of Language Structures Online. Leipzig: Max Planck Institute for Evolutionary Anthropology. (Available online at https://wals.info/chapter/88),2,aab aar aba abu ace acn adg adi adz aeg agb agh agm agt ajg akh akn alk all aln aly ama ame aml amo amp amq amx anc ane ang anj ano ao aoj api aro ata au avk avo awe awi ayw baa bab bag bai baj bak bas baw bbu bch bco bdu bdw bfi bgr bgs bid bik bin bir bka bkr ble blx blz bmb bni bol bra bre brf bri brp bry bse bsh bsi bsq bto bud bug buj bum buu bvi bwc ccm cct cem chh chj chr cic cle cme cnl coe cpl crn cro cso cya dag dan day ddj dds deg dga dgb dgo dha did dim dio dma dng dni dok don dre dum dun edo efi ega egn eno erk err ewe ewo fas fij foe fon fua fut fye gae gbb gbs gel gim gla gln gmw gmz gnd gnn goa goe gok grb grf gug gul gwa gwo hal ham han hat heb hem hid hmo hna hnd hoa huc hya iaa iau iba ido ifm igb ige ila ind inn iri irq irr isa izi jab jak jar jmo jms juh juk kad kan kar kau kba kbw kch kel ken ker kfe kgr khd khm khn kik kir kis kkv klq klv kmb kmj kmo kmp kmu kmw kmz knc kni knk knm knr knz kob koe kom kon kos kpe kpw kqq krb kro krr kse ksg ksn kta ktc kte ktl ktu kuu kwa kwn kwy kyk kyl kyo laa lab lah lal lan lao lda ldo leb lel len les let lew lgi lgt lgu lho lic lis llm lmh lmp lnd lon lot lou lug luo luv luy mab mad mae maj mar maw may mbe mbi mbl mbm mbr mby mda mde mdg mdo mdw mea mei mey mgo mgq mgu min mka mkj mkq mku mkz mlg mlk mlm mlu mmb mmv mna mng mnm mnt mnz mof mok mon mor mou mpa mpo mpt mpu mrg mrl mro msm msn mtb mud mum mup mus mwo mxc mxe mxj mxo mxy myg myn nab nak nal nam nar nbr ncm ndb nde ndi ndo ndr ndt ndu ndy neh ney ngb ngg ngk ngm ngo ngt ngu ngz nia nif nke nkn nko nnd nne nng non noo nsg ntj nua nue nun nup nus nyi nym nza obg obo olo ora orh ori oro orw ory otr pat pit plg plh pnu poh pok prh psw pul qia rag rap ras rga rny ron rot rov rum run sah sak san sea sed see sem ser ses sgb sgu shn sht sim sio sis sko sku sle slp sml so sob son sre sro sti sud sue sul sun swa tab taf tai tak tat tbo tbt tbu tdr ten teo ter tes tet tgh tgk tgn tgo tha thy tib tid tik tim tin tiv tja tke tlo tlp tmm tmn tmo tmr tna tne tng tnk tno toz tpr trb tri tsi tsk ttd tte ttn tuk tvl uld uli ung url urt usa vai vie vif vnm wah wal war wat wch wel wlf wma wmu wn woi wol wom wsk wwa xar xbi xoo yal yao yap yay yel yi yim yiw yns yor yul yus zag zai zap zar zya zzo,562,76475,0.0073488066
92A,Position of Polar Question Particles,,92,Matthew S. Dryer. 2013. Position of Polar Question Particles. In: Dryer; Matthew S. & Haspelmath; Martin (eds.) 2013. The World Atlas of Language Structures Online. Leipzig: Max Planck Institute for Evolutionary Anthropology. (Available online at https://wals.info/chapter/92),6,aar abk acu adz aga ala alk aml ana ang ano apl apu apw ara arc arg arm arw ass ath azi bae baf bao bco bdm bej bgz bii bik bil biu bla ble bln blt bmb bod brm brn brs bsh bti bum bur cah cai can car cba chc chi chk chv cml cmy coa cpl cpy crp ctl cub cup cze des deu dha dim din dio diy djm dlm dni dsh dut eip emb ene eng eno epe erk fas fij foe fri ful gae gah gal gar gdb gds geo ger ghb gim gln gmw gmz gnb grj grw guj gum gyc hay hix hmi hoa hpd htc hua hya hzb idu igb ijo ing irq irr ita ito jak jmo jug kab kae kan kay kba kbl kch kem khi kik kis kje kkp klv klw kma kmh kmk kmn kmr kmz knc kni knm knn knr knw koe kok kol kor kqq krc kro kun kuo kuu kws kwz kyk lab lad lan lbu lez lho lin lis lmh lon lot luo mab mac man mao mar mde mdn meh men mer mgg mik mku mlg mna mnc mne mng mni mnm mov mra mrl mrt msc msg msl mts mtt mwo mxc nab nad naj nbd ndi ndj ndr ndy nga ngd ngk ngo ngt ngz nha nht nif nmb nnd nnk noc nor nph nua nyk ora orh osa paa pae pai pal par pau paw pdp pip pme pms poh ppi prk psh pso psw ptt puq qaw qhu qia qui rem rny rom rov ruk run ryu sah sal sar sea ses shl sia sid skw sml smn sna snm spa src sta stl sud sue sul svs swe syu tab taf tai tar tbt tbw tbx tel ten teo thy tid tir tke tml tmo tni tob ton tps tsf tsi tsz tte tuc tun tuy tvl uby udh uli una usa usr uzb vnm wak wao wap war wem wly wma wol wra wrg wrk wrn wtm xbi yal yap yid yko yng yor zag zay zaz zch zqc zzo,355,76475,0.00464204
111A,Nonperiphrastic Causative Constructions,,111,Jae Jung Song. 2013. Nonperiphrastic Causative Constructions. In: Dryer; Matthew S. & Haspelmath; Martin (eds.) 2013. The World Atlas of Language Structures Online. Leipzig: Max Planck Institute for Evolutionary Anthropology. (Available online at https://wals.info/chapter/111),2,abi abk ace aeg ain aji aly ame amh ana apu arm aro asm atc awn awp aym bab baj bal bam bej bkr bla bma brh brr brs bsq bur but cah car cax cct ceb cha chk chv cld cle cmn coa coo cor cre cui dgr dio diy doy dre eng epe eve fij fin fut gar geo ger grb grw gua guj guu hai hau haw heb hin hix hmi hun hzb iaa igb ika ila ind ing irq jak jaq jpn kam kas kay kdz kem ket kew kfe kgu kha khm khs kin kio kis kls kmk knd knm knr kol kon kor kos krb krk krn kut kwa lad lan lat lav lep let lez lim lmp luv maa mab mac mak mal mao map mau mei men mhi mna mnm mns mny mrl mrt mss mwb mxc mym nbd nca ndo neh nez ngi ngl nht niu niv nko nti ntu nug nym oji ond orh orw pai pal pan pau pip pkn pny ppi prh prs psh psm pso pul pwn qim rap ret rot ruk rus sam saw sel shn shp shu sla sml snh snm son sor squ srn sun sup swa swt tab tag tah tas tel tim tiw tli tml tmr tna tng tno ton tsi tsw tuk tur tus tvl tzo uhi uli una urk usa ute uzb wam wat wch wic wma wol wra wrl yag yap yaq yel yid yko ykt ynk ypk yus yuw zul zun,254,76475,0.0033213468
86A,Order of Genitive and Noun,,86,Matthew S. Dryer. 2013. Order of Genitive and Noun. In: Dryer; Matthew S. & Haspelmath; Martin (eds.) 2013. The World Atlas of Language Structures Online. Leipzig: Max Planck Institute for Evolutionary Anthropology. (Available online at https://wals.info/chapter/86),1,aar aba abk abu abv acg acn aco acu adg adi adk adn adz aga agm ain akh akn ala all aln als amb amc ame amh amm amn amq amt amx ana ang ani ano anu ao api apl apt apu ara arc ari arm arw asm ass ath atk ava awa awi awp awt ayi aym ayo ayr aze baa bae bai bam baw bbw bdm bej bel bho bhu bii bik bil bin bio bkt bla bln blx bmb bnb bod bok bon bri brm brs bry bsk bsq bur bus but buu bya cah can car cas cav cax cay cbo cct cde chc che chg chh chi chk chn chs chv cln cmh cml cmn cmr cnl cnm cnt coa coc cpn cpy cro cti ctm ctw cub cup dag dan daw dds der des dga dgb dgr dha dhb dhi dhm dig diy djn dlm dmi dni dom doy drg drm dsh dul dum dun dyi edo ega eip emb eme epe ese est eud eve ewe fas fin for fqs ful fur ga gam gan gap gar gav gds geo gjj gln gmw gnn god gon grb grj grr grw gua gur gwa gyc hai har hat hay hhu hid hin hix hma hmo ho hop hpd hua huc hui hum hun hup hzb iau idn ijo ika imo ina ing iqu irr irx iwa jab jaq jel jiv jms jng jpn juh jva kaa kab kae kas kay kbt kbw kby kch kem ket kew kfe kgu kgy kha khd khg khi khl kho khw kim kio kir kiw kje kkp kkq kku kkv kla klg kll klm klq klr klv kma kmb kmh kmk kmo kmp kms kmz knb knd kng kni knm knn kno knw knz koa kob kok kol kop kor koy kpe kpw kqq krc krk krn krw kry krz ksa kse ksg kta kti kty kum kuv kwo kwt kwz kxo kyl kyn kyr kyz kzy lab lad lah lai lal lat lav ldu lep let lez lgt lim lis lit llm lmn lng lot lug lui lul mac mag man map mar mau maw mba mbo mcc mco mde mdm mdn mea mei mek men mer mey mgg mhi mie mii mik mis miz mka mke mkg mkl mku mlm mme mnd mne mni mno mns mnv mny moh mom moo mor mos mot mpr mpt mrd mri mrr mru mrw msc msg msn mts mtu mun mut mxx mym myr nab nad nam nar nav nbd nbr ncm nep nev new ney nez ngi ngt nis niv nkn nku nma nnk noc nph nrg nsn nti ntj ntu nua nwd nyi oji oks omh omi ong ord ork oro ory osa oss owi pae pan pat pau pba pdp pia pir pis pit plh plk pme pmn pno pnu pnx pok ppc ppi pra prh psh pso ptt pul pum pun pwn qaf qaw qhu qia qim ral ram rao raw rem res ret rgc rum run rut rwe sah sar sav sdw sec sem ser sgb she shi shk sia sid sin sio skk sko skp sla slb sle slp sme smn sna sng snm sno snt sob sod src srn sro sta stl sud sue sug suk sup sus svs swe tab tac tak tam tar tau taw tba tbt tdi tel tgl tgn thk thn tho thu tib tid tir tis tiw tja tkl tkm tlf tli tlo tls tma tml tmo tnb tnc ton tou tpn tpt trb trr trt tru trw tsf tsh tsm tsz ttd tte ttn tts ttu tul tun tur tuv tvo twe tye uby udh udm uhi uli una urd urk urn usa usr ute uzb vai wah wai wak wao wap was wat way wbn wch wed wem wik win wiy wly wma wme wmu wna wog woi wom wra wrm wrw wsk wwa xam xas xav xer xoo yag yal yaq yar ybi ycn yei yel ygr yid yim yin yiw yko ykt yqy yrm ytu yuc yuk yur yus yyg zar zay zch zpr zqc zqs zun,685,76475,0.008957176
144P,NegSOV Order,,144,Matthew S. Dryer. 2013. Position of Negative Morpheme With Respect to Subject; Object; and Verb. In: Dryer; Matthew S. & Haspelmath; Martin (eds.) 2013. The World Atlas of Language Structures Online. Leipzig: Max Planck Institute for Evolutionary Anthropology. (Available online at https://wals.info/chapter/144),4,aba abk abv adg agb agm ain akh ala aly ame amh amp ang ao apl apt apw arc arm asm ass ath ava awa awp awt aym aze azi baa bam baw bej ben bho biu blx boa bok brl brm brp bsq bti bur bus but bzi cah cai can car cas cay cct cde chc chg chh chp chv cln cml cnl coa cpn ctm dag dds des deu dhm dig dim din dji dni drm dum dun dut eip eme epe ese eve fur gah gal gap gar gds geo ger gim gln gmw gon grb grw guj gur guu gwa ham hay hid hin hmi hop hpd hua hui hum hzb idn ijo ika irq irx isa iwm jiv jms jpn kaa kab kac kae kbo kem ket kew kha khd khg khl kho kie kim kis kiw kkp kla kll kma kmb kmh kmn kmo kmp kmr kmz knd kng knm knn knr knz koa kob kok kol kor koy krc krd krh krr krw kry kse kta kti kty kun kus kuv kwt kwz kyp kyr kyz lad lah lai lav ldu lep lez lis lkt lmn lot mab mac mag man mar maw mbi mdn mdw mee mek mgg mgi mhi mik mis miz mka mkg mkh mki mkj mnc mne mnm mns mpa mpt mrs mru msc msg msl mts mun mur mym nab naj nam nar nas nbd nep new nga ngt niv nku nma nmb nnk noc ntj ntu nwd nyi oks omh ong orh ori osa oya pae pan paw pme prh prk prs psh ptt pum ram rao ras raw ret rgc rum sar sdw ser shb she shh shi shk sia sid sil sla slb sme smn sna sng snm snn snt sod som srb sro stl sup syu taj tak tam tao tar tau tba tbl tbu tdr tel tgl tgr thn thu thy tib tig tli tlo tma tml tnn tod ton tpt trb trm tru tsf tsh tsz tte ttu tul tun tur tuv tuy twn tye uby udh udi udm una urd urk usa usr uyg uzb vai wag wak wao wap was way wbn wly wme wna wom wsk yam yaq yar ygr yid yko ykt yqy ytu zag zay zaz,381,76475,0.0049820202
123A,Relativization on Obliques,,123,Bernard Comrie; Tania Kuteva. 2013. Relativization on Obliques. In: Dryer; Matthew S. & Haspelmath; Martin (eds.) 2013. The World Atlas of Language Structures Online. Leipzig: Max Planck Institute for Evolutionary Anthropology. (Available online at https://wals.info/chapter/123),2,ame bam cnl epe goo hin hix ika lav lkt sla sup usa,14,76475,0.00018306637
76A,Overlap between Situational and Epistemic Modal Marking,,76,Johan van der Auwera; Andreas Ammann. 2013. Overlap between Situational and Epistemic Modal Marking. In: Dryer; Matthew S. & Haspelmath; Martin (eds.) 2013. The World Atlas of Language Structures Online. Leipzig: Max Planck Institute for Evolutionary Anthropology. (Available online at https://wals.info/chapter/76),3,aco akn ame amh ana asm aym bab bkr brh brs chk cre cyv dag dre eka eve fij gar ham hzb imo ind ker ket kha kho khs klv kmu knr kob kty kut lad lav lep lez lkt mai mal mao mdg meh mei mhi mie mku mna mns mok mrd mun mxc myi ndy nez nht niv nko nma nug otm pai pan pau pba pit psm pso qim sel shk sla sml smt snm sno som squ sup tab tgr tli tor tru tuk tvl una ung usa uzb vot wam wch wra yaq yko ypk yuc yur zqc zya,105,76475,0.0013729978
116A,Polar Questions,,116,Matthew S. Dryer. 2013. Polar Questions. In: Dryer; Matthew S. & Haspelmath; Martin (eds.) 2013. The World Atlas of Language Structures Online. Leipzig: Max Planck Institute for Evolutionary Anthropology. (Available online at https://wals.info/chapter/116),2,aar abk acu aga ana ang apw arc ass ath bao bco bej biu bla bln blt bmb bod brm brn brs bti bur can car cba chc chi chv coa cpy crp cub des deu dim dni eip emb ene epe fas foe ful gae gah gal gar gdb gds gim gln gmz grw gyc hua hzb idu ijo ing irq ito jug kae kan kem khi kje kkp klw kmh kmk kmn kmr knm knn knr knw koe kok kol kor krc kro kwz kyk lad lez lho lis lot mab mar mdn men mgg mik mnc mne mni msc msg msl mts mtt nbd nga ngt nmb nnd noc nph nyk pae pau paw pdp pme prk pso ptt qaw qhu qia qui rem run ryu sal sia smn sna src sta stl sue syu tbx tel tml tmo tni ton tsf tsz tte tuc tun tuy uby una usr uzb wak wao wap wly wra wtm yal zag zqc,164,76475,0.0021444918
4A,Voicing in Plosives and Fricatives,,4,Ian Maddieson. 2013. Voicing in Plosives and Fricatives. In: Dryer; Matthew S. & Haspelmath; Martin (eds.) 2013. The World Atlas of Language Structures Online. Leipzig: Max Planck Institute for Evolutionary Anthropology. (Available online at https://wals.info/chapter/4),3,aea aht amu ao arm ata awp bai bee chp chq fye gla grw gua ite ksg kwo lkt luv mme mnd mxm mzc nav niv poa qco sla spa svs tso umb vie wuc yus zul,38,76475,0.0004968944
90A,Order of Relative Clause and Noun,,90,Matthew S. Dryer. 2013. Order of Relative Clause and Noun. In: Dryer; Matthew S. & Haspelmath; Martin (eds.) 2013. The World Atlas of Language Structures Online. Leipzig: Max Planck Institute for Evolutionary Anthropology. (Available online at https://wals.info/chapter/90),3,cct chi cmr dds epe hai ika kio kut lav lkt mpt msn nav ond osa ret rgc ser tja tou wap yuw,24,76475,0.00031382806
