parameter_id,parameter_name,parameter_description,chapter_id,chapter_citation,value,same_value_language_ids,value_language_count,language_count_total,count_ratio
19A,Presence of Uncommon Consonants,,19,Ian Maddieson. 2013. Presence of Uncommon Consonants. In: Dryer; Matthew S. & Haspelmath; Martin (eds.) 2013. The World Atlas of Language Structures Online. Leipzig: Max Planck Institute for Evolutionary Anthropology. (Available online at https://wals.info/chapter/19),1,abi abm ach acm adk adz aht aik ain akn akw ala alw amh amp amu amz ana anc ant ao api apu arb arm arp asm awn awp aym aze bag bai baj bam baw bco bee bej ben bis bki bkr bng bno bod brd bre brh bri brr brw bsq bto bua bul bur byu cac cad cah cam car cax cay cck ccp cha che chk chl chu chv chw cil cle cmn cnl cnt cof coo cre cso cti ctl cve cyv dad dag dar ddf der dgr din dio diy diz djp dni dnw don dum dyi eka epe eve evn eya fas fef fin fre ful fur fuz fye gan gar gds geo ger ghb gla gmb goa goo grr grw gua hai hak ham hau haw hba hin hix hmo hmr hok hop hun hup iba ign ik ika imo ind ird irr irx ite ito iva iwm jak jaq jav jeb jeh jiv jng jom jpn jpr kad kal kas kay kch ked kef kek ker ket kew kfe kgi kgu kgz kha khm khr khs kio kiw kkn kkv klm klv kly kmp kmu knd kng knk knm knr koa kob koi kom kor kot koy krb krk kro kry kse kty kul kun kur kut kwa kwk kwo kws kya kyl kzy lad lah lam lan lat lav len lep lez lit lkt lu lua lui luo lus luv maa mab mak mal mao mau max may maz mbb mei mgg mie mku mla mlk mnc mnd mne mog mor mov mpa mrd mrg mrn mrt mss mtp mui mun mya myi mzc nai nan nap nar nas nav nax nbk ndt ndy nep new nez ngz nhn nht nim nis niv nko nkt nmb nnc nob non nor nug nun nyg nyi oca oji ond ood orh orm pac pae pai pau paw pec phl pit pms pnr poa poh pol prh prs psh psm pso puk pur qaw qui ram rap res rom ror rsc rus sab sba scs sdh seb sed sel sha shi shk shs shu sin skp sla slp sml snc snh snm snt sor sre srn sue sui sup svs tab tag tam teh tel ter tgk tha tib tic tiw tks tli tlp tmn toa tol ton tpa tru try tsg tsi tso ttn tug tuk tul tun tur tuv twn tza umb una ung urk usa uzn vie wah wam wao wap war wch wdo wic win wiy wlf wma wmu wnt woi wps wra wrd wrs wry wuc yag yan yaq yar yaw ycn yct yes ygr yid yim yko ykt yny ytu yuc yur yus zqc zun,449,76475,0.0058711995
14A,Fixed Stress Locations,,14,Rob Goedemans; Harry van der Hulst. 2013. Fixed Stress Locations. In: Dryer; Matthew S. & Haspelmath; Martin (eds.) 2013. The World Atlas of Language Structures Online. Leipzig: Max Planck Institute for Evolutionary Anthropology. (Available online at https://wals.info/chapter/14),1,abe abk aeg ael agu ahs akl ala ame apa apu arc arg arh arl arm arv asy atq au ava awd bej bgg bgv bho bkl bkr bna bqg bqh bqi bqz bso bui bur bwa cap car cct ceb cha chv cle coo cpa crk ctl cub cyg des dhu dhw djr dsh dut eka emc eng epe eve fij for fre gay ger god gor grb guj hin hix hno hop htc hzb iga irm irq ita jav kaj ker kew kha kit klm klv knm koa kop kra krk kro ksh ktn kuu kuz kwk kws lar let lez lit lmh lui mah mai mak mam mao mcs mdm mea meb men mlc mlk mlt mly mme mmo mnd mne mng mnm mrk mrl mrs mrw mse mss mun mwn mym nav nbd ndy nep nez ngd ngi nor nya obk occ oss oto plb por prh psh psm pul ram rom ror rot rsm rus sak sao scr sdh sea ser shk sio skp skr sla slo snc snt spa spo sps srd sru sun svc swe swi tah tbl tgw tib tlo tng tno tns tnt tol tps tsh tur uli ung unm usa wam wic wiy wlo woi wrg yan yap ych yid yil yin yko ypk ysl yuc yun yuw yzv,220,76475,0.0028767572
16A,Weight Factors in Weight-Sensitive Stress Systems,,16,Rob Goedemans; Harry van der Hulst. 2013. Weight Factors in Weight-Sensitive Stress Systems. In: Dryer; Matthew S. & Haspelmath; Martin (eds.) 2013. The World Atlas of Language Structures Online. Leipzig: Max Planck Institute for Evolutionary Anthropology. (Available online at https://wals.info/chapter/16),7,aeg ael ahs apa arv atq ava bgv bho bkr cah cap crk cyg emc iga irq kay ker kra kwk mam mlt mly mse nya occ prh psm rsm spa svc tno tnt unm wrg yap yaq ych ypk yun,42,76475,0.00054919906
83A,Order of Object and Verb,,83,Matthew S. Dryer. 2013. Order of Object and Verb. In: Dryer; Matthew S. & Haspelmath; Martin (eds.) 2013. The World Atlas of Language Structures Online. Leipzig: Max Planck Institute for Evolutionary Anthropology. (Available online at https://wals.info/chapter/83),1,aar aba abk abn abo abv acn acu adg ady aga agm agt ain akh ala ale aly amb amc ame amh amn amp amt amx ana ang ano ao api apl apt apw arc arw asm ass asu ath atk atm ava awa awi awp awt awy aym aze azi baa bam bao baw bbw bdm bdw bej bel ben bgm bgn bho bhu bin bio biu bkb bkt bln blt blx bnj bnu boa bod boj bok bon boq bri brl brm brp brs bry bsk bsq bsr bti bua bun bur bus but bya bzi cah can car cas cay cbo cct cde chb chc chd che chg chh chi chk chn chp chs chv cln cml cmn cmr cnl coa cpn cpy cro cti ctm ctw cub cui cup dag dan daw dds der des deu dgr dha dhb dhm dig dim diy dja dji djp dlm dmi dmk dms dni drg drm dul dum dun dyi edo eip eka emb eme ene epe ese eud eve evn fas foe for fqs ful fur gah gal gam gan gap gar gav gds geo ghb ghr gim gln gmw god gog gon goo grw gug guh guj gur guu gyc hai ham han har hay hhu hid hin hix hlp hma hmi ho hop hpd hua hui hum hzb iat iau idn idu iha ijo ika imo inn irq irx isa isi ite iwm jad jbt jin jiv jms jng joh jpn jrw jug jva jwr kaa kab kac kae kbo kbt kbu kem ket kew kgu kgy kha khd khg khl kho khr khw kie kim kio kiw kkp kkq kku klg kll klq klr klw kma kmb kmh kmk kmn kmo kmp kmr kms kmz knb knc knd kng knm knn kno knr knw knz koa kob kok kol kop kor koy kqq krc krd krh krn krr krw kry krz ksa kse kta kti kty kum kun kus kuu kuv kwb kwo kwt kwz kxo kya kyk kyn kyp kyr kyz lad laf lah lai lak lal lar lav lep lez lho lim lis lkt lmn lot lun mab mac mag mai man mar maw max mbo mde mdl mdn mei mek mem mer mey mgg mgh mgi mhi mii mij mik mil mis miz mka mke mkg mkh mki mkj mkl mku mlk mme mnc mne mni mnm mno mns mnv mny mog mom mot mpa mpt mqf mrc mrd mrh mri mrr mrs mru msc msg msl msn mto mts mtu mui mun muu myi mym myr nab nad nag naj nam nar nas nat nav nbd nbr ndj nep nev new nga ngg ngi ngj ngn ngt nis niv nkb nku nma nmb nmd nmm nnd nnk noc nog nph nsn ntj ntu nus nwd nya nyi nyk nze oir oks omh omi ong ord orh ori ork oro orw ory osa oss owi oya pae pan par paw pba pdp pia pir pis pit pme pmn pno pra prh prk prs psh pso ptt ptw pun qaf qaw qhu qim ral ram rao ras raw rem res ret rgc ria rik rmb rpa rum run rut rwa ryu sar sav sdw sel sem ser shb she shh shi shk sho sia sid sil sin skk sko skp skr skw sla slb slg sme smn sna sng snh snm snn snt sod som spi srb src srn sro sta stl sue suk sup sus svs syu tac taj tak tam tao tar tau taw tba tbl tbt tbu tce tdi tdr tel tgl tgr thk thn thu thy tib tig tir tis tja tkl tkm tlf tli tlo tls tma tmc tmg tml tmo tnb tnc tni tnn tny tod ton tou tpt trb trr trw tsf tsh tsz tte ttu tuc tul tun tur tuv tuy tvl tvo tvt twe tye uby udh udi udm uhi una ung urd urk urn uru usa usr ute uyg uzb vaf vai wag wah wai wak wao wap was wau way wbn wed wic wlw wly wme wmu wn wna woi wom wra wsk wtm xas xer xns yah yal yam yaq yar ybi yei yel ygr yi yid yim yko ykt ylm yqy ytu yuc yuk yus yuw zag zay zaz zim zun,712,76475,0.0093102325
137A,N-M Pronouns,,137,Johanna Nichols; David A. Peterson. 2013. N-M Pronouns. In: Dryer; Matthew S. & Haspelmath; Martin (eds.) 2013. The World Atlas of Language Structures Online. Leipzig: Max Planck Institute for Evolutionary Anthropology. (Available online at https://wals.info/chapter/137),2,cax chi cho cku csh dum kio krk lui map mco mis mne ood pip ram shp sup war wch win xok yaq ywl,25,76475,0.0003269042
136A,M-T Pronouns,,136,Johanna Nichols; David A. Peterson. 2013. M-T Pronouns. In: Dryer; Matthew S. & Haspelmath; Martin (eds.) 2013. The World Atlas of Language Structures Online. Leipzig: Max Planck Institute for Evolutionary Anthropology. (Available online at https://wals.info/chapter/136),1,abk ace aco aeg ain ala ame amh amp ane apu arp asm atk awp awt ayw bag bej bel bma brk brm brr brs bsq bur cax cha chi cho cin cjo cku cnl coo cre csh ctm cyv dag diy diz dji djp dni dum dyi eng fij fur gbb git gku goo gua hai hat hau heb hix hmo hua hve iau imo ind ing jak jaq jiv jpn juh kat kay ket kew kho kio kiw kmb knd knr koa kob kor kot kri krk kro kse kut lan lav lda lez lug lui luv maa mal map mar mau may mco mdk mei mis mlk mnd mne mot mrt mun mxc myi nah nar nat nbr nca ngi ngl niv nmb ntj nug nuu ond ood orh ori otm pai pau pip pme prh pur qim qui ram rap sah sal san shp shs sla snc snm snt squ sul sup swa tag tau tib tiw tkl tlf tli tmc tmr ton tpa tru tuk tun tzu uhi ung vie wao wap war was wch wem wic win wiy wra wrd wrn xok yag yaq yna yor yuc yuk yur ywl zqc zul zun,200,76475,0.0026152337
127A,Reason Clauses,,127,Sonia Cristofaro. 2013. Reason Clauses. In: Dryer; Matthew S. & Haspelmath; Martin (eds.) 2013. The World Atlas of Language Structures Online. Leipzig: Max Planck Institute for Evolutionary Anthropology. (Available online at https://wals.info/chapter/127),3,abk ala awp bdc brs eve gim goo grw ham hix hlp hzb igb ijo irq knd lav mar mei mrt nbd ngi ngt niv pau pit qhu rap res ret snm tml tsh udh ute vai yag yko ypk zul,42,76475,0.00054919906
96A,Relationship between the Order of Object and Verb and the Order of Relative Clause and Noun,,96,Matthew S. Dryer. 2013. Relationship between the Order of Object and Verb and the Order of Relative Clause and Noun. In: Dryer; Matthew S. & Haspelmath; Martin (eds.) 2013. The World Atlas of Language Structures Online. Leipzig: Max Planck Institute for Evolutionary Anthropology. (Available online at https://wals.info/chapter/96),5,ace aco adn ajg all alw amt ani any ao apu ara arm avo awe azi bac bam baw bfi bil bla blr bnb brh bya cai cam cav cct chg chi chk cld cmh cmr cnl cnm coo dam ddj dds dgo dhr din diy djm djn djr dlm drm dut efi emm epe fri gah ger ggu gid gim git gmw gnn god grg grj gum gwa hai har hin hun hup hwr ido ika imo ina jam jeb jms kas kay kew khr kio kis kkq kkw klg klm kmb kmw kmz knd koa kob krk krn krw kut kws kya kyo lai lal lav lda ldu lec les lgt lkt lml lug lui mac mad mai mak mar mco mek men mgq min mka moa moh mou mpa mpt mra mrt mrw msn mss mtt mud mxx mzh nam nav ney nez ngi ngk ngl nha nhn nrg nti nue nug ond osa oya pan pau pit pnx pny pok ppi res ret rgc rit ruk ser skw sla snc snm squ stl sup tau tdr tic tik tis tja tou tru tsh tuk tus twe twn udh urd vai wan wao wap wbn wik win wiy wrd wrg wrl wrw xas yid ypk yur yuw ywr zar,213,76475,0.002785224
101A,Expression of Pronominal Subjects,,101,Matthew S. Dryer. 2013. Expression of Pronominal Subjects. In: Dryer; Matthew S. & Haspelmath; Martin (eds.) 2013. The World Atlas of Language Structures Online. Leipzig: Max Planck Institute for Evolutionary Anthropology. (Available online at https://wals.info/chapter/101),2,aar abk acg acl aco aeg aga ain aja ala alb all amh amq amr amx ane ang any aoj apl apu apw ara arg arm arp arq arw asm ass asy ath awa awp aym ayr bae bbl bbw bco bej bel bem bfg bgr big bii bik bin bio bir bku bln blx blz bma bnb bob bol bre brf brh brp brr brs bsh bsk bsq bsr bul bum bur cah cai cax cba cct cde che chh chi chk chx cic cld cle cln cmy coo crn cro ctl cub cyv cze dag dds des dhi dig dim dio dlm dni dom efi eip eko emb eme ene err esm est ewe ewo fua fur ga gaa gah gds gjj gln gmw gmz goo grg grk grw gua gul gyc ham hat hay heh hix hlu hmi hnd hua hun hya ifu ige ik ika ila ina irq isa ita ite ito izi jab jam jmo kab kae kam kan kba kdw kew kfe kga kgr kgz kik kio kkv klv kma kmb kmh kmj kmp kms kmz knd knm kno knr koa kob koe kon krc krd kre krk krr krw ksa kty kwk kwn kwt kwz kyk lan lav lbu lda ldo leg len let lgi lil lim lin lit lkt llm lml luc lul luo luv luy maa mab mac maj map mar mau mbl mbo mbt mby mcc mcv mdn mea mee meh mir mkd mki mku mlu mme mmw mna mne mnm mns moe moh mou mpr mpt mpu mra mrl mro msc msl mss mtb mua myi mzh nab nag naj nan nav nbd ndb ndj nez nga ngo nhh nhm nhn nht nko nmb nnd nse nti ntu nua nue nug nwd nym nyn nyu obg obo ocu olo ond orh oro osa otm pai pan pau pga pkn pkt plh pms pog por pra pre prs pwn qim qum ram rem rim rny rru ruk run rut sak san sar scr ser sgb sgl sgu shm shu sid sio siu skm skp sla slb slo sml so sob spa squ srb src sro stn sul swa taj tar tau tbw ten tep tes tet tgh tgn tgr tiw tja tki tkl tkm tli tlo tmc tmr tna tnc tob ton toz tps trb trr tsk tsz tte tuk tun tur tus tuv tvo uby udm uld una ung ura urk urn usa usr uzb ven wai wal was way wic wiy wma wrd wrk wrm wrw wry wya yal yao yar yel ygr yim yko ypk yuc yur ywl zai zap zay zqc zul,437,76475,0.0057142857
17A,Rhythm Types,,17,Rob Goedemans; Harry van der Hulst. 2013. Rhythm Types. In: Dryer; Matthew S. & Haspelmath; Martin (eds.) 2013. The World Atlas of Language Structures Online. Leipzig: Max Planck Institute for Evolutionary Anthropology. (Available online at https://wals.info/chapter/17),4,arm atq bgg bho bqi bqs bwa cha far fre gae gid glp grw hnn hop iri ita jav khm knm koy kra kro lit mlt mym nbd nor pul rap ser ung wet yap yuc,37,76475,0.00048381824
2A,Vowel Quality Inventories,,2,Ian Maddieson. 2013. Vowel Quality Inventories. In: Dryer; Matthew S. & Haspelmath; Martin (eds.) 2013. The World Atlas of Language Structures Online. Leipzig: Max Planck Institute for Evolutionary Anthropology. (Available online at https://wals.info/chapter/2),2,abi ach acm aco aeg aht aik ain ame ani ant ao apu arb arc arm asm ata ava baj baw bee bej ber bis bng bno bod brh bri bsq bto bua bul bur cac cam car cha che chk chp cil cle cmn cof coo cso cti cub cve dad dag dah dar ddf der det dgb diz eka eve evn fas fij fur fye gar geo ghb gmb goa grk gua gwa had hak hau haw hba hin hix hmo hmr hok hop htc hum hve iba igs ind ing ird irq irx ite ito iwm jak jng jpn jpr juh kad kal kch ked kef kek ker kew kho khr khs kio kiw kkv klv kly kmp knd knk knm koi kot koy kpa krb krk kry kse kty kul kun kur kwa kwk kws lad lam lat lav len lez lit lkk lkt lui luv mak mao map mar mau max may mei mgg mku mlk mnc mnd mne mog mor mov mrd mss mui mum mun mxc mxm mya myi mzc nai nap nar nas ndy nep nez ngz nht nim niv nko nmb nob ntu nun oca ood orh orm paw pec pms pol prs psh psm pso pur qco rap res ror rsc rtk rus rut sba scs sdw seb sha shi shu sin sla slp snc soq sor spa sue svs swa tab tag tam tel ter tgk tgr tic toa tok tol ton tru try tso ttn ttu tuk twn tza umb ung urk usa uzn wah wao wap war wch win wiy wma wmu wra wrd wry xoo yag yan yaq yar yaw yay ycn yct yey ygr yko ytu yuc yur zqc zul zun,287,76475,0.0037528605
144B,Position of negative words relative to beginning and end of clause and with respect to adjacency to verb,,144,Matthew S. Dryer. 2013. Position of Negative Morpheme With Respect to Subject; Object; and Verb. In: Dryer; Matthew S. & Haspelmath; Martin (eds.) 2013. The World Atlas of Language Structures Online. Leipzig: Max Planck Institute for Evolutionary Anthropology. (Available online at https://wals.info/chapter/144),4,aba abv adg agm ani anu asm ava baw ben ble blx bok brm bus bzi chp chs cmr cnl cti dma dni dum dun ese fre hlp hma iau ijo isa iwm kaa kho kie kim klw kmz kng kol krc krn krr kti kxo kyp kyr lai lav len lew lkt lmn mac mbe mdw mek mhi miz mkh mxe nas ngo nma nnk nse nze ong osa paw qaw sel shb shi skk sla sme snm sro sup tbl tja trb tru tsz udm urk wna wom yul,92,76475,0.0012030075
8A,Lateral Consonants,,8,Ian Maddieson. 2013. Lateral Consonants. In: Dryer; Matthew S. & Haspelmath; Martin (eds.) 2013. The World Atlas of Language Structures Online. Leipzig: Max Planck Institute for Evolutionary Anthropology. (Available online at https://wals.info/chapter/8),2,abi abk acm aea aeg agh aiz alb ald alw ame amh amo amp amz ana anc ao arm arp ata awn aym aze bag bai baj bam baw bbf bco bee bej ben ber bet bir bis bki bkr bma bng bod bra brb brd bre brh brm brw bsk bsq bto bua bul bur byu cac cah cam cay cha che chl chq chu chv chw cil cle cnl cnt cso cti ctl dan dar ddf dgb dgr din dio diy diz djp dni dnw don doy dre dts dum dyi eng eve evn ewe ewo fij fin fre ful fur fuz fye ga gbb ger ghb gla gmb goo grb grk grr gua gwa hak hau haw hba hin hmo hmr htc hun hve iba igb ign igs ijo ik imo ind ing ird irx iso ito iva jak jaq jav jeb jeh jng juh kad kas kay kch ked kef kek ker kfe kgi kgu kgz kha khr khs kkn kkv klm klv kly kmp kmu knd knm knr kob koi kom kor kot koy kpe krd kro kry kse ksg kss ktk kty kul kun kur kwa kws kya kyl kzy lad lah lak lan lat lav len lep lez lkk lkt llm lu lua lui luo maa mab mal map mar mau maz mba mbb mbm mei mgg mie mku mla mlk mme mnc mnd mne mog mpa mrl mrn mro mrt mss mum mun mxc mxm mya myi mzc nai nan nap nar nax nbk ndt ndy nep new nga ngi nhn nis niv nkt nnc nob non nor nti ntu nug nun nyg nyi ogb oji ond orh orm otm pac pae pec phl pit pms poa poh pol prs psm pso puk pur qaw qco ram rom rsc ruk rus rut sab san sba scs sdh seb sed sel sha skp slp sml snd snh som soq sor spa sre sui sup svs swa tab tag tam tas tel tgr tha tib tiw tks tlp tma tmn tmp tne toa tok tol ton try tsg ttn tug tuk tul tun tur tuv tza umb una ung uzn vie wah wam wap wch wdo wlf wma wmu woi wrd wrs wry wuc xoo yan yap yaq yay yct yel yes yid yim yko yny yor ytu yul yus zqc,388,76475,0.0050735534
143A,Order of Negative Morpheme and Verb,,143,Matthew S. Dryer. 2013. Order of Negative Morpheme and Verb. In: Dryer; Matthew S. & Haspelmath; Martin (eds.) 2013. The World Atlas of Language Structures Online. Leipzig: Max Planck Institute for Evolutionary Anthropology. (Available online at https://wals.info/chapter/143),2,aab aba abv agm aja alk aln amq anc ane ani anu ara asm ava bag bak bas baw ben bgr big bik bir bka bud bum bus bzi chp chs chw cmr cnl cti dgo dni duk dum ega ese gbs giz gla gmz goe gul gwo hat hma hna iau ige igs irr isa iwm jab jar jmo juk kaa kar kau kel ken ker kho kie kim kkv kmz kng kpw krn krr kti kxo kyl kyp laa lab lag lai lel lgt lin lkt lmh lmn lon lug mac mad mas may mba mbm mbr mby mda mdg mdo mdw mea meh mek mgu mhi mig miz mlu mmb mor mou mpu mrg msm mtb myg nbm ngm ngz nma nnk nrg nua nup nza nze olo ong osa pat pod pog qaw ron rsu sah san saw sel sgb shb shi sht shy sio skk sla sme snm sro tab tiv tpr trb tru tsz udm uld urk wec wma wna wom wrm xav yul,171,76475,0.002236025
26A,Prefixing vs. Suffixing in Inflectional Morphology,,26,Matthew S. Dryer. 2013. Prefixing vs. Suffixing in Inflectional Morphology. In: Dryer; Matthew S. & Haspelmath; Martin (eds.) 2013. The World Atlas of Language Structures Online. Leipzig: Max Planck Institute for Evolutionary Anthropology. (Available online at https://wals.info/chapter/26),5,adi amo amq aoj arp au bar bbu bbw bfg bgo bgr bik bla bnn brf brp bua cam che ckl cop cyv eno erk gnn goo gyc hup idn kan kbw ket kkv kls klv kmj kmz kro ksa ktc lar lbu len lew lkt lmh lon lug maa mam mau mba mea mmv moh mra mro msn mxp nhm nua nyu nza ond otm otr pal pam pga pms ras sak sng src srn swa tas taw tbo tee tgh tja tmn tno tou tuk tus urk wal wic wrw xav,94,76475,0.0012291599
129A,Hand and Arm,,129,Cecil H. Brown. 2013. Hand and Arm. In: Dryer; Matthew S. & Haspelmath; Martin (eds.) 2013. The World Atlas of Language Structures Online. Leipzig: Max Planck Institute for Evolutionary Anthropology. (Available online at https://wals.info/chapter/129),1,ain amh amr apj apw aro arw arx awa aym ayn aze bam bgr bla blj blr bnq brc btk cab cah cak car cay cch cck ccp cha chj chl cho chr chw cin cmc cmy cof col cor crl csf csk ctt ctw cuu cyn cze dam dca efi eka ena eud for fut gad geo git gku grm gul hau haw hop hui ifu igb ika ilo itw itz ixi jak jeh jmo jpn kat kaz kdz kea kfe kha khg khk khm kio kis kje kky klw kmh kmk knr kon kos kpn kro ktb kuq kwa kwe lau len lez lit lnw lui mab mai mao maz mby mer mgg mhi mid mij mnc moj mok mop mos mse msh mtp mum mup muy mwb mxg mxu mym nas nbd ngz nht niu nkr nnm nog nom npa nsz nym obg oka oko olu ood ore osm pac pae pal per poh prt pul pur qch qui rad ram rgn rng rnn rus sam say scr sed ser shn shu sin smj smt snh sno sol son squ stl sus svk swa tah tbe tce tga tib tkm tlp tml tna tnj toa toj tpi tsf tua tuc tvo tze tzo tzt udh ukr uzb ved wol xoo yak yap yar yav yct ygr ykp ylb zai zaj zam zfl zun zzo,228,76475,0.0029813664
143F,Postverbal Negative Morphemes,,143,Matthew S. Dryer. 2013. Order of Negative Morpheme and Verb. In: Dryer; Matthew S. & Haspelmath; Martin (eds.) 2013. The World Atlas of Language Structures Online. Leipzig: Max Planck Institute for Evolutionary Anthropology. (Available online at https://wals.info/chapter/143),1,aab aba abu abv acl adg adz agh agm aja ajg alk aln aml amo amq anc ane ani anu aoj ara arp asm au ava bab bag bak bas baw bbf bbu ben bgo bgr bid big bii bik bir bka blt blx bmb bob bod bok bol bre brm bud bum bus buy bzi cai cak chj chp chr chs chw cmr cnl cop cti ctl dgo dma dni dsh duk dum dut ega eip eka erk ese ewe ewo fre fye gbb gbs ger giz gla gmz goe gua gul gwa gwo hal hat hau hdi hlp hma hna iau ice ido ifm ige igs irr isa iwm jab jar jmo juk kaa kar kau kbl kbw kel ken ker kho kie kim kis kkv klw kmk kmz kng knk kpw kre krn kro krr ksg kti ktl kwy kxo kyl kyp laa lab lag lai lbu ldu lel len lew lgt lin lkt lmg lmh lmn lmu lnd lon lou lug luv ma mac mad mas may mba mbe mbm mbr mbt mby mda mdg mdo mdw mea meh mek mgk mgu mhi mig min miy miz mka mku mlu mmb moo mor mou mpu mrg msk msm msn mtb mtu mum mup mxe myg nag nbm ndu ngm ngo ngz nma nnk non nor nrg nse nua nup nza nze olo one ong osa otr paa pat per pis plh pod pog qaw qhu rag ron rot rsu rwe sah san saw sel sgb sgl shb shi sht shy sio skk sla sme snm sro sup swe tab tac teo ter tid tiv tja tmo tpr trb tru tsz tye udm uld urk urt wec wma wna wom wrm xav yul zan,288,76475,0.0037659365
90D,Internally-headed relative clauses,,90,Matthew S. Dryer. 2013. Order of Relative Clause and Noun. In: Dryer; Matthew S. & Haspelmath; Martin (eds.) 2013. The World Atlas of Language Structures Online. Leipzig: Max Planck Institute for Evolutionary Anthropology. (Available online at https://wals.info/chapter/90),1,cct chi cmr dds epe hai ika kio kut lav lkt mpt msn nav ond osa ret rgc ser tja tou wap yuw,24,76475,0.00031382806
57A,Position of Pronominal Possessive Affixes,,57,Matthew S. Dryer. 2013. Position of Pronominal Possessive Affixes. In: Dryer; Matthew S. & Haspelmath; Martin (eds.) 2013. The World Atlas of Language Structures Online. Leipzig: Max Planck Institute for Evolutionary Anthropology. (Available online at https://wals.info/chapter/57),1,abk abv acg aco adg ady aga ain akn amc amx ao api apl apu ara ath atm awa awi ayo ayr bae baq bel bil bla blx boa bod brr bry bti bua bun bur cah car cax cba cct cde che chg chj chp chx ckl cln cml cmx cnl cnm coa cor cqt cre cro cti cup dmi dni eme ess eud ful gan gav gds gjj gnn goa grf gto gua gyc ham hat hix hlp hui hup hve ign ijo ika ina iqu irr ito iwa ixi jak jbt jrw jva kaa kbw kdw ket khg kio klg klw kma kmb kmh kmj kmr knw koa kob kok krh kri krk krw ksa ktm kyp kyz lav ldu lec lkt lng lui mac mam mar mau max may mba mco mcv mdn mea mei mek men mik mki mmv mne mno moh mot mpr mpu mrd mrs mtt mug mui mut muu nag nas nav nbd ncm nev nez nhh nhm nhn nht niv nkk nmb nsn nyu ocu ond ood pba pga pia pip pir plk pme pwn qum ram res rgc rik run sem ser sgb shp sla smn src srn sul tar tau tee tep tgn tic tid tir tja tli tlo tnc tob ton tot tpn tps tpt trr tte tun tus twn txj tzo tzu uby una urk wap was way wbn wch wic wiy wma wor wra wrk wrn wrw wsk wya xav xer yag yel yqy yuc yur zpr zqc zqo zqs,255,76475,0.003334423
112A,Negative Morphemes,,112,Matthew S. Dryer. 2013. Negative Morphemes. In: Dryer; Matthew S. & Haspelmath; Martin (eds.) 2013. The World Atlas of Language Structures Online. Leipzig: Max Planck Institute for Evolutionary Anthropology. (Available online at https://wals.info/chapter/112),3,abv acm agc arw ava btk did din ene fin fut grb hlp hlu ign koe kol kom kop ktc kyq kzy maj man mme mro nah nak nga nma nsg ntu pkt qui ruk sel snm sno squ sro taf tha tsz udh xbi zqc,47,76475,0.00061457994
