parameter_id,parameter_name,parameter_description,chapter_id,chapter_citation,value,same_value_language_ids,value_language_count,language_count_total,count_ratio
11A,Front Rounded Vowels,,11,Ian Maddieson. 2013. Front Rounded Vowels. In: Dryer; Matthew S. & Haspelmath; Martin (eds.) 2013. The World Atlas of Language Structures Online. Leipzig: Max Planck Institute for Evolutionary Anthropology. (Available online at https://wals.info/chapter/11),1,abi abk abm ach acm aco adk adz aea aeg agh aht ain aiz akn akw ala ald alw amc ame amh amo amp amu amz ana anc ani ant ao api apu arb arc arm arp asm ata ava awn awp aym bag bai baj bam baw bbf bco bee bej ben ber bet bir bis bki bkr bma bng bno bod bra brb brd brh bri brm brr brw bsq bto bua bul bur byu cac cad cah cam car cax cay cck ccp cha che chk chl chp chu chw cil cle cmn cnl cof coo cre cso cti ctl cub cve cyv dad dag dah dan dar ddf der det dgb din dio diy diz djp dni dnw don doy dre dts dum dyi efi eka eng epe eve evn ewe ewo eya fas fef fij ful fur fye ga gan gar gbb gds geo ghb gla gmb goa goo grb grk grr grw gua gwa had hai hak ham hau haw hba hin hix hmo hmr hok htc hum hup hve hzb iba igb ign igs ijo ik ika imo ind ing ird irq irr irx iso ite ito iva iwm jak jaq jav jeb jeh jiv jng jom jpn jpr juh kab kad kal kas kay kch ked kef kek ker ket kew kfe kgu kha khm kho khr khs kio kiw kkn kkv kla klm klv kly kmp kmu knd kng knk knm knr koa kob koh koi kom kor kot koy kpa kpe krb krd krk kro kry kse ksg kss ktk kty kul kun kur kut kwa kwk kwo kws kya kyl kzy lad lah lak lam lan lat lav len lit lkk lkt llm lu lua lug lui luo lus luv maa mab mak mal mao map mar mau max may maz mba mbb mei mgg mie mku mla mne mog mor mov mpa mrd mrg mrl mrn mro mrt mss mtp mui mum mun mxc mxm mya myi mzc nai nan nap nar nas nav ndt ndy nep new nez ngi ngz nhn nht nim nis niv nko nkt nmb nnc nob non nti ntu nug nun nuu nyg nyi oca ogb oji ond ood orh orm otm pac pae pai pau paw pec phl pit pms pnr poa poh pol prh prs psh psm pso puk pur qaw qco qui ram rap res rom ror rsc rtk ruk rus rut sab san sba scs sdh sdw seb sed sha shi shk shs shu sin sla slp sml snc snd snh snm snt som soq sor spa squ sre srn sue sui sup svs swa tab tac tag tam tas teh tel ter tgk tgr tha tic tiw tks tli tma tmn tmp tne toa tok tol ton tru try tsg tsi tso ttn ttu tug tuk tul tun twn tza umb una ung urk usa uzn vie wah wam wao wap wch wdo wic win wiy wlf wma wmu wnt woi wps wra wrd wrs wry xoo yag yan yap yaq yar yaw yay ycn yct yel yes yey ygr yid yim yny yor yuc yul yur yus zan zqc zul zun,525,76475,0.0068649887
144Q,SNegOV Order,,144,Matthew S. Dryer. 2013. Position of Negative Morpheme With Respect to Subject; Object; and Verb. In: Dryer; Matthew S. & Haspelmath; Martin (eds.) 2013. The World Atlas of Language Structures Online. Leipzig: Max Planck Institute for Evolutionary Anthropology. (Available online at https://wals.info/chapter/144),4,aba abk abv agb agm ain akh ala aly amh amp ang ao apl apt arc arm asm ass ath ava awa awp awt aze azi baa baw bej ben bho biu blx boa brl brm bsq bti bur bus but bzi cah cai can car cas cay cct cde chc chg chh chp chv cln cml cnl coa cpn cpy ctm cui dag dds des deu dhm dig dim dji djp dni drm dum dun dut eip eme epe ese eve fur gah gal gap gar gds geo ger gim gln gmw gon grw guj gur guu hai ham hay hid hin hmi hop hpd hua hui hum hzb idn ijo ika inn irq irx isa iwm jiv jms jpn kaa kab kac kbo kem ket kew kha khd khg khl kho kie kim kio kkp kll kma kmb kmh kmn kmo kmp kmr kmz knd kng knm knn knr knz koa kob kok kol kor koy krc krd krh krr krw kry kta kti kty kun kus kuv kwz kyp kyr kyz lad lah lai lav lep lez lis lkt lmn lot mab mac mag mar mdn mdw mee mek mgg mgi mhi mik mis miz mkh mki mkj mku mnc mne mnm mno mns mny mpa mpt mrs mru msc msg msl mts mun mur mym nab naj nam nar nas nbd nep new nga ngt niv nku nma nmb nnk noc ntj ntu nue nwd nyi oks omh ong orh ori osa oya pae pan paw pme pno prh prk prs psh ptt pum rao ras raw res ret rgc rum sar sdw ser shb she shh shi shk sia sid sil sla sme smn sna sng snm snt sod som srb sro stl syu taj tak tam tao tar tau tba tbl tbu tdr tel tgl tgr thn thu thy tib tig tli tlo tma tml tod ton tpt trb trm trr tru tsf tsz tte ttu tul tun tur tuv tuy twn tye uby udh udi udm una urd urk usa usr uyg uzb wag wak wao wap was way wbn wic wlw wly wme wna wom wsk yam yar ygr yid yko ykt yqy ytu yuw zag zay zaz zun,368,76475,0.00481203
144R,SONegV Order,,144,Matthew S. Dryer. 2013. Position of Negative Morpheme With Respect to Subject; Object; and Verb. In: Dryer; Matthew S. & Haspelmath; Martin (eds.) 2013. The World Atlas of Language Structures Online. Leipzig: Max Planck Institute for Evolutionary Anthropology. (Available online at https://wals.info/chapter/144),8,aba abv adg agm aly amp ang apl apt arc asm ath ava aze azi baf bam baw ben boa bok brp bti bus but bzi can car cas cay cct cde chp chv cln cnl coa cpn cpy ctm cui cup dds des deu dig dim din djp dni dum epe ese gah gal gar gim gln gon grb grw gwa hai hid hmi hpd hum hzb ijo ika inn irq irx isa iwm jiv jms jpn kaa kab kac kbo kem kha khl kho kie kim kio kis kkp kla kmn kmo kmr kmz knd kng knm knr koa kob kok kol koy krc krh krr kse kta kti kun kus kuv kwt kwz kyp kyr kyz lai lav ldu lez lkt lmn mab mac man maw mbi mdw mee mek mhi mik mis miz mka mkg mkh mki mku mnc mne mno mny mpt mrs msc msg msl mts mym nas nbd nep niv nku nma nmb nnk noc nti ntj nue omh ong osa oya pae paw pme pno prh prk rao res ret rum sdw shb shh shi shk sia sla slb sme smn snm snn sro sup syu tao tba tbu tel tlo tma tml tnn ton tpt trb trr tru tsf tsh tsz tul tun tur tuv tuy udm urk uyg uzb vai wao wap was wbn wic wlw wly wna wom yam yaq yar ykt yuw zag zay zun,238,76475,0.0031121282
81A,Order of Subject; Object and Verb,,81,Matthew S. Dryer. 2013. Order of Subject; Object and Verb. In: Dryer; Matthew S. & Haspelmath; Martin (eds.) 2013. The World Atlas of Language Structures Online. Leipzig: Max Planck Institute for Evolutionary Anthropology. (Available online at https://wals.info/chapter/81),1,aba abk abn abo abv adg ady aga agm agt ain akh ala ale all aly amb ame amh amn amp ang ano ao api apt apw arc arw asm ass ath atm ava awa awi awp awt awy aym aze azi baa bam bao baw bdm bdw bej ben bgm bho bhu bin biu bkb bkt blt blx boa bok bon boq bri brl brm brp bsq bti bua bur bus but bzi cah can car cas cay cct cde chb chc chd chg chh chp chv cln cml cmn cnl coa cpn cpy cro ctm ctw cui cup dag dan daw dds der des deu dgr dha dhb dhm dig dim diy dja dji djp dni drg drm dum dun edo eip eka eme ene epe ese eud eve evn foe for fqs fur gah gal gam gan gap gar gds geo ghb ghr gim gln gmw gog gon grw gug guh guj gur guu hai ham hay hhu hid hin hlp hmi hop hpd hua hui hum hzb iat idn iha ijo ika inn irq irx isa isi ite iwm jad jbt jin jiv jms jng joh jpn jrw jva kaa kab kac kae kbo kbu kem ket kew kgu kha khd khg khl kho khw kie kim kio kiw kkp kku kll klw kma kmb kmh kmn kmo kmp kmr kms kmz knb knd kng knm knn kno knr knz koa kob kok kol kor koy kqq krc krd krh krr krw kry krz kse kta kti kty kum kun kus kuv kwo kwt kya kyk kyp kyr kyz lad lah lai lal lav lep lez lis lkt lmn lot mab mag man mar maw max mde mdl mdn mek mem mer mey mgg mgh mgi mhi mij mik mis miz mka mkg mkh mki mkj mkl mku mnc mne mni mnm mno mns mnv mny mog mom mpa mpt mqf mrc mrd mrh mri mrr mrs mru msc msg msl msn mto mts mtu mun muu mym myr nab nag naj nam nar nas nat nav nbd nbr nep nev new nga ngt niv nkb nku nma nmb nmd nnd nnk noc nog ntj ntu nus nwd nyi nyk oir oks omh ong ord orh ori oro orw ory osa oss owi oya pae pan paw pba pdp pir pis pme pno pra prh prk prs psh pso ptt pum pun qaf qhu qim ral ram rao ras raw res ret rgc ria rik rmb rpa rum run rut rwa sar sav sdw ser shb she shh shi shk sho sia sid sil sko skp skw sla slb sme smn sna sng snh snm snn snt sod som spi srb src srn sro sta stl sue suk sup sus svs syu taj tak tam tao tar tau taw tba tbl tbu tce tdi tdr tel tgl tgr thk thn thu thy tib tig tja tkl tkm tlf tli tlo tma tmc tmg tml tmo tni tnn tod tpt trb trr trw tsf tsh tsz tte ttu tul tun tur tuv tuy tvo twe tye uby udh udi udm uhi una urd urk usa usr uyg uzb vai wag wah wak wao wap was way wbn wed wlw wly wme wmu wna wom wsk xas xer xns yah yal yam yaq yar yei yel ygr yid yiw yko ykt ylm yqy ytu yuc yuw zag zay zaz zim zun,564,76475,0.007374959
62A,Action Nominal Constructions,,62,Maria Koptjevskaja-Tamm. 2013. Action Nominal Constructions. In: Dryer; Matthew S. & Haspelmath; Martin (eds.) 2013. The World Atlas of Language Structures Online. Leipzig: Max Planck Institute for Evolutionary Anthropology. (Available online at https://wals.info/chapter/62),8,ala arp awp cnt for gag goo hlp hmo hua ika imo kay kho klv kut kyl lkt mak mau may mei mnd mrt mxc myi nav ngi ond ram sla snm squ tab tid tru wam war wic wrl yaq,42,76475,0.00054919906
6A,Uvular Consonants,,6,Ian Maddieson. 2013. Uvular Consonants. In: Dryer; Matthew S. & Haspelmath; Martin (eds.) 2013. The World Atlas of Language Structures Online. Leipzig: Max Planck Institute for Evolutionary Anthropology. (Available online at https://wals.info/chapter/6),2,abk ani ata awn bma chk gla ham hmo hmr hop hup irq jaq kal kek ket kgz klm kmp krd kry lah lui mar mgg pai prs qco sel skp som teh tpa tsi wch xoo,38,76475,0.0004968944
143G,Minor morphological means of signaling negation,,143,Matthew S. Dryer. 2013. Order of Negative Morpheme and Verb. In: Dryer; Matthew S. & Haspelmath; Martin (eds.) 2013. The World Atlas of Language Structures Online. Leipzig: Max Planck Institute for Evolutionary Anthropology. (Available online at https://wals.info/chapter/143),4,aab aar aba abi abk abn abu abv ace acg acl acm aco acu adg adi adz aeg agb agc agd agh agm ain aja ajg akh akn ala alb alk all aln als alw aly amb amc ame amh aml amn amo amp amq amr ams amt amx ana anc ane ang ani anj ann anu any ao aoj apl apt apu apw ara arc arg arj arm aro arp arq arw asm ass asu asy ata ath au ava awa awe awp awt aym aze azi baa bab bac bae baf bag bai baj bak bam bao baq bar bas baw bbf bbl bbu bbw bch bco bdm bej bel ben ber bfg bgn bgo bgr bho bia bid big bii bik bil bio bir biu bka bkr bku bla bln blr blt blx blz bmb bmz bni bnn bnu boa bob bod boi boj bok bol bra bre brf brh bri brl brm brn brp brr brs bsh bsk bsq bti btk bto bua bud bug bul bum bun bur bus but buw buy bvi bwc bya bzi cah cai cak cam can car cas cax cay cba cbo ccm cct cde cea cem cga cha chb chc chd che chg chh chi chj chk chn chp chq chr chs chv chw chx cic ckl cle cln cmh cml cmn cmr cmy cnl cnm cnt coa coc coo cop cos cpl cpn cpy cqt cre crn crp crt cso cti ctl ctm cub cui cup cya cyv cze dag dan dds des deu dga dgb dgo dgr dha dhi dhm dhw did dig dim din dio diy dja dji djm djn djp dma dmi dmk dms dni dom dre drm dsh dua duk dul dum dun dut dyi ebi efi ega eip eka eko emb eme ene eng eno eny epe erk err ese est eud eve evn ewe fij fin fon fre fua ful fur fut fye ga gaa gae gah gal gap gar gav gbb gbs gds gel geo ger ggu ghr gim gir giz gjj gku gla gln gmw gmz gnb goa god goe gok gon goo grb grf grj grk grr grs grw gua gud gug guh guj gul gur guu gwa gwo gyc hai hak hal ham han har hat hau haw hay hdi heb heh hei hid hil hin hix hlp hlu hma hmi hmo hna hnd hoa hol hop hpd htc hua huc hui hum hun hup hve hya hzb iaa iau iba ice idn ido idu ifm ifu ige ign igs ijo ik ika ila imo ina ind ing inn iqu iri irq irr irx isa ita ite iwm izi jab jak jaq jar jeb jiv jlu jmo jms jng joh jpn juh juk kaa kab kac kad kae kan kar kas kau kay kba kbl kbo kbw kby kch kdw kdz kel kem ken ker ket kew kfe kga kgr kgy kha khd khg khl khm khn kho khr khs kie kik kil kim kin kio kir kiw kkp kkt kkv kla klg kll klm kls klv klw kma kmb kmh kmi kmj kmk kmn kmo kmp kmr kms kmu kmw kmz knb knc knd kng kni knk knm knn knr knw knz koa kob koe koi kok kol kom kon kop kor kos koy kpw krb krc krd kre krh kri krj krk krn kro krr krw kry ksa kse ksg ksn kta ktc kti ktl kty kum kun kuo kus kut kuv kwa kwb kwn kwo kws kwt kwy kwz kxo kya kyl kyp kyq kyr kyz kzy laa lab lac lad lag lah lai lal lan lao lar lat lav lbu lda ldo ldu leb lec leg lel len lep les let lew lez lgi lgt lgu lho lic lim lin lis lit lkt llm lmg lmh lmn lmp lmu lnd lng lon lot lou luc lug lui luo luv ma maa mab mac mad mae mag mai maj mak mal mam man mao map mar mas mau maw may mba mbe mbi mbl mbm mbr mbt mby mcd mch mco mcv mda mde mdg mdl mdm mdn mdo mdw mea mee meh mei mek men mer mga mgg mgi mgk mgu mhi mhl mhu mie mig mii mik min mir mis miy miz mka mkd mke mkg mkh mki mkj mkl mku mkz mlg mlk mlu mmb mme mmn mmv mmw mna mnc mnd mne mni mnm mno mns mnt mny moe mog moh mok mom mon moo mor mos mot mou mov mpa mpo mpt mpu mra mrd mrg mrh mri mrl mro mrq mrr mrs mrt mru mrw msc msg msk msl msm msn msq mss mtb mts mtu mua mug mui mum mun mup mur mus mut mwb mwe mwo mxc mxe mxj mxo mxp mxx myg myi mym mzc nab nad nag nah naj nak nal nam nan nar nas nav nax nbd nbm nbr nca ncm ndb nde ndj ndo ndr ndt ndu ndy neh nep nev new nez nga ngd ngi ngj ngk ngl ngm ngn ngo ngt ngu ngw ngz nha nhh nhm nht nia nif nis niu niv nke nkk nkn nko nku nma nmb nmm nne nnk noc non noo nor nph nrg nse nsg nsn nti ntj nto ntu nua nue nug nun nup nyh nyi nyk nym nyn nyr nyu nza nze obg obo ocu oir oji oks olo omh omi ond one ong ono ood ori ork oro orw osa oss otm otr oya paa pae pai pal pan par pat pau paw pba pec per pga pia pip pis pit pkn pkt plg plh pme pms png pnn pno pnu pod pog poh pol por ppi pra pre prh prk prs psh psj psm pso psw ptt ptw pul pum pun pur pwn qaw qhu qia qim qui qum rag ram rao rap ras raw rem res ret rgc rik rim rit rnd rny rom ron rot rov rpa rru rsu ruk rum run rus rwa rwe sah sak sal sam san sap sar saw sba scr sdw sed see sel sem ser ses sgb sgl sgu shb she shh shi shk shl shm shn shp sht shu shy sia sid sil sin sio sir sis siu skk skm skw sla slb slo sme sml smn sna sng snm snn sno snt so sob sod som son sor spa squ srb src srd sre sro ssa sta sti stl stn sub sud sue sug sul sun sup svs swa swe swt syu tab tac taf tag tah taj tak tal tam tan tao tar tas tau taw tba tbo tbt tbu tbw tbx tce tdr tee tel ten teo tep ter tes tet tgh tgk tgl tgo tgr tha thn tho thu thy tib tid tig tim tin tir tis tiv tiw tja tke tki tkl tla tli tlo tlp tma tml tmm tmn tmo tmr tna tnc tne tng tnn tno tny tob tod tol ton tou toz tpa tpn tpr tpt trb tri trm trr tru tsf tsg tsh tsi tsn tsz tte ttn tts ttu tuc tuk tul tun tur tus tuv tuy tvl twe twn tye tzo tzu uby udh udi udm ukr uld uli una ung urd urk url urn urt uru usa usr ute uyg uzb vai ven vie vnm wag wah wai wak wal wam wao wap war was wat wau way wbn wch wec wed wel wem wic wik win wiy wlf wlm wlw wly wma wme wmu wna woi wol wom wor wra wrb wrd wrg wrk wrl wrm wrn wsk wtm wya xam xar xav xbi xho xns yag yam yao yap yaq yar ybi yei ygr yi yid yim yin yiw yko ykt ylm yng yok yor ypk yqy yrm yrr ytu yuc yuk yul yur yuw ywl ywr zag zai zan zap zar zay zaz zch zpr zqc zqo zqs zul zun zzo,1315,76475,0.017195161
122A,Relativization on Subjects,,122,Bernard Comrie; Tania Kuteva. 2013. Relativization on Subjects. In: Dryer; Matthew S. & Haspelmath; Martin (eds.) 2013. The World Atlas of Language Structures Online. Leipzig: Max Planck Institute for Evolutionary Anthropology. (Available online at https://wals.info/chapter/122),2,ame bam cah cnl epe goo hin ika kio kko koa lav lkt mar mku prh ram sla snm sup usa wra yid,24,76475,0.00031382806
124A,'Want' Complement Subjects,,124,Martin Haspelmath. 2013. 'Want' Complement Subjects. In: Dryer; Matthew S. & Haspelmath; Martin (eds.) 2013. The World Atlas of Language Structures Online. Leipzig: Max Planck Institute for Evolutionary Anthropology. (Available online at https://wals.info/chapter/124),2,abk abu aeg alb all ame apj bae bag bbw bla bma bud bul cch dgb ewe gol grk hat hau jab jak jel kgu klq klv kse kut kwa lml mam mar may mde meh moh mrl mxc nav nht nia nti nua otm pga pms pop prs qaf rag rom sir sla slb som soq squ syu tab ten tja tmm tsi ttn tzu wal wch wrm ywr zaq,72,76475,0.0009414841
82A,Order of Subject and Verb,,82,Matthew S. Dryer. 2013. Order of Subject and Verb. In: Dryer; Matthew S. & Haspelmath; Martin (eds.) 2013. The World Atlas of Language Structures Online. Leipzig: Max Planck Institute for Evolutionary Anthropology. (Available online at https://wals.info/chapter/82),1,aab aar aba abi abk abn abo abu abv acg acl acm acn aco adg adi adn ady adz aeg aga agb agh agm agt ain aja ajg akh akn ala alb ale alk all aln aly ama amb ame amh aml amn amp amq amt amx ana anc ane ang ani ano anu ao aoj api apt apu apw arc arg ari arj arm aro arp arq arw asm ass ath atk atm au ava avk avo awa awi awp awt awy ayi aym ayo ayr ayw aze azi baa bab baf bag bai bak bam bao bar bas baw bbl bbw bdm bdu bdw bej bel ben ber bgm bgo bgr bgs bgz bho bhu bid bii bik bin bio bir biu bka bkb bkt bku ble blt blx blz bmb bnb bni bnj bnk bnn bnu boa bob bod bok bol bon boq bra brf bri brl brm brn brp brq bry bsh bsk bsq bsr bti bua bub bud bug bum bur bus but buu buy bvi bya bzi cah cai cam can car cas cay cct cde cga chb chc chd chg chh chi chk chn chp chr chs chv chw cic cln cme cmh cml cmn cmr cnl cnt coa coc cop cpn cpy crn cro cti ctm ctw cua cuc cui cup cze dag dam dan daw day ddj dds deg der des deu dga dgb dgo dgr dha dhb dhm dig dim din dio diy dja dji djp djr dlm dma dmi dmk dms dni dok doy drg drm dsh dua duk dul dum dun dut dyi ebi edo ega egn eip eka eko emb eme emm ene eng eno epe erk err ese est eud eve evn ewe ewo fas fin foe fon for fqs fre fri fua fur fut fye ga gah gal gam gan gap gar gav gbb gbs gds geo ger ggu ghb ghr gim gla gln gmw gmz gnb god goe gog gok gon goo grb grg grw gua gug guh guj gul gur guu guw gwa gwo gyc hai hak hal ham han har hat hau hay heb heh hem hhu hid hin hlp hma hmi hmo hna hnd hol hop hpd hua huc hui hum hun hya hzb iat iau iba ice idn idu ifm igb ige igs iha ijo ika ila imo ina ind ing inn iqu irq irr irx isa isi ite ito iwa iwm izi jab jad jar jbt jin jiv jmo jms jng joh jpn jrw juh juk jva jwr kaa kab kac kad kae kan kar kas kau kay kba kbo kbu kbw kby kch kdw kel kem ken ker ket kew kfe kga kgu kgy kha khd khg khl khm khn kho khr khs khw kie kik kil kim kin kio kir kis kiw kkp kkq kku kkv kla klg kll klq klw kma kmb kmh kmk kmn kmo kmp kmr kms kmu kmw kmz knb knc knd kng kni knk knm knn kno knr knw knz koa kob koe kok kol kom kon kor kos koy kpw kqq krc krd kre krh krk krr krw kry krz ksa kse ksg ksm ksn kta ktc kte kti ktl kty kum kun kus kuu kuv kwa kwn kwo kwt kwy kwz kxo kya kyk kyl kyn kyp kyr kyz kzy laa lab lad lag lah lai lak lal lan lao lar lav lbu lda ldo ldu leb lec leg lel len lep les let lew lez lgi lgt lho lic lim lin lis lit lkt llm lmh lmn lmp lmu lnd lon lot lou luc lug lui luo luv ma mab mad mae mag mai man mar mas mau maw max may mba mbe mbi mbm mbo mbr mbt mby mcd mda mde mdg mdl mdn mdo mds mdw mea mee mei mek mem mer mey mga mgg mgh mgi mgk mgo mgq mgu mhi mhu mie mii mij mik mil mis miz mka mkd mke mkg mkh mki mkj mkl mkq mku mkz mla mlg mlk mlm mlu mmb mmv mnc mnd mne mng mni mnm mno mns mnv mny moe mof mog mom mon moo mor mos mot mou mpa mpt mpu mqf mrc mrd mrg mrh mri mro mrr mrs mrt mru mrw msc msg msl msm msn mss mtb mto mts mtu mua mui mum mun mup mur mus muu mwe mwo mxe myg myi mym myn myr nab nad nag nah naj nak nal nam nar nas nat nav nbd nbe nbm nbr ncm ndb ndi ndj ndo ndt ndu ndy neh nep nev new ney nga ngd ngi ngj ngk ngm ngn ngo ngt ngu ngw ngz nhn nis niv nkb nke nkn nko nku nma nmb nmd nmm nnd nng nnk noc nog non noo nor nph nse nsn nti ntj nto ntu nua nue nun nup nus nwd nya nyi nyk nza nze obg obo ocu oir oks olo omh omi one ong ora ord orh ori ork oro orw ory osa oss otr owi oya paa pae pal pam pan par pat paw pba pdp per pia pir pis pit pkn plg plh plk pme pmn pms png pno pnu pny pog poh pok por pra pre prh prk prs psh pso psw ptt ptw pul pum pun pur qaf qaw qhu qim rag ral ram rao ras raw rem res ret rga rgc ria rik rim rmb rnd rny rom ron rot rpa rru rsu rum run rus rut rwa ryu sah sak san sap sar sav scr sdw sea sed sem ser ses sgb sgl sgu sha shb she shh shi shk shl shm shn sho sht sia sid sil sin sio sir sis skk skm sko skp skr sku skw sla slb sle slo sme smn sna sng snh snm snn sno snt sob sod som son spi srb src srd sre srn sro ssa sta sti stl stn sud sue suk sul sun sup sus svs swa swe syu tab tac taf taj tak tal tam tan tao tar tau taw tba tbl tbt tbu tbw tce tdi tdr tel teo ter tet tgk tgl tgn tgr tha thk thn thu thy tia tib tid tig tik tis tiv tiw tja tki tkl tkm tlf tli tlo tma tmc tmg tml tmm tmn tmo tmr tnb tnc tne tni tnk tnn tny tod ton tou toz tpr tpt trb trm trr tru trw tsf tsh tsz ttd tte ttn ttu tuc tul tum tun tur tuv tuy tvo tvt twe twn txj tye uby udh udi udm uhi ukr uld uli una ung ura urd urk url urt uru usa usr uyg uzb vai ven vie vnm wag wah wak wal wan wao wap was wau way wbn wch wed wiy wlf wlw wly wma wme wmu wn wna woi wol wom wra wrk wrm wrn wry wsk wtm wwa xam xar xas xav xbi xer xho xns xoo yah yal yam yaq yar yay ybi ycn yei yel ygr yi yid yim yin yko ykt ylm yng yor yqy ytu yuc yuk yul yur yus yuw zag zan zar zay zaz zch zhn zim zpr zul zun,1192,76475,0.015586793
143E,Preverbal Negative Morphemes,,143,Matthew S. Dryer. 2013. Order of Negative Morpheme and Verb. In: Dryer; Matthew S. & Haspelmath; Martin (eds.) 2013. The World Atlas of Language Structures Online. Leipzig: Max Planck Institute for Evolutionary Anthropology. (Available online at https://wals.info/chapter/143),4,aab aar aba abv acu adi agm aja alk aln aly amc amp amq anc ane ang ani anu apl apt ara arc asm ath ava awe aze azi bag bak bas baw ben bgr big bik bio bir bka ble bln boa boj brh brn brr brs bsk bti bud bum bus but bzi can car cas cay cbo cct cde chp chs chv chw cln cmr cnl cnm coa cpn cqt crp cti ctm cub dds des deu dgo dig dim dio dms dni duk dum efi ega egn emb epe ese fua ful ga gah gal gar gbs gim giz gla gln gmz god goe gon grw gul gwo har hat hdi hid hix hma hmi hna hpd hum hzb iau idu ige igs ijo ika ing irq irr irx isa iwm jab jar jeb jiv jmo jms jpn juk kaa kab kac kar kas kau kay kbo kel kem ken ker kha khl kho kie kim kkp kkv kmn kmo kmr kmz knd kng knm knr knw koa kob kok kol koy kpw krc krh kri krn krr kta kti kun kus kuv kwz kxo kyl kyp kyr laa lab lag lai lav lec lel lew lez lgt lin lkt lmg lmh lmn lon lug mab mac mad map mas may mba mbm mbr mby mda mdg mdo mdw mea mee meh mei mek mgu mhi mhl mig mii mik mis miz mkh mki mlg mlu mmb mnc mne mor mot mou mpt mpu mrg mrs msc msg msl msm mtb mts mui myg mym mzc nas nbd nbm ndt nep ngl ngm ngn ngz nis niv nku nma nmb nnk noc noo nrg nsn ntj nua nup nza nze olo omh ong osa oya pae pat paw pec pia pit pme pod pog prh prk psj ptw qaw rao ret rit ron rsu rum sah san saw sba sdw sel sem sgb shb shh shi shk sht shy sia sin sio skk sla sme smn snm sro sug syu tab tan tao tba tbu tel tir tiv tlo tma tml tne ton tpr tpt trb tru tsf tsz tuc tul tun tur tuv tuy udm uld urk urn uyg uzb wai wao wap was wau wbn wec wly wma wna wom wra wrm xav yam yar ykt ypk yrm yrr yul zag zan zay,390,76475,0.005099706
85A,Order of Adposition and Noun Phrase,,85,Matthew S. Dryer. 2013. Order of Adposition and Noun Phrase. In: Dryer; Matthew S. & Haspelmath; Martin (eds.) 2013. The World Atlas of Language Structures Online. Leipzig: Max Planck Institute for Evolutionary Anthropology. (Available online at https://wals.info/chapter/85),1,aar aba abk acg acn aco adg adi adk adn ady agm ain ajg akh ala aly amb amc ame amk amp amt ana ang ao api apl apt apu ara arc arm arw asu atk ava avo awe awp awt aym baa bac bae bam bao baw bbf bej bgs bho bil bin bkb ble bln blt blx boa boj bok bon brh bri brm brs bry bsk bsq bti bua bur bus but bya bzi cah cai cam car cas cav cbo cct cde chc che chg chi chk chn chp chs chv cln cmh cmn cmr cnl cnm coc coo cor cti ctm ctw cub cup dag dan daw dds der des dga dgb dgr dhm dig dim dji dlm dmi dmk dms dni drg drm dul dun edo eip emb eme emm ene epe ese est eud eve evn ewe fas fin for fqs ful fur gaa gam gan gap gar gav geo ghb gim gjj gln gmw gnn gon grb grj grw gua guj gur gyc hai ham han hay hhu hid hin hix hlp hma ho hop hpd hua hum hun hup hzb iau idn idu ika imo ina ing inn iqu jbt jel jin jms jng joh jpn jug juh jva kaa kab kac kas kbo kbt kch kem ket kew kgy kgz kha khd khl kho khr khw kie kim kir kiw kje kkp kkq kku kll klm klq klr kma kmb kmh kmk kmn kmo kms kmw kmz knb knc knd kng knm knn knr knz koa kob kok kol kop kor kpo krc krh krj krk krn kry ksa kse kti kty kum kun kus kuv kwb kwo kws kwt kxo kyk kyn kyr kyz kzy lad lah lai lak lal lar lav ldu lep lez lgt lho lis lkt llm lmn lot lug lui lun mab mac mad mag mai maj man mar maw max mbo mcc mde mdl mdn mei mek mey mgg mgh mgi mhi mik mis miz mka mke mkg mkj mkl mku mme mnc mnm mno mns mnv moe mom mou mpr mpt mqf mrd mrh mri mru msg msn mtu mun muu myr mzn nab nad nag nam nar nas nat nav nbd nbr ndj nep nev new ngg ngk nis niv nkn nnd nnk noc nph nti ntj ntu nwd nyi nze oks omi orh ork oro orw ory osa oss owi pae pan pau paw pdp pis pit pmn pnx pra prh prk psh pso ptt ptw pum pun puq qaf qaw qhu qia qim ram raw rem res ret rik rum run rut ryu sar sav sba sdw sel sem ser shb she shh shi shk shy sid skk sko skw sla slb sle slp sme smn sna sng snh snm sno snt sor src srn sro sta stl sue sup sus svs syu tac tak tam tar tau tbl tbt tbu tbx tce tel tgl thd thn thu tir tja tkl tkm tlf tli tls tml tmo tnc tny ton tou tpn tps trb trm tru trw tsf tsm tsr tsz tte tts ttu tuc tul tun tur tuv tuy tvo tvt uby udh udm una ung urd urk urn usa ute vai wah wai wal wao was wat way wbn wir wme wna wor wra wrd wry wsk wtm xas xav xns yag yah yal yaq yar ycn yei yel ygr yi yim yiw yko ykt ylm yqy ytu yuc zag zar zaz zch zun,577,76475,0.007544949
