parameter_id,parameter_name,parameter_description,chapter_id,chapter_citation,value,same_value_language_ids,value_language_count,language_count_total,count_ratio
95A,Relationship between the Order of Object and Verb and the Order of Adposition and Noun Phrase,,95,Matthew S. Dryer. 2013. Relationship between the Order of Object and Verb and the Order of Adposition and Noun Phrase. In: Dryer; Matthew S. & Haspelmath; Martin (eds.) 2013. The World Atlas of Language Structures Online. Leipzig: Max Planck Institute for Evolutionary Anthropology. (Available online at https://wals.info/chapter/95),1,aar aba abk acn adg ady agm ain akh ala aly amb amc ame amp amt ana ang ao api apl apt arc arw asu atk ava awp awt aym baa bam bao baw bej bho bin bkb bln blt blx boa boj bok bon bri brm brs bry bsk bsq bti bua bur bus but bya bzi cah car cas cbo cct cde chc che chg chi chk chn chp chs chv cln cmn cmr cnl cti ctm ctw cub cup dag dan daw dds der des dgr dhm dig dim dji dlm dmi dmk dms dni drg drm dul dun edo eip emb eme ene epe ese eud eve evn fas for fqs ful fur gam gan gap gar gav geo ghb gim gln gmw gon grw guj gur gyc hai ham han hay hhu hid hin hix hlp hma ho hop hpd hua hum hzb iau idn idu ika imo inn jbt jin jms jng joh jpn jug jva kaa kab kac kbo kbt kem ket kew kgy kha khd khl kho khr khw kie kim kiw kkp kkq kku kll klq klr kma kmb kmh kmk kmn kmo kms kmz knb knc knd kng knm knn knr knz koa kob kok kol kop kor krc krh krn kry ksa kse kti kty kum kun kus kuv kwb kwo kwt kxo kyk kyn kyr kyz lad lah lai lak lal lar lav lep lez lho lis lkt lmn lot lun mab mac mag mai man mar maw max mbo mde mdl mdn mei mek mey mgg mgh mgi mhi mik mis miz mka mke mkg mkj mkl mku mme mnc mnm mno mns mnv mom mpt mqf mrd mrh mri mru msg msn mtu mun muu myr nab nad nag nam nar nas nat nav nbd nbr ndj nep nev new ngg nis niv nnd nnk noc nph ntj ntu nwd nyi nze oks omi orh ork oro orw ory osa oss owi pae pan paw pdp pis pit pmn pra prh prk psh pso ptt ptw pun qaf qaw qhu qim ram raw rem res ret rik rum run rut ryu sar sav sdw sel sem ser shb she shh shi shk sid skk sko skw sla slb sme smn sna sng snh snm snt src srn sro sta stl sue sup sus svs syu tac tak tam tar tau tbl tbt tbu tce tel tgl thn thu tir tja tkl tkm tlf tli tls tml tmo tnc tny ton tou trb trw tsf tsz tte ttu tuc tul tun tur tuv tuy tvo tvt uby udh udm una ung urd urk urn usa ute vai wah wai wao was way wbn wme wna wra wsk wtm xas xns yah yal yaq yar yei yel ygr yi yim yko ykt ylm yqy ytu yuc zag zaz zun,472,76475,0.0061719515
72A,Imperative-Hortative Systems,,72,Johan van der Auwera; Nina Dobrushina; Valentin Goussev. 2013. Imperative-Hortative Systems. In: Dryer; Matthew S. & Haspelmath; Martin (eds.) 2013. The World Atlas of Language Structures Online. Leipzig: Max Planck Institute for Evolutionary Anthropology. (Available online at https://wals.info/chapter/72),4,abk aco aeg ain amh amr ana apl apu arm arp asm ava awp ayr bag bem ber bma brh brm brr bsq bur cah car cay cha chr chv cld cmn cnl coi cop cre crg csh ctl cze dig dre dsh dut eka emb eng epe err ewe far fre fur fye gar geo ger grw gum hai hay hin hlu hmd hmo hum iaa ice igb ika imo ind ita jav jpn kay kek ket kew kgm kio kiw kkn kmp kmu knr kok kor krb krt ksm kut kuv lad lan lat lav laz lez lit lkt lnd lno luo mab mac mak mam map mar may mdg mik miy mkn mku mle mlt mme mna mnd mon mop mrd mrl mro mrt msg msl mul mxc myi mym nav nbd ngl nim nor nun obo oix ong orh otm pai pau pec pip pit pms pol por ppi pso pta pur qim rus scr sdw see shk shl shu slo sml snh snm so spa squ stn sue sug swe tag tgr tha thk tir tiw tja tms tsa tsf tuk ukr uma urk url vie wau wch wel wlo wrk yah yaq yur zqc,201,76475,0.00262831
77A,Semantic Distinctions of Evidentiality,,77,Ferdinand de Haan. 2013. Semantic Distinctions of Evidentiality. In: Dryer; Matthew S. & Haspelmath; Martin (eds.) 2013. The World Atlas of Language Structures Online. Leipzig: Max Planck Institute for Evolutionary Anthropology. (Available online at https://wals.info/chapter/77),1,abi aeg agr agt ala alw ame arp awp baa baw bdk beb bkr bla bre brh brm bse bur can cax chk chr cjo ckl cle cmh cnl crt cso cyv dag dio djp dre dyi eng ewe fij for fur grb grk gum guu hau heb hin hmi hmo hun igb ign imo ind iri irq ite juh ker ket kfe khl khm kho khs kkv kls klv kmu knm knr kob kol kon kpm krb kro kse kut lak lan lav lep luv mab mac mal mao map mau may mch mku mnd mny mov mrl mse mun mxc mxt mxz nbd ndy nez nhh nko nmp nti nug nya oji orh pem pip plk pms poh ppi qaw ram rap rom rus san say sba sel siu slp snt spa sre sup swa tab tau tha thk til tiw tli tlp tmc tnb toq trg tsm tuk tus tws txj uhi una ung usa vie wam war wat wch wiy wol wrd wrg wrk wyn yag yid yim yor yuc yuk yur ywl yyg zul zun,181,76475,0.0023667866
38A,Indefinite Articles,,38,Matthew S. Dryer. 2013. Indefinite Articles. In: Dryer; Matthew S. & Haspelmath; Martin (eds.) 2013. The World Atlas of Language Structures Online. Leipzig: Max Planck Institute for Evolutionary Anthropology. (Available online at https://wals.info/chapter/38),4,aar adi aeg ala arg arj asy ata bab bag bbu bco bdu bkr brn brp btk chi cmn cmy coo cpl crn deg dga dgb doy egn eip epe gae gel gnn goe gok gua hai hnd ice ina ind iri izi jmo kan kfe kla knm kos kse kut kwo lmp mad mal map mar mas may mbi mde mka moo mpt mrg ney ngb noo nti nyu obg oji ond ood per pms psm rwe som sun svs tbu tin tja tpn tsi tuk ung url vai wch wel xas xho yuc yuw zay,98,76475,0.0012814646
15A,Weight-Sensitive Stress,,15,Rob Goedemans; Harry van der Hulst. 2013. Weight-Sensitive Stress. In: Dryer; Matthew S. & Haspelmath; Martin (eds.) 2013. The World Atlas of Language Structures Online. Leipzig: Max Planck Institute for Evolutionary Anthropology. (Available online at https://wals.info/chapter/15),3,akl apu arg awd bgg bgv bkl bkr bna bqh bso bui ceb coo crk ctl emc epe eve fij fre gay guj hzb iga ita jav klv koa kuz kws let lmh meb mlc mlt mly mng mrs mun ngd occ plb por rom rot rsm sak sea sio snt spa srd sru sun swi tgw tlo tng tns tnt tol wlo yap,65,76475,0.00084995094
1A,Consonant Inventories,,1,Ian Maddieson. 2013. Consonant Inventories. In: Dryer; Matthew S. & Haspelmath; Martin (eds.) 2013. The World Atlas of Language Structures Online. Leipzig: Max Planck Institute for Evolutionary Anthropology. (Available online at https://wals.info/chapter/1),3,aea agh aik aiz akn alb ald alw amo amu amz ana ata aze bam baw bbf bej ber bet bir bra bre brh brw bsq bul cad cah cam cay ccp cha chu chv chw cil cle cnt cti ctl dan ddf dgb dgr din dio diy diz djp dnw don doy eja eng fij fre ful gan ger goo grb grk grr grw gwa hmr hok hop htc hve iba ign igs ijo ind irx ito iva jav jeb jng kad kef kek ker kgu kgz kha khm khs kio kkn klv kmu knk knm knr kob kom kor kot koy kpa kpe kro kul kur kwo kws kyl lkt llm lu lua lui maa mab map mar mba mbb mei mgg mla mme mnd mog mpa mrl mro mrt mui mum mzc nap nar new nga nko nmb non nor nug nun ogb ood orm otm pac pai pau phl prs qaw rom rsc ruk sab sba sel sha snd snh som spa srn sup tam tha tiw tks tlp tma tmp tol tru tug tuk tul tur tuv tza umb una uzn vie wch wic wiy wuc yan yap yay yct yko ykt ytu zan zun,201,76475,0.00262831
75A,Epistemic Possibility,,75,Johan van der Auwera; Andreas Ammann. 2013. Epistemic Possibility. In: Dryer; Matthew S. & Haspelmath; Martin (eds.) 2013. The World Atlas of Language Structures Online. Leipzig: Max Planck Institute for Evolutionary Anthropology. (Available online at https://wals.info/chapter/75),2,aco ana apu asm awp brh bri bsq bur chv cmn cre cyv dag dni eka epe eve fua fur gar goo grw hai ham ika imo kay kio klv koa lad lep lkt mai map mar mns mss mxc myi nav ngt niv nma ond pai pba pms prh psm pso qim sel shk sml som squ swa tab tiw tja tml tru tsi tur udh una usa vot wam war wra wrd yag yaq yim yko ypk yuc zqc zul zya,84,76475,0.0010983981
144A,Position of Negative Word With Respect to Subject; Object; and Verb,,144,Matthew S. Dryer. 2013. Position of Negative Morpheme With Respect to Subject; Object; and Verb. In: Dryer; Matthew S. & Haspelmath; Martin (eds.) 2013. The World Atlas of Language Structures Online. Leipzig: Max Planck Institute for Evolutionary Anthropology. (Available online at https://wals.info/chapter/144),8,aba abv agm asm ava baw ben bus bzi chp cnl dni dum ese isa iwm kaa kho kie kim kmz kng krr kti kyp lai lkt lmn mdw mek mhi miz nma nnk ong osa shb shi sla sme snm sro trb tsz udm urk wna wom,49,76475,0.0006407323
71A,The Prohibitive,,71,Johan van der Auwera; Ludo Lejeune (Valentin Goussev). 2013. The Prohibitive. In: Dryer; Matthew S. & Haspelmath; Martin (eds.) 2013. The World Atlas of Language Structures Online. Leipzig: Max Planck Institute for Evolutionary Anthropology. (Available online at https://wals.info/chapter/71),1,ago akn apa apl au ayr azi bag bfg bii brs brz bsk bsq bur cay cnl coo cze dja djp don dsh dut eka eng err eve far fre fri ger gwa ham hat hix iaa ice ido igb jab kew kis klm kob kpe krc lat lew lit lkt lnd lng lug mad mai mar mgo mon mum ndg ndy ngt nht nor npn obo pal pec pit pol ppi prs pso rap rsu rus rwa san scr shk sko slo sno so swe tas tet tir ton tpn tri tsh ttu tur tvo txj udh ukr uma urk uzb wao wap wic wra wrl wrm yag yng ypk yrm,113,76475,0.0014776071
51A,Position of Case Affixes,,51,Matthew S. Dryer. 2013. Position of Case Affixes. In: Dryer; Matthew S. & Haspelmath; Martin (eds.) 2013. The World Atlas of Language Structures Online. Leipzig: Max Planck Institute for Evolutionary Anthropology. (Available online at https://wals.info/chapter/51),6,ala amb amp ao apu awp awt aym bac bao bin bsq bzi cav cct chg chn cmr coo daw dds des dig dim dlm dmi dms dun eip eme emm epe fas for fqs ful gar gim gnn hai hay hma hpd ika imo ina inn jpn kew kgy khd khr kll kmw knc knm knr koa krk ksa kwo kwt kyk lot mar mei mey mgg miz mnm mpt msg msn nab nar nat nbd ngg ngk nph oks ory pae pau pdp pit qhu qia res ret sar sdw sem shk skk sko sng snm sro svs tam tar tau tbt tbx tgl tja tmo ton tsf tuc tuy uby ung wat wbn wir wme wry yal ygr zag,123,76475,0.0016083687
7A,Glottalized Consonants,,7,Ian Maddieson. 2013. Glottalized Consonants. In: Dryer; Matthew S. & Haspelmath; Martin (eds.) 2013. The World Atlas of Language Structures Online. Leipzig: Max Planck Institute for Evolutionary Anthropology. (Available online at https://wals.info/chapter/7),1,abi abm ach acm adk adz aea aeg agh aik ain akn akw ala alb ald alw amc ame amo amp amu amz ana ant ao api apu arb arp asm ata awn awp aze bai baj bam baw bbf bee bej ben bir bis bki bkr bma bng bno bod brb brd bre brh bri brm brr brw bsk bsq bto bua bul bur byu cac cah cam car cax cay cck ccp cha che chk chv cil cle cmn cnl cnt cof cre cso ctl cub cve cyv dad dag dar der dgb dgr din dio diy djp dni don dre dts dum dyi efi eja eka eng epe eve evn ewe ewo fas fef fij fin fre ful fur fuz ga gan gar gds ger ghb gla gmb goa goo grb grk grr grw gua hak ham haw hba hin hix hmo hok hop hum hun hve iaa iba igb ign igs ijo ika imo ind ird irr irx iso iva iwm jav jiv jng jom jpn jpr kal kas kay kch ked ket kew kfe kgu kgz kha kho khr khs kiw kkn kkv kla klv kly kmp knd kng knm knr koa kob koi kot koy kpa krb krd krk kry kse kty kun kur kwa kwo kws kya kyl kzy lad lah lan lat lav len lep lit llm lu lui luo luv mab mal mao map mar mau max may mbb mei mgg mie mku mla mlk mme mnc mnd mog mor mpa mrd mrn mro mrt mss mtp mui mun mxc mxm mya myi mzc nai nan nap nar nas nax nbk ndy nep new nga ngi nhn nht nim nis niv nko nkt nnc nob non nor ntu nug nyi oca oji ond ood orm otm pae pai paw pec pit pms pnr poa poh pol prh prs psh psm puk pur ram rap res rom ror rsc rtk ruk rus sab sba scs seb sha shi shk skp slp snc snd snh snm snt som sor spa srn sue sup svs swa tab tac tag tam tas tel tgk tha tib tic tiw tks tlp tmn tmp tne toa ton tpa try tsg ttn tug tul tun tur tuv umb una ung urk usa uzn wah wam wao wdo wiy wlf wma wmu wnt woi wra wrd wrs wry wuc yag yaq yar yaw yay ycn yel yes yid yim yko ykt yny yor ytu yus zan zqc,409,76475,0.005348153
130B,Cultural Categories of Languages with Identity of 'Finger' and 'Hand',,130,Cecil H. Brown. 2013. Finger and Hand. In: Dryer; Matthew S. & Haspelmath; Martin (eds.) 2013. The World Atlas of Language Structures Online. Leipzig: Max Planck Institute for Evolutionary Anthropology. (Available online at https://wals.info/chapter/130),1,aly amp ati atk beo bnb bnj bwa byu cah cmc dja dji hup inu kaq kkw kls krk kxo mku mpa mwn mwp ndj nez ngi ngj nug ojm pin pit pkn qui ser shs tho tsm wam win wrl xok yan yir yuk,46,76475,0.00060150377
144L,The Position of Negative Morphemes in SOV Languages,,144,Matthew S. Dryer. 2013. Position of Negative Morpheme With Respect to Subject; Object; and Verb. In: Dryer; Matthew S. & Haspelmath; Martin (eds.) 2013. The World Atlas of Language Structures Online. Leipzig: Max Planck Institute for Evolutionary Anthropology. (Available online at https://wals.info/chapter/144),4,aba abv agm asm ava baw ben bus bzi chp cnl dni dum ese isa iwm kaa kho kie kim kmz kng krr kti kyp lai lkt lmn mek mhi miz nma nnk ong osa shb shi sla sme snm sro trb tsz udm urk wna wom,48,76475,0.0006276561
58A,Obligatory Possessive Inflection,,58,Balthasar Bickel; Johanna Nichols. 2013. Obligatory Possessive Inflection. In: Dryer; Matthew S. & Haspelmath; Martin (eds.) 2013. The World Atlas of Language Structures Online. Leipzig: Max Planck Institute for Evolutionary Anthropology. (Available online at https://wals.info/chapter/58),1,aco asm bel brs bur cax cho cin cjo cnl cre ctm dni eka epe eve hai hat hix kho kiu koa koi krk kut lim mne nez oss pms pwn qui res sal tgp tiw tot tun tzu wap wch win,43,76475,0.00056227524
5A,Voicing and Gaps in Plosive Systems,,5,Ian Maddieson. 2013. Voicing and Gaps in Plosive Systems. In: Dryer; Matthew S. & Haspelmath; Martin (eds.) 2013. The World Atlas of Language Structures Online. Leipzig: Max Planck Institute for Evolutionary Anthropology. (Available online at https://wals.info/chapter/5),1,abi abm ach acm aco aea aht ain alw amc amp amu amz ant ao api apu arb arc arm asm ata ava awp aym bai bco bee ber bng bra brd bua byu cac cah cax cck ccp che chk chl chp chq chu chw cmn cnl cnt cre dad diy djp dni don dum dyi eya fas fij ful fuz fye gds geo gla gmb goa goo grr grw gua hai hak ham haw hmo hop htc hup imo irr ite iwm jak jaq jav jeb jiv jom jpr kay kek kew kgu khm kho kkv kmu kng koa kob kor krb krk kro kry ksg kss kty kut kwa kwo kya len lkk lkt lui luv maa mao map mar mau max may maz mbb mku mlk mme mnd mne mor mov mrt mss mtp mxc mxm myi mzc nan nas nav nbk nez ngi nhn nht niv nmb nnc ntu nug nun nuu nyg oca oji ond pac pae pec phl pit pms pnr poa poh prh psm qaw qco rap ror rtk seb sed sel sha shi shk shs shu sin skp sla slp snc snm snt spa squ svs tam tgk tiw tli toa tol ton tpa tru tso ttu tuk umb ung urk usa vie wah wam war wch wdo wic wiy wmu wnt wps wra wrd wrs wry wuc yag yaq ycn yct yel yes yid yim yny yur yus zqc zul zun,242,76475,0.0031644327
13A,Tone,,13,Ian Maddieson. 2013. Tone. In: Dryer; Matthew S. & Haspelmath; Martin (eds.) 2013. The World Atlas of Language Structures Online. Leipzig: Max Planck Institute for Evolutionary Anthropology. (Available online at https://wals.info/chapter/13),1,abk aea aeg aht akw ala alb alw ame amh amp amu ana api apu arb arc arm arp asm ata ava awp aym aze baj bco ben bis bki bkr bma bng brd bre brh brr brw bsk bsq bto bua bul bur byu cah cam car cax cck ccp cha chk chl chu chv cmn cnl coo cre ctl cyv dar ddf der dgr dio diy djp dni dre dyi eng epe eve evn eya fij fin fre gan gar geo ger goo grk grr grw gua hai haw hba hin hix htc hum hun hup hzb iaa iba ika imo ind ing ird irr irx iva jak jaq jav jeb jeh jpr kab kas kay kch ked ket kfe kgu kgz kha khm khr khs kkn kkv klm klv kly kmp knd kng kob kor kot koy krb krd kry kty kun kut kwa kwk kws kya kzy lad lak lav len lez lkt lui lus mak mal mao map mar mau max may mbb mgg mku mlk mne mog mov mpa mrd mrn mrt mss mtp mun myi nai nap nep new nez nga ngi nhn nht nnc ntu nug nuu oji ood orm pac pae pai pau pit pms pnr poh pol prs psh puk pur qaw qco ram rap rom ror rsc rtk ruk rus sba scs sdh sed sel shi shk shu sml snc snh snm soq sor spa squ srn svs swa tab tac tag tas teh tel tgk tgr tiw toa tol ton tpa tru try tsg tsi tso ttn ttu tug tuk tul tur tuv tza ung urk usa uzn wam wao wap war wch wdo wic win wiy wlf wma wmu wnt woi wps wra wrd wry yan yap yar yaw ycn yel yes yid yim yko ykt yny ytu yuc yur yus zqc zun,307,76475,0.004014384
91A,Order of Degree Word and Adjective,,91,Matthew S. Dryer. 2013. Order of Degree Word and Adjective. In: Dryer; Matthew S. & Haspelmath; Martin (eds.) 2013. The World Atlas of Language Structures Online. Leipzig: Max Planck Institute for Evolutionary Anthropology. (Available online at https://wals.info/chapter/91),2,abu adi aeg agm akn ala amc ame amq amr ams anj apl asm au awe awt baw bbw bdw bfi bid bkl bmb bnn boq brn brp bry bsh bud car cct chs chw cld cmr cnm cro cso ctm dag dgb did din djm dma dre ese fua fut gjj gln gmw goa hai hal hau haw hix hmo hnd hoa iaa isa jad jmo jms kau kbw kch kel kgr khm khn khs kkv kmz kng knr kob krb kre kri krr ksg kta kwo kwt lah lai lal lao len let lmp lon lug maa mac mad mao mau may mbe mee mgi mie min miz mku mlu mna mnm mon mpa mrg mxj mxo mxp nab nak nam nca ndo ngd ngm ngt ngz nia niu nkn nko nnc nnd nnk nun nuu obo olo oro pit pkn plg pnu pog pok ram rot sal san seb sed sim slp sng snm snt son sre srn sro sul syu tah tak tar taw tgk tha tib tid tim tja ttd ttn tun ung urk url wal wbn wlf wlo wol wor wra wsk xav yar ycn,192,76475,0.0025106245
35A,Plurality in Independent Personal Pronouns,,35,Michael Daniel. 2013. Plurality in Independent Personal Pronouns. In: Dryer; Matthew S. & Haspelmath; Martin (eds.) 2013. The World Atlas of Language Structures Online. Leipzig: Max Planck Institute for Evolutionary Anthropology. (Available online at https://wals.info/chapter/35),7,ana asm chk chv cmn dgr drg eka eve khs kmk knd mrl nti ork ret sml snm sue vie yko zun,23,76475,0.00030075188
3A,Consonant-Vowel Ratio,,3,Ian Maddieson. 2013. Consonant-Vowel Ratio. In: Dryer; Matthew S. & Haspelmath; Martin (eds.) 2013. The World Atlas of Language Structures Online. Leipzig: Max Planck Institute for Evolutionary Anthropology. (Available online at https://wals.info/chapter/3),4,abm adz aeg aht alw amh ana anc arm baw ber brh bsq cah cax cay cck ccp chu cof dar dgb geo goo grr grw hau hin hmr ign ird ite iva jak jeb jng kal kay kho khr koa kot kpa kul lam lit lkk lkt mar mbb mgg mie mog mpa mun nap nep new nez ngi niv nmb nti ntu nug oca orh pai pit pol psh pso pur qco ram res rsc ruk sdh sed shu sla soq swa tac tel tgr tiw tpa tsg tza wam wap wdo win wiy yel yim yuc yul yur,102,76475,0.0013337692
78A,Coding of Evidentiality,,78,Ferdinand de Haan. 2013. Coding of Evidentiality. In: Dryer; Matthew S. & Haspelmath; Martin (eds.) 2013. The World Atlas of Language Structures Online. Leipzig: Max Planck Institute for Evolutionary Anthropology. (Available online at https://wals.info/chapter/78),1,abi aeg agr agt ala alw ame arp awp baa baw bdk beb bkr bla bre brh brm bse bur can cax chk chr cjo ckl cle cmh cnl crt cso cyv dag dio djp dre dyi eng ewe fij for fur grb grk gum guu hau heb hin hmi hmo hun igb ign imo ind iri irq ite juh ker ket kfe khl khm kho khs kkv kls klv kmu knm knr kob kol kon kpm krb kro kse kut lak lan lav lep luv mab mac mal mao map mau may mch mku mnd mny mov mrl mse mun mxc mxt mxz nbd ndy nez nhh nko nmp nti nug nya oji orh pem pip plk pms poh ppi qaw ram rap rom rus san say sba sel siu slp snt spa sre sup swa tab tau tha thk til tiw tli tlp tmc tnb toq trg tsm tuk tus tws txj uhi una ung usa vie wam war wat wch wiy wol wrd wrg wrk wyn yag yid yim yor yuc yuk yur ywl yyg zul zun,181,76475,0.0023667866
130A,Finger and Hand,,130,Cecil H. Brown. 2013. Finger and Hand. In: Dryer; Matthew S. & Haspelmath; Martin (eds.) 2013. The World Atlas of Language Structures Online. Leipzig: Max Planck Institute for Evolutionary Anthropology. (Available online at https://wals.info/chapter/130),1,aly amc amp apw ati atk beo bnb bnj bwa byu cah ccp chy cmc crj dja dji eud haw hup inu jiv jva kaq kkw kls krk ksa kxo mku moh mpa muu mwn mwp nat nav ndj nez ngi ngj ngz nug ojm ond onn pac pin pit pkn qui ser shs snc tah tho toy tua tun urk wam win wnb wrl xok yan ygr yir ykp yuk,72,76475,0.0009414841
37A,Definite Articles,,37,Matthew S. Dryer. 2013. Definite Articles. In: Dryer; Matthew S. & Haspelmath; Martin (eds.) 2013. The World Atlas of Language Structures Online. Leipzig: Max Planck Institute for Evolutionary Anthropology. (Available online at https://wals.info/chapter/37),1,abk adi agb agm ala amh amp amq anu ara aro ata awt bab bag bak bam baq bbf bco bdu bfi bgr bik bir blz bmb bre brf brp bsq bul ccm cem cha cmy coo cop cor crn cso day dds deg dga dgb dim dre dut egn eng epe ewo fre fri fua fut fye ga gae gel ger gmw gnn goe goo grk gua gul gwa hau haw htc hun hve iaa iri irr ita izi jmo jms juh kan kay kba kch kel ken ker kfe khm knr koa kos kre krk kse kut kwo laa lav lep lgu lkt llm lmg lmp lnd lon lot luo mab mad mae mal mao map mar may mbi mcd mea mis miy mka mof mon mou mpt mrg mrq msg mtb mtu mum mup mus mwb myi nbr nca ndy ney ngz nif nkn nti nyu obg oks ond ood pdp pip pir pms por qia qum ram rap ron rov run rwe sam san ser sir sis skk slb spa squ svs tar taw tbu tee tep tgk tgo tgr tid tim tin tke tla tng tnk tot tsi ttn tvl txj tzu uld ung url vai vie wch wel wlf wol wrw wsk yap zag zar zay zch zqc zqs,216,76475,0.0028244525
33A,Coding of Nominal Plurality,,33,Matthew S. Dryer. 2013. Coding of Nominal Plurality. In: Dryer; Matthew S. & Haspelmath; Martin (eds.) 2013. The World Atlas of Language Structures Online. Leipzig: Max Planck Institute for Evolutionary Anthropology. (Available online at https://wals.info/chapter/33),9,aar abu ace adg aly amn amp bii blx bni brp cct chh chi chq chr cnl cnt cop cpl cso cti cya don egn fqs gku gnn hup iba imo irx isa izi kay kbw kel kmu kmz knc kwz kyl kyz lal lao lim mal may mie min mku mng mnm mxj nam nca ngd ngl nsg nyi obo omi orh orw pau per pkn pnu poh pok prh rao rji sah sia smp snt son syu tau tba thu thy tid tlo tlp tmg tri tuk url wah wic wir wiy xav yid zhn,98,76475,0.0012814646
70A,The Morphological Imperative,,70,Johan van der Auwera; Ludo Lejeune (Umarani Pappuswamy; Valentin Goussev). 2013. The Morphological Imperative. In: Dryer; Matthew S. & Haspelmath; Martin (eds.) 2013. The World Atlas of Language Structures Online. Leipzig: Max Planck Institute for Evolutionary Anthropology. (Available online at https://wals.info/chapter/70),1,abb abk acl aco acu adk aeg ala amh amr ana anl apl ard arg arm arp ars ath ava awp ayr azi bab bam bbw bdk bej bel bem ber bfg bma bre brh brz bsk bsq bud bul bur cah cak car cay ceb chj chv cld cle cmh cml cmn coi coo cor cre cyv cze dag dbd dgr dig diz dmi dni dyi eka emb emc epe err est eve evn far fin fua fye gam gim glc gmz goj grk grw guj gum ham heb her hin hix hlu hmi hui igb ik iri irq jak jaq jeb kas ket kew khk kil kio kis kmk kmp kms knd knm knr koa kob kod koi krb krc krd krk kro krq kse kte kty kui kut kuv kwe kwr kws kyg lad lak lan lav laz lil lim lit lng lno loz luo luv mab mac mak mam man map mar mau mbg mcd mdn meh mgo mhu miy mle mlt mme mna mns moe mop mos mrd mrg mro msl mss mun mwe myi mym nan nap nbd nez nga nht niv nti ntn nub obo oix oka ood orh otm pan pau pip pms pol ppi prk psm pta pur qim qta ram ret rsu rus rwa scr sdw sgu shb shk shl shu slo sno snt so sou spa srd stn sue sug swa tag tas tau tbu tel tem ter tet tgr tir tiw tkl tml tms tna tnc tpn tsa tsh ttu tun tur tuv tvo tzo tzu udh udi ukr uld una uzb vai vot wap wau wch wel wic wlf wra wrd wrg wrk wwr yaq yim yko yng yny ypk yuk yur yus zaz zen zqc zqs zul,292,76475,0.0038182412
