parameter_id,parameter_name,parameter_description,chapter_id,chapter_citation,value,same_value_language_ids,value_language_count,language_count_total,count_ratio
143G,Minor morphological means of signaling negation,,143,Matthew S. Dryer. 2013. Order of Negative Morpheme and Verb. In: Dryer; Matthew S. & Haspelmath; Martin (eds.) 2013. The World Atlas of Language Structures Online. Leipzig: Max Planck Institute for Evolutionary Anthropology. (Available online at https://wals.info/chapter/143),4,aab aar aba abi abk abn abu abv ace acg acl acm aco acu adg adi adz aeg agb agc agd agh agm ain aja ajg akh akn ala alb alk all aln als alw aly amb amc ame amh aml amn amo amp amq amr ams amt amx ana anc ane ang ani anj ann anu any ao aoj apl apt apu apw ara arc arg arj arm aro arp arq arw asm ass asu asy ata ath au ava awa awe awp awt aym aze azi baa bab bac bae baf bag bai baj bak bam bao baq bar bas baw bbf bbl bbu bbw bch bco bdm bej bel ben ber bfg bgn bgo bgr bho bia bid big bii bik bil bio bir biu bka bkr bku bla bln blr blt blx blz bmb bmz bni bnn bnu boa bob bod boi boj bok bol bra bre brf brh bri brl brm brn brp brr brs bsh bsk bsq bti btk bto bua bud bug bul bum bun bur bus but buw buy bvi bwc bya bzi cah cai cak cam can car cas cax cay cba cbo ccm cct cde cea cem cga cha chb chc chd che chg chh chi chj chk chn chp chq chr chs chv chw chx cic ckl cle cln cmh cml cmn cmr cmy cnl cnm cnt coa coc coo cop cos cpl cpn cpy cqt cre crn crp crt cso cti ctl ctm cub cui cup cya cyv cze dag dan dds des deu dga dgb dgo dgr dha dhi dhm dhw did die dig dim din dio diy dja dji djm djn djp dma dmi dmk dms dni dom dre drm dsh dua duk dul dum dun dut dyi ebi efi ega eip eka eko emb eme ene eng eno eny epe erk err ese est eud eve evn ewe fij fin fon fre fua ful fur fut fye ga gaa gae gah gal gap gar gav gbb gbs gds gel geo ger ghr gim gir giz gjj gku gla gln gmw gmz gnb goa god goe gok gon goo grb grf grj grk grr grs grw gua gud gug guh guj gul gur guu gwa gwo gyc hai hak hal ham han har hat hau haw hay hdi heb heh hei hid hil hin hix hlp hlu hma hmi hmo hna hnd hoa hol hop hpd htc hua huc hui hum hun hup hve hya hzb iaa iau iba ice idn ido idu ifm ifu ige ign igs ijo ik ika ila imo ina ind ing inn iqu iri irq irr irx isa ita ite iwm izi jab jak jaq jar jeb jiv jlu jmo jms jng joh jpn juh juk kaa kab kac kad kae kan kar kas kau kay kba kbl kbo kbw kby kch kdw kdz kel kem ken ker ket kew kfe kga kgr kgy kha khd khg khl khm khn kho khr khs kie kik kil kim kin kio kir kiw kkp kkt kkv kla klg kll klm kls klv klw kma kmb kmh kmi kmj kmk kmn kmo kmp kmr kms kmu kmw kmz knb knc knd kng kni knk knm knn knr knw knz koa kob koe koi kok kol kom kon kop kor kos koy kpw krb krc krd kre krh kri krj krk krn kro krr krw kry ksa kse ksg ksn kta ktc kti ktl kty kum kun kuo kus kut kuv kwa kwb kwn kwo kws kwt kwy kwz kxo kya kyl kyp kyq kyr kyz kzy laa lab lac lad lag lah lai lal lan lao lar lat lav lbu lda ldo ldu leb lec leg lel len lep les let lew lez lgi lgt lgu lho lic lim lin lis lit lkt llm lmg lmh lmn lmp lmu lnd lng lon lot lou luc lug lui luo luv ma maa mab mac mad mae mag mai maj mak mal mam man mao map mar mas mau maw may mba mbe mbi mbl mbm mbr mbt mby mcd mch mco mcv mda mde mdg mdl mdm mdn mdo mdw mea mee meh mei mek men mer mga mgg mgi mgk mgu mhi mhl mhu mie mig mii mik min mir mis miy miz mka mkd mke mkg mkh mki mkj mkl mku mkz mlg mlk mlu mmb mme mmn mmv mmw mna mnc mnd mne mni mnm mno mns mnt mny moe mog moh mok mom mon moo mor mos mot mou mov mpa mpo mpt mpu mra mrd mrg mrh mri mrl mro mrq mrr mrs mrt mru mrw msc msg msk msl msm msn msq mss mtb mts mtu mua mug mui mum mun mup mur mus mut mwb mwe mwo mxc mxe mxj mxo mxp mxx myg myi mym mzc nab nad nag nah naj nak nal nam nan nar nas nav nax nbd nbm nbr nca ncm ndb nde ndj ndo ndr ndt ndu ndy neh nep nev new nez nga ngd ngi ngj ngk ngl ngm ngn ngo ngt ngu ngw ngz nha nhh nhm nht nia nif nis niu niv nke nkk nkn nko nku nma nmb nmm nne nnk noc non noo nor nph nrg nse nsg nsn nti ntj nto ntu nua nue nug nun nup nyh nyi nyk nym nyn nyr nyu nza nze obg obo ocu oir oji oks olo omh omi ond one ong ono ood ori ork oro orw osa oss otm otr oya paa pae pai pal pan par pat pau paw pba pec per pga pia pip pis pit pkn pkt plg plh pme pms png pnn pno pnu pod pog poh pol por ppi pra pre prh prk prs psh psj psm pso psw ptt ptw pul pum pun pur pwn qaw qhu qia qim qui qum rag ram rao rap ras raw rem res ret rgc rik rim rit rnd rny rom ron rot rov rpa rru rsu ruk rum run rus rwa rwe sah sak sal sam san sap sar saw sba scr sdw sed see sel sem ser ses sgb sgl sgu shb she shh shi shk shl shm shn shp sht shu shy sia sid sil sin sio sir sis siu skk skm skw sla slb slo sme sml smn sna sng snm snn sno snt so sob sod som son sor spa squ srb src srd sre sro ssa sta sti stl stn sub sud sue sug sul sun sup svs swa swe swt syu tab tac taf tag tah taj tak tal tam tan tao tar tas tau taw tba tbo tbt tbu tbw tbx tce tdr tee tel ten teo tep ter tes tet tgh tgk tgl tgo tgr tha thn tho thu thy tib tid tig tim tin tir tis tiv tiw tja tke tki tkl tla tli tlo tlp tma tml tmm tmn tmo tmr tna tnc tne tng tnn tno tny tob tod tol ton tou toz tpa tpn tpr tpt trb tri trm trr tru tsf tsg tsh tsi tsn tsz tte ttn tts ttu tuc tuk tul tun tur tus tuv tuy tvl twe twn tye tzo tzu uby udh udi udm ukr uld uli una ung urd urk url urn urt uru usa usr ute uyg uzb vai ven vie vnm wag wah wai wak wal wam wao wap war was wat wau way wbn wch wec wed wel wem wic wik win wiy wlf wlm wlw wly wma wme wmu wna woi wol wom wor wra wrb wrd wrg wrk wrl wrm wrn wsk wtm wya xam xar xav xbi xho xns yag yam yao yap yaq yar ybi yei ygr yi yid yim yin yiw yko ykt ylm yng yok yor ypk yqy yrm yrr ytu yuc yuk yul yur yuw ywl ywr zag zai zan zap zar zay zaz zch zpr zqc zqo zqs zul zun zzo,1315,76475,0.017195161
93A,Position of Interrogative Phrases in Content Questions,,93,Matthew S. Dryer. 2013. Position of Interrogative Phrases in Content Questions. In: Dryer; Matthew S. & Haspelmath; Martin (eds.) 2013. The World Atlas of Language Structures Online. Leipzig: Max Planck Institute for Evolutionary Anthropology. (Available online at https://wals.info/chapter/93),2,aab abk abu abv acl acn adg adi adz aeg ain akh akn ala alk all amb ame amh aml amn amq anc ani anj anu any ao aoj apl apt apw arc arg arj arm aro arp arq arw asm ass ata ath au ava awi awp awt aym aze azi bag bai bar baw bbl bej bem bfi bgn bgo bgr bho bhu bii bir bkl bkn bku ble blx bmb bnk bod boj boq bra brh brm brn brp bsh bsq bto bud bug bum bur bya cah cai cax cct chc chg chk chn chs chv chw cic cmh cml cmn cmr cnt cop crn cro cti cup cze dag dan dgr dha din dio dja djm dlm dmi dmk dms don doy dre drm dul dum dun dyi efi egn eip erk err ewe ewo fij foe fur fut fye gal gap gar gbb gbs gdb geo giz gmw goe gok gon grw gua gug guh guj gum gur guu gwa gyc hak ham hat haw heh hin hlp hma hmo hna hoa hop hua huc hui hum hun hup hya iau idu ifm igb ige igs ijo ina irq irr isa ite iwm izi jab jar jel jin jmo jms jng jpn jug juh juk jva kab kac kae kan kar kas kau kay kba kbw kel ker ket kew kgy kha khg khi khm khn khr khs kik kil kin kir kiw kkp kkt kkv klq kmb kmh kmj kmk kmn kmo kmz knc knd kni knk knn kob kol kor kos kqq krb krc krd kre kro krr krw ksg ksm ksn kta kty kum kun kuo kuu kuv kwo kwt kyk kyl kyr laa lab lad lag lah lai lal lan lao lav lbu lda ldu lel len lep lew lez lgt lho lim lin lis lkt lmb lmh lmn lmp lnd lon lot loz lug lun luo luv maa mab mad mag maj man mao map mas maw may mba mbi mbm mby mdl mea mee mei mer mey mga mgu mhi mie mik mis miz mka mkd mkg mlg mmw mna mnd mng mnm mns mon moo mor mou mpa mpt mpu mrg mrl mro mru msg msl mtu mum mun mup mus myi mym nad nag naj nam nan nas nav nax nbd nbm nbr ncm ndb ndi ndj ndo ndt ndu nep new ngb ngd ngk ngm ngn ngo ngt ngz nha nif nis niu niv nke nkn nko nma nnd nnk noc non noo nph ntj nua nue nun nwd nyk nza nze obg obo olo omi one ood orh oro orw osa owi oya paa pal pan par pat paw pdp per pkt plg pms pok pra pre prh prk prs psh pso pul pum pun qhu ram rao raw rem rji rny ron rot ruk rum rwa ryu sah sak sam san sap sar sav sdw sed sem ser sgb she shk shl shn sho sid sio skk sko skp skw sla slb sle slg sme sna sng snm snn snt sob som son spi sre sro sti stl sue suk sul sun svs swa syu tab tah tam tao tas tau tbl tbt tbw tel ten ter tet tgk tgl tgr tha thk thy tid tin tja tke tki tml tmo tna tnc tng tnn tny tou toz trb trm trw tsh tsi tsn ttn ttu tul tur tvt twe udh uhi una ung urd urt uru usa uzb vai vie vnm wah wak wal wap wat wbn wed wma wme wmu wol wom wrd wrg wsk wwa xas xbi xho xoo yal yaq yar ygr yid yko yns ytu yuc yur zan zaz zhn zul zzo,615,76475,0.008041844
143F,Postverbal Negative Morphemes,,143,Matthew S. Dryer. 2013. Order of Negative Morpheme and Verb. In: Dryer; Matthew S. & Haspelmath; Martin (eds.) 2013. The World Atlas of Language Structures Online. Leipzig: Max Planck Institute for Evolutionary Anthropology. (Available online at https://wals.info/chapter/143),4,abi abn ace acg acm agb agc agd ain akh akn ala alb all als alw ams amt anj ann any apu arg arj arm aro arq arw ass asy ata awa awt aym baa bac bae baf bai baj bam bao baq bar bbl bbw bch bco bdm bej ber bfg bgn bho bia bil biu bkr bku bla ble blr blz bmz bni bnn bnu bra brf bri brl brp bsh bsq btk bto bua bug bul bun bur buw bvi bwc bya cah cam cax cba ccm cea cem cga cha chb chc chd che chg chh chk chn chq chx cic ckl cle cmn cmy cnt coc coo cos cpl cpy cre crn crt cso cup cya cyv cze dag dan deg dga dgb dgr dhi dhm dhw did din diy dja dji djm djn djp dmk dre drm dua dul dyi ebi egn ene eng eno eny err est eud fij fin fon fut gaa gae gap gav gds gel geo ghr gir gjj gku gmw goa gok goo grb grf grj grk grr grs gud guj gur guu gyc hak ham han haw hay heb heh hei hil hin hlu hmo hnd hoa hol hop htc hua huc hui hun hup hve hya iaa iba idn ifu ign ik ila imo ind inn iqu iri ita jak jaq jlu jng joh juh kad kae kan kba kby kch kdw kdz ket kew kfe kga kgr kgy khd khm khn khr khs kik kil kin kir kkt kla klm kls klv kmh kmi kmj kmp kms kmu kmw knb knc kni knn knz koi kom kop kor kos krb krd krj ksa kse ksn ktc kty kum kuo kut kwa kwb kwn kws kya kyq kzy lac lah lal lan lao lar lat lda ldo leb leg les let lgi lgu lic lis lit llm lmp lot luc lui luo maa mae mag mai maj mak mal mam man mao mau maw mbi mcd mch mco mcv mde mdl mdm mer mgg mgi mhu mie mir mkd mke mkg mkj mkl mlk mme mmn mmv mmw mna mnd mni mnm mno mns mnt mny moe mog moh mok mon mos mov mpa mpo mra mrd mrh mri mrl mro mrq mrr mrt mru mrw msq mss mua mug mun mur mus mut mwb mwe mxc mxj mxo mxp mxx myi nab nad nah naj nak nal nam nan nar nav nax nbr nca ncm nde ndj ndo ndr ndy neh nev new nez nga ngd ngi ngj ngk ngt ngu ngw nha nhh nhm nht nia nif niu nkk nkn nko nmm nne nsg nti nto ntu nue nug nun nwd nyh nyi nyk nym nyn nyr nyu obg obo ocu oir oji oks omi ond ono ood orh ori ork oss otm pai pal pan par pba pga pip pkn plg pms png pnn pno pnu poh pol por ppi pra pre prs psh psw ptt pul pun pur pwn qia qim qui qum rap ras raw rem res rgc rik rim rnd rny rom rov rpa rru ruk rus rwa sak sal sam sap scr sed see ser ses sgu she shl shm shn shp shu sid sil sir sis skw slb slo sml sna sng snn sno snt so sob sod som son sor spa squ srb src srd sre ssa sta sti stl sud sue sul sun svs swa taf tag tah taj tak tal tam tas tau taw tbo tbw tbx tce tdr tee ten tep tes tet tgh tgk tgo tgr tha thn tho thy tib tim tin tis tiw tke tki tkl tla tli tlp tmm tmr tna tng tnn tno tny tob tod tol tou toz tpa tpn tri trr tsg tsi tsk tsn ttn tts ttu tuk tus tvl twe twn tzo tzu udh udi ukr uli una ung urd url uru usa usr vai ven vie wag wah wak wal wam war wed wel wem wic wik wlm wlw wme wmu wol wor wrb wrd wrg wrl wsk wtm wya xam xar xbi xho xns yag yao yap yaq ybi yei ygr yi yid yim yin yiw yko ylm yng yok yor ytu yuc yur yuw ywl ywr zai zap zar zaz zqc zqo zqs zzo,712,76475,0.0093102325
83A,Order of Object and Verb,,83,Matthew S. Dryer. 2013. Order of Object and Verb. In: Dryer; Matthew S. & Haspelmath; Martin (eds.) 2013. The World Atlas of Language Structures Online. Leipzig: Max Planck Institute for Evolutionary Anthropology. (Available online at https://wals.info/chapter/83),3,ace aco adn ajg alw ani any apu arm avo bac blr bnb cai cam cav cmh coo dam ddj dgo dhr din djm djn djr dut emm fri ger gid git gnn grg grj gum gwa hup ido ina jam jeb kay kis kkw klm kmw krk kws ldu lec les lgt lml lug lui mad men min moa moh mou mra mrw mss mtt mxx mzh ney nez ngk ngl nha nti nue nug pau pnx pny pok ppi rit snc tic tik tru tus twn wan wik win wiy wrd wrg wrl wrw ypk yur ywr zar,101,76475,0.0013206931
87A,Order of Adjective and Noun,,87,Matthew S. Dryer. 2013. Order of Adjective and Noun. In: Dryer; Matthew S. & Haspelmath; Martin (eds.) 2013. The World Atlas of Language Structures Online. Leipzig: Max Planck Institute for Evolutionary Anthropology. (Available online at https://wals.info/chapter/87),2,aab aar abk abn abo abu abv ace acg acl adg adi ady adz aeg agb agh agm agt ajg akh akn alb alk all aln aly ama amc ame aml amn amo amp amq amr ams amx ana anc ane ang anj ano anu any ao aoj api apl apt apu arg arj aro arq asm asy atm au awe awi awt awy ayi ayo ayw baa bab bae baf bag baj bam baq bar bas baw bbf bbl bch bdm bdu bdw bem ber bfg bfi bgm bid bik bin bir biu bkr bku ble bln blu blx blz bma bni bnk bnn bok bon bra bre brf bri brl brm brn brp brq bry bsh bsi bsq bsr bto bub bud buj bum bun bus buu bvi bwc cai cas cav cax cbo ccm cde cem cga chb chi chq chr chw cic cld cle cme cmr cnl cnm coc cop cor cpl crn cro crp cso cti ctl ctm ctw cui cup cya dag dan daw day ddj dds dga dgb dgo dha did dig dim din dio diy dji djn dma dms don doy dre dua duk dum dun dyi edo ega egn els emb eme emm eno epe erk err ese ewe ewo fas fij foe fon fre fua ful fur fut fye ga gaa gae gan gar gav gel ghr gjj gku gla gln gmw gnd gnn goa goe goo grb grf grr grw gto gua gug guh gul guu guw gwa gyc hai hal ham har hat haw hdi heb heh hem hid hix hlp hma hmo hna hnd hoa hol hpd huc hup hwr hya iba idn ifm igb ige igs ik ika ila imo ina ind inn iqu iri irq irr irx isa ita jab jad jar jbt jel jin jlu jmo jms jng jrw juh juk jva kaa kae kam kar kau kba kbl kbo kbw kby kch kdz kel ker kfe kga kgr kgu kgy khd khm khs kie kik kin kir kis kje kkt kkv kll klq klv klw kma kmb kmi kmj kmn kmo kmp kmu kmw kmz knc kng knm kno knr knz koa kob koe kok kom kon kos kpe kpw kqq krb krd krh kri krk kro krr kse ksg ksn kta ktc kte ktl ktu kuo kuu kwa kwb kwm kwn kwy kwz kya kyk kyl kyn kyo kyz laa lab lad lag lal lan lao lar lav lbu lda ldo leb lel len lep les let lew lgi lgt lgu lic lin lis lkt llm lmb lmg lmh lml lmp lon lot lou luc lug lui luo luv luy maa mab mac mad mae mal man mao mar mas maw may mba mbe mbi mbl mbm mbo mbr mbt mby mda mde mdg mdl mdn mds mdw mea mee meh mek mey mga mgk mgo mgq mgu mhk mhl mie mii mij min mis miy miz mka mkd mke mkg mkj mku mkz mla mlg mlk mlm mlu mmb mmv mmw mna mng mnm mnv moa mof mok mon moo mor mot mou mpa mpo mpr mpt mpu mra mrg mrh mrl mro mrq mrr mrt mru msc msk msl msm msn mtb mts mtu mua mud mum mup mur mwe mwo mxa mxc mxe mxj mxo mxp mxy myi myn myr mzc nab naj nak nal nam nan nar nat nau nav nax nbd nbr ncm ndb nde ndi ndj ndo ndr ndt ndu neh ney ngd ngg ngj ngk ngl ngm ngn ngo ngt ngu ngz nhh nhm nht nia nif niu nkb nkk nkn nko nku nma nnc nnd nng nnk noc non noo nph nrg nse ntj nto nua nue nun nup nus nyh nyi nyk nym nze olo omh omi orh ori ork oro orw ory osa otr pae pai pam par pat pau per pga pia pir pit pkt plg plh plk pms png pnu pnx poh pok por ppi pre prh prs psw pul pum pun pur qia rag ral ram rao rap ras raw rga rgc rny rom rot rov rru rsu rum run rwa saa sah sak sam sap sdw sea seb sed sem sen ses sgb sgu she shi shl shm shn sht sia sil sim sio sis skk sko sku sla slb sle slp sme sml smn sng snm snn snt so sob som spa spi src srd sre srn sro sti sud sue sug sul sun sup swa syu tab taf tah taj tak tao tat tau taw tba tbl tbo tbt tbu tbw tdi tdr ten teo ter tes tgk tgn tgo tha thd thy tia tib tid tik tim tkl tlf tlp tma tmm tmn tmo tmr tna tnc tne tng tnk tnn tno tny ton toz tpr tps trb tri tsg tsk tsm ttd ttn tuk tum tun tvl uhi uld uli una ung ura urk url urn urt usa ute vaf vai ven vie vif vnm wag wah wal wap wat wbn wch wed wel wic wiy wlf wlo wma wmu wn wna wog woi wol wom wra wrd wrk wrl wrm wsk wth xam xas xbi xer xho xoo yag yal yam yao yap yay yel yi yid yiw yor yrm yuc yul zag zai zap zar zaz zul zun zya zzo,879,76475,0.011493952
97A,Relationship between the Order of Object and Verb and the Order of Adjective and Noun,,97,Matthew S. Dryer. 2013. Relationship between the Order of Object and Verb and the Order of Adjective and Noun. In: Dryer; Matthew S. & Haspelmath; Martin (eds.) 2013. The World Atlas of Language Structures Online. Leipzig: Max Planck Institute for Evolutionary Anthropology. (Available online at https://wals.info/chapter/97),5,abi ace acn aco adn ajg alw amm amt ani any apu arm ata avo bac bbw bej bgn bgo bio bkl blr bnb boj brs btk bua cai cam cav cct chg chs cmh coo cuc dam ddj deg der dgo dhr die din djm djn djr dlm dul dut emm esm fri gah ger gid gim git gmz gnn grg grj gum gwa han hil hup ido ina ite ito izi jam jeb jug kac kan kay kis kkw kla klm kmw knk kpm krj krk kut kws kwt kyr laf lah lai ldu lec les lgt lml lmu lug lui lun mad mak mam mch mcv mei men mik min mir mmn moa moh mos mou mra mrw mss mtt mxx mzh nag nas ney nez ngi ngk ngl ngw nha nhn nke nmm nti nue nug nuu nyr obo oks pau pdp pnn pnx pny pod pok ppi rit rji ruk sal see ser shk snc son swt tac tag tar tic tik tis tiv tja tla tli tot tpn trr tru tuc tus tvt twn tzu uru wan wao wik win wiy wrd wrg wrl wrw yim yin ypk yur ywr zar,198,76475,0.0025890814
69A,Position of Tense-Aspect Affixes,,69,Matthew S. Dryer. 2013. Position of Tense-Aspect Affixes. In: Dryer; Matthew S. & Haspelmath; Martin (eds.) 2013. The World Atlas of Language Structures Online. Leipzig: Max Planck Institute for Evolutionary Anthropology. (Available online at https://wals.info/chapter/69),2,aar abi abk abn abv acg acm aco acu adn aga agm agt ain ala alb alc ale alw aly amb amc ame amn amp amx ana ani ann ao apl apt apu ara arc arm arw asm ass ath atk ava avo awa awe awi awp awt aym aze azi baa bac bae bam bao baq bau bco bdm bej bel ber bgn bho bii bil bin bio bkb bkr bln blt blx bmb bmr bnj bnr bnu bod boi boj bre brh bri brm brn brr brs bry bsk bua bul bun bur but bya bzi cah car cas cax cay cba cbo cct cde chb chc che chg chi chn chv chx cld cln cmh cmn cmy cnm cnt coa coo cos cpy crn crp ctm cub cui cup dag dan daw der des deu dgo dgr dhb dhm dhr dhw dig dim diy dja dji djm djn djp djr dlm dmi dmk dms dni dom drm dsh duk dun dut dyi eip eka emb eme ene eng epe ese est eud eve evn fas fin for fqs fre fua fur fye gaa gah gal gan gar gbb gds geo ger gid gim gln gnn goa gog gon grb grf grj grk grr grs grw gud gug guh guj gum gur guu hai hak hal har hay hin hix hlp hmi ho hop hpd hua hui hum hun hzb iat ice igb ign igs iha ijo ik ika imo ina ind ing inn iqu irx ita ite iwa jam jaq jeb jiv jpn jva jwr kac kar kay kbo kbu kem ker kew kfe kgu kgz kha khg khi khl kio kiw kkp kku klm klq kma kmb kmh kmj kmk kmn kmo kmp kms knb knc knd kni knk knm knn knr knw kob koe kok kol kop kor koy krc krh kri krj krk krw ksa kta kti ktl kty kum kus kuu kuv kwk kwo kwt kwz kya kyk kyq kyz lac lad lav ldu lec lep lez lho lim lit lkt lmn lng lot lui lun mab mac mag mak map mar mau mbt mcd mco mcv mde mdm mdn mdo mee mei mem mgg mgi mhi mhk mij mik mis mkg mkh mkr mme mmi mnc mnd mne mni mnm mno mns mny moe mog mom moo mos mot mou mpr mpt mqf mra mrh mri mrr mrs mrt mrw msc msg msl mss mtk mts mui mun mut nab nag nah nar nas nbd nbr nca ndo ndt nep nev new nez nga ngi ngj ngl ngn ngt ngw ngz nha nhh nhm nhn nht nis niv nkb nmb nmd noc nog non nor nph nsn nti ntj ntu nug nwd nyi nze oks olo omh omi one ong ood ord orh ork oro orw osa oss oya paa pae pan pau paw pba pdp pga pia pip pir pis pkn plk pme pno pny pol por ppi prh prk psh pso ptw pum pur pwn qaw qhu qim ram rao raw rem res ret rit rmb rom rot rum run rwa rwe sav sba sdw sem shd she shh shi shk sho shp shy sia sid sin siu skp skr slb slg slp sme smn sna snh sno snt som spa srd srn sro sta stl sue sug suk sus svs swe syu tac tam tan tao tau tba tbl tbu tbx tce tel tgl thn thu thy tir tja tkl tma tmc tmg tml tmo tnn tny tob ton tpn tps tpt trb trr tru trw tsf tsh tte ttu tuc tun tur tuv tvo tvt twe twn uby udi udm uhi ukr una urd usa usr ute uyg uzb wah wai wak wam wao wap was wat wau way wbn wch wel wem wik win wir wly wmu wog wra wrb wrg wrk wrn wsk wtm yag yah yal yaq yar ycn yid yim yin yko ykt ylm yng yok ypk yrm ytu yuc yuw ywl yyg zay zch zpr zqc zqo zqs zun,667,76475,0.008721804
94A,Order of Adverbial Subordinator and Clause,,94,Matthew S. Dryer. 2013. Order of Adverbial Subordinator and Clause. In: Dryer; Matthew S. & Haspelmath; Martin (eds.) 2013. The World Atlas of Language Structures Online. Leipzig: Max Planck Institute for Evolutionary Anthropology. (Available online at https://wals.info/chapter/94),1,abi ace acl aco adn aeg alb alk all aln alw aml amo amr ams ani apu arg arj arm arq arw asy ata au ayw bag baj bak baq bar bbw bdu bfg bho bik bir bka bkl bkr bma bnr bnu bre brf bsh bsk btk bto bug bul bum bvi bwc ccm cem cha chk chq chr chw chx cic ckl cle cmy coo cop cpl crn cso cya cyv cze dhr did din dio djp dom dre dsh duk dut efi eng eno erk est ewe ewo fij fin fre fua fut fye ga gae geo ger gmw gok grf grk grr gud guj gwa hal hau haw heb hin hmo hna hnd hoa htc hun hve iaa iba ifm ifu igb ind iri ita ite izi jak jmo juh kam kan kau kch ker kfe khl khm khs kik kil kir kis kkt kkv klm kls klv kmj knk kno koe kos krb krd kro krr kry kse ksn kty kut kwn kwy kya laa lac lao lat lbu lda lel len lgu lit llm lmb lmg lmh lmp lnd lon lou luv maa mag mai mal mam man mao mau may mbm mbr mbt mco mcv mde mds mea mee meh mek men mer mga mgu min miy mka mkg mlg mlu mmn mng mog moh mok mon mov mra mrg mro mrq msq mup mus mut mwb mxc mxj mxo mxp myg myi mzh naj nan nav nca ndo ndt ndy nez ngd ngm ngo nhh nhm nht nia niu nke nkn non noo nor nsg nua nue nyi obo ocu oji olo ond orh otm paa pai pal pan par pat pip pkt plg plh pms pnn poh pol prs psh psm pul qui rap rny rom rot rov rsu rus rwe sah sak sam san sar scr sdw shl shn sim sio siu som son spa squ srb srd sti sud sue sul sun sup sus swa swe swt tab tag tah taj tao tbo tbt tee ten teo tep ter tes tgh tgk tha thy tic tim tin tiw tla tlo tna tne tng tnn tno tob tou tri tsi tsk ttn tuk tvo txj tzo tzu udi ukr uld ung urd uzb vai vie vnm wal war wch wel wic wik wlf wlo wma wme wol xas yap yay yns yor yur zai zqo zul zzo,398,76475,0.0052043153
51A,Position of Case Affixes,,51,Matthew S. Dryer. 2013. Position of Case Affixes. In: Dryer; Matthew S. & Haspelmath; Martin (eds.) 2013. The World Atlas of Language Structures Online. Leipzig: Max Planck Institute for Evolutionary Anthropology. (Available online at https://wals.info/chapter/51),1,aar abn acm acu adk adn ady aga agt alb ale all alw aly amh amn ams ana apw arc arm arw ass ath ats ava awa awe ayo aze azi baa bae baq bbw bej bel ben bho bii bio biu bkb blr blx bmr bnj bnr bnu bod boi brh brm brr brs bry bsk bti bun bur but bya cah cai cam cas cax cay cea chc chi chk chv cln cmh cml cmn coa coc cos cpy cre crp ctm cub cup cze dag dgr dhb dhr dhw did diy dja dji djm djn djp djr dmk dni dom drg dsh dyi emb ene esm ess est eud eve evn fin fur gah gal gam gan gds geo ger gid gil gku goa god gog gon grk grr grw gug guh gum guu hin hlp hmi ho hop hua hui hum hun hup hzb ice ijo ik ing iqu ite jab jaq jeb jiv kab kac kay kbu kem ken ker ket kgu kgz kha khg khi khl kio kiw kje kkp kku klg klm klw kma kmh kmk kmo kmp kmr kms knd knn kno knw kok kol kop kor koy krc krj krn krw kry kta kty kum kuv kws kwz kya kyp kzy lad lak lat lav lec lez lho lim lit lml lmn lui mac mag mai maj map maw mba mby mcc mch mdm mdn mee men mer mgh mhi mhk mhl mii mik mir mkh mki mlk mme mnc mne mno mns mny moe mog moh moo mqf mrl mrt mrw msc msl mts mui mur mut nah nas nbr ndj nep new nez nga ngi ngj ngl ngm ngn ngt ngw nha nis niv nkb noc nog nor nsn ntj ntu nug nya nyi oir oji omi ond one ong ord orh ork orw oss otr oya pan par pba pia pir pkn pkt pme pny pol ppi prh prk psh psm pso ptt ptw puq pur pwn qim qui rem rit rmb rom rus rut rwe sav scr shb shh shi sho shp shy sia sin skp slo slp sna snh sno so sor sta stl sue suk tao tce tel ten thn thu tic tli tlo tlp tma tml tmn tpn tpt trm trr tru tsh tsz ttu tul tun tur tus tuv tvo twe twn udi udm uhi ukr uru usr ute uyg uzb wag wah wak wam wan wap was wau wed wem wic wik win wiy wly wmu wn wom wrb wrd wrg wrk wrl wrn wth xbi yag yah yam yaq yar yid yim yin yko ykt yng yok ypk ytu yuc yuk yur yuw ywl yyg zan zay zpr zqc zqo zqs zun,452,76475,0.0059104282
