parameter_id,parameter_name,parameter_description,chapter_id,chapter_citation,value,same_value_language_ids,value_language_count,language_count_total,count_ratio
143E,Preverbal Negative Morphemes,,143,Matthew S. Dryer. 2013. Order of Negative Morpheme and Verb. In: Dryer; Matthew S. & Haspelmath; Martin (eds.) 2013. The World Atlas of Language Structures Online. Leipzig: Max Planck Institute for Evolutionary Anthropology. (Available online at https://wals.info/chapter/143),1,abi abn abu ace acg acl acm aco adg agc agd agh ain ajg akh ala alb all als alw amb ame aml amn amo ams amx anj any aoj apu apw arg arj aro arp asy ata au awa awp aym baa bab bac bae baf bai baj bam bao baq bar bbf bbw bch bco bdm bfg bgo bho bid bii bil bkr blr blt bmb bmz bni bnn bnu bob bod boi bok bra bre brf bri brp bsq btk bto bua bug bul bun buw buy bvi bwc cah cai cak cax cea cem cha chc chd che chj chk chq chr chx ckl cle cmh cmn cmy cnt coc coo cos cpy cre crn crt cso ctl cui cup cya dag dan dga dgb dgr dha dhw did din diy dja dji djm djn djp dma dmk doy dre dsh dua dut dyi ebi eip eka ene eng eno erk est eud eve evn ewe ewo fij fin fon fre fut fye gaa gae gap gav gbb gds gel geo ger ghr gir gmw goa gok goo grb grf grj grk grr grs gua gud gug guh guj guu gwa hai hak hal han hau haw hay heb hei hil hin hlp hlu hmo hoa hop htc huc hun hup hve iaa iba ice idn ido ifm ifu ign ik imo ina ind inn iqu iri ita ite izi jak jaq jlu jng joh juh kad kae kan kbl kch kdz ket kfe khm khn khr khs kio kir kis kiw kkt kla klm kls klv klw kmk kms kmu kmw knb knc kni knk knn koe koi kom kop kor kos krb kre krj krk kro ksa kse ksg ksn ktc ktl kty kum kuo kut kwa kwb kwn kwo kws kwt kya kyq kzy lac lah lal lan lao lar ldu lgu lho lic lis lmu lou lui luo mae mai maj mak mal mam man mao mau maw mbe mbi mbt mcd mch mco mde mdl mdm men mer mga mgg mgi mgk mhu mie min mir miy mka mkg mkj mkl mku mlk mme mmn mna mnd mni mnm mno mns mnt mny moe mog mok mom mon moo mos mov mpa mpo mrd mrh mri mrl mro mrq mrr mrt mru mrw msk msn msq mss mtu mum mun mup mur mus mut mwb mwo mxc mxj mxo mxp myi nab nag nah naj nak nal nar nav nax nbr nca ncm ndj ndo ndr ndy neh nev nez nga ngd ngi ngj ngk ngu ngw nha nhh nhm nht nia nif niu nke nkk nne non nor nsg nti ntu nue nug nun nyi nyk nyn nyr nyu oir oji oks omi one ono ood oro orw oss otm otr paa pai pal pan par pau pba per pip pis pkn plg plh pnn pno pnu poh pol por ppi psm pso pul pun pur qhu qim qui qum rag ram rap raw res rik rom rot rov rpa ruk run rus rwa rwe sam sap scr sed see ses shl shp shu sid sil sir sis siu skw slb slo sml sna sng snn sno so sob som son spa squ src srd sre ssa sta sti stl stn sud sue sun sup svs swe tac taf tag tah tak tam tau taw tbo tbt tbx tce tee ten teo tep ter tes tgh tgk tgo tha tho thu thy tid tim tin tiw tja tke tkl tla tli tmm tmn tmo tmr tnc tng tnn tno tny tol tou tpa tpn tri trr tsg tsh tsi tsk tsn ttn ttu tuk tus tvl twe tye tzo tzu udh ukr uli una ung urd url urt uru usa vai vie wag wah wak wal wam war wat wch wed wel wem wic wik win wiy wlf wlm wlw wmu woi wol wor wrb wrd wrg wrk wrl wsk wya xam xar xbi xns yag yap yaq yei yi yid yin yiw ylm yng yok yor yuc yuk yur yuw ywl ywr zai zar zch zpr zqo zqs zun zzo,682,76475,0.008917947
81A,Order of Subject; Object and Verb,,81,Matthew S. Dryer. 2013. Order of Subject; Object and Verb. In: Dryer; Matthew S. & Haspelmath; Martin (eds.) 2013. The World Atlas of Language Structures Online. Leipzig: Max Planck Institute for Evolutionary Anthropology. (Available online at https://wals.info/chapter/81),7,ace aco adn ajg alw amc ami ani ann any apl arm asy ats avo bac baj bbu bbw bch bil bkr bla bln blr bnb brs btk bwc cai cam cav cax cbo cea che chk cmh coo cre dam ddj dgo dhr din djm djn djr dom dre dut dyi emm fij fri ger gid git gku gnn goo grg grj grk grr gum gwa hun hup ido ina jam jeb kay khr kis kkw klm klv kmw krk krn ksa kut kwk kws kwz lac ldu lec les lgt lmb lml lug lui mac mad mdm meh men min miy moa moh mou mov mra mrw msk mss mtt mxx mzh nau ndj ndr ney nez ngg ngk ngl nha nnc nti nue nug nuu nym nyn oji ond ood pai pip pnx pny pok ppi psm ptw rit ruk rwe sam shs shu siu sml snc swt tac tas tee tho tic tik tin tng tno tob ton tru tus twn tzu ute wai wam wan wic wik win wiy wrd wrg wrl wrw wya yag yok ypk yur yus ywl ywr zar zqo,189,76475,0.0024713958
116A,Polar Questions,,116,Matthew S. Dryer. 2013. Polar Questions. In: Dryer; Matthew S. & Haspelmath; Martin (eds.) 2013. The World Atlas of Language Structures Online. Leipzig: Max Planck Institute for Evolutionary Anthropology. (Available online at https://wals.info/chapter/116),1,aab abu ace acn adi aeg agc agd agm ain ajg akh akn alb all aln amb amc ame amn amo amp amq amr ams amx anc ani anj ann anu ao aoj api apt aro arp asm asy ata ava avk awp awt aym aze baa bab bag bai bam bar baw bbf bbw bel bem ber bfg bgn bgo bho bir bkn bkr blr blx bma bnj bnu bon bra bre brf brp bsk bsq btk bud bug bul bus bwc bya cax cbo ccm cct cea cem cga cha che chh chp chq chr chs chw chx cic cle cmh cmn cmr cnl cnm cnt coc coo cop cre crn cso cti ctm dan dds dgr dhi dji dmk dng don doy dre drm duk dul dum dun dyi ebi efi ega egn eme err ese est eud eve evn ewe ewo fin fre fua fut fye gap gav gbb gel ghr git goa goe gok gon grb grk grr gua gud gug guh gul gur guw gwa hai ham hat hau hdi heb hil hin hma hmo hna hnd ho hop huc hun hve iaa iba ifm ifu ige ik imo ina ind iri ite iwa iwm izi jab jar jeb jms jng jpn juh juk kaa kar kau kbw kby kdz kel ken ker ket kew kfe kgz kha khg khm khn kho khr khs kil kim kio kiw klm kmb kmj kmo kmu knd knk kno kob kos kpw kre krj krn krw ksa kse ksg ksm ksn kta kum kut kuv kwn kwo kxo kya kyl kyp kyz laa lac lag lah lai lal lao lat lav ldo ldu lel len lep lew lgt lit lkt lmb lmg lmn lmp lnd loz lug lui lun luv maa mad mae maj mak mal mam map mas mau maw max may mbi mbm mbr mby mcc mcd mco mdo mds mea mee mei mek mey mgk mgu mhi mie mir miy miz mka mke mkh mkj mmb mmi mmn mmv mnd mno mny mok mon moo mor mos mou mpa mpr mpt mpu mrg mri mrq mru mrw msn mtu mum mun mup mus mut mwb mxj mxo mxp mxx mxy myi mym mzh nag nam nan nar nas nav nax nbm ncm ndb nep nev new ney nez ngb ngi ngm ngn nia niu niv nkb nke nkn nko nma nnc non noo nsg nsn nti nug nun nup nwd nyn nyu nze obg obo ocu oji olo omh omi ond ood otm oya pan per pga pir pis plk pno pnx pod pok pol por prs pum qim qum rap raw res ret rit ron rot rum rus rwe sam san sap scr sed sem ser sgb she shh shi shk shu sio sis siu skk sko sla slb sle slg slo sng snn sno so sob som son squ srd sre srn sro sti sun sup swa swt tac tag tah taj tak tam tao tat tau tbo tbu tee ter tet tgh tgk tgl tha tho tib tim tin tiw tja tkl tla tlp tna tne tnn tny toz tpn trb tri tsh tsk tsn ttn ttu tuk tur tus tuv tvo tvt twe txj tzo tzu ukr uld urd urk url urt ute vie wah wal was way wbn wch wel wic wik wiy wlf wn wrl wsk wth wwa xas xav xho xoo yag yaq yar ygr yin yiw yok ypk yqy yuc yuk yul yur yuw ywl zai zap zhn zul zya,585,76475,0.0076495586
96A,Relationship between the Order of Object and Verb and the Order of Relative Clause and Noun,,96,Matthew S. Dryer. 2013. Relationship between the Order of Object and Verb and the Order of Relative Clause and Noun. In: Dryer; Matthew S. & Haspelmath; Martin (eds.) 2013. The World Atlas of Language Structures Online. Leipzig: Max Planck Institute for Evolutionary Anthropology. (Available online at https://wals.info/chapter/96),5,ace aco adn ajg all alw amt ani any ao apu ara arm avo awe azi bac bam baw bfi bil bla blr bnb brh bya cai cam cav cct chg chi chk cld cmh cmr cnl cnm coo dam ddj dds dgo dhr die din diy djm djn djr dlm drm dut efi emm epe fri gah ger gid gim git gmw gnn god grg grj gum gwa hai har hin hun hup hwr ido ika imo ina jam jeb jms kas kay kew khr kio kis kkq kkw klg klm kmb kmw kmz knd koa kob krk krn krw kut kws kya kyo lai lal lav lda ldu lec les lgt lkt lml lug lui mac mad mai mak mar mco mek men mgq min mka moa moh mou mpa mpt mra mrt mrw msn mss mtt mud mxx mzh nam nav ney nez ngi ngk ngl nha nhn nrg nti nue nug ond osa oya pan pau pit pnx pny pok ppi res ret rgc rit ruk ser skw sla snc snm squ stl sup tau tdr tic tik tis tja tou tru tsh tuk tus twe twn udh urd vai wan wao wap wbn wik win wiy wrd wrg wrl wrw xas yid ypk yur yuw ywr zar,213,76475,0.002785224
88A,Order of Demonstrative and Noun,,88,Matthew S. Dryer. 2013. Order of Demonstrative and Noun. In: Dryer; Matthew S. & Haspelmath; Martin (eds.) 2013. The World Atlas of Language Structures Online. Leipzig: Max Planck Institute for Evolutionary Anthropology. (Available online at https://wals.info/chapter/88),6,agd arg arj asy bam bbf bbw bem bma chi chq cmh cop der dhr dja eip grw hau hlp hol imo jam jug kdz krd kws kya lbu lkt lmb lmg lml ma mao mch mke mrq mua nau nma nse one osa pkn rom rwa sam sge sir skk tag tbw tdi tgr tlf tou tzu uru wan wrw xho yah yid yir zul,67,76475,0.0008761033
84A,Order of Object; Oblique; and Verb,,84,Matthew S. Dryer (Orin D. Gensler). 2013. Order of Object; Oblique; and Verb. In: Dryer; Matthew S. & Haspelmath; Martin (eds.) 2013. The World Atlas of Language Structures Online. Leipzig: Max Planck Institute for Evolutionary Anthropology. (Available online at https://wals.info/chapter/84),6,ace acm aco adn ajg ala alw ani any apu arm arw avo awt bac bai bdm blr bnb bnu brm brn brr cai cam cav cea che chr cmh coc coo cre dam ddj dgo dhr din djm djn djr dut dyi eme emm fij fri gap ger gid git gnn goo grg grj gum gwa hup ido ina inn irq ite jam jeb kay kis kkw klm kmw knc krk kuu kws lar ldu lec les lgt lml lug lui mad map mdl men min mku moa moh mou mra mrh mrr mrw mss mtt mxx mzh nas ndj ney nez ngi ngk ngl ngn nha nti nue nug oji ond pau pkn pnx pny pok ppi psm ptw pun ram res rit sal sar sdw shs siu snc tac tic tik tin ton tpn tru tsh ttu tuc tun tus twe twn udi urk ute wan wic wik win wiy wrd wrg wrl wrw wry wya yim yin ypk yur ywl ywr zar,167,76475,0.0021837202
144A,Position of Negative Word With Respect to Subject; Object; and Verb,,144,Matthew S. Dryer. 2013. Position of Negative Morpheme With Respect to Subject; Object; and Verb. In: Dryer; Matthew S. & Haspelmath; Martin (eds.) 2013. The World Atlas of Language Structures Online. Leipzig: Max Planck Institute for Evolutionary Anthropology. (Available online at https://wals.info/chapter/144),21,abi abn acm all als ani ann any ara ata bac bao bas bbw bdm bil bnu bri btk bua bug bwc cea chd chk chs chx cmr cos cre cti dan dgr dja djn dmk dom dyi ene eno eud gav ghr gmz goo grj han hma hup hve iau iba ifu ign imo ina jng joh kad kau khn khr klm klv kms kmu kmw knb knc krn ksa ktc kum kwn kya lac lal lar lui mai mba mch mde mdl mer mie mkl mlk mni moe mog mrd mrh mri mrr mrw msm nbr ndj ndo ndr nev nez ngd ngi ngj nht nug nyk nze oir omi ond ood oss par pip pit pnu pog pun pur qaw rik rpa rsu rwa scr ses skk skw sno son src sta sud sue svs tac taw tce tep tke tkl tla tny tou tsg tus twe uru wah wam wed wmu wrb wrd xam xns yag yei yi yiw ylm yok yuc yur zqo,169,76475,0.0022098725
82A,Order of Subject and Verb,,82,Matthew S. Dryer. 2013. Order of Subject and Verb. In: Dryer; Matthew S. & Haspelmath; Martin (eds.) 2013. The World Atlas of Language Structures Online. Leipzig: Max Planck Institute for Evolutionary Anthropology. (Available online at https://wals.info/chapter/82),1,aab aar aba abi abk abn abo abu abv acg acl acm acn aco adg adi adn ady adz aeg aga agb agh agm agt ain aja ajg akh akn ala alb ale alk all aln aly ama amb ame amh aml amn amp amq amt amx ana anc ane ang ani ano anu ao aoj api apt apu apw arc arg ari arj arm aro arp arq arw asm ass ath atk atm au ava avk avo awa awi awp awt awy ayi aym ayo ayr ayw aze azi baa bab baf bag bai bak bam bao bar bas baw bbl bbw bdm bdu bdw bej bel ben ber bgm bgo bgr bgs bgz bho bhu bid bii bik bin bio bir biu bka bkb bkt bku ble blt blx blz bmb bnb bni bnj bnk bnn bnu boa bob bod bok bol bon boq bra brf bri brl brm brn brp brq bry bsh bsk bsq bsr bti bua bub bud bug bum bur bus but buu buy bvi bya bzi cah cai cam can car cas cay cct cde cga chb chc chd chg chh chi chk chn chp chr chs chv chw cic cln cme cmh cml cmn cmr cnl cnt coa coc cop cpn cpy crn cro cti ctm ctw cua cuc cui cup cze dag dam dan daw day ddj dds deg der des deu dga dgb dgo dgr dha dhb dhm die dig dim din dio diy dja dji djp djr dlm dma dmi dmk dms dni dok doy drg drm dsh dua duk dul dum dun dut dyi ebi edo ega egn eip eka eko emb eme emm ene eng eno epe erk err ese est eud eve evn ewe ewo fas fin foe fon for fqs fre fri fua fur fut fye ga gah gal gam gan gap gar gav gbb gbs gds geo ger ghb ghr gim gla gln gmw gmz gnb god goe gog gok gon goo grb grg grw gua gug guh guj gul gur guu guw gwa gwo gyc hai hak hal ham han har hat hau hay heb heh hem hhu hid hin hlp hma hmi hmo hna hnd hol hop hpd hua huc hui hum hun hya hzb iat iau iba ice idn idu ifm igb ige igs iha ijo ika ila imo ina ind ing inn iqu irq irr irx isa isi ite ito iwa iwm izi jab jad jar jbt jin jiv jmo jms jng joh jpn jrw juh juk jva jwr kaa kab kac kad kae kan kar kas kau kay kba kbo kbu kbw kby kch kdw kel kem ken ker ket kew kfe kga kgu kgy kha khd khg khl khm khn kho khr khs khw kie kik kil kim kin kio kir kis kiw kkp kkq kku kkv kla klg kll klq klw kma kmb kmh kmk kmn kmo kmp kmr kms kmu kmw kmz knb knc knd kng kni knk knm knn kno knr knw knz koa kob koe kok kol kom kon kor kos koy kpw kqq krc krd kre krh krk krr krw kry krz ksa kse ksg ksm ksn kta ktc kte kti ktl kty kum kun kus kuu kuv kwa kwn kwo kwt kwy kwz kxo kya kyk kyl kyn kyp kyr kyz kzy laa lab lad lag lah lai lak lal lan lao lar lav lbu lda ldo ldu leb lec leg lel len lep les let lew lez lgi lgt lho lic lim lin lis lit lkt llm lmh lmn lmp lmu lnd lon lot lou luc lug lui luo luv ma mab mad mae mag mai man mar mas mau maw max may mba mbe mbi mbm mbo mbr mbt mby mcd mda mde mdg mdl mdn mdo mds mdw mea mee mei mek mem mer mey mga mgg mgh mgi mgk mgo mgq mgu mhi mhu mie mii mij mik mil mis miz mka mkd mke mkg mkh mki mkj mkl mkq mku mkz mla mlg mlk mlm mlu mmb mmv mnc mnd mne mng mni mnm mno mns mnv mny moe mof mog mom mon moo mor mos mot mou mpa mpt mpu mqf mrc mrd mrg mrh mri mro mrr mrs mrt mru mrw msc msg msl msm msn mss mtb mto mts mtu mua mui mum mun mup mur mus muu mwe mwo mxe myg myi mym myn myr nab nad nag nah naj nak nal nam nar nas nat nav nbd nbe nbm nbr ncm ndb ndi ndj ndo ndt ndu ndy neh nep nev new ney nga ngd ngi ngj ngk ngm ngn ngo ngt ngu ngw ngz nhn nis niv nkb nke nkn nko nku nma nmb nmd nmm nnd nng nnk noc nog non noo nor nph nse nsn nti ntj nto ntu nua nue nun nup nus nwd nya nyi nyk nza nze obg obo ocu oir oks olo omh omi one ong ora ord orh ori ork oro orw ory osa oss otr owi oya paa pae pal pam pan par pat paw pba pdp per pia pir pis pit pkn plg plh plk pme pmn pms png pno pnu pny pog poh pok por pra pre prh prk prs psh pso psw ptt ptw pul pum pun pur qaf qaw qhu qim rag ral ram rao ras raw rem res ret rga rgc ria rik rim rmb rnd rny rom ron rot rpa rru rsu rum run rus rut rwa ryu sah sak san sap sar sav scr sdw sea sed sem ser ses sgb sgl sgu sha shb she shh shi shk shl shm shn sho sht sia sid sil sin sio sir sis skk skm sko skp skr sku skw sla slb sle slo sme smn sna sng snh snm snn sno snt sob sod som son spi srb src srd sre srn sro ssa sta sti stl stn sud sue suk sul sun sup sus svs swa swe syu tab tac taf taj tak tal tam tan tao tar tau taw tba tbl tbt tbu tbw tce tdi tdr tel teo ter tet tgk tgl tgn tgr tha thk thn thu thy tia tib tid tig tik tis tiv tiw tja tki tkl tkm tlf tli tlo tma tmc tmg tml tmm tmn tmo tmr tnb tnc tne tni tnk tnn tny tod ton tou toz tpr tpt trb trm trr tru trw tsf tsh tsz ttd tte ttn ttu tuc tul tum tun tur tuv tuy tvo tvt twe twn txj tye uby udh udi udm uhi ukr uld uli una ung ura urd urk url urt uru usa usr uyg uzb vai ven vie vnm wag wah wak wal wan wao wap was wau way wbn wch wed wiy wlf wlw wly wma wme wmu wn wna woi wol wom wra wrk wrm wrn wry wsk wtm wwa xam xar xas xav xbi xer xho xns xoo yah yal yam yaq yar yay ybi ycn yei yel ygr yi yid yim yin yko ykt ylm yng yor yqy ytu yuc yuk yul yur yus yuw zag zan zar zay zaz zch zhn zim zpr zul zun,1192,76475,0.015586793
112A,Negative Morphemes,,112,Matthew S. Dryer. 2013. Negative Morphemes. In: Dryer; Matthew S. & Haspelmath; Martin (eds.) 2013. The World Atlas of Language Structures Online. Leipzig: Max Planck Institute for Evolutionary Anthropology. (Available online at https://wals.info/chapter/112),2,aab abi abn aco adg adn aeg agd agh ain ajg ala alb alc alk all aln alw amb ame amq ane ani anj ann anu apu ara arg arj arp asm asy au awa aym baa bag bao baq bar bbw bdm ben bfg bgo bgr bii bik bir bka blr blx bma bmb bnn bnu brf bri bsq bto bua bud bul bum bun bwc bzi cah cai cax cea cha chc chk chp chx ckl cle cmn cmy cnl cnt coo cos cpy cre crn cso cti ctl cup cya dag dan dga dgb dgo dhr dhw diy dja dji djn djp dmk dni dsh dua duk dum dut dyi ega eip eka eng eno ese est eud ewo fre fye gaa gae gap gbb gbs gds geo ger gmw gnn gok goo grf grj grk grr grs gud guh guj guu hat hau haw hay heb hil hin hna hun hup hve ice ige igs ik imo iqu iri irr isa ita iwm jab jak jaq jar jmo kaa kad kae kan kar kau kdz kel ken ker kfe kho khr kkv klm kls klv klw kmk kmz knb knc kni knn koi kor kos kre krj krr ksa kse kti kty kum kuo kut kwa kwn kwt laa lab lac lag lan lar ldu lel lgt lin lkt lmg lmn lon lui luo maa mac mad mal mam mas mau may mba mbt mby mcd mch mco mda mde mdm mdo mdw mea meh mer mga mgg mgi mgk mgu mhu mir miz mkl mku mlk mlu mmn mna mnd mni mnm mno mns mny moe mog moh mok mos mou mpo mpu mra mrd mrg mrh mri mrl mrt mrw msm msq mss mtb mtu mum mur mus mut mxc mxj mxo mxp myg myi nab nad nag naj nar nav nca ndj ndo neh nev nez ngi ngj ngm ngu ngw ngz nha nhh nhm nht nke nkk nnk nor nse nti nua nue nug nyi nyn nyu nza nze oji oks olo omi ond one ono ood osa oss otm paa pai pal pan par paw pba pip pkn plh pno pod poh pok pol por pul pur qim qum ram raw res rik rom rov rsu rus sah sam san scr ses sgb shl shp sht shu shy sid sim sio siu skw sla slb slo sme sml sna sng snn so sob som spa src srd sta sup swe tab tac tag tah tak tam tau taw tbo tbt tce tee ten tep ter tes tgh tho thy tid tim tiw tja tkl tli tmn tmo tmr tnn tno tny tou tpn trb trr tru tsg tsh tsk tsn ttn ttu tus tzo tzu ukr uld una ung urk urt usa wag wak wal wam wch wec wel wem wic wir wiy wlm wma wmu wom wor wrb wrd wrg wrm wry wsk wya xam xav yag yap yaq yei yid yin ylm yng yok yur yuw ywl zai zch zzo,502,76475,0.0065642367
33A,Coding of Nominal Plurality,,33,Matthew S. Dryer. 2013. Coding of Nominal Plurality. In: Dryer; Matthew S. & Haspelmath; Martin (eds.) 2013. The World Atlas of Language Structures Online. Leipzig: Max Planck Institute for Evolutionary Anthropology. (Available online at https://wals.info/chapter/33),2,abi abk abn acg aco agt ain alb ale aln amh amx any ao apu ara arc arm arp arw asm ath ava avo awa awe awp awt aym aze azi baa bae bam baq bar bdm bej bgn bho bid big bkb bla bln blt bmz bnu bod bre brh bri brn brs bsk bti bud bul bun bur but bya cah cai cam car cas cax cde chb chc chg chk chn chs chv chx ckl cld cln cmh cmn cmy coc cpy cqt cre crn cro crp ctm cup cze des deu dgb dgo dhr dhw did dji djn dmk dms dom doy drg dsh dut eip emb ene eng est eve evn fin for fre fua ful ga gah gal gam gds geo ger gil gim gmw gnd goa god gon grb grf grk grw gud guh gum guu gyc hai hau hay hdi heb hhu hid hin hlp hma hmi ho hop htc hui hum hun hzb ice idn ign igs ijo ik ina ing inn irq ita ite ito jaq jeb jiv jlu jpn jug jva kab kac kai kbu kdw kem ket kew kfe kgz khg khi khl kho kie kio kir kiw kkp kku kla klw kma kmh kmk kmo kms knd kni knk knn knr knw kob kok kol kop kor koy kpe krc krd kri krk krn krw kry kta kty kum kuv kws kwt kxo kyq lad lah lan lar lat lav ldu lec lel les lez lit lmg lmn lng lug lui lul lun luo ma maa mab mac mag maj man mas mba mbr mcv mde mdn mea mee meh men mer mgh mgq mgu mij miy mkg mkh mkr mlg mme mmi mna mnc mnd mne mno mns mny moe mog mor mos mot mou mpr mpt mrl mrt msl mss mts mtt mui mun mur mut muu myi mzn nab nag naj nan nar nav nbd nbr ndt nep ngi ngj ngm ngz nha nhh nhn nht niv nkb noc nog nor nrg ntu nua oir oji oks olo one ong ord ork oss oya paa pae pan pdp pga pia pip plh plk pme pol por prk prs psh psm pso ptt ptw pur pwn qhu qim ras rem res rgc rit rny rom run rus rut rwe sal sav scr sdw seb sec ser sgb shd shk shl sho shp sht shy sid sil sin siu skp sla slb slo slp smn sna sno so sob som sor spa spi src srd sta stl sug suk sup swe taj tao tar tbu tel ten tep thk thn tic tig tir tiw tkl tlf tli tma tmc tml tnc tny tob ton tou tpt trb trm trr trw tsh tsz tts ttu tuc tul tun tur tuv tvo twn tzo uby udi udm ukr urd urk urn usr ute uyg uzb wak wal wao wap wau wbn wch wel wik wly wra wrd wrk wrl xas xoo yag yam yaq yar ycn yim yin yko ykt yok ypk ytu yuk yuw ywl zay zpr zqc zun,513,76475,0.0067080744
143A,Order of Negative Morpheme and Verb,,143,Matthew S. Dryer. 2013. Order of Negative Morpheme and Verb. In: Dryer; Matthew S. & Haspelmath; Martin (eds.) 2013. The World Atlas of Language Structures Online. Leipzig: Max Planck Institute for Evolutionary Anthropology. (Available online at https://wals.info/chapter/143),1,abi abn ace acg acm agc agd ain akh ala alb all als alw ams anj any apu arg arj aro asy ata awa aym baa bac bae bai baj bam bao baq bar bbw bch bco bdm bfg bho bil bkr blr bmz bni bnn bnu bra brf bri brp bsq btk bto bua bug bul bun buw bvi bwc cah cax cea cem cha chc chd che chk chq chx ckl cle cmn cmy cnt coc coo cos cpy cre crn crt cso cup cya dag dan dga dgb dgr dhw did din diy dja dji djm djn djp dmk dre dua dyi ebi ene eng eno est eud fij fin fon fut gaa gae gap gav gds gel geo ghr gir gmw goa gok goo grb grf grj grk grr grs gud guj guu hak han haw hay heb hei hil hin hlu hmo hoa hop htc huc hun hup hve iaa iba idn ifu ign ik imo ind inn iqu iri ita jak jaq jlu jng joh juh kad kae kan kch kdz ket kfe khm khn khr khs kir kkt kla klm kls klv kms kmu kmw knb knc kni knn koi kom kop kor kos krb krj ksa kse ksn ktc kty kum kuo kut kwa kwb kwn kws kya kyq kzy lac lah lal lan lao lar lgu lic lis lui luo mae mai maj mak mal mam man mao mau maw mbi mcd mch mco mde mdl mdm mer mgg mgi mhu mie mir mkg mkj mkl mlk mme mmn mna mnd mni mnm mno mns mnt mny moe mog mok mon mos mov mpa mpo mrd mrh mri mrl mro mrq mrr mrt mru mrw msq mss mun mur mus mut mwb mxc mxj mxo mxp myi nab nah naj nak nal nar nav nax nbr nca ncm ndj ndo ndr ndy neh nev nez nga ngd ngi ngj ngk ngu ngw nha nhh nhm nht nia nif niu nkk nne nsg nti ntu nue nug nun nyi nyk nyn nyr nyu oir oji oks omi ono ood oss otm pai pal pan par pba pip pkn plg pnn pno pnu poh pol por ppi pul pun pur qim qui qum raw res rik rom rov rpa ruk rus rwa sam sap scr sed see ses shl shp shu sid sil sir sis skw slb slo sml sna sng snn sno so sob som son spa squ src srd sre ssa sta sti stl sud sue sun svs taf tag tah tak tam tau taw tbo tbx tce tee ten tep tes tgh tgk tgo tha tho thy tim tin tiw tke tkl tla tli tmm tmr tng tnn tno tny tol tou tpa tpn tri trr tsg tsn ttn ttu tuk tus tvl twe tzo tzu udh ukr uli una ung urd url uru usa vai vie wag wah wak wal wam war wed wel wem wic wik wlm wlw wmu wol wor wrb wrd wrg wrl wsk xam xar xbi xns yag yap yaq yei yi yid yin yiw ylm yng yok yor yuc yur yuw ywl ywr zai zar zqo zqs zzo,525,76475,0.0068649887
26A,Prefixing vs. Suffixing in Inflectional Morphology,,26,Matthew S. Dryer. 2013. Prefixing vs. Suffixing in Inflectional Morphology. In: Dryer; Matthew S. & Haspelmath; Martin (eds.) 2013. The World Atlas of Language Structures Online. Leipzig: Max Planck Institute for Evolutionary Anthropology. (Available online at https://wals.info/chapter/26),2,aar abi abn acu adn agc agt ala alb ale alw aly amc ame amn amp ams ana ang apt arc arm arw asm ass ath ava awa awe awp aym aze azi baa bam bco bho bii bio bkb bkr bln blr blt bmb bmr bnj bnr bnu bod brh bri brm brn brs bsk bul bun but bya cas cax cay cbo chc chv cmh cmn cmy coc cos cpy crn crp ctm cub dag dds des deu dgr dhr dhw did dig dim diy dja dji djm djn djp djr dlm dmk dms dni dom doy dsh dut dyi eip emb ene eng epe est eve evn fas fin for fre gah gal gar gbb ger gim gln gon grb grk grr grw gud gug guu hai hal hay hin hmi ho hop hpd hum hun hzb ice ik ind ing inn irq irx ita ite jaq jeb jiv jms jpn kac kar kay kbu kem ken ker kew kgz kha khg khi khl kho kkp kku klm kmb kmk kmn kmo kms knc knd kni knk knn knr kob kok kol kop kor koy krc krj krn krw kta kty kuv kwo kws kwt kwz kya kyk laa lac lad lel lez lho lim lit lmg lmn lui mac mai maj map mbr mby mde mdm mee mgg mgu mhi mik mis miy mkh mlg mme mnc mnd mne mno mns mny moe mog moo mot mpt mrt mrw msg msl mss mts mtu mun mut nab nag naj nar nas nbd nca ndt nep new nga ngi ngj ngt ngw ngz nha nis nmb noc nog noo nor nsn ntu nue nyi omi orh ork oss oya paa pae pan paw pdp pkn plk pme pno pol por ppi prh prk psh pso ptw pum pur qaw qhu qim rem rit rom rum rus rwe sav scr sdw shi shk sho sia sid sin siu skp slo slp sna sno snt som spa squ srd sro sta stl sue suk svs swe syu tac tam tbu tel ter tgl thn tml tmo tny trb trm trr tru tsh ttu tuc tun tur tuv tvo twe udi udm uhi ukr una urd urn ute uyg uzb wah wak wam wao wap wat wau wbn wel wem wik win wiy wly wmu wrb wrg wrl wsk yag yal yaq yar yid yin yko ykt yng yok ypk ytu yuk yuw ywl zay,406,76475,0.0053089247
144B,Position of negative words relative to beginning and end of clause and with respect to adjacency to verb,,144,Matthew S. Dryer. 2013. Position of Negative Morpheme With Respect to Subject; Object; and Verb. In: Dryer; Matthew S. & Haspelmath; Martin (eds.) 2013. The World Atlas of Language Structures Online. Leipzig: Max Planck Institute for Evolutionary Anthropology. (Available online at https://wals.info/chapter/144),1,bac bnu coc cpy cui djn djp gav grj gud hai inn iqu kio klm lui maj mao mku mno mny mrq mrw nad ndj nez ngi ngw nue pkn pno res ten tes tmn trr wam wic wlw yuk yuw zpr zun,44,76475,0.0005753514
