parameter_id,parameter_name,parameter_description,chapter_id,chapter_citation,value,same_value_language_ids,value_language_count,language_count_total,count_ratio
144A,Position of Negative Word With Respect to Subject; Object; and Verb,,144,Matthew S. Dryer. 2013. Position of Negative Morpheme With Respect to Subject; Object; and Verb. In: Dryer; Matthew S. & Haspelmath; Martin (eds.) 2013. The World Atlas of Language Structures Online. Leipzig: Max Planck Institute for Evolutionary Anthropology. (Available online at https://wals.info/chapter/144),20,aar abk adi agb akn aly amp amt ang apl apt arc arq ass ath awt aze azi bbl bej ber bia bio biu bku blz boa brl brn bsh bsk bti bur but bya can car cas cay cba ccm cct cde cga chg chh chn chv cic cln coa cpl cpn ctm cub cyv cze dds des deu dhm dig dim dio dmi dms drm dul egn eko emb epe err fua ga gah gal gar gim gjj gku gln god gon grw gur gyc ham har heh hid hmi hnd hol hpd hua hui hum hya hzb idu ika ila irq irx jiv jms jpn kab kac kas kba kbo kby kdw kem kew kga kgy kha khd khl kik kil kin kkp klg kll kmh kmn kmo kmp kmr knd knm knr knw knz koa kob kok koy krd krh kri kta kun kus kuv kwz lad lat ldo leb leg let lez lgi lit llm lmp lot luc mag map mcv mee mei mii mik mis mkd mke mki mkz mlg mmv mnc mne mot mpt mrs msc msg msl mts mua mui mwe mym mzc nam nan nbd ndb ndt nep new ngn ngt nis nkn nko nku nmb nmm noc noo nsn ntj nto nwd obg obo ocu omh ori ork oya pae pga pia pme pms png pre prh prk prs psh psw ptt ptw pum rao ras rem ret rgc rim rny rru rum sak sar sdw sem ser sgu she shh shk shm shn sia sin skm smn snt sod srb sul swa syu taj tal tan tao tba tbu tbw tdr tel tet tgr thn tib tir tis tki tlo tlp tma tml tna tne tob tod ton toz tpt tsf tuc tul tun tur tuv tuy twn uby udi urn usr uyg uzb ven vnm wao wap was wau wbn wly wme wra wrn wtm xho yam yao yar ybi ygr yim yko ykt ytu zag zap zay zaz zul,333,76475,0.0043543642
143F,Postverbal Negative Morphemes,,143,Matthew S. Dryer. 2013. Order of Negative Morpheme and Verb. In: Dryer; Matthew S. & Haspelmath; Martin (eds.) 2013. The World Atlas of Language Structures Online. Leipzig: Max Planck Institute for Evolutionary Anthropology. (Available online at https://wals.info/chapter/143),2,aar abk aco acu adi aeg aly amb amc ame amh amn amp amr amx ana ang ao apl apt apw arc asu ath awe aze azi bel bio bln boa boi boj brh brn brr brs bsk bti but can car cas cay cbo cct cde chi chv cln cmh cml cnm coa cpn cqt crp ctm cub cui dds des deu dha dig dim dio dmi dms dom efi eko emb eme epe eve evn fua ful fur ga gah gal gar gim gln gnb god gon grw gug guh hai har hid hmi hpd hum hzb idu ika ina ing irq irx ite izi jeb jiv jms jpn kab kac kas kay kbo kem kha khg khl kio kiw kkp klg kll kma kmb kmn kmo kmr knd knm knr knw koa kob koe kok koy krh kri krk krw kry kta kun kus kuv kwo kwz kyz lad lec lep lez lho lim lng map mar mbl mdn mee mei men mga mhl mii mik mis mki mkz mlg mnc mne mom mot mpt mrs msc msg msl mts mui mwo mym mzc nbd ndb ndt nep ngl ngn nis nke nku nmb noc noo nph nsn ntj omh oro orw oya pae pau pec pia pkt pme prh prk psj psm pso ptw pum ram rao ret rit rum run sar sba sdw sem shh shk sia sin siu skm smn stn sub sug swt syu tan tao tar tba tbt tbu tel thu tig tir tlo tma tml tmn tnc tne ton tpt trm tsf tsh tte tuc tul tun tur tuv tuy uby urn ute uyg uzb vnm wai wao wap was wat wau way wbn wch win wiy wlf wly woi wra wrk wrn yam yar ykt ypk yqy yrm yrr yuk zag zay zch zpr zul zun,307,76475,0.004014384
84A,Order of Object; Oblique; and Verb,,84,Matthew S. Dryer (Orin D. Gensler). 2013. Order of Object; Oblique; and Verb. In: Dryer; Matthew S. & Haspelmath; Martin (eds.) 2013. The World Atlas of Language Structures Online. Leipzig: Max Planck Institute for Evolutionary Anthropology. (Available online at https://wals.info/chapter/84),5,apl bam bbw bri brp bus cde diy djp dum epe gmw isa kaa kma koa krr kse kya man maw mde mek mka mkg mpa naj nbr par slb sme srn sup sus svs tnn tpt ung vai wna wom xas yid yus,45,76475,0.0005884276
3A,Consonant-Vowel Ratio,,3,Ian Maddieson. 2013. Consonant-Vowel Ratio. In: Dryer; Matthew S. & Haspelmath; Martin (eds.) 2013. The World Atlas of Language Structures Online. Leipzig: Max Planck Institute for Evolutionary Anthropology. (Available online at https://wals.info/chapter/3),3,abi acm aik alb ald amc ame amz apu ata awn awp bag baj bam bbf bee bej ben bir bis bng bra brd bre bri brm bsk bto bua bul byu cam cha chq cil cle cso cti ctl ddf dgr din diz dnw don doy dre dyi eja eve evn ewe ewo fij ful ga gan gar gbb gds ghb gla gmb goa grk gua gwa hak hba hok hop htc hun hve hzb iaa iba igb igs ik ind irx iso ito jeh jiv jpn kad kas kch kef kek ker kew kgz khs kio kkv klv kly kmp knk knm knr koh kom koy kpe krd krk kry kse ksg ktk kty kur kwa kwo kws kya kzy lah lat lav lep llm lua lug lui luo luv mab map mau mba mei mlk mme mnc mnd mne mor mov mrd mrn mro mui mum mxc mxm mya myi mzc nai nar nax nbk ndt ndy nhn nht nko nkt nob nun oji ood orm otm pec phl pms prs psm puk rom san sba sha shk shs sin sml snd snh sor spa sre sup svs tab tag tam tib tic tks tok tol ton tru tso tug tuk tul tur twn umb ung uzn wah wch wic wlf wma wps wrd wry wuc yan yap yaq yaw yay ycn yct yes ygr yid yko ytu zan zun,234,76475,0.0030598235
50A,Asymmetrical Case-Marking,,50,Oliver A. Iggesen. 2013. Asymmetrical Case-Marking. In: Dryer; Matthew S. & Haspelmath; Martin (eds.) 2013. The World Atlas of Language Structures Online. Leipzig: Max Planck Institute for Evolutionary Anthropology. (Available online at https://wals.info/chapter/50),1,abi aco aeg ame arp asm bag bam bkr car cba cha cle cnl dio don dre ewe fij fre fua grb gua hau heb hmo iaa igb ind jak juh kfe khm khs kin klv kmb kmu kon kos krb kut kyl lan lav lkt luv mak mao mdr mnd mok mrd mxc nav ndy nht nko ond ots pal pms rap san sla snt swa tab tha tin tiw tuk tvl urk vie war wch wel yor zul,81,76475,0.0010591696
95A,Relationship between the Order of Object and Verb and the Order of Adposition and Noun Phrase,,95,Matthew S. Dryer. 2013. Relationship between the Order of Object and Verb and the Order of Adposition and Noun Phrase. In: Dryer; Matthew S. & Haspelmath; Martin (eds.) 2013. The World Atlas of Language Structures Online. Leipzig: Max Planck Institute for Evolutionary Anthropology. (Available online at https://wals.info/chapter/95),1,aar aba abk acn adg ady agm ain akh ala aly amb amc ame amp amt ana ang ao api apl apt arc arw asu atk ava awp awt aym baa bam bao baw bej bho bin bkb bln blt blx boa boj bok bon bri brm brs bry bsk bsq bti bua bur bus but bya bzi cah car cas cbo cct cde chc che chg chi chk chn chp chs chv cln cmn cmr cnl cti ctm ctw cub cup dag dan daw dds der des dgr dhm die dig dim dji dlm dmi dmk dms dni drg drm dul dun edo eip emb eme ene epe ese eud eve evn fas for fqs ful fur gam gan gap gar gav geo ghb gim gln gmw gon grw guj gur gyc hai ham han hay hhu hid hin hlp hma ho hop hpd hua hum hzb iau idn idu ika imo inn jbt jin jms jng joh jpn jug jva kaa kab kac kbo kbt kem ket kew kgy kha khd khl kho khr khw kie kim kiw kkp kkq kku kll klq klr kma kmb kmh kmk kmn kmo kms kmz knb knc knd kng knm knn knr knz koa kob kok kol kop kor krc krh krn kry ksa kse kti kty kum kun kus kuv kwb kwo kwt kxo kyk kyn kyr kyz lad lah lai lak lal lar lav lep lez lho lis lkt lmn lot lun mab mac mag mai man mar maw max mbo mde mdl mdn mei mek mey mgg mgh mgi mhi mik mis miz mka mke mkg mkj mkl mku mme mnc mnm mno mns mnv mom mpt mqf mrd mrh mri mru msg msn mtu mun muu myr nab nad nag nam nar nas nat nav nbd nbr ndj nep nev new ngg nis niv nnd nnk noc nph ntj ntu nwd nyi nze oks omi orh ork oro orw ory osa oss owi pae pan paw pdp pis pit pmn pra prh prk psh pso ptt ptw pun qaf qaw qhu qim ram raw rem res ret rik rum run rut ryu sar sav sdw sel sem ser shb she shh shi shk sid skk sko skw sla slb sme smn sna sng snh snm snt src srn sro sta stl sue sup sus svs syu tac tak tam tar tau tbl tbt tbu tce tel tgl thn thu tir tja tkl tkm tlf tli tls tml tmo tnc tny ton tou trb trw tsf tsz tte ttu tuc tul tun tur tuv tuy tvo tvt uby udh udm una ung urd urk urn usa ute vai wah wai wao was way wbn wme wna wra wsk wtm xas xns yah yal yaq yar yei yel ygr yi yim yko ykt ylm yqy ytu yuc zag zaz zun,472,76475,0.0061719515
103A,Third Person Zero of Verbal Person Marking,,103,Anna Siewierska. 2013. Third Person Zero of Verbal Person Marking. In: Dryer; Matthew S. & Haspelmath; Martin (eds.) 2013. The World Atlas of Language Structures Online. Leipzig: Max Planck Institute for Evolutionary Anthropology. (Available online at https://wals.info/chapter/103),2,abk acm aco ala alb ame amh ane anj apu ara arp au awp baa bag baw bej ber bkr bln bma brn bsq bur can cap car cav cax cba cbo cha chk cku cle cmn cnl cop cub dag dgr dio diz dni dum dut eka eng err eve ewe fij fre fua fur geo ger gmw grk grw ham hat hin hua hun ind iqu iri irq ita ket kew kfe khs kjo kkv klv kna knd knr kom kon kos kpm krb krk kws lak lav lel lrk luv mab map mau may mis miz mlk mna mne moa moh mrd mrl msl msn mss mun mxc nai nak nbd ndo nez ngi ngk nko nti nyu ond oss pal par plk pol prh qui ram ret rus sah sal slp sml snt spa sue swa syu tab tap tau taw tid tin tir tiw tla tmr tna tri tru tsi tso tuk tun uma una ung ura usa wam war was wel wma wsk xok yag yim yko ypk yuc yur zan zqc zsq zul,181,76475,0.0023667866
119A,Nominal and Locational Predication,,119,Leon Stassen. 2013. Nominal and Locational Predication. In: Dryer; Matthew S. & Haspelmath; Martin (eds.) 2013. The World Atlas of Language Structures Online. Leipzig: Max Planck Institute for Evolutionary Anthropology. (Available online at https://wals.info/chapter/119),2,aeg ahu alb amh amp amr apl arc arm asm ava awp bab bej ben blc bln bre brs bul bur but car cbo ccp chc cil cze dag diy dua dut eka eng est eve evn fin fre geo god grk heb hin hun hup hzb ice juh kha kku knd kob kty kzy lat laz lda lit mac mbt mis mlt mme mns moe moj mrd myi nai nez ngi ngk ngl nht nko ntu orh pol prs pwn qcu qim ram ret rka rom rus scr shk shn skp smt snm sro swa swe tel tgr tli tml tur tvo ung usa uzb vot wau wic yag yav ygr yid ykt zaz zul,117,76475,0.0015299118
16A,Weight Factors in Weight-Sensitive Stress Systems,,16,Rob Goedemans; Harry van der Hulst. 2013. Weight Factors in Weight-Sensitive Stress Systems. In: Dryer; Matthew S. & Haspelmath; Martin (eds.) 2013. The World Atlas of Language Structures Online. Leipzig: Max Planck Institute for Evolutionary Anthropology. (Available online at https://wals.info/chapter/16),4,abe arh arl asy awd car cct ceb dsh eng goo gor grw hin hop klm klv koy krl ksh mac mcs mgd mss mwn nbd ndy nor ram swe tns tps yan yko,35,76475,0.0004576659
136B,M in First Person Singular,,136,Johanna Nichols; David A. Peterson. 2013. M-T Pronouns. In: Dryer; Matthew S. & Haspelmath; Martin (eds.) 2013. The World Atlas of Language Structures Online. Leipzig: Max Planck Institute for Evolutionary Anthropology. (Available online at https://wals.info/chapter/136),1,abk ace aco aeg ain ala ame amh amp ane apu arp asm atk awp awt ayw bej bel bma brk brm brs bsq bur cax cha chi cho cin cjo cku coo cre csh ctm cyv dag diy diz dji djp dni dum dyi fij fur git gku goo gua hai hat hau heb hmo hua hve imo ind ing jak jaq jiv jpn kay kew kho kio knd knr koa kob kor kot kri krk kro kse kut kyq lan lav lda lez lui maa mal map mar mau may mdk mei mis mlk mnd mne mrt mtp mun mxc myi nah nar nat nbr nca ngi ngl niv nmb nug ond ood orh ori pai pau pip pit pme prh pur qim qui ram rap sah sal shs sla smt snc snt squ sul tag tau tib tiw tja tkl tlf tli tmc tmr ton tpa tru tuk tun tzu uhi ung vie wap war was wch wem wic win wiy wrd wrn xok yag yaq yna yuc yuk yur ywl zqc zun,177,76475,0.002314482
144Y,The Position of Negative Morphemes in Object-Initial Languages,,144,Matthew S. Dryer. 2013. Position of Negative Morpheme With Respect to Subject; Object; and Verb. In: Dryer; Matthew S. & Haspelmath; Martin (eds.) 2013. The World Atlas of Language Structures Online. Leipzig: Max Planck Institute for Evolutionary Anthropology. (Available online at https://wals.info/chapter/144),4,cub tir urn,4,76475,0.000052304677
64A,Nominal and Verbal Conjunction,,64,Martin Haspelmath. 2013. Nominal and Verbal Conjunction. In: Dryer; Matthew S. & Haspelmath; Martin (eds.) 2013. The World Atlas of Language Structures Online. Leipzig: Max Planck Institute for Evolutionary Anthropology. (Available online at https://wals.info/chapter/64),3,amp ana apu goo jam knc myr nha qhu snm tiw wra yag yim,15,76475,0.00019614253
73A,The Optative,,73,Nina Dobrushina; Johan van der Auwera; Valentin Goussev. 2013. The Optative. In: Dryer; Matthew S. & Haspelmath; Martin (eds.) 2013. The World Atlas of Language Structures Online. Leipzig: Max Planck Institute for Evolutionary Anthropology. (Available online at https://wals.info/chapter/73),2,aco aeg ain ala alu ame amr ana apl apu arm arp asm aso awk awp bag bam baw bem bir bkr bma brh brm brs bsk bsq bul bur cah cak car ceb cha chk chr chv cmn coo cre csh dbd dgr dio dni dre dsh eng epe est evn ewe fij fin fre fur gar gbk ger goo grb grk grw guj gum gwa hai ham hau heb her hin hmo hun iaa ice ido igb ijo ika imo ind iqu iri irq jak jpn juh kas kay kaz ker ket kew kfe khk khm kho kim kin kio kis kiw kji klv kmk kmp kmu knd knr koa kob kok kon kor kpe krb krk krn kro kry kse kte kty ktz kut kwa kyl lah lan lat lav lep lin lkt lnd loz luo luv mab mac mai mak mal mam man mao map may mdk mgo mku mme mnd mnm mok mon mop mro mrt mss mxc myi mym nan nav nbd ndy new nez nga ngi ngl nht niu niv nko nma nor nti ntu nug nun obo ond ong orh oss otm pai pal pan pau pip pit pms pnn ppi prh prs psm pta pur qim ram rap rav rus sdh see sel shk shl shn shr shu sla slo sml snm snn snt som spa squ sue sup sus swa swe tab tbu tel tgr tha thk tiw tmi tms tru tsp tuk tun tur tuv txj tzu udh udm una urd urk usa vie wam war wch wra wrd wrk yag yaq yid yim yko ykt yor yur zul,271,76475,0.0035436417
107A,Passive Constructions,,107,Anna Siewierska. 2013. Passive Constructions. In: Dryer; Matthew S. & Haspelmath; Martin (eds.) 2013. The World Atlas of Language Structures Online. Leipzig: Max Planck Institute for Evolutionary Anthropology. (Available online at https://wals.info/chapter/107),1,aeg ain alb amh amu ana ani apu ara arm aym bar bej ber bln bma brr bsq bur car cha cle cmn cmx coo cop cor cri cub cyv dgr dio diz don doy dre dut eng eve fij fin fre fua fur geo ger grb grk grw hau heb hin hlu hmo hmr hmu hun ijo ind iri irq ita jak jpn kas kay kch ket kha kho kis kna knd knm knr koa kon kor kos krb krd krk kro kse kuk kut kws lat lep lim mab mac mal mao map mar mle mnd mrl mrt msl mss mun nad nai nav nbd nbr ndo nez nht nko noo ntu nuu oss pal par pau pip plk pny pol prs psj psm qim qui rus siu sla sml snm so spa squ sun swa tab tha tin tkl tna tpn tuk tur tzu udh vie wap war wel wik win wra yaq yuk yur zan zul zun,162,76475,0.0021183393
91A,Order of Degree Word and Adjective,,91,Matthew S. Dryer. 2013. Order of Degree Word and Adjective. In: Dryer; Matthew S. & Haspelmath; Martin (eds.) 2013. The World Atlas of Language Structures Online. Leipzig: Max Planck Institute for Evolutionary Anthropology. (Available online at https://wals.info/chapter/91),2,abu adi aeg agm akn ala amc ame amq amr ams anj apl asm au awe awt baw bbw bdw bfi bid bkl bmb bnn boq brn brp bry bsh bud car cct chs chw cld cmr cnm cro cso ctm dag dgb did die din djm dma dre ese fua fut gjj gln gmw goa hai hal hau haw hmo hnd hoa iaa isa jad jmo jms kau kbw kch kel kgr khm khn khs kkv kmz kng knr kob krb kre kri krr ksg kta kwo kwt lah lai lal lao len let lmp lon lug maa mac mad mao mau may mbe mee mgi mie min miz mku mlu mna mnm mon mpa mrg mxj mxo mxp nab nak nam nca ndo ngd ngm ngt ngz nia niu nkn nko nnc nnd nnk nun nuu obo olo oro pit pkn plg pnu pog pok ram rot sal san seb sed sim slp sng snm snt son sre srn sro sul syu tah tak tar taw tgk tha tib tid tim tja ttd ttn tun ung urk url wal wbn wlf wlo wol wor wra wsk xav yar ycn,192,76475,0.0025106245
49A,Number of Cases,,49,Oliver A. Iggesen. 2013. Number of Cases. In: Dryer; Matthew S. & Haspelmath; Martin (eds.) 2013. The World Atlas of Language Structures Online. Leipzig: Max Planck Institute for Evolutionary Anthropology. (Available online at https://wals.info/chapter/49),1,abi aco aeg ame arp asm bag bam bkr bul car cba cha cle cnl ctl dio don dre dut ewe fij fre frw fua grb gua hai hau heb hmo hve iaa igb ilo ind ita jak juh kfe khm khs kin klv kmb kmu kob kon kos krb kse kut kyl lan lav lkt luv mak mal mao mau mdr mnd mok mrd mxc nav ndy nht nko nti ond ots pai pal pms rap san sla snt spa swa tab tag tha tin tiw tsi tuk tvl una urk vie war wch wel yor zul zun,100,76475,0.0013076168
111A,Nonperiphrastic Causative Constructions,,111,Jae Jung Song. 2013. Nonperiphrastic Causative Constructions. In: Dryer; Matthew S. & Haspelmath; Martin (eds.) 2013. The World Atlas of Language Structures Online. Leipzig: Max Planck Institute for Evolutionary Anthropology. (Available online at https://wals.info/chapter/111),2,abi abk ace aeg ain aji aly ame amh ana apu arm aro asm atc awn awp aym bab baj bal bam bej bkr bla bma brh brr brs bsq bur but cah car cax cct ceb cha chk chv cld cle cmn coa coo cor cre cui dgr die dio diy doy dre eng epe eve fij fin fut gar geo ger grb grw gua guj guu hai hau haw heb hin hmi hun hzb iaa igb ika ila ind ing irq jak jaq jpn kam kas kay kdz kem ket kew kfe kgu kha khm khs kin kio kis kls kmk knd knm knr kol kon kor kos krb krk krn kut kwa lad lan lat lav lep let lez lim lmp luv maa mab mac mak mal mao map mau mei men mhi mna mnm mns mny mrl mrt mss mwb mxc mym nbd nca ndo neh nez ngi ngl nht niu niv nko nti ntu nug nym oji ond orh orw pai pal pan pau pip pkn pny ppi prh prs psh psm pso pul pwn qim rap ret rot ruk rus sam saw sel shn shp shu sla sml snh snm son sor squ srn sun sup swa swt tab tag tah tas tel tim tiw tli tml tmr tna tng tno ton tsi tsw tuk tur tus tvl tzo uhi uli una urk usa ute uzb wam wat wch wic wma wol wra wrl yag yap yaq yel yid yko ykt ynk ypk yus yuw zul zun,254,76475,0.0033213468
24A,Locus of Marking in Possessive Noun Phrases,,24,Johanna Nichols; Balthasar Bickel. 2013. Locus of Marking in Possessive Noun Phrases. In: Dryer; Matthew S. & Haspelmath; Martin (eds.) 2013. The World Atlas of Language Structures Online. Leipzig: Max Planck Institute for Evolutionary Anthropology. (Available online at https://wals.info/chapter/24),1,abk ace aco ain ane apu brr brs buu ccp cha cho cin cjo cku coo cre cyv dag dum fij gku gua hai hat hun hve iau jak ket kio kiu koa krk kut lan lav lkt map mar mis mrh nat niv nmb nsg nuu ond otm pau pip prs qui sah sla squ sup tgp tkl tlf tli tun usa war was wch wic wrn wsk xok yag yes yli yor yuc yur zun,78,76475,0.0010199412
125A,Purpose Clauses,,125,Sonia Cristofaro. 2013. Purpose Clauses. In: Dryer; Matthew S. & Haspelmath; Martin (eds.) 2013. The World Atlas of Language Structures Online. Leipzig: Max Planck Institute for Evolutionary Anthropology. (Available online at https://wals.info/chapter/125),3,abu ala awp baw bdc brs bsq bur cah djp dni emb epe err eve fre fua gim grb grk grw gum guu ham hau ho hun hzb igb ijo ika ing irq ita itz kas kch kew kha khs kio knd knr kob kro lan lav lez lim luv mao map mei mhi miy mok mrt myi mym nbd ngt niv nko noo npi nti nug orh pan per pit prs pur qhu ram rap res ret shk snm spa tag thk tja tml tsh tur tvl tzu ung ute vai wam wra wrd wrg yag yid yim yko zul,102,76475,0.0013337692
28A,Case Syncretism,,28,Matthew Baerman; Dunstan Brown. 2013. Case Syncretism. In: Dryer; Matthew S. & Haspelmath; Martin (eds.) 2013. The World Atlas of Language Structures Online. Leipzig: Max Planck Institute for Evolutionary Anthropology. (Available online at https://wals.info/chapter/28),1,abi abk aco aeg ain ala ame apu arp asm awp aym bag bam bej bkr bma bri brm brs car cha cle cnl coo cre cyv dag dio dni dre eka ewe fur goo grb gua hai ham heb hmo igb ind irq jak jpn juh ker kew kfe khm kho khs kio klv kmu knm knr kob kon kor krb krk kse kut kyl lan lav lkt luv mab mal mao map mau may mku mnd mrd mun mxc nav ndy nht nko nti otm pms prh prs psm qaw ram rap san sel shk sla snm snt squ sup swa tab tag tha tiw tli tsi tuk tun ung urk usa vie war wch wic yag yim yuc zul,123,76475,0.0016083687
109B,Other Roles of Applied Objects,,109,Maria Polinsky. 2013. Applicative Constructions. In: Dryer; Matthew S. & Haspelmath; Martin (eds.) 2013. The World Atlas of Language Structures Online. Leipzig: Max Planck Institute for Evolutionary Anthropology. (Available online at https://wals.info/chapter/109),5,aeg apu arc arm awp bag bma brh brm brs bsq chk cnl dag dji eng eve ewe fin fre gae ger god goo grk gua heb hin hmo hun hzb ice ing irq jpn kas kay ket kfe kgz kha khk khs kio klv koa kob kol kor lak lat lav lez mac mak mao map mau mnd mrl mrt mxc myi ndy ngi niv orh otm pan pmc pms prh prs qim ram rap rus san sla snm spa sue sup tha tml tsz tur tvl ukr uzb vie war wch wra wrd yaz yor ypk yur,100,76475,0.0013076168
89A,Order of Numeral and Noun,,89,Matthew S. Dryer. 2013. Order of Numeral and Noun. In: Dryer; Matthew S. & Haspelmath; Martin (eds.) 2013. The World Atlas of Language Structures Online. Leipzig: Max Planck Institute for Evolutionary Anthropology. (Available online at https://wals.info/chapter/89),1,ace aga agc agd ain ala alb als amh ami amk amr ams ani apu ara arc arg arm aro arp arq arw ata ath ava awa awp aym ayo aze bae baq bch bel bfg bho bii bil bkr bkt bla bln bma bre brf brs bsk bsq btk bul bur but bwc bya cak cam car cav cay ccm cde cha chc chd che chh chj chk chn chp chq chr chv ckl cld cle cln cmh cml cmn cmy cnt coc coo cop cor cpl cpn cpy crn crp cso ctl cub cuc cup cya cyv cze dam daw der dgr dhi dhm dom don dre drg drm dsh dut eme eng est eve fij fin fre gae gam gds gel geo ger gjj gku gla gnb goa god gok gon goo grf grk gua guj hak hal haw heb hil hin hlu hmi hmo hoa hop hpd htc hua hun hup hwr hzb iaa iba ice ifu ijo ind ing iqu iri ita ite iwa jak jaq jiv joh jpn kan kas kay kbt kdz ket kgu kgz kha khg khl kho khr khs kio kiw kkp kkt kku klm klr klv kma kmh knb knd knn kno kol kop kor koy kpm krb krc krd kre kri krk krn krz ktu kty kum kuo kut kuv kwa kwo kxo kya kyz kzy lac lat ldu lec lez lgu lic lim lit lmn lmp lui mac mag mai mam map mau mco mcv mds men mer mgg mhi mie min mis mmn mna mnd mng mns moh mpr mrc mrq mrt msq mss mto mun mus mxc mxj mxo mxp mxx mxy mym naj nas nav nca ndy neh nep nev nez ngw nhh nhm nhn nht niu nne nor nsg nti ntu nun nyu obg ocu oji ood ord ork oss otm pae pal pam pan pba pip pir pkn plk pmn pnn pno pnu pny pol ppc pra prs psh pso ptt pul pur pwn qaf qhu qim qui qum rap rem res ret rom rov rpa rsu ruk rus rut rwe saa sal sar scr sec sed see shb shi shk shp sid sin sir sis siu skp slo sml smp sna som son spa squ src srd sre sta stl sun svs swe taf tag taj tar tat tbo tee tel teo tep tgh tgk tgr thn tho thu tic tim tin tiw tkm tla tli tlp tls tml tni tnk tob tpn tpt tri tru trw tsf tsh tsi tsk tsz ttu tuc tul tur tuy tvl tvo twe tzu uby udi udm ukr uli urd urk urn usr ute uzb vaf vie wak was wch wel wic wlf wlo wly wme wol wrd wrk wrw xar yag yap yaq yay yei yin yko yng yny yok ytu yur zai zap zay zaz zch zen zhn zun zya zzo,479,76475,0.0062634847
