parameter_id,parameter_name,parameter_description,chapter_id,chapter_citation,value,same_value_language_ids,value_language_count,language_count_total,count_ratio
90A,Order of Relative Clause and Noun,,90,Matthew S. Dryer. 2013. Order of Relative Clause and Noun. In: Dryer; Matthew S. & Haspelmath; Martin (eds.) 2013. The World Atlas of Language Structures Online. Leipzig: Max Planck Institute for Evolutionary Anthropology. (Available online at https://wals.info/chapter/90),1,aar abi abo abu abv ace acg acl adi adz aeg agm ajg alb alk all aly ame aml amo amp amq amr ana anc ang anj anu any aoj apu apw arg arj aro arq arw asy awe baa bab bag baj baq bar bbl bbu bco bej ber bfg bfi bgr bid bii bik bio bir bka bkr bku blr bma bmb bni bob bok bre brf brh brn brp brs bsh bsr btk bto bud bug bul bum bus buu bvi bwc cah cak cav cax ccm cde ceb cem cha chj chp chq chr chw cic cld cle cmh cmn cmy cnm coo cop cor cpl crn cso ctl ctm cub cya cze dag dan day ddj deg des did din dio djm dni dom doy dre dsh duk dut dyi efi egn emb eme eng eno erk err est eud ewe ewo fij fin fon fre fri fua fur fut fye gae gap gbb gel geo ger ghb gmz gnb gnd gok grb grf grk grw gud gul gum gwa hal hat hau haw hdi heb hei hid hmo hna hnd hoa hol htc huc hui hup hve hwr hya iaa iau iba ice idn ifu igb ign igs ik ila ind iri irq isa ita izi jab jak jeb jmo juh juk kam kan kar kau kay kbl kbt kbw kch kel ken ker kfe kgr khl khm khs kik kir kis kje kkt klm klr klv klw kma kmj knc kni knk knm knr knz koe kos kpm kpw krb krd kre kri kro krr kse ksg ktc kte ktl kuo kwn kws kwz kyl kyo kyq lab lan lao lat lbu lda leg lel len let lew lgt lgu lit lmg lmh lmp lmu lnd lon lug lui luo luv maa mab mad maj mal mam mao mas mau maw may mbm mbr mby mco mcv mdg mdo mds mea mee meh men mga mgo mgq mgu min miy mkj mlg mlu mmb mmn mna mng mnm mno moa mof mok mos mot mou mpr mpu mrg mrl mro mrq msk msl msm mud mum mup mur mus mut mwo mxc mxe mxo mxp mxy myg myi myn naj nal nan nar nat nbd ncm ndo ndr ndt ndy neh ney nez ngl ngm ngo ngz nhh nhm nht nia nif niu nkn nko nku non noo nor nrg nua nue nug nun nup nza obg obo oji olo ood orh orw otm paa pai pal par pat pau pba per pga pip pkt plg plh pms pno pnx pod poh pol por pre prs psh psw ptt pul pur qum rag rap rny rom ron rot rov rsu run rus rwe sah sak sam san sdw sea sed see ses sgb sgu shb shn sht sio sir sis skr slb sle sml snh so sob som spa src srd sre sro sud sul sun swa swe swt tab taf tag tah tai taj tak tar tat taw tbo tbt tbu tce tee ten teo tep ter tes tgk tgn tha thy tid tim tin tiw tke tla tlp tls tmm tmr tna tne tng tnk tnn tno tny toz tpn tpt trb tri trm tsi tsk ttd ttn tun tvl txj tzu ukr uld uli ung url urt ute vaf vie vnm wah wak wal war wch wel wic wlf wlo wma wol xbi xho xoo yag yap yaq yor yuc yuk yul zag zai zch zhn zul zzo,579,76475,0.0075711017
120A,Zero Copula for Predicate Nominals,,120,Leon Stassen. 2013. Zero Copula for Predicate Nominals. In: Dryer; Matthew S. & Haspelmath; Martin (eds.) 2013. The World Atlas of Language Structures Online. Leipzig: Max Planck Institute for Evolutionary Anthropology. (Available online at https://wals.info/chapter/120),2,abm ace acl aeg agm ahu ame amp amr aro arp asm awt baa bag ben bgo bma bod brj brm brr bui car cbo chr cil cmh cnl cop cze dab diy diz dmi dua dyi eka epe eve evn fni for frd gjj gll goa gua gud gum guu heb hop hun ik imo ind irq iwa jab jeb kat kew kgu kha khm klv knd knm knr kob kta ktl kty kwa kzy lah lat lda len lit lon luo mac mao mau mbt mie mku mlk mlt mme mng mnm mns mok mou mrg myi nai nak nar nas ndi ngk ngl niu niv ntu ojs orh pau pit plh plr pol pop ptp qcu qim ram rem ret rot rti rus sal sam sed shk shl skp sng snh snm snt som sor sre sro sun tah tas tbu tel tgk tha tiw tla tml tmr tna tng tot tsh tug tuk tup uhi ung urk usa uzb vie wlo wol wrp wsk yag yaq ygr yid yur yuw,175,76475,0.0022883294
47A,Intensifiers and Reflexive Pronouns,,47,Ekkehard König; Peter Siemund (Stephan Töpper). 2013. Intensifiers and Reflexive Pronouns. In: Dryer; Matthew S. & Haspelmath; Martin (eds.) 2013. The World Atlas of Language Structures Online. Leipzig: Max Planck Institute for Evolutionary Anthropology. (Available online at https://wals.info/chapter/47),2,abk apu awp bkr bsq bul cmn cnl coo ctl cub dre ewe fij fre ger grk ice ita kch ket khs kin kio kmu knm koa krk kse ktt kut lat lit lkt luv mao map mau nav nbd nez ngi nht nti nug ond orh pau pol por prh ram rom rus shk shn som spa sup svk swa tag urk usa ven wam war wic yaq ydd yor zqc zul,74,76475,0.0009676365
86A,Order of Genitive and Noun,,86,Matthew S. Dryer. 2013. Order of Genitive and Noun. In: Dryer; Matthew S. & Haspelmath; Martin (eds.) 2013. The World Atlas of Language Structures Online. Leipzig: Max Planck Institute for Evolutionary Anthropology. (Available online at https://wals.info/chapter/86),1,aar aba abk abu abv acg acn aco acu adg adi adk adn adz aga agm ain akh akn ala all aln als amb amc ame amh amm amn amq amt amx ana ang ani ano anu ao api apl apt apu ara arc ari arm arw asm ass ath atk ava awa awi awp awt ayi aym ayo ayr aze baa bae bai bam baw bbw bdm bej bel bho bhu bii bik bil bin bio bkt bla bln blx bmb bnb bod bok bon bri brm brs bry bsk bsq bur bus but buu bya cah can car cas cav cax cay cbo cct cde chc che chg chh chi chk chn chs chv cln cmh cml cmn cmr cnl cnm cnt coa coc cpn cpy cro cti ctm ctw cub cup dag dan daw dds der des dga dgb dgr dha dhb dhi dhm die dig diy djn dlm dmi dni dom doy drg drm dsh dul dum dun dyi edo ega eip emb eme epe ese est eud eve ewe fas fin for fqs ful fur ga gam gan gap gar gav gds geo gjj gln gmw gnn god gon grb grj grr grw gua gur gwa gyc hai har hat hay hhu hid hin hma hmo ho hop hpd hua huc hui hum hun hup hzb iau idn ijo ika imo ina ing iqu irr irx iwa jab jaq jel jiv jms jng jpn juh jva kaa kab kae kas kay kbt kbw kby kch kem ket kew kfe kgu kgy kha khd khg khi khl kho khw kim kio kir kiw kje kkp kkq kku kkv kla klg kll klm klq klr klv kma kmb kmh kmk kmo kmp kms kmz knb knd kng kni knm knn kno knw knz koa kob kok kol kop kor koy kpe kpw kqq krc krk krn krw kry krz ksa kse ksg kta kti kty kum kuv kwo kwt kwz kxo kyl kyn kyr kyz kzy lab lad lah lai lal lat lav ldu lep let lez lgt lim lis lit llm lmn lng lot lug lui lul mac mag man map mar mau maw mba mbo mcc mco mde mdm mdn mea mei mek men mer mey mgg mhi mie mii mik mis miz mka mke mkg mkl mku mlm mme mnd mne mni mno mns mnv mny moh mom moo mor mos mot mpr mpt mrd mri mrr mru mrw msc msg msn mts mtu mun mut mxx mym myr nab nad nam nar nav nbd nbr ncm nep nev new ney nez ngi ngt nis niv nkn nku nma nnk noc nph nrg nsn nti ntj ntu nua nwd nyi oji oks omh omi ong ord ork oro ory osa oss owi pae pan pat pau pba pdp pia pir pis pit plh plk pme pmn pno pnu pnx pok ppc ppi pra prh psh pso ptt pul pum pun pwn qaf qaw qhu qia qim ral ram rao raw rem res ret rgc rum run rut rwe sah sar sav sdw sec sem ser sgb she shi shk sia sid sin sio skk sko skp sla slb sle slp sme smn sna sng snm sno snt sob sod src srn sro sta stl sud sue sug suk sup sus svs swe tab tac tak tam tar tau taw tba tbt tdi tel tgl tgn thk thn tho thu tib tid tir tis tiw tja tkl tkm tlf tli tlo tls tma tml tmo tnb tnc ton tou tpn tpt trb trr trt tru trw tsf tsh tsm tsz ttd tte ttn tts ttu tul tun tur tuv tvo twe tye uby udh udm uhi uli una urd urk urn usa usr ute uzb vai wah wai wak wao wap was wat way wbn wch wed wem wik win wiy wly wma wme wmu wna wog woi wom wra wrm wrw wsk wwa xam xas xav xer xoo yag yal yaq yar ybi ycn yei yel ygr yid yim yin yiw yko ykt yqy yrm ytu yuc yuk yur yus yyg zar zay zch zpr zqc zqs zun,685,76475,0.008957176
123A,Relativization on Obliques,,123,Bernard Comrie; Tania Kuteva. 2013. Relativization on Obliques. In: Dryer; Matthew S. & Haspelmath; Martin (eds.) 2013. The World Atlas of Language Structures Online. Leipzig: Max Planck Institute for Evolutionary Anthropology. (Available online at https://wals.info/chapter/123),2,ame bam cnl die epe goo hin ika lav lkt sla sup usa,14,76475,0.00018306637
143A,Order of Negative Morpheme and Verb,,143,Matthew S. Dryer. 2013. Order of Negative Morpheme and Verb. In: Dryer; Matthew S. & Haspelmath; Martin (eds.) 2013. The World Atlas of Language Structures Online. Leipzig: Max Planck Institute for Evolutionary Anthropology. (Available online at https://wals.info/chapter/143),4,aar acu adi aly amc amp ang apl apt arc ath awe aze azi bio bln boa boj brh brn brr brs bsk bti but can car cas cay cbo cct cde chv cln cnm coa cpn cqt crp ctm cub dds des deu dig dim dio dms efi emb epe fua ful ga gah gal gar gim gln god gon grw har hid hmi hpd hum hzb idu ika ing irq irx jeb jiv jms jpn kab kac kas kay kbo kem kha khl kkp kmn kmo kmr knd knm knr knw koa kob kok koy krh kri kta kun kus kuv kwz lec lez map mee mei mhl mii mik mis mki mlg mnc mne mot mpt mrs msc msg msl mts mui mym mzc nbd ndt nep ngl ngn nis nku nmb noc noo nsn ntj omh oya pae pec pia pme prh prk psj ptw rao ret rit rum sba sdw sem shh shk sia sin smn sug syu tan tao tba tbu tel tir tlo tma tml tne ton tpt tsf tuc tul tun tur tuv tuy urn uyg uzb wai wao wap was wau wbn wly wra yam yar ykt ypk yrm yrr zag zay,202,76475,0.0026413861
136A,M-T Pronouns,,136,Johanna Nichols; David A. Peterson. 2013. M-T Pronouns. In: Dryer; Matthew S. & Haspelmath; Martin (eds.) 2013. The World Atlas of Language Structures Online. Leipzig: Max Planck Institute for Evolutionary Anthropology. (Available online at https://wals.info/chapter/136),1,abk ace aco aeg ain ala ame amh amp ane apu arp asm atk awp awt ayw bag bej bel bma brk brm brr brs bsq bur cax cha chi cho cin cjo cku cnl coo cre csh ctm cyv dag die diy diz dji djp dni dum dyi eng fij fur gbb git gku goo gua hai hat hau heb hmo hua hve iau imo ind ing jak jaq jiv jpn juh kat kay ket kew kho kio kiw kmb knd knr koa kob kor kot kri krk kro kse kut lan lav lda lez lug lui luv maa mal map mar mau may mco mdk mei mis mlk mnd mne mot mrt mun mxc myi nah nar nat nbr nca ngi ngl niv nmb ntj nug nuu ond ood orh ori otm pai pau pip pme prh pur qim qui ram rap sah sal san shp shs sla snc snm snt squ sul sup swa tag tau tib tiw tkl tlf tli tmc tmr ton tpa tru tuk tun tzu uhi ung vie wao wap war was wch wem wic win wiy wra wrd wrn xok yag yaq yna yor yuc yuk yur ywl zqc zul zun,200,76475,0.0026152337
116A,Polar Questions,,116,Matthew S. Dryer. 2013. Polar Questions. In: Dryer; Matthew S. & Haspelmath; Martin (eds.) 2013. The World Atlas of Language Structures Online. Leipzig: Max Planck Institute for Evolutionary Anthropology. (Available online at https://wals.info/chapter/116),6,adz ala alk aml ano apl apu ara arg arm arw azi bae baf bdm bgz bii bik bil ble bsh bum cah cai chk cml cmy cpl ctl cup dha dio diy djm dlm eno erk fij geo ghb gmw gnb grj guj gum hay hmi hoa htc hya igb irr ita jak jmo kay kba kbl kch kik kis klv kma kmz knc kni kqq kun kuo kuu kws lab lan lbu lin lmh lon luo mac man mao mde meh mer mku mlg mna mnm mov mra mrl mrt mwo nab nad naj ndi ndj ndr ndy ngd ngk ngo ngz nha nht nif nnk nua ora orh osa paa pai par pip pms poh ppi psh psw rny rom rov ruk sah sar sea ses shl sid skw sml snm sud sul svs tab taf tai tar tbt tbw ten teo thy tid tir tke tob tps tsi tvl udh uli usa vnm war wem wma wol wrg wrn xbi yap yid yko yng yor zaz zch zzo,173,76475,0.0022621772
101A,Expression of Pronominal Subjects,,101,Matthew S. Dryer. 2013. Expression of Pronominal Subjects. In: Dryer; Matthew S. & Haspelmath; Martin (eds.) 2013. The World Atlas of Language Structures Online. Leipzig: Max Planck Institute for Evolutionary Anthropology. (Available online at https://wals.info/chapter/101),2,aar abk acg acl aco aeg aga ain aja ala alb all amh amq amr amx ane ang any aoj apl apu apw ara arg arm arp arq arw asm ass asy ath awa awp aym ayr bae bbl bbw bco bej bel bem bfg bgr big bii bik bin bio bir bku bln blx blz bma bnb bob bol bre brf brh brp brr brs bsh bsk bsq bsr bul bum bur cah cai cax cba cct cde che chh chi chk chx cic cld cle cln cmy coo crn cro ctl cub cyv cze dag dds des dhi die dig dim dio dlm dni dom efi eip eko emb eme ene err esm est ewe ewo fua fur ga gaa gah gds gjj gln gmw gmz goo grg grk grw gua gul gyc ham hat hay heh hlu hmi hnd hua hun hya ifu ige ik ika ila ina irq isa ita ite ito izi jab jam jmo kab kae kam kan kba kdw kew kfe kga kgr kgz kik kio kkv klv kma kmb kmh kmj kmp kms kmz knd knm kno knr koa kob koe kon krc krd kre krk krr krw ksa kty kwk kwn kwt kwz kyk lan lav lbu lda ldo leg len let lgi lil lim lin lit lkt llm lml luc lul luo luv luy maa mab mac maj map mar mau mbl mbo mbt mby mcc mcv mdn mea mee meh mir mkd mki mku mlu mme mmw mna mne mnm mns moe moh mou mpr mpt mpu mra mrl mro msc msl mss mtb mua myi mzh nab nag naj nan nav nbd ndb ndj nez nga ngo nhh nhm nhn nht nko nmb nnd nse nti ntu nua nue nug nwd nym nyn nyu obg obo ocu olo ond orh oro osa otm pai pan pau pga pkn pkt plh pms pog por pra pre prs pwn qim qum ram rem rim rny rru ruk run rut sak san sar scr ser sgb sgl sgu shm shu sid sio siu skm skp sla slb slo sml so sob spa squ srb src sro stn sul swa taj tar tau tbw ten tep tes tet tgh tgn tgr tiw tja tki tkl tkm tli tlo tmc tmr tna tnc tob ton toz tps trb trr tsk tsz tte tuk tun tur tus tuv tvo uby udm uld una ung ura urk urn usa usr uzb ven wai wal was way wic wiy wma wrd wrk wrm wrw wry wya yal yao yar yel ygr yim yko ypk yuc yur ywl zai zap zay zqc zul,437,76475,0.0057142857
21A,Exponence of Selected Inflectional Formatives,,21,Balthasar Bickel; Johanna Nichols. 2013. Exponence of Selected Inflectional Formatives. In: Dryer; Matthew S. & Haspelmath; Martin (eds.) 2013. The World Atlas of Language Structures Online. Leipzig: Max Planck Institute for Evolutionary Anthropology. (Available online at https://wals.info/chapter/21),5,abi abk aco aeg ala ame apu arp asm atk bag bbw brr cha cho cku cnl cyv dag dni eka eng fij fre grb gua hai hat hau heb hmo hve iau ind jak jel kch ket kio kis kiw koi krk kro lan lav lkt luv map mau may mrg mxc niv nmb ond otm prh san sla sup swa ter tha tiw tot vie war wch wrm yag yuc yur zul,75,76475,0.0009807127
83A,Order of Object and Verb,,83,Matthew S. Dryer. 2013. Order of Object and Verb. In: Dryer; Matthew S. & Haspelmath; Martin (eds.) 2013. The World Atlas of Language Structures Online. Leipzig: Max Planck Institute for Evolutionary Anthropology. (Available online at https://wals.info/chapter/83),1,aar aba abk abn abo abv acn acu adg ady aga agm agt ain akh ala ale aly amb amc ame amh amn amp amt amx ana ang ano ao api apl apt apw arc arw asm ass asu ath atk atm ava awa awi awp awt awy aym aze azi baa bam bao baw bbw bdm bdw bej bel ben bgm bgn bho bhu bin bio biu bkb bkt bln blt blx bnj bnu boa bod boj bok bon boq bri brl brm brp brs bry bsk bsq bsr bti bua bun bur bus but bya bzi cah can car cas cay cbo cct cde chb chc chd che chg chh chi chk chn chp chs chv cln cml cmn cmr cnl coa cpn cpy cro cti ctm ctw cub cui cup dag dan daw dds der des deu dgr dha dhb dhm die dig dim diy dja dji djp dlm dmi dmk dms dni drg drm dul dum dun dyi edo eip eka emb eme ene epe ese eud eve evn fas foe for fqs ful fur gah gal gam gan gap gar gav gds geo ghb ghr gim gln gmw god gog gon goo grw gug guh guj gur guu gyc hai ham han har hay hhu hid hin hlp hma hmi ho hop hpd hua hui hum hzb iat iau idn idu iha ijo ika imo inn irq irx isa isi ite iwm jad jbt jin jiv jms jng joh jpn jrw jug jva jwr kaa kab kac kae kbo kbt kbu kem ket kew kgu kgy kha khd khg khl kho khr khw kie kim kio kiw kkp kkq kku klg kll klq klr klw kma kmb kmh kmk kmn kmo kmp kmr kms kmz knb knc knd kng knm knn kno knr knw knz koa kob kok kol kop kor koy kqq krc krd krh krn krr krw kry krz ksa kse kta kti kty kum kun kus kuu kuv kwb kwo kwt kwz kxo kya kyk kyn kyp kyr kyz lad laf lah lai lak lal lar lav lep lez lho lim lis lkt lmn lot lun mab mac mag mai man mar maw max mbo mde mdl mdn mei mek mem mer mey mgg mgh mgi mhi mii mij mik mil mis miz mka mke mkg mkh mki mkj mkl mku mlk mme mnc mne mni mnm mno mns mnv mny mog mom mot mpa mpt mqf mrc mrd mrh mri mrr mrs mru msc msg msl msn mto mts mtu mui mun muu myi mym myr nab nad nag naj nam nar nas nat nav nbd nbr ndj nep nev new nga ngg ngi ngj ngn ngt nis niv nkb nku nma nmb nmd nmm nnd nnk noc nog nph nsn ntj ntu nus nwd nya nyi nyk nze oir oks omh omi ong ord orh ori ork oro orw ory osa oss owi oya pae pan par paw pba pdp pia pir pis pit pme pmn pno pra prh prk prs psh pso ptt ptw pun qaf qaw qhu qim ral ram rao ras raw rem res ret rgc ria rik rmb rpa rum run rut rwa ryu sar sav sdw sel sem ser shb she shh shi shk sho sia sid sil sin skk sko skp skr skw sla slb slg sme smn sna sng snh snm snn snt sod som spi srb src srn sro sta stl sue suk sup sus svs syu tac taj tak tam tao tar tau taw tba tbl tbt tbu tce tdi tdr tel tgl tgr thk thn thu thy tib tig tir tis tja tkl tkm tlf tli tlo tls tma tmc tmg tml tmo tnb tnc tni tnn tny tod ton tou tpt trb trr trw tsf tsh tsz tte ttu tuc tul tun tur tuv tuy tvl tvo tvt twe tye uby udh udi udm uhi una ung urd urk urn uru usa usr ute uyg uzb vaf vai wag wah wai wak wao wap was wau way wbn wed wic wlw wly wme wmu wn wna woi wom wra wsk wtm xas xer xns yah yal yam yaq yar ybi yei yel ygr yi yid yim yko ykt ylm yqy ytu yuc yuk yus yuw zag zay zaz zim zun,712,76475,0.0093102325
48A,Person Marking on Adpositions,,48,Dik Bakker. 2013. Person Marking on Adpositions. In: Dryer; Matthew S. & Haspelmath; Martin (eds.) 2013. The World Atlas of Language Structures Online. Leipzig: Max Planck Institute for Evolutionary Anthropology. (Available online at https://wals.info/chapter/48),3,aeg ain amh ane anj ara au aym bag ber bma bur can cbo cha cle cnl cop dni err eve ewe fin fur grw gua hau heb hmi hun ijo iqu iri kfe klv kna koa kos krd lan lkt lrk mab mac mal mby mrl mup mxc nbd niv nko noo nti ntu pms prs ram ret sal sel sla so taw tgk tir tmr tpn tri uma ura urk usa was wel wrk yap yaw yes yim yuc zsq,83,76475,0.001085322
32A,Systems of Gender Assignment,,32,Greville G. Corbett. 2013. Systems of Gender Assignment. In: Dryer; Matthew S. & Haspelmath; Martin (eds.) 2013. The World Atlas of Language Structures Online. Leipzig: Max Planck Institute for Evolutionary Anthropology. (Available online at https://wals.info/chapter/32),2,abk ala arc bbw brs bur cax cle cre def diy diz dyi eng god grb hzb ket kfe khs kmu knd kol lak mac mau may mrd mun mxc myi nca ngg oji ond pau ppi prh psm ret snc tag tap tid tiw tml tun wam war wrd yaz zan,53,76475,0.00069303694
68A,The Perfect,,68,Östen Dahl; Viveka Velupillai. 2013. The Perfect. In: Dryer; Matthew S. & Haspelmath; Martin (eds.) 2013. The World Atlas of Language Structures Online. Leipzig: Max Planck Institute for Evolutionary Anthropology. (Available online at https://wals.info/chapter/68),4,abi aco aeg ain ala alw ana apu arp atc atu avo awp bag bma bnj brs cbo ceb cha chk cnl cre cuu cyn dag did dio dni ewe geo goo grw gua gug hal hau haw heb hmo hun hwc jak jpn juh kay ket kfc kio kji knk koa kor kse kut kya lan lav lkt mak mal map mar mau may mlt mnd mrt mxc myi nca ngi ngm nim niv ntu ond ono pnn por prh prs qco qim ren rom rus san shu snc snm som sue tag tga tig tiw tpi tug tuk tur war wch wic wly wor wra yag yaq yct yes yko zun,114,76475,0.0014906832
26A,Prefixing vs. Suffixing in Inflectional Morphology,,26,Matthew S. Dryer. 2013. Prefixing vs. Suffixing in Inflectional Morphology. In: Dryer; Matthew S. & Haspelmath; Martin (eds.) 2013. The World Atlas of Language Structures Online. Leipzig: Max Planck Institute for Evolutionary Anthropology. (Available online at https://wals.info/chapter/26),4,abk abv acg acl aco ain all aln anj ann any apl apu apw ara arq bac blx bma bsq btk bto bud cah car cba cct cde chg chh chq cnm coa cpl cre cup dio eme ewe ful gaa gbs gmw ham hui hve ifu ign ina iqu iri izi jab kab kio klw kma koa koe krb kre kri krk krr ktl kuo lag lan ldu luo mar mbt mcv meh men mer mga mna mpr msk mxj myi nam nan ndj ndo nev nez ngn nhh nht non nti nug ood pai pau per pip plh pwn ram res ruk run sal shl shu sio sob tak tar tep tic tir tli tlo tlp tne tob tot tpn tpt tri tsk tte twn txj tzo uby wag wch wlo wrd wrn ygr yim yuc yul zai zan zap zqc zqo zqs zzo,147,76475,0.0019221968
81A,Order of Subject; Object and Verb,,81,Matthew S. Dryer. 2013. Order of Subject; Object and Verb. In: Dryer; Matthew S. & Haspelmath; Martin (eds.) 2013. The World Atlas of Language Structures Online. Leipzig: Max Planck Institute for Evolutionary Anthropology. (Available online at https://wals.info/chapter/81),5,asu cub kkq myi par sel tir tvl ung urn,11,76475,0.00014383785
71A,The Prohibitive,,71,Johan van der Auwera; Ludo Lejeune (Valentin Goussev). 2013. The Prohibitive. In: Dryer; Matthew S. & Haspelmath; Martin (eds.) 2013. The World Atlas of Language Structures Online. Leipzig: Max Planck Institute for Evolutionary Anthropology. (Available online at https://wals.info/chapter/71),1,ago akn apa apl au ayr azi bag bfg bii brs brz bsk bsq bur cay cnl coo cze die dja djp don dsh dut eka eng err eve far fre fri ger gwa ham hat iaa ice ido igb jab kew kis klm kob kpe krc lat lew lit lkt lnd lng lug mad mai mar mgo mon mum ndg ndy ngt nht nor npn obo pal pec pit pol ppi prs pso rap rsu rus rwa san scr shk sko slo sno so swe tas tet tir ton tpn tri tsh ttu tur tvo txj udh ukr uma urk uzb wao wap wic wra wrl wrm yag yng ypk yrm,113,76475,0.0014776071
82A,Order of Subject and Verb,,82,Matthew S. Dryer. 2013. Order of Subject and Verb. In: Dryer; Matthew S. & Haspelmath; Martin (eds.) 2013. The World Atlas of Language Structures Online. Leipzig: Max Planck Institute for Evolutionary Anthropology. (Available online at https://wals.info/chapter/82),2,agc agd als ami amr ams anj ann asu ata baq bco bfg bkl bma bre bto cak cba ccm ceb cem cha chj chq chx ckl cle cmx cmy coe coo cor cos cpl cso cub cya cyv did dom esm fij gae gel gjj goa grf gto gud haw hdi hei hil hlu hoa htc hve iaa ifu ign ik ilo iri ixi jak kam kbl kdz kje kkt kls klv kmj kpm krb kri kro ktm kuo kut kyq lgu lil lmg maa maj mak mal mam mao map mch mcv mmn mna mnt mov mrl mrq msq mwb mxc mxj mxo mxp mxy mzc nan nca ndr ngr nhh nhm nia nif niu nnc nsg nuu oji ond ood otm pai pau pga pip pkt pnn pnx pod qui qum rap rov ruk sal sam seb see sel shp shu sim smp so squ tag tah tai tat tbo tee ten tep tes tho tim tir tke tlp tna tng tpn tps tri tsg tsi tsk tsr tuk tvl tzo urn war wec wel wem wlo wrb wth wya yag yap yok ywr zai zap zqc zqo zya zzo,194,76475,0.0025367767
79B,Suppletion in Imperatives and Hortatives,,79,Ljuba N. Veselinova. 2013. Suppletion According to Tense and Aspect. In: Dryer; Matthew S. & Haspelmath; Martin (eds.) 2013. The World Atlas of Language Structures Online. Leipzig: Max Planck Institute for Evolutionary Anthropology. (Available online at https://wals.info/chapter/79),5,abk abn ain ala ame ana apu arp asm awp aym bag ben blr brh brm brs bsq bur cah cha chk cle cmn cnl cnt cre cyv cze dag dio dni dut eng eve ewe fij fre fur gar ger goo grb grf grw hau heb hin hup hzb igb ika imo ind jpn kay ket kew kha khm kho khs kio klv knd koa kor kuo kut lad lan lat lav lkt mac mak mal mao map mar mau maw may mei mku mnd mok mra mrt mss mun mup myi nav ndy ngi niv nug oix ond pip pme pol prh prs psh psm qaw qim rap sam san sel ses shk sla slo sml snc snm snt sou squ sue sup svk swe tab tag tha tiw tna tpn tru tuk tur ukr usa ute vie war wic wly wra yag yaq yim yko yor ypk zul zun,153,76475,0.0020006539
7A,Glottalized Consonants,,7,Ian Maddieson. 2013. Glottalized Consonants. In: Dryer; Matthew S. & Haspelmath; Martin (eds.) 2013. The World Atlas of Language Structures Online. Leipzig: Max Planck Institute for Evolutionary Anthropology. (Available online at https://wals.info/chapter/7),1,abi abm ach acm adk adz aea aeg agh aik ain akn akw ala alb ald alw amc ame amo amp amu amz ana ant ao api apu arb arp asm ata awn awp aze bai baj bam baw bbf bee bej ben bir bis bki bkr bma bng bno bod brb brd bre brh bri brm brr brw bsk bsq bto bua bul bur byu cac cah cam car cax cay cck ccp cha che chk chv cil cle cmn cnl cnt cof cre cso ctl cub cve cyv dad dag dar der dgb dgr die din dio diy djp dni don dre dts dum dyi efi eja eka eng epe eve evn ewe ewo fas fef fij fin fre ful fur fuz ga gan gar gds ger ghb gla gmb goa goo grb grk grr grw gua hak ham haw hba hin hmo hok hop hum hun hve iaa iba igb ign igs ijo ika imo ind ird irr irx iso iva iwm jav jiv jng jom jpn jpr kal kas kay kch ked ket kew kfe kgu kgz kha kho khr khs kiw kkn kkv kla klv kly kmp knd kng knm knr koa kob koi kot koy kpa krb krd krk kry kse kty kun kur kwa kwo kws kya kyl kzy lad lah lan lat lav len lep lit llm lu lui luo luv mab mal mao map mar mau max may mbb mei mgg mie mku mla mlk mme mnc mnd mog mor mpa mrd mrn mro mrt mss mtp mui mun mxc mxm mya myi mzc nai nan nap nar nas nax nbk ndy nep new nga ngi nhn nht nim nis niv nko nkt nnc nob non nor ntu nug nyi oca oji ond ood orm otm pae pai paw pec pit pms pnr poa poh pol prh prs psh psm puk pur ram rap res rom ror rsc rtk ruk rus sab sba scs seb sha shi shk skp slp snc snd snh snm snt som sor spa srn sue sup svs swa tab tac tag tam tas tel tgk tha tib tic tiw tks tlp tmn tmp tne toa ton tpa try tsg ttn tug tul tun tur tuv umb una ung urk usa uzn wah wam wao wdo wiy wlf wma wmu wnt woi wra wrd wrs wry wuc yag yaq yar yaw yay ycn yel yes yid yim yko ykt yny yor ytu yus zan zqc,409,76475,0.005348153
29A,Syncretism in Verbal Person/Number Marking,,29,Matthew Baerman; Dunstan Brown. 2013. Syncretism in Verbal Person/Number Marking. In: Dryer; Matthew S. & Haspelmath; Martin (eds.) 2013. The World Atlas of Language Structures Online. Leipzig: Max Planck Institute for Evolutionary Anthropology. (Available online at https://wals.info/chapter/29),2,abi aeg ame awp aym bag bej bur car chk cle cnl cyv dag dio dni eka eng ewe fre ger ham heb hin ika iri irq ket kew kho kio knd knm kob kon krk lak lan lat lav luv mrd mrl nbd niv nko nti ntu nug orh snt spa sue swa tiw usa yim yko zul,60,76475,0.0007845701
