parameter_id,parameter_name,parameter_description,chapter_id,chapter_citation,value,same_value_language_ids,value_language_count,language_count_total,count_ratio
34A,Occurrence of Nominal Plurality,,34,Martin Haspelmath. 2013. Occurrence of Nominal Plurality. In: Dryer; Matthew S. & Haspelmath; Martin (eds.) 2013. The World Atlas of Language Structures Online. Leipzig: Max Planck Institute for Evolutionary Anthropology. (Available online at https://wals.info/chapter/34),2,aml ano bbw cha dgr gua hat jpn kat koa mar mnd myr ngl orh pmc sue udh yny,20,76475,0.00026152338
22A,Inflectional Synthesis of the Verb,,22,Balthasar Bickel; Johanna Nichols. 2013. Inflectional Synthesis of the Verb. In: Dryer; Matthew S. & Haspelmath; Martin (eds.) 2013. The World Atlas of Language Structures Online. Leipzig: Max Planck Institute for Evolutionary Anthropology. (Available online at https://wals.info/chapter/22),3,aco ain amp arp asm bej brr brs bsq chk cnl dig eka epe fre grk grw gua heb hun hve ind jak jpn kay khs kro kut lav mal mau mei mss mxc nan ngi nsg pai pip prs pso rus snm spa swa tib tiw war wra yaq zul,52,76475,0.00067996077
4A,Voicing in Plosives and Fricatives,,4,Ian Maddieson. 2013. Voicing in Plosives and Fricatives. In: Dryer; Matthew S. & Haspelmath; Martin (eds.) 2013. The World Atlas of Language Structures Online. Leipzig: Max Planck Institute for Evolutionary Anthropology. (Available online at https://wals.info/chapter/4),2,abm adk adz akn ala ame amh ani arp bag baj bej ben bkr bno brr brw bsq bto cad cam car cay cck cha cle coo cso cub cve cyv dag dar ddf der det din dio dts dum efi eja epe eve evn eya fur gan gar grb had hba hve iba ign igs ika irq irx ito iva jeh jng jpr kas kch ked kef ket khr khs kio kiw kkn kla klm klv knd knk knm koa koi kom kot koy kse ktk kul kun kur kwk kws kyl lan lav lua luo lus mak mei mie mla mnc mpa mrl mrn mro mtp mun mya nai nar ndt nep new nga nim nis nkt nob non nor ntu nyi ood pec prh pso pur qui ram res sab scs sdw sml snh snt som sor sre srn sue tab tac tag teh tel tgk tha tib tic tks tlp tma tmn tne tru try tsg tsi ttn tul tun tuv twn tza una usa wao wap win wlf wma woi wps xoo yan yap yaq yar yaw yay ygr yko yor ytu yuc,189,76475,0.0024713958
37A,Definite Articles,,37,Matthew S. Dryer. 2013. Definite Articles. In: Dryer; Matthew S. & Haspelmath; Martin (eds.) 2013. The World Atlas of Language Structures Online. Leipzig: Max Planck Institute for Evolutionary Anthropology. (Available online at https://wals.info/chapter/37),5,ace aco aln amb amc amn ana ang any apl apu au awp bar baw bfg bni bod brm bsi bsk bto bum cax cbo chc che chg chk chr chv cle cmr cnl coc cti cup cze dag dhr dlm dmi dni est eud eve evn fij fin gar gln gon grb grw gur hat hin hmi hzb iba ika imo ing irq isa ite jab jng kaa kad ket kew kha khg khs kio kis klv kma kmb kmh kmj kmk knc kor krn kro ksg kwn lai lal lao lbu lit lmn lug luv maa mac mbm mhi mik min miz mkj mlu mnm mns mra mro mru msn mun mwo mxc mxp nas ndb ndj ndo ndu ngd ngi ngl ngm nht non nsg nug nun orh orw pae pal pan pau pga pia plk pno pol prh psh pso pul qaf qim raw res ret rus sar scr shk sia sid sla sna sno src srn sro sti stn sul tab tac ten tes thy tiw tkl tna tsh ttu tuc tul tuv tvo tvt ukr uli urd urk war wbn wik wor xar yag yid yim yko yok yor ypk zul,198,76475,0.0025890814
20A,Fusion of Selected Inflectional Formatives,,20,Balthasar Bickel; Johanna Nichols. 2013. Fusion of Selected Inflectional Formatives. In: Dryer; Matthew S. & Haspelmath; Martin (eds.) 2013. The World Atlas of Language Structures Online. Leipzig: Max Planck Institute for Evolutionary Anthropology. (Available online at https://wals.info/chapter/20),1,abi abk aco ala ame amp ana apu arp asm atk awp aym bag bbw bel bnj brh brm brs bsq bur cah ccp chk cho cku cnl coo cyv dag dig dni eka eng epe eve fin fre gar geo ger grb grk grw gua hai hat hin hun hve hzb imo ing jak jpn kay ket kew kha kio kiw knd koa koi kor krk kro kut lav lez luv mal map mar mau may mei mot mrt mss mun mxc myi nah nav nbd ngi niv nmb ntu ond orh otm prh prs pso pur qim ram rus san shk sla snm spa squ swa tag tib tiw tli tot tur wem wic wrd wrm yag yaq yid yur zqc zul,125,76475,0.0016345211
44A,Gender Distinctions in Independent Personal Pronouns,,44,Anna Siewierska. 2013. Gender Distinctions in Independent Personal Pronouns. In: Dryer; Matthew S. & Haspelmath; Martin (eds.) 2013. The World Atlas of Language Structures Online. Leipzig: Max Planck Institute for Evolutionary Anthropology. (Available online at https://wals.info/chapter/44),2,alb arp au bab car cax dio dre fua god grb ham hlu hmu jpn juh kas kfe knd kon kws lat lav luv mau ndo nko noo plk pol prh qui sah sup swa tid tir wao war yuc zul,42,76475,0.00054919906
108A,Antipassive Constructions,,108,Maria Polinsky. 2013. Antipassive Constructions. In: Dryer; Matthew S. & Haspelmath; Martin (eds.) 2013. The World Atlas of Language Structures Online. Leipzig: Max Planck Institute for Evolutionary Anthropology. (Available online at https://wals.info/chapter/108),3,abk aeg ain ala ame apu arm arp asm awp bag bej bkr bma brh brm brs bur chh cic dag dji dni don eng epe eve ewe fij fin fre gae gdi geo ger grb grk gua hau heb hin hmo hun ice igb ika imo ind ing irq jpn juh kam kas kay ket kew kfe kgz kha khk kho khs klv knd knr koa kob kor krk kut lat lez lin lkt luv mac mak mal mao map mar mau may mei mnd mrl mrt mxc ndy ngi niv nko nug ond orh otm pan pau pmc pms prh prs psm qaf qim ram rap rus sam san shk sla snc spa sue sup swa tab tag tap tau tha tiw tml tuk tur tvl ukr una usa uzb vie wam war wch wic wra yag yaq yaz yim yor yur zul,146,76475,0.0019091206
42A,Pronominal and Adnominal Demonstratives,,42,Holger Diessel. 2013. Pronominal and Adnominal Demonstratives. In: Dryer; Matthew S. & Haspelmath; Martin (eds.) 2013. The World Atlas of Language Structures Online. Leipzig: Max Planck Institute for Evolutionary Anthropology. (Available online at https://wals.info/chapter/42),1,abk abn ace aco aeg afr ala aly ame amp ao apl apu arp bab brs bsq cha chk cmn cnl cnt cre cub cze djr don dre drg dyi egn eng eve ewo fij fin fut ger grk grw guu hau haw heb hmo hun imo ind inr iri ita kam kas kay ker kfe khs kio kis klm klv koa kob kos krg kro krr kse kut kwm lat lit lkt mac mak mal mao mar mau may mei mhi miy mlt mnd moj mrt msh mss nav nez ngi ngl nko nku nti nug nun ond orh pai pan pau pip pkn prh psm put qhu rap ret rus sam sla sml spa sup swa swe tag tiw tru tsh tuk tus tvl tzu urd uri urk ute wam wat wic wrd wrg wrk yag yim ynk yor yus,143,76475,0.0018698921
11A,Front Rounded Vowels,,11,Ian Maddieson. 2013. Front Rounded Vowels. In: Dryer; Matthew S. & Haspelmath; Martin (eds.) 2013. The World Atlas of Language Structures Online. Leipzig: Max Planck Institute for Evolutionary Anthropology. (Available online at https://wals.info/chapter/11),1,abi abk abm ach acm aco adk adz aea aeg agh aht ain aiz akn akw ala ald alw amc ame amh amo amp amu amz ana anc ani ant ao api apu arb arc arm arp asm ata ava awn awp aym bag bai baj bam baw bbf bco bee bej ben ber bet bir bis bki bkr bma bng bno bod bra brb brd brh bri brm brr brw bsq bto bua bul bur byu cac cad cah cam car cax cay cck ccp cha che chk chl chp chu chw cil cle cmn cnl cof coo cre cso cti ctl cub cve cyv dad dag dah dan dar ddf der det dgb die din dio diy diz djp dni dnw don doy dre dts dum dyi efi eka eng epe eve evn ewe ewo eya fas fef fij ful fur fye ga gan gar gbb gds geo ghb gla gmb goa goo grb grk grr grw gua gwa had hai hak ham hau haw hba hin hmo hmr hok htc hum hup hve hzb iba igb ign igs ijo ik ika imo ind ing ird irq irr irx iso ite ito iva iwm jak jaq jav jeb jeh jiv jng jom jpn jpr juh kab kad kal kas kay kch ked kef kek ker ket kew kfe kgu kha khm kho khr khs kio kiw kkn kkv kla klm klv kly kmp kmu knd kng knk knm knr koa kob koh koi kom kor kot koy kpa kpe krb krd krk kro kry kse ksg kss ktk kty kul kun kur kut kwa kwk kwo kws kya kyl kzy lad lah lak lam lan lat lav len lit lkk lkt llm lu lua lug lui luo lus luv maa mab mak mal mao map mar mau max may maz mba mbb mei mgg mie mku mla mne mog mor mov mpa mrd mrg mrl mrn mro mrt mss mtp mui mum mun mxc mxm mya myi mzc nai nan nap nar nas nav ndt ndy nep new nez ngi ngz nhn nht nim nis niv nko nkt nmb nnc nob non nti ntu nug nun nuu nyg nyi oca ogb oji ond ood orh orm otm pac pae pai pau paw pec phl pit pms pnr poa poh pol prh prs psh psm pso puk pur qaw qco qui ram rap res rom ror rsc rtk ruk rus rut sab san sba scs sdh sdw seb sed sha shi shk shs shu sin sla slp sml snc snd snh snm snt som soq sor spa squ sre srn sue sui sup svs swa tab tac tag tam tas teh tel ter tgk tgr tha tic tiw tks tli tma tmn tmp tne toa tok tol ton tru try tsg tsi tso ttn ttu tug tuk tul tun twn tza umb una ung urk usa uzn vie wah wam wao wap wch wdo wic win wiy wlf wma wmu wnt woi wps wra wrd wrs wry xoo yag yan yap yaq yar yaw yay ycn yct yel yes yey ygr yid yim yny yor yuc yul yur yus zan zqc zul zun,525,76475,0.0068649887
65A,Perfective/Imperfective Aspect,,65,Östen Dahl; Viveka Velupillai. 2013. Perfective/Imperfective Aspect. In: Dryer; Matthew S. & Haspelmath; Martin (eds.) 2013. The World Atlas of Language Structures Online. Leipzig: Max Planck Institute for Evolutionary Anthropology. (Available online at https://wals.info/chapter/65),1,abk aeg akn ala alw aly arm atu avo awp aze bag bej bma bng bnj brh bsq bul bur but cbo ceb cha chk cnt cpn cuu dni egn eve fre geo grb grf grk haw hin hwc imo jak juh ket kho kik kio kji knk knr kor kro kse lan lez mak mal mau mlt mnd mrg mwe mxc nak nbr ngm ond ood orh pan pnn por prh prs ren rom ruk rus ses shu sla snc spa sup tag tah tem tny toj tug tur uyg wic wly wor yag yaq yct ygr zqc zul,101,76475,0.0013206931
39A,Inclusive/Exclusive Distinction in Independent Pronouns,,39,Michael Cysouw. 2013. Inclusive/Exclusive Distinction in Independent Pronouns. In: Dryer; Matthew S. & Haspelmath; Martin (eds.) 2013. The World Atlas of Language Structures Online. Leipzig: Max Planck Institute for Evolutionary Anthropology. (Available online at https://wals.info/chapter/39),5,abk ain ana bkr bri brs car cha cle cmn coo cre cyv dio dre eve fij gar goo gua ind ing juh kay ker kho klv knm kro lad lav mal mao mau mku mnd mrt mss mun myi ngi niv nti nug oix pai pms psm rap snm sue tab tag tiw ung wam war wic wrd yag yuc zqc,63,76475,0.00082379865
70A,The Morphological Imperative,,70,Johan van der Auwera; Ludo Lejeune (Umarani Pappuswamy; Valentin Goussev). 2013. The Morphological Imperative. In: Dryer; Matthew S. & Haspelmath; Martin (eds.) 2013. The World Atlas of Language Structures Online. Leipzig: Max Planck Institute for Evolutionary Anthropology. (Available online at https://wals.info/chapter/70),1,abb abk acl aco acu adk aeg ala amh amr ana anl apl ard arg arm arp ars ath ava awp ayr azi bab bam bbw bdk bej bel bem ber bfg bma bre brh brz bsk bsq bud bul bur cah cak car cay ceb chj chv cld cle cmh cml cmn coi coo cor cre cyv cze dag dbd dgr die dig diz dmi dni dyi eka emb emc epe err est eve evn far fin fua fye gam gim glc gmz goj grk grw guj gum ham heb her hin hlu hmi hui igb ik iri irq jak jaq jeb kas ket kew khk kil kio kis kmk kmp kms knd knm knr koa kob kod koi krb krc krd krk kro krq kse kte kty kui kut kuv kwe kwr kws kyg lad lak lan lav laz lil lim lit lng lno loz luo luv mab mac mak mam man map mar mau mbg mcd mdn meh mgo mhu miy mle mlt mme mna mns moe mop mos mrd mrg mro msl mss mun mwe myi mym nan nap nbd nez nga nht niv nti ntn nub obo oix oka ood orh otm pan pau pip pms pol ppi prk psm pta pur qim qta ram ret rsu rus rwa scr sdw sgu shb shk shl shu slo sno snt so sou spa srd stn sue sug swa tag tas tau tbu tel tem ter tet tgr tir tiw tkl tml tms tna tnc tpn tsa tsh ttu tun tur tuv tvo tzo tzu udh udi ukr uld una uzb vai vot wap wau wch wel wic wlf wra wrd wrg wrk wwr yaq yim yko yng yny ypk yuk yur yus zaz zen zqc zqs zul,292,76475,0.0038182412
104A,Order of Person Markers on the Verb,,104,Anna Siewierska. 2013. Order of Person Markers on the Verb. In: Dryer; Matthew S. & Haspelmath; Martin (eds.) 2013. The World Atlas of Language Structures Online. Leipzig: Max Planck Institute for Evolutionary Anthropology. (Available online at https://wals.info/chapter/104),2,abi ace aeg ain ala amh amu ane apu ara arp au bag baw bej ber bln bma brr cax cba cbo chk cku cor cyv dio doy eka err ewe fij gmw grw ham ika kas ket kfe kjo kkv klv kom kon kos kpm krb krd ktl kut lan lrk luv map mby miz mku mlk mna moa mrd mrl msn nan ndo nez ngk nht nko nyu ond oss otm pal pip pms prh prs psj sah snt swa taw tuk uma ura wam war wch wic wrk yag zan zsq zul,96,76475,0.0012553122
25B,Zero Marking of A and P Arguments,,25,Johanna Nichols; Balthasar Bickel. 2013. Locus of Marking: Whole-language Typology. In: Dryer; Matthew S. & Haspelmath; Martin (eds.) 2013. The World Atlas of Language Structures Online. Leipzig: Max Planck Institute for Evolutionary Anthropology. (Available online at https://wals.info/chapter/25),2,abk ace aco aeg ain ala amb ame amp ane apu arp asm atk awp awt aym bag bbw bej bel bma brh bri brm brr brs bsq bur cha chk cho chy cin cjo cku cnl coo cre ctm cyv dag diy diz dji djp dni dum dyi eka eng epe eve fij fin fre fur geo ger gku gmz goo grb grk grr grw gua hat hau heb hin hua hun hve ice ik ika imo ing jak jiv jpn kay kch ket kew kha kho kim kio kkr kmb knd knm knp knr koa kob kor kri krk kro kui kut lai lan lav lez lkt lug luv mai mal mao map mar mau may mei mis mlk mnd mot mpa mrh mrt mss mun mxc myi nah nar nat nbd nca nep ngi niv nkk nmb nsg ntu nug nuu nyn ond orh ori otm pai pau pip prs pso pur qim qui ram rap rus sah san sdw shk siu sla sml snm spa squ sue swa syu tag tau tgp tib tiw tkl tlf tli tmc ton tru tsh tuk tun tur uhi ung usa wao war was wch wem wic win wra wrl wrn wry wsk xok yag yaq yes yim yko yli ynk yor ypk yuc yur zqc zul zun,219,76475,0.002863681
43A,Third Person Pronouns and Demonstratives,,43,D.N.S. Bhat. 2013. Third Person Pronouns and Demonstratives. In: Dryer; Matthew S. & Haspelmath; Martin (eds.) 2013. The World Atlas of Language Structures Online. Leipzig: Max Planck Institute for Evolutionary Anthropology. (Available online at https://wals.info/chapter/43),2,ale amb bsq but cax cld cmh cub cyv dig eng heb hin hzb kam kha khr khs kws lav mac mar mei mhi mss myi mym ngi nht pal pan pau pms ppi pso ram ret snh snt sup tab tid tja tsh tzu wam wrd yid yim yuk yur,52,76475,0.00067996077
100A,Alignment of Verbal Person Marking,,100,Anna Siewierska. 2013. Alignment of Verbal Person Marking. In: Dryer; Matthew S. & Haspelmath; Martin (eds.) 2013. The World Atlas of Language Structures Online. Leipzig: Max Planck Institute for Evolutionary Anthropology. (Available online at https://wals.info/chapter/100),6,ain atk bur chk cku cyv hlu kas miz nez ngi ngl pau psj sml tap tir tna trb tsi ung wam was yaw yel yim yuk,28,76475,0.00036613274
21B,Exponence of Tense-Aspect-Mood Inflection,,21,Balthasar Bickel; Johanna Nichols. 2013. Exponence of Selected Inflectional Formatives. In: Dryer; Matthew S. & Haspelmath; Martin (eds.) 2013. The World Atlas of Language Structures Online. Leipzig: Max Planck Institute for Evolutionary Anthropology. (Available online at https://wals.info/chapter/21),1,abi abk ala ame amp ana apu arp asm atk awp bbw bej bel bma bnj brm brs bsq bur chk cho cku cnl cre cyv dig dni eka eng epe eve fij fin gar ger goo grb grw gua hai hat hau hmo hun iau imo ind ing jak jel jpn kha kho khs kio kis knd knm koa kor krk kro kut lah lai lav lez lkt lug luv mal mao mar mau mei mnd mrg mrt mss mun mxc nah nan nbd ngi niv nmb ntu ond orh pai prh prs pur qim ram rap rus sla snm squ sup swa tag ter tha tli tot tru tur vie wch wem wic wra wrd wrm yag yaq yid yor yuc yur zqc zul,127,76475,0.0016606734
58A,Obligatory Possessive Inflection,,58,Balthasar Bickel; Johanna Nichols. 2013. Obligatory Possessive Inflection. In: Dryer; Matthew S. & Haspelmath; Martin (eds.) 2013. The World Atlas of Language Structures Online. Leipzig: Max Planck Institute for Evolutionary Anthropology. (Available online at https://wals.info/chapter/58),1,aco asm bel brs bur cax cho cin cjo cnl cre ctm die dni eka epe eve hai hat kho kiu koa koi krk kut lim mne nez oss pms pwn qui res sal tgp tiw tot tun tzu wap wch win,43,76475,0.00056227524
2A,Vowel Quality Inventories,,2,Ian Maddieson. 2013. Vowel Quality Inventories. In: Dryer; Matthew S. & Haspelmath; Martin (eds.) 2013. The World Atlas of Language Structures Online. Leipzig: Max Planck Institute for Evolutionary Anthropology. (Available online at https://wals.info/chapter/2),2,abi ach acm aco aeg aht aik ain ame ani ant ao apu arb arc arm asm ata ava baj baw bee bej ber bis bng bno bod brh bri bsq bto bua bul bur cac cam car cha che chk chp cil cle cmn cof coo cso cti cub cve dad dag dah dar ddf der det dgb die diz eka eve evn fas fij fur fye gar geo ghb gmb goa grk gua gwa had hak hau haw hba hin hmo hmr hok hop htc hum hve iba igs ind ing ird irq irx ite ito iwm jak jng jpn jpr juh kad kal kch ked kef kek ker kew kho khr khs kio kiw kkv klv kly kmp knd knk knm koi kot koy kpa krb krk kry kse kty kul kun kur kwa kwk kws lad lam lat lav len lez lit lkk lkt lui luv mak mao map mar mau max may mei mgg mku mlk mnc mnd mne mog mor mov mrd mss mui mum mun mxc mxm mya myi mzc nai nap nar nas ndy nep nez ngz nht nim niv nko nmb nob ntu nun oca ood orh orm paw pec pms pol prs psh psm pso pur qco rap res ror rsc rtk rus rut sba scs sdw seb sha shi shu sin sla slp snc soq sor spa sue svs swa tab tag tam tel ter tgk tgr tic toa tok tol ton tru try tso ttn ttu tuk twn tza umb ung urk usa uzn wah wao wap war wch win wiy wma wmu wra wrd wry xoo yag yan yaq yar yaw yay ycn yct yey ygr yko ytu yuc yur zqc zul zun,287,76475,0.0037528605
117A,Predicative Possession,,117,Leon Stassen. 2013. Predicative Possession. In: Dryer; Matthew S. & Haspelmath; Martin (eds.) 2013. The World Atlas of Language Structures Online. Leipzig: Max Planck Institute for Evolutionary Anthropology. (Available online at https://wals.info/chapter/117),4,acl ala ame apl bar bri car chk cil coo dag diy dua dyi eka gid gll goa hau kay knr lan lda lnd mbo mbt mga mmv mrg mtu mup mxp myi nav nbm ngl nko nue pau pit rot san sdw shn siu so som sup swa ter wsk yid yim yko zan zpi zqc zul,59,76475,0.00077149394
112A,Negative Morphemes,,112,Matthew S. Dryer. 2013. Negative Morphemes. In: Dryer; Matthew S. & Haspelmath; Martin (eds.) 2013. The World Atlas of Language Structures Online. Leipzig: Max Planck Institute for Evolutionary Anthropology. (Available online at https://wals.info/chapter/112),1,aar abk acu adi adz agb akn aly amc amp amt ang ao apl apt arc arq ass ath awe awt aze azi bbl bbu bej bel ber bgn bia bio biu bku bla bln blz boa boj bol brh brl brn brr brs bsh bsk bti bur but bya cam can car cas cay cba cbo ccm cct cde cga chg chh chi chn chv cic cln cmh cnm coa cop cpl cpn cqt crp ctm cub cyv cze dds des deu dhi dhm dig dim dio dmi dms drm dul efi emb eny epe err fua ful ga gah gal gar gim gjj gku gln god gon grw gur gyc ham har heh hid hmi hnd hol hpd hua hui hum hya hzb idu ika ila ina ing irq irx jeb jiv jms jpn kab kac kas kay kba kbo kby kdw kem kew kga kgr kgy kha khd khg khl kik kil kin kkp klg kll kma kmb kmh kmi kmn kmo kmp kmr knd knm knr knw knz koa kob kok koy krd krh kri kta kun kus kuv kwo kwz kyz lad lat lda ldo leb lec leg les let lez lgi lit llm lmp lot luc mab mag map mcv mee mei mhl mii mik mis mkd mke mki mlg mmv mmw mnc mne mot mpt mrs msc msg msl mts mua mug mui mwe mym mzc nam nan nbd nde ndt nep new ngl ngn ngt nis niv nkn nko nku nmb nmm noc noo nph nsn ntj nto nwd nyh nym obg obo ocu omh ori ork oya pae pec pga pia pme pms png pre prh prk prs psh psj psw ptt ptw pum pwn qia rao ras rem ret rgc rim rit rnd rny rru rum run sak sar sba sdw sem ser sgu she shh shk shm shn sia sin smn snt sod sor srb sug sul swa syu taj tal tan tao tar tba tbu tbw tdr tel tet tgr thn tib tir tis tki tlo tlp tma tml tna tne tob tod ton toz tpt tsf tts tuc tul tun tur tuv tuy twn uby udi urn usr uyg uzb ven wai wao wap was wau wbn wly wme woi wra wrn wtm xho yam yao yar ybi ygr yim yko ykt ypk yrm yrr ytu zag zap zay zaz zul,395,76475,0.0051650866
31A,Sex-based and Non-sex-based Gender Systems,,31,Greville G. Corbett. 2013. Sex-based and Non-sex-based Gender Systems. In: Dryer; Matthew S. & Haspelmath; Martin (eds.) 2013. The World Atlas of Language Structures Online. Leipzig: Max Planck Institute for Evolutionary Anthropology. (Available online at https://wals.info/chapter/31),3,bab cic cle cre dio fgu gdi grb juh kfe kis kon lin luv mac mun nca nko nyh nym oji psm shn sup swa wrd zul,28,76475,0.00036613274
108B,Productivity of the Antipassive Construction,,108,Maria Polinsky. 2013. Antipassive Constructions. In: Dryer; Matthew S. & Haspelmath; Martin (eds.) 2013. The World Atlas of Language Structures Online. Leipzig: Max Planck Institute for Evolutionary Anthropology. (Available online at https://wals.info/chapter/108),4,abk aeg ain ala ame apu arm arp asm awp bag bej bkr bma brh brm brs bur chh cic dag dji dni don eng epe eve ewe fij fin fre gae gdi geo ger grb grk gua hau heb hin hmo hun ice igb ika imo ind ing irq jpn juh kam kas kay ket kew kfe kgz kha khk kho khs klv knd knr koa kob kor krk kut lat lez lin lkt luv mac mak mal mao map mar mau may mei mnd mrl mrt mxc ndy ngi niv nko nug ond orh otm pan pau pmc pms prh prs psm qaf qim ram rap rus sam san shk sla snc spa sue sup swa tab tag tap tau tha tiw tml tuk tur tvl ukr una usa uzb vie wam war wch wic wra yag yaq yaz yim yor yur zul,146,76475,0.0019091206
124A,'Want' Complement Subjects,,124,Martin Haspelmath. 2013. 'Want' Complement Subjects. In: Dryer; Matthew S. & Haspelmath; Martin (eds.) 2013. The World Atlas of Language Structures Online. Leipzig: Max Planck Institute for Evolutionary Anthropology. (Available online at https://wals.info/chapter/124),1,ace ain akh aly amp ano ass bab bak baw ben biu boz brm bvi cha chn cic cmn cnl cnt cop dgr dha dhb dhi dre drg eng epe err fin fre gar gel ger guu heb hin hma hmo hoa hun hzb ik ika imo ind irq kam kan kao kas kem ker ket khm kho kmu knd kod kon kor krb kro kty kug kuk kya kyl lak lan lat lel lep lez lgu lil luv mad mao mbi mdr mei mhi mid mis mle mnd mno mos mrt mup ndb ngi nha niu nko nph nse pae pal pec pit pny ptt pul pur qhu qim ram rap raw ret rus san sap sed ser sno spa sue sun sup tag tau tha tib tid tru tur udm vie wam wlf wra yag yey yim yko ynk yor zul,144,76475,0.0018829682
51A,Position of Case Affixes,,51,Matthew S. Dryer. 2013. Position of Case Affixes. In: Dryer; Matthew S. & Haspelmath; Martin (eds.) 2013. The World Atlas of Language Structures Online. Leipzig: Max Planck Institute for Evolutionary Anthropology. (Available online at https://wals.info/chapter/51),9,abi abk abu abv ace acg acl adg adi aeg agc ain ajg akh akn aln amc ame aml amr anc ang anj anu any aoj api apl apt ara arg arp asm ata au bab bag bai bar baw bco bdu bgo bik bil bir bka bkl bkr bmb bnn bri brp bto bud bul bwc car cba cbo ccm cde cem chq chr chs cle cmy cnl cnm cnt crn cro cya dan day dio doy dre drm duk dum dut egn eng ese ewe ewo fij fri fut gaa gbb gbs git gln gmw gmz goe gok grb gua gud gul hal har hat hau haw hmo hna hoa htc hve iaa iba ind irq irr irx ita izi jak jin jmo jng juh juk kaa kar kbw kch kdz kel kfe khm kho khs kis kkt kkv kkw klq klv kmb kmj kmn kmu kmz kni knk kob koe kom kon kos krb krd kre kri krr kse ksg ktc ktl kuo kut kyl laf lah lai lal lan lao lar ldu lel len lep lew lgt lgu lis lkt llm lmg lmh lmp lnd lon lug luo mad mae mak mam man mao mau mbm mbt mcv mde mdg mds mea meh mek mga mgu mie min miy mka mkj mku mlg mlu mmn mna mnd mng mok mon mou mpr mrg mru msk mtu mum mun mup mwb mxc mxj mxo mxp nak nav nca ndy nev ngd ngz nht niu nko nmb noo nsg nti nua nun nup nwd nza nze obg obo olo ood oro osa paa pai pal pam paw per pga pip plh plk pms pnu poh pok por prs psw pum qum ram rap ras raw rot ruk rum run saa sah sam san sed ser sht sil sim sio sis sla slb sml snt sob som son spa src sti sul sun sup swe syu tab tac tah taj taw tbo tbu teo ter tgh tgk tgr tha tia tid tim tin tir tiw tla tmg tnc tng tnn tob tot trb tri tte ttn tuk tvl tzu uld uli una urd url urn urt vai vie wal war wch wel wlf wlo wma wog wol wsk xar xas xav yap yor yul zai zhn zzo,379,76475,0.004955868
67A,The Future Tense,,67,Östen Dahl; Viveka Velupillai. 2013. The Future Tense. In: Dryer; Matthew S. & Haspelmath; Martin (eds.) 2013. The World Atlas of Language Structures Online. Leipzig: Max Planck Institute for Evolutionary Anthropology. (Available online at https://wals.info/chapter/67),2,abi aco afr ain amh ana arm atc atu avo bag bar bej bma brh brm brs bul but ceb cha cnl cnt cre cuu did eng fij fin ger grk hau haw hmo hun hwc ice ind ise jak jav jpn juh ket kfc kha khm kho kik kmu kor kro kse kya lah lai lan lao lkt mak mal man mao may mei mlt mnd mtu myi nak nbr nca ood orh pai plg por prh prs qco rap raw ren rom rus san ses shu sml snm sun sup swe tah tga tgr tha tny toj tpi uyg vie war wlf wor wra yag yct yor zqc zun,112,76475,0.001464531
66A,The Past Tense,,66,Östen Dahl; Viveka Velupillai. 2013. The Past Tense. In: Dryer; Matthew S. & Haspelmath; Martin (eds.) 2013. The World Atlas of Language Structures Online. Leipzig: Max Planck Institute for Evolutionary Anthropology. (Available online at https://wals.info/chapter/66),2,ala ame asm blc bon brs but cnl coc cpl cyn dni grb ins kew kho kik koa lda luv mne mwe nbr nim ono ood ses sla snm sue sup tuc udm uyg wch yes zul,38,76475,0.0004968944
