parameter_id,parameter_name,parameter_description,chapter_id,chapter_citation,value,same_value_language_ids,value_language_count,language_count_total,count_ratio
128A,Utterance Complement Clauses,,128,Sonia Cristofaro. 2013. Utterance Complement Clauses. In: Dryer; Matthew S. & Haspelmath; Martin (eds.) 2013. The World Atlas of Language Structures Online. Leipzig: Max Planck Institute for Evolutionary Anthropology. (Available online at https://wals.info/chapter/128),1,abu ace aco ain akn ame any apu arp bdc bkr brh brs bsq bur cnl djp dre eng epe err fij geo gim goo grk gum heb hin hmo ho hun igb ika ind iri itz jak jpn juh kan kas kay kch kew kho khs kio kmj kmu knr kor lan lim lkt lnd may mei mhi miy mna mnd mxc myi mym nan nbd nbm ndy ngi ngt nht nko noo npi nug nun orb otm pan per pit pms prh prs qhu ram ret rus saw sla sml sup swa tab tag tpi tsh tuk tvl tzu ung urk ute vai vie war way wma wra yag yaq yor,114,76475,0.0014906832
58B,Number of Possessive Nouns,,58,Balthasar Bickel; Johanna Nichols. 2013. Obligatory Possessive Inflection. In: Dryer; Matthew S. & Haspelmath; Martin (eds.) 2013. The World Atlas of Language Structures Online. Leipzig: Max Planck Institute for Evolutionary Anthropology. (Available online at https://wals.info/chapter/58),1,abk aco aeg ain ala alw ame amh amp ane apu arm arp asm awp awt aym baa bag bej bel bma boa brh brk brm brr brs bsq bur buu bzi cax chi chk cho chy cin cnl cre ctm cyv dag die dig diy diz djp dni dre dum dyi eka eng epe eve ewe fin fre fua fur gbb geo ger gmz goo grb grk grr grw hai hat hau heb hin hmo hua hun hve iau ijo ik imo ind ing jak jpn juh kat kay kch ket kew kha kho khs kim kio kln knd knk knm knp knr knu koa kob koi kor krk kro kui kut kzy lan lav lda lez lim lkt lug luv maa mal mao map mar mau may mdk mei mlk mnd mne mot mpa mrg mrh mrt mss mto mxc myi nah nai nan nar nbd nca nez ngi nim nkk ntu nug nyn ond orh ori oss otm pai pau prh prs pso pwn qim qui ram rap res rus sah sal sam san siu sla snm snt spa squ sue sul sup swa syu tag tau taw ter tgp tha tht tib tiw tkl tlf tli ton tot tuk tun tur tuv uhi ung vie wap war wch wem wic win wra wrl wrn wrs wry wsk yag yaq yes yim yko yli yor yuc yur zqc zul,233,76475,0.0030467473
5A,Voicing and Gaps in Plosive Systems,,5,Ian Maddieson. 2013. Voicing and Gaps in Plosive Systems. In: Dryer; Matthew S. & Haspelmath; Martin (eds.) 2013. The World Atlas of Language Structures Online. Leipzig: Max Planck Institute for Evolutionary Anthropology. (Available online at https://wals.info/chapter/5),4,adk ana baw brw cad cil cub cyv eka ghb hve ign irx ito khs kla kws kyl lav lu mak nkt pso sui sup tac teh tha tne ttn win yaw yay,34,76475,0.00044458974
127A,Reason Clauses,,127,Sonia Cristofaro. 2013. Reason Clauses. In: Dryer; Matthew S. & Haspelmath; Martin (eds.) 2013. The World Atlas of Language Structures Online. Leipzig: Max Planck Institute for Evolutionary Anthropology. (Available online at https://wals.info/chapter/127),3,abk ala awp bdc brs die eve gim goo grw ham hlp hzb igb ijo irq knd lav mar mei mrt nbd ngi ngt niv pau pit qhu rap res ret snm tml tsh udh ute vai yag yko ypk zul,42,76475,0.00054919906
8A,Lateral Consonants,,8,Ian Maddieson. 2013. Lateral Consonants. In: Dryer; Matthew S. & Haspelmath; Martin (eds.) 2013. The World Atlas of Language Structures Online. Leipzig: Max Planck Institute for Evolutionary Anthropology. (Available online at https://wals.info/chapter/8),3,ach aik amu ant eka gan geo goa iaa jpr ket kew khm lit lug luv mrd nmb ood pai paw psh wra ycn yey ygr ykt zan,29,76475,0.00037920888
9A,The Velar Nasal,,9,Gregory D.S. Anderson. 2013. The Velar Nasal. In: Dryer; Matthew S. & Haspelmath; Martin (eds.) 2013. The World Atlas of Language Structures Online. Leipzig: Max Planck Institute for Evolutionary Anthropology. (Available online at https://wals.info/chapter/9),3,abi abk abm abz aco adk ady aeg agu aho aik ain ala alb aln ame amh amr amu amz ana apu ara arb arc arm arp asm awp axv aym aze bdk bej bez bgv bla blc bma bor brh bri brr brs bsq bth car cas cav ccp cct chc chh chi chl chm cht chv cmk cmn cmy coo cor cre crj cui cyv dag emb epe ess ets fre gag gap geo god grf grk gto gua guj guq hai hau hav heb hia hid hin hnk hpd hrs hun hzb ika imo ing iri ito ixi jak jbt jeb jib jpn jrn jva kab kew kfy khi kho khv kio kit klv knd koa krk krt krz ksh ksr kut kwo kws kwz lak lat lez lil lkt mak mam mar max may meh mkw mlt mma mos mov mui mxc mxt naa nam nav ndy nev nez ngz nhn nko nti oca ond orh orl osa oss otm pau pip prh prs psm pso qec qim qui rus rut san sba sel shk shw sla snm snt sod som soq spa squ sue swr tac tas tce tec teh tew til tin tli tlp tnd tps tru tsi tsz ttu tun tur twn uby udi umu usa wap war wch wic win wnb wra wrm xav yag yaq yki ykp ynm yor yrc yta yuc yur zso zun,235,76475,0.0030728995
143E,Preverbal Negative Morphemes,,143,Matthew S. Dryer. 2013. Order of Negative Morpheme and Verb. In: Dryer; Matthew S. & Haspelmath; Martin (eds.) 2013. The World Atlas of Language Structures Online. Leipzig: Max Planck Institute for Evolutionary Anthropology. (Available online at https://wals.info/chapter/143),4,aab aar aba abv acu adi agm aja alk aln aly amc amp amq anc ane ang ani anu apl apt ara arc asm ath ava awe aze azi bag bak bas baw ben bgr big bik bio bir bka ble bln boa boj brh brn brr brs bsk bti bud bum bus but bzi can car cas cay cbo cct cde chp chs chv chw cln cmr cnl cnm coa cpn cqt crp cti ctm cub dds des deu dgo die dig dim dio dms dni duk dum efi ega egn emb epe ese fua ful ga gah gal gar gbs gim giz gla gln gmz god goe gon grw gul gwo har hat hdi hid hma hmi hna hpd hum hzb iau idu ige igs ijo ika ing irq irr irx isa iwm jab jar jeb jiv jmo jms jpn juk kaa kab kac kar kas kau kay kbo kel kem ken ker kha khl kho kie kim kkp kkv kmn kmo kmr kmz knd kng knm knr knw koa kob kok kol koy kpw krc krh kri krn krr kta kti kun kus kuv kwz kxo kyl kyp kyr laa lab lag lai lav lec lel lew lez lgt lin lkt lmg lmh lmn lon lug mab mac mad map mas may mba mbm mbr mby mda mdg mdo mdw mea mee meh mei mek mgu mhi mhl mig mii mik mis miz mkh mki mlg mlu mmb mnc mne mor mot mou mpt mpu mrg mrs msc msg msl msm mtb mts mui myg mym mzc nas nbd nbm ndt nep ngl ngm ngn ngz nis niv nku nma nmb nnk noc noo nrg nsn ntj nua nup nza nze olo omh ong osa oya pae pat paw pec pia pit pme pod pog prh prk psj ptw qaw rao ret rit ron rsu rum sah san saw sba sdw sel sem sgb shb shh shi shk sht shy sia sin sio skk sla sme smn snm sro sug syu tab tan tao tba tbu tel tir tiv tlo tma tml tne ton tpr tpt trb tru tsf tsz tuc tul tun tur tuv tuy udm uld urk urn uyg uzb wai wao wap was wau wbn wec wly wma wna wom wra wrm xav yam yar ykt ypk yrm yrr yul zag zan zay,390,76475,0.005099706
122A,Relativization on Subjects,,122,Bernard Comrie; Tania Kuteva. 2013. Relativization on Subjects. In: Dryer; Matthew S. & Haspelmath; Martin (eds.) 2013. The World Atlas of Language Structures Online. Leipzig: Max Planck Institute for Evolutionary Anthropology. (Available online at https://wals.info/chapter/122),4,abk ace aeg ala any arp bag bar baw bkr blq bma bob brh brm brs bsq bur cha chk cle dag deg dgb diy dni eve ewa fij fur fye gae gdr giz grw gua hau heb hmo hzb ik imo ind ing iri jak jpn kam kay kch kfe kha khm kho kin kis kjr klv knd knm kob kor krc kro kse kul kxo lan lel lez lin luo luv maa mal mao map mau may mei miy mle mna mnd mrt mxc nan nbb nbd ndy ngi nug orh pai per pit pms prs psm qim rap san see so spa stn swa tag tes tha tuk tur ung ven vie war wic wrd wrn yaq ygr yim yko zul,125,76475,0.0016345211
78A,Coding of Evidentiality,,78,Ferdinand de Haan. 2013. Coding of Evidentiality. In: Dryer; Matthew S. & Haspelmath; Martin (eds.) 2013. The World Atlas of Language Structures Online. Leipzig: Max Planck Institute for Evolutionary Anthropology. (Available online at https://wals.info/chapter/78),2,abk abm acm aco adk aho ain akh akr alb amc amd amu apc apu arc arg asm aym bco bor cah ccm cco cct che chl chp cku cmn coc den est fas fox gar gny grf grw gso hid hlp hup jaq jmm jpn kay kew kio kje klh kmk knd kng koa kod kor ksh kto kwk kyl lat lez lit mak mam mar mdn mei mne mrt mss mtg mth mtl nep nev ngi nit niv nmi ntu nuu nwd omh ood pae pai pme pmn pno prh pso ptw pum pur put pwn qhu qim que qui ret rut she shk shu sin src srn srr tkl tml ton tpn trn tsi tun twe twn wao wic win wra wur yam yaq yko ypk zqc,131,76475,0.0017129781
79A,Suppletion According to Tense and Aspect,,79,Ljuba N. Veselinova. 2013. Suppletion According to Tense and Aspect. In: Dryer; Matthew S. & Haspelmath; Martin (eds.) 2013. The World Atlas of Language Structures Online. Leipzig: Max Planck Institute for Evolutionary Anthropology. (Available online at https://wals.info/chapter/79),1,abk ala awp brh bsq bul car cha dut eng ewe fur ger heb hun hzb kew kho knd knr kuo lat mac mau mcd mun orh pip sue swe tna tuk tur usa yim,36,76475,0.00047074206
53A,Ordinal Numerals,,53,Thomas Stolz; Ljuba N. Veselinova. 2013. Ordinal Numerals. In: Dryer; Matthew S. & Haspelmath; Martin (eds.) 2013. The World Atlas of Language Structures Online. Leipzig: Max Planck Institute for Evolutionary Anthropology. (Available online at https://wals.info/chapter/53),1,abn ain apu arp awp awt brs cle cnl cyv dmi goo ika imo kay kob koi lim mra mrd mrt mxc myi ngi nug snc tau tiw tru war wrd xoo,33,76475,0.00043151356
72A,Imperative-Hortative Systems,,72,Johan van der Auwera; Nina Dobrushina; Valentin Goussev. 2013. Imperative-Hortative Systems. In: Dryer; Matthew S. & Haspelmath; Martin (eds.) 2013. The World Atlas of Language Structures Online. Leipzig: Max Planck Institute for Evolutionary Anthropology. (Available online at https://wals.info/chapter/72),1,acu aea ala alb ame anl ark ath awn aym bkr brs bsk bul cak chk cor dag dbd dio dni est eve evn fin fua gam gbk gmz goo grk gua ham haw heb her hun hzb ing iri irq jak jaq jeb juh kha kho kil kim klm klv kmk knd knm koa kob kon krk krn kro krq kte kui kyl lak lep lgt loz lug luv mai mal mao mcd mdk mei mgo mhi mnm mok mrg mss mwe nan nca nep nez ngi nht niv noo nti ntu nub nug ond oss pal pnn prh psm rap rav ret rom shn sla sno snt swa tbu tem tnc tot tur tvo txj tzo tzu udh uzb vot wai win wlf yid yim yko ypk ysi zul zun,133,76475,0.0017391305
62A,Action Nominal Constructions,,62,Maria Koptjevskaja-Tamm. 2013. Action Nominal Constructions. In: Dryer; Matthew S. & Haspelmath; Martin (eds.) 2013. The World Atlas of Language Structures Online. Leipzig: Max Planck Institute for Evolutionary Anthropology. (Available online at https://wals.info/chapter/62),3,abk alb apl bul car crj dut fre geo ger grk ind kbl kji prs rus spa wai wel wyn,21,76475,0.00027459953
87A,Order of Adjective and Noun,,87,Matthew S. Dryer. 2013. Order of Adjective and Noun. In: Dryer; Matthew S. & Haspelmath; Martin (eds.) 2013. The World Atlas of Language Structures Online. Leipzig: Max Planck Institute for Evolutionary Anthropology. (Available online at https://wals.info/chapter/87),2,aab aar abk abn abo abu abv ace acg acl adg adi ady adz aeg agb agh agm agt ajg akh akn alb alk all aln aly ama amc ame aml amn amo amp amq amr ams amx ana anc ane ang anj ano anu any ao aoj api apl apt apu arg arj aro arq asm asy atm au awe awi awt awy ayi ayo ayw baa bab bae baf bag baj bam baq bar bas baw bbf bbl bch bdm bdu bdw bem ber bfg bfi bgm bid bik bin bir biu bkr bku ble bln blu blx blz bma bni bnk bnn bok bon bra bre brf bri brl brm brn brp brq bry bsh bsi bsq bsr bto bub bud buj bum bun bus buu bvi bwc cai cas cav cax cbo ccm cde cem cga chb chi chq chr chw cic cld cle cme cmr cnl cnm coc cop cor cpl crn cro crp cso cti ctl ctm ctw cui cup cya dag dan daw day ddj dds dga dgb dgo dha did dig dim din dio diy dji djn dma dms don doy dre dua duk dum dun dyi edo ega egn els emb eme emm eno epe erk err ese ewe ewo fas fij foe fon fre fua ful fur fut fye ga gaa gae gan gar gav gel ggu ghr gjj gku gla gln gmw gnd gnn goa goe goo grb grf grr grw gto gua gug guh gul guu guw gwa gyc hai hal ham har hat haw hdi heb heh hem hid hlp hma hmo hna hnd hoa hol hpd huc hup hwr hya iba idn ifm igb ige igs ik ika ila imo ina ind inn iqu iri irq irr irx isa ita jab jad jar jbt jel jin jlu jmo jms jng jrw juh juk jva kaa kae kam kar kau kba kbl kbo kbw kby kch kdz kel ker kfe kga kgr kgu kgy khd khm khs kie kik kin kir kis kje kkt kkv kll klq klv klw kma kmb kmi kmj kmn kmo kmp kmu kmw kmz knc kng knm kno knr knz koa kob koe kok kom kon kos kpe kpw kqq krb krd krh kri krk kro krr kse ksg ksn kta ktc kte ktl ktu kuo kuu kwa kwb kwm kwn kwy kwz kya kyk kyl kyn kyo kyz laa lab lad lag lal lan lao lar lav lbu lda ldo leb lel len lep les let lew lgi lgt lgu lic lin lis lkt llm lmb lmg lmh lml lmp lon lot lou luc lug lui luo luv luy maa mab mac mad mae mal man mao mar mas maw may mba mbe mbi mbl mbm mbo mbr mbt mby mda mde mdg mdl mdn mds mdw mea mee meh mek mey mga mgk mgo mgq mgu mhk mhl mie mii mij min mis miy miz mka mkd mke mkg mkj mku mkz mla mlg mlk mlm mlu mmb mmv mmw mna mng mnm mnv moa mof mok mon moo mor mot mou mpa mpo mpr mpt mpu mra mrg mrh mrl mro mrq mrr mrt mru msc msk msl msm msn mtb mts mtu mua mud mum mup mur mwe mwo mxa mxc mxe mxj mxo mxp mxy myi myn myr mzc nab naj nak nal nam nan nar nat nau nav nax nbd nbr ncm ndb nde ndi ndj ndo ndr ndt ndu neh ney ngd ngg ngj ngk ngl ngm ngn ngo ngt ngu ngz nhh nhm nht nia nif niu nkb nkk nkn nko nku nma nnc nnd nng nnk noc non noo nph nrg nse ntj nto nua nue nun nup nus nyh nyi nyk nym nze olo omh omi orh ori ork oro orw ory osa otr pae pai pam par pat pau per pga pia pir pit pkt plg plh plk pms png pnu pnx poh pok por ppi pre prh prs psw pul pum pun pur qia rag ral ram rao rap ras raw rga rgc rny rom rot rov rru rsu rum run rwa saa sah sak sam sap sdw sea seb sed sem sen ses sgb sgu she shi shl shm shn sht sia sil sim sio sis skk sko sku sla slb sle slp sme sml smn sng snm snn snt so sob som spa spi src srd sre srn sro sti sud sue sug sul sun sup swa syu tab taf tah taj tak tao tat tau taw tba tbl tbo tbt tbu tbw tdi tdr ten teo ter tes tgk tgn tgo tha thd thy tia tib tid tik tim tkl tlf tlp tma tmm tmn tmo tmr tna tnc tne tng tnk tnn tno tny ton toz tpr tps trb tri tsg tsk tsm ttd ttn tuk tum tun tvl uhi uld uli una ung ura urk url urn urt usa ute vaf vai ven vie vif vnm wag wah wal wap wat wbn wch wed wel wic wiy wlf wlo wma wmu wn wna wog woi wol wom wra wrd wrk wrl wrm wsk wth xam xas xbi xer xho xoo yag yal yam yao yap yay yel yi yid yiw yor yrm yuc yul zag zai zap zar zaz zul zun zya zzo,879,76475,0.011493952
40A,Inclusive/Exclusive Distinction in Verbal Inflection,,40,Michael Cysouw. 2013. Inclusive/Exclusive Distinction in Verbal Inflection. In: Dryer; Matthew S. & Haspelmath; Martin (eds.) 2013. The World Atlas of Language Structures Online. Leipzig: Max Planck Institute for Evolutionary Anthropology. (Available online at https://wals.info/chapter/40),5,ain coo cyv dio eve goo gua kio klv knm kro lav mau mku mss mun myi nug ond pms sue tab tiw ung war wrd yag yuc zqc,30,76475,0.00039228506
98A,Alignment of Case Marking of Full Noun Phrases,,98,Bernard Comrie. 2013. Alignment of Case Marking of Full Noun Phrases. In: Dryer; Matthew S. & Haspelmath; Martin (eds.) 2013. The World Atlas of Language Structures Online. Leipzig: Max Planck Institute for Evolutionary Anthropology. (Available online at https://wals.info/chapter/98),1,abi abk aco aeg ain ala ame apu arp asm bag bam bkr car cea cha cle cnl cyv dag dio eka eng ewe fij fre grb hai ham hau hmo ind iri jak juh ker ket kfe khm kio klv kmu kob kon krb krk kro kse kut kyl lan lav lkt luv map mau may mku mnd mrd mun mxc nav ndy nht niv nko nti nug otm pms prh psm ram rap san sla squ sup swa tab tag tha tiw tun ung usa vie war wch wic wra yag yim yor yur zul,98,76475,0.0012814646
52A,Comitatives and Instrumentals,,52,Thomas Stolz; Cornelia Stroh; Aina Urdze. 2013. Comitatives and Instrumentals. In: Dryer; Matthew S. & Haspelmath; Martin (eds.) 2013. The World Atlas of Language Structures Online. Leipzig: Max Planck Institute for Evolutionary Anthropology. (Available online at https://wals.info/chapter/52),2,abk acg aco aeg agt ain ala aly ame arg arm arp arr auy ava bag bah bis bla bma bnm bou brh bsq bur car cem chk cmh cmn cog com cor crg dah dam des dgr dmi dni dre dug efi ena eve evn fij fin fni gds gnn goa gol gon goo grj grw gua gum guu hin ho hua hui hup hve hzb imo ite jak jpn kam kat kay kha khm khr khs kin klv knd kng knm knr koa kob koi kor krk kro kry ktt kur kwe kwm kxo lad lah lak laz les lez lim lkt lug lui luo mah mao map maw mei mgg mjk mlt mmv mnc mnd mne moa mrd mrg mrt mrw msh mun mup myi myo nah nan nav ngi niv nkr nmi nob nti nwd nya orh ots pae pai pal per pia pol ppi prh psj pur qaw qch rap sam shn siu sla slb slp so som ssh swa syu tag tah tas tau tbs tbu tel tha tin tke tli tml tng toq tri trr tru tug tup txj uby udi uhi una urd urk usr vai ven wan way wch win wra wrg wrw wsk yaq yel yir yko ykt yor ypk yuk zch,213,76475,0.002785224
33A,Coding of Nominal Plurality,,33,Matthew S. Dryer. 2013. Coding of Nominal Plurality. In: Dryer; Matthew S. & Haspelmath; Martin (eds.) 2013. The World Atlas of Language Structures Online. Leipzig: Max Planck Institute for Evolutionary Anthropology. (Available online at https://wals.info/chapter/33),7,abv agc agd alk aml ana anc aoj api apl apt aro avk bai baw bgr bil bkl bnn brm bto bvi bwc cbo ccm cem cha cle cmr cnm coe dan day djp dre drm dul err ese fon fut gbb gel giz gln goe gok gua gul gur hal haw hoa iaa ika jak jmo jng kan kch khm khs kim kkt kre krr ksg kuo kwa kwo kyk lai len lep lew lkt lmu lnd lon lou mae mai mao map mau mbm mco mda mik mis miz mka mmn mof mon mru mum mup mus mwb mwo mxc mxo mxp mxy nak nal ndy nif nis niu nun nze osa pms psw qum rag rap raw saa sam sea sed shb shi sis skk sle snm sro sti tac tag tah tak tam tbo teo tgk tgn tin tla tmo tng tnk tno tru tsg ttd ttn tvl tzu uld ura urt vai vie vnm war wlo wme xar xbi yap yel yor yuc zai,170,76475,0.0022229487
143G,Minor morphological means of signaling negation,,143,Matthew S. Dryer. 2013. Order of Negative Morpheme and Verb. In: Dryer; Matthew S. & Haspelmath; Martin (eds.) 2013. The World Atlas of Language Structures Online. Leipzig: Max Planck Institute for Evolutionary Anthropology. (Available online at https://wals.info/chapter/143),4,aab aar aba abi abk abn abu abv ace acg acl acm aco acu adg adi adz aeg agb agc agd agh agm ain aja ajg akh akn ala alb alk all aln als alw aly amb amc ame amh aml amn amo amp amq amr ams amt amx ana anc ane ang ani anj ann anu any ao aoj apl apt apu apw ara arc arg arj arm aro arp arq arw asm ass asu asy ata ath au ava awa awe awp awt aym aze azi baa bab bac bae baf bag bai baj bak bam bao baq bar bas baw bbf bbl bbu bbw bch bco bdm bej bel ben ber bfg bgn bgo bgr bho bia bid big bii bik bil bio bir biu bka bkr bku bla bln blr blt blx blz bmb bmz bni bnn bnu boa bob bod boi boj bok bol bra bre brf brh bri brl brm brn brp brr brs bsh bsk bsq bti btk bto bua bud bug bul bum bun bur bus but buw buy bvi bwc bya bzi cah cai cak cam can car cas cax cay cba cbo ccm cct cde cea cem cga cha chb chc chd che chg chh chi chj chk chn chp chq chr chs chv chw chx cic ckl cle cln cmh cml cmn cmr cmy cnl cnm cnt coa coc coo cop cos cpl cpn cpy cqt cre crn crp crt cso cti ctl ctm cub cui cup cya cyv cze dag dan dds des deu dga dgb dgo dgr dha dhi dhm dhw did die dig dim din dio diy dja dji djm djn djp dma dmi dmk dms dni dom dre drm dsh dua duk dul dum dun dut dyi ebi efi ega eip eka eko emb eme ene eng eno eny epe erk err ese est eud eve evn ewe fij fin fon fre fua ful fur fut fye ga gaa gae gah gal gap gar gav gbb gbs gds gel geo ger ggu ghr gim gir giz gjj gku gla gln gmw gmz gnb goa god goe gok gon goo grb grf grj grk grr grs grw gua gud gug guh guj gul gur guu gwa gwo gyc hai hak hal ham han har hat hau haw hay hdi heb heh hei hid hil hin hlp hlu hma hmi hmo hna hnd hoa hol hop hpd htc hua huc hui hum hun hup hve hya hzb iaa iau iba ice idn ido idu ifm ifu ige ign igs ijo ik ika ila imo ina ind ing inn iqu iri irq irr irx isa ita ite iwm izi jab jak jaq jar jeb jiv jlu jmo jms jng joh jpn juh juk kaa kab kac kad kae kan kar kas kau kay kba kbl kbo kbw kby kch kdw kdz kel kem ken ker ket kew kfe kga kgr kgy kha khd khg khl khm khn kho khr khs kie kik kil kim kin kio kir kiw kkp kkt kkv kla klg kll klm kls klv klw kma kmb kmh kmi kmj kmk kmn kmo kmp kmr kms kmu kmw kmz knb knc knd kng kni knk knm knn knr knw knz koa kob koe koi kok kol kom kon kop kor kos koy kpw krb krc krd kre krh kri krj krk krn kro krr krw kry ksa kse ksg ksn kta ktc kti ktl kty kum kun kuo kus kut kuv kwa kwb kwn kwo kws kwt kwy kwz kxo kya kyl kyp kyq kyr kyz kzy laa lab lac lad lag lah lai lal lan lao lar lat lav lbu lda ldo ldu leb lec leg lel len lep les let lew lez lgi lgt lgu lho lic lim lin lis lit lkt llm lmg lmh lmn lmp lmu lnd lng lon lot lou luc lug lui luo luv ma maa mab mac mad mae mag mai maj mak mal mam man mao map mar mas mau maw may mba mbe mbi mbl mbm mbr mbt mby mcd mch mco mcv mda mde mdg mdl mdm mdn mdo mdw mea mee meh mei mek men mer mga mgg mgi mgk mgu mhi mhl mhu mie mig mii mik min mir mis miy miz mka mkd mke mkg mkh mki mkj mkl mku mkz mlg mlk mlu mmb mme mmn mmv mmw mna mnc mnd mne mni mnm mno mns mnt mny moe mog moh mok mom mon moo mor mos mot mou mov mpa mpo mpt mpu mra mrd mrg mrh mri mrl mro mrq mrr mrs mrt mru mrw msc msg msk msl msm msn msq mss mtb mts mtu mua mug mui mum mun mup mur mus mut mwb mwe mwo mxc mxe mxj mxo mxp mxx myg myi mym mzc nab nad nag nah naj nak nal nam nan nar nas nav nax nbd nbm nbr nca ncm ndb nde ndj ndo ndr ndt ndu ndy neh nep nev new nez nga ngd ngi ngj ngk ngl ngm ngn ngo ngt ngu ngw ngz nha nhh nhm nht nia nif nis niu niv nke nkk nkn nko nku nma nmb nmm nne nnk noc non noo nor nph nrg nse nsg nsn nti ntj nto ntu nua nue nug nun nup nyh nyi nyk nym nyn nyr nyu nza nze obg obo ocu oir oji oks olo omh omi ond one ong ono ood ori ork oro orw osa oss otm otr oya paa pae pai pal pan par pat pau paw pba pec per pga pia pip pis pit pkn pkt plg plh pme pms png pnn pno pnu pod pog poh pol por ppi pra pre prh prk prs psh psj psm pso psw ptt ptw pul pum pun pur pwn qaw qhu qia qim qui qum rag ram rao rap ras raw rem res ret rgc rik rim rit rnd rny rom ron rot rov rpa rru rsu ruk rum run rus rwa rwe sah sak sal sam san sap sar saw sba scr sdw sed see sel sem ser ses sgb sgl sgu shb she shh shi shk shl shm shn shp sht shu shy sia sid sil sin sio sir sis siu skk skm skw sla slb slo sme sml smn sna sng snm snn sno snt so sob sod som son sor spa squ srb src srd sre sro ssa sta sti stl stn sub sud sue sug sul sun sup svs swa swe swt syu tab tac taf tag tah taj tak tal tam tan tao tar tas tau taw tba tbo tbt tbu tbw tbx tce tdr tee tel ten teo tep ter tes tet tgh tgk tgl tgo tgr tha thn tho thu thy tib tid tig tim tin tir tis tiv tiw tja tke tki tkl tla tli tlo tlp tma tml tmm tmn tmo tmr tna tnc tne tng tnn tno tny tob tod tol ton tou toz tpa tpn tpr tpt trb tri trm trr tru tsf tsg tsh tsi tsn tsz tte ttn tts ttu tuc tuk tul tun tur tus tuv tuy tvl twe twn tye tzo tzu uby udh udi udm ukr uld uli una ung urd urk url urn urt uru usa usr ute uyg uzb vai ven vie vnm wag wah wai wak wal wam wao wap war was wat wau way wbn wch wec wed wel wem wic wik win wiy wlf wlm wlw wly wma wme wmu wna woi wol wom wor wra wrb wrd wrg wrk wrl wrm wrn wsk wtm wya xam xar xav xbi xho xns yag yam yao yap yaq yar ybi yei ygr yi yid yim yin yiw yko ykt ylm yng yok yor ypk yqy yrm yrr ytu yuc yuk yul yur yuw ywl ywr zag zai zan zap zar zay zaz zch zpr zqc zqo zqs zul zun zzo,1315,76475,0.017195161
94A,Order of Adverbial Subordinator and Clause,,94,Matthew S. Dryer. 2013. Order of Adverbial Subordinator and Clause. In: Dryer; Matthew S. & Haspelmath; Martin (eds.) 2013. The World Atlas of Language Structures Online. Leipzig: Max Planck Institute for Evolutionary Anthropology. (Available online at https://wals.info/chapter/94),2,agm ain akh ame amh ana apt asm ath awt baw bkb blt blx bsq bud car cay chp chs chv cmr cti ctm ctw dds des dgr dms dul ese gav gim gjj hai hid hmi ho hum jms jng jpn kew kha kho kku kmb kng kor krn kti kuv kyn lah lai lal ldu lep lmn mac maw mgg mis miz mnc mru nam nep nti osa pum raw res sem ser shi skk snm srn sro svs tac tib tja tli tnc tuc udm urk urn way wbn yko yuc zag,96,76475,0.0012553122
75A,Epistemic Possibility,,75,Johan van der Auwera; Andreas Ammann. 2013. Epistemic Possibility. In: Dryer; Matthew S. & Haspelmath; Martin (eds.) 2013. The World Atlas of Language Structures Online. Leipzig: Max Planck Institute for Evolutionary Anthropology. (Available online at https://wals.info/chapter/75),3,ain akn ame arm aym bab bal bej bkr brm brs bto cah cha chk cnl cnt coo dre fij geo haw hzb ind irq jak jpn juh ker ket kew kha kho khs kmu knr kob kor krb krk kro kty kut lan lav lez lin luv mal mao mie mku mna mrd mrt mun ndy nez ngi nht nko nug otm pau pit prs qaw rap san sla slo smt snm snt so tag teo tgr tin tli tor tvl tvo ung urk uzb wch wel yid yur,91,76475,0.0011899313
