parameter_id,parameter_name,parameter_description,chapter_id,chapter_citation,value,same_value_language_ids,value_language_count,language_count_total,count_ratio
85A,Order of Adposition and Noun Phrase,,85,Matthew S. Dryer. 2013. Order of Adposition and Noun Phrase. In: Dryer; Matthew S. & Haspelmath; Martin (eds.) 2013. The World Atlas of Language Structures Online. Leipzig: Max Planck Institute for Evolutionary Anthropology. (Available online at https://wals.info/chapter/85),2,abi abu ace acl acm adz aeg agc aja alb alk aln als alw ama ami aml amq amr ams anc ane anj any arg arj aro arp arq asy ata au ayw bab baf bag baj bak bar bas bbl bbu bco bdu bfg bfi bga bgo bid bik bir bka bkl bkr blu bma bmz bni bnk bnn bob bol bra bre brf brq bse bsh bsi btk bto bud bul bum buu bvi bwc cak cba ccm ceb cem cha chj chq chr cic ckl cld cle cmx cmy coe cop cpl cqt crn cso ctl cuc cya cyv cze did dio dng dok dom don dre dsh duk dut egn eng eno erk err esm ewo fij fre fri fua fut fye gae gbb gel ger git giz gku gla gmz gnb gnd goa goe gok grf grk grr gto gud gwo hal hat hau haw hdi heb heh hei hem hil hlu hna hoa htc hve hwr hya iaa iba ice ifm ifu igb ign igs ik ila ilo ind iri irq irr ita ixi izi jak jar jlu jmo juk kam kan kar kau kbl kbw kby kdz kel ker kga kgr khm khs kik kil kin kis kkt kkv klv kmi kmj kmu knk koe kon kos kpm kpw krb krd kre kri ksg kte ktu kuo kwa kwk kwm kwn kwy kya kyo kyq laa lab lac lag lan lao lat lbu lda ldo leb lel len let lew lgi lgu lic lil lit lmb lmg lmp lnd lon lou luo luv maa mae mal mam mao mas mau may mbe mbm mcd mco mdg mdm mdo mds mea meh mga mgo mgu mig min miy mko mlg mlm mlu mmb mmi mmn mna mng mnz mof mok mon mor mov mpu mra mrg mrq msm msq mtt mua mum mup mus mwb mxa mxc mxj mxo mxp mxy myg myi mzh naj nak nal nan nca nde ndi ndo ndt ndu ndy neh ngb ngd ngm ngo ngu ngz nhh nhm nht nia nif niu nko nnc noo nor nse nsg nua nue nun nup nza obg obo ocu olo ora otm paa pai pal par pat per pip pkt plg plh plk pms png pnn pod pog poh pol por pre prs psm psw pul qum rag rap rga rny rom rot ruk rus rwe saa sah sak sal sam san scr seb sed sen ses sgb sge sgl shl shn shu sim sio sir sis slo sml so sob son spa squ srb sre sti sul sun swa swe tab tah tai taj tal tbo tbw tee teo tep ter tes tet tgh tgk tgo tgr tha tho tid tig tim tin tiv tiw tke tla tlo tlp tmr tna tne tng tnk tno tpr tpt tri trt tsg tsi tsk ttd ttn tuk tvl txj tzo tzu ukr uld uli url vie vif vnm war wch wel wlf wlo wma wol wrk wrm xar xbi xho yap yok yor yul zai zan zap zen zhn zqs zul zya,511,76475,0.0066819224
47A,Intensifiers and Reflexive Pronouns,,47,Ekkehard König; Peter Siemund (Stephan Töpper). 2013. Intensifiers and Reflexive Pronouns. In: Dryer; Matthew S. & Haspelmath; Martin (eds.) 2013. The World Atlas of Language Structures Online. Leipzig: Max Planck Institute for Evolutionary Anthropology. (Available online at https://wals.info/chapter/47),1,afr ala ame amh arg arm asm bag ben bgv brh brm bur cha cle cnt dsh dut eng eve fin fur gar geo god goo grw guj heb hin hun imo ind ing iri jpn juh jun kas kay kfe kha khm knd kob kor lan lav lez mal mar mei mhi miy miz mlt mnd mns mup mxc mym ndy nko nor otm oya pan pit pod prs qhu rap snh snn sue swe tas tel tha tiw tml tna tru tsa tuk tur ung urh vie wel wlf wra yim,94,76475,0.0012291599
124A,'Want' Complement Subjects,,124,Martin Haspelmath. 2013. 'Want' Complement Subjects. In: Dryer; Matthew S. & Haspelmath; Martin (eds.) 2013. The World Atlas of Language Structures Online. Leipzig: Max Planck Institute for Evolutionary Anthropology. (Available online at https://wals.info/chapter/124),1,ace ain akh aly amp ano ass bab bak baw ben biu boz brm bvi cha chn cic cmn cnl cnt cop dgr dha dhb dhi dre drg eng epe err fin fre gar gel ger guu heb hin hix hma hoa hun hzb ik ika imo ind irq kam kan kao kas kem ker ket khm kho kmu knd kod kon kor krb kro kty kug kuk kya kyl lak lan lat lel lep lez lgu lil luv mad mao mbi mdr mei mhi mid mis mle mnd mno mos mrt mup ndb ngi nha niu nko nph nse pae pal pec pit pny ptt pul pur qhu qim ram rap raw ret rus san sap sed ser sno spa sue sun sup tag tau tha tib tid tru tur udm vie wam wlf wra yag yey yim yko ynk yor zul,144,76475,0.0018829682
90C,Postnominal relative clauses,,90,Matthew S. Dryer. 2013. Order of Relative Clause and Noun. In: Dryer; Matthew S. & Haspelmath; Martin (eds.) 2013. The World Atlas of Language Structures Online. Leipzig: Max Planck Institute for Evolutionary Anthropology. (Available online at https://wals.info/chapter/90),1,aar abi abo abu abv ace acg acl adi adz aeg agm ajg alb alk all aly ame aml amo amp amq amr ana anc ang anj anu any aoj apu apw arg arj aro arq arw asy awe baa bab bag baj baq bar bbl bbu bco bej ber bfg bfi bgr bid bii bik bio bir bka bkr bku blr bma bmb bni bob bok bre brf brh brn brp brs bsh bsr btk bto bud bug bul bum bus buu bvi bwc cah cak cav cax ccm cde ceb cem cha chj chp chq chr chw cic cld cle cmh cmn cmy cnm coo cop cor cpl crn cso ctl ctm cub cya cze dag dan day ddj deg des did din dio djm dni dom doy dre dsh duk dut dyi efi egn emb eme eng eno erk err est eud ewe ewo fij fin fon fre fri fua fur fut fye gae gap gbb gel geo ger ghb gmz gnb gnd gok grb grf grk grw gud gul gum gwa hal hat hau haw hdi heb hei hid hix hna hnd hoa hol htc huc hui hup hve hwr hya iaa iau iba ice idn ifu igb ign igs ik ila ind iri irq isa ita izi jab jak jeb jmo juh juk kam kan kar kau kay kbl kbt kbw kch kel ken ker kfe kgr khl khm khs kik kir kis kje kkt klm klr klv klw kma kmj knc kni knk knm knr knz koe kos kpm kpw krb krd kre kri kro krr kse ksg ktc kte ktl kuo kwn kws kwz kyl kyo kyq lab lan lao lat lbu lda leg lel len let lew lgt lgu lit lmg lmh lmp lmu lnd lon lug lui luo luv maa mab mad maj mal mam mao mas mau maw may mbm mbr mby mco mcv mdg mdo mds mea mee meh men mga mgo mgq mgu min miy mkj mlg mlu mmb mmn mna mng mnm mno moa mof mok mos mot mou mpr mpu mrg mrl mro mrq msk msl msm mud mum mup mur mus mut mwo mxc mxe mxo mxp mxy myg myi myn naj nal nan nar nat nbd ncm ndo ndr ndt ndy neh ney nez ngl ngm ngo ngz nhh nhm nht nia nif niu nkn nko nku non noo nor nrg nua nue nug nun nup nza obg obo oji olo ood orh orw otm paa pai pal par pat pau pba per pga pip pkt plg plh pms pno pnx pod poh pol por pre prs psh psw ptt pul pur qum rag rap rny rom ron rot rov rsu run rus rwe sah sak sam san sdw sea sed see ses sgb sgu shb shn sht sio sir sis skr slb sle sml snh so sob som spa src srd sre sro sud sul sun swa swe swt tab taf tag tah tai taj tak tar tat taw tbo tbt tbu tce tee ten teo tep ter tes tgk tgn tha thy tid tim tin tiw tke tla tlp tls tmm tmr tna tne tng tnk tnn tno tny toz tpn tpt trb tri trm tsi tsk ttd ttn tun tvl txj tzu ukr uld uli ung url urt ute vaf vie vnm wah wak wal war wch wel wic wlf wlo wma wol xbi xho xoo yag yap yaq yor yuc yuk yul zag zai zch zhn zul zzo,579,76475,0.0075711017
111A,Nonperiphrastic Causative Constructions,,111,Jae Jung Song. 2013. Nonperiphrastic Causative Constructions. In: Dryer; Matthew S. & Haspelmath; Martin (eds.) 2013. The World Atlas of Language Structures Online. Leipzig: Max Planck Institute for Evolutionary Anthropology. (Available online at https://wals.info/chapter/111),1,bag djr ewe goo grk iri klv kro may mul nav ndy otm pms rej src tha tib ung vai yay yor,23,76475,0.00030075188
3A,Consonant-Vowel Ratio,,3,Ian Maddieson. 2013. Consonant-Vowel Ratio. In: Dryer; Matthew S. & Haspelmath; Martin (eds.) 2013. The World Atlas of Language Structures Online. Leipzig: Max Planck Institute for Evolutionary Anthropology. (Available online at https://wals.info/chapter/3),5,abk aco aea amp amu ani arc ava aym bco bma bur cad chl chp coo dah det diy djp eya fye had hai hup ing irq jaq juh kab kgu klm kut kwk lad lak lez lus mak mal maz mrg mrt nav ngz nuu pae pau qaw qui rus rut scs sdw sel squ sui tas teh ter tli tsi ttu xoo yey yny yus zul,69,76475,0.00090225565
127A,Reason Clauses,,127,Sonia Cristofaro. 2013. Reason Clauses. In: Dryer; Matthew S. & Haspelmath; Martin (eds.) 2013. The World Atlas of Language Structures Online. Leipzig: Max Planck Institute for Evolutionary Anthropology. (Available online at https://wals.info/chapter/127),1,abu ace ain ame any apu bkr brh bur cha cle cnl dre emb epe ewe fij fua geo ger grk gua hau heb hun ika imo ind jpn juh kan kay kew kfe kho khs klv knr kor krb kro lan lkt lnd mal mao may miy mku mna mnd mok mxc myi ndy nht noo npi nti nun orh otm pai per prh prs san sla sml sng som sup tab tin tiw tpi tru tuk tzu ung urk vie wam wma wra wrd yaq yim yor,90,76475,0.0011768552
87A,Order of Adjective and Noun,,87,Matthew S. Dryer. 2013. Order of Adjective and Noun. In: Dryer; Matthew S. & Haspelmath; Martin (eds.) 2013. The World Atlas of Language Structures Online. Leipzig: Max Planck Institute for Evolutionary Anthropology. (Available online at https://wals.info/chapter/87),2,aab aar abk abn abo abu abv ace acg acl adg adi ady adz aeg agb agh agm agt ajg akh akn alb alk all aln aly ama amc ame aml amn amo amp amq amr ams amx ana anc ane ang anj ano anu any ao aoj api apl apt apu arg arj aro arq asm asy atm au awe awi awt awy ayi ayo ayw baa bab bae baf bag baj bam baq bar bas baw bbf bbl bch bdm bdu bdw bem ber bfg bfi bgm bid bik bin bir biu bkr bku ble bln blu blx blz bma bni bnk bnn bok bon bra bre brf bri brl brm brn brp brq bry bsh bsi bsq bsr bto bub bud buj bum bun bus buu bvi bwc cai cas cav cax cbo ccm cde cem cga chb chi chq chr chw cic cld cle cme cmr cnl cnm coc cop cor cpl crn cro crp cso cti ctl ctm ctw cui cup cya dag dan daw day ddj dds dga dgb dgo dha did dig dim din dio diy dji djn dma dms don doy dre dua duk dum dun dyi edo ega egn els emb eme emm eno epe erk err ese ewe ewo fas fij foe fon fre fua ful fur fut fye ga gaa gae gan gar gav gel ggu ghr gjj gku gla gln gmw gnd gnn goa goe goo grb grf grr grw gto gua gug guh gul guu guw gwa gyc hai hal ham har hat haw hdi heb heh hem hid hix hlp hma hna hnd hoa hol hpd huc hup hwr hya iba idn ifm igb ige igs ik ika ila imo ina ind inn iqu iri irq irr irx isa ita jab jad jar jbt jel jin jlu jmo jms jng jrw juh juk jva kaa kae kam kar kau kba kbl kbo kbw kby kch kdz kel ker kfe kga kgr kgu kgy khd khm khs kie kik kin kir kis kje kkt kkv kll klq klv klw kma kmb kmi kmj kmn kmo kmp kmu kmw kmz knc kng knm kno knr knz koa kob koe kok kom kon kos kpe kpw kqq krb krd krh kri krk kro krr kse ksg ksn kta ktc kte ktl ktu kuo kuu kwa kwb kwm kwn kwy kwz kya kyk kyl kyn kyo kyz laa lab lad lag lal lan lao lar lav lbu lda ldo leb lel len lep les let lew lgi lgt lgu lic lin lis lkt llm lmb lmg lmh lml lmp lon lot lou luc lug lui luo luv luy maa mab mac mad mae mal man mao mar mas maw may mba mbe mbi mbl mbm mbo mbr mbt mby mda mde mdg mdl mdn mds mdw mea mee meh mek mey mga mgk mgo mgq mgu mhk mhl mie mii mij min mis miy miz mka mkd mke mkg mkj mku mkz mla mlg mlk mlm mlu mmb mmv mmw mna mng mnm mnv moa mof mok mon moo mor mot mou mpa mpo mpr mpt mpu mra mrg mrh mrl mro mrq mrr mrt mru msc msk msl msm msn mtb mts mtu mua mud mum mup mur mwe mwo mxa mxc mxe mxj mxo mxp mxy myi myn myr mzc nab naj nak nal nam nan nar nat nau nav nax nbd nbr ncm ndb nde ndi ndj ndo ndr ndt ndu neh ney ngd ngg ngj ngk ngl ngm ngn ngo ngt ngu ngz nhh nhm nht nia nif niu nkb nkk nkn nko nku nma nnc nnd nng nnk noc non noo nph nrg nse ntj nto nua nue nun nup nus nyh nyi nyk nym nze olo omh omi orh ori ork oro orw ory osa otr pae pai pam par pat pau per pga pia pir pit pkt plg plh plk pms png pnu pnx poh pok por ppi pre prh prs psw pul pum pun pur qia rag ral ram rao rap ras raw rga rgc rny rom rot rov rru rsu rum run rwa saa sah sak sam sap sdw sea seb sed sem sen ses sgb sgu she shi shl shm shn sht sia sil sim sio sis skk sko sku sla slb sle slp sme sml smn sng snm snn snt so sob som spa spi src srd sre srn sro sti sud sue sug sul sun sup swa syu tab taf tah taj tak tao tat tau taw tba tbl tbo tbt tbu tbw tdi tdr ten teo ter tes tgk tgn tgo tha thd thy tia tib tid tik tim tkl tlf tlp tma tmm tmn tmo tmr tna tnc tne tng tnk tnn tno tny ton toz tpr tps trb tri tsg tsk tsm ttd ttn tuk tum tun tvl uhi uld uli una ung ura urk url urn urt usa ute vaf vai ven vie vif vnm wag wah wal wap wat wbn wch wed wel wic wiy wlf wlo wma wmu wn wna wog woi wol wom wra wrd wrk wrl wrm wsk wth xam xas xbi xer xho xoo yag yal yam yao yap yay yel yi yid yiw yor yrm yuc yul zag zai zap zar zaz zul zun zya zzo,879,76475,0.011493952
7A,Glottalized Consonants,,7,Ian Maddieson. 2013. Glottalized Consonants. In: Dryer; Matthew S. & Haspelmath; Martin (eds.) 2013. The World Atlas of Language Structures Online. Leipzig: Max Planck Institute for Evolutionary Anthropology. (Available online at https://wals.info/chapter/7),1,abi abm ach acm adk adz aea aeg agh aik ain akn akw ala alb ald alw amc ame amo amp amu amz ana ant ao api apu arb arp asm ata awn awp aze bai baj bam baw bbf bee bej ben bir bis bki bkr bma bng bno bod brb brd bre brh bri brm brr brw bsk bsq bto bua bul bur byu cac cah cam car cax cay cck ccp cha che chk chv cil cle cmn cnl cnt cof cre cso ctl cub cve cyv dad dag dar der dgb dgr die din dio diy djp dni don dre dts dum dyi efi eja eka eng epe eve evn ewe ewo fas fef fij fin fre ful fur fuz ga gan gar gds ger ghb gla gmb goa goo grb grk grr grw gua hak ham haw hba hin hix hok hop hum hun hve iaa iba igb ign igs ijo ika imo ind ird irr irx iso iva iwm jav jiv jng jom jpn jpr kal kas kay kch ked ket kew kfe kgu kgz kha kho khr khs kiw kkn kkv kla klv kly kmp knd kng knm knr koa kob koi kot koy kpa krb krd krk kry kse kty kun kur kwa kwo kws kya kyl kzy lad lah lan lat lav len lep lit llm lu lui luo luv mab mal mao map mar mau max may mbb mei mgg mie mku mla mlk mme mnc mnd mog mor mpa mrd mrn mro mrt mss mtp mui mun mxc mxm mya myi mzc nai nan nap nar nas nax nbk ndy nep new nga ngi nhn nht nim nis niv nko nkt nnc nob non nor ntu nug nyi oca oji ond ood orm otm pae pai paw pec pit pms pnr poa poh pol prh prs psh psm puk pur ram rap res rom ror rsc rtk ruk rus sab sba scs seb sha shi shk skp slp snc snd snh snm snt som sor spa srn sue sup svs swa tab tac tag tam tas tel tgk tha tib tic tiw tks tlp tmn tmp tne toa ton tpa try tsg ttn tug tul tun tur tuv umb una ung urk usa uzn wah wam wao wdo wiy wlf wma wmu wnt woi wra wrd wrs wry wuc yag yaq yar yaw yay ycn yel yes yid yim yko ykt yny yor ytu yus zan zqc,409,76475,0.005348153
136B,M in First Person Singular,,136,Johanna Nichols; David A. Peterson. 2013. M-T Pronouns. In: Dryer; Matthew S. & Haspelmath; Martin (eds.) 2013. The World Atlas of Language Structures Online. Leipzig: Max Planck Institute for Evolutionary Anthropology. (Available online at https://wals.info/chapter/136),1,abk ace aco aeg ain ala ame amh amp ane apu arp asm atk awp awt ayw bej bel bma brk brm brs bsq bur cax cha chi cho cin cjo cku coo cre csh ctm cyv dag diy diz dji djp dni dum dyi fij fur git gku goo gua hai hat hau heb hix hua hve imo ind ing jak jaq jiv jpn kay kew kho kio knd knr koa kob kor kot kri krk kro kse kut kyq lan lav lda lez lui maa mal map mar mau may mdk mei mis mlk mnd mne mrt mtp mun mxc myi nah nar nat nbr nca ngi ngl niv nmb nug ond ood orh ori pai pau pip pit pme prh pur qim qui ram rap sah sal shs sla smt snc snt squ sul tag tau tib tiw tja tkl tlf tli tmc tmr ton tpa tru tuk tun tzu uhi ung vie wap war was wch wem wic win wiy wrd wrn xok yag yaq yna yuc yuk yur ywl zqc zun,177,76475,0.002314482
73A,The Optative,,73,Nina Dobrushina; Johan van der Auwera; Valentin Goussev. 2013. The Optative. In: Dryer; Matthew S. & Haspelmath; Martin (eds.) 2013. The World Atlas of Language Structures Online. Leipzig: Max Planck Institute for Evolutionary Anthropology. (Available online at https://wals.info/chapter/73),2,aco aeg ain ala alu ame amr ana apl apu arm arp asm aso awk awp bag bam baw bem bir bkr bma brh brm brs bsk bsq bul bur cah cak car ceb cha chk chr chv cmn coo cre csh dbd dgr dio dni dre dsh eng epe est evn ewe fij fin fre fur gar gbk ger goo grb grk grw guj gum gwa hai ham hau heb her hin hix hun iaa ice ido igb ijo ika imo ind iqu iri irq jak jpn juh kas kay kaz ker ket kew kfe khk khm kho kim kin kio kis kiw kji klv kmk kmp kmu knd knr koa kob kok kon kor kpe krb krk krn kro kry kse kte kty ktz kut kwa kyl lah lan lat lav lep lin lkt lnd loz luo luv mab mac mai mak mal mam man mao map may mdk mgo mku mme mnd mnm mok mon mop mro mrt mss mxc myi mym nan nav nbd ndy new nez nga ngi ngl nht niu niv nko nma nor nti ntu nug nun obo ond ong orh oss otm pai pal pan pau pip pit pms pnn ppi prh prs psm pta pur qim ram rap rav rus sdh see sel shk shl shn shr shu sla slo sml snm snn snt som spa squ sue sup sus swa swe tab tbu tel tgr tha thk tiw tmi tms tru tsp tuk tun tur tuv txj tzu udh udm una urd urk usa vie wam war wch wra wrd wrk yag yaq yid yim yko ykt yor yur zul,271,76475,0.0035436417
143G,Minor morphological means of signaling negation,,143,Matthew S. Dryer. 2013. Order of Negative Morpheme and Verb. In: Dryer; Matthew S. & Haspelmath; Martin (eds.) 2013. The World Atlas of Language Structures Online. Leipzig: Max Planck Institute for Evolutionary Anthropology. (Available online at https://wals.info/chapter/143),4,aab aar aba abi abk abn abu abv ace acg acl acm aco acu adg adi adz aeg agb agc agd agh agm ain aja ajg akh akn ala alb alk all aln als alw aly amb amc ame amh aml amn amo amp amq amr ams amt amx ana anc ane ang ani anj ann anu any ao aoj apl apt apu apw ara arc arg arj arm aro arp arq arw asm ass asu asy ata ath au ava awa awe awp awt aym aze azi baa bab bac bae baf bag bai baj bak bam bao baq bar bas baw bbf bbl bbu bbw bch bco bdm bej bel ben ber bfg bgn bgo bgr bho bia bid big bii bik bil bio bir biu bka bkr bku bla bln blr blt blx blz bmb bmz bni bnn bnu boa bob bod boi boj bok bol bra bre brf brh bri brl brm brn brp brr brs bsh bsk bsq bti btk bto bua bud bug bul bum bun bur bus but buw buy bvi bwc bya bzi cah cai cak cam can car cas cax cay cba cbo ccm cct cde cea cem cga cha chb chc chd che chg chh chi chj chk chn chp chq chr chs chv chw chx cic ckl cle cln cmh cml cmn cmr cmy cnl cnm cnt coa coc coo cop cos cpl cpn cpy cqt cre crn crp crt cso cti ctl ctm cub cui cup cya cyv cze dag dan dds des deu dga dgb dgo dgr dha dhi dhm dhw did die dig dim din dio diy dja dji djm djn djp dma dmi dmk dms dni dom dre drm dsh dua duk dul dum dun dut dyi ebi efi ega eip eka eko emb eme ene eng eno eny epe erk err ese est eud eve evn ewe fij fin fon fre fua ful fur fut fye ga gaa gae gah gal gap gar gav gbb gbs gds gel geo ger ggu ghr gim gir giz gjj gku gla gln gmw gmz gnb goa god goe gok gon goo grb grf grj grk grr grs grw gua gud gug guh guj gul gur guu gwa gwo gyc hai hak hal ham han har hat hau haw hay hdi heb heh hei hid hil hin hix hlp hlu hma hmi hna hnd hoa hol hop hpd htc hua huc hui hum hun hup hve hya hzb iaa iau iba ice idn ido idu ifm ifu ige ign igs ijo ik ika ila imo ina ind ing inn iqu iri irq irr irx isa ita ite iwm izi jab jak jaq jar jeb jiv jlu jmo jms jng joh jpn juh juk kaa kab kac kad kae kan kar kas kau kay kba kbl kbo kbw kby kch kdw kdz kel kem ken ker ket kew kfe kga kgr kgy kha khd khg khl khm khn kho khr khs kie kik kil kim kin kio kir kiw kkp kkt kkv kla klg kll klm kls klv klw kma kmb kmh kmi kmj kmk kmn kmo kmp kmr kms kmu kmw kmz knb knc knd kng kni knk knm knn knr knw knz koa kob koe koi kok kol kom kon kop kor kos koy kpw krb krc krd kre krh kri krj krk krn kro krr krw kry ksa kse ksg ksn kta ktc kti ktl kty kum kun kuo kus kut kuv kwa kwb kwn kwo kws kwt kwy kwz kxo kya kyl kyp kyq kyr kyz kzy laa lab lac lad lag lah lai lal lan lao lar lat lav lbu lda ldo ldu leb lec leg lel len lep les let lew lez lgi lgt lgu lho lic lim lin lis lit lkt llm lmg lmh lmn lmp lmu lnd lng lon lot lou luc lug lui luo luv ma maa mab mac mad mae mag mai maj mak mal mam man mao map mar mas mau maw may mba mbe mbi mbl mbm mbr mbt mby mcd mch mco mcv mda mde mdg mdl mdm mdn mdo mdw mea mee meh mei mek men mer mga mgg mgi mgk mgu mhi mhl mhu mie mig mii mik min mir mis miy miz mka mkd mke mkg mkh mki mkj mkl mku mkz mlg mlk mlu mmb mme mmn mmv mmw mna mnc mnd mne mni mnm mno mns mnt mny moe mog moh mok mom mon moo mor mos mot mou mov mpa mpo mpt mpu mra mrd mrg mrh mri mrl mro mrq mrr mrs mrt mru mrw msc msg msk msl msm msn msq mss mtb mts mtu mua mug mui mum mun mup mur mus mut mwb mwe mwo mxc mxe mxj mxo mxp mxx myg myi mym mzc nab nad nag nah naj nak nal nam nan nar nas nav nax nbd nbm nbr nca ncm ndb nde ndj ndo ndr ndt ndu ndy neh nep nev new nez nga ngd ngi ngj ngk ngl ngm ngn ngo ngt ngu ngw ngz nha nhh nhm nht nia nif nis niu niv nke nkk nkn nko nku nma nmb nmm nne nnk noc non noo nor nph nrg nse nsg nsn nti ntj nto ntu nua nue nug nun nup nyh nyi nyk nym nyn nyr nyu nza nze obg obo ocu oir oji oks olo omh omi ond one ong ono ood ori ork oro orw osa oss otm otr oya paa pae pai pal pan par pat pau paw pba pec per pga pia pip pis pit pkn pkt plg plh pme pms png pnn pno pnu pod pog poh pol por ppi pra pre prh prk prs psh psj psm pso psw ptt ptw pul pum pun pur pwn qaw qhu qia qim qui qum rag ram rao rap ras raw rem res ret rgc rik rim rit rnd rny rom ron rot rov rpa rru rsu ruk rum run rus rwa rwe sah sak sal sam san sap sar saw sba scr sdw sed see sel sem ser ses sgb sgl sgu shb she shh shi shk shl shm shn shp sht shu shy sia sid sil sin sio sir sis siu skk skm skw sla slb slo sme sml smn sna sng snm snn sno snt so sob sod som son sor spa squ srb src srd sre sro ssa sta sti stl stn sub sud sue sug sul sun sup svs swa swe swt syu tab tac taf tag tah taj tak tal tam tan tao tar tas tau taw tba tbo tbt tbu tbw tbx tce tdr tee tel ten teo tep ter tes tet tgh tgk tgl tgo tgr tha thn tho thu thy tib tid tig tim tin tir tis tiv tiw tja tke tki tkl tla tli tlo tlp tma tml tmm tmn tmo tmr tna tnc tne tng tnn tno tny tob tod tol ton tou toz tpa tpn tpr tpt trb tri trm trr tru tsf tsg tsh tsi tsn tsz tte ttn tts ttu tuc tuk tul tun tur tus tuv tuy tvl twe twn tye tzo tzu uby udh udi udm ukr uld uli una ung urd urk url urn urt uru usa usr ute uyg uzb vai ven vie vnm wag wah wai wak wal wam wao wap war was wat wau way wbn wch wec wed wel wem wic wik win wiy wlf wlm wlw wly wma wme wmu wna woi wol wom wor wra wrb wrd wrg wrk wrl wrm wrn wsk wtm wya xam xar xav xbi xho xns yag yam yao yap yaq yar ybi yei ygr yi yid yim yin yiw yko ykt ylm yng yok yor ypk yqy yrm yrr ytu yuc yuk yul yur yuw ywl ywr zag zai zan zap zar zay zaz zch zpr zqc zqo zqs zul zun zzo,1315,76475,0.017195161
32A,Systems of Gender Assignment,,32,Greville G. Corbett. 2013. Systems of Gender Assignment. In: Dryer; Matthew S. & Haspelmath; Martin (eds.) 2013. The World Atlas of Language Structures Online. Leipzig: Max Planck Institute for Evolutionary Anthropology. (Available online at https://wals.info/chapter/32),1,abn aco ain ale ame arm asm awp bag baw bkr brh brm bsq cah car ccp cha chi chk chv cmn cnl cnt coo cyv dag djr dni don epe err eve ewe fij fin geo goo grw gua guu hai hat haw hay hun iaa igb ika imo ind ite jaq kam kay kew kgz kha khk khl khm klv knr koa kob krk kse kut lad lah lan lep lez mak mal mao map mar mei mnd mns mny mok mrl mrt mss nbd ndy nez ngi nht niv ntu ork otm pai pal pil pip pit pmc prs qim ram rap san saw shk sml smt snt srn sue tab tha tho tib tol tot tsh tsi tuk tur tvl uhi una urk usa uzb vie wat wic wra yaq yel yid yko ykt ylb yor ypk yur zqc zun,145,76475,0.0018960445
25B,Zero Marking of A and P Arguments,,25,Johanna Nichols; Balthasar Bickel. 2013. Locus of Marking: Whole-language Typology. In: Dryer; Matthew S. & Haspelmath; Martin (eds.) 2013. The World Atlas of Language Structures Online. Leipzig: Max Planck Institute for Evolutionary Anthropology. (Available online at https://wals.info/chapter/25),1,buu bzi ewe hai iau ijo ind jel juh kis lmh prh sup tha vie,16,76475,0.0002092187
65A,Perfective/Imperfective Aspect,,65,Östen Dahl; Viveka Velupillai. 2013. Perfective/Imperfective Aspect. In: Dryer; Matthew S. & Haspelmath; Martin (eds.) 2013. The World Atlas of Language Structures Online. Leipzig: Max Planck Institute for Evolutionary Anthropology. (Available online at https://wals.info/chapter/65),2,abi aco afr ain ame amh ana apu arp asm atc awn bar ben blc bon brm brs bui cnl coc cpl cre cyn dag did dio eng ewe fij fin ger goo grw gua gug hal hau heb hun ice ind ins ise jav jiv jpn kay kew kfc kha khm kmu knd koa krk kui kut kya lah lai lao lat lav lda lkt luv mai man mao map mar may mei mne mrt mtg mtu myi nca ngi nim niv ntu ono pai plg qco qim ram rap raw san sml snm som sue sun swa swe tga tgr tha tig tiw tml tne tpi tuc tuk udm vie war wch wlf wra yes yko yor zun,121,76475,0.0015822164
144A,Position of Negative Word With Respect to Subject; Object; and Verb,,144,Matthew S. Dryer. 2013. Position of Negative Morpheme With Respect to Subject; Object; and Verb. In: Dryer; Matthew S. & Haspelmath; Martin (eds.) 2013. The World Atlas of Language Structures Online. Leipzig: Max Planck Institute for Evolutionary Anthropology. (Available online at https://wals.info/chapter/144),2,acg alb arg arj aro bae bai bar bni bnn bra brf bul bvi cmy cnt dga dgb dua ebi eng est fin fon fut gok hak heb htc huc hun iaa ind ita juh kan kch kfe khm khs kir kni kom kos ksn kwa kzy lan lao lic mae mau mcd mhu mna mnd mok mon mro mrt mus mut nak nal ncm ndy neh ngu nhm nne nun pal plg poh pol por pul rom rus sap sed shl sir sis slo sob spa srd sre ssa sti sun taf tgk tha tiw tmm tmr ttn ukr uli url vie wal wol xar xbi yin yng yor zqs,112,76475,0.001464531
