parameter_id,parameter_name,parameter_description,chapter_id,chapter_citation,value,same_value_language_ids,value_language_count,language_count_total,count_ratio
48A,Person Marking on Adpositions,,48,Dik Bakker. 2013. Person Marking on Adpositions. In: Dryer; Matthew S. & Haspelmath; Martin (eds.) 2013. The World Atlas of Language Structures Online. Leipzig: Max Planck Institute for Evolutionary Anthropology. (Available online at https://wals.info/chapter/48),2,abi abu ace aco adz ala alb ame amu ana ani arm asm ata atk awp baa bab bam bar baw bej bkr bln brh bri brm brn bro brs bsq bya cah cap cav cax chk chr ckl cmn cmx cpn cri cub dag dga dgr dio diz don doy dre dum dut eka eng epe fre fua geo ger gmw god goo grb grk gud hai hat hin hua hzb igb ika imo ind ing irq ita jpn juh kas kch ker kew kha khm kho khs kis kjo klk kmu knd knm knr kob kom kon kor kpm krk kro kse kuk kyl lad lah lak lat lel lep lez lim luv mao map mau mcr mde mei mis miz mku mlm mna mnd moa mrd msn mum mun nad nak nan nas nbr ndo ndy nup nyu orh oss otm pai pal par pau pit pol prh psj pso pur qaw qim rap rem rus sah sam san saw sem shk slp sml snm snt spa srm sue sun sup swa syu tab tha tid tin tiw tla tms tna tol ton tot trb tru tsi tso tuk tun tur una vie wao wap wbn wma wra xok yaq yko yor yur zan zul,209,76475,0.0027329193
99A,Alignment of Case Marking of Pronouns,,99,Bernard Comrie. 2013. Alignment of Case Marking of Pronouns. In: Dryer; Matthew S. & Haspelmath; Martin (eds.) 2013. The World Atlas of Language Structures Online. Leipzig: Max Planck Institute for Evolutionary Anthropology. (Available online at https://wals.info/chapter/99),1,abi abk aeg ain ame apu arp bam bkr bma car cea cle cyv dag dio ewe geo grw hai ham hau hix hzb ind irq jak juh ker ket kfe khm kmu kon krk kro kse kut kyl lak lan lav luv map mau may mnd mrd mun mxc ndy nht niv nko nti nug pms prh rap san sla sue sup swa tab tag tha tiw tsi tun ung usa vie wch yag yim ypk zul,79,76475,0.0010330173
108B,Productivity of the Antipassive Construction,,108,Maria Polinsky. 2013. Antipassive Constructions. In: Dryer; Matthew S. & Haspelmath; Martin (eds.) 2013. The World Atlas of Language Structures Online. Leipzig: Max Planck Institute for Evolutionary Anthropology. (Available online at https://wals.info/chapter/108),4,abk aeg ain ala ame apu arm arp asm awp bag bej bkr bma brh brm brs bur chh cic dag dji dni don eng epe eve ewe fij fin fre gae gdi geo ger grb grk gua hau heb hin hix hun ice igb ika imo ind ing irq jpn juh kam kas kay ket kew kfe kgz kha khk kho khs klv knd knr koa kob kor krk kut lat lez lin lkt luv mac mak mal mao map mar mau may mei mnd mrl mrt mxc ndy ngi niv nko nug ond orh otm pan pau pmc pms prh prs psm qaf qim ram rap rus sam san shk sla snc spa sue sup swa tab tag tap tau tha tiw tml tuk tur tvl ukr una usa uzb vie wam war wch wic wra yag yaq yaz yim yor yur zul,146,76475,0.0019091206
143F,Postverbal Negative Morphemes,,143,Matthew S. Dryer. 2013. Order of Negative Morpheme and Verb. In: Dryer; Matthew S. & Haspelmath; Martin (eds.) 2013. The World Atlas of Language Structures Online. Leipzig: Max Planck Institute for Evolutionary Anthropology. (Available online at https://wals.info/chapter/143),4,abi abn ace acg acm agb agc agd ain akh akn ala alb all als alw ams amt anj ann any apu arg arj arm aro arq arw ass asy ata awa awt aym baa bac bae baf bai baj bam bao baq bar bbl bbw bch bco bdm bej ber bfg bgn bho bia bil biu bkr bku bla ble blr blz bmz bni bnn bnu bra brf bri brl brp bsh bsq btk bto bua bug bul bun bur buw bvi bwc bya cah cam cax cba ccm cea cem cga cha chb chc chd che chg chh chk chn chq chx cic ckl cle cmn cmy cnt coc coo cos cpl cpy cre crn crt cso cup cya cyv cze dag dan deg dga dgb dgr dhi dhm dhw did din diy dja dji djm djn djp dmk dre drm dua dul dyi ebi egn ene eng eno eny err est eud fij fin fon fut gaa gae gap gav gds gel geo ggu ghr gir gjj gku gmw goa gok goo grb grf grj grk grr grs gud guj gur guu gyc hak ham han haw hay heb heh hei hil hin hlu hnd hoa hol hop htc hua huc hui hun hup hve hya iaa iba idn ifu ign ik ila imo ind inn iqu iri ita jak jaq jlu jng joh juh kad kae kan kba kby kch kdw kdz ket kew kfe kga kgr kgy khd khm khn khr khs kik kil kin kir kkt kla klm kls klv kmh kmi kmj kmp kms kmu kmw knb knc kni knn knz koi kom kop kor kos krb krd krj ksa kse ksn ktc kty kum kuo kut kwa kwb kwn kws kya kyq kzy lac lah lal lan lao lar lat lda ldo leb leg les let lgi lgu lic lis lit llm lmp lot luc lui luo maa mae mag mai maj mak mal mam man mao mau maw mbi mcd mch mco mcv mde mdl mdm mer mgg mgi mhu mie mir mkd mke mkg mkj mkl mlk mme mmn mmv mmw mna mnd mni mnm mno mns mnt mny moe mog moh mok mon mos mov mpa mpo mra mrd mrh mri mrl mro mrq mrr mrt mru mrw msq mss mua mug mun mur mus mut mwb mwe mxc mxj mxo mxp mxx myi nab nad nah naj nak nal nam nan nar nav nax nbr nca ncm nde ndj ndo ndr ndy neh nev new nez nga ngd ngi ngj ngk ngt ngu ngw nha nhh nhm nht nia nif niu nkk nkn nko nmm nne nsg nti nto ntu nue nug nun nwd nyh nyi nyk nym nyn nyr nyu obg obo ocu oir oji oks omi ond ono ood orh ori ork oss otm pai pal pan par pba pga pip pkn plg pms png pnn pno pnu poh pol por ppi pra pre prs psh psw ptt pul pun pur pwn qia qim qui qum rap ras raw rem res rgc rik rim rnd rny rom rov rpa rru ruk rus rwa sak sal sam sap scr sed see ser ses sgu she shl shm shn shp shu sid sil sir sis skw slb slo sml sna sng snn sno snt so sob sod som son sor spa squ srb src srd sre ssa sta sti stl sud sue sul sun svs swa taf tag tah taj tak tal tam tas tau taw tbo tbw tbx tce tdr tee ten tep tes tet tgh tgk tgo tgr tha thn tho thy tib tim tin tis tiw tke tki tkl tla tli tlp tmm tmr tna tng tnn tno tny tob tod tol tou toz tpa tpn tri trr tsg tsi tsk tsn ttn tts ttu tuk tus tvl twe twn tzo tzu udh udi ukr uli una ung urd url uru usa usr vai ven vie wag wah wak wal wam war wed wel wem wic wik wlm wlw wme wmu wol wor wrb wrd wrg wrl wsk wtm wya xam xar xbi xho xns yag yao yap yaq ybi yei ygr yi yid yim yin yiw yko ylm yng yok yor ytu yuc yur yuw ywl ywr zai zap zar zaz zqc zqo zqs zzo,712,76475,0.0093102325
81A,Order of Subject; Object and Verb,,81,Matthew S. Dryer. 2013. Order of Subject; Object and Verb. In: Dryer; Matthew S. & Haspelmath; Martin (eds.) 2013. The World Atlas of Language Structures Online. Leipzig: Max Planck Institute for Evolutionary Anthropology. (Available online at https://wals.info/chapter/81),2,aab abi abu acg acl acm adi adz aeg agb agh aja akn alb alk aln ama aml amq anc ane anu aoj apu ara arg ari arj aro arp arq au avk ayi ayr ayw bab bae baf bag bai bak bar bas bbl bdu ber bgo bgr bgs bgz bid bii bik bir bka bku ble blz bmb bni bnk bnn bob bol bra bre brf brn brq bsh bub bud bug bul bum buu buy bvi cga chr chw cic cme cmy cnt coc cop crn ctl cua cuc cze day deg dga dgb dio dma dok don doy dsh dua duk ebi ega egn eko eng eno erk err est ewe ewo fin fon fre fua fut fye ga gbb gbs gla gmz gnb goe gok grb gua gul guw gwo hak hal hat hau heb heh hem hna hnd hol htc huc hve hya iaa iba ice ifm igb ige igs ila ind iqu irr ita ito iwa izi jab jar jmo juh juk kad kan kar kas kau kba kbw kby kch kdw kel ken ker kfe kga khm khn khs kik kil kin kir kkv kla kmu kni knk koe kom kon kos kpw kre ksg ksm ksn ktc kte ktl kwa kwn kwy kyl kzy laa lab lag lan lao lat lbu ldo leb leg lel len let lew lgi lic lin lit llm lmh lmp lmu lnd lon lou luc luo luv ma mae map mas mau may mba mbe mbi mbm mbr mbt mby mcd mcv mda mdg mdo mds mdw mea mee mga mgk mgo mgu mhu mie mkd mkq mkz mla mlg mlm mlu mmb mmv mna mnd mng moe mof mok mon moo mor mos mpr mpu mrg mro mrt msm mtb mua mum mup mur mus mut mwe mwo mxe myg myn nak nal nbe nbm ncm ndb ndi ndo ndt ndu ndy neh ngb ngd ngm ngo ngu ngw ngz nhm nhn nht nke nkn nko nne nng non noo nor nse nto nua nun nup nza obg obo ocu olo one ora otr paa pal pam pat pau per pga pkn plg plh plk pms png pnu pog poh pol por pre psw pul pur rag rga rim rny rom ron rot rru rsu rus sah sak sal san sap scr sea sed ses sgb sgl sgu sha shl shm shn sht sio sir sis skm sku sle slo sno sob son spa srd sre ssa sti stn sud sul sun swa swe tab taf tal tan tbw teo tep ter tet tgk tgn tha tia tid tiv tiw tki tla tmm tmn tmr tne tnk toz tpr trm ttd ttn tum txj ukr uld uli ura url urt ven vie vnm wal wch wlf wma wol wrk wrm wrn wry wwa xam xar xbi xho xoo yao yay ycn yin yng yor yuk yul zan zch zhn zpr zqs zul,488,76475,0.0063811704
4A,Voicing in Plosives and Fricatives,,4,Ian Maddieson. 2013. Voicing in Plosives and Fricatives. In: Dryer; Matthew S. & Haspelmath; Martin (eds.) 2013. The World Atlas of Language Structures Online. Leipzig: Max Planck Institute for Evolutionary Anthropology. (Available online at https://wals.info/chapter/4),1,abi ach acm aco ain alw amc amp amz ant api apu arb asm aym bco ber bng bra brd bua byu cac cah cax ccp che chk chl chu chw cmn cnl cnt cre dad diy djp dni don dyi eka fas fij fuz gds gmb goa goo grr hai hak ham haw hok hop htc hup imo irr iwm jak jaq jav jeb jiv jom kay kek kew kgu khm kho kkv kmu kng kob kor krb krk kro kry kss kty kut kwa kya len lkk lui maa mao map mar mau max may maz mbb mku mlk mne mor mov mrt mss myi nan nas nbk nez ngi nhn nht nmb nnc nug nun nuu nyg oji ond pac pae pit pms pnr poh psm qaw rap ror rtk seb sed sel sha shi shk shs shu sin skp slp snc snm squ tam tiw tli toa tol ton tpa tuk ung urk wah wam war wch wdo wic wiy wmu wnt wra wrd wrs wry yag ycn yct yel yes yid yim yny yur zqc zun,182,76475,0.0023798626
101A,Expression of Pronominal Subjects,,101,Matthew S. Dryer. 2013. Expression of Pronominal Subjects. In: Dryer; Matthew S. & Haspelmath; Martin (eds.) 2013. The World Atlas of Language Structures Online. Leipzig: Max Planck Institute for Evolutionary Anthropology. (Available online at https://wals.info/chapter/101),1,abu agt amb amp anj ao bab bas bmb bus bya chc dga dgb dre dsh dum dut egn eng eve fre fri gae ger gud gwa hai iba ice ind ing juh juk kch kel kho khs kse kyr laa lat lep mal mka mny moo mup mwb nam nbm ndo ndt ndy ngj non nor nya pam plk pno pso rov rus sah sdw sis snm snn sup swe tab taf tbl thy tru tvt uhi ukr uyg vai,82,76475,0.0010722459
98A,Alignment of Case Marking of Full Noun Phrases,,98,Bernard Comrie. 2013. Alignment of Case Marking of Full Noun Phrases. In: Dryer; Matthew S. & Haspelmath; Martin (eds.) 2013. The World Atlas of Language Structures Online. Leipzig: Max Planck Institute for Evolutionary Anthropology. (Available online at https://wals.info/chapter/98),1,abi abk aco aeg ain ala ame apu arp asm bag bam bkr car cea cha cle cnl cyv dag dio eka eng ewe fij fre grb hai ham hau hix ind iri jak juh ker ket kfe khm kio klv kmu kob kon krb krk kro kse kut kyl lan lav lkt luv map mau may mku mnd mrd mun mxc nav ndy nht niv nko nti nug otm pms prh psm ram rap san sla squ sup swa tab tag tha tiw tun ung usa vie war wch wic wra yag yim yor yur zul,98,76475,0.0012814646
74A,Situational Possibility,,74,Johan van der Auwera; Andreas Ammann. 2013. Situational Possibility. In: Dryer; Matthew S. & Haspelmath; Martin (eds.) 2013. The World Atlas of Language Structures Online. Leipzig: Max Planck Institute for Evolutionary Anthropology. (Available online at https://wals.info/chapter/74),2,abk ace aeg ain akn alb amh amr apu arg arm aym bab bag bal bam baw bej bma brs cle cnt cre ctl cyv dre dsh dut eng ewe far fij fin fre fue geo ger grk hau haw heb hin hzb ice igb ing iri irq ita kam kas ker ket kfe kha khm kho khs kmu knd knm knr kol kon krb kro kse kty kui lak lan lat lep lez lin lit lkt mai mak mal mao map may mcd mde mdg meh mhi mie mku mlt mna mnd mns mok mrl mun mxc mym ndy ngi niv nko ntu ond orh otm pan pau pba pol por prs psm qim rap rka rom rus san scr sel shk slo sml snm sno som spa sue sup swe tab tbu tel tgr tha tja tor tru tuk tun tuv tvl tvo udh vie vot wch wel wic wlf yaq yko yor zqc zya,158,76475,0.0020660346
94A,Order of Adverbial Subordinator and Clause,,94,Matthew S. Dryer. 2013. Order of Adverbial Subordinator and Clause. In: Dryer; Matthew S. & Haspelmath; Martin (eds.) 2013. The World Atlas of Language Structures Online. Leipzig: Max Planck Institute for Evolutionary Anthropology. (Available online at https://wals.info/chapter/94),1,abi ace acl aco adn aeg alb alk all aln alw aml amo amr ams ani apu arg arj arm arq arw asy ata au ayw bag baj bak baq bar bbw bdu bfg bho bik bir bka bkl bkr bma bnr bnu bre brf bsh bsk btk bto bug bul bum bvi bwc ccm cem cha chk chq chr chw chx cic ckl cle cmy coo cop cpl crn cso cya cyv cze dhr did din dio djp dom dre dsh duk dut efi eng eno erk est ewe ewo fij fin fre fua fut fye ga gae geo ger ggu gmw gok grf grk grr gud guj gwa hal hau haw heb hin hna hnd hoa htc hun hve iaa iba ifm ifu igb ind iri ita ite izi jak jmo juh kam kan kau kch ker kfe khl khm khs kik kil kir kis kkt kkv klm kls klv kmj knk kno koe kos krb krd kro krr kry kse ksn kty kut kwn kwy kya laa lac lao lat lbu lda lel len lgu lit llm lmb lmg lmh lmp lnd lon lou luv maa mag mai mal mam man mao mau may mbm mbr mbt mco mcv mde mds mea mee meh mek men mer mga mgu min miy mka mkg mlg mlu mmn mng mog moh mok mon mov mra mrg mro mrq msq mup mus mut mwb mxc mxj mxo mxp myg myi mzh naj nan nav nca ndo ndt ndy nez ngd ngm ngo nhh nhm nht nia niu nke nkn non noo nor nsg nua nue nyi obo ocu oji olo ond orh otm paa pai pal pan par pat pip pkt plg plh pms pnn poh pol prs psh psm pul qui rap rny rom rot rov rsu rus rwe sah sak sam san sar scr sdw shl shn sim sio siu som son spa squ srb srd sti sud sue sul sun sup sus swa swe swt tab tag tah taj tao tbo tbt tee ten teo tep ter tes tgh tgk tha thy tic tim tin tiw tla tlo tna tne tng tnn tno tob tou tri tsi tsk ttn tuk tvo txj tzo tzu udi ukr uld ung urd uzb vai vie vnm wal war wch wel wic wik wlf wlo wma wme wol xas yap yay yns yor yur zai zqo zul zzo,398,76475,0.0052043153
35A,Plurality in Independent Personal Pronouns,,35,Michael Daniel. 2013. Plurality in Independent Personal Pronouns. In: Dryer; Matthew S. & Haspelmath; Martin (eds.) 2013. The World Atlas of Language Structures Online. Leipzig: Max Planck Institute for Evolutionary Anthropology. (Available online at https://wals.info/chapter/35),4,abi abk abn aeg amh awp bam bej bkr brh bri bsq bur car cha ctm dag dio eng epe err fin fur gar ger grb grw gua guu ham heb hin hix hun hzb iba igb ind ing iri irq ker kew khm klv kmu kob kon krb krd krk kro kse kut kwa kyl lak lat lav lez luv mac mak mal map may meh mna mny mss nbd ndy nez ngi nic nko orh pai ppi prs qim san shk sla snt squ sup swa tab tag tel tha tiw tli tms tol tuk una urk usa wat wlf wra yag yaq yel yid yim yna yor yur zqc zul,114,76475,0.0014906832
143E,Preverbal Negative Morphemes,,143,Matthew S. Dryer. 2013. Order of Negative Morpheme and Verb. In: Dryer; Matthew S. & Haspelmath; Martin (eds.) 2013. The World Atlas of Language Structures Online. Leipzig: Max Planck Institute for Evolutionary Anthropology. (Available online at https://wals.info/chapter/143),1,abi abn abu ace acg acl acm aco adg agc agd agh ain ajg akh ala alb all als alw amb ame aml amn amo ams amx anj any aoj apu apw arg arj aro arp asy ata au awa awp aym baa bab bac bae baf bai baj bam bao baq bar bbf bbw bch bco bdm bfg bgo bho bid bii bil bkr blr blt bmb bmz bni bnn bnu bob bod boi bok bra bre brf bri brp bsq btk bto bua bug bul bun buw buy bvi bwc cah cai cak cax cea cem cha chc chd che chj chk chq chr chx ckl cle cmh cmn cmy cnt coc coo cos cpy cre crn crt cso ctl cui cup cya dag dan dga dgb dgr dha dhw did din diy dja dji djm djn djp dma dmk doy dre dsh dua dut dyi ebi eip eka ene eng eno erk est eud eve evn ewe ewo fij fin fon fre fut fye gaa gae gap gav gbb gds gel geo ger ggu ghr gir gmw goa gok goo grb grf grj grk grr grs gua gud gug guh guj guu gwa hai hak hal han hau haw hay heb hei hil hin hlp hlu hoa hop htc huc hun hup hve iaa iba ice idn ido ifm ifu ign ik imo ina ind inn iqu iri ita ite izi jak jaq jlu jng joh juh kad kae kan kbl kch kdz ket kfe khm khn khr khs kio kir kis kiw kkt kla klm kls klv klw kmk kms kmu kmw knb knc kni knk knn koe koi kom kop kor kos krb kre krj krk kro ksa kse ksg ksn ktc ktl kty kum kuo kut kwa kwb kwn kwo kws kwt kya kyq kzy lac lah lal lan lao lar ldu lgu lho lic lis lmu lou lui luo mae mai maj mak mal mam man mao mau maw mbe mbi mbt mcd mch mco mde mdl mdm men mer mga mgg mgi mgk mhu mie min mir miy mka mkg mkj mkl mku mlk mme mmn mna mnd mni mnm mno mns mnt mny moe mog mok mom mon moo mos mov mpa mpo mrd mrh mri mrl mro mrq mrr mrt mru mrw msk msn msq mss mtu mum mun mup mur mus mut mwb mwo mxc mxj mxo mxp myi nab nag nah naj nak nal nar nav nax nbr nca ncm ndj ndo ndr ndy neh nev nez nga ngd ngi ngj ngk ngu ngw nha nhh nhm nht nia nif niu nke nkk nne non nor nsg nti ntu nue nug nun nyi nyk nyn nyr nyu oir oji oks omi one ono ood oro orw oss otm otr paa pai pal pan par pau pba per pip pis pkn plg plh pnn pno pnu poh pol por ppi psm pso pul pun pur qhu qim qui qum rag ram rap raw res rik rom rot rov rpa ruk run rus rwa rwe sam sap scr sed see ses shl shp shu sid sil sir sis siu skw slb slo sml sna sng snn sno so sob som son spa squ src srd sre ssa sta sti stl stn sud sue sun sup svs swe tac taf tag tah tak tam tau taw tbo tbt tbx tce tee ten teo tep ter tes tgh tgk tgo tha tho thu thy tid tim tin tiw tja tke tkl tla tli tmm tmn tmo tmr tnc tng tnn tno tny tol tou tpa tpn tri trr tsg tsh tsi tsk tsn ttn ttu tuk tus tvl twe tye tzo tzu udh ukr uli una ung urd url urt uru usa vai vie wag wah wak wal wam war wat wch wed wel wem wic wik win wiy wlf wlm wlw wmu woi wol wor wrb wrd wrg wrk wrl wsk wya xam xar xbi xns yag yap yaq yei yi yid yin yiw ylm yng yok yor yuc yuk yur yuw ywl ywr zai zar zch zpr zqo zqs zun zzo,682,76475,0.008917947
114A,Subtypes of Asymmetric Standard Negation,,114,Matti Miestamo. 2013. Subtypes of Asymmetric Standard Negation. In: Dryer; Matthew S. & Haspelmath; Martin (eds.) 2013. The World Atlas of Language Structures Online. Leipzig: Max Planck Institute for Evolutionary Anthropology. (Available online at https://wals.info/chapter/114),7,adk aeg ain alb apu bir bkr brs bur cba cha ckl cle cnl cnm coo cre crt cyv dag dre dum fre fur geo ger gku gnn goo grk grr hai hui hun ice ind ing ita jeb juh ket kew kfe khm klm klv kmu kob kon kun kut kwz lan lkt mal map mar mas may mku mne mns mos mrl mrt mss mun mxc nca ndy nez ngi nht nti ono pau pba prh prs psj pur qaw rus san sap saw shk siu sla spa tab tag tau tha tol ton tpa tuk tuy ukr una urk vie was wrd wrm yag yaq yid yrr yuc ywl zaz,114,76475,0.0014906832
51A,Position of Case Affixes,,51,Matthew S. Dryer. 2013. Position of Case Affixes. In: Dryer; Matthew S. & Haspelmath; Martin (eds.) 2013. The World Atlas of Language Structures Online. Leipzig: Max Planck Institute for Evolutionary Anthropology. (Available online at https://wals.info/chapter/51),9,abi abk abu abv ace acg acl adg adi aeg agc ain ajg akh akn aln amc ame aml amr anc ang anj anu any aoj api apl apt ara arg arp asm ata au bab bag bai bar baw bco bdu bgo bik bil bir bka bkl bkr bmb bnn bri brp bto bud bul bwc car cba cbo ccm cde cem chq chr chs cle cmy cnl cnm cnt crn cro cya dan day dio doy dre drm duk dum dut egn eng ese ewe ewo fij fri fut gaa gbb gbs git gln gmw gmz goe gok grb gua gud gul hal har hat hau haw hix hna hoa htc hve iaa iba ind irq irr irx ita izi jak jin jmo jng juh juk kaa kar kbw kch kdz kel kfe khm kho khs kis kkt kkv kkw klq klv kmb kmj kmn kmu kmz kni knk kob koe kom kon kos krb krd kre kri krr kse ksg ktc ktl kuo kut kyl laf lah lai lal lan lao lar ldu lel len lep lew lgt lgu lis lkt llm lmg lmh lmp lnd lon lug luo mad mae mak mam man mao mau mbm mbt mcv mde mdg mds mea meh mek mga mgu mie min miy mka mkj mku mlg mlu mmn mna mnd mng mok mon mou mpr mrg mru msk mtu mum mun mup mwb mxc mxj mxo mxp nak nav nca ndy nev ngd ngz nht niu nko nmb noo nsg nti nua nun nup nwd nza nze obg obo olo ood oro osa paa pai pal pam paw per pga pip plh plk pms pnu poh pok por prs psw pum qum ram rap ras raw rot ruk rum run saa sah sam san sed ser sht sil sim sio sis sla slb sml snt sob som son spa src sti sul sun sup swe syu tab tac tah taj taw tbo tbu teo ter tgh tgk tgr tha tia tid tim tin tir tiw tla tmg tnc tng tnn tob tot trb tri tte ttn tuk tvl tzu uld uli una urd url urn urt vai vie wal war wch wel wlf wlo wma wog wol wsk xar xas xav yap yor yul zai zhn zzo,379,76475,0.004955868
97A,Relationship between the Order of Object and Verb and the Order of Adjective and Noun,,97,Matthew S. Dryer. 2013. Relationship between the Order of Object and Verb and the Order of Adjective and Noun. In: Dryer; Matthew S. & Haspelmath; Martin (eds.) 2013. The World Atlas of Language Structures Online. Leipzig: Max Planck Institute for Evolutionary Anthropology. (Available online at https://wals.info/chapter/97),4,aab abu acg acl adi adz aeg agb agh akn alb alk aln ama aml amo amq amr ams anc ane anj anu aoj arg arj aro arq asy au ayi ayo ayw bab bae baf bag baj baq bar bas bbl bch bdu ber bfg bia bid bik bir bkr bku ble blu blz bma bni bnk bnn bra bre brf brn bsh bto bub bud bum buu bvi bwc cax ccm cem cga chq chr chw cic cle cme coc cop cor cpl crn cso ctl cya day dga dgb did dio dma don doy dre dua duk ega egn eno erk err ewe ewo fij fni fon fre fua fut fye ga gae gel gjj gla gnd goa goe grb grf grr gto gua gul guw hal hat haw hdi heb heh hem hna hnd hoa hol huc hya iba ifm igb ige igs ik ila ind iqu iri irr ita jab jar jmo juh juk kam kar kau kba kbl kbw kby kch kdz kel ker kfe kga kgr khm khs kik kin kir kje kkt kkv klv kmj kmu koe kom kon kos kpw krb kri kro ksg ksn ktc kte ktl kuo kwa kwn kwy kyl laa lab lag lan lao lbu ldo leb lel len let lew lgi lgu lic lin llm lmg lmh lmp lon lou luc luo luv maa mae mal mao mas may mba mbe mbi mbl mbm mbr mbt mby mda mdg mds mdw mea mee meh mga mgk mgo mgu mie miy mkd mkz mla mlg mlm mlu mmb mmv mna mng mof mok mon moo mor mpo mpr mpu mrg mrl mro mrq mrt msk msm mtb mua mum mup mur mwe mwo mxc mxe mxj mxo mxp mxy myn mzc nak nal nan nau ncm ndb ndi ndo ndr ndt ndu neh ngd ngm ngo ngu ngz nhh nhm nht nia nif niu nkn nko nnc non noo nse nto nua nun nup nym olo otr pai pam pat per pga pkt plg plh plk pms png pnu poh por pre psw pul pur rag rap rga rny rom rot rov rru rsu sah sak sam sap sea seb sed ses sgb sgu shl shm shn sht sim sio sis sku sle sml so sob spa srd sre sti sud sul sun swa tab taf tah tat tbo tbw ten teo ter tes tgk tgn tha tia tid tim tlp tmm tmn tmr tna tne tng tnk tno toz tpr tps tri tsg tsk ttd ttn tuk tum uld uli ura url urt ven vie vnm wal wch wel wlf wlo wma wol wrk wrm wth xam xbi xho xoo yag yao yap yay yor yul zai zap zul zya zzo,456,76475,0.0059627327
42A,Pronominal and Adnominal Demonstratives,,42,Holger Diessel. 2013. Pronominal and Adnominal Demonstratives. In: Dryer; Matthew S. & Haspelmath; Martin (eds.) 2013. The World Atlas of Language Structures Online. Leipzig: Max Planck Institute for Evolutionary Anthropology. (Available online at https://wals.info/chapter/42),1,abk abn ace aco aeg afr ala aly ame amp ao apl apu arp bab brs bsq cha chk cmn cnl cnt cre cub cze djr don dre drg dyi egn eng eve ewo fij fin fut ger grk grw guu hau haw heb hix hun imo ind inr iri ita kam kas kay ker kfe khs kio kis klm klv koa kob kos krg kro krr kse kut kwm lat lit lkt mac mak mal mao mar mau may mei mhi miy mlt mnd moj mrt msh mss nav nez ngi ngl nko nku nti nug nun ond orh pai pan pau pip pkn prh psm put qhu rap ret rus sam sla sml spa sup swa swe tag tiw tru tsh tuk tus tvl tzu urd uri urk ute wam wat wic wrd wrg wrk yag yim ynk yor yus,143,76475,0.0018698921
58A,Obligatory Possessive Inflection,,58,Balthasar Bickel; Johanna Nichols. 2013. Obligatory Possessive Inflection. In: Dryer; Matthew S. & Haspelmath; Martin (eds.) 2013. The World Atlas of Language Structures Online. Leipzig: Max Planck Institute for Evolutionary Anthropology. (Available online at https://wals.info/chapter/58),2,abk aeg ain ala alw ame amh amp ane apu arm arp awp awt aym baa bag bej bma boa brh brk brm brr bsq buu bzi cha chi chk chy cyv dag dig diy diz djp dre dum dyi eng ewe fij fin fre fua fur gbb geo ger gmz goo grb grk grr grw gua hau heb hin hua hun hve iau ijo ik imo ind ing jak jpn juh kat kay kch ket kew kha khs kim kio kln knd knk knm knp knr knu kob kor kri kro kzy lan lav lda lez lkt lug luv maa mal mao map mar mau may mdk mei mlk mnd mot mpa mrg mrh mrt mss mto mxc myi nah nai nan nar nbd nca ngi nim nkk ntu nug nyn ond orh ori otm pai pau pnr poh prh prs pso qim ram rap rus sah sam san siu sla snm snt spa squ sue sul sup swa syu tag tau taw ter tha tht tib tkl tlf tli ton tru tuk tur tuv uhi ung vie war was wem wic wra wrl wrn wrs wry wsk yag yaq yes yim yko yli yor yuc yur zqc zul,201,76475,0.00262831
109A,Applicative Constructions,,109,Maria Polinsky. 2013. Applicative Constructions. In: Dryer; Matthew S. & Haspelmath; Martin (eds.) 2013. The World Atlas of Language Structures Online. Leipzig: Max Planck Institute for Evolutionary Anthropology. (Available online at https://wals.info/chapter/109),8,aeg apu arc arm awp bag bma brh brm brs bsq chk cnl dag dji eng eve ewe fin fre gae ger god goo grk gua heb hin hix hun hzb ice ing irq jpn kas kay ket kfe kgz kha khk khs kio klv koa kob kol kor lak lat lav lez mac mak mao map mau mnd mrl mrt mxc myi ndy ngi niv orh otm pan pmc pms prh prs qim ram rap rus san sla snm spa sue sup tha tml tsz tur tvl ukr uzb vie war wch wra wrd yaz yor ypk yur,100,76475,0.0013076168
