parameter_id,parameter_name,parameter_description,chapter_id,chapter_citation,value,same_value_language_ids,value_language_count,language_count_total,count_ratio
78A,Coding of Evidentiality,,78,Ferdinand de Haan. 2013. Coding of Evidentiality. In: Dryer; Matthew S. & Haspelmath; Martin (eds.) 2013. The World Atlas of Language Structures Online. Leipzig: Max Planck Institute for Evolutionary Anthropology. (Available online at https://wals.info/chapter/78),1,abi aeg agr agt ala alw ame arp awp baa baw bdk beb bkr bla bre brh brm bse bur can cax chk chr cjo ckl cle cmh cnl crt cso cyv dag die dio djp dre dyi eng ewe fij for fur grb grk gum guu hau heb hin hmi hun igb ign imo ind iri irq ite juh ker ket kfe khl khm kho khs kkv kls klv kmu knm knr kob kol kon kpm krb kro kse kut lak lan lav lep luv mab mac mal mao map mau may mch mku mnd mny mov mrl mse mun mxc mxt mxz nbd ndy nez nhh nko nmp nti nug nya oji orh pem pip plk pms poh ppi qaw ram rap rom rus san say sba sel siu slp snt spa sre sup swa tab tau tha thk til tiw tli tlp tmc tnb toq trg tsm tuk tus tws txj uhi una ung usa vie wam war wat wch wiy wol wrd wrg wrk wyn yag yid yim yor yuc yuk yur ywl yyg zul zun,181,76475,0.0023667866
102A,Verbal Person Marking,,102,Anna Siewierska. 2013. Verbal Person Marking. In: Dryer; Matthew S. & Haspelmath; Martin (eds.) 2013. The World Atlas of Language Structures Online. Leipzig: Max Planck Institute for Evolutionary Anthropology. (Available online at https://wals.info/chapter/102),1,abn abu adz ana awt bab bam bar bnj bri brm bro chr dga dre epe gar god grb gud guu hai hau hmr igb imo ing jpn juh kay kch kha khm klk kmu kor kro kse kuk kyl lad lah lep lez mal mao mcr mde mei mlm mnd mrt mum nbr ndy niv nup pai pso qaw rap sam san saw shk snm srm sun sup tag tha uhi vie wap wik xok yaq yes yid yor zun,82,76475,0.0010722459
92A,Position of Polar Question Particles,,92,Matthew S. Dryer. 2013. Position of Polar Question Particles. In: Dryer; Matthew S. & Haspelmath; Martin (eds.) 2013. The World Atlas of Language Structures Online. Leipzig: Max Planck Institute for Evolutionary Anthropology. (Available online at https://wals.info/chapter/92),4,bsq mbi niu sed som tbo tin,8,76475,0.00010460935
22A,Inflectional Synthesis of the Verb,,22,Balthasar Bickel; Johanna Nichols. 2013. Inflectional Synthesis of the Verb. In: Dryer; Matthew S. & Haspelmath; Martin (eds.) 2013. The World Atlas of Language Structures Online. Leipzig: Max Planck Institute for Evolutionary Anthropology. (Available online at https://wals.info/chapter/22),2,arm brh brm eng fin gar ger hat hin kch ket kha kis knd ksg lez mrt ntu ram sup tag tha wch,24,76475,0.00031382806
103A,Third Person Zero of Verbal Person Marking,,103,Anna Siewierska. 2013. Third Person Zero of Verbal Person Marking. In: Dryer; Matthew S. & Haspelmath; Martin (eds.) 2013. The World Atlas of Language Structures Online. Leipzig: Max Planck Institute for Evolutionary Anthropology. (Available online at https://wals.info/chapter/103),1,abn abu adz ana ani awt bab bam bar bnj bri brm bro chr dga don dre epe gar god grb gud guu hai hau hmr hzb igb ijo imo ing jpn juh kay kch ker kha khm kho kis klk kmu kor kro kse kuk kyl lad lah lep lez mal mao mcr mde mei mle mlm mnd mrt mum mup nbr ndy niv noo nup pai pny pso qaw rap sam san saw sel sem shk snm srm sun sup tag tgk tha uhi vie wap wik wra yaq yes yid yor zun,96,76475,0.0012553122
24A,Locus of Marking in Possessive Noun Phrases,,24,Johanna Nichols; Balthasar Bickel. 2013. Locus of Marking in Possessive Noun Phrases. In: Dryer; Matthew S. & Haspelmath; Martin (eds.) 2013. The World Atlas of Language Structures Online. Leipzig: Max Planck Institute for Evolutionary Anthropology. (Available online at https://wals.info/chapter/24),2,ala amb ame amp arp awp awt bbw bej bma brh brm bsq bzi cnl diy djp dyi eng ewe fre fur geo ger goo grb grr hau heb hin ice ik ika ing jel jpn kay kch kew kha kho kim kis kmb knd knm knp knr kor kro lez lug luv mai mao may mei mlk mnd mot mrt mun nah nbd nep ngi ntj ntu nug nyn ori pso pur qim rap rus san shk siu snm spa sue swa tau tha tib ton tru tsh tuk uhi ung win wrl wry yim zul,98,76475,0.0012814646
104A,Order of Person Markers on the Verb,,104,Anna Siewierska. 2013. Order of Person Markers on the Verb. In: Dryer; Matthew S. & Haspelmath; Martin (eds.) 2013. The World Atlas of Language Structures Online. Leipzig: Max Planck Institute for Evolutionary Anthropology. (Available online at https://wals.info/chapter/104),1,abn abu adz ana ani anj arm ata awp awt bab bam bar bkr bnj brh bri brm brn bro brs bya cap cav cha chr cle cnl cop cpn cri cub dga dgr diz don dre dum dut eng epe eve fin fre fur gar ger god grb gud guu hai hat hau heb hin hmr hmu hzb igb ijo imo ind ing iqu iri irq ita jpn juh kay kch ker kew kgu kha khm kho khs kio kis klk kmu kna knd kob kor kro kse kuk kyl lad lah lak lat lep lez mal mao may mcr mde mei mis mle mlm mnd mne mrt mum mup mxc nad nai nak nbd nbr ndy niv noo ntu nup nuu orh pai pau plk pny pol pso qaw ram rap rem rus sam san saw sel sem shk sml snm so srm sue sun sup syu tab tag tgk tha tid tin tir tla tmr tms trb tri tru tso tur udh uhi urk vie wao wap wbn wel wik win wma wra wsk xok yap yaq yaw yes yid yko yor zun,187,76475,0.0024452435
70A,The Morphological Imperative,,70,Johan van der Auwera; Ludo Lejeune (Umarani Pappuswamy; Valentin Goussev). 2013. The Morphological Imperative. In: Dryer; Matthew S. & Haspelmath; Martin (eds.) 2013. The World Atlas of Language Structures Online. Leipzig: Max Planck Institute for Evolutionary Anthropology. (Available online at https://wals.info/chapter/70),5,abu ace ame anu apa ark avo bag baw bhu bir brm brr chk chr cnt dio djp don dre egn eng ewe fij fue fur gbk geo gll goo gwa hat haw hay hmd hmr hun iaa ika ind iqu jar juh kam kdw kei ker khm kho kim klv kmu kpe krn kwa kyl lkt lnd lon mad mao may mbo mdg mku mnd mnm mok mon mrl mul mum muu mwo mxy nav nca ndy nel ngl nim nug nun ong pal pec plh pno prh rap san sap sko sla slb sml snm sva tab tha tin tli tno tot tri tru ttn txj uma url vag vie wam war wll wrm yag yap ykm yor zun,122,76475,0.0015952926
86A,Order of Genitive and Noun,,86,Matthew S. Dryer. 2013. Order of Genitive and Noun. In: Dryer; Matthew S. & Haspelmath; Martin (eds.) 2013. The World Atlas of Language Structures Online. Leipzig: Max Planck Institute for Evolutionary Anthropology. (Available online at https://wals.info/chapter/86),1,aar aba abk abu abv acg acn aco acu adg adi adk adn adz aga agm ain akh akn ala all aln als amb amc ame amh amm amn amq amt amx ana ang ani ano anu ao api apl apt apu ara arc ari arm arw asm ass ath atk ava awa awi awp awt ayi aym ayo ayr aze baa bae bai bam baw bbw bdm bej bel bho bhu bii bik bil bin bio bkt bla bln blx bmb bnb bod bok bon bri brm brs bry bsk bsq bur bus but buu bya cah can car cas cav cax cay cbo cct cde chc che chg chh chi chk chn chs chv cln cmh cml cmn cmr cnl cnm cnt coa coc cpn cpy cro cti ctm ctw cub cup dag dan daw dds der des dga dgb dgr dha dhb dhi dhm die dig diy djn dlm dmi dni dom doy drg drm dsh dul dum dun dyi edo ega eip emb eme epe ese est eud eve ewe fas fin for fqs ful fur ga gam gan gap gar gav gds geo gjj gln gmw gnn god gon grb grj grr grw gua gur gwa gyc hai har hat hay hhu hid hin hix hma ho hop hpd hua huc hui hum hun hup hzb iau idn ijo ika imo ina ing iqu irr irx iwa jab jaq jel jiv jms jng jpn juh jva kaa kab kae kas kay kbt kbw kby kch kem ket kew kfe kgu kgy kha khd khg khi khl kho khw kim kio kir kiw kje kkp kkq kku kkv kla klg kll klm klq klr klv kma kmb kmh kmk kmo kmp kms kmz knb knd kng kni knm knn kno knw knz koa kob kok kol kop kor koy kpe kpw kqq krc krk krn krw kry krz ksa kse ksg kta kti kty kum kuv kwo kwt kwz kxo kyl kyn kyr kyz kzy lab lad lah lai lal lat lav ldu lep let lez lgt lim lis lit llm lmn lng lot lug lui lul mac mag man map mar mau maw mba mbo mcc mco mde mdm mdn mea mei mek men mer mey mgg mhi mie mii mik mis miz mka mke mkg mkl mku mlm mme mnd mne mni mno mns mnv mny moh mom moo mor mos mot mpr mpt mrd mri mrr mru mrw msc msg msn mts mtu mun mut mxx mym myr nab nad nam nar nav nbd nbr ncm nep nev new ney nez ngi ngt nis niv nkn nku nma nnk noc nph nrg nsn nti ntj ntu nua nwd nyi oji oks omh omi ong ord ork oro ory osa oss owi pae pan pat pau pba pdp pia pir pis pit plh plk pme pmn pno pnu pnx pok ppc ppi pra prh psh pso ptt pul pum pun pwn qaf qaw qhu qia qim ral ram rao raw rem res ret rgc rum run rut rwe sah sar sav sdw sec sem ser sgb she shi shk sia sid sin sio skk sko skp sla slb sle slp sme smn sna sng snm sno snt sob sod src srn sro sta stl sud sue sug suk sup sus svs swe tab tac tak tam tar tau taw tba tbt tdi tel tgl tgn thk thn tho thu tib tid tir tis tiw tja tkl tkm tlf tli tlo tls tma tml tmo tnb tnc ton tou tpn tpt trb trr trt tru trw tsf tsh tsm tsz ttd tte ttn tts ttu tul tun tur tuv tvo twe tye uby udh udm uhi uli una urd urk urn usa usr ute uzb vai wah wai wak wao wap was wat way wbn wch wed wem wik win wiy wly wma wme wmu wna wog woi wom wra wrm wrw wsk wwa xam xas xav xer xoo yag yal yaq yar ybi ycn yei yel ygr yid yim yin yiw yko ykt yqy yrm ytu yuc yuk yur yus yyg zar zay zch zpr zqc zqs zun,685,76475,0.008957176
90A,Order of Relative Clause and Noun,,90,Matthew S. Dryer. 2013. Order of Relative Clause and Noun. In: Dryer; Matthew S. & Haspelmath; Martin (eds.) 2013. The World Atlas of Language Structures Online. Leipzig: Max Planck Institute for Evolutionary Anthropology. (Available online at https://wals.info/chapter/90),1,aar abi abo abu abv ace acg acl adi adz aeg agm ajg alb alk all aly ame aml amo amp amq amr ana anc ang anj anu any aoj apu apw arg arj aro arq arw asy awe baa bab bag baj baq bar bbl bbu bco bej ber bfg bfi bgr bid bii bik bio bir bka bkr bku blr bma bmb bni bob bok bre brf brh brn brp brs bsh bsr btk bto bud bug bul bum bus buu bvi bwc cah cak cav cax ccm cde ceb cem cha chj chp chq chr chw cic cld cle cmh cmn cmy cnm coo cop cor cpl crn cso ctl ctm cub cya cze dag dan day ddj deg des did din dio djm dni dom doy dre dsh duk dut dyi efi egn emb eme eng eno erk err est eud ewe ewo fij fin fon fre fri fua fur fut fye gae gap gbb gel geo ger ghb gmz gnb gnd gok grb grf grk grw gud gul gum gwa hal hat hau haw hdi heb hei hid hix hna hnd hoa hol htc huc hui hup hve hwr hya iaa iau iba ice idn ifu igb ign igs ik ila ind iri irq isa ita izi jab jak jeb jmo juh juk kam kan kar kau kay kbl kbt kbw kch kel ken ker kfe kgr khl khm khs kik kir kis kje kkt klm klr klv klw kma kmj knc kni knk knm knr knz koe kos kpm kpw krb krd kre kri kro krr kse ksg ktc kte ktl kuo kwn kws kwz kyl kyo kyq lab lan lao lat lbu lda leg lel len let lew lgt lgu lit lmg lmh lmp lmu lnd lon lug lui luo luv maa mab mad maj mal mam mao mas mau maw may mbm mbr mby mco mcv mdg mdo mds mea mee meh men mga mgo mgq mgu min miy mkj mlg mlu mmb mmn mna mng mnm mno moa mof mok mos mot mou mpr mpu mrg mrl mro mrq msk msl msm mud mum mup mur mus mut mwo mxc mxe mxo mxp mxy myg myi myn naj nal nan nar nat nbd ncm ndo ndr ndt ndy neh ney nez ngl ngm ngo ngz nhh nhm nht nia nif niu nkn nko nku non noo nor nrg nua nue nug nun nup nza obg obo oji olo ood orh orw otm paa pai pal par pat pau pba per pga pip pkt plg plh pms pno pnx pod poh pol por pre prs psh psw ptt pul pur qum rag rap rny rom ron rot rov rsu run rus rwe sah sak sam san sdw sea sed see ses sgb sgu shb shn sht sio sir sis skr slb sle sml snh so sob som spa src srd sre sro sud sul sun swa swe swt tab taf tag tah tai taj tak tar tat taw tbo tbt tbu tce tee ten teo tep ter tes tgk tgn tha thy tid tim tin tiw tke tla tlp tls tmm tmr tna tne tng tnk tnn tno tny toz tpn tpt trb tri trm tsi tsk ttd ttn tun tvl txj tzu ukr uld uli ung url urt ute vaf vie vnm wah wak wal war wch wel wic wlf wlo wma wol xbi xho xoo yag yap yaq yor yuc yuk yul zag zai zch zhn zul zzo,579,76475,0.0075711017
112A,Negative Morphemes,,112,Matthew S. Dryer. 2013. Negative Morphemes. In: Dryer; Matthew S. & Haspelmath; Martin (eds.) 2013. The World Atlas of Language Structures Online. Leipzig: Max Planck Institute for Evolutionary Anthropology. (Available online at https://wals.info/chapter/112),4,akh anc bai baw bkr bus bvi chr chs coc dre fon goe hma htc iaa iba ind jng juh juk kch khs kim kir kkt krb krn kyl lai lal lao lgu lis lug mae mao mie min mka mkj mmb mon mrq mup ndy ngd nia niu nun nup pnu pun rap sed sis skk sti sun tgk tin tla tng uli url vie war wlf wol xar yor zhn,73,76475,0.0009545603
83A,Order of Object and Verb,,83,Matthew S. Dryer. 2013. Order of Object and Verb. In: Dryer; Matthew S. & Haspelmath; Martin (eds.) 2013. The World Atlas of Language Structures Online. Leipzig: Max Planck Institute for Evolutionary Anthropology. (Available online at https://wals.info/chapter/83),2,aab abi abu acg acl acm adi adz aeg agb agc agd agh aja akn alb alk aln als ama ami aml amo amq amr ams anc ane anj ann anu aoj ara arg ari arj aro arp arq asy ata au avk ayi ayo ayr ayw bab bae baf bag bai baj bak baq bar bas bbl bbu bch bco bdu ber bfg bgo bgr bgs bgz bid big bii bik bil bir bka bkl bkr bku bla ble blg blu blz bma bmb bni bnk bnn bob bol bra bre brf brn brq brr bse bsh btk bto bub bud bug bul bum buu buy bvi bwc cak cax cba ccm cea ceb cem cga cha chj chq chr chw chx cic ckl cle cme cmx cmy cnt coc coe cop cor cos cpl cqt cre crn cso ctl cua cuc cya cyv cze day deg dga dgb did dio dma dok dom don doy dre dsh dua duk ebi ega egn eko eng eno erk err esm est ewe ewo fij fin fon fre fua fut fye ga gae gbb gbs gel gir giz gjj gla gmz gnb gnd goa goe gok grb grf grk grr gto gua gud gul guw gwo hak hal hat hau haw hdi heb heh hei hem hil hlu hna hnd hoa hol htc huc hun hve hya iaa iba ice ifm ifu igb ige ign igs ik ila ilo ind iqu iri irr ita ito iwa ixi izi jab jak jar jmo juh juk kad kam kan kar kas kau kba kbl kbw kby kch kdw kdz kel ken ker kfe kga kgr khm khn khs kik kil kin kir kje kkt kkv kla kls klv kmj kmu kni knk koe kom kon kos kpm kpw krb kre kri kro ksg ksm ksn ktc kte ktl kuo kut kwa kwk kwn kwy kyl kyq kzy laa lab lac lag lan lao lat lbu ldo leb leg lel len let lew lgi lgu lic lil lin lit llm lmg lmh lmp lmu lnd lon lou luc luo luv ma maa mae maj mak mal mam mao map mas mau may mba mbe mbi mbl mbm mbr mbt mby mcd mch mcv mda mdg mdm mdo mds mdw mea mee meh mga mgk mgo mgu mhu mie miy mkd mkq mkz mla mlg mlm mlu mmb mmn mmv mna mnd mng moe mof mok mon moo mor mos mov mpo mpr mpu mrg mrl mro mrq mrt msk msm msq mtb mua mum mup mur mus mut mwb mwe mwo mxc mxe mxj mxo mxp mxy myg myn mzc nak nal nan nau nbe nbm nca ncm ndb ndi ndo ndr ndt ndu ndy neh ngd ngm ngo ngu ngw ngz nhh nhm nhn nht nia nif niu nke nkn nko nnc nne nng non noo nor nse nsg nto nua nun nup nuu nym nyn nza obg obo ocu oji olo ond one ood ora otm otr paa pai pal pam pat per pga pip pkn pkt plg plh plk pms png pnn pnu pod pog poh pol por pre psm psw pul pur qui qum rag rap rga rim rny rom ron rot rov rru rsu ruk rus rwe sah sak sal sam san sap scr sea seb sed see ses sgb sgl sgu sha shl shm shn shp shs sht shu sim sio sir sis siu skm sku sle slo sml smp sno so sob son spa squ srd sre ssa sti stn sud sul sun swa swe swt tab taf tag tah tai tal tan tas tat tbo tbw tee ten teo tep ter tes tet tgh tgk tgn tha tho tia tid tim tin tiv tiw tke tki tla tlp tmm tmn tmr tna tne tng tnk tno tob toz tpn tpr tps tri trm tsg tsi tsk tsr ttd ttn tuk tum txj tzo tzu ukr uld uli ura url urt ven vie vnm wal wam war wch wec wel wem wlf wlo wma wol wrb wrk wrm wrn wry wth wwa wya xam xar xbi xho xoo yag yao yap yay ycn yin yng yok yor yul ywl zai zan zap zch zhn zpr zqc zqo zqs zul zya zzo,705,76475,0.009218699
27A,Reduplication,,27,Carl Rubino. 2013. Reduplication. In: Dryer; Matthew S. & Haspelmath; Martin (eds.) 2013. The World Atlas of Language Structures Online. Leipzig: Max Planck Institute for Evolutionary Anthropology. (Available online at https://wals.info/chapter/27),1,abk abm aeg agc akn ala alw aly ame amh amp api apl arp asm ass asy aym baj bal bco bej bis bkl blq blx bma bnj bsm bsq buw cah cax cba cck cct cha chh chk chl chr cin cla cmk cmn cmx cnl coe col coo cos cre cuu cwe cyv dag dah dga dhm diy dji djp djr dre dri dyi epe ewe fox fua gar geo goo gum ham hau haw heb hil hin hlp hlu hop hrr htc hui hun hzb iaa igb ilo itz jak jaq kay kha khm kho khs kik kjn kkv klm kls klv kma knd knr koa kol koo kor koy kpm krb krk krw kuo kwk kya lac lav lil lkt lmp lrd lui lus luv maj mal mao mar mau maw may mcs mdr mei men min miy mki mks mlk mmb mnd mnm mok moo mos mpa mra mrq msh muh myi nak nau ndb nde ndy nez ngi ngk ngl nhc nia nkr nnc nug nuu nyn ojs oka olo ood orh oro pac pai pan pau pgl pip pms pnn poh prs psh pul put qay qui rit rmb rnd rny rot ruk sam sed ses shp shu siu sml som spo squ srn sro sry sst stl sun swa swi swt tag tbb tgk tgr tha tho thw tid tig til tim tin tiw tja tkm tlp tml tmr tng toj tru tsg tsi tso tuk tur tuv twa tze tzo uhi ung uyg vie war was wat wik wmu wrd wrk wrl wry wsk wwy xho yaq yct yid yim yin yir yny yor yuc yuk yur ywl,278,76475,0.0036351748
125A,Purpose Clauses,,125,Sonia Cristofaro. 2013. Purpose Clauses. In: Dryer; Matthew S. & Haspelmath; Martin (eds.) 2013. The World Atlas of Language Structures Online. Leipzig: Max Planck Institute for Evolutionary Anthropology. (Available online at https://wals.info/chapter/125),1,ace ain arp bkr cle dre fij gua ind juh kay kho klv kmu kor lkt lnd mal may mku mna mnd mxc nun pai saw sla sml som tab tin tpi vie war wma yaq yor,38,76475,0.0004968944
143A,Order of Negative Morpheme and Verb,,143,Matthew S. Dryer. 2013. Order of Negative Morpheme and Verb. In: Dryer; Matthew S. & Haspelmath; Martin (eds.) 2013. The World Atlas of Language Structures Online. Leipzig: Max Planck Institute for Evolutionary Anthropology. (Available online at https://wals.info/chapter/143),1,abi abn ace acg acm agc agd ain akh ala alb all als alw ams anj any apu arg arj aro asy ata awa aym baa bac bae bai baj bam bao baq bar bbw bch bco bdm bfg bho bil bkr blr bmz bni bnn bnu bra brf bri brp bsq btk bto bua bug bul bun buw bvi bwc cah cax cea cem cha chc chd che chk chq chx ckl cle cmn cmy cnt coc coo cos cpy cre crn crt cso cup cya dag dan dga dgb dgr dhw did din diy dja dji djm djn djp dmk dre dua dyi ebi ene eng eno est eud fij fin fon fut gaa gae gap gav gds gel geo ggu ghr gir gmw goa gok goo grb grf grj grk grr grs gud guj guu hak han haw hay heb hei hil hin hlu hoa hop htc huc hun hup hve iaa iba idn ifu ign ik imo ind inn iqu iri ita jak jaq jlu jng joh juh kad kae kan kch kdz ket kfe khm khn khr khs kir kkt kla klm kls klv kms kmu kmw knb knc kni knn koi kom kop kor kos krb krj ksa kse ksn ktc kty kum kuo kut kwa kwb kwn kws kya kyq kzy lac lah lal lan lao lar lgu lic lis lui luo mae mai maj mak mal mam man mao mau maw mbi mcd mch mco mde mdl mdm mer mgg mgi mhu mie mir mkg mkj mkl mlk mme mmn mna mnd mni mnm mno mns mnt mny moe mog mok mon mos mov mpa mpo mrd mrh mri mrl mro mrq mrr mrt mru mrw msq mss mun mur mus mut mwb mxc mxj mxo mxp myi nab nah naj nak nal nar nav nax nbr nca ncm ndj ndo ndr ndy neh nev nez nga ngd ngi ngj ngk ngu ngw nha nhh nhm nht nia nif niu nkk nne nsg nti ntu nue nug nun nyi nyk nyn nyr nyu oir oji oks omi ono ood oss otm pai pal pan par pba pip pkn plg pnn pno pnu poh pol por ppi pul pun pur qim qui qum raw res rik rom rov rpa ruk rus rwa sam sap scr sed see ses shl shp shu sid sil sir sis skw slb slo sml sna sng snn sno so sob som son spa squ src srd sre ssa sta sti stl sud sue sun svs taf tag tah tak tam tau taw tbo tbx tce tee ten tep tes tgh tgk tgo tha tho thy tim tin tiw tke tkl tla tli tmm tmr tng tnn tno tny tol tou tpa tpn tri trr tsg tsn ttn ttu tuk tus tvl twe tzo tzu udh ukr uli una ung urd url uru usa vai vie wag wah wak wal wam war wed wel wem wic wik wlm wlw wmu wol wor wrb wrd wrg wrl wsk xam xar xbi xns yag yap yaq yei yi yid yin yiw ylm yng yok yor yuc yur yuw ywl ywr zai zar zqo zqs zzo,525,76475,0.0068649887
144H,NegSVO Order,,144,Matthew S. Dryer. 2013. Position of Negative Morpheme With Respect to Subject; Object; and Verb. In: Dryer; Matthew S. & Haspelmath; Martin (eds.) 2013. The World Atlas of Language Structures Online. Leipzig: Max Planck Institute for Evolutionary Anthropology. (Available online at https://wals.info/chapter/144),4,aab abu acg adi adz aeg agh aja akn alb alk aln aml amq anc ane anu ara arg arj arm aro arp arq asy au bab bae bag bai bak bar bas bbl bch ber bgo bgr bia bik bir bka bkr bku ble blz bmb bni bnn bob bol bra bre brf brn bsh bud bul bum buy bvi cai cga chr chw cic cmy cnt ctl cze deg dga dgb dgo dio dma doy dsh dua duk dut ebi ega egn eko eng erk err est ewe ewo fin fon fre fua fut ga gbb gbs ger gku gla gmz gnb goe gok grk gua gul gwa gwo hak hal hat hau heb heh hna hnd hol htc huc hun hya iaa ice ige igs ila ind irr ita izi jab jar jmo juh juk kan kar kas kau kba kbw kby kch kdw kel ken ker kfe kga khm khs kik kil kin kir kis kkv kni knk kom kon kos kpw ksg ksn ktl kwa kwy kwz kyl kzy laa lab lag lan lao lat lbu ldo ldu leb leg lel len let lew lgi lgt lic lin lit llm lmh lmp lmu lnd lon lou luc lug luv ma mad mae map mas mau may mba mbe mbm mbr mby mcd mcv mda mdg mdo mea meh mgk mgu mhu miy mkd mkz mlg mlu mmb mmv mna mnd mok mon moo mor mou mpu mrg mro mrt msm mtb mua mum mus mut mwe mwo mxe myg nak nal nbm ncm ndb ndt ndu ndy neh ngm ngo ngu ngz nhm nke nkn nko nne noo nor nse nto nua nun nup nza obg obo ocu olo one paa pal pat per pga plg plh pms png pog poh pol por pre psw pul rim rny rom ron rot rru rsu rus sah sak san sap sed sgb sgl sgu shl shm shn sht sio sir sis skm slo sob spa srd sre ssa sti stn sul sun swa swe tab taf tal tan tbw tee teo ter tet tgk tha tid tin tiv tiw tki tmm tmr tne tob ton toz tpr tru ttn twn tzu ukr uld uli url urt ven vie vnm wal wch wlf wma wol wrk wrm wrn xar xbi xho yao yin yng yor yul zan zqs zul,392,76475,0.0051258584
77A,Semantic Distinctions of Evidentiality,,77,Ferdinand de Haan. 2013. Semantic Distinctions of Evidentiality. In: Dryer; Matthew S. & Haspelmath; Martin (eds.) 2013. The World Atlas of Language Structures Online. Leipzig: Max Planck Institute for Evolutionary Anthropology. (Available online at https://wals.info/chapter/77),1,abi aeg agr agt ala alw ame arp awp baa baw bdk beb bkr bla bre brh brm bse bur can cax chk chr cjo ckl cle cmh cnl crt cso cyv dag die dio djp dre dyi eng ewe fij for fur grb grk gum guu hau heb hin hmi hun igb ign imo ind iri irq ite juh ker ket kfe khl khm kho khs kkv kls klv kmu knm knr kob kol kon kpm krb kro kse kut lak lan lav lep luv mab mac mal mao map mau may mch mku mnd mny mov mrl mse mun mxc mxt mxz nbd ndy nez nhh nko nmp nti nug nya oji orh pem pip plk pms poh ppi qaw ram rap rom rus san say sba sel siu slp snt spa sre sup swa tab tau tha thk til tiw tli tlp tmc tnb toq trg tsm tuk tus tws txj uhi una ung usa vie wam war wat wch wiy wol wrd wrg wrk wyn yag yid yim yor yuc yuk yur ywl yyg zul zun,181,76475,0.0023667866
6A,Uvular Consonants,,6,Ian Maddieson. 2013. Uvular Consonants. In: Dryer; Matthew S. & Haspelmath; Martin (eds.) 2013. The World Atlas of Language Structures Online. Leipzig: Max Planck Institute for Evolutionary Anthropology. (Available online at https://wals.info/chapter/6),2,abk ani ata awn bma chk die gla ham hmr hop hup irq jaq kal kek ket kgz klm kmp krd kry lah lui mar mgg pai prs qco sel skp som teh tpa tsi wch xoo,38,76475,0.0004968944
69A,Position of Tense-Aspect Affixes,,69,Matthew S. Dryer. 2013. Position of Tense-Aspect Affixes. In: Dryer; Matthew S. & Haspelmath; Martin (eds.) 2013. The World Atlas of Language Structures Online. Leipzig: Max Planck Institute for Evolutionary Anthropology. (Available online at https://wals.info/chapter/69),5,abu ace adg akh aln amq anc anj aro au bai baw bik cem chr chs cnl coc cop cti din dre erk fij fon fut goe gua hat hau hma htc iaa iba irq isa jin jmo jng juh juk kaa kam kbw kch khm kho khr khs kim kir kmu kmz kom kos krn krr kse ksg kut kyl lai lal lao lgu lmh lmp lon lou mae mao may mbr mdl mek mie min miy miz mka mkj mku mlk mmv mng mon mpu mtu mup ndy ngd ngm niu nnc nua nue nun nup plh pnu pok pul pun rap ria saa sah sal san scr shu sio sis skk snm sti sun tah teo ter tgk tha tid tin tla tng tsi ttn tvl uli ung urk url urt vie wal war wiy wlf wma wol wrl xar xav xbi yap yay yor yuk yur zhn,152,76475,0.0019875776
30A,Number of Genders,,30,Greville G. Corbett. 2013. Number of Genders. In: Dryer; Matthew S. & Haspelmath; Martin (eds.) 2013. The World Atlas of Language Structures Online. Leipzig: Max Planck Institute for Evolutionary Anthropology. (Available online at https://wals.info/chapter/30),1,abn aco ain ale ame arm asm awp bag baw bkr brh brm bsq cah car ccp cha chi chk chv cmn cnl cnt coo cyv dag djr dni don epe err eve ewe fij fin geo goo grw gua guu hai hat haw hay hun iaa igb ika imo ind ite jaq kam kay kew kgz kha khk khl khm klv knr koa kob krk kse kut lad lah lan lep lez mak mal mao map mar mei mnd mns mny mok mrl mrt mss nbd ndy nez ngi nht niv ntu ork otm pai pal pil pip pit pmc prs qim ram rap san saw shk sml smt snt srn sue tab tha tho tib tol tot tsh tsi tuk tur tvl uhi una urk usa uzb vie wat wic wra yaq yel yid yko ykt ylb yor ypk yur zqc zun,145,76475,0.0018960445
113A,Symmetric and Asymmetric Standard Negation,,113,Matti Miestamo. 2013. Symmetric and Asymmetric Standard Negation. In: Dryer; Matthew S. & Haspelmath; Martin (eds.) 2013. The World Atlas of Language Structures Online. Leipzig: Max Planck Institute for Evolutionary Anthropology. (Available online at https://wals.info/chapter/113),1,adk aeg ain alb apu bir bkr brs bur cba cha ckl cle cnl cnm coo cre crt cyv dag dre dum fre fur geo ger gku gnn goo grk grr hai hui hun ice ind ing ita jeb juh ket kew kfe khm klm klv kmu kob kon kun kut kwz lan lkt mal map mar mas may mku mne mns mos mrl mrt mss mun mxc nca ndy nez ngi nht nti ono pau pba prh prs psj pur qaw rus san sap saw shk siu sla spa tab tag tau tha tol ton tpa tuk tuy ukr una urk vie was wrd wrm yag yaq yid yrr yuc ywl zaz,114,76475,0.0014906832
