parameter_id,parameter_name,parameter_description,chapter_id,chapter_citation,value,same_value_language_ids,value_language_count,language_count_total,count_ratio
5A,Voicing and Gaps in Plosive Systems,,5,Ian Maddieson. 2013. Voicing and Gaps in Plosive Systems. In: Dryer; Matthew S. & Haspelmath; Martin (eds.) 2013. The World Atlas of Language Structures Online. Leipzig: Max Planck Institute for Evolutionary Anthropology. (Available online at https://wals.info/chapter/5),2,abk adz aik aiz akn akw ala alb ald amh amo anc ani arp awn aze bag baj bam bbf ben bet bir bis bki bkr bno bod brb bre brh bri brm brr bsk bsq bto bul bur cam car cay cha chv cle cof coo cso cti ctl dag dah dan dar ddf der det dgb dgr din dio dnw doy dre dts eja eng epe eve evn ewe fin fre ga gan gar gbb ger grb grk gwa had hba hin hok hun hzb iaa iba igb igs ijo ik ika ind ing ird irq iso iva jeh jng jpn juh kab kad kal kas ked kef ker kfe kgi kgz kha khr kio kiw kkn klm klv kly kmp knd knk koh kom kot koy kpa kpe krd ktk kun kur kwk kzy lad lah lak lam lan lat lep lez lit llm lua lug luo lus mal mba mbm mei mgg mie mla mnc mog mpa mrd mrg mrl mrn mro mui mum mun mya nai nap nax ndt ndy nep new nga ngz nim nis nko nor nti ogb ood orm otm pai pau paw pol prs psh puk pur qui ram res rom rsc ruk rus rut sab san sba scs sdh sdw sml snd snh sor sre srn sue swa tab tag tel ter tib tic tks tlp tmn tmp tok tsg tsi tul tun tur tuv twn tza uzn wao wap wlf wma woi xoo yan yap yey ygr yko ykt ytu yuc yul zan,255,76475,0.003334423
70A,The Morphological Imperative,,70,Johan van der Auwera; Ludo Lejeune (Umarani Pappuswamy; Valentin Goussev). 2013. The Morphological Imperative. In: Dryer; Matthew S. & Haspelmath; Martin (eds.) 2013. The World Atlas of Language Structures Online. Leipzig: Max Planck Institute for Evolutionary Anthropology. (Available online at https://wals.info/chapter/70),5,abu ace ame anu apa ark avo bag baw bhu bir brm brr chk chr cnt dio djp don dre egn eng ewe fij fue fur gbk geo gll goo gwa hat haw hay hmd hmo hun iaa ika ind iqu jar juh kam kdw kei ker khm kho kim klv kmu kpe krn kwa kyl lkt lnd lon mad mao may mbo mdg mku mnd mnm mok mon mrl mul mum muu mwo mxy nav nca ndy nel ngl nim nug nun ong pal pec plh pno prh rap san sap sko sla slb sml snm sva tab tha tin tli tno tot tri tru ttn txj uma url vag vie wam war wll wrm yag yap ykm yor zun,122,76475,0.0015952926
2A,Vowel Quality Inventories,,2,Ian Maddieson. 2013. Vowel Quality Inventories. In: Dryer; Matthew S. & Haspelmath; Martin (eds.) 2013. The World Atlas of Language Structures Online. Leipzig: Max Planck Institute for Evolutionary Anthropology. (Available online at https://wals.info/chapter/2),2,abi ach acm aco aeg aht aik ain ame ani ant ao apu arb arc arm asm ata ava baj baw bee bej ber bis bng bno bod brh bri bsq bto bua bul bur cac cam car cha che chk chp cil cle cmn cof coo cso cti cub cve dad dag dah dar ddf der det dgb die diz eka eve evn fas fij fur fye gar geo ghb gmb goa grk gua gwa had hak hau haw hba hin hix hmo hok hop htc hum hve iba igs ind ing ird irq irx ite ito iwm jak jng jpn jpr juh kad kal kch ked kef kek ker kew kho khr khs kio kiw kkv klv kly kmp knd knk knm koi kot koy kpa krb krk kry kse kty kul kun kur kwa kwk kws lad lam lat lav len lez lit lkk lkt lui luv mak mao map mar mau max may mei mgg mku mlk mnc mnd mne mog mor mov mrd mss mui mum mun mxc mxm mya myi mzc nai nap nar nas ndy nep nez ngz nht nim niv nko nmb nob ntu nun oca ood orh orm paw pec pms pol prs psh psm pso pur qco rap res ror rsc rtk rus rut sba scs sdw seb sha shi shu sin sla slp snc soq sor spa sue svs swa tab tag tam tel ter tgk tgr tic toa tok tol ton tru try tso ttn ttu tuk twn tza umb ung urk usa uzn wah wao wap war wch win wiy wma wmu wra wrd wry xoo yag yan yaq yar yaw yay ycn yct yey ygr yko ytu yuc yur zqc zul zun,287,76475,0.0037528605
71A,The Prohibitive,,71,Johan van der Auwera; Ludo Lejeune (Valentin Goussev). 2013. The Prohibitive. In: Dryer; Matthew S. & Haspelmath; Martin (eds.) 2013. The World Atlas of Language Structures Online. Leipzig: Max Planck Institute for Evolutionary Anthropology. (Available online at https://wals.info/chapter/71),4,acl acu ala ame amh ana apt ars awp bab bam bdk bem ber bhu bri brr buk bul chk cml cmn coi dbd dig dio diz dni dre dyi gar god grb grk grw gua hau heb her hya hzb imo jeb kay ker kfe kil kim kio kiw kkn kmp kms knd knr koa kod koi kow krk kro krq krt kse kui kwa kwk kws kyg lan lav laz lep lez lil lob loz luo luv mab mal mao map mau mbg mcd mei mhi miy mle mlt mme mnm mro msg mun mwe mwo nav nen nga ngi noo ntu oka oss pai pms pnn psm qta ram ret sgu shu squ stn sug swa tah tbu tem teo tiw tml tor tot tsa tuk tun udi una way wch wiy wrg wwr yaq yim yny yuk yus zaz zqc zul,146,76475,0.0019091206
18A,Absence of Common Consonants,,18,Ian Maddieson. 2013. Absence of Common Consonants. In: Dryer; Matthew S. & Haspelmath; Martin (eds.) 2013. The World Atlas of Language Structures Online. Leipzig: Max Planck Institute for Evolutionary Anthropology. (Available online at https://wals.info/chapter/18),1,abi abk abm ach acm aco adz aea aeg agh aht aik ain aiz akn akw ala alb ald amc ame amh amo amu amz ana anc ani ao api apu arb arc arm arp asm ata ava awn awp aym aze bag bai baj bam baw bbf bco bee bej ben ber bet bir bis bki bkr bma bng bod bra brb bre brh bri brm brw bsk bsq bto bul bur cad cah cam car cax cay cck ccp cha che chk chl chq chu chv chw cil cle cmn cnl cnt cof coo cre cso cti ctl cve cyv dad dag dah dan dar ddf det dgb dgr die dio diz dni dnw don doy dre dts dum efi eja eng eve evn ewe ewo fas fef fij fin fre ful fur fuz fye ga gar gbb geo ger ghb gla gmb goa grb grk grw gua gwa had hai hak ham hau hba hin hix hmo hok hop htc hum hun hup hve hzb iaa iba igb ign igs ijo ik ika imo ind ing ird irq irr irx iso ite ito iva iwm jak jaq jav jeb jeh jiv jng jom jpn jpr juh kab kad kal kas kch ked kef kek ker ket kew kfe kgi kgz kha khm kho khr khs kio kiw kkn kkv klm klv kly kmp kmu knd knk knm knr koa kob koh koi kom kor kot koy kpe krd krk kro kry kse ksg kss ktk kty kul kun kur kut kwa kwk kwo kws kyl kzy lad lah lak lam lat lav len lep lez lit lkk lkt llm lu lua lug lui luo lus luv maa mab mak mal mao map mar mau may maz mba mbm mei mgg mie mla mme mnc mnd mne mog mor mov mrd mrg mrl mro mss mtp mui mum mun mxc mxm mya mzc nai nan nap nar nas nav nax nbk ndt ndy nep new nez nga ngi ngz nhn nht nim nis niv nko nkt nmb nnc nob non nor nti ntu nun nuu nyg nyi oca ogb oji ood orh orm otm pac pae pai pau paw pec phl pms poa poh pol prs psh psm pso puk pur qaw qco ram rap res rom ror rsc ruk rus rut sab san sba scs sdh sdw seb sed sel sha shi shk shs shu sin skp sla slp sml snc snd snh snm snt som soq sor spa squ sre srn sue sui sup svs swa tab tac tag tam tas teh tel ter tgk tgr tha tib tic tiw tks tlp tma tmn tmp tne toa tok tol ton tpa tru try tsg tsi tso ttn ttu tug tuk tul tun tur tuv twn tza umb una urk usa uzn vie wap wch win wiy wlf wma wnt woi wps wra wrs wuc xoo yan yap yaq yar yaw yay ycn yct yes yey ygr yko ykt yor ytu yuc yul yur yus zan zqc zul zun,503,76475,0.006577313
48A,Person Marking on Adpositions,,48,Dik Bakker. 2013. Person Marking on Adpositions. In: Dryer; Matthew S. & Haspelmath; Martin (eds.) 2013. The World Atlas of Language Structures Online. Leipzig: Max Planck Institute for Evolutionary Anthropology. (Available online at https://wals.info/chapter/48),1,abn acm apu arp awt bnj cba coo cre cyv gar guu ham hlu jaq kay kgu kio kut kwz mak mar mle mlk mne moh mrt msl mss myi nai nez ngi ngk ngl nmb nug nuu ond pec pny psm qui siu squ tag tap tau tja uhi ung wam wch wic wik win wrd yid ypk yuk zqc zun,63,76475,0.00082379865
44A,Gender Distinctions in Independent Personal Pronouns,,44,Anna Siewierska. 2013. Gender Distinctions in Independent Personal Pronouns. In: Dryer; Matthew S. & Haspelmath; Martin (eds.) 2013. The World Atlas of Language Structures Online. Leipzig: Max Planck Institute for Evolutionary Anthropology. (Available online at https://wals.info/chapter/44),6,abi abn ace acm adz ain ame amu ana anj arm asm ata atk awp aym baa bag bam bar baw ber bkr brh bri bro brr bsq bya cah can cap cav cba cbo cha chk chr cle cmn cmx cnl coo cor cpn cri cyv dag dgr dni don doy eka epe err eve ewe fij fin fur gar geo gmw goo grw gua guu hai hat hin hmo hua hun hzb igb ika imo ind ing iqu jak jaq kay kch ket kew kgu kha khm kio kis kjo kkv klk kna knm knr koa kob kos kpm krb krd krk kse ktl kuk kut kwz kyl lad lah lak lan lep lez lim lkt lrk mab mac mak mal mao map mar mcr mde mei mis miz mlm mna mne moa mrl mrt msl msn mss mum mxc myi nad nai nak nan nbd nbr ndy nez ngi nht niv nti ntu nup nuu nyu ond oss otm pai pal par pec pip pit pms pny pur qaw qim ram rap rem sal sam san saw sel shk siu sla slp sml snm snt so squ srm sue sun syu tab tag tau taw tgk tha tin tja tkl tla tli tmr tms tna tol ton tot tpn trb tri tsi tso tuk tur tzu udh uhi uma una ura urk usa vie wam wap was wbn wch wic wik win wma wra wrd wsk yag yap yaq yel yid yim yko yor ypk yuk yur zqc zsq zun,254,76475,0.0033213468
100A,Alignment of Verbal Person Marking,,100,Anna Siewierska. 2013. Alignment of Verbal Person Marking. In: Dryer; Matthew S. & Haspelmath; Martin (eds.) 2013. The World Atlas of Language Structures Online. Leipzig: Max Planck Institute for Evolutionary Anthropology. (Available online at https://wals.info/chapter/100),1,abn abu adz ana awt bab bam bar bnj bri brm bro chr dga don dre epe gar god grb gud guu hai hau hmo igb imo ing jpn juh kay kch kha khm klk kmu kor kro kse kuk kyl lad lah lep lez mal mao mcr mde mei mle mlm mnd mrt mum nbr ndy niv nup pai pso qaw rap sam san saw shk snm srm sun sup tag tha uhi vie wap wik xok yaq yes yid yor zun,84,76475,0.0010983981
120A,Zero Copula for Predicate Nominals,,120,Leon Stassen. 2013. Zero Copula for Predicate Nominals. In: Dryer; Matthew S. & Haspelmath; Martin (eds.) 2013. The World Atlas of Language Structures Online. Leipzig: Max Planck Institute for Evolutionary Anthropology. (Available online at https://wals.info/chapter/120),1,abk abz acm aco ady ain akn ala alb amh apl arc arm ava awp bab bam bar bej bik bla blc bln blx bre bri brs bsq bto bul bur but cah ccm ccp cct ceb cha chc che chk cmr coo cre cro cso dag dgb din dut eng est ewe fij fin fre gae gar gbb gdi geo god gol grb grk grn grw hau hcr hei hin hui hup hzb iaa ice igb ilo iri jak jpn juh kab kbl ket kho khs kic kio kko kku kls knk kor kpe kpm krk kro ksm kur kwk lad lao laz lep lez lil lis lkt lnd lnw maa mal mam map maw mei men mis miz mka mnc mnd moe moj moo mrd mrl mtu mun mut mwb mxp mym nav nbb nbh nca nep nez ngi ngz nht nko nue nup nuu ond ood otm otr pai pap pir pms pna prd prs pwn ras rka rom scr sel sey shn siu sla smt snc spa squ sra sup swa swe tag tep tes tgr tiv tli tne tno tpi tur tus tvo tzo tzu uby vai vot wap wau wch wel wic wlf yav yim yko ykt yor zai zan zar zaz zqc zul,211,76475,0.0027590715
102A,Verbal Person Marking,,102,Anna Siewierska. 2013. Verbal Person Marking. In: Dryer; Matthew S. & Haspelmath; Martin (eds.) 2013. The World Atlas of Language Structures Online. Leipzig: Max Planck Institute for Evolutionary Anthropology. (Available online at https://wals.info/chapter/102),1,abn abu adz ana awt bab bam bar bnj bri brm bro chr dga dre epe gar god grb gud guu hai hau hmo igb imo ing jpn juh kay kch kha khm klk kmu kor kro kse kuk kyl lad lah lep lez mal mao mcr mde mei mlm mnd mrt mum nbr ndy niv nup pai pso qaw rap sam san saw shk snm srm sun sup tag tha uhi vie wap wik xok yaq yes yid yor zun,82,76475,0.0010722459
6A,Uvular Consonants,,6,Ian Maddieson. 2013. Uvular Consonants. In: Dryer; Matthew S. & Haspelmath; Martin (eds.) 2013. The World Atlas of Language Structures Online. Leipzig: Max Planck Institute for Evolutionary Anthropology. (Available online at https://wals.info/chapter/6),2,abk ani ata awn bma chk die gla ham hmo hop hup irq jaq kal kek ket kgz klm kmp krd kry lah lui mar mgg pai prs qco sel skp som teh tpa tsi wch xoo,38,76475,0.0004968944
13A,Tone,,13,Ian Maddieson. 2013. Tone. In: Dryer; Matthew S. & Haspelmath; Martin (eds.) 2013. The World Atlas of Language Structures Online. Leipzig: Max Planck Institute for Evolutionary Anthropology. (Available online at https://wals.info/chapter/13),2,acm adk agh aik ain akn ald amo ani ant awn bam baw bee bej ber bno bod cac cad che chp chw cil cub dad dah det dgb dnw dts efi eka ewe fas ful fur fye gbb had ham hau hop hve igb igs ijo ik irq iso jom jpn kal kef kew kgi kio kiw kmu knk knm knr koi krk kro kss ktk kul lan lat llm luo luv maa mab maz mbm mei mor mrg mrl mro mui nan nar nav ndy ngz nis niv nko nkt nob nor nyg oca ogb ond otm paw pec prh psm qui res rut san sdw shs sla som sre sue tam tib tks tli tmn tmp tne twn umb una wah yag yaq yct yey ygr zan zul,132,76475,0.0017260542
1A,Consonant Inventories,,1,Ian Maddieson. 2013. Consonant Inventories. In: Dryer; Matthew S. & Haspelmath; Martin (eds.) 2013. The World Atlas of Language Structures Online. Leipzig: Max Planck Institute for Evolutionary Anthropology. (Available online at https://wals.info/chapter/1),3,aea agh aik aiz akn alb ald alw amo amu amz ana ata aze bam baw bbf bej ber bet bir bra bre brh brw bsq bul cad cah cam cay ccp cha chu chv chw cil cle cnt cti ctl dan ddf dgb dgr die din dio diy diz djp dnw don doy eja eng fij fre ful gan ger goo grb grk grr grw gwa hok hop htc hve iba ign igs ijo ind irx ito iva jav jeb jng kad kef kek ker kgu kgz kha khm khs kio kkn klv kmu knk knm knr kob kom kor kot koy kpa kpe kro kul kur kwo kws kyl lkt llm lu lua lui maa mab map mar mba mbb mei mgg mla mme mnd mog mpa mrl mro mrt mui mum mzc nap nar new nga nko nmb non nor nug nun ogb ood orm otm pac pai pau phl prs qaw rom rsc ruk sab sba sel sha snd snh som spa srn sup tam tha tiw tks tlp tma tmp tol tru tug tuk tul tur tuv tza umb una uzn vie wch wic wiy wuc yan yap yay yct yko ykt ytu zan zun,201,76475,0.00262831
7A,Glottalized Consonants,,7,Ian Maddieson. 2013. Glottalized Consonants. In: Dryer; Matthew S. & Haspelmath; Martin (eds.) 2013. The World Atlas of Language Structures Online. Leipzig: Max Planck Institute for Evolutionary Anthropology. (Available online at https://wals.info/chapter/7),5,dah det hau ik irq kek kom ktk kul mne orh yct zul,14,76475,0.00018306637
119A,Nominal and Locational Predication,,119,Leon Stassen. 2013. Nominal and Locational Predication. In: Dryer; Matthew S. & Haspelmath; Martin (eds.) 2013. The World Atlas of Language Structures Online. Leipzig: Max Planck Institute for Evolutionary Anthropology. (Available online at https://wals.info/chapter/119),1,abk abm abz ace acl acm aco ady agm ain akn ala ame aro arp awt baa bag bam bar bgo bik bla blx bma bod bri brj brm brr bsq bto bui cah ccm cct ceb cha che chk chr cmh cmr cnl coo cop cre cro cso dab dgb din diz dmi dyi epe ewe fij fni for frd gae gar gbb gdi gjj gll goa gol grb grn grw gua gud gum guu hau hcr hei hop hui iaa igb ik ilo imo ind iri irq iwa jab jak jeb jpn kab kat kbl ket kew kgu khm kho khs kic kio kko kls klv knk knm knr kor kpe kpm krk kro ksm kta ktl kur kwa kwk lad lah lao len lep lez lil lis lkt lnd lnw lon luo maa mal mam mao map mau maw mei men mie miz mka mku mlk mnc mnd mng mnm mok moo mou mrg mrl mtu mun mut mwb mxp mym nak nar nas nav nbb nbh nca ndi nep ngz niu niv nue nup nuu ojs ond ood otm otr pai pap pau pir pit plh plr pms pna pop prd ptp ras rem rot rti sal sam sed sel sey shl siu sla snc sng snh snt som sor spa squ sra sre sun sup tag tah tas tbu tep tes tgk tha tiv tiw tla tmr tna tne tng tno tot tpi tsh tug tuk tup tus tzo tzu uby uhi urk vai vie wap wch wel wlf wlo wol wrp wsk yaq yim yko yor yur yuw zai zan zar zqc,269,76475,0.0035174894
104A,Order of Person Markers on the Verb,,104,Anna Siewierska. 2013. Order of Person Markers on the Verb. In: Dryer; Matthew S. & Haspelmath; Martin (eds.) 2013. The World Atlas of Language Structures Online. Leipzig: Max Planck Institute for Evolutionary Anthropology. (Available online at https://wals.info/chapter/104),1,abn abu adz ana ani anj arm ata awp awt bab bam bar bkr bnj brh bri brm brn bro brs bya cap cav cha chr cle cnl cop cpn cri cub dga dgr diz don dre dum dut eng epe eve fin fre fur gar ger god grb gud guu hai hat hau heb hin hmo hmu hzb igb ijo imo ind ing iqu iri irq ita jpn juh kay kch ker kew kgu kha khm kho khs kio kis klk kmu kna knd kob kor kro kse kuk kyl lad lah lak lat lep lez mal mao may mcr mde mei mis mle mlm mnd mne mrt mum mup mxc nad nai nak nbd nbr ndy niv noo ntu nup nuu orh pai pau plk pny pol pso qaw ram rap rem rus sam san saw sel sem shk sml snm so srm sue sun sup syu tab tag tgk tha tid tin tir tla tmr tms trb tri tru tso tur udh uhi urk vie wao wap wbn wel wik win wma wra wsk xok yap yaq yaw yes yid yko yor zun,187,76475,0.0024452435
107A,Passive Constructions,,107,Anna Siewierska. 2013. Passive Constructions. In: Dryer; Matthew S. & Haspelmath; Martin (eds.) 2013. The World Atlas of Language Structures Online. Leipzig: Max Planck Institute for Evolutionary Anthropology. (Available online at https://wals.info/chapter/107),1,aeg ain alb amh amu ana ani apu ara arm aym bar bej ber bln bma brr bsq bur car cha cle cmn cmx coo cop cor cri cub cyv dgr dio diz don doy dre dut eng eve fij fin fre fua fur geo ger grb grk grw hau heb hin hix hlu hmo hmu hun ijo ind iri irq ita jak jpn kas kay kch ket kha kho kis kna knd knm knr koa kon kor kos krb krd krk kro kse kuk kut kws lat lep lim mab mac mal mao map mar mle mnd mrl mrt msl mss mun nad nai nav nbd nbr ndo nez nht nko noo ntu nuu oss pal par pau pip plk pny pol prs psj psm qim qui rus siu sla sml snm so spa squ sun swa tab tha tin tkl tna tpn tuk tur tzu udh vie wap war wel wik win wra yaq yuk yur zan zul zun,162,76475,0.0021183393
118A,Predicative Adjectives,,118,Leon Stassen. 2013. Predicative Adjectives. In: Dryer; Matthew S. & Haspelmath; Martin (eds.) 2013. The World Atlas of Language Structures Online. Leipzig: Max Planck Institute for Evolutionary Anthropology. (Available online at https://wals.info/chapter/118),3,acl acm akn ala arc arp bab bam bar bej bln bri brj brs bui cah che cil cmh cop cso dab dgb diz dmi dua ewe frd gbb gol grn grw gud hui igb irq iwa jpn kbl kho khs kku knm knr kor kpe ksm lad lda lep lnd luo maa mao map mau maw mbt mlk mnm moo mrg mtu mun mxp myi nar nbh ndi ngl nht nko nue nup orh otm pms pop pwn rti shl shn som sor sup swa tah tbu tep tne tsh tup ung vai wch wic wrp yim zai zan zar zul,103,76475,0.0013468454
19A,Presence of Uncommon Consonants,,19,Ian Maddieson. 2013. Presence of Uncommon Consonants. In: Dryer; Matthew S. & Haspelmath; Martin (eds.) 2013. The World Atlas of Language Structures Online. Leipzig: Max Planck Institute for Evolutionary Anthropology. (Available online at https://wals.info/chapter/19),1,abi abm ach acm adk adz aht aik ain akn akw ala alw amh amp amu amz ana anc ant ao api apu arb arm arp asm awn awp aym aze bag bai baj bam baw bco bee bej ben bis bki bkr bng bno bod brd bre brh bri brr brw bsq bto bua bul bur byu cac cad cah cam car cax cay cck ccp cha che chk chl chu chv chw cil cle cmn cnl cnt cof coo cre cso cti ctl cve cyv dad dag dar ddf der dgr die din dio diy diz djp dni dnw don dum dyi eka epe eve evn eya fas fef fin fre ful fur fuz fye gan gar gds geo ger ghb gla gmb goa goo grr grw gua hai hak ham hau haw hba hin hix hmo hok hop hun hup iba ign ik ika imo ind ird irr irx ite ito iva iwm jak jaq jav jeb jeh jiv jng jom jpn jpr kad kal kas kay kch ked kef kek ker ket kew kfe kgi kgu kgz kha khm khr khs kio kiw kkn kkv klm klv kly kmp kmu knd kng knk knm knr koa kob koi kom kor kot koy krb krk kro kry kse kty kul kun kur kut kwa kwk kwo kws kya kyl kzy lad lah lam lan lat lav len lep lez lit lkt lu lua lui luo lus luv maa mab mak mal mao mau max may maz mbb mei mgg mie mku mla mlk mnc mnd mne mog mor mov mpa mrd mrg mrn mrt mss mtp mui mun mya myi mzc nai nan nap nar nas nav nax nbk ndt ndy nep new nez ngz nhn nht nim nis niv nko nkt nmb nnc nob non nor nug nun nyg nyi oca oji ond ood orh orm pac pae pai pau paw pec phl pit pms pnr poa poh pol prh prs psh psm pso puk pur qaw qui ram rap res rom ror rsc rus sab sba scs sdh seb sed sel sha shi shk shs shu sin skp sla slp sml snc snh snm snt sor sre srn sue sui sup svs tab tag tam teh tel ter tgk tha tib tic tiw tks tli tlp tmn toa tol ton tpa tru try tsg tsi tso ttn tug tuk tul tun tur tuv twn tza umb una ung urk usa uzn vie wah wam wao wap war wch wdo wic win wiy wlf wma wmu wnt woi wps wra wrd wrs wry wuc yag yan yaq yar yaw ycn yct yes ygr yid yim yko ykt yny ytu yuc yur yus zqc zun,449,76475,0.0058711995
8A,Lateral Consonants,,8,Ian Maddieson. 2013. Lateral Consonants. In: Dryer; Matthew S. & Haspelmath; Martin (eds.) 2013. The World Atlas of Language Structures Online. Leipzig: Max Planck Institute for Evolutionary Anthropology. (Available online at https://wals.info/chapter/8),2,abi abk acm aea aeg agh aiz alb ald alw ame amh amo amp amz ana anc ao arm arp ata awn aym aze bag bai baj bam baw bbf bco bee bej ben ber bet bir bis bki bkr bma bng bod bra brb brd bre brh brm brw bsk bsq bto bua bul bur byu cac cah cam cay cha che chl chq chu chv chw cil cle cnl cnt cso cti ctl dan dar ddf dgb dgr die din dio diy diz djp dni dnw don doy dre dts dum dyi eng eve evn ewe ewo fij fin fre ful fur fuz fye ga gbb ger ghb gla gmb goo grb grk grr gua gwa hak hau haw hba hin hmo htc hun hve iba igb ign igs ijo ik imo ind ing ird irx iso ito iva jak jaq jav jeb jeh jng juh kad kas kay kch ked kef kek ker kfe kgi kgu kgz kha khr khs kkn kkv klm klv kly kmp kmu knd knm knr kob koi kom kor kot koy kpe krd kro kry kse ksg kss ktk kty kul kun kur kwa kws kya kyl kzy lad lah lak lan lat lav len lep lez lkk lkt llm lu lua lui luo maa mab mal map mar mau maz mba mbb mbm mei mgg mie mku mla mlk mme mnc mnd mne mog mpa mrl mrn mro mrt mss mum mun mxc mxm mya myi mzc nai nan nap nar nax nbk ndt ndy nep new nga ngi nhn nis niv nkt nnc nob non nor nti ntu nug nun nyg nyi ogb oji ond orh orm otm pac pae pec phl pit pms poa poh pol prs psm pso puk pur qaw qco ram rom rsc ruk rus rut sab san sba scs sdh seb sed sel sha skp slp sml snd snh som soq sor spa sre sui sup svs swa tab tag tam tas tel tgr tha tib tiw tks tlp tma tmn tmp tne toa tok tol ton try tsg ttn tug tuk tul tun tur tuv tza umb una ung uzn vie wah wam wap wch wdo wlf wma wmu woi wrd wrs wry wuc xoo yan yap yaq yay yct yel yes yid yim yko yny yor ytu yul yus zqc,388,76475,0.0050735534
103A,Third Person Zero of Verbal Person Marking,,103,Anna Siewierska. 2013. Third Person Zero of Verbal Person Marking. In: Dryer; Matthew S. & Haspelmath; Martin (eds.) 2013. The World Atlas of Language Structures Online. Leipzig: Max Planck Institute for Evolutionary Anthropology. (Available online at https://wals.info/chapter/103),1,abn abu adz ana ani awt bab bam bar bnj bri brm bro chr dga don dre epe gar god grb gud guu hai hau hmo hzb igb ijo imo ing jpn juh kay kch ker kha khm kho kis klk kmu kor kro kse kuk kyl lad lah lep lez mal mao mcr mde mei mle mlm mnd mrt mum mup nbr ndy niv noo nup pai pny pso qaw rap sam san saw sel sem shk snm srm sun sup tag tgk tha uhi vie wap wik wra yaq yes yid yor zun,96,76475,0.0012553122
12A,Syllable Structure,,12,Ian Maddieson. 2013. Syllable Structure. In: Dryer; Matthew S. & Haspelmath; Martin (eds.) 2013. The World Atlas of Language Structures Online. Leipzig: Max Planck Institute for Evolutionary Anthropology. (Available online at https://wals.info/chapter/12),2,aco agh aik ain akn akw ald ame amh amo amp amu ani ant ao arb arp asm awn aym aze bag bai baj baw bee ber bet bir bis bkr bng bod brm byu cac cad car cax cck cha che chp cil cle cmn cnt cre cti ctl dad dag dan dar ddf der det dgb din diy dni dnw don dre dyi efi eja epe eve ewe ewo fef fin fur fuz fye ga gan gar gbb gds gla gmb goo grr grw hak hau hix hmo hok htc hve hzb iaa iba igs ika irq irr irx iso ito iva jak jaq jeb jng jom jpn jpr kad kal kay kch ked kef ker kfe kgu kho khr kio kkv klv kmp kng knk knm knr koa kob kom kor kpe krb kro ksg kss kty kul kun kwo kya kyl lah lan lav len lkk lu lua lug luo maa mal map max mbb mei mgg mla mnd mne mrd mrl mro mrt mss mum mun mya mzc nai nan nar nav ndt ndy new nga ngi ngz nhn nht nko nnc nob nug nyg nyi ogb orh pac pai paw pec phl pit pms pnr poa puk pur ram res ruk sdw sed sha shi shk shs skp sla sml snm som sor spa sui sup tag tam tel ter tgk tgr tha tib tiw tma tmn tok tol ton tru try tsg tur una ung urk usa vie wah wam war wch win wma wmu wnt woi wps wrs xoo yag yap yaq yaw yay ycn yes yey yid yim yko yny yul yus zul zun,274,76475,0.0035828701
