parameter_id,parameter_name,parameter_description,chapter_id,chapter_citation,value,same_value_language_ids,value_language_count,language_count_total,count_ratio
46A,Indefinite Pronouns,,46,Martin Haspelmath. 2013. Indefinite Pronouns. In: Dryer; Matthew S. & Haspelmath; Martin (eds.) 2013. The World Atlas of Language Structures Online. Leipzig: Max Planck Institute for Evolutionary Anthropology. (Available online at https://wals.info/chapter/46),2,abu aeg ame aml amp ano bab bag bak bam bud cic dgb doy eng err ewe fon fre fue gam gbb gol hau ibi ind iri irq ita kan kat kfe kji klq kob kse kwr kya kyk lan lav lel lgu lug mal may mbi mby mde mgu mis mle mlt mrg msh nbd ndb niu nko nti nto orh orl pal pms prs qia sam san see sla som sum swa tid tis tms tmu tru tur tvl usa yap yor,85,76475,0.0011114744
49A,Number of Cases,,49,Oliver A. Iggesen. 2013. Number of Cases. In: Dryer; Matthew S. & Haspelmath; Martin (eds.) 2013. The World Atlas of Language Structures Online. Leipzig: Max Planck Institute for Evolutionary Anthropology. (Available online at https://wals.info/chapter/49),1,abi aco aeg ame arp asm bag bam bkr bul car cba cha cle cnl ctl dio don dre dut ewe fij fre frw fua grb gua hai hau heb hix hmo hve iaa igb ind ita jak juh kfe khm khs kin klv kmb kmu kob kon kos krb kse kut kyl lan lav lkt luv mak mal mao mau mdr mnd mok mrd mxc nav ndy nht nko nti ond ots pai pal pms rap san sla snt spa swa tab tag tha tin tiw tsi tuk tvl una urk vie war wch wel yor zul zun,100,76475,0.0013076168
93A,Position of Interrogative Phrases in Content Questions,,93,Matthew S. Dryer. 2013. Position of Interrogative Phrases in Content Questions. In: Dryer; Matthew S. & Haspelmath; Martin (eds.) 2013. The World Atlas of Language Structures Online. Leipzig: Max Planck Institute for Evolutionary Anthropology. (Available online at https://wals.info/chapter/93),1,abi acg agc agd api apu asy bac bae baq bbw bdm bfg bgs bgz bik bkr bla bma bnu bre brf brr brs bti btk bul cak cay cbo ccm cde che chj chq chr chx ckl cle cmy cnl cnm coc coo cpl cso cub cya daw des dgb dhb diy dji djr dsh eme emm eng eno epe ese est eud eve fin fre fri fua gae gav ger ghb gid git gjj gnb goa grb grj grk grr gud hdi heb hix hmi hpd htc hve iaa ifu ign ik iqu iri iwa jak kaa kdw kdz kfe kgu kho kio kis kje klm klv kma kno knr knw kpm krn kse kut kws kyp kyq kyz lat lit lui mac mak mal mam mau mcv mde mdn mds meh mek men mku mmn mne mno mny mok mos mov mpr mra mrt mrw mss mui mut muu mwb mxc mxj mxo mxp mxy mzh ndy neh nev ney nez ngi ngw nhh nhm nhn nht nia nor nsg nug ocu oji ond ora otm pai pam pau pga pir pkn plh plk pnn pno pnx pol ppi pur qim qui qum ret rit rom rus shh shi shp sia sis siu sml so spa src srn swe tac tag tar tat tbo tbu tce tee tho tig tir tlp tne tno tob tpn tpt tri tru tsk tus txj tzu urk urn wan war way wch wel wem wiy wlf wlw wra wrb wrk yag yin yok yor ypk yuk yuw zai zap zay zch zqo zun zya,264,76475,0.0034521085
142A,Para-Linguistic Usages of Clicks,,142,David Gil. 2013. Para-Linguistic Usages of Clicks. In: Dryer; Matthew S. & Haspelmath; Martin (eds.) 2013. The World Atlas of Language Structures Online. Leipzig: Max Planck Institute for Evolutionary Anthropology. (Available online at https://wals.info/chapter/142),2,akm ame aul bal bmn bra chx cnt cze dge dsh dut eng fef fin fiw fua ger gfr gvi hau hmd hmo hok hun igb inj iri jah jpn khm khu kil klq klv kmu knd kor kou lao lav lns lov mad mal may mbz min mla myk nif oi ood pms rus sam slb spa spc svk swa swe tab ter tha tuk yba ydd yor zsq,71,76475,0.000928408
120A,Zero Copula for Predicate Nominals,,120,Leon Stassen. 2013. Zero Copula for Predicate Nominals. In: Dryer; Matthew S. & Haspelmath; Martin (eds.) 2013. The World Atlas of Language Structures Online. Leipzig: Max Planck Institute for Evolutionary Anthropology. (Available online at https://wals.info/chapter/120),1,abk abz acm aco ady ain akn ala alb amh apl arc arm ava awp bab bam bar bej bik bla blc bln blx bre bri brs bsq bto bul bur but cah ccm ccp cct ceb cha chc che chk cmr coo cre cro cso dag dgb din dut eng est ewe fij fin fre gae gar gbb gdi geo god gol grb grk grn grw hau hcr hei hin hmr hui hup hzb iaa ice igb iri jak jpn juh kab kbl ket kho khs kic kio kko kku kls knk kor kpe kpm krk kro ksm kur kwk lad lao laz lep lez lil lis lkt lnd lnw maa mal mam map maw mei men mis miz mka mnc mnd moe moj moo mrd mrl mtu mun mut mwb mxp mym nav nbb nbh nca nep nez ngi ngz nht nko nue nup nuu ond ood otm otr pai pap pir pms pna prd prs pwn ras rka rom scr sel sey shn siu sla smt snc spa squ sra sup swa swe tag tep tes tgr tiv tli tne tno tpi tur tus tvo tzo tzu uby vai vot wap wau wch wel wic wlf yav yim yko ykt yor zai zan zar zaz zqc zul,211,76475,0.0027590715
130A,Finger and Hand,,130,Cecil H. Brown. 2013. Finger and Hand. In: Dryer; Matthew S. & Haspelmath; Martin (eds.) 2013. The World Atlas of Language Structures Online. Leipzig: Max Planck Institute for Evolutionary Anthropology. (Available online at https://wals.info/chapter/130),2,abi abk abm abw acg acm acu afr agr aht akr ale alg amh amk amr amu apc api apj ara aro arw arx atq ats awa awp aym ayo aze bab bae bam bca bem bgr bkd bkl bla blj blr blx bno bnq bnv bok bor bpb brc bre brs bsq btk bur but cab cac cai cak cam cap car cas cat cav cax cay cch cck cct ceb cec cha che chi chj chl cho chp chr chu chw cin cla clc cle cma cmh cmn cmy cnl cnt cof cog col cor cpa cre crg crk crl crn cro crp crq crt csf csh csk ctc ctl ctt ctw cub cui cur cut cuu cyn cze dak dam dca des dgx dig djp dre dsh dut efi eka emb ena eng ese eve eya fij fin for fox fre fut gad gae geo ger ghb gid git gjj gku gmb gna gno goa gre grk grm gto gua gul guu gyb hai hau heb hid hil hmb hmd hmi hmu hop hpd htc hui hum hun hve ifu igb ik ika ill ind iql iri ita itw itz ixc ixi jak jeh jmo jpn juh kas kat kaz kdg kdz kea kek kew kfe kgt kgz kha khg khk kic kio kis kje kky klm klw klz kmh kmk knc knd kng knr koa kon kor kos kpn krc kro ktb kth ktu kul kun kuq kut kwa kwe kws kyn lao lau len lez lit lnw lui lus mab mai mal mao map maz mby mcg mch mcn mco mcs mcv men mer mgg mhc mhi mic mid mij mis miz mjc mkb mnc mnd mne moc mog moj mok mop mos mov mpy mrt mse msh mss mtg mti mtp mtt mui mum mup mut muy mwb mwl mxg mxu myi mym myo myr mzc nas nbd nbr nep ngn nht nhu nhx niu nju nko nkr nlu nne nnm nog nom nor npa nro nsk nsn nsz ntj nuk nun nuu nya nym oca oji oka oko olu ood ore osa osm owc pae pal pan pcm pem per pia pip pir pla pme pnn pno poh pol por pow ppc prt psj psm psv pui pul pur qan qaw qca qch qec rad ram rap res ret rgn rng rnn rom rus sal sam say sba scr sea sec sed sel shk shl shn sho shu shw sin sla slv smj smt snh sno sol son spa spo squ sri sss stl sum sus sva svk swa tac tag tar tbe tce teh tga tha tib tic tkm tlf tlp tml tna tnb tnj tnl toa tob toj tol tos tpa tpi tpt trb trc tsf tsg tsh tsi tsj tsw tty tub tuc tup tur tus tut tuy tvo twn txj tze tzo tzt udh uhi ukr ute uzb ved wap way wch wel wem wic wir wiy wmu wol wra wrd wth wwr xar xer xoo yah yak yap yar yav ycn yct yki ypk yrt yus yyo zai zaj zam zap zfl zqc zqr zqs zul zun zzo,521,76475,0.006812684
50A,Asymmetrical Case-Marking,,50,Oliver A. Iggesen. 2013. Asymmetrical Case-Marking. In: Dryer; Matthew S. & Haspelmath; Martin (eds.) 2013. The World Atlas of Language Structures Online. Leipzig: Max Planck Institute for Evolutionary Anthropology. (Available online at https://wals.info/chapter/50),3,ana arm bri bul bur ctl dag dut eka eng fin frw gim goo hai hve ita kob kse kty lep lit mal mau mku mlk nti nug pai psh rom shk sml snm sno spa sue swe tag tli tsi tts una urd usa was win wra wrd yko yur zun,53,76475,0.00069303694
81A,Order of Subject; Object and Verb,,81,Matthew S. Dryer. 2013. Order of Subject; Object and Verb. In: Dryer; Matthew S. & Haspelmath; Martin (eds.) 2013. The World Atlas of Language Structures Online. Leipzig: Max Planck Institute for Evolutionary Anthropology. (Available online at https://wals.info/chapter/81),3,agc agd ams bco bfg bma ccm ceb cha chq cor cpl cso cya did gae gjj goa grf gto gud haw hdi hei hil hlu hoa ik iri ixi jak kbl kdz kje kkt kls kmj kro kuo kyq lil lmg maa maj mak mam mao mmn mrl mrq msq mwb mxc mxj mxo mxp mxy nan nhh nif niu nsg pkt pnn pod qui qum rap rov seb shp smp so squ tag tah tbo ten tes tim tlp tna tpn tri tsi tsk tsr wec wel wlo yap zai zap zzo,95,76475,0.001242236
95A,Relationship between the Order of Object and Verb and the Order of Adposition and Noun Phrase,,95,Matthew S. Dryer. 2013. Relationship between the Order of Object and Verb and the Order of Adposition and Noun Phrase. In: Dryer; Matthew S. & Haspelmath; Martin (eds.) 2013. The World Atlas of Language Structures Online. Leipzig: Max Planck Institute for Evolutionary Anthropology. (Available online at https://wals.info/chapter/95),4,abi abu acl acm adz aeg agc aja alb alk aln als ama ami aml amq amr ams anc ane anj arg arj aro arp arq asy ata au ayw bab baf bag baj bak bar bas bbl bbu bco bdu bfg bgo bia bid bik bir bka bkl bkr blu bma bni bnk bnn bob bol bra bre brf bse bsh btk bto bud bul bum buu bvi bwc cak cba ccm ceb cem cha chj chq chr cic ckl cle cmx cmy coe cop cpl cqt crn cso ctl cuc cya cyv cze did dio dok dom don dre dsh duk egn eng eno erk err esm ewo fij fni fre fua fut fye gae gbb gel giz gla gmz gnb gnd goa goe gok grf grk grr gto gud gwo hal hat hau haw hdi heb heh hei hem hil hlu hmo hna hoa htc hve hya iaa iba ice ifm ifu igb ign igs ik ila ind iri irr ita ixi izi jak jar jmo juk kam kan kar kau kbl kbw kby kdz kel ker kga kgr khm khs kik kil kin kkt kkv klv kmj kmu knk koe kon kos kpm kpw krb kre kri ksg kte kuo kwa kwk kwn kwy kyq laa lab lac lag lan lao lat lbu ldo leb lel len let lew lgi lgu lic lil lit lmg lmp lnd lon lou luo luv maa mae mal mam mao mas mau may mbe mbm mcd mdg mdm mdo mds mea meh mga mgo mgu miy mlg mlm mlu mmb mmn mna mng mof mok mon mor mov mpu mrg mrq msm msq mua mum mup mus mwb mxc mxj mxo mxp mxy myg nak nal nan nca ndi ndo ndt ndu ndy neh ngb ngd ngm ngo ngu ngz nhh nhm nht nia nif niu nko nnc noo nor nse nsg nua nun nup nza obg obo ocu olo ora otm paa pai pal pat per pip pkt plg plh plk pms png pnn pod pog poh pol por pre psm psw pul qum rag rap rga rny rom rot ruk rus rwe sah sak sal sam san scr seb sed ses sgb sgl shl shn shu sim sio sir sis slo sml so sob son spa squ sre sti sul sun swa swe tab tah tai tal tbo tbw tee teo tep ter tes tet tgh tgk tha tho tid tim tin tiv tiw tke tla tlp tmr tna tne tng tnk tno tpr tri tsg tsi tsk ttd ttn tuk txj tzo tzu ukr uld uli url vie vnm war wch wel wlf wlo wma wol wrk wrm xar xbi xho yap yok yor yul zai zan zap zhn zqs zul zya,456,76475,0.0059627327
85A,Order of Adposition and Noun Phrase,,85,Matthew S. Dryer. 2013. Order of Adposition and Noun Phrase. In: Dryer; Matthew S. & Haspelmath; Martin (eds.) 2013. The World Atlas of Language Structures Online. Leipzig: Max Planck Institute for Evolutionary Anthropology. (Available online at https://wals.info/chapter/85),2,abi abu ace acl acm adz aeg agc aja alb alk aln als alw ama ami aml amq amr ams anc ane anj any arg arj aro arp arq asy ata au ayw bab baf bag baj bak bar bas bbl bbu bco bdu bfg bfi bga bgo bid bik bir bka bkl bkr blu bma bmz bni bnk bnn bob bol bra bre brf brq bse bsh bsi btk bto bud bul bum buu bvi bwc cak cba ccm ceb cem cha chj chq chr cic ckl cld cle cmx cmy coe cop cpl cqt crn cso ctl cuc cya cyv cze did dio dng dok dom don dre dsh duk dut egn eng eno erk err esm ewo fij fre fri fua fut fye gae gbb gel ger git giz gku gla gmz gnb gnd goa goe gok grf grk grr gto gud gwo hal hat hau haw hdi heb heh hei hem hil hlu hmo hna hoa htc hve hwr hya iaa iba ice ifm ifu igb ign igs ik ila ind iri irq irr ita ixi izi jak jar jlu jmo juk kam kan kar kau kbl kbw kby kdz kel ker kga kgr khm khs kik kil kin kis kkt kkv klv kmi kmj kmu knk koe kon kos kpm kpw krb krd kre kri ksg kte ktu kuo kwa kwk kwm kwn kwy kya kyo kyq laa lab lac lag lan lao lat lbu lda ldo leb lel len let lew lgi lgu lic lil lit lmb lmg lmp lnd lon lou luo luv maa mae mal mam mao mas mau may mbe mbm mcd mco mdg mdm mdo mds mea meh mga mgo mgu mig min miy mko mlg mlm mlu mmb mmi mmn mna mng mnz mof mok mon mor mov mpu mra mrg mrq msm msq mtt mua mum mup mus mwb mxa mxc mxj mxo mxp mxy myg myi mzh naj nak nal nan nca nde ndi ndo ndt ndu ndy neh ngb ngd ngm ngo ngu ngz nhh nhm nht nia nif niu nko nnc noo nor nse nsg nua nue nun nup nza obg obo ocu olo ora otm paa pai pal par pat per pip pkt plg plh plk pms png pnn pod pog poh pol por pre prs psm psw pul qum rag rap rga rny rom rot ruk rus rwe saa sah sak sal sam san scr seb sed sen ses sgb sge sgl shl shn shu sim sio sir sis slo sml so sob son spa squ srb sre sti sul sun swa swe tab tah tai taj tal tbo tbw tee teo tep ter tes tet tgh tgk tgo tgr tha tho tid tig tim tin tiv tiw tke tla tlo tlp tmr tna tne tng tnk tno tpr tpt tri trt tsg tsi tsk ttd ttn tuk tvl txj tzo tzu ukr uld uli url vie vif vnm war wch wel wlf wlo wma wol wrk wrm xar xbi xho yap yok yor yul zai zan zap zen zhn zqs zul zya,511,76475,0.0066819224
82A,Order of Subject and Verb,,82,Matthew S. Dryer. 2013. Order of Subject and Verb. In: Dryer; Matthew S. & Haspelmath; Martin (eds.) 2013. The World Atlas of Language Structures Online. Leipzig: Max Planck Institute for Evolutionary Anthropology. (Available online at https://wals.info/chapter/82),2,agc agd als ami amr ams anj ann asu ata baq bco bfg bkl bma bre bto cak cba ccm ceb cem cha chj chq chx ckl cle cmx cmy coe coo cor cos cpl cso cub cya cyv did dom esm fij gae gel gjj goa grf gto gud haw hdi hei hil hix hlu hoa htc hve iaa ifu ign ik iri ixi jak kam kbl kdz kje kkt kls klv kmj kpm krb kri kro ktm kuo kut kyq lgu lil lmg maa maj mak mal mam mao map mch mcv mmn mna mnt mov mrl mrq msq mwb mxc mxj mxo mxp mxy mzc nan nca ndr ngr nhh nhm nia nif niu nnc nsg nuu oji ond ood otm pai pau pga pip pkt pnn pnx pod qui qum rap rov ruk sal sam seb see sel shp shu sim smp so squ tag tah tai tat tbo tee ten tep tes tho tim tir tke tlp tna tng tpn tps tri tsg tsi tsk tsr tuk tvl tzo urn war wec wel wem wlo wrb wth wya yag yap yok ywr zai zap zqc zqo zya zzo,194,76475,0.0025367767
87A,Order of Adjective and Noun,,87,Matthew S. Dryer. 2013. Order of Adjective and Noun. In: Dryer; Matthew S. & Haspelmath; Martin (eds.) 2013. The World Atlas of Language Structures Online. Leipzig: Max Planck Institute for Evolutionary Anthropology. (Available online at https://wals.info/chapter/87),1,adn aga agc agd ain aja ala als amb amh ami amk ani ara arc arm arp arw ass ath ava awa awp aym aze bai bak bbu bco bel bho bhu bii bil bka bkt bla blr blt bnb bnj bod brh bsk bul bur but bya cah cak car cay cha chc chd che chh chk chn chv chx ckl cln cmn cmy cnt coo cpn cpy cub cyv cze des deu dgr dhi dhm dmi dmk dom drg drm dsh dut eip ene eng ess est eve evn fin for fri gal gam gbb gbs gdb gds geo ger gid gil git gnb god gok gon grk gud guj gur hau hay hei hhu hin hlu hmi ho hop htc hua hum hun hve hzb iaa ice idu ifu ijo ing iwa jak jaq jeb jiv joh jpn kas kay kbt kem ket kew kgz kha khg khi khl kho khw kiw kkp kku klg klm klr kmh kmk kms knd knn kol kop kor koy krc kre krn krw kry krz kty kum kuv kwk kwo kws kxo kzy lac lak lat ldu lez lil lim lit lmn lnd ma mai maj map mau mcc mcd mco mdm mdo mer mgg mhi mil mme mnc mnd mne mns mnz moe mrc mrw msg msq mto mun mus mwb mxx myg mym mzn nah nca ndy nep nev new nez nga nis niv nog nor nsg nsn nti ntu nwd nyu nza obg ocu ood ord oss otm paa pal pan paw pba pip pkn pno pol pra prk psh ptt qaf qhu qim qui qum rem res ret rpa rus rut rwe san sar sav scr sec sel shb sho shp sid sin sir siu skp slo smp sna snh sno sod squ srb sta stl suk svs swe tam tce tee tel tep tgl tgr thk thn tho thu tig tin tiw tkm tls tml tni tob trw tsf tsh tsi tsz tts ttu tul tur tuv tvo twe txj uby udh udi udm ukr urd usr uyg uzb wak was wem wik wly wme wrw xar yah yaq yar ybi ycn ygr yko ykt yng yny yok ytu yuk yur yuw ywr zan zay zch zqc,373,76475,0.004877411
27A,Reduplication,,27,Carl Rubino. 2013. Reduplication. In: Dryer; Matthew S. & Haspelmath; Martin (eds.) 2013. The World Atlas of Language Structures Online. Leipzig: Max Planck Institute for Evolutionary Anthropology. (Available online at https://wals.info/chapter/27),1,abk abm aeg agc akn ala alw aly ame amh amp api apl arp asm ass asy aym baj bal bco bej bis bkl blq blx bma bnj bsm bsq buw cah cax cba cck cct cha chh chk chl chr cin cla cmk cmn cmx cnl coe col coo cos cre cuu cwe cyv dag dah dga dhm diy dji djp djr dre dri dyi epe ewe fox fua gar geo goo gum ham hau haw heb hil hin hlp hlu hmo hop hrr htc hui hun hzb iaa igb itz jak jaq kay kha khm kho khs kik kjn kkv klm kls klv kma knd knr koa kol koo kor koy kpm krb krk krw kuo kwk kya lac lav lil lkt lmp lrd lui lus luv maj mal mao mar mau maw may mcs mdr mei men min miy mki mks mlk mmb mnd mnm mok moo mos mpa mra mrq msh muh myi nak nau ndb nde ndy nez ngi ngk ngl nhc nia nkr nnc nug nuu nyn ojs oka olo ood orh oro pac pai pan pau pgl pip pms pnn poh prs psh pul put qay qui rit rmb rnd rny rot ruk sam sed ses shp shu siu sml som spo squ srn sro sry sst stl sun swa swi swt tag tbb tgk tgr tha tho thw tid tig til tim tin tiw tja tkm tlp tml tmr tng toj tru tsg tsi tso tuk tur tuv twa tze tzo uhi ung uyg vie war was wat wik wmu wrd wrk wrl wry wsk wwy xho yaq yct yid yim yin yir yny yor yuc yuk yur ywl,278,76475,0.0036351748
119A,Nominal and Locational Predication,,119,Leon Stassen. 2013. Nominal and Locational Predication. In: Dryer; Matthew S. & Haspelmath; Martin (eds.) 2013. The World Atlas of Language Structures Online. Leipzig: Max Planck Institute for Evolutionary Anthropology. (Available online at https://wals.info/chapter/119),1,abk abm abz ace acl acm aco ady agm ain akn ala ame aro arp awt baa bag bam bar bgo bik bla blx bma bod bri brj brm brr bsq bto bui cah ccm cct ceb cha che chk chr cmh cmr cnl coo cop cre cro cso dab dgb din diz dmi dyi epe ewe fij fni for frd gae gar gbb gdi gjj gll goa gol grb grn grw gua gud gum guu hau hcr hei hmr hop hui iaa igb ik imo ind iri irq iwa jab jak jeb jpn kab kat kbl ket kew kgu khm kho khs kic kio kko kls klv knk knm knr kor kpe kpm krk kro ksm kta ktl kur kwa kwk lad lah lao len lep lez lil lis lkt lnd lnw lon luo maa mal mam mao map mau maw mei men mie miz mka mku mlk mnc mnd mng mnm mok moo mou mrg mrl mtu mun mut mwb mxp mym nak nar nas nav nbb nbh nca ndi nep ngz niu niv nue nup nuu ojs ond ood otm otr pai pap pau pir pit plh plr pms pna pop prd ptp ras rem rot rti sal sam sed sel sey shl siu sla snc sng snh snt som sor spa squ sra sre sun sup tag tah tas tbu tep tes tgk tha tiv tiw tla tmr tna tne tng tno tot tpi tsh tug tuk tup tus tzo tzu uby uhi urk vai vie wap wch wel wlf wlo wol wrp wsk yaq yim yko yor yur yuw zai zan zar zqc,269,76475,0.0035174894
83A,Order of Object and Verb,,83,Matthew S. Dryer. 2013. Order of Object and Verb. In: Dryer; Matthew S. & Haspelmath; Martin (eds.) 2013. The World Atlas of Language Structures Online. Leipzig: Max Planck Institute for Evolutionary Anthropology. (Available online at https://wals.info/chapter/83),2,aab abi abu acg acl acm adi adz aeg agb agc agd agh aja akn alb alk aln als ama ami aml amo amq amr ams anc ane anj ann anu aoj ara arg ari arj aro arp arq asy ata au avk ayi ayo ayr ayw bab bae baf bag bai baj bak baq bar bas bbl bbu bch bco bdu ber bfg bgo bgr bgs bgz bid big bii bik bil bir bka bkl bkr bku bla ble blg blu blz bma bmb bni bnk bnn bob bol bra bre brf brn brq brr bse bsh btk bto bub bud bug bul bum buu buy bvi bwc cak cax cba ccm cea ceb cem cga cha chj chq chr chw chx cic ckl cle cme cmx cmy cnt coc coe cop cor cos cpl cqt cre crn cso ctl cua cuc cya cyv cze day deg dga dgb did dio dma dok dom don doy dre dsh dua duk ebi ega egn eko eng eno erk err esm est ewe ewo fij fin fon fre fua fut fye ga gae gbb gbs gel gir giz gjj gla gmz gnb gnd goa goe gok grb grf grk grr gto gua gud gul guw gwo hak hal hat hau haw hdi heb heh hei hem hil hlu hmo hna hnd hoa hol htc huc hun hve hya iaa iba ice ifm ifu igb ige ign igs ik ila ind iqu iri irr ita ito iwa ixi izi jab jak jar jmo juh juk kad kam kan kar kas kau kba kbl kbw kby kch kdw kdz kel ken ker kfe kga kgr khm khn khs kik kil kin kir kje kkt kkv kla kls klv kmj kmu kni knk koe kom kon kos kpm kpw krb kre kri kro ksg ksm ksn ktc kte ktl kuo kut kwa kwk kwn kwy kyl kyq kzy laa lab lac lag lan lao lat lbu ldo leb leg lel len let lew lgi lgu lic lil lin lit llm lmg lmh lmp lmu lnd lon lou luc luo luv ma maa mae maj mak mal mam mao map mas mau may mba mbe mbi mbl mbm mbr mbt mby mcd mch mcv mda mdg mdm mdo mds mdw mea mee meh mga mgk mgo mgu mhu mie miy mkd mkq mkz mla mlg mlm mlu mmb mmn mmv mna mnd mng moe mof mok mon moo mor mos mov mpo mpr mpu mrg mrl mro mrq mrt msk msm msq mtb mua mum mup mur mus mut mwb mwe mwo mxc mxe mxj mxo mxp mxy myg myn mzc nak nal nan nau nbe nbm nca ncm ndb ndi ndo ndr ndt ndu ndy neh ngd ngm ngo ngu ngw ngz nhh nhm nhn nht nia nif niu nke nkn nko nnc nne nng non noo nor nse nsg nto nua nun nup nuu nym nyn nza obg obo ocu oji olo ond one ood ora otm otr paa pai pal pam pat per pga pip pkn pkt plg plh plk pms png pnn pnu pod pog poh pol por pre psm psw pul pur qui qum rag rap rga rim rny rom ron rot rov rru rsu ruk rus rwe sah sak sal sam san sap scr sea seb sed see ses sgb sgl sgu sha shl shm shn shp shs sht shu sim sio sir sis siu skm sku sle slo sml smp sno so sob son spa squ srd sre ssa sti stn sud sul sun swa swe swt tab taf tag tah tai tal tan tas tat tbo tbw tee ten teo tep ter tes tet tgh tgk tgn tha tho tia tid tim tin tiv tiw tke tki tla tlp tmm tmn tmr tna tne tng tnk tno tob toz tpn tpr tps tri trm tsg tsi tsk tsr ttd ttn tuk tum txj tzo tzu ukr uld uli ura url urt ven vie vnm wal wam war wch wec wel wem wlf wlo wma wol wrb wrk wrm wrn wry wth wwa wya xam xar xbi xho xoo yag yao yap yay ycn yin yng yok yor yul ywl zai zan zap zch zhn zpr zqc zqo zqs zul zya zzo,705,76475,0.009218699
121A,Comparative Constructions,,121,Leon Stassen. 2013. Comparative Constructions. In: Dryer; Matthew S. & Haspelmath; Martin (eds.) 2013. The World Atlas of Language Structures Online. Leipzig: Max Planck Institute for Evolutionary Anthropology. (Available online at https://wals.info/chapter/121),4,alb bsq bto cmn dut eng fin fre gae goa grk hun iri jav lat mal ood rus spa sra tsh,22,76475,0.0002876757
88A,Order of Demonstrative and Noun,,88,Matthew S. Dryer. 2013. Order of Demonstrative and Noun. In: Dryer; Matthew S. & Haspelmath; Martin (eds.) 2013. The World Atlas of Language Structures Online. Leipzig: Max Planck Institute for Evolutionary Anthropology. (Available online at https://wals.info/chapter/88),1,abi abk abv aco adk ain ala alb als alw amb amc amh ami amk amn amr ams ana ani ann anu apt apu apw ara arc arm arp arw asm ass ath atk ats ava awa awp awt aym bae baq bar bdm bfg bho bii bil bkt bku bla blg blr blt bnb bnj bnn bnr bod brh brl brm brs bsk bub bul bur but bya cak car cas cay cde cea cha chc chd che chg chk chn chp chs chv ckl cld cln cml cmn cnm cnt coc coo cor cpn cpy cre crp cti ctl cup cyv cze daw des dgr dhi dhm diy djm djn djp djr dlm dmi dms dom drm dsh dua duk dul dut dyi emb eme eng epe est eud eve fin for fre fri fur ga gaa gam gar gav geo ger gid gjj gnb god gon goo grg grj grk grr gto gua guj gur guu gyc hai hak haw hay hei hhu hil hin hlu hmi hop hpd htc hua hun hup hve hwr hzb ice idn idu ifu ijo ing iqu ita ite ito iwa jaq jbt jeb jng joh jpn jva kaa kab kac kae kas kay kbt kem ket kew kgy kha khg khl kho khr khs kin kio kiw kkp kkt kku kkw klm klr kls kma kmh kmn kms knd knn kno koa kok kol kor koy krc kri krk krn krw kry krz ksa ktm kty kum kuo kut kuv kwo kwt kxo kyn kyr lac lad lat ldu lec lep lez lil lim lit lmn lui lun maa mac mai mak mam map mau mcd mco mcv mdm mds mek men mgg mgi mhi mie mik mis miy mkg mmn mnd mne mns moa moh mot mra mrc mrt mru msc msg msq mss mto mtt mun mut mwb mxx myi mym naj nas nav nax nbd nca ndj nep nev new nez ngi ngl ngn ngw nhh nhm nhn nht niv nku nnc noc nor nph nrg nsn nti ntu nug nwd nyk nyn nyr nyu nze ocu oji omh omi ond ood oss otm pae pai pal pam pan pau paw pba pdp pga pia pir plk pno pny pod pol por ppc pra pre prk prs psh psm pso ptt pum pur qaf qhu qim qui qum ram raw rem res ret rgc rmb rsu ruk rus rut rwe sal sar sav scr sdw sec she shh shi shk shm sho shp sid sin siu skp sla slb slo sme smn sna sng snm snt spa spi squ src srn stl suk sup sus svs swe swt tac tah taj tam tar tau taw tbl tce tee tel tgl thd thk thn thu tic tig tiw tkl tkm tla tli tls tml tnc tni tnn tob tot tpn tps tpt trr tru trw tsf tsz ttu tuc tul tur tuv tuy tvo tvt twe txj udi udm uhi ukr una urd urk urn usr ute uzb vaf wak wam wao wap was wbn wed wem wic wik wiy wlo wly wme wra wrd wrk xam xas xer yag yaq ybi ycn yin yko ykt yng yny yok yuc yuk yur yuw zay zaz zch zqc zqs zun,542,76475,0.0070872833
118A,Predicative Adjectives,,118,Leon Stassen. 2013. Predicative Adjectives. In: Dryer; Matthew S. & Haspelmath; Martin (eds.) 2013. The World Atlas of Language Structures Online. Leipzig: Max Planck Institute for Evolutionary Anthropology. (Available online at https://wals.info/chapter/118),1,abk abm abz ace aco ady agm ain aro bag bgo bik bla blx bma bod brm brr bto ccm ccp cct ceb cha chr cmr cnl coo cre cro din epe fij fni gar gdi gjj gll goa grb gua hcr hei hop hup iaa ik ind jak jeb juh kab khm kic kio kko kls klv kpm krk kro ktl kwa kwk lah lao len lil lis lkt lnw mal mam mei men mie miz mka mnd mng moj mok mou mrl mut mwb nak nav nbb nca niu niv nuu ojs ond ood otr pai pap pau pir plh plr pna ptp rot sal sam sed sel sey siu sla snc snm squ sra sre sun tag tas tes tgk tha tiv tla tli tmr tna tng tno tpi tug tuk tus tzo tzu uby urk vie wap wlf wlo wol yaq yav yko yor yur zqc,151,76475,0.0019745014
