parameter_id,parameter_name,parameter_description,chapter_id,chapter_citation,value,same_value_language_ids,value_language_count,language_count_total,count_ratio
11A,Front Rounded Vowels,,11,Ian Maddieson. 2013. Front Rounded Vowels. In: Dryer; Matthew S. & Haspelmath; Martin (eds.) 2013. The World Atlas of Language Structures Online. Leipzig: Max Planck Institute for Evolutionary Anthropology. (Available online at https://wals.info/chapter/11),1,abi abk abm ach acm aco adk adz aea aeg agh aht ain aiz akn akw ala ald alw amc ame amh amo amp amu amz ana anc ani ant ao api apu arb arc arm arp asm ata ava awn awp aym bag bai baj bam baw bbf bco bee bej ben ber bet bir bis bki bkr bma bng bno bod bra brb brd brh bri brm brr brw bsq bto bua bul bur byu cac cad cah cam car cax cay cck ccp cha che chk chl chp chu chw cil cle cmn cnl cof coo cre cso cti ctl cub cve cyv dad dag dah dan dar ddf der det dgb die din dio diy diz djp dni dnw don doy dre dts dum dyi efi eka eng epe eve evn ewe ewo eya fas fef fij ful fur fye ga gan gar gbb gds geo ghb gla gmb goa goo grb grk grr grw gua gwa had hai hak ham hau haw hba hin hix hmo hmr hok htc hum hup hve hzb iba igb ign igs ijo ik ika imo ind ing ird irq irr irx iso ite iva iwm jak jaq jav jeb jeh jiv jng jom jpn jpr juh kab kad kal kas kay kch ked kef kek ker ket kew kfe kgu kha khm kho khr khs kio kiw kkn kkv kla klm klv kly kmp kmu knd kng knk knm knr koa kob koh koi kom kor kot koy kpa kpe krb krd krk kro kry kse ksg kss ktk kty kul kun kur kut kwa kwk kwo kws kya kyl kzy lad lah lak lam lan lat lav len lit lkk lkt llm lu lua lug lui luo lus luv maa mab mak mal mao map mar mau max may maz mba mbb mei mgg mie mku mla mne mog mor mov mpa mrd mrg mrl mrn mro mrt mss mtp mui mum mun mxc mxm mya myi mzc nai nan nap nar nas nav ndt ndy nep new nez ngi ngz nhn nht nim nis niv nko nkt nmb nnc nob non nti ntu nug nun nuu nyg nyi oca ogb oji ond ood orh orm otm pac pae pai pau paw pec phl pit pms pnr poa poh pol prh prs psh psm pso puk pur qaw qco qui ram rap res rom ror rsc rtk ruk rus rut sab san sba scs sdh sdw seb sed sha shi shk shs shu sin sla slp sml snc snd snh snm snt som soq sor spa squ sre srn sue sui sup svs swa tab tac tag tam tas teh tel ter tgk tgr tha tic tiw tks tli tma tmn tmp tne toa tok tol ton tru try tsg tsi tso ttn ttu tug tuk tul tun twn tza umb una ung urk usa uzn vie wah wam wao wap wch wdo wic win wiy wlf wma wmu wnt woi wps wra wrd wrs wry xoo yag yan yap yaq yar yaw yay ycn yct yel yes yey ygr yid yim yny yor yuc yul yur yus zan zqc zul zun,525,76475,0.0068649887
2A,Vowel Quality Inventories,,2,Ian Maddieson. 2013. Vowel Quality Inventories. In: Dryer; Matthew S. & Haspelmath; Martin (eds.) 2013. The World Atlas of Language Structures Online. Leipzig: Max Planck Institute for Evolutionary Anthropology. (Available online at https://wals.info/chapter/2),2,abi ach acm aco aeg aht aik ain ame ani ant ao apu arb arc arm asm ata ava baj baw bee bej ber bis bng bno bod brh bri bsq bto bua bul bur cac cam car cha che chk chp cil cle cmn cof coo cso cti cub cve dad dag dah dar ddf der det dgb die diz eka eve evn fas fij fur fye gar geo ghb gmb goa grk gua gwa had hak hau haw hba hin hix hmo hmr hok hop htc hum hve iba igs ind ing ird irq irx ite iwm jak jng jpn jpr juh kad kal kch ked kef kek ker kew kho khr khs kio kiw kkv klv kly kmp knd knk knm koi kot koy kpa krb krk kry kse kty kul kun kur kwa kwk kws lad lam lat lav len lez lit lkk lkt lui luv mak mao map mar mau max may mei mgg mku mlk mnc mnd mne mog mor mov mrd mss mui mum mun mxc mxm mya myi mzc nai nap nar nas ndy nep nez ngz nht nim niv nko nmb nob ntu nun oca ood orh orm paw pec pms pol prs psh psm pso pur qco rap res ror rsc rtk rus rut sba scs sdw seb sha shi shu sin sla slp snc soq sor spa sue svs swa tab tag tam tel ter tgk tgr tic toa tok tol ton tru try tso ttn ttu tuk twn tza umb ung urk usa uzn wah wao wap war wch win wiy wma wmu wra wrd wry xoo yag yan yaq yar yaw yay ycn yct yey ygr yko ytu yuc yur zqc zul zun,287,76475,0.0037528605
88A,Order of Demonstrative and Noun,,88,Matthew S. Dryer. 2013. Order of Demonstrative and Noun. In: Dryer; Matthew S. & Haspelmath; Martin (eds.) 2013. The World Atlas of Language Structures Online. Leipzig: Max Planck Institute for Evolutionary Anthropology. (Available online at https://wals.info/chapter/88),1,abi abk abv aco adk ain ala alb als alw amb amc amh ami amk amn amr ams ana ani ann anu apt apu apw ara arc arm arp arw asm ass ath atk ats ava awa awp awt aym bae baq bar bdm bfg bho bii bil bkt bku bla blg blr blt bnb bnj bnn bnr bod brh brl brm brs bsk bub bul bur but bya cak car cas cay cde cea cha chc chd che chg chk chn chp chs chv ckl cld cln cml cmn cnm cnt coc coo cor cpn cpy cre crp cti ctl cup cyv cze daw des dgr dhi dhm diy djm djn djp djr dlm dmi dms dom drm dsh dua duk dul dut dyi emb eme eng epe est eud eve fin for fre fri fur ga gaa gam gar gav geo ger gid gjj gnb god gon goo grg grj grk grr gto gua guj gur guu gyc hai hak haw hay hei hhu hil hin hlu hmi hop hpd htc hua hun hup hve hwr hzb ice idn idu ifu ijo ilo ing iqu ita ite iwa jaq jbt jeb jng joh jpn jva kaa kab kac kae kas kay kbt kem ket kew kgy kha khg khl kho khr khs kin kio kiw kkp kkt kku kkw klm klr kls kma kmh kmn kms knd knn kno koa kok kol kor koy krc kri krk krn krw kry krz ksa ktm kty kum kuo kut kuv kwo kwt kxo kyn kyr lac lad lat ldu lec lep lez lil lim lit lmn lui lun maa mac mai mak mam map mau mcd mco mcv mdm mds mek men mgg mgi mhi mie mik mis miy mkg mmn mnd mne mns moa moh mot mra mrc mrt mru msc msg msq mss mto mtt mun mut mwb mxx myi mym naj nas nav nax nbd nca ndj nep nev new nez ngi ngl ngn ngw nhh nhm nhn nht niv nku nnc noc nor nph nrg nsn nti ntu nug nwd nyk nyn nyr nyu nze ocu oji omh omi ond ood oss otm pae pai pal pam pan pau paw pba pdp pga pia pir plk pno pny pod pol por ppc pra pre prk prs psh psm pso ptt pum pur qaf qhu qim qui qum ram raw rem res ret rgc rmb rsu ruk rus rut rwe sal sar sav scr sdw sec she shh shi shk shm sho shp sid sin siu skp sla slb slo sme smn sna sng snm snt spa spi squ src srn stl suk sup sus svs swe swt tac tah taj tam tar tau taw tbl tce tee tel tgl thd thk thn thu tic tig tiw tkl tkm tla tli tls tml tnc tni tnn tob tot tpn tps tpt trr tru trw tsf tsz ttu tuc tul tur tuv tuy tvo tvt twe txj udi udm uhi ukr una urd urk urn usr ute uzb vaf wak wam wao wap was wbn wed wem wic wik wiy wlo wly wme wra wrd wrk xam xas xer yag yaq ybi ycn yin yko ykt yng yny yok yuc yuk yur yuw zay zaz zch zqc zqs zun,542,76475,0.0070872833
97A,Relationship between the Order of Object and Verb and the Order of Adjective and Noun,,97,Matthew S. Dryer. 2013. Relationship between the Order of Object and Verb and the Order of Adjective and Noun. In: Dryer; Matthew S. & Haspelmath; Martin (eds.) 2013. The World Atlas of Language Structures Online. Leipzig: Max Planck Institute for Evolutionary Anthropology. (Available online at https://wals.info/chapter/97),5,abi ace acn aco adn ajg alw amm amt ani any apu arm ata avo bac bbw bej bgn bgo bio bkl blr bnb boj brs btk bua cai cam cav cct chg chs cmh coo cuc dam ddj deg der dgo dhr die din djm djn djr dlm dul dut emm esm fri gah ger ggu gid gim git gmz gnn grg grj gum gwa han hil hup ido ina ite izi jam jeb jug kac kan kay kis kkw kla klm kmw knk kpm krj krk kut kws kwt kyr laf lah lai ldu lec les lgt lml lmu lug lui lun mad mak mam mch mcv mei men mik min mir mmn moa moh mos mou mra mrw mss mtt mxx mzh nag nas ney nez ngi ngk ngl ngw nha nhn nke nmm nti nue nug nuu nyr obo oks pau pdp pnn pnx pny pod pok ppi rit rji ruk sal see ser shk snc son swt tac tag tar tic tik tis tiv tja tla tli tot tpn trr tru tuc tus tvt twn tzu uru wan wao wik win wiy wrd wrg wrl wrw yim yin ypk yur ywr zar,198,76475,0.0025890814
82A,Order of Subject and Verb,,82,Matthew S. Dryer. 2013. Order of Subject and Verb. In: Dryer; Matthew S. & Haspelmath; Martin (eds.) 2013. The World Atlas of Language Structures Online. Leipzig: Max Planck Institute for Evolutionary Anthropology. (Available online at https://wals.info/chapter/82),1,aab aar aba abi abk abn abo abu abv acg acl acm acn aco adg adi adn ady adz aeg aga agb agh agm agt ain aja ajg akh akn ala alb ale alk all aln aly ama amb ame amh aml amn amp amq amt amx ana anc ane ang ani ano anu ao aoj api apt apu apw arc arg ari arj arm aro arp arq arw asm ass ath atk atm au ava avk avo awa awi awp awt awy ayi aym ayo ayr ayw aze azi baa bab baf bag bai bak bam bao bar bas baw bbl bbw bdm bdu bdw bej bel ben ber bgm bgo bgr bgs bgz bho bhu bid bii bik bin bio bir biu bka bkb bkt bku ble blt blx blz bmb bnb bni bnj bnk bnn bnu boa bob bod bok bol bon boq bra brf bri brl brm brn brp brq bry bsh bsk bsq bsr bti bua bub bud bug bum bur bus but buu buy bvi bya bzi cah cai cam can car cas cay cct cde cga chb chc chd chg chh chi chk chn chp chr chs chv chw cic cln cme cmh cml cmn cmr cnl cnt coa coc cop cpn cpy crn cro cti ctm ctw cua cuc cui cup cze dag dam dan daw day ddj dds deg der des deu dga dgb dgo dgr dha dhb dhm die dig dim din dio diy dja dji djp djr dlm dma dmi dmk dms dni dok doy drg drm dsh dua duk dul dum dun dut dyi ebi edo ega egn eip eka eko emb eme emm ene eng eno epe erk err ese est eud eve evn ewe ewo fas fin foe fon for fqs fre fri fua fur fut fye ga gah gal gam gan gap gar gav gbb gbs gds geo ger ggu ghb ghr gim gla gln gmw gmz gnb god goe gog gok gon goo grb grg grw gua gug guh guj gul gur guu guw gwa gwo gyc hai hak hal ham han har hat hau hay heb heh hem hhu hid hin hlp hma hmi hmo hna hnd hol hop hpd hua huc hui hum hun hya hzb iat iau iba ice idn idu ifm igb ige igs iha ijo ika ila imo ina ind ing inn iqu irq irr irx isa isi ite iwa iwm izi jab jad jar jbt jin jiv jmo jms jng joh jpn jrw juh juk jva jwr kaa kab kac kad kae kan kar kas kau kay kba kbo kbu kbw kby kch kdw kel kem ken ker ket kew kfe kga kgu kgy kha khd khg khl khm khn kho khr khs khw kie kik kil kim kin kio kir kis kiw kkp kkq kku kkv kla klg kll klq klw kma kmb kmh kmk kmn kmo kmp kmr kms kmu kmw kmz knb knc knd kng kni knk knm knn kno knr knw knz koa kob koe kok kol kom kon kor kos koy kpw kqq krc krd kre krh krk krr krw kry krz ksa kse ksg ksm ksn kta ktc kte kti ktl kty kum kun kus kuu kuv kwa kwn kwo kwt kwy kwz kxo kya kyk kyl kyn kyp kyr kyz kzy laa lab lad lag lah lai lak lal lan lao lar lav lbu lda ldo ldu leb lec leg lel len lep les let lew lez lgi lgt lho lic lim lin lis lit lkt llm lmh lmn lmp lmu lnd lon lot lou luc lug lui luo luv ma mab mad mae mag mai man mar mas mau maw max may mba mbe mbi mbm mbo mbr mbt mby mcd mda mde mdg mdl mdn mdo mds mdw mea mee mei mek mem mer mey mga mgg mgh mgi mgk mgo mgq mgu mhi mhu mie mii mij mik mil mis miz mka mkd mke mkg mkh mki mkj mkl mkq mku mkz mla mlg mlk mlm mlu mmb mmv mnc mnd mne mng mni mnm mno mns mnv mny moe mof mog mom mon moo mor mos mot mou mpa mpt mpu mqf mrc mrd mrg mrh mri mro mrr mrs mrt mru mrw msc msg msl msm msn mss mtb mto mts mtu mua mui mum mun mup mur mus muu mwe mwo mxe myg myi mym myn myr nab nad nag nah naj nak nal nam nar nas nat nav nbd nbe nbm nbr ncm ndb ndi ndj ndo ndt ndu ndy neh nep nev new ney nga ngd ngi ngj ngk ngm ngn ngo ngt ngu ngw ngz nhn nis niv nkb nke nkn nko nku nma nmb nmd nmm nnd nng nnk noc nog non noo nor nph nse nsn nti ntj nto ntu nua nue nun nup nus nwd nya nyi nyk nza nze obg obo ocu oir oks olo omh omi one ong ora ord orh ori ork oro orw ory osa oss otr owi oya paa pae pal pam pan par pat paw pba pdp per pia pir pis pit pkn plg plh plk pme pmn pms png pno pnu pny pog poh pok por pra pre prh prk prs psh pso psw ptt ptw pul pum pun pur qaf qaw qhu qim rag ral ram rao ras raw rem res ret rga rgc ria rik rim rmb rnd rny rom ron rot rpa rru rsu rum run rus rut rwa ryu sah sak san sap sar sav scr sdw sea sed sem ser ses sgb sgl sgu sha shb she shh shi shk shl shm shn sho sht sia sid sil sin sio sir sis skk skm sko skp skr sku skw sla slb sle slo sme smn sna sng snh snm snn sno snt sob sod som son spi srb src srd sre srn sro ssa sta sti stl stn sud sue suk sul sun sup sus svs swa swe syu tab tac taf taj tak tal tam tan tao tar tau taw tba tbl tbt tbu tbw tce tdi tdr tel teo ter tet tgk tgl tgn tgr tha thk thn thu thy tia tib tid tig tik tis tiv tiw tja tki tkl tkm tlf tli tlo tma tmc tmg tml tmm tmn tmo tmr tnb tnc tne tni tnk tnn tny tod ton tou toz tpr tpt trb trm trr tru trw tsf tsh tsz ttd tte ttn ttu tuc tul tum tun tur tuv tuy tvo tvt twe twn txj tye uby udh udi udm uhi ukr uld uli una ung ura urd urk url urt uru usa usr uyg uzb vai ven vie vnm wag wah wak wal wan wao wap was wau way wbn wch wed wiy wlf wlw wly wma wme wmu wn wna woi wol wom wra wrk wrm wrn wry wsk wtm wwa xam xar xas xav xbi xer xho xns xoo yah yal yam yaq yar yay ybi ycn yei yel ygr yi yid yim yin yko ykt ylm yng yor yqy ytu yuc yuk yul yur yus yuw zag zan zar zay zaz zch zhn zim zpr zul zun,1192,76475,0.015586793
19A,Presence of Uncommon Consonants,,19,Ian Maddieson. 2013. Presence of Uncommon Consonants. In: Dryer; Matthew S. & Haspelmath; Martin (eds.) 2013. The World Atlas of Language Structures Online. Leipzig: Max Planck Institute for Evolutionary Anthropology. (Available online at https://wals.info/chapter/19),1,abi abm ach acm adk adz aht aik ain akn akw ala alw amh amp amu amz ana anc ant ao api apu arb arm arp asm awn awp aym aze bag bai baj bam baw bco bee bej ben bis bki bkr bng bno bod brd bre brh bri brr brw bsq bto bua bul bur byu cac cad cah cam car cax cay cck ccp cha che chk chl chu chv chw cil cle cmn cnl cnt cof coo cre cso cti ctl cve cyv dad dag dar ddf der dgr die din dio diy diz djp dni dnw don dum dyi eka epe eve evn eya fas fef fin fre ful fur fuz fye gan gar gds geo ger ghb gla gmb goa goo grr grw gua hai hak ham hau haw hba hin hix hmo hmr hok hop hun hup iba ign ik ika imo ind ird irr irx ite iva iwm jak jaq jav jeb jeh jiv jng jom jpn jpr kad kal kas kay kch ked kef kek ker ket kew kfe kgi kgu kgz kha khm khr khs kio kiw kkn kkv klm klv kly kmp kmu knd kng knk knm knr koa kob koi kom kor kot koy krb krk kro kry kse kty kul kun kur kut kwa kwk kwo kws kya kyl kzy lad lah lam lan lat lav len lep lez lit lkt lu lua lui luo lus luv maa mab mak mal mao mau max may maz mbb mei mgg mie mku mla mlk mnc mnd mne mog mor mov mpa mrd mrg mrn mrt mss mtp mui mun mya myi mzc nai nan nap nar nas nav nax nbk ndt ndy nep new nez ngz nhn nht nim nis niv nko nkt nmb nnc nob non nor nug nun nyg nyi oca oji ond ood orh orm pac pae pai pau paw pec phl pit pms pnr poa poh pol prh prs psh psm pso puk pur qaw qui ram rap res rom ror rsc rus sab sba scs sdh seb sed sel sha shi shk shs shu sin skp sla slp sml snc snh snm snt sor sre srn sue sui sup svs tab tag tam teh tel ter tgk tha tib tic tiw tks tli tlp tmn toa tol ton tpa tru try tsg tsi tso ttn tug tuk tul tun tur tuv twn tza umb una ung urk usa uzn vie wah wam wao wap war wch wdo wic win wiy wlf wma wmu wnt woi wps wra wrd wrs wry wuc yag yan yaq yar yaw ycn yct yes ygr yid yim yko ykt yny ytu yuc yur yus zqc zun,449,76475,0.0058711995
69A,Position of Tense-Aspect Affixes,,69,Matthew S. Dryer. 2013. Position of Tense-Aspect Affixes. In: Dryer; Matthew S. & Haspelmath; Martin (eds.) 2013. The World Atlas of Language Structures Online. Leipzig: Max Planck Institute for Evolutionary Anthropology. (Available online at https://wals.info/chapter/69),4,aeg agc amh amr ang anu any arg arq asy ata ats awy bag bbl bbw bdu bfg bia bkl blr bma boa bsq bti ccm chh chk chq ckl cle cya cyv cze dds dgb die dio eno gae gbs gmz gnb ham heb hup hve iri izi jak jms kab kan kgr kik kls kmr kon kpm krd kre kro kry ktm kuo kwy laa lar lat lbu ldo leg lel lmg lml maa mbl mcc mea meh mer mga mki mmn moh mok mrg mrl msk mug mur mxo myi naj nak nam nan ncm ndb ndj ngo nym nyu ond pai per pkt poh prs qia rik rus rut sak sar shs sht sod src stn sup taj tee tep tes tic tim tli tlo tne tot tus txj tzo tzu vai wag wic wrw wya xho yei ygr yul zag,146,76475,0.0019091206
81A,Order of Subject; Object and Verb,,81,Matthew S. Dryer. 2013. Order of Subject; Object and Verb. In: Dryer; Matthew S. & Haspelmath; Martin (eds.) 2013. The World Atlas of Language Structures Online. Leipzig: Max Planck Institute for Evolutionary Anthropology. (Available online at https://wals.info/chapter/81),2,aab abi abu acg acl acm adi adz aeg agb agh aja akn alb alk aln ama aml amq anc ane anu aoj apu ara arg ari arj aro arp arq au avk ayi ayr ayw bab bae baf bag bai bak bar bas bbl bdu ber bgo bgr bgs bgz bid bii bik bir bka bku ble blz bmb bni bnk bnn bob bol bra bre brf brn brq bsh bub bud bug bul bum buu buy bvi cga chr chw cic cme cmy cnt coc cop crn ctl cua cuc cze day deg dga dgb dio dma dok don doy dsh dua duk ebi ega egn eko eng eno erk err est ewe ewo fin fon fre fua fut fye ga gbb gbs gla gmz gnb goe gok grb gua gul guw gwo hak hal hat hau heb heh hem hmo hna hnd hol htc huc hve hya iaa iba ice ifm igb ige igs ila ind iqu irr ita iwa izi jab jar jmo juh juk kad kan kar kas kau kba kbw kby kch kdw kel ken ker kfe kga khm khn khs kik kil kin kir kkv kla kmu kni knk koe kom kon kos kpw kre ksg ksm ksn ktc kte ktl kwa kwn kwy kyl kzy laa lab lag lan lao lat lbu ldo leb leg lel len let lew lgi lic lin lit llm lmh lmp lmu lnd lon lou luc luo luv ma mae map mas mau may mba mbe mbi mbm mbr mbt mby mcd mcv mda mdg mdo mds mdw mea mee mga mgk mgo mgu mhu mie mkd mkq mkz mla mlg mlm mlu mmb mmv mna mnd mng moe mof mok mon moo mor mos mpr mpu mrg mro mrt msm mtb mua mum mup mur mus mut mwe mwo mxe myg myn nak nal nbe nbm ncm ndb ndi ndo ndt ndu ndy neh ngb ngd ngm ngo ngu ngw ngz nhm nhn nht nke nkn nko nne nng non noo nor nse nto nua nun nup nza obg obo ocu olo one ora otr paa pal pam pat pau per pga pkn plg plh plk pms png pnu pog poh pol por pre psw pul pur rag rga rim rny rom ron rot rru rsu rus sah sak sal san sap scr sea sed ses sgb sgl sgu sha shl shm shn sht sio sir sis skm sku sle slo sno sob son spa srd sre ssa sti stn sud sul sun swa swe tab taf tal tan tbw teo tep ter tet tgk tgn tha tia tid tiv tiw tki tla tmm tmn tmr tne tnk toz tpr trm ttd ttn tum txj ukr uld uli ura url urt ven vie vnm wal wch wlf wma wol wrk wrm wrn wry wwa xam xar xbi xho xoo yao yay ycn yin yng yor yuk yul zan zch zhn zpr zqs zul,488,76475,0.0063811704
87A,Order of Adjective and Noun,,87,Matthew S. Dryer. 2013. Order of Adjective and Noun. In: Dryer; Matthew S. & Haspelmath; Martin (eds.) 2013. The World Atlas of Language Structures Online. Leipzig: Max Planck Institute for Evolutionary Anthropology. (Available online at https://wals.info/chapter/87),3,abi acn aco alw amm amt ata bac bbw bej bgn bgo bio bkl boj brs btk bua cam chg chs cmh cuc deg der djm djr dlm dul esm gah gim gmz grg grj gum han hil ite izi jam jug kac kan kla knk kpm krj kwt kyr laf lah lai lmu lun mak mam mch mcv mei men mik mir mmn mos mss nag nas ngi ngw nhn nke nmm nug nuu nyr obo oks pdp pnn pny pod rji ruk sal see shk son swt tac tag tar tis tiv tla tli tot tpn trr tru tuc tvt tzu uru wan wao yim yin ypk,110,76475,0.0014383786
7A,Glottalized Consonants,,7,Ian Maddieson. 2013. Glottalized Consonants. In: Dryer; Matthew S. & Haspelmath; Martin (eds.) 2013. The World Atlas of Language Structures Online. Leipzig: Max Planck Institute for Evolutionary Anthropology. (Available online at https://wals.info/chapter/7),2,abk aht amh ani arc arm ava aym bco ber cad chl chp chu coo diz eya geo had htc hup hzb ing ite jak jaq juh kab kef kio kor lak lez lkt mak nav pso qaw qco qui rut sdw sel shs sin teh tgr tli tol tru ttu twn tza win yan yey zun,58,76475,0.00075841777
18A,Absence of Common Consonants,,18,Ian Maddieson. 2013. Absence of Common Consonants. In: Dryer; Matthew S. & Haspelmath; Martin (eds.) 2013. The World Atlas of Language Structures Online. Leipzig: Max Planck Institute for Evolutionary Anthropology. (Available online at https://wals.info/chapter/18),1,abi abk abm ach acm aco adz aea aeg agh aht aik ain aiz akn akw ala alb ald amc ame amh amo amu amz ana anc ani ao api apu arb arc arm arp asm ata ava awn awp aym aze bag bai baj bam baw bbf bco bee bej ben ber bet bir bis bki bkr bma bng bod bra brb bre brh bri brm brw bsk bsq bto bul bur cad cah cam car cax cay cck ccp cha che chk chl chq chu chv chw cil cle cmn cnl cnt cof coo cre cso cti ctl cve cyv dad dag dah dan dar ddf det dgb dgr die dio diz dni dnw don doy dre dts dum efi eja eng eve evn ewe ewo fas fef fij fin fre ful fur fuz fye ga gar gbb geo ger ghb gla gmb goa grb grk grw gua gwa had hai hak ham hau hba hin hix hmo hmr hok hop htc hum hun hup hve hzb iaa iba igb ign igs ijo ik ika imo ind ing ird irq irr irx iso ite iva iwm jak jaq jav jeb jeh jiv jng jom jpn jpr juh kab kad kal kas kch ked kef kek ker ket kew kfe kgi kgz kha khm kho khr khs kio kiw kkn kkv klm klv kly kmp kmu knd knk knm knr koa kob koh koi kom kor kot koy kpe krd krk kro kry kse ksg kss ktk kty kul kun kur kut kwa kwk kwo kws kyl kzy lad lah lak lam lat lav len lep lez lit lkk lkt llm lu lua lug lui luo lus luv maa mab mak mal mao map mar mau may maz mba mbm mei mgg mie mla mme mnc mnd mne mog mor mov mrd mrg mrl mro mss mtp mui mum mun mxc mxm mya mzc nai nan nap nar nas nav nax nbk ndt ndy nep new nez nga ngi ngz nhn nht nim nis niv nko nkt nmb nnc nob non nor nti ntu nun nuu nyg nyi oca ogb oji ood orh orm otm pac pae pai pau paw pec phl pms poa poh pol prs psh psm pso puk pur qaw qco ram rap res rom ror rsc ruk rus rut sab san sba scs sdh sdw seb sed sel sha shi shk shs shu sin skp sla slp sml snc snd snh snm snt som soq sor spa squ sre srn sue sui sup svs swa tab tac tag tam tas teh tel ter tgk tgr tha tib tic tiw tks tlp tma tmn tmp tne toa tok tol ton tpa tru try tsg tsi tso ttn ttu tug tuk tul tun tur tuv twn tza umb una urk usa uzn vie wap wch win wiy wlf wma wnt woi wps wra wrs wuc xoo yan yap yaq yar yaw yay ycn yct yes yey ygr yko ykt yor ytu yuc yul yur yus zan zqc zul zun,503,76475,0.006577313
92A,Position of Polar Question Particles,,92,Matthew S. Dryer. 2013. Position of Polar Question Particles. In: Dryer; Matthew S. & Haspelmath; Martin (eds.) 2013. The World Atlas of Language Structures Online. Leipzig: Max Planck Institute for Evolutionary Anthropology. (Available online at https://wals.info/chapter/92),6,aar abk acu adz aga ala alk aml ana ang ano apl apu apw ara arc arg arm arw ass ath azi bae baf bao bco bdm bej bgz bii bik bil biu bla ble bln blt bmb bod brm brn brs bsh bti bum bur cah cai can car cba chc chi chk chv cml cmy coa cpl cpy crp ctl cub cup cze des deu dha die dim din dio diy djm dlm dni dsh dut eip emb ene eng eno epe erk fas fij foe fri ful gae gah gal gar gdb gds geo ger ghb gim gln gmw gmz gnb grj grw guj gum gyc hay hix hmi hoa hpd htc hua hya hzb idu igb ijo ing irq irr ita jak jmo jug kab kae kan kay kba kbl kch kem khi kik kis kje kkp klv klw kma kmh kmk kmn kmr kmz knc kni knm knn knr knw koe kok kol kor kqq krc kro kun kuo kuu kws kwz kyk lab lad lan lbu lez lho lin lis lmh lon lot luo mab mac man mao mar mde mdn meh men mer mgg mik mku mlg mna mnc mne mng mni mnm mov mra mrl mrt msc msg msl mts mtt mwo mxc nab nad naj nbd ndi ndj ndr ndy nga ngd ngk ngo ngt ngz nha nht nif nmb nnd nnk noc nor nph nua nyk ora orh osa paa pae pai pal par pau paw pdp pip pme pms poh ppi prk psh pso psw ptt puq qaw qhu qia qui rem rny rom rov ruk run ryu sah sal sar sea ses shl sia sid skw sml smn sna snm spa src sta stl sud sue sul svs swe syu tab taf tai tar tbt tbw tbx tel ten teo thy tid tir tke tml tmo tni tob ton tps tsf tsi tsz tte tuc tun tuy tvl uby udh uli una usa usr uzb vnm wak wao wap war wem wly wma wol wra wrg wrk wrn wtm xbi yal yap yid yko yng yor zag zay zaz zch zqc zzo,355,76475,0.00464204
9A,The Velar Nasal,,9,Gregory D.S. Anderson. 2013. The Velar Nasal. In: Dryer; Matthew S. & Haspelmath; Martin (eds.) 2013. The World Atlas of Language Structures Online. Leipzig: Max Planck Institute for Evolutionary Anthropology. (Available online at https://wals.info/chapter/9),3,abi abk abm abz aco adk ady aeg agu aho aik ain ala alb aln ame amh amr amu amz ana apu ara arb arc arm arp asm awp axv aym aze bdk bej bez bgv bla blc bma bor brh bri brr brs bsq bth car cas cav ccp cct chc chh chi chl chm cht chv cmk cmn cmy coo cor cre crj cui cyv dag emb epe ess ets fre gag gap geo god grf grk gto gua guj guq hai hau hav heb hia hid hin hix hnk hpd hrs hun hzb ika imo ing iri ixi jak jbt jeb jib jpn jrn jva kab kew kfy khi kho khv kio kit klv knd koa krk krt krz ksh ksr kut kwo kws kwz lak lat lez lil lkt mak mam mar max may meh mkw mlt mma mos mov mui mxc mxt naa nam nav ndy nev nez ngz nhn nko nti oca ond orh orl osa oss otm pau pip prh prs psm pso qec qim qui rus rut san sba sel shk shw sla snm snt sod som soq spa squ sue swr tac tas tce tec teh tew til tin tli tlp tnd tps tru tsi tsz ttu tun tur twn uby udi umu usa wap war wch wic win wnb wra wrm xav yag yaq yki ykp ynm yor yrc yta yuc yur zso zun,235,76475,0.0030728995
