parameter_id,parameter_name,parameter_description,chapter_id,chapter_citation,value,same_value_language_ids,value_language_count,language_count_total,count_ratio
8A,Lateral Consonants,,8,Ian Maddieson. 2013. Lateral Consonants. In: Dryer; Matthew S. & Haspelmath; Martin (eds.) 2013. The World Atlas of Language Structures Online. Leipzig: Max Planck Institute for Evolutionary Anthropology. (Available online at https://wals.info/chapter/8),2,abi abk acm aea aeg agh aiz alb ald alw ame amh amo amp amz ana anc ao arm arp ata awn aym aze bag bai baj bam baw bbf bco bee bej ben ber bet bir bis bki bkr bma bng bod bra brb brd bre brh brm brw bsk bsq bto bua bul bur byu cac cah cam cay cha che chl chq chu chv chw cil cle cnl cnt cso cti ctl dan dar ddf dgb dgr die din dio diy diz djp dni dnw don doy dre dts dum dyi eng eve evn ewe ewo fij fin fre ful fur fuz fye ga gbb ger ghb gla gmb goo grb grk grr gua gwa hak hau haw hba hin hmo hmr htc hun hve iba igb ign igs ijo ik imo ind ing ird irx iso iva jak jaq jav jeb jeh jng juh kad kas kay kch ked kef kek ker kfe kgi kgu kgz kha khr khs kkn kkv klm klv kly kmp kmu knd knm knr kob koi kom kor kot koy kpe krd kro kry kse ksg kss ktk kty kul kun kur kwa kws kya kyl kzy lad lah lak lan lat lav len lep lez lkk lkt llm lu lua lui luo maa mab mal map mar mau maz mba mbb mbm mei mgg mie mku mla mlk mme mnc mnd mne mog mpa mrl mrn mro mrt mss mum mun mxc mxm mya myi mzc nai nan nap nar nax nbk ndt ndy nep new nga ngi nhn nis niv nkt nnc nob non nor nti ntu nug nun nyg nyi ogb oji ond orh orm otm pac pae pec phl pit pms poa poh pol prs psm pso puk pur qaw qco ram rom rsc ruk rus rut sab san sba scs sdh seb sed sel sha skp slp sml snd snh som soq sor spa sre sui sup svs swa tab tag tam tas tel tgr tha tib tiw tks tlp tma tmn tmp tne toa tok tol ton try tsg ttn tug tuk tul tun tur tuv tza umb una ung uzn vie wah wam wap wch wdo wlf wma wmu woi wrd wrs wry wuc xoo yan yap yaq yay yct yel yes yid yim yko yny yor ytu yul yus zqc,388,76475,0.0050735534
4A,Voicing in Plosives and Fricatives,,4,Ian Maddieson. 2013. Voicing in Plosives and Fricatives. In: Dryer; Matthew S. & Haspelmath; Martin (eds.) 2013. The World Atlas of Language Structures Online. Leipzig: Max Planck Institute for Evolutionary Anthropology. (Available online at https://wals.info/chapter/4),2,abm adk adz akn ala ame amh ani arp bag baj bej ben bkr bno brr brw bsq bto cad cam car cay cck cha cle coo cso cub cve cyv dag dar ddf der det din dio dts dum efi eja epe eve evn eya fur gan gar grb had hba hix hve iba ign igs ika irq irx iva jeh jng jpr kas kch ked kef ket khr khs kio kiw kkn kla klm klv knd knk knm koa koi kom kot koy kse ktk kul kun kur kwk kws kyl lan lav lua luo lus mak mei mie mla mnc mpa mrl mrn mro mtp mun mya nai nar ndt nep new nga nim nis nkt nob non nor ntu nyi ood pec prh pso pur qui ram res sab scs sdw sml snh snt som sor sre srn sue tab tac tag teh tel tgk tha tib tic tks tlp tma tmn tne tru try tsg tsi ttn tul tun tuv twn tza una usa wao wap win wlf wma woi wps xoo yan yap yaq yar yaw yay ygr yko yor ytu yuc,189,76475,0.0024713958
6A,Uvular Consonants,,6,Ian Maddieson. 2013. Uvular Consonants. In: Dryer; Matthew S. & Haspelmath; Martin (eds.) 2013. The World Atlas of Language Structures Online. Leipzig: Max Planck Institute for Evolutionary Anthropology. (Available online at https://wals.info/chapter/6),1,abm ach aco adk adz agh aik ain aiz akn akw ala alb ald alw amc ame amh amo amp amu amz ana anc ant ao api apu arb arp asm awp aze bag bai baj bam baw bbf bee bej ben ber bet bir bis bki bkr bng bno bod bra brb brd bre brh bri brm brr brw bsq bto bua bul byu cac cad cam car cax cay cck ccp cha che chp chq chu chv chw cil cle cmn cnl cnt cof cre cso cti ctl cub cve cyv dad dag dah dan dar der det dgb dgr din dio diy diz djp dni dnw doy dre dts dum dyi efi eja eka eng epe eve evn ewe ewo fas fef fij fin ful fur fuz fye ga gan gar gbb gds ghb gmb goa goo grb grk grr gua gwa had hak hau haw hin hix hok htc hum hun hve iaa iba igb ign igs ijo ik ika imo ind ird irr irx iso iva iwm jav jeb jeh jiv jng jom jpr juh kad kas kay kch ked kef ker kew kfe kgi kgu kha khm kho khr khs kio kiw kkn kkv kla klv kly kmu knd kng knk knm knr koa kob koh koi kom kor kot koy kpa kpe krb krk kro kse ksg kss ktk kty kul kun kwa kwo kws kya kyl kzy lad lam lan lat lav len lep lit lkk lkt llm lu lua lug luo luv maa mab mal mao map mau max may maz mba mbb mbm mei mie mku mla mlk mme mnc mnd mne mor mov mpa mrd mrg mrl mrn mro mrt mss mtp mui mum mun mxc mxm mya myi mzc nai nan nar nas nav nbk ndt ndy nep new nga ngi ngz nhn nht nim nis nko nkt nmb nnc nob non nor nti ntu nug nun nyg nyi oca ogb oji ond ood orh otm pac pae pau paw pec phl pit pms pnr poa poh pol prh psm puk pur qaw ram rap res rom ror rsc rtk ruk rus sab san sba scs sdh sdw seb sed sha shi shk shs sin sla slp sml snc snd snh snm snt soq sor spa sre srn sue sup svs swa tab tac tag tam tas tel ter tgk tgr tha tib tic tiw tks tlp tma tmn tmp tne toa tok tol ton tru try tsg tso ttn tuk tul tun tur tuv twn tza umb una ung urk usa vie wah wam wao wap war wdo wic wiy wlf wma wmu wnt woi wps wra wrd wrs wry wuc yag yan yap yaq yar yaw yay ycn yct yel yes yey ygr yid yim ykt yny yor yuc yul yur zan zqc zul zun,470,76475,0.006145799
116A,Polar Questions,,116,Matthew S. Dryer. 2013. Polar Questions. In: Dryer; Matthew S. & Haspelmath; Martin (eds.) 2013. The World Atlas of Language Structures Online. Leipzig: Max Planck Institute for Evolutionary Anthropology. (Available online at https://wals.info/chapter/116),2,aar abk acu aga ana ang apw arc ass ath bao bco bej biu bla bln blt bmb bod brm brn brs bti bur can car cba chc chi chv coa cpy crp cub des deu die dim dni eip emb ene epe fas foe ful gae gah gal gar gdb gds gim gln gmz grw gyc hua hzb idu ijo ing irq jug kae kan kem khi kje kkp klw kmh kmk kmn kmr knm knn knr knw koe kok kol kor krc kro kwz kyk lad lez lho lis lot mab mar mdn men mgg mik mnc mne mni msc msg msl mts mtt nbd nga ngt nmb nnd noc nph nyk pae pau paw pdp pme prk pso ptt qaw qhu qia qui rem run ryu sal sia smn sna src sta stl sue syu tbx tel tml tmo tni ton tsf tsz tte tuc tun tuy uby una usr uzb wak wao wap wly wra wtm yal zag zqc,164,76475,0.0021444918
78A,Coding of Evidentiality,,78,Ferdinand de Haan. 2013. Coding of Evidentiality. In: Dryer; Matthew S. & Haspelmath; Martin (eds.) 2013. The World Atlas of Language Structures Online. Leipzig: Max Planck Institute for Evolutionary Anthropology. (Available online at https://wals.info/chapter/78),4,afr ana apl baq bej blx bsq cbo cha cnt coe coo cor ctm dmi dni epe ese gjj gua ham hlu hop iqu itz jak jem kic kma krk kws lah leg lim lkt mja moh mrd mxo mxs nav nhm nhn nht ond otm pau pir pit pot prc sla squ sue tac tag tew tru tsh tzo tzu urk wai way,65,76475,0.00084995094
33A,Coding of Nominal Plurality,,33,Matthew S. Dryer. 2013. Coding of Nominal Plurality. In: Dryer; Matthew S. & Haspelmath; Martin (eds.) 2013. The World Atlas of Language Structures Online. Leipzig: Max Planck Institute for Evolutionary Anthropology. (Available online at https://wals.info/chapter/33),2,abi abk abn acg aco agt ain alb ale aln amh amx any ao apu ara arc arm arp arw asm ath ava avo awa awe awp awt aym aze azi baa bae bam baq bar bdm bej bgn bho bid big bkb bla bln blt bmz bnu bod bre brh bri brn brs bsk bti bud bul bun bur but bya cah cai cam car cas cax cde chb chc chg chk chn chs chv chx ckl cld cln cmh cmn cmy coc cpy cqt cre crn cro crp ctm cup cze des deu dgb dgo dhr dhw did dji djn dmk dms dom doy drg dsh dut eip emb ene eng est eve evn fin for fre fua ful ga gah gal gam gds geo ger ggu gil gim gmw gnd goa god gon grb grf grk grw gud guh gum guu gyc hai hau hay hdi heb hhu hid hin hlp hma hmi ho hop htc hui hum hun hzb ice idn ign igs ijo ik ina ing inn irq ita ite jaq jeb jiv jlu jpn jug jva kab kac kai kbu kdw kem ket kew kfe kgz khg khi khl kho kie kio kir kiw kkp kku kla klw kma kmh kmk kmo kms knd kni knk knn knr knw kob kok kol kop kor koy kpe krc krd kri krk krn krw kry kta kty kum kuv kws kwt kxo kyq lad lah lan lar lat lav ldu lec lel les lez lit lmg lmn lng lug lui lul lun luo ma maa mab mac mag maj man mas mba mbr mcv mde mdn mea mee meh men mer mgh mgq mgu mij miy mkg mkh mkr mlg mme mmi mna mnc mnd mne mno mns mny moe mog mor mos mot mou mpr mpt mrl mrt msl mss mts mtt mui mun mur mut muu myi mzn nab nag naj nan nar nav nbd nbr ndt nep ngi ngj ngm ngz nha nhh nhn nht niv nkb noc nog nor nrg ntu nua oir oji oks olo one ong ord ork oss oya paa pae pan pdp pga pia pip plh plk pme pol por prk prs psh psm pso ptt ptw pur pwn qhu qim ras rem res rgc rit rny rom run rus rut rwe sal sav scr sdw seb sec ser sgb shd shk shl sho shp sht shy sid sil sin siu skp sla slb slo slp smn sna sno so sob som sor spa spi src srd sta stl sug suk sup swe taj tao tar tbu tel ten tep thk thn tic tig tir tiw tkl tlf tli tma tmc tml tnc tny tob ton tou tpt trb trm trr trw tsh tsz tts ttu tuc tul tun tur tuv tvo twn tzo uby udi udm ukr urd urk urn usr ute uyg uzb wak wal wao wap wau wbn wch wel wik wly wra wrd wrk wrl xas xoo yag yam yaq yar ycn yim yin yko ykt yok ypk ytu yuk yuw ywl zay zpr zqc zun,513,76475,0.0067080744
83A,Order of Object and Verb,,83,Matthew S. Dryer. 2013. Order of Object and Verb. In: Dryer; Matthew S. & Haspelmath; Martin (eds.) 2013. The World Atlas of Language Structures Online. Leipzig: Max Planck Institute for Evolutionary Anthropology. (Available online at https://wals.info/chapter/83),2,aab abi abu acg acl acm adi adz aeg agb agc agd agh aja akn alb alk aln als ama ami aml amo amq amr ams anc ane anj ann anu aoj ara arg ari arj aro arp arq asy ata au avk ayi ayo ayr ayw bab bae baf bag bai baj bak baq bar bas bbl bbu bch bco bdu ber bfg bgo bgr bgs bgz bid big bii bik bil bir bka bkl bkr bku bla ble blg blu blz bma bmb bni bnk bnn bob bol bra bre brf brn brq brr bse bsh btk bto bub bud bug bul bum buu buy bvi bwc cak cax cba ccm cea ceb cem cga cha chj chq chr chw chx cic ckl cle cme cmx cmy cnt coc coe cop cor cos cpl cqt cre crn cso ctl cua cuc cya cyv cze day deg dga dgb did dio dma dok dom don doy dre dsh dua duk ebi ega egn eko eng eno erk err esm est ewe ewo fij fin fon fre fua fut fye ga gae gbb gbs gel gir giz gjj gla gmz gnb gnd goa goe gok grb grf grk grr gto gua gud gul guw gwo hak hal hat hau haw hdi heb heh hei hem hil hlu hmo hna hnd hoa hol htc huc hun hve hya iaa iba ice ifm ifu igb ige ign igs ik ila ilo ind iqu iri irr ita iwa ixi izi jab jak jar jmo juh juk kad kam kan kar kas kau kba kbl kbw kby kch kdw kdz kel ken ker kfe kga kgr khm khn khs kik kil kin kir kje kkt kkv kla kls klv kmj kmu kni knk koe kom kon kos kpm kpw krb kre kri kro ksg ksm ksn ktc kte ktl kuo kut kwa kwk kwn kwy kyl kyq kzy laa lab lac lag lan lao lat lbu ldo leb leg lel len let lew lgi lgu lic lil lin lit llm lmg lmh lmp lmu lnd lon lou luc luo luv ma maa mae maj mak mal mam mao map mas mau may mba mbe mbi mbl mbm mbr mbt mby mcd mch mcv mda mdg mdm mdo mds mdw mea mee meh mga mgk mgo mgu mhu mie miy mkd mkq mkz mla mlg mlm mlu mmb mmn mmv mna mnd mng moe mof mok mon moo mor mos mov mpo mpr mpu mrg mrl mro mrq mrt msk msm msq mtb mua mum mup mur mus mut mwb mwe mwo mxc mxe mxj mxo mxp mxy myg myn mzc nak nal nan nau nbe nbm nca ncm ndb ndi ndo ndr ndt ndu ndy neh ngd ngm ngo ngu ngw ngz nhh nhm nhn nht nia nif niu nke nkn nko nnc nne nng non noo nor nse nsg nto nua nun nup nuu nym nyn nza obg obo ocu oji olo ond one ood ora otm otr paa pai pal pam pat per pga pip pkn pkt plg plh plk pms png pnn pnu pod pog poh pol por pre psm psw pul pur qui qum rag rap rga rim rny rom ron rot rov rru rsu ruk rus rwe sah sak sal sam san sap scr sea seb sed see ses sgb sgl sgu sha shl shm shn shp shs sht shu sim sio sir sis siu skm sku sle slo sml smp sno so sob son spa squ srd sre ssa sti stn sud sul sun swa swe swt tab taf tag tah tai tal tan tas tat tbo tbw tee ten teo tep ter tes tet tgh tgk tgn tha tho tia tid tim tin tiv tiw tke tki tla tlp tmm tmn tmr tna tne tng tnk tno tob toz tpn tpr tps tri trm tsg tsi tsk tsr ttd ttn tuk tum txj tzo tzu ukr uld uli ura url urt ven vie vnm wal wam war wch wec wel wem wlf wlo wma wol wrb wrk wrm wrn wry wth wwa wya xam xar xbi xho xoo yag yao yap yay ycn yin yng yok yor yul ywl zai zan zap zch zhn zpr zqc zqo zqs zul zya zzo,705,76475,0.009218699
101A,Expression of Pronominal Subjects,,101,Matthew S. Dryer. 2013. Expression of Pronominal Subjects. In: Dryer; Matthew S. & Haspelmath; Martin (eds.) 2013. The World Atlas of Language Structures Online. Leipzig: Max Planck Institute for Evolutionary Anthropology. (Available online at https://wals.info/chapter/101),2,aar abk acg acl aco aeg aga ain aja ala alb all amh amq amr amx ane ang any aoj apl apu apw ara arg arm arp arq arw asm ass asy ath awa awp aym ayr bae bbl bbw bco bej bel bem bfg bgr big bii bik bin bio bir bku bln blx blz bma bnb bob bol bre brf brh brp brr brs bsh bsk bsq bsr bul bum bur cah cai cax cba cct cde che chh chi chk chx cic cld cle cln cmy coo crn cro ctl cub cyv cze dag dds des dhi die dig dim dio dlm dni dom efi eip eko emb eme ene err esm est ewe ewo fua fur ga gaa gah gds gjj gln gmw gmz goo grg grk grw gua gul gyc ham hat hay heh hix hlu hmi hnd hua hun hya ifu ige ik ika ila ina irq isa ita ite izi jab jam jmo kab kae kam kan kba kdw kew kfe kga kgr kgz kik kio kkv klv kma kmb kmh kmj kmp kms kmz knd knm kno knr koa kob koe kon krc krd kre krk krr krw ksa kty kwk kwn kwt kwz kyk lan lav lbu lda ldo leg len let lgi lil lim lin lit lkt llm lml luc lul luo luv luy maa mab mac maj map mar mau mbl mbo mbt mby mcc mcv mdn mea mee meh mir mkd mki mku mlu mme mmw mna mne mnm mns moe moh mou mpr mpt mpu mra mrl mro msc msl mss mtb mua myi mzh nab nag naj nan nav nbd ndb ndj nez nga ngo nhh nhm nhn nht nko nmb nnd nse nti ntu nua nue nug nwd nym nyn nyu obg obo ocu olo ond orh oro osa otm pai pan pau pga pkn pkt plh pms pog por pra pre prs pwn qim qum ram rem rim rny rru ruk run rut sak san sar scr ser sgb sgl sgu shm shu sid sio siu skm skp sla slb slo sml so sob spa squ srb src sro stn sul swa taj tar tau tbw ten tep tes tet tgh tgn tgr tiw tja tki tkl tkm tli tlo tmc tmr tna tnc tob ton toz tps trb trr tsk tsz tte tuk tun tur tus tuv tvo uby udm uld una ung ura urk urn usa usr uzb ven wai wal was way wic wiy wma wrd wrk wrm wrw wry wya yal yao yar yel ygr yim yko ypk yuc yur ywl zai zap zay zqc zul,437,76475,0.0057142857
5A,Voicing and Gaps in Plosive Systems,,5,Ian Maddieson. 2013. Voicing and Gaps in Plosive Systems. In: Dryer; Matthew S. & Haspelmath; Martin (eds.) 2013. The World Atlas of Language Structures Online. Leipzig: Max Planck Institute for Evolutionary Anthropology. (Available online at https://wals.info/chapter/5),4,adk ana baw brw cad cil cub cyv eka ghb hix hve ign irx khs kla kws kyl lav lu mak nkt pso sui sup tac teh tha tne ttn win yaw yay,34,76475,0.00044458974
77A,Semantic Distinctions of Evidentiality,,77,Ferdinand de Haan. 2013. Semantic Distinctions of Evidentiality. In: Dryer; Matthew S. & Haspelmath; Martin (eds.) 2013. The World Atlas of Language Structures Online. Leipzig: Max Planck Institute for Evolutionary Anthropology. (Available online at https://wals.info/chapter/77),2,abk abm acm afr aho akr alb amc amu ana apc apu arc arg arw asm baq bco bej blx bor bsq cah cbo ccm cco cct cha che chl chp cku cmn cnt coc coe coo cor ctm den dmi dni dut eka epe ese est fin fox fre gar ger gjj gny goo grf grw gso gua ham hid hlu hop hzb iqu itz jak jem jpn kic kio kma kmk knd kng kor krk kwk kws lah lat lez lim lit lkt mam mdn mja mne moh mrd mrt mss mtg mth mtl mxo mxs myi nav nep nev nhm nhn nht nit niv nmi nsn nuu nwd omh ond ood otm pae pai pau pir pit pno pot prc psm ptw pur put pwn qui rut shk shu sla src srn srr sue swe tac tag tew tkl tml ton tpn trn tru tsh tsi tun twn tzo tzu urk wai wao way wic wra wur yam yaq yko ypk zqc,166,76475,0.002170644
86A,Order of Genitive and Noun,,86,Matthew S. Dryer. 2013. Order of Genitive and Noun. In: Dryer; Matthew S. & Haspelmath; Martin (eds.) 2013. The World Atlas of Language Structures Online. Leipzig: Max Planck Institute for Evolutionary Anthropology. (Available online at https://wals.info/chapter/86),3,abi abn ajg alk ane ann arp au avo bkl bnr bul ckl coo cor cos cze djm djp eng fri gku goo gum guu guw ik ite kau kdw kmr krj kun kws kya laf lel les lkt lmh mab mad mak may mbt mcd mcv mkj mlk mlu mmb mmv moa mok mra mrt mss mum mxe myi nas ndy ngl ngn nhm nnd nor nug nyn ocu olo ond one ood pny poh pur scr siu slo som sul tah tic tig ung wal wol wrd xar ylm yok yuw zag zan,96,76475,0.0012553122
57A,Position of Pronominal Possessive Affixes,,57,Matthew S. Dryer. 2013. Position of Pronominal Possessive Affixes. In: Dryer; Matthew S. & Haspelmath; Martin (eds.) 2013. The World Atlas of Language Structures Online. Leipzig: Max Planck Institute for Evolutionary Anthropology. (Available online at https://wals.info/chapter/57),1,abk abv acg aco adg ady aga ain akn amc amx ao api apl apu ara ath atm awa awi ayo ayr bae baq bel bil bla blx boa bod brr bry bti bua bun bur cah car cax cba cct cde che chg chj chp chx ckl cln cml cmx cnl cnm coa cor cqt cre cro cti cup die dmi dni eme ess eud ful gan gav gds gjj gnn goa grf gto gua gyc ham hat hix hlp hui hup hve ign ijo ika ina iqu irr iwa ixi jak jbt jrw jva kaa kbw kdw ket khg kio klg klw kma kmb kmh kmj kmr knw koa kob kok krh kri krk krw ksa ktm kyp kyz lav ldu lec lkt lng lui mac mam mar mau max may mba mco mcv mdn mea mei mek men mik mki mmv mne mno moh mot mpr mpu mrd mrs mtt mug mui mut muu nag nas nav nbd ncm nev nez nhh nhm nhn nht niv nkk nmb nsn nyu ocu ond ood pba pga pia pip pir plk pme pwn qum ram res rgc rik run sem ser sgb shp sla smn src srn sul tar tau tee tep tgn tic tid tir tja tli tlo tnc tob ton tot tpn tps tpt trr tte tun tus twn txj tzo tzu uby una urk wap was way wbn wch wic wiy wma wor wra wrk wrn wrw wsk wya xav xer yag yel yqy yuc yur zpr zqc zqo zqs,255,76475,0.003334423
3A,Consonant-Vowel Ratio,,3,Ian Maddieson. 2013. Consonant-Vowel Ratio. In: Dryer; Matthew S. & Haspelmath; Martin (eds.) 2013. The World Atlas of Language Structures Online. Leipzig: Max Planck Institute for Evolutionary Anthropology. (Available online at https://wals.info/chapter/3),3,abi acm aik alb ald amc ame amz apu ata awn awp bag baj bam bbf bee bej ben bir bis bng bra brd bre bri brm bsk bto bua bul byu cam cha chq cil cle cso cti ctl ddf dgr din diz dnw don doy dre dyi eja eve evn ewe ewo fij ful ga gan gar gbb gds ghb gla gmb goa grk gua gwa hak hba hix hok hop htc hun hve hzb iaa iba igb igs ik ind irx iso jeh jiv jpn kad kas kch kef kek ker kew kgz khs kio kkv klv kly kmp knk knm knr koh kom koy kpe krd krk kry kse ksg ktk kty kur kwa kwo kws kya kzy lah lat lav lep llm lua lug lui luo luv mab map mau mba mei mlk mme mnc mnd mne mor mov mrd mrn mro mui mum mxc mxm mya myi mzc nai nar nax nbk ndt ndy nhn nht nko nkt nob nun oji ood orm otm pec phl pms prs psm puk rom san sba sha shk shs sin sml snd snh sor spa sre sup svs tab tag tam tib tic tks tok tol ton tru tso tug tuk tul tur twn umb ung uzn wah wch wic wlf wma wps wrd wry wuc yan yap yaq yaw yay ycn yct yes ygr yid yko ytu zan zun,234,76475,0.0030598235
1A,Consonant Inventories,,1,Ian Maddieson. 2013. Consonant Inventories. In: Dryer; Matthew S. & Haspelmath; Martin (eds.) 2013. The World Atlas of Language Structures Online. Leipzig: Max Planck Institute for Evolutionary Anthropology. (Available online at https://wals.info/chapter/1),3,aea agh aik aiz akn alb ald alw amo amu amz ana ata aze bam baw bbf bej ber bet bir bra bre brh brw bsq bul cad cah cam cay ccp cha chu chv chw cil cle cnt cti ctl dan ddf dgb dgr die din dio diy diz djp dnw don doy eja eng fij fre ful gan ger goo grb grk grr grw gwa hmr hok hop htc hve iba ign igs ijo ind irx iva jav jeb jng kad kef kek ker kgu kgz kha khm khs kio kkn klv kmu knk knm knr kob kom kor kot koy kpa kpe kro kul kur kwo kws kyl lkt llm lu lua lui maa mab map mar mba mbb mei mgg mla mme mnd mog mpa mrl mro mrt mui mum mzc nap nar new nga nko nmb non nor nug nun ogb ood orm otm pac pai pau phl prs qaw rom rsc ruk sab sba sel sha snd snh som spa srn sup tam tha tiw tks tlp tma tmp tol tru tug tuk tul tur tuv tza umb una uzn vie wch wic wiy wuc yan yap yay yct yko ykt ytu zan zun,201,76475,0.00262831
12A,Syllable Structure,,12,Ian Maddieson. 2013. Syllable Structure. In: Dryer; Matthew S. & Haspelmath; Martin (eds.) 2013. The World Atlas of Language Structures Online. Leipzig: Max Planck Institute for Evolutionary Anthropology. (Available online at https://wals.info/chapter/12),2,aco agh aik ain akn akw ald ame amh amo amp amu ani ant ao arb arp asm awn aym aze bag bai baj baw bee ber bet bir bis bkr bng bod brm byu cac cad car cax cck cha che chp cil cle cmn cnt cre cti ctl dad dag dan dar ddf der det dgb din diy dni dnw don dre dyi efi eja epe eve ewe ewo fef fin fur fuz fye ga gan gar gbb gds gla gmb goo grr grw hak hau hix hmo hmr hok htc hve hzb iaa iba igs ika irq irr irx iso iva jak jaq jeb jng jom jpn jpr kad kal kay kch ked kef ker kfe kgu kho khr kio kkv klv kmp kng knk knm knr koa kob kom kor kpe krb kro ksg kss kty kul kun kwo kya kyl lah lan lav len lkk lu lua lug luo maa mal map max mbb mei mgg mla mnd mne mrd mrl mro mrt mss mum mun mya mzc nai nan nar nav ndt ndy new nga ngi ngz nhn nht nko nnc nob nug nyg nyi ogb orh pac pai paw pec phl pit pms pnr poa puk pur ram res ruk sdw sed sha shi shk shs skp sla sml snm som sor spa sui sup tag tam tel ter tgk tgr tha tib tiw tma tmn tok tol ton tru try tsg tur una ung urk usa vie wah wam war wch win wma wmu wnt woi wps wrs xoo yag yap yaq yaw yay ycn yes yey yid yim yko yny yul yus zul zun,274,76475,0.0035828701
