parameter_id,parameter_name,parameter_description,chapter_id,chapter_citation,value,same_value_language_ids,value_language_count,language_count_total,count_ratio
124A,'Want' Complement Subjects,,124,Martin Haspelmath. 2013. 'Want' Complement Subjects. In: Dryer; Matthew S. & Haspelmath; Martin (eds.) 2013. The World Atlas of Language Structures Online. Leipzig: Max Planck Institute for Evolutionary Anthropology. (Available online at https://wals.info/chapter/124),4,aga ale ana apu ara awp chk eve gua hum jpn kay kma kob kwk kyk lad mac mak mcv mku mts nab ngl nmb nmi oji olu ood pno prh qia see shk sho tgn tob tps udh yaq yir ypk ytu zch,45,76475,0.0005884276
55A,Numeral Classifiers,,55,David Gil. 2013. Numeral Classifiers. In: Dryer; Matthew S. & Haspelmath; Martin (eds.) 2013. The World Atlas of Language Structures Online. Leipzig: Max Planck Institute for Evolutionary Anthropology. (Available online at https://wals.info/chapter/55),1,abk abo aco aeg agw ako ala alb amb ame amh ami amk aml amr apu ara arb arm aro ata atk ava awt bae bgv brh brl bsq bul bur but cap cba cct cha chc chi chk chv cin cjo cku cnl coo cpn cre ctm cul cyv dat den dga diz dji dre drg dum dyi eng epe err eve fij fin fma fre fur fut gaa gav gbb gdf geo ger gnn goo grr gua hau haw heb hin hix hpd hua hzb iaa igb ika imo ing irq jaq jiv jmm juh kat kch kew kfe kha kho kio kiw kku klm klt kmb knd knr knu kob koi kot kpe krf krk kut kzy lan lat lda let lez lim lkt luc lug lui luo maa mal map mar mau mbg mde mdk mdn mee mhi mis mit miy mkw mli mlk mll mne moe mos mrg mrt msc mss msy mup muu mxc myi mym nah nai naj nar nas nav nbd ndy ngi ngy ngz nht ntu nug nyu ood orh ori pau pba pip pir pno pnr prc prh put pwn qcu qhu qim qui rap rcp rru ruk rus sal sdw see ses shk shs siu snc snh snt sue sul sup swa swt syu tag taw tgh tim tiw tkl tla tlf tll tmr tnn tob tol ton tps trn tso tun tuv uhi ung ura wap war was wem wgl win wor wrn xam xoo yes yid yim yko ymi yng yor yuc yuk ywl zul zun,260,76475,0.0033998038
105A,Ditransitive Constructions: The Verb 'Give',,105,Martin Haspelmath. 2013. Ditransitive Constructions: The Verb 'Give'. In: Dryer; Matthew S. & Haspelmath; Martin (eds.) 2013. The World Atlas of Language Structures Online. Leipzig: Max Planck Institute for Evolutionary Anthropology. (Available online at https://wals.info/chapter/105),3,ain akw ala all bbw bco bel bla bnn brs cha che coo cre err gaa gap goo grg grw hau hay hli hui juh kfe klv kmh krr kut lai laz lil lml map mar mos mot mrt nab ndj ngi ngl niv nko nmb oji pal qhu sng som tau tbt tiw tps usa war wch wrd yag yaq yng yor zch,65,76475,0.00084995094
115A,Negative Indefinite Pronouns and Predicate Negation,,115,Martin Haspelmath. 2013. Negative Indefinite Pronouns and Predicate Negation. In: Dryer; Matthew S. & Haspelmath; Martin (eds.) 2013. The World Atlas of Language Structures Online. Leipzig: Max Planck Institute for Evolutionary Anthropology. (Available online at https://wals.info/chapter/115),1,abk abu ace ady aeg ain ana ano ass awp bab bae bag baw bbw biu bkr bma boz brh brm bsq bud bul chk chn cnl cnt coo cop ctl dgr dji epe eve fin fon goo grg grk grw gua guj hai hau heb hin hmo hun hzb ind iri jel jpn kan kas kaz ker ket kfe khm khs kio kkp kku klv kma kmh kmu knd knr koa kob kod kor kse kty kug kzy lak lat lav lel lez lil lin lit lkt mac mad mao map may mbi mby mdg mgu mhi miy mle mme mnd moe mos mto mun mym nai nav ndj nep ngi niu niv nti nua nwd oji ood orh pae pai pms pno pol pop prs qhu qia qim raw ret rom rus scr shk skp sla sno som squ sup swa tag tam tha tid tja tml tms tpn trb tru ttn tur tuv udh udm urk vie wch wlf yko ykt ytu zaq zaz zul zun,170,76475,0.0022229487
46A,Indefinite Pronouns,,46,Martin Haspelmath. 2013. Indefinite Pronouns. In: Dryer; Matthew S. & Haspelmath; Martin (eds.) 2013. The World Atlas of Language Structures Online. Leipzig: Max Planck Institute for Evolutionary Anthropology. (Available online at https://wals.info/chapter/46),1,abm ace aco agt ain aly amu ana aso ass atc awp aze bao baw bdm blr bsk bsq bug bul bur but cah cch chk chn chv cmn cnl coo crk ctm diy dja dji djp djr dyi ene est eve evn ful gaa gag gar geo goa goo grg grk grw gum guu hay heb hmo htc hun hup hzb ice itz jak jaq jpn kay ket kgz khk khs kio kku kma kmh knc knd kng koa kod kop kor krc krk krl krm kry ksi kty kut kzy lak lat lez lil lit lkt lml mac mah mai mar mei mhi mic mlk mme mmo moe mra mrh mrt mrw mss mun myi mym nai nav ndj neg nez nga ngi ngk ngn nha nht niv nsg ntu nug nwd oss pae pkn pno pny pol ppi psh psm pur qhu qim rom rus scr shk sho shr siu ski skp sno squ stl tab taj tha tiw tja tkl tml ton tps tst tun tuv tvo txj udh udm ukr uku uzb vie wam wic wmu wrd wrn wry yaq yid yin yko ykt yng ypk yuw zun,194,76475,0.0025367767
95A,Relationship between the Order of Object and Verb and the Order of Adposition and Noun Phrase,,95,Matthew S. Dryer. 2013. Relationship between the Order of Object and Verb and the Order of Adposition and Noun Phrase. In: Dryer; Matthew S. & Haspelmath; Martin (eds.) 2013. The World Atlas of Language Structures Online. Leipzig: Max Planck Institute for Evolutionary Anthropology. (Available online at https://wals.info/chapter/95),5,ace aco adn ajg akn all alw amh ani ann any apu arm avo bac bai bbw bgr blr bmb bnb brn cai cam cav chh cmh cnt coo dam ddj dgo dhr din djm djn djr doy dut emm fon fri ger ggu gid git gnn goo grg grj gul gum guw gwa huc hup ido ina isa iwa jab jeb kay ken kfe kis kkw klm kmw kni krk krr kws kyl ldu lec les lgt lmh lml lug lui mad mak map mbr mby men min mnd moa moh moo mou mpa mra mrl mro mrw mss mtt mxx mzh ncm ney nez ngk ngl nha non nti nue nug nyr nyu ood pau pno pnx pny pok ppi pur rit snc sod som taw ten thy tic tik tnn tru tsh tus twe twn vaf vot wak wan wed wem wik win wiy woi wrd wrg wrl wrw yin ypk yur ywr zar,158,76475,0.0020660346
60A,Genitives; Adjectives and Relative Clauses,,60,David Gil. 2013. Genitives; Adjectives and Relative Clauses. In: Dryer; Matthew S. & Haspelmath; Martin (eds.) 2013. The World Atlas of Language Structures Online. Leipzig: Max Planck Institute for Evolutionary Anthropology. (Available online at https://wals.info/chapter/60),6,abk abu agw alb ath ava bae bel bgv bok brn bsq cha chk dat drg eng epe eve fin fre gav geo heb hin hpd hun hzb ika imo ing irq jaq kan kay kch kfe kha kor kwz kyl lai lez luc mau mee mhi miy mks mrg msc nbd nht pba pnr qim rus ses shk snm sup tam tgh tiw tts tuk tur ura vaf war wra yid yim yko yng zul,77,76475,0.001006865
97A,Relationship between the Order of Object and Verb and the Order of Adjective and Noun,,97,Matthew S. Dryer. 2013. Relationship between the Order of Object and Verb and the Order of Adjective and Noun. In: Dryer; Matthew S. & Haspelmath; Martin (eds.) 2013. The World Atlas of Language Structures Online. Leipzig: Max Planck Institute for Evolutionary Anthropology. (Available online at https://wals.info/chapter/97),5,abi ace acn aco adn ajg alw amm amt ani any apu arm ata avo bac bbw bej bgn bgo bio bkl blr bnb boj brs btk bua cai cam cav cct chg chs cmh coo cuc dam ddj deg der dgo dhr die din djm djn djr dlm dul dut emm esm fri gah ger ggu gid gim git gmz gnn grg grj gum gwa han hil hup ido ina ite ito izi jeb jug kac kan kay kis kkw kla klm kmw knk kpm krj krk kut kws kwt kyr laf lah lai ldu lec les lgt lml lmu lug lui lun mad mak mam mch mcv mei men mik min mir mmn moa moh mos mou mra mrw mss mtt mxx mzh nag nas ney nez ngi ngk ngl ngw nha nhn nke nmm nti nue nug nuu nyr obo oks pau pdp pnn pnx pny pod pok ppi rit rji ruk sal see ser shk snc son swt tac tag tar tic tik tis tiv tja tla tli tot tpn trr tru tuc tus tvt twn tzu uru wan wao wik win wiy wrd wrg wrl wrw yim yin ypk yur ywr zar,198,76475,0.0025890814
83A,Order of Object and Verb,,83,Matthew S. Dryer. 2013. Order of Object and Verb. In: Dryer; Matthew S. & Haspelmath; Martin (eds.) 2013. The World Atlas of Language Structures Online. Leipzig: Max Planck Institute for Evolutionary Anthropology. (Available online at https://wals.info/chapter/83),3,ace aco adn ajg alw ani any apu arm avo bac blr bnb cai cam cav cmh coo dam ddj dgo dhr din djm djn djr dut emm fri ger ggu gid git gnn grg grj gum gwa hup ido ina jeb kay kis kkw klm kmw krk kws ldu lec les lgt lml lug lui mad men min moa moh mou mra mrw mss mtt mxx mzh ney nez ngk ngl nha nti nue nug pau pnx pny pok ppi rit snc tic tik tru tus twn wan wik win wiy wrd wrg wrl wrw ypk yur ywr zar,101,76475,0.0013206931
89A,Order of Numeral and Noun,,89,Matthew S. Dryer. 2013. Order of Numeral and Noun. In: Dryer; Matthew S. & Haspelmath; Martin (eds.) 2013. The World Atlas of Language Structures Online. Leipzig: Max Planck Institute for Evolutionary Anthropology. (Available online at https://wals.info/chapter/89),3,abk aco aeg aja ana apl arj ass asy bbw bdm bio bnr bto cnm des deu djp dmi eno fut gaa gim grr hay hhu ika izi jva kwy kyn mak meh mgk mik moa mrd myi nak ngd nia niv nmm noc nsn nuu nwd oks oya pdp plg qaw rga run sam snh sti suk swt tah tno url wat wbn,65,76475,0.00084995094
84A,Order of Object; Oblique; and Verb,,84,Matthew S. Dryer (Orin D. Gensler). 2013. Order of Object; Oblique; and Verb. In: Dryer; Matthew S. & Haspelmath; Martin (eds.) 2013. The World Atlas of Language Structures Online. Leipzig: Max Planck Institute for Evolutionary Anthropology. (Available online at https://wals.info/chapter/84),6,ace acm aco adn ajg ala alw ani any apu arm arw avo awt bac bai bdm blr bnb bnu brm brn brr cai cam cav cea che chr cmh coc coo cre dam ddj dgo dhr din djm djn djr dut dyi eme emm fij fri gap ger ggu gid git gnn goo grg grj gum gwa hup ido ina inn irq ite jeb kay kis kkw klm kmw knc krk kuu kws lar ldu lec les lgt lml lug lui mad map mdl men min mku moa moh mou mra mrh mrr mrw mss mtt mxx mzh nas ndj ney nez ngi ngk ngl ngn nha nti nue nug oji ond pau pkn pnx pny pok ppi psm ptw pun ram res rit sal sar sdw shs siu snc tac tic tik tin ton tpn tru tsh ttu tuc tun tus twe twn udi urk ute wan wic wik win wiy wrd wrg wrl wrw wry wya yim yin ypk yur ywl ywr zar,167,76475,0.0021837202
56A,Conjunctions and Universal Quantifiers,,56,David Gil. 2013. Conjunctions and Universal Quantifiers. In: Dryer; Matthew S. & Haspelmath; Martin (eds.) 2013. The World Atlas of Language Structures Online. Leipzig: Max Planck Institute for Evolutionary Anthropology. (Available online at https://wals.info/chapter/56),1,amr arm bae brh bsq epe fre gaa geo hai hix hzb ika kch kho kut lan lat mao mar mau may nbd ndy nht pba pnr qim saw sml tiw tps trb tuk tur vaf war was yim,40,76475,0.00052304677
64A,Nominal and Verbal Conjunction,,64,Martin Haspelmath. 2013. Nominal and Verbal Conjunction. In: Dryer; Matthew S. & Haspelmath; Martin (eds.) 2013. The World Atlas of Language Structures Online. Leipzig: Max Planck Institute for Evolutionary Anthropology. (Available online at https://wals.info/chapter/64),3,amp ana apu goo hix knc myr nha qhu snm tiw wra yag yim,15,76475,0.00019614253
87A,Order of Adjective and Noun,,87,Matthew S. Dryer. 2013. Order of Adjective and Noun. In: Dryer; Matthew S. & Haspelmath; Martin (eds.) 2013. The World Atlas of Language Structures Online. Leipzig: Max Planck Institute for Evolutionary Anthropology. (Available online at https://wals.info/chapter/87),3,abi acn aco alw amm amt ata bac bbw bej bgn bgo bio bkl boj brs btk bua cam chg chs cmh cuc deg der djm djr dlm dul esm gah gim gmz grg grj gum han hil ite ito izi jug kac kan kla knk kpm krj kwt kyr laf lah lai lmu lun mak mam mch mcv mei men mik mir mmn mos mss nag nas ngi ngw nhn nke nmm nug nuu nyr obo oks pdp pnn pny pod rji ruk sal see shk son swt tac tag tar tis tiv tla tli tot tpn trr tru tuc tvt tzu uru wan wao yim yin ypk,110,76475,0.0014383786
34A,Occurrence of Nominal Plurality,,34,Martin Haspelmath. 2013. Occurrence of Nominal Plurality. In: Dryer; Matthew S. & Haspelmath; Martin (eds.) 2013. The World Atlas of Language Structures Online. Leipzig: Max Planck Institute for Evolutionary Anthropology. (Available online at https://wals.info/chapter/34),3,ame ccp cmh cmn coo ctm epe gaa gap kgu kku kma kob kod krw kut lan lel mad mto mts new nti pal per pme ram ret rot sdw sed slb sud tab tin tiw tja tmm tru,40,76475,0.00052304677
82A,Order of Subject and Verb,,82,Matthew S. Dryer. 2013. Order of Subject and Verb. In: Dryer; Matthew S. & Haspelmath; Martin (eds.) 2013. The World Atlas of Language Structures Online. Leipzig: Max Planck Institute for Evolutionary Anthropology. (Available online at https://wals.info/chapter/82),3,ace alw amc any apl ara asy bac bae baj bbu bch bil bkr bla bln blr brs btk bul bwc cav cax cbo cea che cre ctl dhr djm don dre gid git gku gnn grj grk grr gum hup ita jeb klm krn kwk kws lac lat lml mac mdm meh men min miy moa moh mok mpo mpr mra msk mtt mut mxx mzh nau nez ngg ngl nha nht nne nug nym nyn pol ppi psm rit rwe shs siu sml snc spa swt tas tin tla tno tob tus tzu ute wai wam wic wik win wrd wrg wrl wrw yao ypk ywl zqs,110,76475,0.0014383786
69A,Position of Tense-Aspect Affixes,,69,Matthew S. Dryer. 2013. Position of Tense-Aspect Affixes. In: Dryer; Matthew S. & Haspelmath; Martin (eds.) 2013. The World Atlas of Language Structures Online. Leipzig: Max Planck Institute for Evolutionary Anthropology. (Available online at https://wals.info/chapter/69),2,aar abi abk abn abv acg acm aco acu adn aga agm agt ain ala alb alc ale alw aly amb amc ame amn amp amx ana ani ann ao apl apt apu ara arc arm arw asm ass ath atk ava avo awa awe awi awp awt aym aze azi baa bac bae bam bao baq bau bco bdm bej bel ber bgn bho bii bil bin bio bkb bkr bln blt blx bmb bmr bnj bnr bnu bod boi boj bre brh bri brm brn brr brs bry bsk bua bul bun bur but bya bzi cah car cas cax cay cba cbo cct cde chb chc che chg chi chn chv chx cld cln cmh cmn cmy cnm cnt coa coo cos cpy crn crp ctm cub cui cup dag dan daw der des deu dgo dgr dhb dhm dhr dhw dig dim diy dja dji djm djn djp djr dlm dmi dmk dms dni dom drm dsh duk dun dut dyi eip eka emb eme ene eng epe ese est eud eve evn fas fin for fqs fre fua fur fye gaa gah gal gan gar gbb gds geo ger ggu gid gim gln gnn goa gog gon grb grf grj grk grr grs grw gud gug guh guj gum gur guu hai hak hal har hay hin hix hlp hmi ho hop hpd hua hui hum hun hzb iat ice igb ign igs iha ijo ik ika imo ina ind ing inn iqu irx ita ite iwa jaq jeb jiv jpn jva jwr kac kar kay kbo kbu kem ker kew kfe kgu kgz kha khg khi khl kio kiw kkp kku klm klq kma kmb kmh kmj kmk kmn kmo kmp kms knb knc knd kni knk knm knn knr knw kob koe kok kol kop kor koy krc krh kri krj krk krw ksa kta kti ktl kty kum kus kuu kuv kwk kwo kwt kwz kya kyk kyq kyz lac lad lav ldu lec lep lez lho lim lit lkt lmn lng lot lui lun mab mac mag mak map mar mau mbt mcd mco mcv mde mdm mdn mdo mee mei mem mgg mgi mhi mhk mij mik mis mkg mkh mkr mme mmi mnc mnd mne mni mnm mno mns mny moe mog mom moo mos mot mou mpr mpt mqf mra mrh mri mrr mrs mrt mrw msc msg msl mss mtk mts mui mun mut nab nag nah nar nas nbd nbr nca ndo ndt nep nev new nez nga ngi ngj ngl ngn ngt ngw ngz nha nhh nhm nhn nht nis niv nkb nmb nmd noc nog non nor nph nsn nti ntj ntu nug nwd nyi nze oks olo omh omi one ong ood ord orh ork oro orw osa oss oya paa pae pan pau paw pba pdp pga pia pip pir pis pkn plk pme pno pny pol por ppi prh prk psh pso ptw pum pur pwn qaw qhu qim ram rao raw rem res ret rit rmb rom rot rum run rwa rwe sav sba sdw sem shd she shh shi shk sho shp shy sia sid sin siu skp skr slb slg slp sme smn sna snh sno snt som spa srd srn sro sta stl sue sug suk sus svs swe syu tac tam tan tao tau tba tbl tbu tbx tce tel tgl thn thu thy tir tja tkl tma tmc tmg tml tmo tnn tny tob ton tpn tps tpt trb trr tru trw tsf tsh tte ttu tuc tun tur tuv tvo tvt twe twn uby udi udm uhi ukr una urd usa usr ute uyg uzb wah wai wak wam wao wap was wat wau way wbn wch wel wem wik win wir wly wmu wog wra wrb wrg wrk wrn wsk wtm yag yah yal yaq yar ycn yid yim yin yko ykt ylm yng yok ypk yrm ytu yuc yuw ywl yyg zay zch zpr zqc zqo zqs zun,667,76475,0.008721804
101A,Expression of Pronominal Subjects,,101,Matthew S. Dryer. 2013. Expression of Pronominal Subjects. In: Dryer; Matthew S. & Haspelmath; Martin (eds.) 2013. The World Atlas of Language Structures Online. Leipzig: Max Planck Institute for Evolutionary Anthropology. (Available online at https://wals.info/chapter/101),2,aar abk acg acl aco aeg aga ain aja ala alb all amh amq amr amx ane ang any aoj apl apu apw ara arg arm arp arq arw asm ass asy ath awa awp aym ayr bae bbl bbw bco bej bel bem bfg bgr big bii bik bin bio bir bku bln blx blz bma bnb bob bol bre brf brh brp brr brs bsh bsk bsq bsr bul bum bur cah cai cax cba cct cde che chh chi chk chx cic cld cle cln cmy coo crn cro ctl cub cyv cze dag dds des dhi die dig dim dio dlm dni dom efi eip eko emb eme ene err esm est ewe ewo fua fur ga gaa gah gds gjj gln gmw gmz goo grg grk grw gua gul gyc ham hat hay heh hix hlu hmi hnd hua hun hya ifu ige ik ika ila ina irq isa ita ite ito izi jab jmo kab kae kam kan kba kdw kew kfe kga kgr kgz kik kio kkv klv kma kmb kmh kmj kmp kms kmz knd knm kno knr koa kob koe kon krc krd kre krk krr krw ksa kty kwk kwn kwt kwz kyk lan lav lbu lda ldo leg len let lgi lil lim lin lit lkt llm lml luc lul luo luv luy maa mab mac maj map mar mau mbl mbo mbt mby mcc mcv mdn mea mee meh mir mkd mki mku mlu mme mmw mna mne mnm mns moe moh mou mpr mpt mpu mra mrl mro msc msl mss mtb mua myi mzh nab nag naj nan nav nbd ndb ndj nez nga ngo nhh nhm nhn nht nko nmb nnd nse nti ntu nua nue nug nwd nym nyn nyu obg obo ocu olo ond orh oro osa otm pai pan pau pga pkn pkt plh pms pog por pra pre prs pwn qim qum ram rem rim rny rru ruk run rut sak san sar scr ser sgb sgl sgu shm shu sid sio siu skm skp sla slb slo sml so sob spa squ srb src sro stn sul swa taj tar tau tbw ten tep tes tet tgh tgn tgr tiw tja tki tkl tkm tli tlo tmc tmr tna tnc tob ton toz tps trb trr tsk tsz tte tuk tun tur tus tuv tvo uby udm uld una ung ura urk urn usa usr uzb ven wai wal was way wic wiy wma wrd wrk wrm wrw wry wya yal yao yar yel ygr yim yko ypk yuc yur ywl zai zap zay zqc zul,437,76475,0.0057142857
61A,Adjectives without Nouns,,61,David Gil. 2013. Adjectives without Nouns. In: Dryer; Matthew S. & Haspelmath; Martin (eds.) 2013. The World Atlas of Language Structures Online. Leipzig: Max Planck Institute for Evolutionary Anthropology. (Available online at https://wals.info/chapter/61),2,abk aly ame amr ava awp bae brm bsq cha drg dyi eve fin fre gaa geo goo gum heb hmd hun kfe kha kho knr krf kut lil luc mar mau mbg min mks mmb mos mrg mrt nbd ngz nkk ood pnr prs qim rcp rus ses shk spa sup swa tag tam taw tha tiw tnn tuk tur tvo ura vaf war wat wir yes yid yim yng zul,73,76475,0.0009545603
96A,Relationship between the Order of Object and Verb and the Order of Relative Clause and Noun,,96,Matthew S. Dryer. 2013. Relationship between the Order of Object and Verb and the Order of Relative Clause and Noun. In: Dryer; Matthew S. & Haspelmath; Martin (eds.) 2013. The World Atlas of Language Structures Online. Leipzig: Max Planck Institute for Evolutionary Anthropology. (Available online at https://wals.info/chapter/96),5,ace aco adn ajg all alw amt ani any ao apu ara arm avo awe azi bac bam baw bfi bil bla blr bnb brh bya cai cam cav cct chg chi chk cld cmh cmr cnl cnm coo dam ddj dds dgo dhr die din diy djm djn djr dlm drm dut efi emm epe fri gah ger ggu gid gim git gmw gnn god grg grj gum gwa hai har hin hun hup hwr ido ika imo ina jeb jms kas kay kew khr kio kis kkq kkw klg klm kmb kmw kmz knd koa kob krk krn krw kut kws kya kyo lai lal lav lda ldu lec les lgt lkt lml lug lui mac mad mai mak mar mco mek men mgq min mka moa moh mou mpa mpt mra mrt mrw msn mss mtt mud mxx mzh nam nav ney nez ngi ngk ngl nha nhn nrg nti nue nug ond osa oya pan pau pit pnx pny pok ppi res ret rgc rit ruk ser skw sla snc snm squ stl sup tau tdr tic tik tis tja tou tru tsh tuk tus twe twn udh urd vai wan wao wap wbn wik win wiy wrd wrg wrl wrw xas yid ypk yur yuw ywr zar,213,76475,0.002785224
81A,Order of Subject; Object and Verb,,81,Matthew S. Dryer. 2013. Order of Subject; Object and Verb. In: Dryer; Matthew S. & Haspelmath; Martin (eds.) 2013. The World Atlas of Language Structures Online. Leipzig: Max Planck Institute for Evolutionary Anthropology. (Available online at https://wals.info/chapter/81),7,ace aco adn ajg alw amc ami ani ann any apl arm asy ats avo bac baj bbu bbw bch bil bkr bla bln blr bnb brs btk bwc cai cam cav cax cbo cea che chk cmh coo cre dam ddj dgo dhr din djm djn djr dom dre dut dyi emm fij fri ger ggu gid git gku gnn goo grg grj grk grr gum gwa hun hup ido ina jeb kay khr kis kkw klm klv kmw krk krn ksa kut kwk kws kwz lac ldu lec les lgt lmb lml lug lui mac mad mdm meh men min miy moa moh mou mov mra mrw msk mss mtt mxx mzh nau ndj ndr ney nez ngg ngk ngl nha nnc nti nue nug nuu nym nyn oji ond ood pai pip pnx pny pok ppi psm ptw rit ruk rwe sam shs shu siu sml snc swt tac tas tee tho tic tik tin tng tno tob ton tru tus twn tzu ute wai wam wan wic wik win wiy wrd wrg wrl wrw wya yag yok ypk yur yus ywl ywr zar zqo,189,76475,0.0024713958
88A,Order of Demonstrative and Noun,,88,Matthew S. Dryer. 2013. Order of Demonstrative and Noun. In: Dryer; Matthew S. & Haspelmath; Martin (eds.) 2013. The World Atlas of Language Structures Online. Leipzig: Max Planck Institute for Evolutionary Anthropology. (Available online at https://wals.info/chapter/88),6,agd arg arj asy bam bbf bbw bem bma chi chq cmh cop der dhr dja eip ggu grw hau hlp hol imo jug kdz krd kws kya lbu lkt lmb lmg lml ma mao mch mke mrq mua nau nma nse one osa pkn rom rwa sam sge sir skk tag tbw tdi tgr tlf tou tzu uru wan wrw xho yah yid yir zul,67,76475,0.0008761033
