parameter_id,parameter_name,parameter_description,chapter_id,chapter_citation,value,same_value_language_ids,value_language_count,language_count_total,count_ratio
24A,Locus of Marking in Possessive Noun Phrases,,24,Johanna Nichols; Balthasar Bickel. 2013. Locus of Marking in Possessive Noun Phrases. In: Dryer; Matthew S. & Haspelmath; Martin (eds.) 2013. The World Atlas of Language Structures Online. Leipzig: Max Planck Institute for Evolutionary Anthropology. (Available online at https://wals.info/chapter/24),1,abk ace aco ain ane apu brr brs buu ccp cha cho cin cjo cku coo cre cyv dag dum fij gku gua hai hat hix hun hve iau jak ket kio koa krk kut lan lav lkt map mar mis mrh nat niv nmb nsg nuu ond otm pau pip prs qui sah sla squ sup tgp tkl tlf tli tun usa war was wch wic wrn wsk xok yag yes yli yor yuc yur zun,78,76475,0.0010199412
23A,Locus of Marking in the Clause,,23,Johanna Nichols; Balthasar Bickel. 2013. Locus of Marking in the Clause. In: Dryer; Matthew S. & Haspelmath; Martin (eds.) 2013. The World Atlas of Language Structures Online. Leipzig: Max Planck Institute for Evolutionary Anthropology. (Available online at https://wals.info/chapter/23),1,abk ace aco ala ame ane apu arp asm atk bag bbw brr cho cin cjo cku cnl coo cre ctm dag dni eka fij gua hix hve jak ket kim kio krk lan lav lkt luv mau mrh nat niv nkk nmb nsg ond otm pip sah sla snm swa tgp tiw tkl tlf tli tmc tun ung usa war was wic wrn yes yim yli yuc yur zul,71,76475,0.000928408
59A,Possessive Classification,,59,Johanna Nichols; Balthasar Bickel. 2013. Possessive Classification. In: Dryer; Matthew S. & Haspelmath; Martin (eds.) 2013. The World Atlas of Language Structures Online. Leipzig: Max Planck Institute for Evolutionary Anthropology. (Available online at https://wals.info/chapter/59),2,alw amp asm bma boa brs buu chi chy dag die diy diz dni dre dum dyi eka ewe fua gbb goo grr hai hat hve iau ijo imo kat kay kch kho kim kio knk knm knu koa kob koi kro lan lda lkt lug luv maa mau may mlk mne mot mrg mrh mrt myi nai nbd ngi nim nug nyn orh oss pau poh pwn qui ram rap sal snm sul tau taw ter tgp tht tiw tkl tli ton tuk tun uhi was wem win wrn wsk yko yur,94,76475,0.0012291599
25A,Locus of Marking: Whole-language Typology,,25,Johanna Nichols; Balthasar Bickel. 2013. Locus of Marking: Whole-language Typology. In: Dryer; Matthew S. & Haspelmath; Martin (eds.) 2013. The World Atlas of Language Structures Online. Leipzig: Max Planck Institute for Evolutionary Anthropology. (Available online at https://wals.info/chapter/25),1,abk ace aco ane apu cho cin cjo cku coo cre dag fij gua hix hve jak ket krk lan lav lkt mrh nat niv nmb nsg ond otm pip sah sla tgp tkl tlf tli tun usa war was wic wrn yes yli yuc yur,47,76475,0.00061457994
58A,Obligatory Possessive Inflection,,58,Balthasar Bickel; Johanna Nichols. 2013. Obligatory Possessive Inflection. In: Dryer; Matthew S. & Haspelmath; Martin (eds.) 2013. The World Atlas of Language Structures Online. Leipzig: Max Planck Institute for Evolutionary Anthropology. (Available online at https://wals.info/chapter/58),1,aco asm bel brs bur cax cho cin cjo cnl cre ctm die dni eka epe eve hai hat hix kho koa koi krk kut lim mne nez oss pms pwn qui res sal tgp tiw tot tun tzu wap wch win,43,76475,0.00056227524
