parameter_id,parameter_name,parameter_description,chapter_id,chapter_citation,value,same_value_language_ids,value_language_count,language_count_total,count_ratio
73A,The Optative,,73,Nina Dobrushina; Johan van der Auwera; Valentin Goussev. 2013. The Optative. In: Dryer; Matthew S. & Haspelmath; Martin (eds.) 2013. The World Atlas of Language Structures Online. Leipzig: Max Planck Institute for Evolutionary Anthropology. (Available online at https://wals.info/chapter/73),2,aco aeg ain ala alu ame amr ana apl apu arm arp asm aso awk awp bag bam baw bem bir bkr bma brh brm brs bsk bsq bul bur cah cak car ceb cha chk chr chv cmn coo cre csh dbd dgr dio dni dre dsh eng epe est evn ewe fij fin fre fur gar gbk ger goo grb grk grw guj gum gwa hai ham hau heb her hin hix hmo hun iaa ice ido igb ijo ika imo ind iqu iri irq jak jpn juh kas kay kaz ker ket kew kfe khk khm kho kim kin kio kis kiw klv kmk kmp kmu knd knr koa kob kok kon kor kpe krb krk krn kro kry kse kte kty ktz kut kwa kyl lah lan lat lav lep lin lkt lnd loz luo luv mab mac mai mak mal mam man mao map may mdk mgo mku mme mnd mnm mok mon mop mro mrt mss mxc myi mym nan nav nbd ndy new nez nga ngi ngl nht niu niv nko nma nor nti ntu nug nun obo ond ong orh oss otm pai pal pan pau pip pit pms pnn ppi prh prs psm pta pur qim ram rap rav rus sdh see sel shk shl shn shr shu sla slo sml snm snn snt som spa squ sue sup sus swa swe tab tbu tel tgr tha thk tiw tmi tms tru tsp tuk tun tur tuv txj tzu udh udm una urd urk usa vie wam war wch wra wrd wrk yag yaq yid yim yko ykt yor yur zul,271,76475,0.0035436417
45A,Politeness Distinctions in Pronouns,,45,Johannes Helmbrecht. 2013. Politeness Distinctions in Pronouns. In: Dryer; Matthew S. & Haspelmath; Martin (eds.) 2013. The World Atlas of Language Structures Online. Leipzig: Max Planck Institute for Evolutionary Anthropology. (Available online at https://wals.info/chapter/45),1,abu aco aeg ala alb ame apu arp asm awp aym bab bag bam ble bma brh bri brs bur cha chk cmn cnl cop cre cyv dag dmi dni dyi eng eve ewe fur gar goo grb grw gua hat hau haw heb hix hmo igb imo iri irq jak jaq juh kam kay ker kew kio kis klv kmb kmu knm knr koa kob kon krk kro kse kut kyl lan lav lez lim lkt mak mal mao map mar mau may mei mmb mrl mrt msl mss myi nbd nez ngi noo nti nug ond orh oss otm pai per pip pit prh pso ram rap sav sla sng snm snt som sup swa taw tiw tli ura wam war wch wic wra yag yaq yct yim yin yko yur zqc zul,136,76475,0.001778359
67A,The Future Tense,,67,Östen Dahl; Viveka Velupillai. 2013. The Future Tense. In: Dryer; Matthew S. & Haspelmath; Martin (eds.) 2013. The World Atlas of Language Structures Online. Leipzig: Max Planck Institute for Evolutionary Anthropology. (Available online at https://wals.info/chapter/67),1,abk aeg akn ala alw aly ame apu arp asm awn awp aze ben blc bng bnj bon bsq bui bur cbo chk coc cpl cpn cyn dag dio dni egn eve ewe fre geo goo grb grf grw gua gug hal heb hin imo ins jiv kay kew kio knd knk knr koa krk kui kut lat lav lda lez luv mai map mar mau mne mrg mrt mtg mwe mxc ngi ngm nim niv ntu ond ono pan pnn qim ram ruk sla snc som spa sue swa tag tem tig tiw tml tne tuc tug tuk tur udm wch wic wly yaq yes ygr yko zul,110,76475,0.0014383786
62A,Action Nominal Constructions,,62,Maria Koptjevskaja-Tamm. 2013. Action Nominal Constructions. In: Dryer; Matthew S. & Haspelmath; Martin (eds.) 2013. The World Atlas of Language Structures Online. Leipzig: Max Planck Institute for Evolutionary Anthropology. (Available online at https://wals.info/chapter/62),3,abk alb apl bul car crj dut fre geo ger grk hix ind kbl prs rus spa wai wel wyn,21,76475,0.00027459953
77A,Semantic Distinctions of Evidentiality,,77,Ferdinand de Haan. 2013. Semantic Distinctions of Evidentiality. In: Dryer; Matthew S. & Haspelmath; Martin (eds.) 2013. The World Atlas of Language Structures Online. Leipzig: Max Planck Institute for Evolutionary Anthropology. (Available online at https://wals.info/chapter/77),3,aco adk ain akh amd apl aym brs bul car chc crp diy eve fas gag geo god hai hix hlp hup ika ing jaq jmm kay kew kha khw kje klh koa kod ksh kto kyl kzy lad laz leg mak mar mei mgl ngi ntu pme pmn prh prs pso pum qhu qim que ret she sin slr snm squ tar ttu tuc tur tuy twe win ykt,71,76475,0.000928408
46A,Indefinite Pronouns,,46,Martin Haspelmath. 2013. Indefinite Pronouns. In: Dryer; Matthew S. & Haspelmath; Martin (eds.) 2013. The World Atlas of Language Structures Online. Leipzig: Max Planck Institute for Evolutionary Anthropology. (Available online at https://wals.info/chapter/46),2,abu aeg ame aml amp ano bab bag bak bam bud cic dgb doy eng err ewe fon fre fue gam gbb gol hau ibi ilo ind iri irq ita kan kat kfe klq kob kse kwr kya kyk lan lav lel lgu lug mal may mbi mby mde mgu mis mle mlt mrg msh nbd ndb niu nko nti nto orh orl pal pms prs qia sam san see sla som sum swa tid tis tms tmu tru tur tvl usa yap yor,85,76475,0.0011114744
138A,Tea,,138,Östen Dahl. 2013. Tea. In: Dryer; Matthew S. & Haspelmath; Martin (eds.) 2013. The World Atlas of Language Structures Online. Leipzig: Max Planck Institute for Evolutionary Anthropology. (Available online at https://wals.info/chapter/138),1,abz aeg aht alb amh ass aze ben blc blr brj bsk bsq bul bur but ceb cha chc chn chr chv cme cnt com cze dah dhi din eve evn fua geo grk guj hau hil hin ing jmo jpn kab kaz kgz kha khk khs kik kin kkn kkp kmk kor krm kro kry kuq lad lcr lda luo mby mhi mme mnd moe mol mym nai nbd nep new nog nun orh oss owc oya pan por prs psh qaf rse rus san scr sdh slo som ssh svk swa tag taj tha tib tkm tur tuv tvo udm ukr uyg uzb vie ykt yms ypk,110,76475,0.0014383786
66A,The Past Tense,,66,Östen Dahl; Viveka Velupillai. 2013. The Past Tense. In: Dryer; Matthew S. & Haspelmath; Martin (eds.) 2013. The World Atlas of Language Structures Online. Leipzig: Max Planck Institute for Evolutionary Anthropology. (Available online at https://wals.info/chapter/66),1,abk aeg afr alw aly amh arm atc atu avo awn awp aze bar bej ben bnj brh bsq bul bur dag did eng eve fij fin fre geo ger goo grk gua gug heb hin hun hwc ice imo jiv jpn kfc kha knd knk knr kor kui kya lat lez mai mao mau mlt mrt mtg myi ngi ntu orh pan por prs qco qim ram rap raw rom ruk rus som spa swa swe tah tga tgr tig tiw tml tne tny tpi tur wlf wor wra yaq zqc zun,94,76475,0.0012291599
65A,Perfective/Imperfective Aspect,,65,Östen Dahl; Viveka Velupillai. 2013. Perfective/Imperfective Aspect. In: Dryer; Matthew S. & Haspelmath; Martin (eds.) 2013. The World Atlas of Language Structures Online. Leipzig: Max Planck Institute for Evolutionary Anthropology. (Available online at https://wals.info/chapter/65),1,abk aeg akn ala alw aly arm atu avo awp aze bag bej bma bng bnj brh bsq bul bur but cbo ceb cha chk cnt cpn cuu dni egn eve fre geo grb grf grk haw hin hix hwc imo jak juh ket kho kik kio knk knr kor kro kse lan lez mak mal mau mlt mnd mrg mwe mxc nak nbr ngm ond ood orh pan pnn por prh prs ren rom ruk rus ses shu sla snc spa sup tag tah tem tny toj tug tur uyg wic wly wor yag yaq yct ygr zqc zul,101,76475,0.0013206931
78A,Coding of Evidentiality,,78,Ferdinand de Haan. 2013. Coding of Evidentiality. In: Dryer; Matthew S. & Haspelmath; Martin (eds.) 2013. The World Atlas of Language Structures Online. Leipzig: Max Planck Institute for Evolutionary Anthropology. (Available online at https://wals.info/chapter/78),3,arw brs bul car chc crp eka eve gag god hai hzb ing khw lad laz prs slr tar tuc tur tuy ykt,24,76475,0.00031382806
53A,Ordinal Numerals,,53,Thomas Stolz; Ljuba N. Veselinova. 2013. Ordinal Numerals. In: Dryer; Matthew S. & Haspelmath; Martin (eds.) 2013. The World Atlas of Language Structures Online. Leipzig: Max Planck Institute for Evolutionary Anthropology. (Available online at https://wals.info/chapter/53),5,abk aco ame aze brh bsm cah chk evn gar gua haw ind jak kas ket kha knd knr kse ktt kuo kuv kwm lad luo mac mah map maw may mei mnc mns mqc mxa mym nav nog owc prs qay qec qim rka ssh tab tha toj tsh tur ypk zya,54,76475,0.0007061131
68A,The Perfect,,68,Östen Dahl; Viveka Velupillai. 2013. The Perfect. In: Dryer; Matthew S. & Haspelmath; Martin (eds.) 2013. The World Atlas of Language Structures Online. Leipzig: Max Planck Institute for Evolutionary Anthropology. (Available online at https://wals.info/chapter/68),4,abi aco aeg ain ala alw ana apu arp atc atu avo awp bag bma bnj brs cbo ceb cha chk cnl cre cuu cyn dag did dio dni ewe geo goo grw gua gug hal hau haw heb hix hmo hun hwc jak jpn juh kay ket kfc kio knk koa kor kse kut kya lan lav lkt mak mal map mar mau may mlt mnd mrt mxc myi nca ngi ngm nim niv ntu ond ono pnn por prh prs qco qim ren rom rus san shu snc snm som sue tag tga tig tiw tpi tug tuk tur war wch wic wly wor wra yag yaq yct yes yko zun,114,76475,0.0014906832
