parameter_id,parameter_name,parameter_description,chapter_id,chapter_citation,value,same_value_language_ids,value_language_count,language_count_total,count_ratio
27A,Reduplication,,27,Carl Rubino. 2013. Reduplication. In: Dryer; Matthew S. & Haspelmath; Martin (eds.) 2013. The World Atlas of Language Structures Online. Leipzig: Max Planck Institute for Evolutionary Anthropology. (Available online at https://wals.info/chapter/27),1,abk abm aeg agc akn ala alw aly ame amh amp api apl arp asm ass asy aym baj bal bco bej bis bkl blq blx bma bnj bsm bsq buw cah cax cba cck cct cha chh chk chl chr cin cla cmk cmn cmx cnl coe col coo cos cre cuu cwe cyv dag dah dga dhm diy dji djp djr dre dri dyi epe ewe fox fua gar geo goo gum ham hau haw heb hil hin hlp hlu hmo hop hrr htc hui hun hzb iaa igb ilo itz jak jaq kay kha khm kho khs kik kkv klm kls klv kma knd knr koa kol koo kor koy kpm krb krk krw kuo kwk kya lac lav lil lkt lmp lrd lui lus luv maj mal mao mar mau maw may mcs mdr mei men min miy mki mks mlk mmb mnd mnm mok moo mos mpa mra mrq msh muh myi nak nau ndb nde ndy nez ngi ngk ngl nhc nia nkr nnc nug nuu nyn ojs oka olo ood orh oro pac pai pan pau pgl pip pms pnn poh prs psh pul put qay qui rit rmb rnd rny rot ruk sam sed ses shp shu siu sml som spo squ srn sro sry sst stl sun swa swi swt tag tbb tgk tgr tha tho thw tid tig til tim tin tiw tja tkm tlp tml tmr tng toj tru tsg tsi tso tuk tur tuv twa tze tzo uhi ung uyg vie war was wat wik wmu wrd wrk wrl wry wsk wwy xho yaq yct yid yim yin yir yny yor yuc yuk yur ywl,278,76475,0.0036351748
16A,Weight Factors in Weight-Sensitive Stress Systems,,16,Rob Goedemans; Harry van der Hulst. 2013. Weight Factors in Weight-Sensitive Stress Systems. In: Dryer; Matthew S. & Haspelmath; Martin (eds.) 2013. The World Atlas of Language Structures Online. Leipzig: Max Planck Institute for Evolutionary Anthropology. (Available online at https://wals.info/chapter/16),1,acg agt aln alw aly ana ara aro arp atb awe awt aym bae bag bal baw bbm bbw bdm bej ben bik bim blk bma bna bnl bnt bqb bql bqn bqo bqr bqs bre bsk bto bua bug buu cav chk cle cmn cnl coo cpa cpn cre crn cup cya cyv cze daa dak dio diy dji dni dou dre dri dyi eno ese far fin frd gae geo gll glp grr gua gug guu heb hln hmu iaa ice ind ing irr jak jaq jum kal kam kap kaw kei kfe kgu khs kit kjo kli klp kmu kob kon ksr kwa kya lan lat lav len liv lje lla lmp lrk luv mae mal map mar mau may mbb mcd mea min mis mks mku mms mna mnj mns mnt mnx mny moh mrd mta myi myn myy naj nbb nbo ngl ngr nht nia nin niv nju nkb nmb nne npu nsy nua nug olm ond ono orc pad pag pai pau pin pir pit pkm pkn plh plp pme pms pna pol ppi prs psh put qay qch qim que rap rit rnr rti sah sbg sdh sed sgr skl slp sly sml snm sno srb srd sro sup svk swa tab tac taj tas taw tbr teh tgk thp tiw tla tld tmc tor trd tru try tse tsi tua tuk tun tzo uhi uli uma urk uzn vot wah wan wao war wbn wch wel wer wet wlm wnb wra wrd wrl yel yim yir ymd yny ywl zqc zul zun,261,76475,0.00341288
14A,Fixed Stress Locations,,14,Rob Goedemans; Harry van der Hulst. 2013. Fixed Stress Locations. In: Dryer; Matthew S. & Haspelmath; Martin (eds.) 2013. The World Atlas of Language Structures Online. Leipzig: Max Planck Institute for Evolutionary Anthropology. (Available online at https://wals.info/chapter/14),7,ace asm bag bal baw bma bsk ccp cnl cya dni dri grw gua heb hln irr kal kaw kei khm khs kmu lmp mac mar mrd mta nmb orc pkm prs qch que rnr sed shi skl sml taj tas tbb tru tsa tsi urk uzn wah war wer,51,76475,0.0006668846
138A,Tea,,138,Östen Dahl. 2013. Tea. In: Dryer; Matthew S. & Haspelmath; Martin (eds.) 2013. The World Atlas of Language Structures Online. Leipzig: Max Planck Institute for Evolutionary Anthropology. (Available online at https://wals.info/chapter/138),3,abm ata bam bma brm che cre cyn fli haw inu kbl ket krk kse ksg lao lis lit lon mku ojm pak pol psm ren rka snn tiw tun wam wlf zar zqc zul,36,76475,0.00047074206
15A,Weight-Sensitive Stress,,15,Rob Goedemans; Harry van der Hulst. 2013. Weight-Sensitive Stress. In: Dryer; Matthew S. & Haspelmath; Martin (eds.) 2013. The World Atlas of Language Structures Online. Leipzig: Max Planck Institute for Evolutionary Anthropology. (Available online at https://wals.info/chapter/15),8,ace acg agt aln alw aly ana ara aro arp asm atb awe awt aym bae bag bal baw bbm bbw bdm ben bik bim blk bma bnl bnt bqb bql bqn bqo bqr bqs bre bsk bto bua bug buu cah cav chk cmn cnl cpn cre crn cup cya cyv cze daa dak dio diy dji dni dob dou dre dri dyi eno ese est far fin frd gae geo gid gll glp goo grk grr grw gua gug guu haw heb hln hmu hnn hun iaa ice ind ing iri irr jak jaq jum kal kam kap kaw kay kei kfe kgu khm khs kjo kli klp kmu kob kon koo koy krl ksr kut kwa kya lan lat lav len liv lje lla lmp lrk luv mac mae mal map mar mau may mbb mcd mgd min mis mks mku mms mna mnj mns mnt mnx mny moh mrd mrt mta myi myn myy naj nbb nbo ngl ngr nht nia nin niv nju nkb nmb nne npu nsy ntu nua nug olm ond ono orc pad pag pai pau pin pir pit pkm pkn plh plp pme pms pna pol ppi prs pur put qay qch qim que rap rit rnr rti sah sbg sed sgr shi skl slp sly sml snm sno squ srb sro sto sup svk swa tab tac tag taj tas taw tbb tbr teh tgk thp tiw tla tld tmc tor trd tru try tsa tse tsi tua tuk tun tzo uhi uma urk uzn vot wah wan wao war wbn wch wel wer wet wlm wnb wra wrd wrl yaq yel yim yir ymd yny ywl zqc zul zun,281,76475,0.0036744033
