parameter_id,parameter_name,parameter_description,chapter_id,chapter_citation,value,same_value_language_ids,value_language_count,language_count_total,count_ratio
103A,Third Person Zero of Verbal Person Marking,,103,Anna Siewierska. 2013. Third Person Zero of Verbal Person Marking. In: Dryer; Matthew S. & Haspelmath; Martin (eds.) 2013. The World Atlas of Language Structures Online. Leipzig: Max Planck Institute for Evolutionary Anthropology. (Available online at https://wals.info/chapter/103),2,abk acm aco ala alb ame amh ane anj apu ara arp au awp baa bag baw bej ber bkr bln bma brn bsq bur can cap car cav cax cba cbo cha chk cku cle cmn cnl cop cub dag dgr dio diz dni dum dut eka eng err eve ewe fij fre fua fur geo ger gmw grk grw ham hat hin hix hua hun ind iqu iri irq ita ket kew kfe khs kjo kkv klv kna knd knr kom kon kos kpm krb krk kws lak lav lel luv mab map mau may mis miz mlk mna mne moa moh mrd mrl msl msn mss mun mxc nai nak nbd ndo nez ngi ngk nko nti nyu ond oss pal par plk pol prh qui ram ret rus sah sal slp sml snt spa sue swa syu tab tap tau taw tid tin tir tiw tla tmr tna tri tru tsi tso tuk tun uma una ung ura usa wam war was wel wma wsk xok yag yim yko ypk yuc yur zan zqc zsq zul,181,76475,0.0023667866
102A,Verbal Person Marking,,102,Anna Siewierska. 2013. Verbal Person Marking. In: Dryer; Matthew S. & Haspelmath; Martin (eds.) 2013. The World Atlas of Language Structures Online. Leipzig: Max Planck Institute for Evolutionary Anthropology. (Available online at https://wals.info/chapter/102),5,abi abk ace acm aco aeg ain ala alb ame amh amu ane apu ara arp asm atk au aym baa bag baw bej ber bln bma brr bsq bur cah can car cax cba cbo chk cku cmn cmx coo cor cre cyv dag dio dni doy eka err ewe fij fua geo gmw goo grk grw gua ham hix hlu hua hun ika jak jaq kas ket kfe kjo kkv klv knm knr koa kom kon kos kpm krb krd krk ktl kut kws kwz lan lav lel lim lkt luv mab mac mak map mar mau mby miz mku mlk mna moa moh mrd mrl msl msn mss mun myi nan nas nav ndo nez ngi ngk ngl nht nko nmb nti nug nyu ond oss otm pal par pec pip pit pms prh prs psj psm pur qim qui ret sah sal siu sla slp snt spa squ swa tap tau taw tiw tja tkl tli tna tol ton tot tpn tsi tuk tun tzu uma una ung ura usa wam war was wch wic wrd wrk yag yel yim ypk yuc yuk yur zan zqc zsq zul,193,76475,0.0025237005
104A,Order of Person Markers on the Verb,,104,Anna Siewierska. 2013. Order of Person Markers on the Verb. In: Dryer; Matthew S. & Haspelmath; Martin (eds.) 2013. The World Atlas of Language Structures Online. Leipzig: Max Planck Institute for Evolutionary Anthropology. (Available online at https://wals.info/chapter/104),2,abi ace aeg ain ala amh amu ane apu ara arp au bag baw bej ber bln bma brr cax cba cbo chk cku cor cyv dio doy eka err ewe fij gmw grw ham hix ika kas ket kfe kjo kkv klv kom kon kos kpm krb krd ktl kut lan luv map mby miz mku mlk mna moa mrd mrl msn nan ndo nez ngk nht nko nyu ond oss otm pal pip pms prh prs psj sah snt swa taw tuk uma ura wam war wch wic wrk yag zan zsq zul,96,76475,0.0012553122
100A,Alignment of Verbal Person Marking,,100,Anna Siewierska. 2013. Alignment of Verbal Person Marking. In: Dryer; Matthew S. & Haspelmath; Martin (eds.) 2013. The World Atlas of Language Structures Online. Leipzig: Max Planck Institute for Evolutionary Anthropology. (Available online at https://wals.info/chapter/100),4,ace aco amu apu ara arp cax gua ika ket kew koa lkt moh nas ond tab tli ton tso tun wic wrk yag yuc,26,76475,0.00033998038
17A,Rhythm Types,,17,Rob Goedemans; Harry van der Hulst. 2013. Rhythm Types. In: Dryer; Matthew S. & Haspelmath; Martin (eds.) 2013. The World Atlas of Language Structures Online. Leipzig: Max Planck Institute for Evolutionary Anthropology. (Available online at https://wals.info/chapter/17),3,wic yid yuw,4,76475,0.000052304677
16A,Weight Factors in Weight-Sensitive Stress Systems,,16,Rob Goedemans; Harry van der Hulst. 2013. Weight Factors in Weight-Sensitive Stress Systems. In: Dryer; Matthew S. & Haspelmath; Martin (eds.) 2013. The World Atlas of Language Structures Online. Leipzig: Max Planck Institute for Evolutionary Anthropology. (Available online at https://wals.info/chapter/16),1,acg agt aln alw aly ana ara aro arp atb awe awt aym bae bag bal baw bbm bbw bdm bej ben bik bim blk bma bna bnl bnt bqb bql bqn bqo bqr bqs bre bsk bto bua bug buu cav chk cle cmn cnl coo cpa cpn cre crn cup cya cyv cze daa dak dio diy dji dni dou dre dri dyi eno ese far fin frd gae geo gll glp grr gua gug guu heb hln hmu iaa ice ind ing irr jak jaq jum kal kam kap kaw kei kfe kgu khs kit kjn kjo kli klp kmu kob kon ksr kwa kya lan lat lav len liv lje lla lmp luv mae mal map mar mau may mbb mcd mea min mis mks mku mms mna mnj mns mnt mnx mny moh mrd mta myi myn myy naj nbb nbo ngl ngr nht nia nin niv nju nkb nmb nne npu nsy nua nug olm ond ono orc pad pag pai pau pin pir pit pkm pkn plh plp pme pms pna pol ppi prs psh put qay qch qim que rap rit rnr rti sah sbg sdh sed sgr skl slp sly sml snm sno srb srd sro sup svk swa tab tac taj tas taw tbr teh tgk thp tiw tla tld tmc tor trd tru try tse tsi tua tuk tun tzo uhi uli uma urk uzn vot wah wan wao war wbn wch wel wer wet wlm wnb wra wrd wrl yel yim yir ymd yny ywl zqc zul zun,261,76475,0.00341288
9A,The Velar Nasal,,9,Gregory D.S. Anderson. 2013. The Velar Nasal. In: Dryer; Matthew S. & Haspelmath; Martin (eds.) 2013. The World Atlas of Language Structures Online. Leipzig: Max Planck Institute for Evolutionary Anthropology. (Available online at https://wals.info/chapter/9),2,agr amn aso ats awn bsk bur but cah cly cmh cri dgr dni eng fin gar ger grw hlp hmi hmo iql jiv juh kaz ket kfe kgz kha khk khm kiq kkp kmk kob kor krc krd krm kty kuo kuq kym mcs mgg mid mnd mns mog mss mun mwn nog nok olo pno psh put rwa shr skp slr sol sss sta syg tbb tex tkm tlb tof ttb tuv tvo twx una urk urm ute uyg uzb ykt ysi yug zqc,87,76475,0.0011376267
15A,Weight-Sensitive Stress,,15,Rob Goedemans; Harry van der Hulst. 2013. Weight-Sensitive Stress. In: Dryer; Matthew S. & Haspelmath; Martin (eds.) 2013. The World Atlas of Language Structures Online. Leipzig: Max Planck Institute for Evolutionary Anthropology. (Available online at https://wals.info/chapter/15),8,ace acg agt aln alw aly ana ara aro arp asm atb awe awt aym bae bag bal baw bbm bbw bdm ben bik bim blk bma bnl bnt bqb bql bqn bqo bqr bqs bre bsk bto bua bug buu cah cav chk cmn cnl cpn cre crn cup cya cyv cze daa dak dio diy dji dni dob dou dre dri dyi eno ese est far fin frd gae geo gid gll glp goo grk grr grw gua gug guu haw heb hln hmu hnn hun iaa ice ind ing iri irr jak jaq jum kal kam kap kaw kay kei kfe kgu khm khs kjn kjo kli klp kmu kob kon koo koy krl ksr kut kwa kya lan lat lav len liv lje lla lmp luv mac mae mal map mar mau may mbb mcd mgd min mis mks mku mms mna mnj mns mnt mnx mny moh mrd mrt mta myi myn myy naj nbb nbo ngl ngr nht nia nin niv nju nkb nmb nne npu nsy ntu nua nug olm ond ono orc pad pag pai pau pin pir pit pkm pkn plh plp pme pms pna pol ppi prs pur put qay qch qim que rap rit rnr rti sah sbg sed sgr shi skl slp sly sml snm sno squ srb sro sto sup svk swa tab tac tag taj tas taw tbb tbr teh tgk thp tiw tla tld tmc tor trd tru try tsa tse tsi tua tuk tun tzo uhi uma urk uzn vot wah wan wao war wbn wch wel wer wet wlm wnb wra wrd wrl yaq yel yim yir ymd yny ywl zqc zul zun,281,76475,0.0036744033
14A,Fixed Stress Locations,,14,Rob Goedemans; Harry van der Hulst. 2013. Fixed Stress Locations. In: Dryer; Matthew S. & Haspelmath; Martin (eds.) 2013. The World Atlas of Language Structures Online. Leipzig: Max Planck Institute for Evolutionary Anthropology. (Available online at https://wals.info/chapter/14),6,aln alw arp atb awt aym bae bbm bik bim blk bnt bql bqn bqr bre bto bug buu cav crn daa dji dob eno ese frd gll haw hnn ind jaq jum kam kjo kli kob koo ksr kut kwa len lje luv mal mau mgd min mks mms mna mnt moh myi myn naj nbb ngl nht nia nkb nne npu nsy nua nug olm ond pad pag pai pir plh plp pna pol qay qim rap rti sbg sgr sly snm squ swa tab tac tag taw tbr tiw tld tor trd tse tua tuk uma wbn wel wet wra wrd ymd yny ywl zqc zul,110,76475,0.0014383786
44A,Gender Distinctions in Independent Personal Pronouns,,44,Anna Siewierska. 2013. Gender Distinctions in Independent Personal Pronouns. In: Dryer; Matthew S. & Haspelmath; Martin (eds.) 2013. The World Atlas of Language Structures Online. Leipzig: Max Planck Institute for Evolutionary Anthropology. (Available online at https://wals.info/chapter/44),6,abi abn ace acm adz ain ame amu ana anj arm asm ata atk awp aym baa bag bam bar baw ber bkr brh bri bro brr bsq bya cah can cap cav cba cbo cha chk chr cle cmn cmx cnl coo cor cpn cri cyv dag dgr dni don doy eka epe err eve ewe fij fin fur gar geo gmw goo grw gua guu hai hat hin hmo hmr hua hun hzb igb ika imo ind ing iqu jak jaq kay kch ket kew kgu kha khm kio kis kjo kkv klk kna knm knr koa kob kos kpm krb krd krk kse ktl kuk kut kwz kyl lad lah lak lan lep lez lim lkt mab mac mak mal mao map mar mcr mde mei mis miz mlm mna mne moa mrl mrt msl msn mss mum mxc myi nad nai nak nan nbd nbr ndy nez ngi nht niv nti ntu nup nuu nyu ond oss otm pai pal par pec pip pit pms pny pur qaw qim ram rap rem sal sam san saw sel shk siu sla slp sml snm snt so squ srm sue sun syu tab tag tau taw tgk tha tin tja tkl tla tli tmr tms tna tol ton tot tpn trb tri tsi tso tuk tur tzu udh uhi uma una ura urk usa vie wam wap was wbn wch wic wik win wma wra wrd wsk yag yap yaq yel yid yim yko yor ypk yuk yur zqc zsq zun,254,76475,0.0033213468
48A,Person Marking on Adpositions,,48,Dik Bakker. 2013. Person Marking on Adpositions. In: Dryer; Matthew S. & Haspelmath; Martin (eds.) 2013. The World Atlas of Language Structures Online. Leipzig: Max Planck Institute for Evolutionary Anthropology. (Available online at https://wals.info/chapter/48),3,aeg ain amh ane anj ara au aym bag ber bma bur can cbo cha cle cnl cop dni err eve ewe fin fur grw gua hau heb hix hmi hun ijo iqu iri kfe klv kna koa kos krd lan lkt mab mac mal mby mrl mup mxc nbd niv nko noo nti ntu pms prs ram ret sal sel sla so taw tgk tir tmr tpn tri uma ura urk usa was wel wrk yap yaw yes yim yuc zsq,83,76475,0.001085322
55A,Numeral Classifiers,,55,David Gil. 2013. Numeral Classifiers. In: Dryer; Matthew S. & Haspelmath; Martin (eds.) 2013. The World Atlas of Language Structures Online. Leipzig: Max Planck Institute for Evolutionary Anthropology. (Available online at https://wals.info/chapter/55),3,abu aln ass ath bel ben bnv bok brm chw chx cme cnt crq cuu eya gar hmd hyo jak jpn kam kan kei keo khu klp klv kmh kmu kor kos krb ktp kua kwz kyl lah lai lch lon lov mlm mnd mok nau nel new ngd niv nvs nyl plk poh pur rem saw sim smd sml so tab tha tht tli tou tpa trb tsi tuy tze uli vie wao wrk yag yct,78,76475,0.0010199412
