parameter_id,parameter_name,parameter_description,chapter_id,chapter_citation,value,same_value_language_ids,value_language_count,language_count_total,count_ratio
15A,Weight-Sensitive Stress,,15,Rob Goedemans; Harry van der Hulst. 2013. Weight-Sensitive Stress. In: Dryer; Matthew S. & Haspelmath; Martin (eds.) 2013. The World Atlas of Language Structures Online. Leipzig: Max Planck Institute for Evolutionary Anthropology. (Available online at https://wals.info/chapter/15),6,ala arv car dsh irq mam sdh,8,76475,0.00010460935
53A,Ordinal Numerals,,53,Thomas Stolz; Ljuba N. Veselinova. 2013. Ordinal Numerals. In: Dryer; Matthew S. & Haspelmath; Martin (eds.) 2013. The World Atlas of Language Structures Online. Leipzig: Max Planck Institute for Evolutionary Anthropology. (Available online at https://wals.info/chapter/53),5,abk aco ame aze brh bsm cah chk evn gar gua haw ind jak kas ket kha kji knd knr kse ktt kuo kuv kwm lad luo mac map maw may mei mnc mns mqc mxa mym nav nog owc prs qay qec qim rka ssh tab tha toj tsh tur ypk zya,54,76475,0.0007061131
16A,Weight Factors in Weight-Sensitive Stress Systems,,16,Rob Goedemans; Harry van der Hulst. 2013. Weight Factors in Weight-Sensitive Stress Systems. In: Dryer; Matthew S. & Haspelmath; Martin (eds.) 2013. The World Atlas of Language Structures Online. Leipzig: Max Planck Institute for Evolutionary Anthropology. (Available online at https://wals.info/chapter/16),2,agu apu arg bgg bui bwa dhu dhw djr epe est eve fij gid haw htc hun hzb iri irm kha koa kop krk kuu kws lar let lui mai mak mao men mme mrk mrl mrs mrt mrw mym nep ngi oss oto plb ror rot sea ser sio skp tah tbb tib tlo tng tsh ung wam wlo yid yin ysl yuw,65,76475,0.00084995094
14A,Fixed Stress Locations,,14,Rob Goedemans; Harry van der Hulst. 2013. Fixed Stress Locations. In: Dryer; Matthew S. & Haspelmath; Martin (eds.) 2013. The World Atlas of Language Structures Online. Leipzig: Max Planck Institute for Evolutionary Anthropology. (Available online at https://wals.info/chapter/14),1,abe abk aeg ael agu ahs akl ala ame apa apu arc arg arh arl arm arv asy atq au ava awd bej bgg bgv bho bkl bkr bna bqg bqh bqi bqz bso bui bur bwa cap car cct ceb cha chv cle coo cpa crk ctl cub cyg des dhu dhw die djr dsh dut eka emc eng epe eve fij for fre gay ger god gor grb guj hin hix hno hop htc hzb iga irm irq ita jav kaj ker kew kha kit klm klv knm koa kop kra krk kro ksh ktn kuu kuz kwk kws lar let lez lit lmh lui mai mak mam mao mcs mdm mea meb men mlc mlk mlt mly mme mmo mnd mne mng mnm mrk mrl mrs mrw mse mss mun mwn mym nav nbd ndy nep nez ngd ngi nor nya obk occ oss oto plb por prh psh psm pul ram rom ror rot rsm rus sak sao scr sdh sea ser shk sio skp skr sla slo snc snt spa spo sps srd sru sun svc swe swi tah tbl tgw tib tlo tng tno tns tnt tol tps tsh tur uli ung unm usa wam wic wiy wlo woi wrg yan yap ych yid yil yin yko ypk ysl yuc yun yuw yzv,220,76475,0.0028767572
52A,Comitatives and Instrumentals,,52,Thomas Stolz; Cornelia Stroh; Aina Urdze. 2013. Comitatives and Instrumentals. In: Dryer; Matthew S. & Haspelmath; Martin (eds.) 2013. The World Atlas of Language Structures Online. Leipzig: Max Planck Institute for Evolutionary Anthropology. (Available online at https://wals.info/chapter/52),2,abk acg aco aeg agt ain ala aly ame arg arm arp arr auy ava bag bah bis bla bma bnm bou brh bsq bur car cem chk cmh cmn cog com cor crg dah dam des dgr dmi dni dre dug efi ena eve evn fij fin fni gds gnn goa gol gon goo grj grw gua gum guu hin hix ho hua hui hup hve hzb imo ite jak jpn kam kat kay kha khm khr khs kin klv knd kng knm knr koa kob koi kor krk kro kry ktt kur kwe kwm kxo lad lah lak laz les lez lim lkt lug lui luo mao map maw mei mgg mjk mlt mmv mnc mnd mne moa mrd mrg mrt mrw msh mun mup myi myo nah nan nav ngi niv nkr nmi nob nti nwd nya orh ots pae pai pal per pia pol ppi prh psj pur qaw qch rap sam shn siu sla slb slp so som ssh swa syu tag tah tas tau tbs tbu tel tha tin tke tli tml tng toq tri trr tru tug tup txj uby udi uhi una urd urk usr vai ven wan way wch win wra wrg wrw wsk yaq yel yir yko ykt yor ypk yuk zch,213,76475,0.002785224
17A,Rhythm Types,,17,Rob Goedemans; Harry van der Hulst. 2013. Rhythm Types. In: Dryer; Matthew S. & Haspelmath; Martin (eds.) 2013. The World Atlas of Language Structures Online. Leipzig: Max Planck Institute for Evolutionary Anthropology. (Available online at https://wals.info/chapter/17),5,agu aln ame arc ava awd bbm bbw ben bgv bnt bqb bqg bqh bql bqn bqo bqr bqz bsk bso bua chv coo ctl cub cya dak dhu dhw djr dob dou eka for gll god gor grb htc irq irr kal ker kew kfe kha kob kop ktn lat mal mar mcd mea mme mmo moh nbo obk olm ond oss pai pkm psh que rit rot rus scr sea sed sio skr sla slo sly sml squ sto swe swi tah tas tgk tsa tua tun tur war wiy woi yan yir ymd yzv,98,76475,0.0012814646
46A,Indefinite Pronouns,,46,Martin Haspelmath. 2013. Indefinite Pronouns. In: Dryer; Matthew S. & Haspelmath; Martin (eds.) 2013. The World Atlas of Language Structures Online. Leipzig: Max Planck Institute for Evolutionary Anthropology. (Available online at https://wals.info/chapter/46),1,abm ace aco agt ain aly amu ana aso ass atc awp aze bao baw bdm blr bsk bsq bug bul bur but cah cch chk chn chv cmn cnl coo crk ctm diy dja dji djp djr dyi ene est eve evn ful gaa gag gar geo goa goo grg grk grw gum guu hay heb hmo htc hun hup hzb ice itz jak jam jaq jpn kay ket kgz khk khs kio kku kma kmh knc knd kng koa kod kop kor krc krk krl krm kry ksi kty kut kzy lak lat lez lil lit lkt lml mac mai mar mei mhi mic mlk mme mmo moe mra mrh mrt mrw mss mun myi mym nai nav ndj neg nez nga ngi ngk ngn nha nht niv nsg ntu nug nwd oss pae pkn pno pny pol ppi psh psm pur qhu qim rom rus scr shk sho shr siu ski skp sno squ stl tab taj tha tiw tja tkl tml ton tps tst tun tuv tvo txj udh udm ukr uku uzb vie wam wic wmu wrd wrn wry yaq yid yin yko ykt yng ypk yuw zun,194,76475,0.0025367767
