parameter_id,parameter_name,parameter_description,chapter_id,chapter_citation,value,same_value_language_ids,value_language_count,language_count_total,count_ratio
25B,Zero Marking of A and P Arguments,,25,Johanna Nichols; Balthasar Bickel. 2013. Locus of Marking: Whole-language Typology. In: Dryer; Matthew S. & Haspelmath; Martin (eds.) 2013. The World Atlas of Language Structures Online. Leipzig: Max Planck Institute for Evolutionary Anthropology. (Available online at https://wals.info/chapter/25),2,abk ace aco aeg ain ala amb ame amp ane apu arp asm atk awp awt aym bag bbw bej bel bma brh bri brm brr brs bsq bur cha chk cho chy cin cjo cku cnl coo cre ctm cyv dag diy diz dji djp dni dum dyi eka eng epe eve fij fin fre fur geo ger gku gmz goo grb grk grr grw gua hat hau heb hin hix hua hun hve ice ik ika imo ing jak jiv jpn kay kch ket kew kha kho kim kio kkr kmb knd knm knp knr koa kob kor kri krk kro kui kut lai lan lav lez lkt lug luv mal mao map mar mau may mei mis mlk mnd mot mpa mrh mrt mss mun mxc myi nah nar nat nbd nca nep ngi niv nkk nmb nsg ntu nug nuu nyn ond orh ori otm pai pau pip prs pso pur qim qui ram rap rus sah san sdw shk siu sla sml snm spa squ sue swa syu tag tau tgp tib tiw tkl tlf tli tmc ton tru tsh tuk tun tur uhi ung usa wao war was wch wem wic win wra wrl wrn wry wsk xok yag yaq yes yim yko yli ynk yor ypk yuc yur zqc zul zun,219,76475,0.002863681
16A,Weight Factors in Weight-Sensitive Stress Systems,,16,Rob Goedemans; Harry van der Hulst. 2013. Weight Factors in Weight-Sensitive Stress Systems. In: Dryer; Matthew S. & Haspelmath; Martin (eds.) 2013. The World Atlas of Language Structures Online. Leipzig: Max Planck Institute for Evolutionary Anthropology. (Available online at https://wals.info/chapter/16),2,agu apu arg bgg bui bwa dhu dhw djr epe est eve fij gid haw htc hun hzb iri irm kha koa kop krk kuu kws lar let lui mah mak mao men mme mrk mrl mrs mrt mrw mym nep ngi oss oto plb ror rot sea ser sio skp tah tbb tib tlo tng tsh ung wam wlo yid yin ysl yuw,65,76475,0.00084995094
75A,Epistemic Possibility,,75,Johan van der Auwera; Andreas Ammann. 2013. Epistemic Possibility. In: Dryer; Matthew S. & Haspelmath; Martin (eds.) 2013. The World Atlas of Language Structures Online. Leipzig: Max Planck Institute for Evolutionary Anthropology. (Available online at https://wals.info/chapter/75),2,aco ana apu asm awp brh bri bsq bur chv cmn cre cyv dag die dni eka epe eve fua fur gar goo grw hai ham ika imo kay kio klv koa lad lep lkt map mar mns mss mxc myi nav ngt niv nma ond pai pba pms prh psm pso qim sel shk sml som squ swa tab tiw tja tml tru tsi tur udh una usa vot wam war wra wrd yag yaq yim yko ypk yuc zqc zul zya,84,76475,0.0010983981
65A,Perfective/Imperfective Aspect,,65,Östen Dahl; Viveka Velupillai. 2013. Perfective/Imperfective Aspect. In: Dryer; Matthew S. & Haspelmath; Martin (eds.) 2013. The World Atlas of Language Structures Online. Leipzig: Max Planck Institute for Evolutionary Anthropology. (Available online at https://wals.info/chapter/65),2,abi aco afr ain ame amh ana apu arp asm atc awn bar ben blc bon brm brs bui cnl coc cpl cre cyn dag did dio eng ewe fij fin ger goo grw gua gug hal hau heb hmo hun ice ind ins ise jav jiv jpn kay kew kfc kha khm kmu knd koa krk kui kut kya lah lai lao lat lav lda lkt luv man mao map mar may mei mne mrt mtg mtu myi nca ngi nim niv ntu ono pai plg qco qim ram rap raw san sml snm som sue sun swa swe tga tgr tha tig tiw tml tne tpi tuc tuk udm vie war wch wlf wra yes yko yor zun,121,76475,0.0015822164
143E,Preverbal Negative Morphemes,,143,Matthew S. Dryer. 2013. Order of Negative Morpheme and Verb. In: Dryer; Matthew S. & Haspelmath; Martin (eds.) 2013. The World Atlas of Language Structures Online. Leipzig: Max Planck Institute for Evolutionary Anthropology. (Available online at https://wals.info/chapter/143),1,abi abn abu ace acg acl acm aco adg agc agd agh ain ajg akh ala alb all als alw amb ame aml amn amo ams amx anj any aoj apu apw arg arj aro arp asy ata au awa awp aym baa bab bac bae baf bai baj bam bao baq bar bbf bbw bch bco bdm bfg bgo bho bid bii bil bkr blr blt bmb bmz bni bnn bnu bob bod boi bok bra bre brf bri brp bsq btk bto bua bug bul bun buw buy bvi bwc cah cai cak cax cea cem cha chc chd che chj chk chq chr chx ckl cle cmh cmn cmy cnt coc coo cos cpy cre crn crt cso ctl cui cup cya dag dan dga dgb dgr dha dhw did din diy dja dji djm djn djp dma dmk doy dre dsh dua dut dyi ebi eip eka ene eng eno erk est eud eve evn ewe ewo fij fin fon fre fut fye gaa gae gap gav gbb gds gel geo ger ggu ghr gir gmw goa gok goo grb grf grj grk grr grs gua gud gug guh guj guu gwa hai hak hal han hau haw hay heb hei hil hin hlp hlu hmo hoa hop htc huc hun hup hve iaa iba ice idn ido ifm ifu ign ik imo ina ind inn iqu iri ita ite izi jak jaq jlu jng joh juh kad kae kan kbl kch kdz ket kfe khm khn khr khs kio kir kis kiw kkt kla klm kls klv klw kmk kms kmu kmw knb knc kni knk knn koe koi kom kop kor kos krb kre krj krk kro ksa kse ksg ksn ktc ktl kty kum kuo kut kwa kwb kwn kwo kws kwt kya kyq kzy lac lah lal lan lao lar ldu lgu lho lic lis lmu lou lui luo mae maj mak mal mam man mao mau maw mbe mbi mbt mcd mch mco mde mdl mdm men mer mga mgg mgi mgk mhu mie min mir miy mka mkg mkj mkl mku mlk mme mmn mna mnd mni mnm mno mns mnt mny moe mog mok mom mon moo mos mov mpa mpo mrd mrh mri mrl mro mrq mrr mrt mru mrw msk msn msq mss mtu mum mun mup mur mus mut mwb mwo mxc mxj mxo mxp myi nab nag nah naj nak nal nar nav nax nbr nca ncm ndj ndo ndr ndy neh nev nez nga ngd ngi ngj ngk ngu ngw nha nhh nhm nht nia nif niu nke nkk nne non nor nsg nti ntu nue nug nun nyi nyk nyn nyr nyu oir oji oks omi one ono ood oro orw oss otm otr paa pai pal pan par pau pba per pip pis pkn plg plh pnn pno pnu poh pol por ppi psm pso pul pun pur qhu qim qui qum rag ram rap raw res rik rom rot rov rpa ruk run rus rwa rwe sam sap scr sed see ses shl shp shu sid sil sir sis siu skw slb slo sml sna sng snn sno so sob som son spa squ src srd sre ssa sta sti stl stn sud sue sun sup svs swe tac taf tag tah tak tam tau taw tbo tbt tbx tce tee ten teo tep ter tes tgh tgk tgo tha tho thu thy tid tim tin tiw tja tke tkl tla tli tmm tmn tmo tmr tnc tng tnn tno tny tol tou tpa tpn tri trr tsg tsh tsi tsk tsn ttn ttu tuk tus tvl twe tye tzo tzu udh ukr uli una ung urd url urt uru usa vai vie wag wah wak wal wam war wat wch wed wel wem wic wik win wiy wlf wlm wlw wmu woi wol wor wrb wrd wrg wrk wrl wsk wya xam xar xbi xns yag yap yaq yei yi yid yin yiw ylm yng yok yor yuc yuk yur yuw ywl ywr zai zar zch zpr zqo zqs zun zzo,682,76475,0.008917947
17A,Rhythm Types,,17,Rob Goedemans; Harry van der Hulst. 2013. Rhythm Types. In: Dryer; Matthew S. & Haspelmath; Martin (eds.) 2013. The World Atlas of Language Structures Online. Leipzig: Max Planck Institute for Evolutionary Anthropology. (Available online at https://wals.info/chapter/17),1,abe ace aeg agt aly apa apu ara arv asy awe awt bdm bkl blk bna bto bur cah cap cav cmn cre crn cyv cze diy dji dni dre dri dut dyi eng ese est fij fin gay geo ger goo grk grr gug guu haw heb hun iaa ice iga ind jaq kaj kay kei kgu kjo klm kon krl ksr kut kuu kya lar lav len let liv luv mau may mdm mku mlc mlk mna mne mnj mnm mns mny mrs mrt mrw mss mta myi myy ngi ngl ngr nin nju nkb nne ntu nua nug nya ono pin pir pit pkn pol ppi ram rti skp slp snm sno snt spa srb sru svk tab tac tag taw tbb tgw tiw tmc tng tns tps try tsh tuk uzn vot wam wan wao wch wlm wra wrd wrg wrl yaq yel yim yin yny zqc zul,153,76475,0.0020006539
51A,Position of Case Affixes,,51,Matthew S. Dryer. 2013. Position of Case Affixes. In: Dryer; Matthew S. & Haspelmath; Martin (eds.) 2013. The World Atlas of Language Structures Online. Leipzig: Max Planck Institute for Evolutionary Anthropology. (Available online at https://wals.info/chapter/51),1,aar abn acm acu adk adn ady aga agt alb ale all alw aly amh amn ams ana apw arc arm arw ass ath ats ava awa awe ayo aze azi baa bae baq bbw bej bel ben bho bii bio biu bkb blr blx bmr bnj bnr bnu bod boi brh brm brr brs bry bsk bti bun bur but bya cah cai cam cas cax cay cea chc chi chk chv cln cmh cml cmn coa coc cos cpy cre crp ctm cub cup cze dag dgr dhb dhr dhw did diy dja dji djm djn djp djr dmk dni dom drg dsh dyi emb ene esm ess est eud eve evn fin fur gah gal gam gan gds geo ger ggu gid gil gku goa god gog gon grk grr grw gug guh gum guu hin hlp hmi ho hop hua hui hum hun hup hzb ice ijo ik ing iqu ite jab jaq jeb jiv kab kac kay kbu kem ken ker ket kgu kgz kha khg khi khl kio kiw kje kkp kku klg klm klw kma kmh kmk kmo kmp kmr kms knd knn kno knw kok kol kop kor koy krc krj krn krw kry kta kty kum kuv kws kwz kya kyp kzy lad lak lat lav lec lez lho lim lit lml lmn lui mac mag maj map maw mba mby mcc mch mdm mdn mee men mer mgh mhi mhk mhl mii mik mir mkh mki mlk mme mnc mne mno mns mny moe mog moh moo mqf mrl mrt mrw msc msl mts mui mur mut nah nas nbr ndj nep new nez nga ngi ngj ngl ngm ngn ngt ngw nha nis niv nkb noc nog nor nsn ntj ntu nug nya nyi oir oji omi ond one ong ord orh ork orw oss otr oya pan par pba pia pir pkn pkt pme pny pol ppi prh prk psh psm pso ptt ptw puq pur pwn qim qui rem rit rmb rom rus rut rwe sav scr shb shh shi sho shp shy sia sin skp slo slp sna snh sno so sor sta stl sue suk tao tce tel ten thn thu tic tli tlo tlp tma tml tmn tpn tpt trm trr tru tsh tsz ttu tul tun tur tus tuv tvo twe twn udi udm uhi ukr uru usr ute uyg uzb wag wah wak wam wan wap was wau wed wem wic wik win wiy wly wmu wn wom wrb wrd wrg wrk wrl wrn wth xbi yag yah yam yaq yar yid yim yin yko ykt yng yok ypk ytu yuc yuk yur yuw ywl yyg zan zay zpr zqc zqo zqs zun,452,76475,0.0059104282
66A,The Past Tense,,66,Östen Dahl; Viveka Velupillai. 2013. The Past Tense. In: Dryer; Matthew S. & Haspelmath; Martin (eds.) 2013. The World Atlas of Language Structures Online. Leipzig: Max Planck Institute for Evolutionary Anthropology. (Available online at https://wals.info/chapter/66),1,abk aeg afr alw aly amh arm atc atu avo awn awp aze bar bej ben bnj brh bsq bul bur dag did eng eve fij fin fre geo ger goo grk gua gug heb hin hun hwc ice imo jiv jpn kfc kha kji knd knk knr kor kui kya lat lez mao mau mlt mrt mtg myi ngi ntu orh pan por prs qco qim ram rap raw rom ruk rus som spa swa swe tah tga tgr tig tiw tml tne tny tpi tur wlf wor wra yaq zqc zun,94,76475,0.0012291599
72A,Imperative-Hortative Systems,,72,Johan van der Auwera; Nina Dobrushina; Valentin Goussev. 2013. Imperative-Hortative Systems. In: Dryer; Matthew S. & Haspelmath; Martin (eds.) 2013. The World Atlas of Language Structures Online. Leipzig: Max Planck Institute for Evolutionary Anthropology. (Available online at https://wals.info/chapter/72),1,acu aea ala alb ame anl ark ath awn aym bkr brs bsk bul cak chk cor dag dbd dio dni est eve evn fin fua gam gbk gmz goo grk gua ham haw heb her hix hun hzb ing iri irq jak jaq jeb juh kha kho kil kim klm klv kmk knd knm koa kob kon krk krn kro krq kte kui kyl lak lep lgt loz lug luv mal mao mcd mdk mei mgo mhi mnm mok mrg mss mwe nan nca nep nez ngi nht niv noo nti ntu nub nug ond oss pal pnn prh psm rap rav ret rom shn sla sno snt swa tbu tem tnc tot tur tvo txj tzo tzu udh uzb vot wai win wlf yid yim yko ypk ysi zul zun,133,76475,0.0017391305
105A,Ditransitive Constructions: The Verb 'Give',,105,Martin Haspelmath. 2013. Ditransitive Constructions: The Verb 'Give'. In: Dryer; Matthew S. & Haspelmath; Martin (eds.) 2013. The World Atlas of Language Structures Online. Leipzig: Max Planck Institute for Evolutionary Anthropology. (Available online at https://wals.info/chapter/105),1,abk abu akh ale alk ame aml ano ara awp bae bag bai bak bdm ber bfg bho bii biu bkt bma boz bsq bum bur but bya bzi cct chk chn chr cnl cop dhi dja drg dug epe eve fij fin fre gam gar gdf geo ger grk gua guu hai hat heb hin hix hmo hun hzb ik imo ing irq ita itz jab jak jel jng jpn kas kda kem ker kha khs klm kly kma kmu knc knd knm knr koa kod kor kro kwa kya lad lak lat lav lep lez lgu lis mac mad mam mao mbb mbi mbo mdg mdr mei mgg mgu mhi mle mlt mpr mup mus mxc mym nag nbd nep nia niu nsg nua nwd orh ory pae per pms prs pta ptt pur qaf qia qim rap raw ron rus san sap skp sla sml snm sno so spa sud sue sup tam tgl tgn tha tib tig tin tis tml tms tor trb tru trw tsi tst tsz tur tzu udh udm uku urk wir wra wrm yid yim yko ytu zaq zay zaz,189,76475,0.0024713958
90C,Postnominal relative clauses,,90,Matthew S. Dryer. 2013. Order of Relative Clause and Noun. In: Dryer; Matthew S. & Haspelmath; Martin (eds.) 2013. The World Atlas of Language Structures Online. Leipzig: Max Planck Institute for Evolutionary Anthropology. (Available online at https://wals.info/chapter/90),4,kas,2,76475,0.000026152338
71A,The Prohibitive,,71,Johan van der Auwera; Ludo Lejeune (Valentin Goussev). 2013. The Prohibitive. In: Dryer; Matthew S. & Haspelmath; Martin (eds.) 2013. The World Atlas of Language Structures Online. Leipzig: Max Planck Institute for Evolutionary Anthropology. (Available online at https://wals.info/chapter/71),1,ago akn apa apl au ayr azi bag bfg bii brs brz bsk bsq bur cay cnl coo cze die dja djp don dsh dut eka eng err eve far fre fri ger gwa ham hat hix iaa ice ido igb jab kew kis klm kob kpe krc lat lew lit lkt lnd lng lug mad mar mgo mon mum ndg ndy ngt nht nor npn obo pal pec pit pol ppi prs pso rap rsu rus rwa san scr shk sko slo sno so swe tas tet tir ton tpn tri tsh ttu tur tvo txj udh ukr uma urk uzb wao wap wic wra wrl wrm yag yng ypk yrm,113,76475,0.0014776071
14A,Fixed Stress Locations,,14,Rob Goedemans; Harry van der Hulst. 2013. Fixed Stress Locations. In: Dryer; Matthew S. & Haspelmath; Martin (eds.) 2013. The World Atlas of Language Structures Online. Leipzig: Max Planck Institute for Evolutionary Anthropology. (Available online at https://wals.info/chapter/14),1,abe abk aeg ael agu ahs akl ala ame apa apu arc arg arh arl arm arv asy atq au ava awd bej bgg bgv bho bkl bkr bna bqg bqh bqi bqz bso bui bur bwa cap car cct ceb cha chv cle coo cpa crk ctl cub cyg des dhu dhw die djr dsh dut eka emc eng epe eve fij for fre gay ger god gor grb guj hin hix hno hop htc hzb iga irm irq ita jav kaj ker kew kha kit klm klv knm koa kop kra krk kro ksh ktn kuu kuz kwk kws lar let lez lit lmh lui mah mak mam mao mcs mdm mea meb men mlc mlk mlt mly mme mmo mnd mne mng mnm mrk mrl mrs mrw mse mss mun mwn mym nav nbd ndy nep nez ngd ngi nor nya obk occ oss oto plb por prh psh psm pul ram rom ror rot rsm rus sak sao scr sdh sea ser shk sio skp skr sla slo snc snt spa spo sps srd sru sun svc swe swi tah tbl tgw tib tlo tng tno tns tnt tol tps tsh tur uli ung unm usa wam wic wiy wlo woi wrg yan yap ych yid yil yin yko ypk ysl yuc yun yuw yzv,220,76475,0.0028767572
94A,Order of Adverbial Subordinator and Clause,,94,Matthew S. Dryer. 2013. Order of Adverbial Subordinator and Clause. In: Dryer; Matthew S. & Haspelmath; Martin (eds.) 2013. The World Atlas of Language Structures Online. Leipzig: Max Planck Institute for Evolutionary Anthropology. (Available online at https://wals.info/chapter/94),1,abi ace acl aco adn aeg alb alk all aln alw aml amo amr ams ani apu arg arj arm arq arw asy ata au ayw bag baj bak baq bar bbw bdu bfg bho bik bir bka bkl bkr bma bnr bnu bre brf bsh bsk btk bto bug bul bum bvi bwc ccm cem cha chk chq chr chw chx cic ckl cle cmy coo cop cpl crn cso cya cyv cze dhr did din dio djp dom dre dsh duk dut efi eng eno erk est ewe ewo fij fin fre fua fut fye ga gae geo ger ggu gmw gok grf grk grr gud guj gwa hal hau haw heb hin hmo hna hnd hoa htc hun hve iaa iba ifm ifu igb ind iri ita ite izi jak jmo juh kam kan kau kch ker kfe khl khm khs kik kil kir kis kkt kkv klm kls klv kmj knk kno koe kos krb krd kro krr kry kse ksn kty kut kwn kwy kya laa lac lao lat lbu lda lel len lgu lit llm lmb lmg lmh lmp lnd lon lou luv maa mag mal mam man mao mau may mbm mbr mbt mco mcv mde mds mea mee meh mek men mer mga mgu min miy mka mkg mlg mlu mmn mng mog moh mok mon mov mra mrg mro mrq msq mup mus mut mwb mxc mxj mxo mxp myg myi mzh naj nan nav nca ndo ndt ndy nez ngd ngm ngo nhh nhm nht nia niu nke nkn non noo nor nsg nua nue nyi obo ocu oji olo ond orh otm paa pai pal pan par pat pip pkt plg plh pms pnn poh pol prs psh psm pul qui rap rny rom rot rov rsu rus rwe sah sak sam san sar scr sdw shl shn sim sio siu som son spa squ srb srd sti sud sue sul sun sup sus swa swe swt tab tag tah taj tao tbo tbt tee ten teo tep ter tes tgh tgk tha thy tic tim tin tiw tla tlo tna tne tng tnn tno tob tou tri tsi tsk ttn tuk tvo txj tzo tzu udi ukr uld ung urd uzb vai vie vnm wal war wch wel wic wik wlf wlo wma wme wol xas yap yay yns yor yur zai zqo zul zzo,398,76475,0.0052043153
130A,Finger and Hand,,130,Cecil H. Brown. 2013. Finger and Hand. In: Dryer; Matthew S. & Haspelmath; Martin (eds.) 2013. The World Atlas of Language Structures Online. Leipzig: Max Planck Institute for Evolutionary Anthropology. (Available online at https://wals.info/chapter/130),2,abi abk abm abw acg acm acu afr agr aht akr ale alg amh amk amr amu apc api apj ara aro arw arx atq ats awa awp aym ayo aze bab bae bam bca bem bgr bkd bkl bla blj blr blx bno bnq bnv bok bor bpb brc bre brs bsq btk bur but cab cac cai cak cam cap car cas cat cav cax cay cch cck cct ceb cec cha che chi chj chl cho chp chr chu chw cin cla clc cle cma cmh cmn cmy cnl cnt cof cog col cor cpa cre crg crk crl crn cro crp crq crt csf csh csk ctc ctl ctt ctw cub cui cur cut cuu cyn cze dak dam dca des dgx dig djp dre dsh dut efi eka emb ena eng ese eve eya fij fin for fox fre fut gad gae geo ger ghb gid git gjj gku gmb gna gno goa gre grk grm gto gua gul guu gyb hai hau heb hid hil hmb hmd hmi hmu hop hpd htc hui hum hun hve ifu igb ik ika ill ilo ind iql iri ita itw itz ixc ixi jak jeh jmo jpn juh kas kat kaz kdg kdz kea kek kew kfe kgt kgz kha khg khk kic kio kis kje kky klm klw klz kmh kmk knc knd kng knr koa kon kor kos kpn krc kro ktb kth ktu kul kun kuq kut kwa kwe kws kyn lao lau len lez lit lnw lui lus mab mal mao map maz mby mcg mch mcn mco mcs mcv men mer mgg mhc mhi mic mid mij mis miz mjc mkb mnc mnd mne moc mog moj mok mop mos mov mpy mrt mse msh mss mtg mti mtp mtt mui mum mup mut muy mwb mwl mxg mxu myi mym myo myr mzc nas nbd nbr nep ngn nht nhu nhx niu nju nko nkr nlu nne nnm nog nom nor npa nro nsk nsn nsz ntj nuk nun nuu nya nym oca oji oka oko olu ood ore osa osm owc pae pal pan pcm pem per pia pip pir pla pme pnn pno poh pol por pow ppc prt psj psm psv pui pul pur qan qaw qca qch qec rad ram rap res ret rgn rng rnn rom rus sal sam say sba scr sea sec sed sel shk shl shn sho shu shw sin sla slv smj smt snh sno sol son spa spo squ sri sss stl sum sus sva svk swa tac tag tar tbe tce teh tga tha tib tic tkm tlf tlp tml tna tnb tnj tnl toa tob toj tol tos tpa tpi tpt trb trc tsf tsg tsh tsi tsj tsw tty tub tuc tup tur tus tut tuy tvo twn txj tze tzo tzt udh uhi ukr ute uzb ved wap way wch wel wem wic wir wiy wmu wol wra wrd wth wwr xar xer xoo yah yak yap yar yav ycn yct yki ypk yrt yus yyo zai zaj zam zap zfl zqc zqr zqs zul zun zzo,521,76475,0.006812684
129A,Hand and Arm,,129,Cecil H. Brown. 2013. Hand and Arm. In: Dryer; Matthew S. & Haspelmath; Martin (eds.) 2013. The World Atlas of Language Structures Online. Leipzig: Max Planck Institute for Evolutionary Anthropology. (Available online at https://wals.info/chapter/129),1,ain amh amr apj apw aro arw arx awa aym ayn aze bam bgr bla blj blr bnq brc btk cab cah cak car cay cch cck ccp cha chj chl cho chr chw cin cmc cmy cof col cor crl csf csk ctt ctw cuu cyn cze dam dca die efi eka ena eud for fut gad geo git gku grm gul hau haw hop hui ifu igb ika ilo itw itz ixi jak jeh jmo jpn kat kaz kdz kea kfe kha khg khk khm kio kis kje kky klw kmh kmk knr kon kos kpn kro ktb kuq kwa kwe lau len lez lit lnw lui mab mao maz mby mer mgg mhi mid mij mnc moj mok mop mos mse msh mtp mum mup muy mwb mxg mxu mym nas nbd ngz nht niu nkr nnm nog nom npa nsz nym obg oka oko olu ood ore osm pac pae pal per poh prt pul pur qch qui rad ram rgn rng rnn rus sam say scr sed ser shn shu sin smj smt snh sno sol son squ stl sus svk swa tah tbe tce tga tib tkm tlp tml tna tnj toa toj tpi tsf tua tuc tvo tze tzo tzt udh ukr uzb ved wol xoo yak yap yar yav yct ygr ykp ylb zai zaj zam zfl zun zzo,228,76475,0.0029813664
