parameter_id,parameter_name,parameter_description,chapter_id,chapter_citation,value,same_value_language_ids,value_language_count,language_count_total,count_ratio
25A,Locus of Marking: Whole-language Typology,,25,Johanna Nichols; Balthasar Bickel. 2013. Locus of Marking: Whole-language Typology. In: Dryer; Matthew S. & Haspelmath; Martin (eds.) 2013. The World Atlas of Language Structures Online. Leipzig: Max Planck Institute for Evolutionary Anthropology. (Available online at https://wals.info/chapter/25),2,amb amp awt bej bma brh brm diy djp dyi eng fur ger grb grr ice ik jpn kay kch kew kha kho knd knm kor lez mao mei mnd mrt nah nbd nep ngi ntj pso pur qim rus shk tib tru tsh uhi,46,76475,0.00060150377
87A,Order of Adjective and Noun,,87,Matthew S. Dryer. 2013. Order of Adjective and Noun. In: Dryer; Matthew S. & Haspelmath; Martin (eds.) 2013. The World Atlas of Language Structures Online. Leipzig: Max Planck Institute for Evolutionary Anthropology. (Available online at https://wals.info/chapter/87),1,adn aga agc agd ain aja ala als amb amh ami amk ani ara arc arm arp arw ass ath ava awa awp aym aze bai bak bbu bco bel bho bhu bii bil bka bkt bla blr blt bnb bnj bod brh bsk bul bur but bya cah cak car cay cha chc chd che chh chk chn chv chx ckl cln cmn cmy cnt coo cpn cpy cub cyv cze des deu dgr dhi dhm dmi dmk dom drg drm dsh dut eip ene eng ess est eve evn fin for fri gal gam gbb gbs gdb gds geo ger gid gil git gnb god gok gon grk gud guj gur hau hay hei hhu hin hlu hmi ho hop htc hua hum hun hve hzb iaa ice idu ifu ijo ilo ing iwa jak jaq jeb jiv joh jpn kas kay kbt kem ket kew kgz kha khg khi khl kho khw kiw kkp kku klg klm klr kmh kmk kms knd knn kol kop kor koy krc kre krn krw kry krz kty kum kuv kwk kwo kws kxo kzy lac lak lat ldu lez lil lim lit lmn lnd ma maj map mau mcc mcd mco mdm mdo mer mgg mhi mil mme mnc mnd mne mns mnz moe mrc mrw msg msq mto mun mus mwb mxx myg mym mzn nah nca ndy nep nev new nez nga nis niv nog nor nsg nsn nti ntu nwd nyu nza obg ocu ood ord oss otm paa pal pan paw pba pip pkn pno pol pra prk psh ptt qaf qhu qim qui qum rem res ret rpa rus rut rwe san sar sav scr sec sel shb sho shp sid sin sir siu skp slo smp sna snh sno sod squ srb sta stl suk svs swe tam tce tee tel tep tgl tgr thk thn tho thu tig tin tiw tkm tls tml tni tob trw tsf tsh tsi tsz tts ttu tul tur tuv tvo twe txj uby udh udi udm ukr urd usr uyg uzb wak was wem wik wly wme wrw xar yah yaq yar ybi ycn ygr yko ykt yng yny yok ytu yuk yur yuw ywr zan zay zch zqc,373,76475,0.004877411
143A,Order of Negative Morpheme and Verb,,143,Matthew S. Dryer. 2013. Order of Negative Morpheme and Verb. In: Dryer; Matthew S. & Haspelmath; Martin (eds.) 2013. The World Atlas of Language Structures Online. Leipzig: Max Planck Institute for Evolutionary Anthropology. (Available online at https://wals.info/chapter/143),1,abi abn ace acg acm agc agd ain akh ala alb all als alw ams anj any apu arg arj aro asy ata awa aym baa bac bae bai baj bam bao baq bar bbw bch bco bdm bfg bho bil bkr blr bmz bni bnn bnu bra brf bri brp bsq btk bto bua bug bul bun buw bvi bwc cah cax cea cem cha chc chd che chk chq chx ckl cle cmn cmy cnt coc coo cos cpy cre crn crt cso cup cya dag dan dga dgb dgr dhw did din diy dja dji djm djn djp dmk dre dua dyi ebi ene eng eno est eud fij fin fon fut gaa gae gap gav gds gel geo ggu ghr gir gmw goa gok goo grb grf grj grk grr grs gud guj guu hak han haw hay heb hei hil hin hlu hmo hoa hop htc huc hun hup hve iaa iba idn ifu ign ik imo ind inn iqu iri ita jak jaq jlu jng joh juh kad kae kan kch kdz ket kfe khm khn khr khs kir kkt kla klm kls klv kms kmu kmw knb knc kni knn koi kom kop kor kos krb krj ksa kse ksn ktc kty kum kuo kut kwa kwb kwn kws kya kyq kzy lac lah lal lan lao lar lgu lic lis lui luo mae maj mak mal mam man mao mau maw mbi mcd mch mco mde mdl mdm mer mgg mgi mhu mie mir mkg mkj mkl mlk mme mmn mna mnd mni mnm mno mns mnt mny moe mog mok mon mos mov mpa mpo mrd mrh mri mrl mro mrq mrr mrt mru mrw msq mss mun mur mus mut mwb mxc mxj mxo mxp myi nab nah naj nak nal nar nav nax nbr nca ncm ndj ndo ndr ndy neh nev nez nga ngd ngi ngj ngk ngu ngw nha nhh nhm nht nia nif niu nkk nne nsg nti ntu nue nug nun nyi nyk nyn nyr nyu oir oji oks omi ono ood oss otm pai pal pan par pba pip pkn plg pnn pno pnu poh pol por ppi pul pun pur qim qui qum raw res rik rom rov rpa ruk rus rwa sam sap scr sed see ses shl shp shu sid sil sir sis skw slb slo sml sna sng snn sno so sob som son spa squ src srd sre ssa sta sti stl sud sue sun svs taf tag tah tak tam tau taw tbo tbx tce tee ten tep tes tgh tgk tgo tha tho thy tim tin tiw tke tkl tla tli tmm tmr tng tnn tno tny tol tou tpa tpn tri trr tsg tsn ttn ttu tuk tus tvl twe tzo tzu udh ukr uli una ung urd url uru usa vai vie wag wah wak wal wam war wed wel wem wic wik wlm wlw wmu wol wor wrb wrd wrg wrl wsk xam xar xbi xns yag yap yaq yei yi yid yin yiw ylm yng yok yor yuc yur yuw ywl ywr zai zar zqo zqs zzo,525,76475,0.0068649887
85A,Order of Adposition and Noun Phrase,,85,Matthew S. Dryer. 2013. Order of Adposition and Noun Phrase. In: Dryer; Matthew S. & Haspelmath; Martin (eds.) 2013. The World Atlas of Language Structures Online. Leipzig: Max Planck Institute for Evolutionary Anthropology. (Available online at https://wals.info/chapter/85),1,aar aba abk acg acn aco adg adi adk adn ady agm ain ajg akh ala aly amb amc ame amk amp amt ana ang ao api apl apt apu ara arc arm arw asu atk ava avo awe awp awt aym baa bac bae bam bao baw bbf bej bgs bho bil bin bkb ble bln blt blx boa boj bok bon brh bri brm brs bry bsk bsq bti bua bur bus but bya bzi cah cai cam car cas cav cbo cct cde chc che chg chi chk chn chp chs chv cln cmh cmn cmr cnl cnm coc coo cor cti ctm ctw cub cup dag dan daw dds der des dga dgb dgr dhm die dig dim dji dlm dmi dmk dms dni drg drm dul dun edo eip emb eme emm ene epe ese est eud eve evn ewe fas fin for fqs ful fur gaa gam gan gap gar gav geo ghb gim gjj gln gmw gnn gon grb grj grw gua guj gur gyc hai ham han hay hhu hid hin hix hlp hma ho hop hpd hua hum hun hup hzb iau idn idu ika imo ina ing inn iqu jbt jel jin jms jng joh jpn jug juh jva kaa kab kac kas kbo kbt kch kem ket kew kgy kgz kha khd khl kho khr khw kie kim kir kiw kje kkp kkq kku kll klm klq klr kma kmb kmh kmk kmn kmo kms kmw kmz knb knc knd kng knm knn knr knz koa kob kok kol kop kor kpo krc krh krj krk krn kry ksa kse kti kty kum kun kus kuv kwb kwo kws kwt kxo kyk kyn kyr kyz kzy lad lah lai lak lal lar lav ldu lep lez lgt lho lis lkt llm lmn lot lug lui lun mab mac mad mag maj man mar maw max mbo mcc mde mdl mdn mei mek mey mgg mgh mgi mhi mik mis miz mka mke mkg mkj mkl mku mme mnc mnm mno mns mnv moe mom mou mpr mpt mqf mrd mrh mri mru msg msn mtu mun muu myr mzn nab nad nag nam nar nas nat nav nbd nbr ndj nep nev new ngg ngk nis niv nkn nnd nnk noc nph nti ntj ntu nwd nyi nze oks omi orh ork oro orw ory osa oss owi pae pan pau paw pdp pis pit pmn pnx pra prh prk psh pso ptt ptw pum pun puq qaf qaw qhu qia qim ram raw rem res ret rik rum run rut ryu sar sav sba sdw sel sem ser shb she shh shi shk shy sid skk sko skw sla slb sle slp sme smn sna sng snh snm sno snt sor src srn sro sta stl sue sup sus svs syu tac tak tam tar tau tbl tbt tbu tbx tce tel tgl thd thn thu tir tja tkl tkm tlf tli tls tml tmo tnc tny ton tou tpn tps trb trm tru trw tsf tsm tsr tsz tte tts ttu tuc tul tun tur tuv tuy tvo tvt uby udh udm una ung urd urk urn usa ute vai wah wai wal wao was wat way wbn wir wme wna wor wra wrd wry wsk wtm xas xav xns yag yah yal yaq yar ycn yei yel ygr yi yim yiw yko ykt ylm yqy ytu yuc zag zar zaz zch zun,577,76475,0.007544949
46A,Indefinite Pronouns,,46,Martin Haspelmath. 2013. Indefinite Pronouns. In: Dryer; Matthew S. & Haspelmath; Martin (eds.) 2013. The World Atlas of Language Structures Online. Leipzig: Max Planck Institute for Evolutionary Anthropology. (Available online at https://wals.info/chapter/46),1,abm ace aco agt ain aly amu ana aso ass atc awp aze bao baw bdm blr bsk bsq bug bul bur but cah cch chk chn chv cmn cnl coo crk ctm diy dja dji djp djr dyi ene est eve evn ful gaa gag gar geo goa goo grg grk grw gum guu hay heb hmo htc hun hup hzb ice itz jak jam jaq jpn kay ket kgz khk khs kio kku kma kmh knc knd kng koa kod kop kor krc krk krl krm kry ksi kty kut kzy lak lat lez lil lit lkt lml mac mah mar mei mhi mic mlk mme mmo moe mra mrh mrt mrw mss mun myi mym nai nav ndj neg nez nga ngi ngk ngn nha nht niv nsg ntu nug nwd oss pae pkn pno pny pol ppi psh psm pur qhu qim rom rus scr shk sho shr siu ski skp sno squ stl tab taj tha tiw tja tkl tml ton tps tst tun tuv tvo txj udh udm ukr uku uzb vie wam wic wmu wrd wrn wry yaq yid yin yko ykt yng ypk yuw zun,194,76475,0.0025367767
73A,The Optative,,73,Nina Dobrushina; Johan van der Auwera; Valentin Goussev. 2013. The Optative. In: Dryer; Matthew S. & Haspelmath; Martin (eds.) 2013. The World Atlas of Language Structures Online. Leipzig: Max Planck Institute for Evolutionary Anthropology. (Available online at https://wals.info/chapter/73),2,aco aeg ain ala alu ame amr ana apl apu arm arp asm aso awk awp bag bam baw bem bir bkr bma brh brm brs bsk bsq bul bur cah cak car ceb cha chk chr chv cmn coo cre csh dbd dgr dio dni dre dsh eng epe est evn ewe fij fin fre fur gar gbk ger goo grb grk grw guj gum gwa hai ham hau heb her hin hix hmo hun iaa ice ido igb ijo ika imo ind iqu iri irq jak jpn juh kas kay kaz ker ket kew kfe khk khm kho kim kin kio kis kiw kji klv kmk kmp kmu knd knr koa kob kok kon kor kpe krb krk krn kro kry kse kte kty ktz kut kwa kyl lah lan lat lav lep lin lkt lnd loz luo luv mab mac mak mal mam man mao map may mdk mgo mku mme mnd mnm mok mon mop mro mrt mss mxc myi mym nan nav nbd ndy new nez nga ngi ngl nht niu niv nko nma nor nti ntu nug nun obo ond ong orh oss otm pai pal pan pau pip pit pms pnn ppi prh prs psm pta pur qim ram rap rav rus sdh see sel shk shl shn shr shu sla slo sml snm snn snt som spa squ sue sup sus swa swe tab tbu tel tgr tha thk tiw tmi tms tru tsp tuk tun tur tuv txj tzu udh udm una urd urk usa vie wam war wch wra wrd wrk yag yaq yid yim yko ykt yor yur zul,271,76475,0.0035436417
97A,Relationship between the Order of Object and Verb and the Order of Adjective and Noun,,97,Matthew S. Dryer. 2013. Relationship between the Order of Object and Verb and the Order of Adjective and Noun. In: Dryer; Matthew S. & Haspelmath; Martin (eds.) 2013. The World Atlas of Language Structures Online. Leipzig: Max Planck Institute for Evolutionary Anthropology. (Available online at https://wals.info/chapter/97),1,aga ain ala amb amh arc arw ass ath ava awa awp aym aze bel bho bhu bkt blt bnj bod bsk bur but bya cah car cay chc chd che chh chk chn chv cln cmn cpn cpy cub des deu dgr dhm dmi dmk drg drm eip ene eve evn for gal gam gds geo god gon guj gur hay hhu hin hmi ho hop hua hum hzb idu ijo jiv joh jpn kbt kem ket kew kha khg khl kho khw kiw kkp kku klg klr kmh kmk kms knd knn kol kop kor koy krc krn krw kry krz kty kum kuv kwo kxo lak lez lim lmn mer mgg mhi mil mme mnc mne mns mrc msg mto mun mym nep nev new nga nis niv nog nsn ntu nwd ord oss pan paw pba pno pra prk psh ptt qaf qhu qim rem res ret rpa rut sar sav sel shb sho sid sin skp sna snh sod srb sta stl suk svs tam tce tel tgl tgr thk thn thu tig tkm tls tml tni trw tsf tsh tsz ttu tul tur tuv tvo twe uby udh udi udm urd usr uyg uzb wak was wly wme yah yaq yar ybi ygr yko ykt ytu yuk yuw zay,216,76475,0.0028244525
144B,Position of negative words relative to beginning and end of clause and with respect to adjacency to verb,,144,Matthew S. Dryer. 2013. Position of Negative Morpheme With Respect to Subject; Object; and Verb. In: Dryer; Matthew S. & Haspelmath; Martin (eds.) 2013. The World Atlas of Language Structures Online. Leipzig: Max Planck Institute for Evolutionary Anthropology. (Available online at https://wals.info/chapter/144),3,acg aeg agc agd ain akh ala alb als ams anj ann any arg arj aro arp asy ata awa awp baa bae bai baq bar bch bco bfg bho bil bkr bmb bni bnn bra brf bsq bto bul bvi cah cea cem cha chc chj chq chr chx ckl cle cmy cnt cos cre crn cso ctl cya dag dga dgb did dji dmk dom doy dre dua dyi ebi eng est eve fij fin fon fut gae gap gds gel geo gmw gnb goa gok goo grf grk guj guu hak hau haw hay heb hei hil hin hlu hmo hoa hop htc huc hun hup iaa idn ifu ign ik ind iri ita izi jak juh kan kch kdz ket kfe khm khs kir kkt kls kmj kmw knc kni knn kom kor kos krb ksn kty kuo kut kwa kyq kzy lah lan lao lgu lic lis maa mae mak mal mam mau mcd mch mgg mgi mhu mkj mmn mna mnd mnm mns mok mon mov mpa mrl mro mrt mru msq mun mur mus mut mwb mwo mxc mxj mxo mxp myi nab naj nak nal nar nca ncm ndr ndy neh nga ngu nhh nhm nia nif niu nke nne nsg ntu nug nun nyi oji oks ond ood otm pai pal pan pip pkt plg plh pnn poh pol por pul qui qum rap raw rom rov ruk rus sam sap sed see shl shp shu sid sil sir sis slo sml sna sng so sob som spa squ srd sre ssa sti stl stn sun taf tag tah tak tam tau tbo tbt tee tgk tha tho thu thy tim tin tiw tke tli tmm tmr tng tpn tri trm tsg tsk ttn ttu tuk tus tvl tzo tzu udh ukr uli una ung urd url urt usa vie wag wak wal war wch wel wem wlf wol wrb wrd wrk wsk wya xar xbi yag yap yid yin yng yok yor yur zai zqc zqo zqs zzo,339,76475,0.004432821
144L,The Position of Negative Morphemes in SOV Languages,,144,Matthew S. Dryer. 2013. Position of Negative Morpheme With Respect to Subject; Object; and Verb. In: Dryer; Matthew S. & Haspelmath; Martin (eds.) 2013. The World Atlas of Language Structures Online. Leipzig: Max Planck Institute for Evolutionary Anthropology. (Available online at https://wals.info/chapter/144),22,dmk dyi goo knc,5,76475,0.000065380846
82A,Order of Subject and Verb,,82,Matthew S. Dryer. 2013. Order of Subject and Verb. In: Dryer; Matthew S. & Haspelmath; Martin (eds.) 2013. The World Atlas of Language Structures Online. Leipzig: Max Planck Institute for Evolutionary Anthropology. (Available online at https://wals.info/chapter/82),1,aab aar aba abi abk abn abo abu abv acg acl acm acn aco adg adi adn ady adz aeg aga agb agh agm agt ain aja ajg akh akn ala alb ale alk all aln aly ama amb ame amh aml amn amp amq amt amx ana anc ane ang ani ano anu ao aoj api apt apu apw arc arg ari arj arm aro arp arq arw asm ass ath atk atm au ava avk avo awa awi awp awt awy ayi aym ayo ayr ayw aze azi baa bab baf bag bai bak bam bao bar bas baw bbl bbw bdm bdu bdw bej bel ben ber bgm bgo bgr bgs bgz bho bhu bid bii bik bin bio bir biu bka bkb bkt bku ble blt blx blz bmb bnb bni bnj bnk bnn bnu boa bob bod bok bol bon boq bra brf bri brl brm brn brp brq bry bsh bsk bsq bsr bti bua bub bud bug bum bur bus but buu buy bvi bya bzi cah cai cam can car cas cay cct cde cga chb chc chd chg chh chi chk chn chp chr chs chv chw cic cln cme cmh cml cmn cmr cnl cnt coa coc cop cpn cpy crn cro cti ctm ctw cua cuc cui cup cze dag dam dan daw day ddj dds deg der des deu dga dgb dgo dgr dha dhb dhm die dig dim din dio diy dja dji djp djr dlm dma dmi dmk dms dni dok doy drg drm dsh dua duk dul dum dun dut dyi ebi edo ega egn eip eka eko emb eme emm ene eng eno epe erk err ese est eud eve evn ewe ewo fas fin foe fon for fqs fre fri fua fur fut fye ga gah gal gam gan gap gar gav gbb gbs gds geo ger ggu ghb ghr gim gla gln gmw gmz gnb god goe gog gok gon goo grb grg grw gua gug guh guj gul gur guu guw gwa gwo gyc hai hak hal ham han har hat hau hay heb heh hem hhu hid hin hlp hma hmi hmo hna hnd hol hop hpd hua huc hui hum hun hya hzb iat iau iba ice idn idu ifm igb ige igs iha ijo ika ila imo ina ind ing inn iqu irq irr irx isa isi ite ito iwa iwm izi jab jad jar jbt jin jiv jmo jms jng joh jpn jrw juh juk jva jwr kaa kab kac kad kae kan kar kas kau kay kba kbo kbu kbw kby kch kdw kel kem ken ker ket kew kfe kga kgu kgy kha khd khg khl khm khn kho khr khs khw kie kik kil kim kin kio kir kis kiw kkp kkq kku kkv kla klg kll klq klw kma kmb kmh kmk kmn kmo kmp kmr kms kmu kmw kmz knb knc knd kng kni knk knm knn kno knr knw knz koa kob koe kok kol kom kon kor kos koy kpw kqq krc krd kre krh krk krr krw kry krz ksa kse ksg ksm ksn kta ktc kte kti ktl kty kum kun kus kuu kuv kwa kwn kwo kwt kwy kwz kxo kya kyk kyl kyn kyp kyr kyz kzy laa lab lad lag lah lai lak lal lan lao lar lav lbu lda ldo ldu leb lec leg lel len lep les let lew lez lgi lgt lho lic lim lin lis lit lkt llm lmh lmn lmp lmu lnd lon lot lou luc lug lui luo luv ma mab mad mae mag man mar mas mau maw max may mba mbe mbi mbm mbo mbr mbt mby mcd mda mde mdg mdl mdn mdo mds mdw mea mee mei mek mem mer mey mga mgg mgh mgi mgk mgo mgq mgu mhi mhu mie mii mij mik mil mis miz mka mkd mke mkg mkh mki mkj mkl mkq mku mkz mla mlg mlk mlm mlu mmb mmv mnc mnd mne mng mni mnm mno mns mnv mny moe mof mog mom mon moo mor mos mot mou mpa mpt mpu mqf mrc mrd mrg mrh mri mro mrr mrs mrt mru mrw msc msg msl msm msn mss mtb mto mts mtu mua mui mum mun mup mur mus muu mwe mwo mxe myg myi mym myn myr nab nad nag nah naj nak nal nam nar nas nat nav nbd nbe nbm nbr ncm ndb ndi ndj ndo ndt ndu ndy neh nep nev new ney nga ngd ngi ngj ngk ngm ngn ngo ngt ngu ngw ngz nhn nis niv nkb nke nkn nko nku nma nmb nmd nmm nnd nng nnk noc nog non noo nor nph nse nsn nti ntj nto ntu nua nue nun nup nus nwd nya nyi nyk nza nze obg obo ocu oir oks olo omh omi one ong ora ord orh ori ork oro orw ory osa oss otr owi oya paa pae pal pam pan par pat paw pba pdp per pia pir pis pit pkn plg plh plk pme pmn pms png pno pnu pny pog poh pok por pra pre prh prk prs psh pso psw ptt ptw pul pum pun pur qaf qaw qhu qim rag ral ram rao ras raw rem res ret rga rgc ria rik rim rmb rnd rny rom ron rot rpa rru rsu rum run rus rut rwa ryu sah sak san sap sar sav scr sdw sea sed sem ser ses sgb sgl sgu sha shb she shh shi shk shl shm shn sho sht sia sid sil sin sio sir sis skk skm sko skp skr sku skw sla slb sle slo sme smn sna sng snh snm snn sno snt sob sod som son spi srb src srd sre srn sro ssa sta sti stl stn sud sue suk sul sun sup sus svs swa swe syu tab tac taf taj tak tal tam tan tao tar tau taw tba tbl tbt tbu tbw tce tdi tdr tel teo ter tet tgk tgl tgn tgr tha thk thn thu thy tia tib tid tig tik tis tiv tiw tja tki tkl tkm tlf tli tlo tma tmc tmg tml tmm tmn tmo tmr tnb tnc tne tni tnk tnn tny tod ton tou toz tpr tpt trb trm trr tru trw tsf tsh tsz ttd tte ttn ttu tuc tul tum tun tur tuv tuy tvo tvt twe twn txj tye uby udh udi udm uhi ukr uld uli una ung ura urd urk url urt uru usa usr uyg uzb vai ven vie vnm wag wah wak wal wan wao wap was wau way wbn wch wed wiy wlf wlw wly wma wme wmu wn wna woi wol wom wra wrk wrm wrn wry wsk wtm wwa xam xar xas xav xbi xer xho xns xoo yah yal yam yaq yar yay ybi ycn yei yel ygr yi yid yim yin yko ykt ylm yng yor yqy ytu yuc yuk yul yur yus yuw zag zan zar zay zaz zch zhn zim zpr zul zun,1192,76475,0.015586793
74A,Situational Possibility,,74,Johan van der Auwera; Andreas Ammann. 2013. Situational Possibility. In: Dryer; Matthew S. & Haspelmath; Martin (eds.) 2013. The World Atlas of Language Structures Online. Leipzig: Max Planck Institute for Evolutionary Anthropology. (Available online at https://wals.info/chapter/74),2,abk ace aeg ain akn alb amh amr apu arg arm aym bab bag bal bam baw bej bma brs cle cnt cre ctl cyv dre dsh dut eng ewe far fij fin fre fue geo ger grk hau haw heb hin hmo hzb ice igb ing iri irq ita kam kas ker ket kfe kha khm kho khs kmu knd knm knr kol kon krb kro kse kty kui lak lan lat lep lez lin lit lkt mak mal mao map may mcd mde mdg meh mhi mie mku mlt mna mnd mns mok mrl mun mxc mym ndy ngi niv nko ntu ond orh otm pan pau pba pol por prs psm qim rap rka rom rus san scr sel shk slo sml snm sno som spa sue sup swe tab tbu tel tgr tha tja tor tru tuk tun tuv tvl tvo udh vie vot wch wel wic wlf yaq yko yor zqc zya,158,76475,0.0020660346
33A,Coding of Nominal Plurality,,33,Matthew S. Dryer. 2013. Coding of Nominal Plurality. In: Dryer; Matthew S. & Haspelmath; Martin (eds.) 2013. The World Atlas of Language Structures Online. Leipzig: Max Planck Institute for Evolutionary Anthropology. (Available online at https://wals.info/chapter/33),7,abv agc agd alk aml ana anc aoj api apl apt aro avk bai baw bgr bil bkl bnn brm bto bvi bwc cbo ccm cem cha cle cmr cnm coe dan day djp dre drm dul err ese fon fut gbb gel giz gln goe gok gua gul gur hal haw hix hoa iaa ika jak jmo jng kan kch khm khs kim kkt kre krr ksg kuo kwa kwo kyk lai len lep lew lkt lmu lnd lon lou mae mao map mau mbm mco mda mik mis miz mka mmn mof mon mru mum mup mus mwb mwo mxc mxo mxp mxy nak nal ndy nif nis niu nun nze osa pms psw qum rag rap raw saa sam sea sed shb shi sis skk sle snm sro sti tac tag tah tak tam tbo teo tgk tgn tin tla tmo tng tnk tno tru tsg ttd ttn tvl tzu uld ura urt vai vie vnm war wlo wme xar xbi yap yel yor yuc zai,170,76475,0.0022229487
96A,Relationship between the Order of Object and Verb and the Order of Relative Clause and Noun,,96,Matthew S. Dryer. 2013. Relationship between the Order of Object and Verb and the Order of Relative Clause and Noun. In: Dryer; Matthew S. & Haspelmath; Martin (eds.) 2013. The World Atlas of Language Structures Online. Leipzig: Max Planck Institute for Evolutionary Anthropology. (Available online at https://wals.info/chapter/96),5,ace aco adn ajg all alw amt ani any ao apu ara arm avo awe azi bac bam baw bfi bil bla blr bnb brh bya cai cam cav cct chg chi chk cld cmh cmr cnl cnm coo dam ddj dds dgo dhr die din diy djm djn djr dlm drm dut efi emm epe fri gah ger ggu gid gim git gmw gnn god grg grj gum gwa hai har hin hun hup hwr ido ika imo ina jam jeb jms kas kay kew khr kio kis kkq kkw klg klm kmb kmw kmz knd koa kob krk krn krw kut kws kya kyo lai lal lav lda ldu lec les lgt lkt lml lug lui mac mad mak mar mco mek men mgq min mka moa moh mou mpa mpt mra mrt mrw msn mss mtt mud mxx mzh nam nav ney nez ngi ngk ngl nha nhn nrg nti nue nug ond osa oya pan pau pit pnx pny pok ppi res ret rgc rit ruk ser skw sla snc snm squ stl sup tau tdr tic tik tis tja tou tru tsh tuk tus twe twn udh urd vai wan wao wap wbn wik win wiy wrd wrg wrl wrw xas yid ypk yur yuw ywr zar,213,76475,0.002785224
90A,Order of Relative Clause and Noun,,90,Matthew S. Dryer. 2013. Order of Relative Clause and Noun. In: Dryer; Matthew S. & Haspelmath; Martin (eds.) 2013. The World Atlas of Language Structures Online. Leipzig: Max Planck Institute for Evolutionary Anthropology. (Available online at https://wals.info/chapter/90),7,amt ao ara arm azi baw bil bla bya chg chk cnl dlm drm gah gim gmw god har hun imo jms kas kew khr klg kmz knd koa kob krn krw lai lal ldu mac mak mar mpa nam ngi nhn pan pit res ruk skw sla snm squ stl tau tdr tis tsh tuk twe udh wao wbn wrg xas yur,64,76475,0.0008368748
83A,Order of Object and Verb,,83,Matthew S. Dryer. 2013. Order of Object and Verb. In: Dryer; Matthew S. & Haspelmath; Martin (eds.) 2013. The World Atlas of Language Structures Online. Leipzig: Max Planck Institute for Evolutionary Anthropology. (Available online at https://wals.info/chapter/83),1,aar aba abk abn abo abv acn acu adg ady aga agm agt ain akh ala ale aly amb amc ame amh amn amp amt amx ana ang ano ao api apl apt apw arc arw asm ass asu ath atk atm ava awa awi awp awt awy aym aze azi baa bam bao baw bbw bdm bdw bej bel ben bgm bgn bho bhu bin bio biu bkb bkt bln blt blx bnj bnu boa bod boj bok bon boq bri brl brm brp brs bry bsk bsq bsr bti bua bun bur bus but bya bzi cah can car cas cay cbo cct cde chb chc chd che chg chh chi chk chn chp chs chv cln cml cmn cmr cnl coa cpn cpy cro cti ctm ctw cub cui cup dag dan daw dds der des deu dgr dha dhb dhm die dig dim diy dja dji djp dlm dmi dmk dms dni drg drm dul dum dun dyi edo eip eka emb eme ene epe ese eud eve evn fas foe for fqs ful fur gah gal gam gan gap gar gav gds geo ghb ghr gim gln gmw god gog gon goo grw gug guh guj gur guu gyc hai ham han har hay hhu hid hin hix hlp hma hmi ho hop hpd hua hui hum hzb iat iau idn idu iha ijo ika imo inn irq irx isa isi ite iwm jad jbt jin jiv jms jng joh jpn jrw jug jva jwr kaa kab kac kae kbo kbt kbu kem ket kew kgu kgy kha khd khg khl kho khr khw kie kim kio kiw kkp kkq kku klg kll klq klr klw kma kmb kmh kmk kmn kmo kmp kmr kms kmz knb knc knd kng knm knn kno knr knw knz koa kob kok kol kop kor koy kqq krc krd krh krn krr krw kry krz ksa kse kta kti kty kum kun kus kuu kuv kwb kwo kwt kwz kxo kya kyk kyn kyp kyr kyz lad laf lah lai lak lal lar lav lep lez lho lim lis lkt lmn lot lun mab mac mag man mar maw max mbo mde mdl mdn mei mek mem mer mey mgg mgh mgi mhi mii mij mik mil mis miz mka mke mkg mkh mki mkj mkl mku mlk mme mnc mne mni mnm mno mns mnv mny mog mom mot mpa mpt mqf mrc mrd mrh mri mrr mrs mru msc msg msl msn mto mts mtu mui mun muu myi mym myr nab nad nag naj nam nar nas nat nav nbd nbr ndj nep nev new nga ngg ngi ngj ngn ngt nis niv nkb nku nma nmb nmd nmm nnd nnk noc nog nph nsn ntj ntu nus nwd nya nyi nyk nze oir oks omh omi ong ord orh ori ork oro orw ory osa oss owi oya pae pan par paw pba pdp pia pir pis pit pme pmn pno pra prh prk prs psh pso ptt ptw pun qaf qaw qhu qim ral ram rao ras raw rem res ret rgc ria rik rmb rpa rum run rut rwa ryu sar sav sdw sel sem ser shb she shh shi shk sho sia sid sil sin skk sko skp skr skw sla slb slg sme smn sna sng snh snm snn snt sod som spi srb src srn sro sta stl sue suk sup sus svs syu tac taj tak tam tao tar tau taw tba tbl tbt tbu tce tdi tdr tel tgl tgr thk thn thu thy tib tig tir tis tja tkl tkm tlf tli tlo tls tma tmc tmg tml tmo tnb tnc tni tnn tny tod ton tou tpt trb trr trw tsf tsh tsz tte ttu tuc tul tun tur tuv tuy tvl tvo tvt twe tye uby udh udi udm uhi una ung urd urk urn uru usa usr ute uyg uzb vaf vai wag wah wai wak wao wap was wau way wbn wed wic wlw wly wme wmu wn wna woi wom wra wsk wtm xas xer xns yah yal yam yaq yar ybi yei yel ygr yi yid yim yko ykt ylm yqy ytu yuc yuk yus yuw zag zay zaz zim zun,712,76475,0.0093102325
