parameter_id,parameter_name,parameter_description,chapter_id,chapter_citation,value,same_value_language_ids,value_language_count,language_count_total,count_ratio
24A,Locus of Marking in Possessive Noun Phrases,,24,Johanna Nichols; Balthasar Bickel. 2013. Locus of Marking in Possessive Noun Phrases. In: Dryer; Matthew S. & Haspelmath; Martin (eds.) 2013. The World Atlas of Language Structures Online. Leipzig: Max Planck Institute for Evolutionary Anthropology. (Available online at https://wals.info/chapter/24),2,ala amb ame amp arp awp awt bbw bej bma brh brm bsq bzi cnl diy djp dyi eng ewe fre fur geo ger goo grb grr hau heb hin hmo ice ik ika ing jel jpn kay kch kew kha kho kim kis kmb knd knm knp knr kor kro lez lug luv mao may mei mlk mnd mot mrt mun nah nbd nep ngi ntj ntu nug nyn ori pso pur qim rap rus san shk siu snm spa sue swa tau tha tib ton tru tsh tuk uhi ung win wrl wry yim zul,98,76475,0.0012814646
95A,Relationship between the Order of Object and Verb and the Order of Adposition and Noun Phrase,,95,Matthew S. Dryer. 2013. Relationship between the Order of Object and Verb and the Order of Adposition and Noun Phrase. In: Dryer; Matthew S. & Haspelmath; Martin (eds.) 2013. The World Atlas of Language Structures Online. Leipzig: Max Planck Institute for Evolutionary Anthropology. (Available online at https://wals.info/chapter/95),1,aar aba abk acn adg ady agm ain akh ala aly amb amc ame amp amt ana ang ao api apl apt arc arw asu atk ava awp awt aym baa bam bao baw bej bho bin bkb bln blt blx boa boj bok bon bri brm brs bry bsk bsq bti bua bur bus but bya bzi cah car cas cbo cct cde chc che chg chi chk chn chp chs chv cln cmn cmr cnl cti ctm ctw cub cup dag dan daw dds der des dgr dhm die dig dim dji dlm dmi dmk dms dni drg drm dul dun edo eip emb eme ene epe ese eud eve evn fas for fqs ful fur gam gan gap gar gav geo ghb gim gln gmw gon grw guj gur gyc hai ham han hay hhu hid hin hix hlp hma ho hop hpd hua hum hzb iau idn idu ika imo inn jbt jin jms jng joh jpn jug jva kaa kab kac kbo kbt kem ket kew kgy kha khd khl kho khr khw kie kim kiw kkp kkq kku kll klq klr kma kmb kmh kmk kmn kmo kms kmz knb knc knd kng knm knn knr knz koa kob kok kol kop kor krc krh krn kry ksa kse kti kty kum kun kus kuv kwb kwo kwt kxo kyk kyn kyr kyz lad lah lai lak lal lar lav lep lez lho lis lkt lmn lot lun mab mac mag man mar maw max mbo mde mdl mdn mei mek mey mgg mgh mgi mhi mik mis miz mka mke mkg mkj mkl mku mme mnc mnm mno mns mnv mom mpt mqf mrd mrh mri mru msg msn mtu mun muu myr nab nad nag nam nar nas nat nav nbd nbr ndj nep nev new ngg nis niv nnd nnk noc nph ntj ntu nwd nyi nze oks omi orh ork oro orw ory osa oss owi pae pan paw pdp pis pit pmn pra prh prk psh pso ptt ptw pun qaf qaw qhu qim ram raw rem res ret rik rum run rut ryu sar sav sdw sel sem ser shb she shh shi shk sid skk sko skw sla slb sme smn sna sng snh snm snt src srn sro sta stl sue sup sus svs syu tac tak tam tar tau tbl tbt tbu tce tel tgl thn thu tir tja tkl tkm tlf tli tls tml tmo tnc tny ton tou trb trw tsf tsz tte ttu tuc tul tun tur tuv tuy tvo tvt uby udh udm una ung urd urk urn usa ute vai wah wai wao was way wbn wme wna wra wsk wtm xas xns yah yal yaq yar yei yel ygr yi yim yko ykt ylm yqy ytu yuc zag zaz zun,472,76475,0.0061719515
76A,Overlap between Situational and Epistemic Modal Marking,,76,Johan van der Auwera; Andreas Ammann. 2013. Overlap between Situational and Epistemic Modal Marking. In: Dryer; Matthew S. & Haspelmath; Martin (eds.) 2013. The World Atlas of Language Structures Online. Leipzig: Max Planck Institute for Evolutionary Anthropology. (Available online at https://wals.info/chapter/76),3,aco akn ame amh ana asm aym bab bkr brh brs chk cre cyv dag die dre eka eve fij gar ham hzb imo ind ker ket kha kho khs klv kmu knr kob kty kut lad lav lep lez lkt mal mao mdg meh mei mhi mie mku mna mns mok mrd mun mxc myi ndy nez nht niv nko nma nug otm pai pan pau pba pit psm pso qim sel shk sla sml smt snm sno som squ sup tab tgr tli tor tru tuk tvl una ung usa uzb vot wam wch wra yaq yko ypk yuc yur zqc zya,105,76475,0.0013729978
68A,The Perfect,,68,Östen Dahl; Viveka Velupillai. 2013. The Perfect. In: Dryer; Matthew S. & Haspelmath; Martin (eds.) 2013. The World Atlas of Language Structures Online. Leipzig: Max Planck Institute for Evolutionary Anthropology. (Available online at https://wals.info/chapter/68),3,abk akn aly amh arm asm awn aze bar bej ben blc bng brh bsq bul bur but cnt coc cpl cpn eve fin grb grf hin imo jiv kew kha kho kik knd knr krk kro kui lah lai lat lda lez luv man mao mne mrg mtg mtu mwe nak nbr ood orh pai pan plg ram rap raw ruk ses sla sup swa tah tem tgr tml toj tuc udm uyg vie wlf ygr zqc zul,80,76475,0.0010460935
26A,Prefixing vs. Suffixing in Inflectional Morphology,,26,Matthew S. Dryer. 2013. Prefixing vs. Suffixing in Inflectional Morphology. In: Dryer; Matthew S. & Haspelmath; Martin (eds.) 2013. The World Atlas of Language Structures Online. Leipzig: Max Planck Institute for Evolutionary Anthropology. (Available online at https://wals.info/chapter/26),2,aar abi abn acu adn agc agt ala alb ale alw aly amc ame amn amp ams ana ang apt arc arm arw asm ass ath ava awa awe awp aym aze azi baa bam bco bho bii bio bkb bkr bln blr blt bmb bmr bnj bnr bnu bod brh bri brm brn brs bsk bul bun but bya cas cax cay cbo chc chv cmh cmn cmy coc cos cpy crn crp ctm cub dag dds des deu dgr dhr dhw did dig dim diy dja dji djm djn djp djr dlm dmk dms dni dom doy dsh dut dyi eip emb ene eng epe est eve evn fas fin for fre gah gal gar gbb ger ggu gim gln gon grb grk grr grw gud gug guu hai hal hay hin hmi ho hop hpd hum hun hzb ice ik ind ing inn irq irx ita ite jaq jeb jiv jms jpn kac kar kay kbu kem ken ker kew kgz kha khg khi khl kho kkp kku klm kmb kmk kmn kmo kms knc knd kni knk knn knr kob kok kol kop kor koy krc krj krn krw kta kty kuv kwo kws kwt kwz kya kyk laa lac lad lel lez lho lim lit lmg lmn lui mac maj map mbr mby mde mdm mee mgg mgu mhi mik mis miy mkh mlg mme mnc mnd mne mno mns mny moe mog moo mot mpt mrt mrw msg msl mss mts mtu mun mut nab nag naj nar nas nbd nca ndt nep new nga ngi ngj ngt ngw ngz nha nis nmb noc nog noo nor nsn ntu nue nyi omi orh ork oss oya paa pae pan paw pdp pkn plk pme pno pol por ppi prh prk psh pso ptw pum pur qaw qhu qim rem rit rom rum rus rwe sav scr sdw shi shk sho sia sid sin siu skp slo slp sna sno snt som spa squ srd sro sta stl sue suk svs swe syu tac tam tbu tel ter tgl thn tml tmo tny trb trm trr tru tsh ttu tuc tun tur tuv tvo twe udi udm uhi ukr una urd urn ute uyg uzb wah wak wam wao wap wat wau wbn wel wem wik win wiy wly wmu wrb wrg wrl wsk yag yal yaq yar yid yin yko ykt yng yok ypk ytu yuk yuw ywl zay,406,76475,0.0053089247
143G,Minor morphological means of signaling negation,,143,Matthew S. Dryer. 2013. Order of Negative Morpheme and Verb. In: Dryer; Matthew S. & Haspelmath; Martin (eds.) 2013. The World Atlas of Language Structures Online. Leipzig: Max Planck Institute for Evolutionary Anthropology. (Available online at https://wals.info/chapter/143),4,aab aar aba abi abk abn abu abv ace acg acl acm aco acu adg adi adz aeg agb agc agd agh agm ain aja ajg akh akn ala alb alk all aln als alw aly amb amc ame amh aml amn amo amp amq amr ams amt amx ana anc ane ang ani anj ann anu any ao aoj apl apt apu apw ara arc arg arj arm aro arp arq arw asm ass asu asy ata ath au ava awa awe awp awt aym aze azi baa bab bac bae baf bag bai baj bak bam bao baq bar bas baw bbf bbl bbu bbw bch bco bdm bej bel ben ber bfg bgn bgo bgr bho bia bid big bii bik bil bio bir biu bka bkr bku bla bln blr blt blx blz bmb bmz bni bnn bnu boa bob bod boi boj bok bol bra bre brf brh bri brl brm brn brp brr brs bsh bsk bsq bti btk bto bua bud bug bul bum bun bur bus but buw buy bvi bwc bya bzi cah cai cak cam can car cas cax cay cba cbo ccm cct cde cea cem cga cha chb chc chd che chg chh chi chj chk chn chp chq chr chs chv chw chx cic ckl cle cln cmh cml cmn cmr cmy cnl cnm cnt coa coc coo cop cos cpl cpn cpy cqt cre crn crp crt cso cti ctl ctm cub cui cup cya cyv cze dag dan dds des deu dga dgb dgo dgr dha dhi dhm dhw did die dig dim din dio diy dja dji djm djn djp dma dmi dmk dms dni dom dre drm dsh dua duk dul dum dun dut dyi ebi efi ega eip eka eko emb eme ene eng eno eny epe erk err ese est eud eve evn ewe fij fin fon fre fua ful fur fut fye ga gaa gae gah gal gap gar gav gbb gbs gds gel geo ger ggu ghr gim gir giz gjj gku gla gln gmw gmz gnb goa god goe gok gon goo grb grf grj grk grr grs grw gua gud gug guh guj gul gur guu gwa gwo gyc hai hak hal ham han har hat hau haw hay hdi heb heh hei hid hil hin hix hlp hlu hma hmi hmo hna hnd hoa hol hop hpd htc hua huc hui hum hun hup hve hya hzb iaa iau iba ice idn ido idu ifm ifu ige ign igs ijo ik ika ila imo ina ind ing inn iqu iri irq irr irx isa ita ite iwm izi jab jak jaq jar jeb jiv jlu jmo jms jng joh jpn juh juk kaa kab kac kad kae kan kar kas kau kay kba kbl kbo kbw kby kch kdw kdz kel kem ken ker ket kew kfe kga kgr kgy kha khd khg khl khm khn kho khr khs kie kik kil kim kin kio kir kiw kkp kkt kkv kla klg kll klm kls klv klw kma kmb kmh kmi kmj kmk kmn kmo kmp kmr kms kmu kmw kmz knb knc knd kng kni knk knm knn knr knw knz koa kob koe koi kok kol kom kon kop kor kos koy kpw krb krc krd kre krh kri krj krk krn kro krr krw kry ksa kse ksg ksn kta ktc kti ktl kty kum kun kuo kus kut kuv kwa kwb kwn kwo kws kwt kwy kwz kxo kya kyl kyp kyq kyr kyz kzy laa lab lac lad lag lah lai lal lan lao lar lat lav lbu lda ldo ldu leb lec leg lel len lep les let lew lez lgi lgt lgu lho lic lim lin lis lit lkt llm lmg lmh lmn lmp lmu lnd lng lon lot lou luc lug lui luo luv ma maa mab mac mad mae mag maj mak mal mam man mao map mar mas mau maw may mba mbe mbi mbl mbm mbr mbt mby mcd mch mco mcv mda mde mdg mdl mdm mdn mdo mdw mea mee meh mei mek men mer mga mgg mgi mgk mgu mhi mhl mhu mie mig mii mik min mir mis miy miz mka mkd mke mkg mkh mki mkj mkl mku mkz mlg mlk mlu mmb mme mmn mmv mmw mna mnc mnd mne mni mnm mno mns mnt mny moe mog moh mok mom mon moo mor mos mot mou mov mpa mpo mpt mpu mra mrd mrg mrh mri mrl mro mrq mrr mrs mrt mru mrw msc msg msk msl msm msn msq mss mtb mts mtu mua mug mui mum mun mup mur mus mut mwb mwe mwo mxc mxe mxj mxo mxp mxx myg myi mym mzc nab nad nag nah naj nak nal nam nan nar nas nav nax nbd nbm nbr nca ncm ndb nde ndj ndo ndr ndt ndu ndy neh nep nev new nez nga ngd ngi ngj ngk ngl ngm ngn ngo ngt ngu ngw ngz nha nhh nhm nht nia nif nis niu niv nke nkk nkn nko nku nma nmb nmm nne nnk noc non noo nor nph nrg nse nsg nsn nti ntj nto ntu nua nue nug nun nup nyh nyi nyk nym nyn nyr nyu nza nze obg obo ocu oir oji oks olo omh omi ond one ong ono ood ori ork oro orw osa oss otm otr oya paa pae pai pal pan par pat pau paw pba pec per pga pia pip pis pit pkn pkt plg plh pme pms png pnn pno pnu pod pog poh pol por ppi pra pre prh prk prs psh psj psm pso psw ptt ptw pul pum pun pur pwn qaw qhu qia qim qui qum rag ram rao rap ras raw rem res ret rgc rik rim rit rnd rny rom ron rot rov rpa rru rsu ruk rum run rus rwa rwe sah sak sal sam san sap sar saw sba scr sdw sed see sel sem ser ses sgb sgl sgu shb she shh shi shk shl shm shn shp sht shu shy sia sid sil sin sio sir sis siu skk skm skw sla slb slo sme sml smn sna sng snm snn sno snt so sob sod som son sor spa squ srb src srd sre sro ssa sta sti stl stn sub sud sue sug sul sun sup svs swa swe swt syu tab tac taf tag tah taj tak tal tam tan tao tar tas tau taw tba tbo tbt tbu tbw tbx tce tdr tee tel ten teo tep ter tes tet tgh tgk tgl tgo tgr tha thn tho thu thy tib tid tig tim tin tir tis tiv tiw tja tke tki tkl tla tli tlo tlp tma tml tmm tmn tmo tmr tna tnc tne tng tnn tno tny tob tod tol ton tou toz tpa tpn tpr tpt trb tri trm trr tru tsf tsg tsh tsi tsn tsz tte ttn tts ttu tuc tuk tul tun tur tus tuv tuy tvl twe twn tye tzo tzu uby udh udi udm ukr uld uli una ung urd urk url urn urt uru usa usr ute uyg uzb vai ven vie vnm wag wah wai wak wal wam wao wap war was wat wau way wbn wch wec wed wel wem wic wik win wiy wlf wlm wlw wly wma wme wmu wna woi wol wom wor wra wrb wrd wrg wrk wrl wrm wrn wsk wtm wya xam xar xav xbi xho xns yag yam yao yap yaq yar ybi yei ygr yi yid yim yin yiw yko ykt ylm yng yok yor ypk yqy yrm yrr ytu yuc yuk yul yur yuw ywl ywr zag zai zan zap zar zay zaz zch zpr zqc zqo zqs zul zun zzo,1315,76475,0.017195161
89A,Order of Numeral and Noun,,89,Matthew S. Dryer. 2013. Order of Numeral and Noun. In: Dryer; Matthew S. & Haspelmath; Martin (eds.) 2013. The World Atlas of Language Structures Online. Leipzig: Max Planck Institute for Evolutionary Anthropology. (Available online at https://wals.info/chapter/89),1,ace aga agc agd ain ala alb als amh ami amk amr ams ani apu ara arc arg arm aro arp arq arw ata ath ava awa awp aym ayo aze bae baq bch bel bfg bho bii bil bkr bkt bla bln bma bre brf brs bsk bsq btk bul bur but bwc bya cak cam car cav cay ccm cde cha chc chd che chh chj chk chn chp chq chr chv ckl cld cle cln cmh cml cmn cmy cnt coc coo cop cor cpl cpn cpy crn crp cso ctl cub cuc cup cya cyv cze dam daw der dgr dhi dhm dom don dre drg drm dsh dut eme eng est eve fij fin fre gae gam gds gel geo ger gjj gku gla gnb goa god gok gon goo grf grk gua guj hak hal haw heb hil hin hix hlu hmi hmo hoa hop hpd htc hua hun hup hwr hzb iaa iba ice ifu ijo ind ing iqu iri ita ite iwa jak jaq jiv joh jpn kan kas kay kbt kdz ket kgu kgz kha khg khl kho khr khs kio kiw kkp kkt kku klm klr klv kma kmh knb knd knn kno kol kop kor koy kpm krb krc krd kre kri krk krn krz ktu kty kum kuo kut kuv kwa kwo kxo kya kyz kzy lac lat ldu lec lez lgu lic lim lit lmn lmp lui mac mag mam map mau mco mcv mds men mer mgg mhi mie min mis mmn mna mnd mng mns moh mpr mrc mrq mrt msq mss mto mun mus mxc mxj mxo mxp mxx mxy mym naj nas nav nca ndy neh nep nev nez ngw nhh nhm nhn nht niu nne nor nsg nti ntu nun nyu obg ocu oji ood ord ork oss otm pae pal pam pan pba pip pir pkn plk pmn pnn pno pnu pny pol ppc pra prs psh pso ptt pul pur pwn qaf qhu qim qui qum rap rem res ret rom rov rpa rsu ruk rus rut rwe saa sal sar scr sec sed see shb shi shk shp sid sin sir sis siu skp slo sml smp sna som son spa squ src srd sre sta stl sun svs swe taf tag taj tar tat tbo tee tel teo tep tgh tgk tgr thn tho thu tic tim tin tiw tkm tla tli tlp tls tml tni tnk tob tpn tpt tri tru trw tsf tsh tsi tsk tsz ttu tuc tul tur tuy tvl tvo twe tzu uby udi udm ukr uli urd urk urn usr ute uzb vaf vie wak was wch wel wic wlf wlo wly wme wol wrd wrk wrw xar yag yap yaq yay yei yin yko yng yny yok ytu yur zai zap zay zaz zch zen zhn zun zya zzo,479,76475,0.0062634847
90E,Correlative relative clauses,,90,Matthew S. Dryer. 2013. Order of Relative Clause and Noun. In: Dryer; Matthew S. & Haspelmath; Martin (eds.) 2013. The World Atlas of Language Structures Online. Leipzig: Max Planck Institute for Evolutionary Anthropology. (Available online at https://wals.info/chapter/90),3,kas,2,76475,0.000026152338
23A,Locus of Marking in the Clause,,23,Johanna Nichols; Balthasar Bickel. 2013. Locus of Marking in the Clause. In: Dryer; Matthew S. & Haspelmath; Martin (eds.) 2013. The World Atlas of Language Structures Online. Leipzig: Max Planck Institute for Evolutionary Anthropology. (Available online at https://wals.info/chapter/23),2,amb amp awt bej bma brh brm cha diy diz djp dyi eng epe eve fin fur ger gmz grb grr heb hun ice ik jpn kay kch kew kha kho kkr knd knm kor kri lez mal mao mei mnd mrt nah nar nbd nep ngi ntj pso pur qim rus shk sml tib tru tsh tur uhi wra xok yko,63,76475,0.00082379865
88A,Order of Demonstrative and Noun,,88,Matthew S. Dryer. 2013. Order of Demonstrative and Noun. In: Dryer; Matthew S. & Haspelmath; Martin (eds.) 2013. The World Atlas of Language Structures Online. Leipzig: Max Planck Institute for Evolutionary Anthropology. (Available online at https://wals.info/chapter/88),1,abi abk abv aco adk ain ala alb als alw amb amc amh ami amk amn amr ams ana ani ann anu apt apu apw ara arc arm arp arw asm ass ath atk ats ava awa awp awt aym bae baq bar bdm bfg bho bii bil bkt bku bla blg blr blt bnb bnj bnn bnr bod brh brl brm brs bsk bub bul bur but bya cak car cas cay cde cea cha chc chd che chg chk chn chp chs chv ckl cld cln cml cmn cnm cnt coc coo cor cpn cpy cre crp cti ctl cup cyv cze daw des dgr dhi dhm diy djm djn djp djr dlm dmi dms dom drm dsh dua duk dul dut dyi emb eme eng epe est eud eve fin for fre fri fur ga gaa gam gar gav geo ger gid gjj gnb god gon goo grg grj grk grr gto gua guj gur guu gyc hai hak haw hay hei hhu hil hin hlu hmi hop hpd htc hua hun hup hve hwr hzb ice idn idu ifu ijo ilo ing iqu ita ite ito iwa jaq jbt jeb jng joh jpn jva kaa kab kac kae kas kay kbt kem ket kew kgy kha khg khl kho khr khs kin kio kiw kkp kkt kku kkw klm klr kls kma kmh kmn kms knd knn kno koa kok kol kor koy krc kri krk krn krw kry krz ksa ktm kty kum kuo kut kuv kwo kwt kxo kyn kyr lac lad lat ldu lec lep lez lil lim lit lmn lui lun maa mac mak mam map mau mcd mco mcv mdm mds mek men mgg mgi mhi mie mik mis miy mkg mmn mnd mne mns moa moh mot mra mrc mrt mru msc msg msq mss mto mtt mun mut mwb mxx myi mym naj nas nav nax nbd nca ndj nep nev new nez ngi ngl ngn ngw nhh nhm nhn nht niv nku nnc noc nor nph nrg nsn nti ntu nug nwd nyk nyn nyr nyu nze ocu oji omh omi ond ood oss otm pae pai pal pam pan pau paw pba pdp pga pia pir plk pno pny pod pol por ppc pra pre prk prs psh psm pso ptt pum pur qaf qhu qim qui qum ram raw rem res ret rgc rmb rsu ruk rus rut rwe sal sar sav scr sdw sec she shh shi shk shm sho shp sid sin siu skp sla slb slo sme smn sna sng snm snt spa spi squ src srn stl suk sup sus svs swe swt tac tah taj tam tar tau taw tbl tce tee tel tgl thd thk thn thu tic tig tiw tkl tkm tla tli tls tml tnc tni tnn tob tot tpn tps tpt trr tru trw tsf tsz ttu tuc tul tur tuv tuy tvo tvt twe txj udi udm uhi ukr una urd urk urn usr ute uzb vaf wak wam wao wap was wbn wed wem wic wik wiy wlo wly wme wra wrd wrk xam xas xer yag yaq ybi ycn yin yko ykt yng yny yok yuc yuk yur yuw zay zaz zch zqc zqs zun,542,76475,0.0070872833
67A,The Future Tense,,67,Östen Dahl; Viveka Velupillai. 2013. The Future Tense. In: Dryer; Matthew S. & Haspelmath; Martin (eds.) 2013. The World Atlas of Language Structures Online. Leipzig: Max Planck Institute for Evolutionary Anthropology. (Available online at https://wals.info/chapter/67),1,abk aeg akn ala alw aly ame apu arp asm awn awp aze ben blc bng bnj bon bsq bui bur cbo chk coc cpl cpn cyn dag dio dni egn eve ewe fre geo goo grb grf grw gua gug hal heb hin imo ins jiv kay kew kio kji knd knk knr koa krk kui kut lat lav lda lez luv map mar mau mne mrg mrt mtg mwe mxc ngi ngm nim niv ntu ond ono pan pnn qim ram ruk sla snc som spa sue swa tag tem tig tiw tml tne tuc tug tuk tur udm wch wic wly yaq yes ygr yko zul,110,76475,0.0014383786
143F,Postverbal Negative Morphemes,,143,Matthew S. Dryer. 2013. Order of Negative Morpheme and Verb. In: Dryer; Matthew S. & Haspelmath; Martin (eds.) 2013. The World Atlas of Language Structures Online. Leipzig: Max Planck Institute for Evolutionary Anthropology. (Available online at https://wals.info/chapter/143),4,abi abn ace acg acm agb agc agd ain akh akn ala alb all als alw ams amt anj ann any apu arg arj arm aro arq arw ass asy ata awa awt aym baa bac bae baf bai baj bam bao baq bar bbl bbw bch bco bdm bej ber bfg bgn bho bia bil biu bkr bku bla ble blr blz bmz bni bnn bnu bra brf bri brl brp bsh bsq btk bto bua bug bul bun bur buw bvi bwc bya cah cam cax cba ccm cea cem cga cha chb chc chd che chg chh chk chn chq chx cic ckl cle cmn cmy cnt coc coo cos cpl cpy cre crn crt cso cup cya cyv cze dag dan deg dga dgb dgr dhi dhm dhw did din diy dja dji djm djn djp dmk dre drm dua dul dyi ebi egn ene eng eno eny err est eud fij fin fon fut gaa gae gap gav gds gel geo ggu ghr gir gjj gku gmw goa gok goo grb grf grj grk grr grs gud guj gur guu gyc hak ham han haw hay heb heh hei hil hin hlu hmo hnd hoa hol hop htc hua huc hui hun hup hve hya iaa iba idn ifu ign ik ila imo ind inn iqu iri ita jak jaq jlu jng joh juh kad kae kan kba kby kch kdw kdz ket kew kfe kga kgr kgy khd khm khn khr khs kik kil kin kir kkt kla klm kls klv kmh kmi kmj kmp kms kmu kmw knb knc kni knn knz koi kom kop kor kos krb krd krj ksa kse ksn ktc kty kum kuo kut kwa kwb kwn kws kya kyq kzy lac lah lal lan lao lar lat lda ldo leb leg les let lgi lgu lic lis lit llm lmp lot luc lui luo maa mae mag maj mak mal mam man mao mau maw mbi mcd mch mco mcv mde mdl mdm mer mgg mgi mhu mie mir mkd mke mkg mkj mkl mlk mme mmn mmv mmw mna mnd mni mnm mno mns mnt mny moe mog moh mok mon mos mov mpa mpo mra mrd mrh mri mrl mro mrq mrr mrt mru mrw msq mss mua mug mun mur mus mut mwb mwe mxc mxj mxo mxp mxx myi nab nad nah naj nak nal nam nan nar nav nax nbr nca ncm nde ndj ndo ndr ndy neh nev new nez nga ngd ngi ngj ngk ngt ngu ngw nha nhh nhm nht nia nif niu nkk nkn nko nmm nne nsg nti nto ntu nue nug nun nwd nyh nyi nyk nym nyn nyr nyu obg obo ocu oir oji oks omi ond ono ood orh ori ork oss otm pai pal pan par pba pga pip pkn plg pms png pnn pno pnu poh pol por ppi pra pre prs psh psw ptt pul pun pur pwn qia qim qui qum rap ras raw rem res rgc rik rim rnd rny rom rov rpa rru ruk rus rwa sak sal sam sap scr sed see ser ses sgu she shl shm shn shp shu sid sil sir sis skw slb slo sml sna sng snn sno snt so sob sod som son sor spa squ srb src srd sre ssa sta sti stl sud sue sul sun svs swa taf tag tah taj tak tal tam tas tau taw tbo tbw tbx tce tdr tee ten tep tes tet tgh tgk tgo tgr tha thn tho thy tib tim tin tis tiw tke tki tkl tla tli tlp tmm tmr tna tng tnn tno tny tob tod tol tou toz tpa tpn tri trr tsg tsi tsk tsn ttn tts ttu tuk tus tvl twe twn tzo tzu udh udi ukr uli una ung urd url uru usa usr vai ven vie wag wah wak wal wam war wed wel wem wic wik wlm wlw wme wmu wol wor wrb wrd wrg wrl wsk wtm wya xam xar xbi xho xns yag yao yap yaq ybi yei ygr yi yid yim yin yiw yko ylm yng yok yor ytu yuc yur yuw ywl ywr zai zap zar zaz zqc zqo zqs zzo,712,76475,0.0093102325
15A,Weight-Sensitive Stress,,15,Rob Goedemans; Harry van der Hulst. 2013. Weight-Sensitive Stress. In: Dryer; Matthew S. & Haspelmath; Martin (eds.) 2013. The World Atlas of Language Structures Online. Leipzig: Max Planck Institute for Evolutionary Anthropology. (Available online at https://wals.info/chapter/15),4,abe aeg ael apa arh arl asy bej bho cha cyg dut eng ger hin knm mnm mse nor prh psm snc swe tbl tno unm,27,76475,0.00035305656
70A,The Morphological Imperative,,70,Johan van der Auwera; Ludo Lejeune (Umarani Pappuswamy; Valentin Goussev). 2013. The Morphological Imperative. In: Dryer; Matthew S. & Haspelmath; Martin (eds.) 2013. The World Atlas of Language Structures Online. Leipzig: Max Planck Institute for Evolutionary Anthropology. (Available online at https://wals.info/chapter/70),4,aga ago ain ao apt asm aym bae bii bkr bkt brs ccm chc cnl csh cte dam des dja dsh dut gar god hai hya hzb ido imo ing jpn kay kbl kfe kha kiw kkn klm kok kor kow krt lep lez lgt lob lot lug mal mbb mby mde mei mhi mik mnx mrt msg mup mxc ngi ngt nkn nor npn nya ond pai pba pit pnn pny pso saw see sel sem sus swe tah thk tke tor wat wiy wlo wth yid,89,76475,0.0011637791
64A,Nominal and Verbal Conjunction,,64,Martin Haspelmath. 2013. Nominal and Verbal Conjunction. In: Dryer; Matthew S. & Haspelmath; Martin (eds.) 2013. The World Atlas of Language Structures Online. Leipzig: Max Planck Institute for Evolutionary Anthropology. (Available online at https://wals.info/chapter/64),1,abk abu ace aco aeg alk aml ara baw bbw bkr boz brh bsq bum bur cah cha chc chk cic coa coo drg dug eng err eve fin fre gap gar geo ger gnb gol grg grk grw gua guj haw heb hin hmo hun hzb ind irq ita itz jab kam kas kat ker ket kgu kho khs kku kmh kol kpw krw kuk kuo kut kwa lak lat lav laz lez lgu lkt mam map may mbo mcv mdr mhi moh mos mun mus mxc mym nab nav ndb ndj nel nep ngl nht nia nif niu nmb nmi nua obo oji ood otm pal pit pop prh prs psm pul pur qia qim rot rus san sir siu ski skp sno spa squ sud sue sun tab taf tag tgn tha tho tid tik tin tis tlo tps ttn tuk tur txj tzu udh udm uli usa vaf vie wal war yaq ywl ywr zaq zch,161,76475,0.002105263
144A,Position of Negative Word With Respect to Subject; Object; and Verb,,144,Matthew S. Dryer. 2013. Position of Negative Morpheme With Respect to Subject; Object; and Verb. In: Dryer; Matthew S. & Haspelmath; Martin (eds.) 2013. The World Atlas of Language Structures Online. Leipzig: Max Planck Institute for Evolutionary Anthropology. (Available online at https://wals.info/chapter/144),21,abi abn acm all als ani ann any ara ata bac bao bas bbw bdm bil bnu bri btk bua bug bwc cea chd chk chs chx cmr cos cre cti dan dgr dja djn dmk dom dyi ene eno eud gav ggu ghr gmz goo grj han hma hup hve iau iba ifu ign imo ina jng joh kad kau khn khr klm klv kms kmu kmw knb knc krn ksa ktc kum kwn kya lac lal lar lui mba mch mde mdl mer mie mkl mlk mni moe mog mrd mrh mri mrr mrw msm nbr ndj ndo ndr nev nez ngd ngi ngj nht nug nyk nze oir omi ond ood oss par pip pit pnu pog pun pur qaw rik rpa rsu rwa scr ses skk skw sno son src sta sud sue svs tac taw tce tep tke tkl tla tny tou tsg tus twe uru wah wam wed wmu wrb wrd xam xns yag yei yi yiw ylm yok yuc yur zqo,169,76475,0.0022098725
