parameter_id,parameter_name,parameter_description,chapter_id,chapter_citation,value,same_value_language_ids,value_language_count,language_count_total,count_ratio
94A,Order of Adverbial Subordinator and Clause,,94,Matthew S. Dryer. 2013. Order of Adverbial Subordinator and Clause. In: Dryer; Matthew S. & Haspelmath; Martin (eds.) 2013. The World Atlas of Language Structures Online. Leipzig: Max Planck Institute for Evolutionary Anthropology. (Available online at https://wals.info/chapter/94),1,abi ace acl aco adn aeg alb alk all aln alw aml amo amr ams ani apu arg arj arm arq arw asy ata au ayw bag baj bak baq bar bbw bdu bfg bho bik bir bka bkl bkr bma bnr bnu bre brf bsh bsk btk bto bug bul bum bvi bwc ccm cem cha chk chq chr chw chx cic ckl cle cmy coo cop cpl crn cso cya cyv cze dhr did din dio djp dom dre dsh duk dut efi eng eno erk est ewe ewo fij fin fre fua fut fye ga gae geo ger ggu gmw gok grf grk grr gud guj gwa hal hau haw heb hin hmo hna hnd hoa htc hun hve iaa iba ifm ifu igb ind iri ita ite izi jak jmo juh kam kan kau kch ker kfe khl khm khs kik kil kir kis kkt kkv klm kls klv kmj knk kno koe kos krb krd kro krr kry kse ksn kty kut kwn kwy kya laa lac lao lat lbu lda lel len lgu lit llm lmb lmg lmh lmp lnd lon lou luv maa mag mai mal mam man mao mau may mbm mbr mbt mco mcv mde mea mee meh mek men mer mga mgu min miy mka mkg mlg mlu mmn mng mog moh mok mon mov mra mrg mro mrq msq mup mus mut mwb mxc mxj mxo mxp myg myi mzh naj nan nav nca ndo ndt ndy nez ngd ngm ngo nhh nhm nht nia niu nke nkn non noo nor nsg nua nue nyi obo ocu oji olo ond orh otm paa pai pal pan par pat pip pkt plg plh pms pnn poh pol prs psh psm pul qui rap rny rom rot rov rsu rus rwe sah sak sam san sar scr sdw shl shn sim sio siu som son spa squ srb srd sti sud sue sul sun sup sus swa swe swt tab tag tah taj tao tbo tbt tee ten teo tep ter tes tgh tgk tha thy tic tim tin tiw tla tlo tna tne tng tnn tno tob tou tri tsi tsk ttn tuk tvo txj tzo tzu udi ukr uld ung urd uzb vai vie vnm wal war wch wel wic wik wlf wlo wma wme wol xas yap yay yns yor yur zai zqo zul zzo,398,76475,0.0052043153
87A,Order of Adjective and Noun,,87,Matthew S. Dryer. 2013. Order of Adjective and Noun. In: Dryer; Matthew S. & Haspelmath; Martin (eds.) 2013. The World Atlas of Language Structures Online. Leipzig: Max Planck Institute for Evolutionary Anthropology. (Available online at https://wals.info/chapter/87),2,aab aar abk abn abo abu abv ace acg acl adg adi ady adz aeg agb agh agm agt ajg akh akn alb alk all aln aly ama amc ame aml amn amo amp amq amr ams amx ana anc ane ang anj ano anu any ao aoj api apl apt apu arg arj aro arq asm asy atm au awe awi awt awy ayi ayo ayw baa bab bae baf bag baj bam baq bar bas baw bbf bbl bch bdm bdu bdw bem ber bfg bfi bgm bid bik bin bir biu bkr bku ble bln blu blx blz bma bni bnk bnn bok bon bra bre brf bri brl brm brn brp brq bry bsh bsi bsq bsr bto bub bud buj bum bun bus buu bvi bwc cai cas cav cax cbo ccm cde cem cga chb chi chq chr chw cic cld cle cme cmr cnl cnm coc cop cor cpl crn cro crp cso cti ctl ctm ctw cui cup cya dag dan daw day ddj dds dga dgb dgo dha did dig dim din dio diy dji djn dma dms don doy dre dua duk dum dun dyi edo ega egn els emb eme emm eno epe erk err ese ewe ewo fas fij foe fon fre fua ful fur fut fye ga gaa gae gan gar gav gel ggu ghr gjj gku gla gln gmw gnd gnn goa goe goo grb grf grr grw gto gua gug guh gul guu guw gwa gyc hai hal ham har hat haw hdi heb heh hem hid hix hlp hma hmo hna hnd hoa hol hpd huc hup hwr hya iba idn ifm igb ige igs ik ika ila imo ina ind inn iqu iri irq irr irx isa ita jab jad jar jbt jel jin jlu jmo jms jng jrw juh juk jva kaa kae kam kar kau kba kbl kbo kbw kby kch kdz kel ker kfe kga kgr kgu kgy khd khm khs kie kik kin kir kis kje kkt kkv kll klq klv klw kma kmb kmi kmj kmn kmo kmp kmu kmw kmz knc kng knm kno knr knz koa kob koe kok kom kon kos kpe kpw kqq krb krd krh kri krk kro krr kse ksg ksn kta ktc kte ktl ktu kuo kuu kwa kwb kwm kwn kwy kwz kya kyk kyl kyn kyo kyz laa lab lad lag lal lan lao lar lav lbu lda ldo leb lel len lep les let lew lgi lgt lgu lic lin lis lkt llm lmb lmg lmh lml lmp lon lot lou luc lug lui luo luv luy maa mab mac mad mae mal man mao mar mas maw may mba mbe mbi mbl mbm mbo mbr mbt mby mda mde mdg mdl mdn mdw mea mee meh mek mey mga mgk mgo mgq mgu mhk mhl mie mii mij min mis miy miz mka mkd mke mkg mkj mku mkz mla mlg mlk mlm mlu mmb mmv mmw mna mng mnm mnv moa mof mok mon moo mor mot mou mpa mpo mpr mpt mpu mra mrg mrh mrl mro mrq mrr mrt mru msc msk msl msm msn mtb mts mtu mua mud mum mup mur mwe mwo mxa mxc mxe mxj mxo mxp mxy myi myn myr mzc nab naj nak nal nam nan nar nat nau nav nax nbd nbr ncm ndb nde ndi ndj ndo ndr ndt ndu neh ney ngd ngg ngj ngk ngl ngm ngn ngo ngt ngu ngz nhh nhm nht nia nif niu nkb nkk nkn nko nku nma nnc nnd nng nnk noc non noo nph nrg nse ntj nto nua nue nun nup nus nyh nyi nyk nym nze olo omh omi orh ori ork oro orw ory osa otr pae pai pam par pat pau per pga pia pir pit pkt plg plh plk pms png pnu pnx poh pok por ppi pre prh prs psw pul pum pun pur qia rag ral ram rao rap ras raw rga rgc rny rom rot rov rru rsu rum run rwa saa sah sak sam sap sdw sea seb sed sem sen ses sgb sgu she shi shl shm shn sht sia sil sim sio sis skk sko sku sla slb sle slp sme sml smn sng snm snn snt so sob som spa spi src srd sre srn sro sti sud sue sug sul sun sup swa syu tab taf tah taj tak tao tat tau taw tba tbl tbo tbt tbu tbw tdi tdr ten teo ter tes tgk tgn tgo tha thd thy tia tib tid tik tim tkl tlf tlp tma tmm tmn tmo tmr tna tnc tne tng tnk tnn tno tny ton toz tpr tps trb tri tsg tsk tsm ttd ttn tuk tum tun tvl uhi uld uli una ung ura urk url urn urt usa ute vaf vai ven vie vif vnm wag wah wal wap wat wbn wch wed wel wic wiy wlf wlo wma wmu wn wna wog woi wol wom wra wrd wrk wrl wrm wsk wth xam xas xbi xer xho xoo yag yal yam yao yap yay yel yi yid yiw yor yrm yuc yul zag zai zap zar zaz zul zun zya zzo,879,76475,0.011493952
85A,Order of Adposition and Noun Phrase,,85,Matthew S. Dryer. 2013. Order of Adposition and Noun Phrase. In: Dryer; Matthew S. & Haspelmath; Martin (eds.) 2013. The World Atlas of Language Structures Online. Leipzig: Max Planck Institute for Evolutionary Anthropology. (Available online at https://wals.info/chapter/85),2,abi abu ace acl acm adz aeg agc aja alb alk aln als alw ama ami aml amq amr ams anc ane anj any arg arj aro arp arq asy ata au ayw bab baf bag baj bak bar bas bbl bbu bco bdu bfg bfi bga bgo bid bik bir bka bkl bkr blu bma bmz bni bnk bnn bob bol bra bre brf brq bse bsh bsi btk bto bud bul bum buu bvi bwc cak cba ccm ceb cem cha chj chq chr cic ckl cld cle cmx cmy coe cop cpl cqt crn cso ctl cuc cya cyv cze did dio dng dok dom don dre dsh duk dut egn eng eno erk err esm ewo fij fre fri fua fut fye gae gbb gel ger git giz gku gla gmz gnb gnd goa goe gok grf grk grr gto gud gwo hal hat hau haw hdi heb heh hei hem hil hlu hmo hna hoa htc hve hwr hya iaa iba ice ifm ifu igb ign igs ik ila ilo ind iri irq irr ita ixi izi jak jar jlu jmo juk kam kan kar kau kbl kbw kby kdz kel ker kga kgr khm khs kik kil kin kis kkt kkv klv kmi kmj kmu knk koe kon kos kpm kpw krb krd kre kri ksg kte ktu kuo kwa kwk kwm kwn kwy kya kyo kyq laa lab lac lag lan lao lat lbu lda ldo leb lel len let lew lgi lgu lic lil lit lmb lmg lmp lnd lon lou luo luv maa mae mal mam mao mas mau may mbe mbm mcd mco mdg mdm mdo mea meh mga mgo mgu mig min miy mko mlg mlm mlu mmb mmi mmn mna mng mnz mof mok mon mor mov mpu mra mrg mrq msm msq mtt mua mum mup mus mwb mxa mxc mxj mxo mxp mxy myg myi mzh naj nak nal nan nca nde ndi ndo ndt ndu ndy neh ngb ngd ngm ngo ngu ngz nhh nhm nht nia nif niu nko nnc noo nor nse nsg nua nue nun nup nza obg obo ocu olo ora otm paa pai pal par pat per pip pkt plg plh plk pms png pnn pod pog poh pol por pre prs psm psw pul qum rag rap rga rny rom rot ruk rus rwe saa sah sak sal sam san scr seb sed sen ses sgb sge sgl shl shn shu sim sio sir sis slo sml so sob son spa squ srb sre sti sul sun swa swe tab tah tai taj tal tbo tbw tee teo tep ter tes tet tgh tgk tgo tgr tha tho tid tig tim tin tiv tiw tke tla tlo tlp tmr tna tne tng tnk tno tpr tpt tri trt tsg tsi tsk ttd ttn tuk tvl txj tzo tzu ukr uld uli url vie vif vnm war wch wel wlf wlo wma wol wrk wrm xar xbi xho yap yok yor yul zai zan zap zen zhn zqs zul zya,511,76475,0.0066819224
95A,Relationship between the Order of Object and Verb and the Order of Adposition and Noun Phrase,,95,Matthew S. Dryer. 2013. Relationship between the Order of Object and Verb and the Order of Adposition and Noun Phrase. In: Dryer; Matthew S. & Haspelmath; Martin (eds.) 2013. The World Atlas of Language Structures Online. Leipzig: Max Planck Institute for Evolutionary Anthropology. (Available online at https://wals.info/chapter/95),4,abi abu acl acm adz aeg agc aja alb alk aln als ama ami aml amq amr ams anc ane anj arg arj aro arp arq asy ata au ayw bab baf bag baj bak bar bas bbl bbu bco bdu bfg bgo bia bid bik bir bka bkl bkr blu bma bni bnk bnn bob bol bra bre brf bse bsh btk bto bud bul bum buu bvi bwc cak cba ccm ceb cem cha chj chq chr cic ckl cle cmx cmy coe cop cpl cqt crn cso ctl cuc cya cyv cze did dio dok dom don dre dsh duk egn eng eno erk err esm ewo fij fni fre fua fut fye gae gbb gel giz gla gmz gnb gnd goa goe gok grf grk grr gto gud gwo hal hat hau haw hdi heb heh hei hem hil hlu hmo hna hoa htc hve hya iaa iba ice ifm ifu igb ign igs ik ila ilo ind iri irr ita ixi izi jak jar jmo juk kam kan kar kau kbl kbw kby kdz kel ker kga kgr khm khs kik kil kin kkt kkv klv kmj kmu knk koe kon kos kpm kpw krb kre kri ksg kte kuo kwa kwk kwn kwy kyq laa lab lac lag lan lao lat lbu ldo leb lel len let lew lgi lgu lic lil lit lmg lmp lnd lon lou luo luv maa mae mal mam mao mas mau may mbe mbm mcd mdg mdm mdo mea meh mga mgo mgu miy mlg mlm mlu mmb mmn mna mng mof mok mon mor mov mpu mrg mrq msm msq mua mum mup mus mwb mxc mxj mxo mxp mxy myg nak nal nan nca ndi ndo ndt ndu ndy neh ngb ngd ngm ngo ngu ngz nhh nhm nht nia nif niu nko nnc noo nor nse nsg nua nun nup nza obg obo ocu olo ora otm paa pai pal pat per pip pkt plg plh plk pms png pnn pod pog poh pol por pre psm psw pul qum rag rap rga rny rom rot ruk rus rwe sah sak sal sam san scr seb sed ses sgb sgl shl shn shu sim sio sir sis slo sml so sob son spa squ sre sti sul sun swa swe tab tah tai tal tbo tbw tee teo tep ter tes tet tgh tgk tha tho tid tim tin tiv tiw tke tla tlp tmr tna tne tng tnk tno tpr tri tsg tsi tsk ttd ttn tuk txj tzo tzu ukr uld uli url vie vnm war wch wel wlf wlo wma wol wrk wrm xar xbi xho yap yok yor yul zai zan zap zhn zqs zul zya,456,76475,0.0059627327
82A,Order of Subject and Verb,,82,Matthew S. Dryer. 2013. Order of Subject and Verb. In: Dryer; Matthew S. & Haspelmath; Martin (eds.) 2013. The World Atlas of Language Structures Online. Leipzig: Max Planck Institute for Evolutionary Anthropology. (Available online at https://wals.info/chapter/82),1,aab aar aba abi abk abn abo abu abv acg acl acm acn aco adg adi adn ady adz aeg aga agb agh agm agt ain aja ajg akh akn ala alb ale alk all aln aly ama amb ame amh aml amn amp amq amt amx ana anc ane ang ani ano anu ao aoj api apt apu apw arc arg ari arj arm aro arp arq arw asm ass ath atk atm au ava avk avo awa awi awp awt awy ayi aym ayo ayr ayw aze azi baa bab baf bag bai bak bam bao bar bas baw bbl bbw bdm bdu bdw bej bel ben ber bgm bgo bgr bgs bgz bho bhu bid bii bik bin bio bir biu bka bkb bkt bku ble blt blx blz bmb bnb bni bnj bnk bnn bnu boa bob bod bok bol bon boq bra brf bri brl brm brn brp brq bry bsh bsk bsq bsr bti bua bub bud bug bum bur bus but buu buy bvi bya bzi cah cai cam can car cas cay cct cde cga chb chc chd chg chh chi chk chn chp chr chs chv chw cic cln cme cmh cml cmn cmr cnl cnt coa coc cop cpn cpy crn cro cti ctm ctw cua cuc cui cup cze dag dam dan daw day ddj dds deg der des deu dga dgb dgo dgr dha dhb dhm die dig dim din dio diy dja dji djp djr dlm dma dmi dmk dms dni dok doy drg drm dsh dua duk dul dum dun dut dyi ebi edo ega egn eip eka eko emb eme emm ene eng eno epe erk err ese est eud eve evn ewe ewo fas fin foe fon for fqs fre fri fua fur fut fye ga gah gal gam gan gap gar gav gbb gbs gds geo ger ggu ghb ghr gim gla gln gmw gmz gnb god goe gog gok gon goo grb grg grw gua gug guh guj gul gur guu guw gwa gwo gyc hai hak hal ham han har hat hau hay heb heh hem hhu hid hin hlp hma hmi hmo hna hnd hol hop hpd hua huc hui hum hun hya hzb iat iau iba ice idn idu ifm igb ige igs iha ijo ika ila imo ina ind ing inn iqu irq irr irx isa isi ite ito iwa iwm izi jab jad jar jbt jin jiv jmo jms jng joh jpn jrw juh juk jva jwr kaa kab kac kad kae kan kar kas kau kay kba kbo kbu kbw kby kch kdw kel kem ken ker ket kew kfe kga kgu kgy kha khd khg khl khm khn kho khr khs khw kie kik kil kim kin kio kir kis kiw kkp kkq kku kkv kla klg kll klq klw kma kmb kmh kmk kmn kmo kmp kmr kms kmu kmw kmz knb knc knd kng kni knk knm knn kno knr knw knz koa kob koe kok kol kom kon kor kos koy kpw kqq krc krd kre krh krk krr krw kry krz ksa kse ksg ksm ksn kta ktc kte kti ktl kty kum kun kus kuu kuv kwa kwn kwo kwt kwy kwz kxo kya kyk kyl kyn kyp kyr kyz kzy laa lab lad lag lah lai lak lal lan lao lar lav lbu lda ldo ldu leb lec leg lel len lep les let lew lez lgi lgt lho lic lim lin lis lit lkt llm lmh lmn lmp lmu lnd lon lot lou luc lug lui luo luv ma mab mad mae mag mai man mar mas mau maw max may mba mbe mbi mbm mbo mbr mbt mby mcd mda mde mdg mdl mdn mdo mdw mea mee mei mek mem mer mey mga mgg mgh mgi mgk mgo mgq mgu mhi mhu mie mii mij mik mil mis miz mka mkd mke mkg mkh mki mkj mkl mkq mku mkz mla mlg mlk mlm mlu mmb mmv mnc mnd mne mng mni mnm mno mns mnv mny moe mof mog mom mon moo mor mos mot mou mpa mpt mpu mqf mrc mrd mrg mrh mri mro mrr mrs mrt mru mrw msc msg msl msm msn mss mtb mto mts mtu mua mui mum mun mup mur mus muu mwe mwo mxe myg myi mym myn myr nab nad nag nah naj nak nal nam nar nas nat nav nbd nbe nbm nbr ncm ndb ndi ndj ndo ndt ndu ndy neh nep nev new ney nga ngd ngi ngj ngk ngm ngn ngo ngt ngu ngw ngz nhn nis niv nkb nke nkn nko nku nma nmb nmd nmm nnd nng nnk noc nog non noo nor nph nse nsn nti ntj nto ntu nua nue nun nup nus nwd nya nyi nyk nza nze obg obo ocu oir oks olo omh omi one ong ora ord orh ori ork oro orw ory osa oss otr owi oya paa pae pal pam pan par pat paw pba pdp per pia pir pis pit pkn plg plh plk pme pmn pms png pno pnu pny pog poh pok por pra pre prh prk prs psh pso psw ptt ptw pul pum pun pur qaf qaw qhu qim rag ral ram rao ras raw rem res ret rga rgc ria rik rim rmb rnd rny rom ron rot rpa rru rsu rum run rus rut rwa ryu sah sak san sap sar sav scr sdw sea sed sem ser ses sgb sgl sgu sha shb she shh shi shk shl shm shn sho sht sia sid sil sin sio sir sis skk skm sko skp skr sku skw sla slb sle slo sme smn sna sng snh snm snn sno snt sob sod som son spi srb src srd sre srn sro ssa sta sti stl stn sud sue suk sul sun sup sus svs swa swe syu tab tac taf taj tak tal tam tan tao tar tau taw tba tbl tbt tbu tbw tce tdi tdr tel teo ter tet tgk tgl tgn tgr tha thk thn thu thy tia tib tid tig tik tis tiv tiw tja tki tkl tkm tlf tli tlo tma tmc tmg tml tmm tmn tmo tmr tnb tnc tne tni tnk tnn tny tod ton tou toz tpr tpt trb trm trr tru trw tsf tsh tsz ttd tte ttn ttu tuc tul tum tun tur tuv tuy tvo tvt twe twn txj tye uby udh udi udm uhi ukr uld uli una ung ura urd urk url urt uru usa usr uyg uzb vai ven vie vnm wag wah wak wal wan wao wap was wau way wbn wch wed wiy wlf wlw wly wma wme wmu wn wna woi wol wom wra wrk wrm wrn wry wsk wtm wwa xam xar xas xav xbi xer xho xns xoo yah yal yam yaq yar yay ybi ycn yei yel ygr yi yid yim yin yko ykt ylm yng yor yqy ytu yuc yuk yul yur yus yuw zag zan zar zay zaz zch zhn zim zpr zul zun,1192,76475,0.015586793
89A,Order of Numeral and Noun,,89,Matthew S. Dryer. 2013. Order of Numeral and Noun. In: Dryer; Matthew S. & Haspelmath; Martin (eds.) 2013. The World Atlas of Language Structures Online. Leipzig: Max Planck Institute for Evolutionary Anthropology. (Available online at https://wals.info/chapter/89),1,ace aga agc agd ain ala alb als amh ami amk amr ams ani apu ara arc arg arm aro arp arq arw ata ath ava awa awp aym ayo aze bae baq bch bel bfg bho bii bil bkr bkt bla bln bma bre brf brs bsk bsq btk bul bur but bwc bya cak cam car cav cay ccm cde cha chc chd che chh chj chk chn chp chq chr chv ckl cld cle cln cmh cml cmn cmy cnt coc coo cop cor cpl cpn cpy crn crp cso ctl cub cuc cup cya cyv cze dam daw der dgr dhi dhm dom don dre drg drm dsh dut eme eng est eve fij fin fre gae gam gds gel geo ger gjj gku gla gnb goa god gok gon goo grf grk gua guj hak hal haw heb hil hin hix hlu hmi hmo hoa hop hpd htc hua hun hup hwr hzb iaa iba ice ifu ijo ind ing iqu iri ita ite iwa jak jaq jiv joh jpn kan kas kay kbt kdz ket kgu kgz kha khg khl kho khr khs kio kiw kkp kkt kku klm klr klv kma kmh knb knd knn kno kol kop kor koy kpm krb krc krd kre kri krk krn krz ktu kty kum kuo kut kuv kwa kwo kxo kya kyz kzy lac lat ldu lec lez lgu lic lim lit lmn lmp lui mac mag mai mam map mau mco mcv men mer mgg mhi mie min mis mmn mna mnd mng mns moh mpr mrc mrq mrt msq mss mto mun mus mxc mxj mxo mxp mxx mxy mym naj nas nav nca ndy neh nep nev nez ngw nhh nhm nhn nht niu nne nor nsg nti ntu nun nyu obg ocu oji ood ord ork oss otm pae pal pam pan pba pip pir pkn plk pmn pnn pno pnu pny pol ppc pra prs psh pso ptt pul pur pwn qaf qhu qim qui qum rap rem res ret rom rov rpa rsu ruk rus rut rwe saa sal sar scr sec sed see shb shi shk shp sid sin sir sis siu skp slo sml smp sna som son spa squ src srd sre sta stl sun svs swe taf tag taj tar tat tbo tee tel teo tep tgh tgk tgr thn tho thu tic tim tin tiw tkm tla tli tlp tls tml tni tnk tob tpn tpt tri tru trw tsf tsh tsi tsk tsz ttu tuc tul tur tuy tvl tvo twe tzu uby udi udm ukr uli urd urk urn usr ute uzb vaf vie wak was wch wel wic wlf wlo wly wme wol wrd wrk wrw xar yag yap yaq yay yei yin yko yng yny yok ytu yur zai zap zay zaz zch zen zhn zun zya zzo,479,76475,0.0062634847
