parameter_id,parameter_name,parameter_description,chapter_id,chapter_citation,value,same_value_language_ids,value_language_count,language_count_total,count_ratio
48A,Person Marking on Adpositions,,48,Dik Bakker. 2013. Person Marking on Adpositions. In: Dryer; Matthew S. & Haspelmath; Martin (eds.) 2013. The World Atlas of Language Structures Online. Leipzig: Max Planck Institute for Evolutionary Anthropology. (Available online at https://wals.info/chapter/48),1,abn acm apu arp awt bnj cba coo cre cyv gar guu ham hlu hmr jaq kay kgu kio kut kwz mak mar mlk mne moh mrt msl mss myi nai nez ngi ngk ngl nmb nug nuu ond pec pny psm qui siu squ tag tap tau tja uhi ung wam wch wic wik win wrd yid ypk yuk zqc zun,63,76475,0.00082379865
100A,Alignment of Verbal Person Marking,,100,Anna Siewierska. 2013. Alignment of Verbal Person Marking. In: Dryer; Matthew S. & Haspelmath; Martin (eds.) 2013. The World Atlas of Language Structures Online. Leipzig: Max Planck Institute for Evolutionary Anthropology. (Available online at https://wals.info/chapter/100),1,abn abu adz ana awt bab bam bar bnj bri brm bro chr dga don dre epe gar god grb gud guu hai hau hmo hmr igb imo ing jpn juh kay kch kha khm klk kmu kor kro kse kuk kyl lad lah lep lez mal mao mcr mde mei mlm mnd mrt mum nbr ndy niv nup pai pso qaw rap sam san saw shk snm srm sun sup tag tha uhi vie wap wik xok yaq yes yid yor zun,84,76475,0.0010983981
44A,Gender Distinctions in Independent Personal Pronouns,,44,Anna Siewierska. 2013. Gender Distinctions in Independent Personal Pronouns. In: Dryer; Matthew S. & Haspelmath; Martin (eds.) 2013. The World Atlas of Language Structures Online. Leipzig: Max Planck Institute for Evolutionary Anthropology. (Available online at https://wals.info/chapter/44),3,abu ala ane apu ara awt bln bnj brm brs bur ckl cre cub diz dut eng fre ger grk gud ijo iri ita khs klv kom kor kro may mku mlk mnd moh mrd mun nas nav ngk ngl nmb orh pau prs psj psm pso ret rus sem tap tiw tru ung wel wrk xok yaw yes zan,61,76475,0.0007976463
104A,Order of Person Markers on the Verb,,104,Anna Siewierska. 2013. Order of Person Markers on the Verb. In: Dryer; Matthew S. & Haspelmath; Martin (eds.) 2013. The World Atlas of Language Structures Online. Leipzig: Max Planck Institute for Evolutionary Anthropology. (Available online at https://wals.info/chapter/104),1,abn abu adz ana ani anj arm ata awp awt bab bam bar bkr bnj brh bri brm brn bro brs bya cap cav cha chr cle cnl cop cpn cri cub dga dgr diz don dre dum dut eng epe eve fin fre fur gar ger god grb gud guu hai hat hau heb hin hmo hmr hmu hzb igb ijo imo ind ing iqu iri irq ita jpn juh kay kch ker kew kgu kha khm kho khs kio kis klk kmu kna knd kob kor kro kse kuk kyl lad lah lak lat lep lez mal mao may mcr mde mei mis mlm mnd mne mrt mum mup mxc nad nai nak nbd nbr ndy niv noo ntu nup nuu orh pai pau plk pny pol pso qaw ram rap rem rus sam san saw sel sem shk sml snm so srm sue sun sup syu tab tag tgk tha tid tin tir tla tmr tms trb tri tru tso tur udh uhi urk vie wao wap wbn wel wik win wma wra wsk xok yap yaq yaw yes yid yko yor zun,187,76475,0.0024452435
71A,The Prohibitive,,71,Johan van der Auwera; Ludo Lejeune (Valentin Goussev). 2013. The Prohibitive. In: Dryer; Matthew S. & Haspelmath; Martin (eds.) 2013. The World Atlas of Language Structures Online. Leipzig: Max Planck Institute for Evolutionary Anthropology. (Available online at https://wals.info/chapter/71),4,acl acu ala ame amh ana apt ars awp bab bam bdk bem ber bhu bri brr buk bul chk cml cmn coi dbd dig dio diz dni dre dyi gar god grb grk grw gua hau heb her hmr hya hzb imo jeb kay ker kfe kil kim kio kiw kkn kmp kms knd knr koa kod koi kow krk kro krq krt kse kui kwa kwk kws kyg lan lav laz lep lez lil lob loz luo luv mab mal mao map mau mbg mcd mei mhi miy mlt mme mnm mro msg mun mwe mwo nav nen nga ngi noo ntu oka oss pai pms pnn psm qta ram ret sgu shu squ stn sug swa tah tbu tem teo tiw tml tor tot tsa tuk tun udi una way wch wiy wrg wwr yaq yim yny yuk yus zaz zqc zul,146,76475,0.0019091206
124A,'Want' Complement Subjects,,124,Martin Haspelmath. 2013. 'Want' Complement Subjects. In: Dryer; Matthew S. & Haspelmath; Martin (eds.) 2013. The World Atlas of Language Structures Online. Leipzig: Max Planck Institute for Evolutionary Anthropology. (Available online at https://wals.info/chapter/124),1,ace ain akh aly amp ano ass bab bak baw ben biu boz brm bvi cha chn cic cmn cnl cnt cop dgr dha dhb dhi dre drg eng epe err fin fre gar gel ger guu heb hin hix hma hmo hoa hun hzb ik ika imo ind irq kam kan kao kas kem ker ket khm kho kmu knd kod kon kor krb kro kty kug kuk kya kyl lak lan lat lel lep lez lgu lil luv mad mao mbi mdr mei mhi mid mis mnd mno mos mrt mup ndb ngi nha niu nko nph nse pae pal pec pit pny ptt pul pur qhu qim ram rap raw ret rus san sap sed ser sno spa sue sun sup tag tau tha tib tid tru tur udm vie wam wlf wra yag yey yim yko ynk yor zul,144,76475,0.0018829682
105A,Ditransitive Constructions: The Verb 'Give',,105,Martin Haspelmath. 2013. Ditransitive Constructions: The Verb 'Give'. In: Dryer; Matthew S. & Haspelmath; Martin (eds.) 2013. The World Atlas of Language Structures Online. Leipzig: Max Planck Institute for Evolutionary Anthropology. (Available online at https://wals.info/chapter/105),1,abk abu akh ale alk ame aml ano ara awp bae bag bai bak bdm ber bfg bho bii biu bkt bma boz bsq bum bur but bya bzi cct chk chn chr cnl cop dhi dja drg dug epe eve fij fin fre gam gar gdf geo ger grk gua guu hai hat heb hin hix hmo hun hzb ik imo ing irq ita itz jab jak jel jng jpn kas kda kem ker kha khs klm kly kma kmu knc knd knm knr koa kod kor kro kwa kya lad lak lat lav lep lez lgu lis mac mad mai mam mao mbb mbi mbo mdg mdr mei mgg mgu mhi mlt mpr mup mus mxc mym nag nbd nep nia niu nsg nua nwd orh ory pae per pms prs pta ptt pur qaf qia qim rap raw ron rus san sap skp sla sml snm sno so spa sud sue sup tam tgl tgn tha tib tig tin tis tml tms tor trb tru trw tsi tst tsz tur tzu udh udm uku urk wir wra wrm yid yim yko ytu zaq zay zaz,189,76475,0.0024713958
107A,Passive Constructions,,107,Anna Siewierska. 2013. Passive Constructions. In: Dryer; Matthew S. & Haspelmath; Martin (eds.) 2013. The World Atlas of Language Structures Online. Leipzig: Max Planck Institute for Evolutionary Anthropology. (Available online at https://wals.info/chapter/107),1,aeg ain alb amh amu ana ani apu ara arm aym bar bej ber bln bma brr bsq bur car cha cle cmn cmx coo cop cor cri cub cyv dgr dio diz don doy dre dut eng eve fij fin fre fua fur geo ger grb grk grw hau heb hin hix hlu hmo hmr hmu hun ijo ind iri irq ita jak jpn kas kay kch ket kha kho kis kna knd knm knr koa kon kor kos krb krd krk kro kse kuk kut kws lat lep lim mab mac mal mao map mar mnd mrl mrt msl mss mun nad nai nav nbd nbr ndo nez nht nko noo ntu nuu oss pal par pau pip plk pny pol prs psj psm qim qui rus siu sla sml snm so spa squ sun swa tab tha tin tkl tna tpn tuk tur tzu udh vie wap war wel wik win wra yaq yuk yur zan zul zun,162,76475,0.0021183393
70A,The Morphological Imperative,,70,Johan van der Auwera; Ludo Lejeune (Umarani Pappuswamy; Valentin Goussev). 2013. The Morphological Imperative. In: Dryer; Matthew S. & Haspelmath; Martin (eds.) 2013. The World Atlas of Language Structures Online. Leipzig: Max Planck Institute for Evolutionary Anthropology. (Available online at https://wals.info/chapter/70),1,abb abk acl aco acu adk aeg ala amh amr ana anl apl ard arg arm arp ars ath ava awp ayr azi bab bam bbw bdk bej bel bem ber bfg bma bre brh brz bsk bsq bud bul bur cah cak car cay ceb chj chv cld cle cmh cml cmn coi coo cor cre cyv cze dag dbd dgr die dig diz dmi dni dyi eka emb emc epe err est eve evn far fin fua fye gam gim glc gmz goj grk grw guj gum ham heb her hin hix hlu hmi hui igb ik iri irq jak jaq jeb kas ket kew khk kil kio kis kmk kmp kms knd knm knr koa kob kod koi krb krc krd krk kro krq kse kte kty kui kut kuv kwe kwr kws kyg lad lak lan lav laz lil lim lit lng lno loz luo luv mab mac mak mam man map mar mau mbg mcd mdn meh mgo mhu miy mlt mme mna mns moe mop mos mrd mrg mro msl mss mun mwe myi mym nan nap nbd nez nga nht niv nti ntn nub obo oix oka ood orh otm pan pau pip pms pol ppi prk psm pta pur qim qta ram ret rsu rus rwa scr sdw sgu shb shk shl shu slo sno snt so sou spa srd stn sue sug swa tag tas tau tbu tel tem ter tet tgr tir tiw tkl tml tms tna tnc tpn tsa tsh ttu tun tur tuv tvo tzo tzu udh udi ukr uld una uzb vai vot wap wau wch wel wic wlf wra wrd wrg wrk wwr yaq yim yko yng yny ypk yuk yur yus zaz zen zqc zqs zul,292,76475,0.0038182412
64A,Nominal and Verbal Conjunction,,64,Martin Haspelmath. 2013. Nominal and Verbal Conjunction. In: Dryer; Matthew S. & Haspelmath; Martin (eds.) 2013. The World Atlas of Language Structures Online. Leipzig: Max Planck Institute for Evolutionary Anthropology. (Available online at https://wals.info/chapter/64),2,aga ain ala aly ame bab bag bak bdm bkt bma bnn bud bus bvi cch cmh cnl cnt cop cyg deg dgb dha dhi dja doy dre ewo fij fon hai ham hat hau hoa ika imo jak jpn juh kan kfe kma kmb kmu knd knr koa kob kor krb krk kro krr kse kty lai lan lel lep lil lmg lug luv mad mao mar mbi mby mei mgg mgu mid miy mnd mrq mup myi nag nez niv nko nse nsg nwd orh pae pai pec per pms pno qaf ret sea sgu sho sla snt so som sup syu tao tau tig tml tmm tms trb tru tst tvl uku urk wch wlf wrd yid yko yor zul zun,125,76475,0.0016345211
72A,Imperative-Hortative Systems,,72,Johan van der Auwera; Nina Dobrushina; Valentin Goussev. 2013. Imperative-Hortative Systems. In: Dryer; Matthew S. & Haspelmath; Martin (eds.) 2013. The World Atlas of Language Structures Online. Leipzig: Max Planck Institute for Evolutionary Anthropology. (Available online at https://wals.info/chapter/72),4,abk aco aeg ain amh amr ana apl apu arm arp asm ava awp ayr bag bem ber bma brh brm brr bsq bur cah car cay cha chr chv cld cmn cnl coi cop cre crg csh ctl cze die dig dre dsh dut eka emb eng epe err ewe far fre fur fye gar geo ger grw gum hai hay hin hlu hmd hmo hum iaa ice igb ika imo ind ita jav jpn kay kek ket kew kgm kio kiw kkn kmp kmu knr kok kor krb krt ksm kut kuv lad lan lat lav laz lez lit lkt lnd lno luo mab mac mak mam map mar may mdg mik miy mkn mku mlt mme mna mnd mon mop mrd mrl mro mrt msg msl mul mxc myi mym nav nbd ngl nim nor nun obo oix ong orh otm pai pau pec pip pit pms pol por ppi pso pta pur qim rus scr sdw see shk shl shu slo sml snh snm so spa squ stn sue sug swe tag tgr tha thk tir tiw tja tms tsa tsf tuk ukr uma urk url vie wau wch wel wlo wrk yah yaq yur zqc,201,76475,0.00262831
115A,Negative Indefinite Pronouns and Predicate Negation,,115,Martin Haspelmath. 2013. Negative Indefinite Pronouns and Predicate Negation. In: Dryer; Matthew S. & Haspelmath; Martin (eds.) 2013. The World Atlas of Language Structures Online. Leipzig: Max Planck Institute for Evolutionary Anthropology. (Available online at https://wals.info/chapter/115),1,abk abu ace ady aeg ain ana ano ass awp bab bae bag baw bbw biu bkr bma boz brh brm bsq bud bul chk chn cnl cnt coo cop ctl dgr dji epe eve fin fon goo grg grk grw gua guj hai hau heb hin hmo hun hzb ind iri jam jel jpn kan kas kaz ker ket kfe khm khs kio kkp kku klv kma kmh kmu knd knr koa kob kod kor kse kty kug kzy lak lat lav lel lez lil lin lit lkt mac mad mao map may mbi mby mdg mgu mhi miy mme mnd moe mos mto mun mym nai nav ndj nep ngi niu niv nti nua nwd oji ood orh pae pai pms pno pol pop prs qhu qia qim raw ret rom rus scr shk skp sla sno som squ sup swa tag tam tha tid tja tml tms tpn trb tru ttn tur tuv udh udm urk vie wch wlf yko ykt ytu zaq zaz zul zun,170,76475,0.0022229487
123A,Relativization on Obliques,,123,Bernard Comrie; Tania Kuteva. 2013. Relativization on Obliques. In: Dryer; Matthew S. & Haspelmath; Martin (eds.) 2013. The World Atlas of Language Structures Online. Leipzig: Max Planck Institute for Evolutionary Anthropology. (Available online at https://wals.info/chapter/123),4,abk ace ala bma bob brm brs cha cle eve fur grw hzb imo ind ing jak jpn kam kay kch kfe kha khm klv knd knm kob kor krc kse kxo lez maa mao map may mei mna mnd mxc nbb ndy ngi nug orh per pit qim tha tuk tur ung war,55,76475,0.0007191893
103A,Third Person Zero of Verbal Person Marking,,103,Anna Siewierska. 2013. Third Person Zero of Verbal Person Marking. In: Dryer; Matthew S. & Haspelmath; Martin (eds.) 2013. The World Atlas of Language Structures Online. Leipzig: Max Planck Institute for Evolutionary Anthropology. (Available online at https://wals.info/chapter/103),1,abn abu adz ana ani awt bab bam bar bnj bri brm bro chr dga don dre epe gar god grb gud guu hai hau hmo hmr hzb igb ijo imo ing jpn juh kay kch ker kha khm kho kis klk kmu kor kro kse kuk kyl lad lah lep lez mal mao mcr mde mei mlm mnd mrt mum mup nbr ndy niv noo nup pai pny pso qaw rap sam san saw sel sem shk snm srm sun sup tag tgk tha uhi vie wap wik wra yaq yes yid yor zun,96,76475,0.0012553122
122A,Relativization on Subjects,,122,Bernard Comrie; Tania Kuteva. 2013. Relativization on Subjects. In: Dryer; Matthew S. & Haspelmath; Martin (eds.) 2013. The World Atlas of Language Structures Online. Leipzig: Max Planck Institute for Evolutionary Anthropology. (Available online at https://wals.info/chapter/122),4,abk ace aeg ala any arp bag bar baw bkr blq bma bob brh brm brs bsq bur cha chk cle dag deg dgb diy dni eve ewa fij fur fye gae gdr giz grw gua hau heb hix hmo hzb ik imo ind ing iri jak jpn kam kay kch kfe kha khm kho kin kis kjr klv knd knm kob kor krc kro kse kul kxo lan lel lez lin luo luv maa mal mao map mau may mei miy mna mnd mrt mxc nan nbb nbd ndy ngi nug orh pai per pit pms prs psm qim rap san see so spa stn swa tag tes tha tuk tur ung ven vie war wic wrd wrn yaq ygr yim yko zul,125,76475,0.0016345211
46A,Indefinite Pronouns,,46,Martin Haspelmath. 2013. Indefinite Pronouns. In: Dryer; Matthew S. & Haspelmath; Martin (eds.) 2013. The World Atlas of Language Structures Online. Leipzig: Max Planck Institute for Evolutionary Anthropology. (Available online at https://wals.info/chapter/46),2,abu aeg ame aml amp ano bab bag bak bam bud cic dgb doy eng err ewe fon fre fue gam gbb gol hau ibi ilo ind iri irq ita kan kat kfe kji klq kob kse kwr kya kyk lan lav lel lgu lug mal may mbi mby mde mgu mis mlt mrg msh nbd ndb niu nko nti nto orh orl pal pms prs qia sam san see sla som sum swa tid tis tms tmu tru tur tvl usa yap yor,85,76475,0.0011114744
