parameter_id,parameter_name,parameter_description,chapter_id,chapter_citation,value,same_value_language_ids,value_language_count,language_count_total,count_ratio
90C,Postnominal relative clauses,,90,Matthew S. Dryer. 2013. Order of Relative Clause and Noun. In: Dryer; Matthew S. & Haspelmath; Martin (eds.) 2013. The World Atlas of Language Structures Online. Leipzig: Max Planck Institute for Evolutionary Anthropology. (Available online at https://wals.info/chapter/90),1,aar abi abo abu abv ace acg acl adi adz aeg agm ajg alb alk all aly ame aml amo amp amq amr ana anc ang anj anu any aoj apu apw arg arj aro arq arw asy awe baa bab bag baj baq bar bbl bbu bco bej ber bfg bfi bgr bid bii bik bio bir bka bkr bku blr bma bmb bni bob bok bre brf brh brn brp brs bsh bsr btk bto bud bug bul bum bus buu bvi bwc cah cak cav cax ccm cde ceb cem cha chj chp chq chr chw cic cld cle cmh cmn cmy cnm coo cop cor cpl crn cso ctl ctm cub cya cze dag dan day ddj deg des did din dio djm dni dom doy dre dsh duk dut dyi efi egn emb eme eng eno erk err est eud ewe ewo fij fin fon fre fri fua fur fut fye gae gap gbb gel geo ger ghb gmz gnb gnd gok grb grf grk grw gud gul gum gwa hal hat hau haw hdi heb hei hid hix hmo hna hnd hoa hol htc huc hui hup hve hwr hya iaa iau iba ice idn ifu igb ign igs ik ila ind iri irq isa ita izi jab jak jeb jmo juh juk kam kan kar kau kay kbl kbt kbw kch kel ken ker kfe kgr khl khm khs kik kir kis kje kkt klm klr klv klw kma kmj knc kni knk knm knr knz koe kos kpm kpw krb krd kre kri kro krr kse ksg ktc kte ktl kuo kwn kws kwz kyl kyo kyq lab lan lao lat lbu lda leg lel len let lew lgt lgu lit lmg lmh lmp lmu lnd lon lug lui luo luv maa mab mad maj mal mam mao mas mau maw may mbm mbr mby mco mcv mdg mdo mds mea mee meh men mga mgo mgq mgu min miy mkj mlg mlu mmb mmn mng mnm mno moa mof mok mos mot mou mpr mpu mrg mrl mro mrq msk msl msm mud mum mup mur mus mut mwo mxc mxe mxo mxp mxy myg myi myn naj nal nan nar nat nbd ncm ndo ndr ndt ndy neh ney nez ngl ngm ngo ngz nhh nhm nht nia nif niu nkn nko nku non noo nor nrg nua nue nug nun nup nza obg obo oji olo ood orh orw otm paa pai pal par pat pau pba per pga pip pkt plg plh pms pno pnx pod poh pol por pre prs psh psw ptt pul pur qum rag rap rny rom ron rot rov rsu run rus rwe sah sak sam san sdw sea sed see ses sgb sgu shb shn sht sio sir sis skr slb sle sml snh so sob som spa src srd sre sro sud sul sun swa swe swt tab taf tag tah tai taj tak tar tat taw tbo tbt tbu tce tee ten teo tep ter tes tgk tgn tha thy tid tim tin tiw tke tla tlp tls tmm tmr tna tne tng tnk tnn tno tny toz tpn tpt trb tri trm tsi tsk ttd ttn tun tvl txj tzu ukr uld uli ung url urt ute vaf vie vnm wah wak wal war wch wel wic wlf wlo wma wol xbi xho xoo yag yap yaq yor yuc yuk yul zag zai zch zhn zul zzo,579,76475,0.0075711017
144K,SVONeg Order,,144,Matthew S. Dryer. 2013. Position of Negative Morpheme With Respect to Subject; Object; and Verb. In: Dryer; Matthew S. & Haspelmath; Martin (eds.) 2013. The World Atlas of Language Structures Online. Leipzig: Max Planck Institute for Evolutionary Anthropology. (Available online at https://wals.info/chapter/144),4,abi acg acm adi aeg agh akn alb anu apu arg arj arm aro arq asy bae bai bar bbl bch ber bia bkr bku ble blz bni bnn bra bre brf brn bsh btk bug bul bvi bwc cga cic cmy cnt coc cop ctl cze deg dga dgb dio dma dre dsh dua ebi egn eko eng eno err est ewo fin fon fre fua fut ga gku gnb gok grk gua gud hak hal heb heh hmo hnd hol htc huc hun hve hya iaa iba ice ila ina ind iqu ita izi juh kad kan kas kba kby kch kdw kfe kga khm khn khs kik kil kin kir klv kmu kni koe kom kos ksn ktc ktl kwa kwn kwz kzy lac lan lao lat ldo leb leg len let lgi lic lit llm lmp lmu luc luo mae maj mao map mau mbe mbt mcd mcv mga mhu mie mkd mkz mlg mmv mnd moe mok mon mos mro mrq mrt mua mus mut mwe mwo mxe nad nak nal ncm ndb ndo ndt ndy neh ngd ngo ngu ngw nhm nht nke nkn nko nne noo nor nse nti nto nun obg obo ocu pal pau pga pkn plg pms png pnu poh pol por pre psw pul pur rim rny rom rot rru rus sak sal sap scr sed ses sgu shl shm shn sir sis skm slo sno sob son spa srd sre ssa sti stn sud sul sun swa swe taf tal tan tbw tee ten teo tep tes tet tgk tha tin tiw tki tla tmm tmn tmr tne tob ton toz tru ttn twn tzu ukr uli url ven vie vnm wal wch wlf wol wrk wrn xam xar xbi xho yao yin yng yor yuk yul zch zpr zqs zul,304,76475,0.0039751553
143A,Order of Negative Morpheme and Verb,,143,Matthew S. Dryer. 2013. Order of Negative Morpheme and Verb. In: Dryer; Matthew S. & Haspelmath; Martin (eds.) 2013. The World Atlas of Language Structures Online. Leipzig: Max Planck Institute for Evolutionary Anthropology. (Available online at https://wals.info/chapter/143),1,abi abn ace acg acm agc agd ain akh ala alb all als alw ams anj any apu arg arj aro asy ata awa aym baa bac bae bai baj bam bao baq bar bbw bch bco bdm bfg bho bil bkr blr bmz bni bnn bnu bra brf bri brp bsq btk bto bua bug bul bun buw bvi bwc cah cax cea cem cha chc chd che chk chq chx ckl cle cmn cmy cnt coc coo cos cpy cre crn crt cso cup cya dag dan dga dgb dgr dhw did din diy dja dji djm djn djp dmk dre dua dyi ebi ene eng eno est eud fij fin fon fut gaa gae gap gav gds gel geo ggu ghr gir gmw goa gok goo grb grf grj grk grr grs gud guj guu hak han haw hay heb hei hil hin hlu hmo hoa hop htc huc hun hup hve iaa iba idn ifu ign ik imo ind inn iqu iri ita jak jaq jlu jng joh juh kad kae kan kch kdz ket kfe khm khn khr khs kir kkt kla klm kls klv kms kmu kmw knb knc kni knn koi kom kop kor kos krb krj ksa kse ksn ktc kty kum kuo kut kwa kwb kwn kws kya kyq kzy lac lah lal lan lao lar lgu lic lis lui luo mae mai maj mak mal mam man mao mau maw mbi mcd mch mco mde mdl mdm mer mgg mgi mhu mie mir mkg mkj mkl mlk mme mmn mnd mni mnm mno mns mnt mny moe mog mok mon mos mov mpa mpo mrd mrh mri mrl mro mrq mrr mrt mru mrw msq mss mun mur mus mut mwb mxc mxj mxo mxp myi nab nah naj nak nal nar nav nax nbr nca ncm ndj ndo ndr ndy neh nev nez nga ngd ngi ngj ngk ngu ngw nha nhh nhm nht nia nif niu nkk nne nsg nti ntu nue nug nun nyi nyk nyn nyr nyu oir oji oks omi ono ood oss otm pai pal pan par pba pip pkn plg pnn pno pnu poh pol por ppi pul pun pur qim qui qum raw res rik rom rov rpa ruk rus rwa sam sap scr sed see ses shl shp shu sid sil sir sis skw slb slo sml sna sng snn sno so sob som son spa squ src srd sre ssa sta sti stl sud sue sun svs taf tag tah tak tam tau taw tbo tbx tce tee ten tep tes tgh tgk tgo tha tho thy tim tin tiw tke tkl tla tli tmm tmr tng tnn tno tny tol tou tpa tpn tri trr tsg tsn ttn ttu tuk tus tvl twe tzo tzu udh ukr uli una ung urd url uru usa vai vie wag wah wak wal wam war wed wel wem wic wik wlm wlw wmu wol wor wrb wrd wrg wrl wsk xam xar xbi xns yag yap yaq yei yi yid yin yiw ylm yng yok yor yuc yur yuw ywl ywr zai zar zqo zqs zzo,525,76475,0.0068649887
121A,Comparative Constructions,,121,Leon Stassen. 2013. Comparative Constructions. In: Dryer; Matthew S. & Haspelmath; Martin (eds.) 2013. The World Atlas of Language Structures Online. Leipzig: Max Planck Institute for Evolutionary Anthropology. (Available online at https://wals.info/chapter/121),3,abi apl arp biu eka gum hix jab klw kob koi kyp lkt mao mbo men mis mtu mxa myi nug pau prh ptp sam shk sik urk war wrk yag yav yin,34,76475,0.00044458974
125A,Purpose Clauses,,125,Sonia Cristofaro. 2013. Purpose Clauses. In: Dryer; Matthew S. & Haspelmath; Martin (eds.) 2013. The World Atlas of Language Structures Online. Leipzig: Max Planck Institute for Evolutionary Anthropology. (Available online at https://wals.info/chapter/125),1,ace ain arp bkr cle dre fij gua hmo ind juh kay kho klv kmu kor lkt lnd mal may mku mnd mxc nun pai saw sla sml som tab tin tpi vie war wma yaq yor,38,76475,0.0004968944
144I,SNegVO Order,,144,Matthew S. Dryer. 2013. Position of Negative Morpheme With Respect to Subject; Object; and Verb. In: Dryer; Matthew S. & Haspelmath; Martin (eds.) 2013. The World Atlas of Language Structures Online. Leipzig: Max Planck Institute for Evolutionary Anthropology. (Available online at https://wals.info/chapter/144),1,acg agh alb apu arg arj arm aro asy au bae bai bar bch bii bkr bni bnn bra brf bul bvi cai cmy cnt dga dgb dsh dua ebi eng est fin fon fut gok grk hak heb hmo htc huc hun iaa ice ind ita juh kan kch kfe khm khs kir kni kom kos ksn kwa kzy lan lao lic luo mae mau mcd mhu mnd mok mon mos mro mrt mus mut nak nal ncm ndy neh ngu nhm nne nor nun pal pau plg poh pol por pul rom rus sap sed shl sir sis slo sob spa srd sre ssa sti sun swe taf tee tgk tha tin tiw tmm tmr ttn tzu ukr uli url vie wal wch wlf wol xar xbi yin yng yor zqs,134,76475,0.0017522066
82A,Order of Subject and Verb,,82,Matthew S. Dryer. 2013. Order of Subject and Verb. In: Dryer; Matthew S. & Haspelmath; Martin (eds.) 2013. The World Atlas of Language Structures Online. Leipzig: Max Planck Institute for Evolutionary Anthropology. (Available online at https://wals.info/chapter/82),2,agc agd als ami amr ams anj ann asu ata baq bco bfg bkl bma bre bto cak cba ccm ceb cem cha chj chq chx ckl cle cmx cmy coe coo cor cos cpl cso cub cya cyv did dom esm fij gae gel gjj goa grf gto gud haw hdi hei hil hix hlu hoa htc hve iaa ifu ign ik ilo iri ixi jak kam kbl kdz kje kkt kls klv kmj kpm krb kri kro ktm kuo kut kyq lgu lil lmg maa maj mak mal mam mao map mch mcv mmn mnt mov mrl mrq msq mwb mxc mxj mxo mxp mxy mzc nan nca ndr ngr nhh nhm nia nif niu nnc nsg nuu oji ond ood otm pai pau pga pip pkt pnn pnx pod qui qum rap rov ruk sal sam seb see sel shp shu sim smp so squ tag tah tai tat tbo tee ten tep tes tho tim tir tke tlp tna tng tpn tps tri tsg tsi tsk tsr tuk tvl tzo urn war wec wel wem wlo wrb wth wya yag yap yok ywr zai zap zqc zqo zya zzo,194,76475,0.0025367767
71A,The Prohibitive,,71,Johan van der Auwera; Ludo Lejeune (Valentin Goussev). 2013. The Prohibitive. In: Dryer; Matthew S. & Haspelmath; Martin (eds.) 2013. The World Atlas of Language Structures Online. Leipzig: Max Planck Institute for Evolutionary Anthropology. (Available online at https://wals.info/chapter/71),2,ace aco aga agu ain alb anu ao arg ark arm arp ava aym bae baf baj baw bej bkr brm ceb cha chc chr chv cnt cre crg csh egn emb emc epe ewe fij fin fua fue fur gim gll gmz goj gum haw hay hin hmi hmo hun ijo ika ind ing iqu iri irq jar jpn juh kam kas kdw kei ket kha khk khm kho klv kmk kmu knm kok kon kor krb krn kty kuv kwr kyl lad lak lim lon lot mac mam may mbb mbo mby mde mdg mdk mdn mik mku mnd mns moe mok mrd msl mul mxc mxy myi mym nad nbd nbm nca nel nko nma nnn ntn nub nug nun nya oix ond orh otm pan pau pba pip plh pno prk pta pur qim rav rka sap saw sel sem shb shl slb sml snm snt sou sup sus tab tag tau tel tha thk tin tke tms tno tsi ttn tuv url vag vie war wau wel wlf wll wlo wrk yap yid ykm yko zun,182,76475,0.0023798626
88A,Order of Demonstrative and Noun,,88,Matthew S. Dryer. 2013. Order of Demonstrative and Noun. In: Dryer; Matthew S. & Haspelmath; Martin (eds.) 2013. The World Atlas of Language Structures Online. Leipzig: Max Planck Institute for Evolutionary Anthropology. (Available online at https://wals.info/chapter/88),2,aab aar aba abu ace acn adg adi adz aeg agb agh agm agt ajg akh akn alk all aln aly ama ame aml amo amp amq amx anc ane ang anj ano ao aoj api aro ata au avk avo awe awi ayw baa bab bag bai baj bak bas baw bbu bch bco bdu bdw bfi bgr bgs bid bik bin bir bka bkr ble blx blz bmb bni bol bra bre brf bri brp bry bse bsh bsi bsq bto bud bug buj bum buu bvi bwc ccm cct cem chh chj chr cic cle cme cnl coe cpl crn cro cso cya dag dan day ddj dds deg dga dgb dgo dha did die dim dio dma dng dni dok don dre dum dun edo efi ega egn eno erk err ewe ewo fas fij foe fon fua fut fye gae gbb gbs gel gim gla gln gmw gmz gnd gnn goa goe gok grb grf gug gul gwa gwo hal ham han hat heb hem hid hmo hna hnd hoa huc hya iaa iau iba ido ifm igb ige ila ind inn iri irq irr isa izi jab jak jar jmo jms juh juk kad kan kar kau kba kbw kch kel ken ker kfe kgr khd khm khn kik kir kis kkv klq klv kmb kmj kmo kmp kmu kmw kmz knc kni knk knm knr knz kob koe kom kon kos kpe kpw kqq krb kro krr kse ksg ksn kta ktc kte ktl ktu kuu kwa kwn kwy kyk kyl kyo laa lab lah lal lan lao lda ldo leb lel len les let lew lgi lgt lgu lho lic lis llm lmh lmp lnd lon lot lou lug luo luv luy mab mad mae maj mar maw may mbe mbi mbl mbm mbr mby mda mde mdg mdo mdw mea mei mey mgo mgq mgu min mka mkj mkq mku mkz mlg mlk mlm mlu mmb mmv mng mnm mnt mnz mof mok mon mor mou mpa mpo mpt mpu mrg mrl mro msm msn mtb mud mum mup mus mwo mxc mxe mxj mxo mxy myg myn nab nak nal nam nar nbr ncm ndb nde ndi ndo ndr ndt ndu ndy neh ney ngb ngg ngk ngm ngo ngt ngu ngz nia nif nke nkn nko nnd nne nng non noo nsg ntj nua nue nun nup nus nyi nym nza obg obo olo ora orh ori oro orw ory otr pat pit plg plh pnu poh pok prh psw pul qia rag rap ras rga rny ron rot rov rum run sah sak san sea sed see sem ser ses sgb sgu shn sht sim sio sis sko sku sle slp sml so sob son sre sro sti sud sue sul sun swa tab taf tai tak tat tbo tbt tbu tdr ten teo ter tes tet tgh tgk tgn tgo tha thy tib tid tik tim tin tiv tja tke tlo tlp tmm tmn tmo tmr tna tne tng tnk tno toz tpr trb tri tsi tsk ttd tte ttn tuk tvl uld uli ung url urt usa vai vie vif vnm wah wal war wat wch wel wlf wma wmu wn woi wol wom wsk wwa xar xbi xoo yal yao yap yay yel yi yim yiw yns yor yul yus zag zai zap zar zya zzo,562,76475,0.0073488066
144J,SVNegO Order,,144,Matthew S. Dryer. 2013. Position of Negative Morpheme With Respect to Subject; Object; and Verb. In: Dryer; Matthew S. & Haspelmath; Martin (eds.) 2013. The World Atlas of Language Structures Online. Leipzig: Max Planck Institute for Evolutionary Anthropology. (Available online at https://wals.info/chapter/144),7,aab abi abu acg acm adz aja akn alb alk aln amq anc ane apu arg arj arm aro arp arq asy au bab bae bag bai bak bar bbl bch ber bgo bgr bia bik bir bka bkr bku blz bmb bni bnn bob bol bra brf bsh btk bud bug bul bum buy bvi bwc cai cga chr chw cic cmy cnt coc cze deg dga dgb dgo dre dua duk dut ebi ega egn eng eno erk err est ewe fin fon fut fye gbb gbs ger gku gla goe gok grk gud gul gwa gwo hak hat hau heb heh hmo hna hnd hol htc huc hun hve hya iaa iba ige igs ila ind iqu irr ita jab jar jmo juh juk kad kan kar kba kbw kby kch kdw kel ken ker kfe kga khm khn khs kik kil kin kir kis kkv klv kmu kni knk kom kos kpw kre ksg ksn ktc kwa kwn kwy kyl kzy laa lab lac lag lan lao lat lbu ldo ldu leb leg lel let lgi lgt lic lin lit llm lmh lmp lnd lon lou luc lug luo luv ma mad mae maj mao mas mau may mbm mbr mby mcd mcv mda mdg mdo mea meh mgk mgu mhu mie mkd mlu mmb mmv mnd moe mok mon moo mor mos mou mpu mrg mro mrq mrt msk mua mum mup mus mut mwe myg nad nak nal nbm ncm ndo ndu ndy neh ngd ngm ngu ngw ngz nhm nht nkn nko nne non nto nua nun nup nza obg obo ocu olo one paa pal pat per pga pkn plg plh pms png pnu poh pol por pre psw pul pur rim rny rom ron rru rus sak sal san sap scr sed ses sgb sgl sgu shl shm shn sht sio sir sis slo sno sob son spa srd sre ssa sti sud sul sun swa tab taf tal tbw tee ten tep ter tes tet tgk tha tid tin tiv tiw tki tla tmm tmn tmr tob toz tpr ttn twn tzu ukr uld uli url urt ven vie wal wma wol wrm xam xar xbi xho yao yin yng yor zqs,373,76475,0.004877411
144B,Position of negative words relative to beginning and end of clause and with respect to adjacency to verb,,144,Matthew S. Dryer. 2013. Position of Negative Morpheme With Respect to Subject; Object; and Verb. In: Dryer; Matthew S. & Haspelmath; Martin (eds.) 2013. The World Atlas of Language Structures Online. Leipzig: Max Planck Institute for Evolutionary Anthropology. (Available online at https://wals.info/chapter/144),3,acg aeg agc agd ain akh ala alb als ams anj ann any arg arj aro arp asy ata awa awp baa bae bai baq bar bch bco bfg bho bil bkr bmb bni bnn bra brf bsq bto bul bvi cah cea cem cha chc chj chq chr chx ckl cle cmy cnt cos cre crn cso ctl cya dag dga dgb did dji dmk dom doy dre dua dyi ebi eng est eve fij fin fon fut gae gap gds gel geo gmw gnb goa gok goo grf grk guj guu hak hau haw hay heb hei hil hin hlu hmo hoa hop htc huc hun hup iaa idn ifu ign ik ind iri ita izi jak juh kan kch kdz ket kfe khm khs kir kkt kls kmj kmw knc kni knn kom kor kos krb ksn kty kuo kut kwa kyq kzy lah lan lao lgu lic lis maa mae mai mak mal mam mau mcd mch mgg mgi mhu mkj mmn mnd mnm mns mok mon mov mpa mrl mro mrt mru msq mun mur mus mut mwb mwo mxc mxj mxo mxp myi nab naj nak nal nar nca ncm ndr ndy neh nga ngu nhh nhm nia nif niu nke nne nsg ntu nug nun nyi oji oks ond ood otm pai pal pan pip pkt plg plh pnn poh pol por pul qui qum rap raw rom rov ruk rus sam sap sed see shl shp shu sid sil sir sis slo sml sna sng so sob som spa squ srd sre ssa sti stl stn sun taf tag tah tak tam tau tbo tbt tee tgk tha tho thu thy tim tin tiw tke tli tmm tmr tng tpn tri trm tsg tsk ttn ttu tuk tus tvl tzo tzu udh ukr uli una ung urd url urt usa vie wag wak wal war wch wel wem wlf wol wrb wrd wrk wsk wya xar xbi yag yap yid yin yng yok yor yur zai zqc zqo zqs zzo,339,76475,0.004432821
144A,Position of Negative Word With Respect to Subject; Object; and Verb,,144,Matthew S. Dryer. 2013. Position of Negative Morpheme With Respect to Subject; Object; and Verb. In: Dryer; Matthew S. & Haspelmath; Martin (eds.) 2013. The World Atlas of Language Structures Online. Leipzig: Max Planck Institute for Evolutionary Anthropology. (Available online at https://wals.info/chapter/144),2,acg alb arg arj aro bae bai bar bni bnn bra brf bul bvi cmy cnt dga dgb dua ebi eng est fin fon fut gok hak heb hmo htc huc hun iaa ind ita juh kan kch kfe khm khs kir kni kom kos ksn kwa kzy lan lao lic mae mau mcd mhu mnd mok mon mro mrt mus mut nak nal ncm ndy neh ngu nhm nne nun pal plg poh pol por pul rom rus sap sed shl sir sis slo sob spa srd sre ssa sti sun taf tgk tha tiw tmm tmr ttn ukr uli url vie wal wol xar xbi yin yng yor zqs,112,76475,0.001464531
96A,Relationship between the Order of Object and Verb and the Order of Relative Clause and Noun,,96,Matthew S. Dryer. 2013. Relationship between the Order of Object and Verb and the Order of Relative Clause and Noun. In: Dryer; Matthew S. & Haspelmath; Martin (eds.) 2013. The World Atlas of Language Structures Online. Leipzig: Max Planck Institute for Evolutionary Anthropology. (Available online at https://wals.info/chapter/96),4,abi abu acg acl adi adz aeg alb alk aml amo amq amr anc anj anu aoj arg arj aro arq asy bab bag baj baq bar bbl bbu bco ber bfg bgr bid bii bik bir bka bkr bku bma bmb bni bob bre brf brn bsh btk bto bud bug bul bum buu bvi bwc cak cax ccm ceb cem cha chj chq chr chw cic cle cmy cop cor cpl crn cso ctl cya cze day deg did dio dom doy dre dsh duk egn eng eno erk err est ewe ewo fij fin fni fon fre fua fut fye gae gbb gel gmz gnb gnd gok grb grf grk gud gul hal hat hau haw hdi heb hei hmo hna hnd hoa hol htc huc hve hya iaa iba ice ifu igb ign igs ik ila ind iri ita izi jab jak jmo juh juk kam kan kar kau kbl kbw kch kel ken ker kfe kgr khm khs kik kir kje kkt klv kmj kni knk koe kos kpm kpw krb kre kri kro ksg ktc kte ktl kuo kwn kyl kyq lab lan lao lat lbu leg lel len let lew lgu lit lmg lmh lmp lmu lnd lon luo luv maa maj mal mam mao mas mau may mbm mbr mby mcv mdg mdo mds mea mee meh mga mgo mgu miy mlg mlu mmb mmn mng mof mok mos mpr mpu mrg mrl mro mrq msk msm mum mup mur mus mut mwo mxc mxe mxo mxp mxy myg myn nal nan ncm ndo ndr ndt ndy neh ngm ngo ngz nhh nhm nht nia nif niu nkn nko non noo nor nua nun nup nza obg obo oji olo ood otm paa pai pal pat per pga pip pkt plg plh pms pod poh pol por pre psw pul pur qum rag rap rny rom ron rot rov rsu rus rwe sah sak sam san sea sed see ses sgb sgu shn sht sio sir sis sle sml so sob spa srd sre sud sul sun swa swe swt tab taf tag tah tai tat tbo tee ten teo tep ter tes tgk tgn tha tid tim tin tiw tke tla tlp tmm tmr tna tne tng tnk tno toz tpn tri trm tsi tsk ttd ttn txj tzu ukr uld uli url urt vie vnm wal war wch wel wlf wlo wma wol xbi xho xoo yag yap yor yul zai zch zhn zul zzo,416,76475,0.005439686
15A,Weight-Sensitive Stress,,15,Rob Goedemans; Harry van der Hulst. 2013. Weight-Sensitive Stress. In: Dryer; Matthew S. & Haspelmath; Martin (eds.) 2013. The World Atlas of Language Structures Online. Leipzig: Max Planck Institute for Evolutionary Anthropology. (Available online at https://wals.info/chapter/15),8,ace acg agt aln alw aly ana ara aro arp asm atb awe awt aym bae bag bal baw bbm bbw bdm ben bik bim blk bma bnl bnt bqb bql bqn bqo bqr bqs bre bsk bto bua bug buu cah cav chk cmn cnl cpn cre crn cup cya cyv cze daa dak dio diy dji dni dob dou dre dri dyi eno ese est far fin frd gae geo gid gll glp goo grk grr grw gua gug guu haw heb hln hmu hnn hun iaa ice ind ing iri irr jak jaq jum kal kam kap kaw kay kei kfe kgu khm khs kjn kjo kli klp kmu kob kon koo koy krl ksr kut kwa kya lan lat lav len liv lje lla lmp lrk luv mac mae mal map mar mau may mbb mcd mgd min mis mks mku mms mnj mns mnt mnx mny moh mrd mrt mta myi myn myy naj nbb nbo ngl ngr nht nia nin niv nju nkb nmb nne npu nsy ntu nua nug olm ond ono orc pad pag pai pau pin pir pit pkm pkn plh plp pme pms pna pol ppi prs pur put qay qch qim que rap rit rnr rti sah sbg sed sgr shi skl slp sly sml snm sno squ srb sro sto sup svk swa tab tac tag taj tas taw tbb tbr teh tgk thp tiw tla tld tmc tor trd tru try tsa tse tsi tua tuk tun tzo uhi uma urk uzn vot wah wan wao war wbn wch wel wer wet wlm wnb wra wrd wrl yaq yel yim yir ymd yny ywl zqc zul zun,281,76475,0.0036744033
33A,Coding of Nominal Plurality,,33,Matthew S. Dryer. 2013. Coding of Nominal Plurality. In: Dryer; Matthew S. & Haspelmath; Martin (eds.) 2013. The World Atlas of Language Structures Online. Leipzig: Max Planck Institute for Evolutionary Anthropology. (Available online at https://wals.info/chapter/33),2,abi abk abn acg aco agt ain alb ale aln amh amx any ao apu ara arc arm arp arw asm ath ava avo awa awe awp awt aym aze azi baa bae bam baq bar bdm bej bgn bho bid big bkb bla bln blt bmz bnu bod bre brh bri brn brs bsk bti bud bul bun bur but bya cah cai cam car cas cax cde chb chc chg chk chn chs chv chx ckl cld cln cmh cmn cmy coc cpy cqt cre crn cro crp ctm cup cze des deu dgb dgo dhr dhw did dji djn dmk dms dom doy drg dsh dut eip emb ene eng est eve evn fin for fre fua ful ga gah gal gam gds geo ger ggu gil gim gmw gnd goa god gon grb grf grk grw gud guh gum guu gyc hai hau hay hdi heb hhu hid hin hlp hma hmi ho hop htc hui hum hun hzb ice idn ign igs ijo ik ina ing inn irq ita ite ito jaq jeb jiv jlu jpn jug jva kab kac kai kbu kdw kem ket kew kfe kgz khg khi khl kho kie kio kir kiw kkp kku kla klw kma kmh kmk kmo kms knd kni knk knn knr knw kob kok kol kop kor koy kpe krc krd kri krk krn krw kry kta kty kum kuv kws kwt kxo kyq lad lah lan lar lat lav ldu lec lel les lez lit lmg lmn lng lug lui lul lun luo ma maa mab mac mag maj man mas mba mbr mcv mde mdn mea mee meh men mer mgh mgq mgu mij miy mkg mkh mkr mlg mme mmi mnc mnd mne mno mns mny moe mog mor mos mot mou mpr mpt mrl mrt msl mss mts mtt mui mun mur mut muu myi mzn nab nag naj nan nar nav nbd nbr ndt nep ngi ngj ngm ngz nha nhh nhn nht niv nkb noc nog nor nrg ntu nua oir oji oks olo one ong ord ork oss oya paa pae pan pdp pga pia pip plh plk pme pol por prk prs psh psm pso ptt ptw pur pwn qhu qim ras rem res rgc rit rny rom run rus rut rwe sal sav scr sdw seb sec ser sgb shd shk shl sho shp sht shy sid sil sin siu skp sla slb slo slp smn sna sno so sob som sor spa spi src srd sta stl sug suk sup swe taj tao tar tbu tel ten tep thk thn tic tig tir tiw tkl tlf tli tma tmc tml tnc tny tob ton tou tpt trb trm trr trw tsh tsz tts ttu tuc tul tun tur tuv tvo twn tzo uby udi udm ukr urd urk urn usr ute uyg uzb wak wal wao wap wau wbn wch wel wik wly wra wrd wrk wrl xas xoo yag yam yaq yar ycn yim yin yko ykt yok ypk ytu yuk yuw ywl zay zpr zqc zun,513,76475,0.0067080744
