parameter_id,parameter_name,parameter_description,chapter_id,chapter_citation,value,same_value_language_ids,value_language_count,language_count_total,count_ratio
143G,Minor morphological means of signaling negation,,143,Matthew S. Dryer. 2013. Order of Negative Morpheme and Verb. In: Dryer; Matthew S. & Haspelmath; Martin (eds.) 2013. The World Atlas of Language Structures Online. Leipzig: Max Planck Institute for Evolutionary Anthropology. (Available online at https://wals.info/chapter/143),4,aab aar aba abi abk abn abu abv ace acg acl acm aco acu adg adi adz aeg agb agc agd agh agm ain aja ajg akh akn ala alb alk all aln als alw aly amb amc ame amh aml amn amo amp amq amr ams amt amx ana anc ane ang ani anj ann anu any ao aoj apl apt apu apw ara arc arg arj arm aro arp arq arw asm ass asu asy ata ath au ava awa awe awp awt aym aze azi baa bab bac bae baf bag bai baj bak bam bao baq bar bas baw bbf bbl bbu bbw bch bco bdm bej bel ben ber bfg bgn bgo bgr bho bia bid big bii bik bil bio bir biu bka bkr bku bla bln blr blt blx blz bmb bmz bni bnn bnu boa bob bod boi boj bok bol bra bre brf brh bri brl brm brn brp brr brs bsh bsk bsq bti btk bto bua bud bug bul bum bun bur bus but buw buy bvi bwc bya bzi cah cai cak cam can car cas cax cay cba cbo ccm cct cde cea cem cga cha chb chc chd che chg chh chi chj chk chn chp chq chr chs chv chw chx cic ckl cle cln cmh cml cmn cmr cmy cnl cnm cnt coa coc coo cop cos cpl cpn cpy cqt cre crn crp crt cso cti ctl ctm cub cui cup cya cyv cze dag dan dds des deu dga dgb dgo dgr dha dhi dhm dhw did die dig dim din dio diy dja dji djm djn djp dma dmi dmk dms dni dom dre drm dsh dua duk dul dum dun dut dyi ebi efi ega eip eka eko emb eme ene eng eno eny epe erk err ese est eud eve evn ewe fij fin fon fre fua ful fur fut fye ga gaa gae gah gal gap gar gav gbb gbs gds gel geo ger ggu ghr gim gir giz gjj gku gla gln gmw gmz gnb goa god goe gok gon goo grb grf grj grk grr grs grw gua gud gug guh guj gul gur guu gwa gwo gyc hai hak hal ham han har hat hau haw hay hdi heb heh hei hid hil hin hix hlp hlu hma hmi hmo hna hnd hoa hol hop hpd htc hua huc hui hum hun hup hve hya hzb iaa iau iba ice idn ido idu ifm ifu ige ign igs ijo ik ika ila imo ina ind ing inn iqu iri irq irr irx isa ita ite iwm izi jab jak jaq jar jeb jiv jlu jmo jms jng joh jpn juh juk kaa kab kac kad kae kan kar kas kau kay kba kbl kbo kbw kby kch kdw kdz kel kem ken ker ket kew kfe kga kgr kgy kha khd khg khl khm khn kho khr khs kie kik kil kim kin kio kir kiw kkp kkt kkv kla klg kll klm kls klv klw kma kmb kmh kmi kmj kmk kmn kmo kmp kmr kms kmu kmw kmz knb knc knd kng kni knk knm knn knr knw knz koa kob koe koi kok kol kom kon kop kor kos koy kpw krb krc krd kre krh kri krj krk krn kro krr krw kry ksa kse ksg ksn kta ktc kti ktl kty kum kun kuo kus kut kuv kwa kwb kwn kwo kws kwt kwy kwz kxo kya kyl kyp kyq kyr kyz kzy laa lab lac lad lag lah lai lal lan lao lar lat lav lbu lda ldo ldu leb lec leg lel len lep les let lew lez lgi lgt lgu lho lic lim lin lis lit lkt llm lmg lmh lmn lmp lmu lnd lng lon lot lou luc lug lui luo luv ma maa mab mac mad mae mag mai maj mak mal mam man mao map mar mas mau maw may mba mbe mbi mbl mbm mbr mbt mby mcd mch mco mcv mda mde mdg mdl mdm mdn mdo mdw mea mee meh mei mek men mer mga mgg mgi mgk mgu mhi mhl mhu mie mig mii mik min mir mis miy miz mka mkd mke mkg mkh mki mkj mkl mku mkz mlg mlk mlu mmb mme mmn mmv mmw mnc mnd mne mni mnm mno mns mnt mny moe mog moh mok mom mon moo mor mos mot mou mov mpa mpo mpt mpu mra mrd mrg mrh mri mrl mro mrq mrr mrs mrt mru mrw msc msg msk msl msm msn msq mss mtb mts mtu mua mug mui mum mun mup mur mus mut mwb mwe mwo mxc mxe mxj mxo mxp mxx myg myi mym mzc nab nad nag nah naj nak nal nam nan nar nas nav nax nbd nbm nbr nca ncm ndb nde ndj ndo ndr ndt ndu ndy neh nep nev new nez nga ngd ngi ngj ngk ngl ngm ngn ngo ngt ngu ngw ngz nha nhh nhm nht nia nif nis niu niv nke nkk nkn nko nku nma nmb nmm nne nnk noc non noo nor nph nrg nse nsg nsn nti ntj nto ntu nua nue nug nun nup nyh nyi nyk nym nyn nyr nyu nza nze obg obo ocu oir oji oks olo omh omi ond one ong ono ood ori ork oro orw osa oss otm otr oya paa pae pai pal pan par pat pau paw pba pec per pga pia pip pis pit pkn pkt plg plh pme pms png pnn pno pnu pod pog poh pol por ppi pra pre prh prk prs psh psj psm pso psw ptt ptw pul pum pun pur pwn qaw qhu qia qim qui qum rag ram rao rap ras raw rem res ret rgc rik rim rit rnd rny rom ron rot rov rpa rru rsu ruk rum run rus rwa rwe sah sak sal sam san sap sar saw sba scr sdw sed see sel sem ser ses sgb sgl sgu shb she shh shi shk shl shm shn shp sht shu shy sia sid sil sin sio sir sis siu skk skm skw sla slb slo sme sml smn sna sng snm snn sno snt so sob sod som son sor spa squ srb src srd sre sro ssa sta sti stl stn sub sud sue sug sul sun sup svs swa swe swt syu tab tac taf tag tah taj tak tal tam tan tao tar tas tau taw tba tbo tbt tbu tbw tbx tce tdr tee tel ten teo tep ter tes tet tgh tgk tgl tgo tgr tha thn tho thu thy tib tid tig tim tin tir tis tiv tiw tja tke tki tkl tla tli tlo tlp tma tml tmm tmn tmo tmr tna tnc tne tng tnn tno tny tob tod tol ton tou toz tpa tpn tpr tpt trb tri trm trr tru tsf tsg tsh tsi tsn tsz tte ttn tts ttu tuc tuk tul tun tur tus tuv tuy tvl twe twn tye tzo tzu uby udh udi udm ukr uld uli una ung urd urk url urn urt uru usa usr ute uyg uzb vai ven vie vnm wag wah wai wak wal wam wao wap war was wat wau way wbn wch wec wed wel wem wic wik win wiy wlf wlm wlw wly wma wme wmu wna woi wol wom wor wra wrb wrd wrg wrk wrl wrm wrn wsk wtm wya xam xar xav xbi xho xns yag yam yao yap yaq yar ybi yei ygr yi yid yim yin yiw yko ykt ylm yng yok yor ypk yqy yrm yrr ytu yuc yuk yul yur yuw ywl ywr zag zai zan zap zar zay zaz zch zpr zqc zqo zqs zul zun zzo,1315,76475,0.017195161
97A,Relationship between the Order of Object and Verb and the Order of Adjective and Noun,,97,Matthew S. Dryer. 2013. Relationship between the Order of Object and Verb and the Order of Adjective and Noun. In: Dryer; Matthew S. & Haspelmath; Martin (eds.) 2013. The World Atlas of Language Structures Online. Leipzig: Max Planck Institute for Evolutionary Anthropology. (Available online at https://wals.info/chapter/97),4,aab abu acg acl adi adz aeg agb agh akn alb alk aln ama aml amo amq amr ams anc ane anj anu aoj arg arj aro arq asy au ayi ayo ayw bab bae baf bag baj baq bar bas bbl bch bdu ber bfg bia bid bik bir bkr bku ble blu blz bma bni bnk bnn bra bre brf brn bsh bto bub bud bum buu bvi bwc cax ccm cem cga chq chr chw cic cle cme coc cop cor cpl crn cso ctl cya day dga dgb did dio dma don doy dre dua duk ega egn eno erk err ewe ewo fij fni fon fre fua fut fye ga gae gel gjj gla gnd goa goe grb grf grr gto gua gul guw hal hat haw hdi heb heh hem hmo hna hnd hoa hol huc hya iba ifm igb ige igs ik ila ind iqu iri irr ita jab jar jmo juh juk kam kar kau kba kbl kbw kby kch kdz kel ker kfe kga kgr khm khs kik kin kir kje kkt kkv klv kmj kmu koe kom kon kos kpw krb kri kro ksg ksn ktc kte ktl kuo kwa kwn kwy kyl laa lab lag lan lao lbu ldo leb lel len let lew lgi lgu lic lin llm lmg lmh lmp lon lou luc luo luv maa mae mal mao mas may mba mbe mbi mbl mbm mbr mbt mby mda mdg mds mdw mea mee meh mga mgk mgo mgu mie miy mkd mkz mla mlg mlm mlu mmb mmv mng mof mok mon moo mor mpo mpr mpu mrg mrl mro mrq mrt msk msm mtb mua mum mup mur mwe mwo mxc mxe mxj mxo mxp mxy myn mzc nak nal nan nau ncm ndb ndi ndo ndr ndt ndu neh ngd ngm ngo ngu ngz nhh nhm nht nia nif niu nkn nko nnc non noo nse nto nua nun nup nym olo otr pai pam pat per pga pkt plg plh plk pms png pnu poh por pre psw pul pur rag rap rga rny rom rot rov rru rsu sah sak sam sap sea seb sed ses sgb sgu shl shm shn sht sim sio sis sku sle sml so sob spa srd sre sti sud sul sun swa tab taf tah tat tbo tbw ten teo ter tes tgk tgn tha tia tid tim tlp tmm tmn tmr tna tne tng tnk tno toz tpr tps tri tsg tsk ttd ttn tuk tum uld uli ura url urt ven vie vnm wal wch wel wlf wlo wma wol wrk wrm wth xam xbi xho xoo yag yao yap yay yor yul zai zap zul zya zzo,456,76475,0.0059627327
51A,Position of Case Affixes,,51,Matthew S. Dryer. 2013. Position of Case Affixes. In: Dryer; Matthew S. & Haspelmath; Martin (eds.) 2013. The World Atlas of Language Structures Online. Leipzig: Max Planck Institute for Evolutionary Anthropology. (Available online at https://wals.info/chapter/51),9,abi abk abu abv ace acg acl adg adi aeg agc ain ajg akh akn aln amc ame aml amr anc ang anj anu any aoj api apl apt ara arg arp asm ata au bab bag bai bar baw bco bdu bgo bik bil bir bka bkl bkr bmb bnn bri brp bto bud bul bwc car cba cbo ccm cde cem chq chr chs cle cmy cnl cnm cnt crn cro cya dan day dio doy dre drm duk dum dut egn eng ese ewe ewo fij fri fut gaa gbb gbs git gln gmw gmz goe gok grb gua gud gul hal har hat hau haw hix hmo hna hoa htc hve iaa iba ind irq irr irx ita izi jak jin jmo jng juh juk kaa kar kbw kch kdz kel kfe khm kho khs kis kkt kkv kkw klq klv kmb kmj kmn kmu kmz kni knk kob koe kom kon kos krb krd kre kri krr kse ksg ktc ktl kuo kut kyl laf lah lai lal lan lao lar ldu lel len lep lew lgt lgu lis lkt llm lmg lmh lmp lnd lon lug luo mad mae mak mam man mao mau mbm mbt mcv mde mdg mds mea meh mek mga mgu mie min miy mka mkj mku mlg mlu mmn mnd mng mok mon mou mpr mrg mru msk mtu mum mun mup mwb mxc mxj mxo mxp nak nav nca ndy nev ngd ngz nht niu nko nmb noo nsg nti nua nun nup nwd nza nze obg obo olo ood oro osa paa pai pal pam paw per pga pip plh plk pms pnu poh pok por prs psw pum qum ram rap ras raw rot ruk rum run saa sah sam san sed ser sht sil sim sio sis sla slb sml snt sob som son spa src sti sul sun sup swe syu tab tac tah taj taw tbo tbu teo ter tgh tgk tgr tha tia tid tim tin tir tiw tla tmg tnc tng tnn tob tot trb tri tte ttn tuk tvl tzu uld uli una urd url urn urt vai vie wal war wch wel wlf wlo wma wog wol wsk xar xas xav yap yor yul zai zhn zzo,379,76475,0.004955868
92A,Position of Polar Question Particles,,92,Matthew S. Dryer. 2013. Position of Polar Question Particles. In: Dryer; Matthew S. & Haspelmath; Martin (eds.) 2013. The World Atlas of Language Structures Online. Leipzig: Max Planck Institute for Evolutionary Anthropology. (Available online at https://wals.info/chapter/92),6,aar abk acu adz aga ala alk aml ana ang ano apl apu apw ara arc arg arm arw ass ath azi bae baf bao bco bdm bej bgz bii bik bil biu bla ble bln blt bmb bod brm brn brs bsh bti bum bur cah cai can car cba chc chi chk chv cml cmy coa cpl cpy crp ctl cub cup cze des deu dha die dim din dio diy djm dlm dni dsh dut eip emb ene eng eno epe erk fas fij foe fri ful gae gah gal gar gdb gds geo ger ghb gim gln gmw gmz gnb grj grw guj gum gyc hay hix hmi hoa hpd htc hua hya hzb idu igb ijo ing irq irr ita ito jak jmo jug kab kae kan kay kba kbl kch kem khi kik kis kje kkp klv klw kma kmh kmk kmn kmr kmz knc kni knm knn knr knw koe kok kol kor kqq krc kro kun kuo kuu kws kwz kyk lab lad lan lbu lez lho lin lis lmh lon lot luo mab mac man mao mar mde mdn meh men mer mgg mik mku mlg mnc mne mng mni mnm mov mra mrl mrt msc msg msl mts mtt mwo mxc nab nad naj nbd ndi ndj ndr ndy nga ngd ngk ngo ngt ngz nha nht nif nmb nnd nnk noc nor nph nua nyk ora orh osa paa pae pai pal par pau paw pdp pip pme pms poh ppi prk psh pso psw ptt puq qaw qhu qia qui rem rny rom rov ruk run ryu sah sal sar sea ses shl sia sid skw sml smn sna snm spa src sta stl sud sue sul svs swe syu tab taf tai tar tbt tbw tbx tel ten teo thy tid tir tke tml tmo tni tob ton tps tsf tsi tsz tte tuc tun tuy tvl uby udh uli una usa usr uzb vnm wak wao wap war wem wly wma wol wra wrg wrk wrn wtm xbi yal yap yid yko yng yor zag zay zaz zch zqc zzo,355,76475,0.00464204
87A,Order of Adjective and Noun,,87,Matthew S. Dryer. 2013. Order of Adjective and Noun. In: Dryer; Matthew S. & Haspelmath; Martin (eds.) 2013. The World Atlas of Language Structures Online. Leipzig: Max Planck Institute for Evolutionary Anthropology. (Available online at https://wals.info/chapter/87),2,aab aar abk abn abo abu abv ace acg acl adg adi ady adz aeg agb agh agm agt ajg akh akn alb alk all aln aly ama amc ame aml amn amo amp amq amr ams amx ana anc ane ang anj ano anu any ao aoj api apl apt apu arg arj aro arq asm asy atm au awe awi awt awy ayi ayo ayw baa bab bae baf bag baj bam baq bar bas baw bbf bbl bch bdm bdu bdw bem ber bfg bfi bgm bid bik bin bir biu bkr bku ble bln blu blx blz bma bni bnk bnn bok bon bra bre brf bri brl brm brn brp brq bry bsh bsi bsq bsr bto bub bud buj bum bun bus buu bvi bwc cai cas cav cax cbo ccm cde cem cga chb chi chq chr chw cic cld cle cme cmr cnl cnm coc cop cor cpl crn cro crp cso cti ctl ctm ctw cui cup cya dag dan daw day ddj dds dga dgb dgo dha did dig dim din dio diy dji djn dma dms don doy dre dua duk dum dun dyi edo ega egn els emb eme emm eno epe erk err ese ewe ewo fas fij foe fon fre fua ful fur fut fye ga gaa gae gan gar gav gel ggu ghr gjj gku gla gln gmw gnd gnn goa goe goo grb grf grr grw gto gua gug guh gul guu guw gwa gyc hai hal ham har hat haw hdi heb heh hem hid hix hlp hma hmo hna hnd hoa hol hpd huc hup hwr hya iba idn ifm igb ige igs ik ika ila imo ina ind inn iqu iri irq irr irx isa ita jab jad jar jbt jel jin jlu jmo jms jng jrw juh juk jva kaa kae kam kar kau kba kbl kbo kbw kby kch kdz kel ker kfe kga kgr kgu kgy khd khm khs kie kik kin kir kis kje kkt kkv kll klq klv klw kma kmb kmi kmj kmn kmo kmp kmu kmw kmz knc kng knm kno knr knz koa kob koe kok kom kon kos kpe kpw kqq krb krd krh kri krk kro krr kse ksg ksn kta ktc kte ktl ktu kuo kuu kwa kwb kwm kwn kwy kwz kya kyk kyl kyn kyo kyz laa lab lad lag lal lan lao lar lav lbu lda ldo leb lel len lep les let lew lgi lgt lgu lic lin lis lkt llm lmb lmg lmh lml lmp lon lot lou luc lug lui luo luv luy maa mab mac mad mae mal man mao mar mas maw may mba mbe mbi mbl mbm mbo mbr mbt mby mda mde mdg mdl mdn mds mdw mea mee meh mek mey mga mgk mgo mgq mgu mhk mhl mie mii mij min mis miy miz mka mkd mke mkg mkj mku mkz mla mlg mlk mlm mlu mmb mmv mmw mng mnm mnv moa mof mok mon moo mor mot mou mpa mpo mpr mpt mpu mra mrg mrh mrl mro mrq mrr mrt mru msc msk msl msm msn mtb mts mtu mua mud mum mup mur mwe mwo mxa mxc mxe mxj mxo mxp mxy myi myn myr mzc nab naj nak nal nam nan nar nat nau nav nax nbd nbr ncm ndb nde ndi ndj ndo ndr ndt ndu neh ney ngd ngg ngj ngk ngl ngm ngn ngo ngt ngu ngz nhh nhm nht nia nif niu nkb nkk nkn nko nku nma nnc nnd nng nnk noc non noo nph nrg nse ntj nto nua nue nun nup nus nyh nyi nyk nym nze olo omh omi orh ori ork oro orw ory osa otr pae pai pam par pat pau per pga pia pir pit pkt plg plh plk pms png pnu pnx poh pok por ppi pre prh prs psw pul pum pun pur qia rag ral ram rao rap ras raw rga rgc rny rom rot rov rru rsu rum run rwa saa sah sak sam sap sdw sea seb sed sem sen ses sgb sgu she shi shl shm shn sht sia sil sim sio sis skk sko sku sla slb sle slp sme sml smn sng snm snn snt so sob som spa spi src srd sre srn sro sti sud sue sug sul sun sup swa syu tab taf tah taj tak tao tat tau taw tba tbl tbo tbt tbu tbw tdi tdr ten teo ter tes tgk tgn tgo tha thd thy tia tib tid tik tim tkl tlf tlp tma tmm tmn tmo tmr tna tnc tne tng tnk tnn tno tny ton toz tpr tps trb tri tsg tsk tsm ttd ttn tuk tum tun tvl uhi uld uli una ung ura urk url urn urt usa ute vaf vai ven vie vif vnm wag wah wal wap wat wbn wch wed wel wic wiy wlf wlo wma wmu wn wna wog woi wol wom wra wrd wrk wrl wrm wsk wth xam xas xbi xer xho xoo yag yal yam yao yap yay yel yi yid yiw yor yrm yuc yul zag zai zap zar zaz zul zun zya zzo,879,76475,0.011493952
112A,Negative Morphemes,,112,Matthew S. Dryer. 2013. Negative Morphemes. In: Dryer; Matthew S. & Haspelmath; Martin (eds.) 2013. The World Atlas of Language Structures Online. Leipzig: Max Planck Institute for Evolutionary Anthropology. (Available online at https://wals.info/chapter/112),2,aab abi abn aco adg adn aeg agd agh ain ajg ala alb alc alk all aln alw amb ame amq ane ani anj ann anu apu ara arg arj arp asm asy au awa aym baa bag bao baq bar bbw bdm ben bfg bgo bgr bii bik bir bka blr blx bma bmb bnn bnu brf bri bsq bto bua bud bul bum bun bwc bzi cah cai cax cea cha chc chk chp chx ckl cle cmn cmy cnl cnt coo cos cpy cre crn cso cti ctl cup cya dag dan dga dgb dgo dhr dhw diy dja dji djn djp dmk dni dsh dua duk dum dut dyi ega eip eka eng eno ese est eud ewo fre fye gaa gae gap gbb gbs gds geo ger ggu gmw gnn gok goo grf grj grk grr grs gud guh guj guu hat hau haw hay heb hil hin hna hun hup hve ice ige igs ik imo iqu iri irr isa ita iwm jab jak jaq jar jmo kaa kad kae kan kar kau kdz kel ken ker kfe kho khr kkv klm kls klv klw kmk kmz knb knc kni knn koi kor kos kre krj krr ksa kse kti kty kum kuo kut kwa kwn kwt laa lab lac lag lan lar ldu lel lgt lin lkt lmg lmn lon lui luo maa mac mad mal mam mas mau may mba mbt mby mcd mch mco mda mde mdm mdo mdw mea meh mer mga mgg mgi mgk mgu mhu mir miz mkl mku mlk mlu mmn mnd mni mnm mno mns mny moe mog moh mok mos mou mpo mpu mra mrd mrg mrh mri mrl mrt mrw msm msq mss mtb mtu mum mur mus mut mxc mxj mxo mxp myg myi nab nad nag naj nar nav nca ndj ndo neh nev nez ngi ngj ngm ngu ngw ngz nha nhh nhm nht nke nkk nnk nor nse nti nua nue nug nyi nyn nyu nza nze oji oks olo omi ond one ono ood osa oss otm paa pai pal pan par paw pba pip pkn plh pno pod poh pok pol por pul pur qim qum ram raw res rik rom rov rsu rus sah sam san scr ses sgb shl shp sht shu shy sid sim sio siu skw sla slb slo sme sml sna sng snn so sob som spa src srd sta sup swe tab tac tag tah tak tam tau taw tbo tbt tce tee ten tep ter tes tgh tho thy tid tim tiw tja tkl tli tmn tmo tmr tnn tno tny tou tpn trb trr tru tsg tsh tsk tsn ttn ttu tus tzo tzu ukr uld una ung urk urt usa wag wak wal wam wch wec wel wem wic wir wiy wlm wma wmu wom wor wrb wrd wrg wrm wry wsk wya xam xav yag yap yaq yei yid yin ylm yng yok yur yuw ywl zai zch zzo,502,76475,0.0065642367
143F,Postverbal Negative Morphemes,,143,Matthew S. Dryer. 2013. Order of Negative Morpheme and Verb. In: Dryer; Matthew S. & Haspelmath; Martin (eds.) 2013. The World Atlas of Language Structures Online. Leipzig: Max Planck Institute for Evolutionary Anthropology. (Available online at https://wals.info/chapter/143),4,abi abn ace acg acm agb agc agd ain akh akn ala alb all als alw ams amt anj ann any apu arg arj arm aro arq arw ass asy ata awa awt aym baa bac bae baf bai baj bam bao baq bar bbl bbw bch bco bdm bej ber bfg bgn bho bia bil biu bkr bku bla ble blr blz bmz bni bnn bnu bra brf bri brl brp bsh bsq btk bto bua bug bul bun bur buw bvi bwc bya cah cam cax cba ccm cea cem cga cha chb chc chd che chg chh chk chn chq chx cic ckl cle cmn cmy cnt coc coo cos cpl cpy cre crn crt cso cup cya cyv cze dag dan deg dga dgb dgr dhi dhm dhw did din diy dja dji djm djn djp dmk dre drm dua dul dyi ebi egn ene eng eno eny err est eud fij fin fon fut gaa gae gap gav gds gel geo ggu ghr gir gjj gku gmw goa gok goo grb grf grj grk grr grs gud guj gur guu gyc hak ham han haw hay heb heh hei hil hin hlu hmo hnd hoa hol hop htc hua huc hui hun hup hve hya iaa iba idn ifu ign ik ila imo ind inn iqu iri ita jak jaq jlu jng joh juh kad kae kan kba kby kch kdw kdz ket kew kfe kga kgr kgy khd khm khn khr khs kik kil kin kir kkt kla klm kls klv kmh kmi kmj kmp kms kmu kmw knb knc kni knn knz koi kom kop kor kos krb krd krj ksa kse ksn ktc kty kum kuo kut kwa kwb kwn kws kya kyq kzy lac lah lal lan lao lar lat lda ldo leb leg les let lgi lgu lic lis lit llm lmp lot luc lui luo maa mae mag mai maj mak mal mam man mao mau maw mbi mcd mch mco mcv mde mdl mdm mer mgg mgi mhu mie mir mkd mke mkg mkj mkl mlk mme mmn mmv mmw mnd mni mnm mno mns mnt mny moe mog moh mok mon mos mov mpa mpo mra mrd mrh mri mrl mro mrq mrr mrt mru mrw msq mss mua mug mun mur mus mut mwb mwe mxc mxj mxo mxp mxx myi nab nad nah naj nak nal nam nan nar nav nax nbr nca ncm nde ndj ndo ndr ndy neh nev new nez nga ngd ngi ngj ngk ngt ngu ngw nha nhh nhm nht nia nif niu nkk nkn nko nmm nne nsg nti nto ntu nue nug nun nwd nyh nyi nyk nym nyn nyr nyu obg obo ocu oir oji oks omi ond ono ood orh ori ork oss otm pai pal pan par pba pga pip pkn plg pms png pnn pno pnu poh pol por ppi pra pre prs psh psw ptt pul pun pur pwn qia qim qui qum rap ras raw rem res rgc rik rim rnd rny rom rov rpa rru ruk rus rwa sak sal sam sap scr sed see ser ses sgu she shl shm shn shp shu sid sil sir sis skw slb slo sml sna sng snn sno snt so sob sod som son sor spa squ srb src srd sre ssa sta sti stl sud sue sul sun svs swa taf tag tah taj tak tal tam tas tau taw tbo tbw tbx tce tdr tee ten tep tes tet tgh tgk tgo tgr tha thn tho thy tib tim tin tis tiw tke tki tkl tla tli tlp tmm tmr tna tng tnn tno tny tob tod tol tou toz tpa tpn tri trr tsg tsi tsk tsn ttn tts ttu tuk tus tvl twe twn tzo tzu udh udi ukr uli una ung urd url uru usa usr vai ven vie wag wah wak wal wam war wed wel wem wic wik wlm wlw wme wmu wol wor wrb wrd wrg wrl wsk wtm wya xam xar xbi xho xns yag yao yap yaq ybi yei ygr yi yid yim yin yiw yko ylm yng yok yor ytu yuc yur yuw ywl ywr zai zap zar zaz zqc zqo zqs zzo,712,76475,0.0093102325
48A,Person Marking on Adpositions,,48,Dik Bakker. 2013. Person Marking on Adpositions. In: Dryer; Matthew S. & Haspelmath; Martin (eds.) 2013. The World Atlas of Language Structures Online. Leipzig: Max Planck Institute for Evolutionary Anthropology. (Available online at https://wals.info/chapter/48),2,abi abu ace aco adz ala alb ame amu ana ani arm asm ata atk awp baa bab bam bar baw bej bkr bln brh bri brm brn bro brs bsq bya cah cap cav cax chk chr ckl cmn cmx cpn cri cub dag dga dgr dio diz don doy dre dum dut eka eng epe fre fua geo ger gmw god goo grb grk gud hai hat hin hmo hua hzb igb ika imo ind ing irq ita jpn juh kas kch ker kew kha khm kho khs kis kjo klk kmu knd knm knr kob kom kon kor kpm krk kro kse kuk kyl lad lah lak lat lel lep lez lim luv mao map mau mcr mde mei mis miz mku mlm mnd moa mrd msn mum mun nad nak nan nas nbr ndo ndy nup nyu orh oss otm pai pal par pau pit pol prh psj pso pur qaw qim rap rem rus sah sam san saw sem shk slp sml snm snt spa srm sue sun sup swa syu tab tha tid tin tiw tla tms tna tol ton tot trb tru tsi tso tuk tun tur una vie wao wap wbn wma wra xok yaq yko yor yur zan zul,209,76475,0.0027329193
86A,Order of Genitive and Noun,,86,Matthew S. Dryer. 2013. Order of Genitive and Noun. In: Dryer; Matthew S. & Haspelmath; Martin (eds.) 2013. The World Atlas of Language Structures Online. Leipzig: Max Planck Institute for Evolutionary Anthropology. (Available online at https://wals.info/chapter/86),2,abo ace acl aeg agb agc agd agh aja alb aly ami aml amr ams anc anj any aoj arg arj aro arq asy ata awe ayw bag baj bak baq bar bas bbu bch bco bdu bfg bfi bga bgo bgr bid bir bka bkr bku blr blz bma bni bnk bnn bob bol bra bre brf brn brp brq bsr btk bto bud bug bum buw bvi bwc cai cak cba ccm ceb cem cha chj chq chr chx cic cld cle cme cmx cmy cop cpl cqt crn cso ctl cya cyv day dgo did din dio dji dre dua duk dut egn eno erk err esm ewo fij fon fre fua fut fye gae gbb gbs gel ger gmz gnd goa goe gok grf grk gto gud gul gwo hal hau haw hdi heb hei hil hna hnd hoa htc hve iaa iba ice ifm ifu igb ign igs ila ind iri irq isa ita izi jak jar jeb jlu jmo juk kad kan kar kba kbl kbu kdz kel ken ker kga khm khs kik kis kkt kls kmj kmu knc knk knr koe kom kon kos kpm krb krd kre kri kro krr ktc ktl ktu kuo kut kwk kwm kwn kyo laa lac lag lan lao lar lbu lda ldo len lew lgi lgu lil lin lmb lmg lmp lmu lnd lon lou luo luv ma maa mae maj mal mam mao mas mbl mbm mbr mby mch mda mdg mdo mdw mee meh mga mgo mgq mgu min miy mla mlg mmn mng mnm mnt mnz mof mon mou mpa mrg mrl mro mrq msk msl msq mtb mtt mua mud mup mur mus mwb mwe mxa mxc mxo mxp mxy myg myn naj nak nan nca ndb nde ndi ndo ndr ndt ndu neh ngb ngd ngm ngo ngu ngz nhh nht nia niu nkb nko nnc nne nng non noo nsg nue nun nup nym nza obo orh ori orw otm otr paa pai pal par per pga pip pkt plg pms pnn pod pol por pre prs psw qui qum rag rap ras rga rny rom ron rot rov rsu ruk rus saa sak sal sam san seb sed see ses sgu sha shl shn sht shu sil sim sir sis sml so son spa squ sre sti stn sun swa swt taf tag tai taj tas tat tbo tbu tbw tee ten teo tep ter tes tet tgh tgk tgr tha thy tia tik tim tin tiv tla tlp tmm tmn tna tne tng tnk tnn tno tob toz tri tsg tsi tsk tuk tvl txj tzo tzu uld ura url urt vaf vie vif vnm war wel wlf wlo wrk wrn xbi xho yap yay yns yor yul ywr zai zap zen zul zya,468,76475,0.006119647
36A,The Associative Plural,,36,Michael Daniel; Edith Moravcsik. 2013. The Associative Plural. In: Dryer; Matthew S. & Haspelmath; Martin (eds.) 2013. The World Atlas of Language Structures Online. Leipzig: Max Planck Institute for Evolutionary Anthropology. (Available online at https://wals.info/chapter/36),3,adt afr ala asm brs bsq buu cre fri ger gud hau haw ice ifu iir ind kay ker knd kon krb kyl lao lcr mao mce mds mlt mnd mrd mwo ndy nor pau prs rap sla sup swa tag tlf tlo toq tuk tvl,47,76475,0.00061457994
144D,The Position of Negative Morphemes in SVO Languages,,144,Matthew S. Dryer. 2013. Position of Negative Morpheme With Respect to Subject; Object; and Verb. In: Dryer; Matthew S. & Haspelmath; Martin (eds.) 2013. The World Atlas of Language Structures Online. Leipzig: Max Planck Institute for Evolutionary Anthropology. (Available online at https://wals.info/chapter/144),2,acg alb arg arj aro bae bai bar bni bnn bra brf bul bvi cmy cnt dga dgb dua ebi eng est fin fon fut gok hak heb hmo htc huc iaa ind ita juh kan kch kfe khm khs kir kni kom kos ksn kwa kzy lan lao lic mae mau mcd mhu mnd mok mon mro mrt mus mut nak nal ncm ndy neh ngu nhm nne nun pal plg poh pol por pul rom rus sap sed shl sir sis slo sob spa srd sre ssa sti sun taf tgk tha tiw tmm tmr ttn ukr uli url vie wal wol xar xbi yin yng yor zqs,111,76475,0.0014514547
