parameter_id,parameter_name,parameter_description,chapter_id,chapter_citation,value,same_value_language_ids,value_language_count,language_count_total,count_ratio
89A,Order of Numeral and Noun,,89,Matthew S. Dryer. 2013. Order of Numeral and Noun. In: Dryer; Matthew S. & Haspelmath; Martin (eds.) 2013. The World Atlas of Language Structures Online. Leipzig: Max Planck Institute for Evolutionary Anthropology. (Available online at https://wals.info/chapter/89),1,ace aga agc agd ain ala alb als amh ami amk amr ams ani apu ara arc arg arm aro arp arq arw ata ath ava awa awp aym ayo aze bae baq bch bel bfg bho bii bil bkr bkt bla bln bma bre brf brs bsk bsq btk bul bur but bwc bya cak cam car cav cay ccm cde cha chc chd che chh chj chk chn chp chq chr chv ckl cld cle cln cmh cml cmn cmy cnt coc coo cop cor cpl cpn cpy crn crp cso ctl cub cuc cup cya cyv cze dam daw der dgr dhi dhm dom don dre drg drm dsh dut eme eng est eve fij fin fre gae gam gds gel geo ger gjj gku gla gnb goa god gok gon goo grf grk gua guj hak hal haw heb hil hin hix hlu hmi hmo hoa hop hpd htc hua hun hup hwr hzb iaa iba ice ifu ijo ind ing iqu iri ita ite iwa jak jaq jiv joh jpn kan kas kay kbt kdz ket kgu kgz kha khg khl kho khr khs kio kiw kkp kkt kku klm klr klv kma kmh knb knd knn kno kol kop kor koy kpm krb krc krd kre kri krk krn krz ktu kty kum kuo kut kuv kwa kwo kxo kya kyz kzy lac lat ldu lec lez lgu lic lim lit lmn lmp lui mac mag mai mam map mau mco mcv mds men mer mgg mhi mie min mis mmn mnd mng mns moh mpr mrc mrq mrt msq mss mto mun mus mxc mxj mxo mxp mxx mxy mym naj nas nav nca ndy neh nep nev nez ngw nhh nhm nhn nht niu nne nor nsg nti ntu nun nyu obg ocu oji ood ord ork oss otm pae pal pam pan pba pip pir pkn plk pmn pnn pno pnu pny pol ppc pra prs psh pso ptt pul pur pwn qaf qhu qim qui qum rap rem res ret rom rov rpa rsu ruk rus rut rwe saa sal sar scr sec sed see shb shi shk shp sid sin sir sis siu skp slo sml smp sna som son spa squ src srd sre sta stl sun svs swe taf tag taj tar tat tbo tee tel teo tep tgh tgk tgr thn tho thu tic tim tin tiw tkm tla tli tlp tls tml tni tnk tob tpn tpt tri tru trw tsf tsh tsi tsk tsz ttu tuc tul tur tuy tvl tvo twe tzu uby udi udm ukr uli urd urk urn usr ute uzb vaf vie wak was wch wel wic wlf wlo wly wme wol wrd wrk wrw xar yag yap yaq yay yei yin yko yng yny yok ytu yur zai zap zay zaz zch zen zhn zun zya zzo,479,76475,0.0062634847
26A,Prefixing vs. Suffixing in Inflectional Morphology,,26,Matthew S. Dryer. 2013. Prefixing vs. Suffixing in Inflectional Morphology. In: Dryer; Matthew S. & Haspelmath; Martin (eds.) 2013. The World Atlas of Language Structures Online. Leipzig: Max Planck Institute for Evolutionary Anthropology. (Available online at https://wals.info/chapter/26),4,abk abv acg acl aco ain all aln anj ann any apl apu apw ara arq bac blx bma bsq btk bto bud cah car cba cct cde chg chh chq cnm coa cpl cre cup dio eme ewe ful gaa gbs gmw ham hix hui hve ifu ign ina iqu iri izi jab kab kio klw kma koa koe krb kre kri krk krr ktl kuo lag lan ldu luo mar mbt mcv meh men mer mga mpr msk mxj myi nam nan ndj ndo nev nez ngn nhh nht non nti nug ood pai pau per pip plh pwn ram res ruk run sal shl shu sio sob tak tar tep tic tir tli tlo tlp tne tob tot tpn tpt tri tsk tte twn txj tzo uby wag wch wlo wrd wrn ygr yim yuc yul zai zan zap zqc zqo zqs zzo,147,76475,0.0019221968
81A,Order of Subject; Object and Verb,,81,Matthew S. Dryer. 2013. Order of Subject; Object and Verb. In: Dryer; Matthew S. & Haspelmath; Martin (eds.) 2013. The World Atlas of Language Structures Online. Leipzig: Max Planck Institute for Evolutionary Anthropology. (Available online at https://wals.info/chapter/81),2,aab abi abu acg acl acm adi adz aeg agb agh aja akn alb alk aln ama aml amq anc ane anu aoj apu ara arg ari arj aro arp arq au avk ayi ayr ayw bab bae baf bag bai bak bar bas bbl bdu ber bgo bgr bgs bgz bid bii bik bir bka bku ble blz bmb bni bnk bnn bob bol bra bre brf brn brq bsh bub bud bug bul bum buu buy bvi cga chr chw cic cme cmy cnt coc cop crn ctl cua cuc cze day deg dga dgb dio dma dok don doy dsh dua duk ebi ega egn eko eng eno erk err est ewe ewo fin fon fre fua fut fye ga gbb gbs gla gmz gnb goe gok grb gua gul guw gwo hak hal hat hau heb heh hem hmo hna hnd hol htc huc hve hya iaa iba ice ifm igb ige igs ila ind iqu irr ita ito iwa izi jab jar jmo juh juk kad kan kar kas kau kba kbw kby kch kdw kel ken ker kfe kga khm khn khs kik kil kin kir kkv kla kmu kni knk koe kom kon kos kpw kre ksg ksm ksn ktc kte ktl kwa kwn kwy kyl kzy laa lab lag lan lao lat lbu ldo leb leg lel len let lew lgi lic lin lit llm lmh lmp lmu lnd lon lou luc luo luv ma mae map mas mau may mba mbe mbi mbm mbr mbt mby mcd mcv mda mdg mdo mds mdw mea mee mga mgk mgo mgu mhu mie mkd mkq mkz mla mlg mlm mlu mmb mmv mnd mng moe mof mok mon moo mor mos mpr mpu mrg mro mrt msm mtb mua mum mup mur mus mut mwe mwo mxe myg myn nak nal nbe nbm ncm ndb ndi ndo ndt ndu ndy neh ngb ngd ngm ngo ngu ngw ngz nhm nhn nht nke nkn nko nne nng non noo nor nse nto nua nun nup nza obg obo ocu olo one ora otr paa pal pam pat pau per pga pkn plg plh plk pms png pnu pog poh pol por pre psw pul pur rag rga rim rny rom ron rot rru rsu rus sah sak sal san sap scr sea sed ses sgb sgl sgu sha shl shm shn sht sio sir sis skm sku sle slo sno sob son spa srd sre ssa sti stn sud sul sun swa swe tab taf tal tan tbw teo tep ter tet tgk tgn tha tia tid tiv tiw tki tla tmm tmn tmr tne tnk toz tpr trm ttd ttn tum txj ukr uld uli ura url urt ven vie vnm wal wch wlf wma wol wrk wrm wrn wry wwa xam xar xbi xho xoo yao yay ycn yin yng yor yuk yul zan zch zhn zpr zqs zul,488,76475,0.0063811704
83A,Order of Object and Verb,,83,Matthew S. Dryer. 2013. Order of Object and Verb. In: Dryer; Matthew S. & Haspelmath; Martin (eds.) 2013. The World Atlas of Language Structures Online. Leipzig: Max Planck Institute for Evolutionary Anthropology. (Available online at https://wals.info/chapter/83),2,aab abi abu acg acl acm adi adz aeg agb agc agd agh aja akn alb alk aln als ama ami aml amo amq amr ams anc ane anj ann anu aoj ara arg ari arj aro arp arq asy ata au avk ayi ayo ayr ayw bab bae baf bag bai baj bak baq bar bas bbl bbu bch bco bdu ber bfg bgo bgr bgs bgz bid big bii bik bil bir bka bkl bkr bku bla ble blg blu blz bma bmb bni bnk bnn bob bol bra bre brf brn brq brr bse bsh btk bto bub bud bug bul bum buu buy bvi bwc cak cax cba ccm cea ceb cem cga cha chj chq chr chw chx cic ckl cle cme cmx cmy cnt coc coe cop cor cos cpl cqt cre crn cso ctl cua cuc cya cyv cze day deg dga dgb did dio dma dok dom don doy dre dsh dua duk ebi ega egn eko eng eno erk err esm est ewe ewo fij fin fon fre fua fut fye ga gae gbb gbs gel gir giz gjj gla gmz gnb gnd goa goe gok grb grf grk grr gto gua gud gul guw gwo hak hal hat hau haw hdi heb heh hei hem hil hlu hmo hna hnd hoa hol htc huc hun hve hya iaa iba ice ifm ifu igb ige ign igs ik ila ilo ind iqu iri irr ita ito iwa ixi izi jab jak jar jmo juh juk kad kam kan kar kas kau kba kbl kbw kby kch kdw kdz kel ken ker kfe kga kgr khm khn khs kik kil kin kir kje kkt kkv kla kls klv kmj kmu kni knk koe kom kon kos kpm kpw krb kre kri kro ksg ksm ksn ktc kte ktl kuo kut kwa kwk kwn kwy kyl kyq kzy laa lab lac lag lan lao lat lbu ldo leb leg lel len let lew lgi lgu lic lil lin lit llm lmg lmh lmp lmu lnd lon lou luc luo luv ma maa mae maj mak mal mam mao map mas mau may mba mbe mbi mbl mbm mbr mbt mby mcd mch mcv mda mdg mdm mdo mds mdw mea mee meh mga mgk mgo mgu mhu mie miy mkd mkq mkz mla mlg mlm mlu mmb mmn mmv mnd mng moe mof mok mon moo mor mos mov mpo mpr mpu mrg mrl mro mrq mrt msk msm msq mtb mua mum mup mur mus mut mwb mwe mwo mxc mxe mxj mxo mxp mxy myg myn mzc nak nal nan nau nbe nbm nca ncm ndb ndi ndo ndr ndt ndu ndy neh ngd ngm ngo ngu ngw ngz nhh nhm nhn nht nia nif niu nke nkn nko nnc nne nng non noo nor nse nsg nto nua nun nup nuu nym nyn nza obg obo ocu oji olo ond one ood ora otm otr paa pai pal pam pat per pga pip pkn pkt plg plh plk pms png pnn pnu pod pog poh pol por pre psm psw pul pur qui qum rag rap rga rim rny rom ron rot rov rru rsu ruk rus rwe sah sak sal sam san sap scr sea seb sed see ses sgb sgl sgu sha shl shm shn shp shs sht shu sim sio sir sis siu skm sku sle slo sml smp sno so sob son spa squ srd sre ssa sti stn sud sul sun swa swe swt tab taf tag tah tai tal tan tas tat tbo tbw tee ten teo tep ter tes tet tgh tgk tgn tha tho tia tid tim tin tiv tiw tke tki tla tlp tmm tmn tmr tna tne tng tnk tno tob toz tpn tpr tps tri trm tsg tsi tsk tsr ttd ttn tuk tum txj tzo tzu ukr uld uli ura url urt ven vie vnm wal wam war wch wec wel wem wlf wlo wma wol wrb wrk wrm wrn wry wth wwa wya xam xar xbi xho xoo yag yao yap yay ycn yin yng yok yor yul ywl zai zan zap zch zhn zpr zqc zqo zqs zul zya zzo,705,76475,0.009218699
69A,Position of Tense-Aspect Affixes,,69,Matthew S. Dryer. 2013. Position of Tense-Aspect Affixes. In: Dryer; Matthew S. & Haspelmath; Martin (eds.) 2013. The World Atlas of Language Structures Online. Leipzig: Max Planck Institute for Evolutionary Anthropology. (Available online at https://wals.info/chapter/69),1,acl adi aja akn all amo aoj apw ari arp ayi bar bbu bem bgo bgr big bir bku bla bnn brf bsh btk bud cam ceb chj chp cic coe cpl cqt cre cso ewo gmw goo gyc hnd hya idn ifu ila irr iwm ixi jab kad kba kel ket kin kkv klv klw krb ktc kwn lag lda len les lew llm lug luo luv ma mal mam mba men mgk mkl mrd mro msm msn mtb mua mwb mwe mwo mxc mxj mxp mzh nav ndu nia nkn nko nza obg obo ocu otm otr pal pam par pms pre qum rny rru ruk sam ser shl shm shn sla sng so sub sul swa tab tag tas taw tbo ten tgh tiw tki tlp tmn tmr tna tnc tno tou toz tri tuk uld ven wry yao yel yns yqy zai zan zap zim zul zya zzo,153,76475,0.0020006539
44A,Gender Distinctions in Independent Personal Pronouns,,44,Anna Siewierska. 2013. Gender Distinctions in Independent Personal Pronouns. In: Dryer; Matthew S. & Haspelmath; Martin (eds.) 2013. The World Atlas of Language Structures Online. Leipzig: Max Planck Institute for Evolutionary Anthropology. (Available online at https://wals.info/chapter/44),6,abi abn ace acm adz ain ame amu ana anj arm asm ata atk awp aym baa bag bam bar baw ber bkr brh bri bro brr bsq bya cah can cap cav cba cbo cha chk chr cle cmn cmx cnl coo cor cpn cri cyv dag dgr dni don doy eka epe err eve ewe fij fin fur gar geo gmw goo grw gua guu hai hat hin hmo hmr hua hun hzb igb ika imo ind ing iqu jak jaq kay kch ket kew kgu kha khm kio kis kjo kkv klk kna knm knr koa kob kos kpm krb krd krk kse ktl kuk kut kwz kyl lad lah lak lan lep lez lim lkt lrk mab mac mak mal mao map mar mcr mde mei mis miz mlm mne moa mrl mrt msl msn mss mum mxc myi nad nai nak nan nbd nbr ndy nez ngi nht niv nti ntu nup nuu nyu ond oss otm pai pal par pec pip pit pms pny pur qaw qim ram rap rem sal sam san saw sel shk siu sla slp sml snm snt so squ srm sue sun syu tab tag tau taw tgk tha tin tja tkl tla tli tmr tms tna tol ton tot tpn trb tri tsi tso tuk tur tzu udh uhi uma una ura urk usa vie wam wap was wbn wch wic wik win wma wra wrd wsk yag yap yaq yel yid yim yko yor ypk yuk yur zqc zsq zun,254,76475,0.0033213468
76A,Overlap between Situational and Epistemic Modal Marking,,76,Johan van der Auwera; Andreas Ammann. 2013. Overlap between Situational and Epistemic Modal Marking. In: Dryer; Matthew S. & Haspelmath; Martin (eds.) 2013. The World Atlas of Language Structures Online. Leipzig: Max Planck Institute for Evolutionary Anthropology. (Available online at https://wals.info/chapter/76),3,aco akn ame amh ana asm aym bab bkr brh brs chk cre cyv dag die dre eka eve fij gar ham hzb imo ind ker ket kha kho khs klv kmu knr kob kty kut lad lav lep lez lkt mai mal mao mdg meh mei mhi mie mku mns mok mrd mun mxc myi ndy nez nht niv nko nma nug otm pai pan pau pba pit psm pso qim sel shk sla sml smt snm sno som squ sup tab tgr tli tor tru tuk tvl una ung usa uzb vot wam wch wra yaq yko ypk yuc yur zqc zya,105,76475,0.0013729978
102A,Verbal Person Marking,,102,Anna Siewierska. 2013. Verbal Person Marking. In: Dryer; Matthew S. & Haspelmath; Martin (eds.) 2013. The World Atlas of Language Structures Online. Leipzig: Max Planck Institute for Evolutionary Anthropology. (Available online at https://wals.info/chapter/102),5,abi abk ace acm aco aeg ain ala alb ame amh amu ane apu ara arp asm atk au aym baa bag baw bej ber bln bma brr bsq bur cah can car cax cba cbo chk cku cmn cmx coo cor cre cyv dag dio dni doy eka err ewe fij fua geo gmw goo grk grw gua ham hix hlu hua hun ika jak jaq kas ket kfe kjo kkv klv knm knr koa kom kon kos kpm krb krd krk ktl kut kws kwz lan lav lel lim lkt lrk luv mab mac mak map mar mau mby miz mku mlk moa moh mrd mrl msl msn mss mun myi nan nas nav ndo nez ngi ngk ngl nht nko nmb nti nug nyu ond oss otm pal par pec pip pit pms prh prs psj psm pur qim qui ret sah sal siu sla slp snt spa squ swa tap tau taw tiw tja tkl tli tna tol ton tot tpn tsi tuk tun tzu uma una ung ura usa wam war was wch wic wrd wrk yag yel yim ypk yuc yuk yur zan zqc zsq zul,193,76475,0.0025237005
17A,Rhythm Types,,17,Rob Goedemans; Harry van der Hulst. 2013. Rhythm Types. In: Dryer; Matthew S. & Haspelmath; Martin (eds.) 2013. The World Atlas of Language Structures Online. Leipzig: Max Planck Institute for Evolutionary Anthropology. (Available online at https://wals.info/chapter/17),1,abe ace aeg agt aly apa apu ara arv asy awe awt bdm bkl blk bna bto bur cah cap cav cmn cre crn cyv cze diy dji dni dre dri dut dyi eng ese est fij fin gay geo ger goo grk grr gug guu haw heb hun iaa ice iga ind jaq kaj kay kei kgu kjo klm kon krl ksr kut kuu kya lar lav len let liv luv mai mau may mdm mku mlc mlk mne mnj mnm mns mny mrs mrt mrw mss mta myi myy ngi ngl ngr nin nju nkb nne ntu nua nug nya ono pin pir pit pkn pol ppi ram rti skp slp snm sno snt spa srb sru svk tab tac tag taw tbb tgw tiw tmc tng tns tps try tsh tuk uzn vot wam wan wao wch wlm wra wrd wrg wrl yaq yel yim yin yny zqc zul,153,76475,0.0020006539
127A,Reason Clauses,,127,Sonia Cristofaro. 2013. Reason Clauses. In: Dryer; Matthew S. & Haspelmath; Martin (eds.) 2013. The World Atlas of Language Structures Online. Leipzig: Max Planck Institute for Evolutionary Anthropology. (Available online at https://wals.info/chapter/127),1,abu ace ain ame any apu bkr brh bur cha cle cnl dre emb epe ewe fij fua geo ger grk gua hau heb hmo hun ika imo ind jpn juh kan kay kew kfe kho khs klv knr kor krb kro lan lkt lnd mal mao may miy mku mnd mok mxc myi ndy nht noo npi nti nun orh otm pai per prh prs san sla sml sng som sup tab tin tiw tpi tru tuk tzu ung urk vie wam wma wra wrd yaq yim yor,90,76475,0.0011768552
90A,Order of Relative Clause and Noun,,90,Matthew S. Dryer. 2013. Order of Relative Clause and Noun. In: Dryer; Matthew S. & Haspelmath; Martin (eds.) 2013. The World Atlas of Language Structures Online. Leipzig: Max Planck Institute for Evolutionary Anthropology. (Available online at https://wals.info/chapter/90),1,aar abi abo abu abv ace acg acl adi adz aeg agm ajg alb alk all aly ame aml amo amp amq amr ana anc ang anj anu any aoj apu apw arg arj aro arq arw asy awe baa bab bag baj baq bar bbl bbu bco bej ber bfg bfi bgr bid bii bik bio bir bka bkr bku blr bma bmb bni bob bok bre brf brh brn brp brs bsh bsr btk bto bud bug bul bum bus buu bvi bwc cah cak cav cax ccm cde ceb cem cha chj chp chq chr chw cic cld cle cmh cmn cmy cnm coo cop cor cpl crn cso ctl ctm cub cya cze dag dan day ddj deg des did din dio djm dni dom doy dre dsh duk dut dyi efi egn emb eme eng eno erk err est eud ewe ewo fij fin fon fre fri fua fur fut fye gae gap gbb gel geo ger ghb gmz gnb gnd gok grb grf grk grw gud gul gum gwa hal hat hau haw hdi heb hei hid hix hmo hna hnd hoa hol htc huc hui hup hve hwr hya iaa iau iba ice idn ifu igb ign igs ik ila ind iri irq isa ita izi jab jak jeb jmo juh juk kam kan kar kau kay kbl kbt kbw kch kel ken ker kfe kgr khl khm khs kik kir kis kje kkt klm klr klv klw kma kmj knc kni knk knm knr knz koe kos kpm kpw krb krd kre kri kro krr kse ksg ktc kte ktl kuo kwn kws kwz kyl kyo kyq lab lan lao lat lbu lda leg lel len let lew lgt lgu lit lmg lmh lmp lmu lnd lon lug lui luo luv maa mab mad maj mal mam mao mas mau maw may mbm mbr mby mco mcv mdg mdo mds mea mee meh men mga mgo mgq mgu min miy mkj mlg mlu mmb mmn mng mnm mno moa mof mok mos mot mou mpr mpu mrg mrl mro mrq msk msl msm mud mum mup mur mus mut mwo mxc mxe mxo mxp mxy myg myi myn naj nal nan nar nat nbd ncm ndo ndr ndt ndy neh ney nez ngl ngm ngo ngz nhh nhm nht nia nif niu nkn nko nku non noo nor nrg nua nue nug nun nup nza obg obo oji olo ood orh orw otm paa pai pal par pat pau pba per pga pip pkt plg plh pms pno pnx pod poh pol por pre prs psh psw ptt pul pur qum rag rap rny rom ron rot rov rsu run rus rwe sah sak sam san sdw sea sed see ses sgb sgu shb shn sht sio sir sis skr slb sle sml snh so sob som spa src srd sre sro sud sul sun swa swe swt tab taf tag tah tai taj tak tar tat taw tbo tbt tbu tce tee ten teo tep ter tes tgk tgn tha thy tid tim tin tiw tke tla tlp tls tmm tmr tna tne tng tnk tnn tno tny toz tpn tpt trb tri trm tsi tsk ttd ttn tun tvl txj tzu ukr uld uli ung url urt ute vaf vie vnm wah wak wal war wch wel wic wlf wlo wma wol xbi xho xoo yag yap yaq yor yuc yuk yul zag zai zch zhn zul zzo,579,76475,0.0075711017
72A,Imperative-Hortative Systems,,72,Johan van der Auwera; Nina Dobrushina; Valentin Goussev. 2013. Imperative-Hortative Systems. In: Dryer; Matthew S. & Haspelmath; Martin (eds.) 2013. The World Atlas of Language Structures Online. Leipzig: Max Planck Institute for Evolutionary Anthropology. (Available online at https://wals.info/chapter/72),4,abk aco aeg ain amh amr ana apl apu arm arp asm ava awp ayr bag bem ber bma brh brm brr bsq bur cah car cay cha chr chv cld cmn cnl coi cop cre crg csh ctl cze die dig dre dsh dut eka emb eng epe err ewe far fre fur fye gar geo ger grw gum hai hay hin hlu hmd hmo hum iaa ice igb ika imo ind ita jav jpn kay kek ket kew kgm kio kiw kkn kmp kmu knr kok kor krb krt ksm kut kuv lad lan lat lav laz lez lit lkt lnd lno luo mab mac mak mam map mar may mdg mik miy mkn mku mle mlt mme mnd mon mop mrd mrl mro mrt msg msl mul mxc myi mym nav nbd ngl nim nor nun obo oix ong orh otm pai pau pec pip pit pms pol por ppi pso pta pur qim rus scr sdw see shk shl shu slo sml snh snm so spa squ stn sue sug swe tag tgr tha thk tir tiw tja tms tsa tsf tuk ukr uma urk url vie wau wch wel wlo wrk yah yaq yur zqc,201,76475,0.00262831
101A,Expression of Pronominal Subjects,,101,Matthew S. Dryer. 2013. Expression of Pronominal Subjects. In: Dryer; Matthew S. & Haspelmath; Martin (eds.) 2013. The World Atlas of Language Structures Online. Leipzig: Max Planck Institute for Evolutionary Anthropology. (Available online at https://wals.info/chapter/101),2,aar abk acg acl aco aeg aga ain aja ala alb all amh amq amr amx ane ang any aoj apl apu apw ara arg arm arp arq arw asm ass asy ath awa awp aym ayr bae bbl bbw bco bej bel bem bfg bgr big bii bik bin bio bir bku bln blx blz bma bnb bob bol bre brf brh brp brr brs bsh bsk bsq bsr bul bum bur cah cai cax cba cct cde che chh chi chk chx cic cld cle cln cmy coo crn cro ctl cub cyv cze dag dds des dhi die dig dim dio dlm dni dom efi eip eko emb eme ene err esm est ewe ewo fua fur ga gaa gah gds gjj gln gmw gmz goo grg grk grw gua gul gyc ham hat hay heh hix hlu hmi hnd hua hun hya ifu ige ik ika ila ina irq isa ita ite ito izi jab jam jmo kab kae kam kan kba kdw kew kfe kga kgr kgz kik kio kkv klv kma kmb kmh kmj kmp kms kmz knd knm kno knr koa kob koe kon krc krd kre krk krr krw ksa kty kwk kwn kwt kwz kyk lan lav lbu lda ldo leg len let lgi lil lim lin lit lkt llm lml luc lul luo luv luy maa mab mac maj map mar mau mbl mbo mbt mby mcc mcv mdn mea mee meh mir mkd mki mku mlu mme mmw mne mnm mns moe moh mou mpr mpt mpu mra mrl mro msc msl mss mtb mua myi mzh nab nag naj nan nav nbd ndb ndj nez nga ngo nhh nhm nhn nht nko nmb nnd nse nti ntu nua nue nug nwd nym nyn nyu obg obo ocu olo ond orh oro osa otm pai pan pau pga pkn pkt plh pms pog por pra pre prs pwn qim qum ram rem rim rny rru ruk run rut sak san sar scr ser sgb sgl sgu shm shu sid sio siu skm skp sla slb slo sml so sob spa squ srb src sro stn sul swa taj tar tau tbw ten tep tes tet tgh tgn tgr tiw tja tki tkl tkm tli tlo tmc tmr tna tnc tob ton toz tps trb trr tsk tsz tte tuk tun tur tus tuv tvo uby udm uld una ung ura urk urn usa usr uzb ven wai wal was way wic wiy wma wrd wrk wrm wrw wry wya yal yao yar yel ygr yim yko ypk yuc yur ywl zai zap zay zqc zul,437,76475,0.0057142857
14A,Fixed Stress Locations,,14,Rob Goedemans; Harry van der Hulst. 2013. Fixed Stress Locations. In: Dryer; Matthew S. & Haspelmath; Martin (eds.) 2013. The World Atlas of Language Structures Online. Leipzig: Max Planck Institute for Evolutionary Anthropology. (Available online at https://wals.info/chapter/14),6,aln alw arp atb awt aym bae bbm bik bim blk bnt bql bqn bqr bre bto bug buu cav crn daa dji dob eno ese frd gll haw hnn ind jaq jum kam kjo kli kob koo ksr kut kwa len lje lrk luv mal mau mgd min mks mms mnt moh myi myn naj nbb ngl nht nia nkb nne npu nsy nua nug olm ond pad pag pai pir plh plp pna pol qay qim rap rti sbg sgr sly snm squ swa tab tac tag taw tbr tiw tld tor trd tse tua tuk uma wbn wel wet wra wrd ymd yny ywl zqc zul,110,76475,0.0014383786
123A,Relativization on Obliques,,123,Bernard Comrie; Tania Kuteva. 2013. Relativization on Obliques. In: Dryer; Matthew S. & Haspelmath; Martin (eds.) 2013. The World Atlas of Language Structures Online. Leipzig: Max Planck Institute for Evolutionary Anthropology. (Available online at https://wals.info/chapter/123),4,abk ace ala bma bob brm brs cha cle eve fur grw hzb imo ind ing jak jpn kam kay kch kfe kha khm klv knd knm kob kor krc kse kxo lez maa mao map may mei mle mnd mxc nbb ndy ngi nug orh per pit qim tha tuk tur ung war,55,76475,0.0007191893
57A,Position of Pronominal Possessive Affixes,,57,Matthew S. Dryer. 2013. Position of Pronominal Possessive Affixes. In: Dryer; Matthew S. & Haspelmath; Martin (eds.) 2013. The World Atlas of Language Structures Online. Leipzig: Max Planck Institute for Evolutionary Anthropology. (Available online at https://wals.info/chapter/57),2,acl acu aeg agc ajg ale alk alw aly ama ame amh aml amo amp amr ams anc ane anj ann arg ari arm aro arq arw asy aym aze azi bag bak bau bbu bch bco bej ber bfg bgo bgr bia bid big bik bkr blg bma bmr bnn bre brf brh brn bsi bsk btk bto bud but bvi bwc cai cem cha chh chv cld cmh cmy dag dgo dgr did din dio dom doy dre ene eno erk esm eve evn ewe fij fin fua fut fye gbb gbs gel giz gku gln gmw gmz gok goo grs grw gud hal hau hdi heb hhu hlu hoa hun iaa igs ila irq jab jaq jar jeb jlu kad kam kar kau kbu ken ker kga kgz kha khl kkp kkt kkv klv kmk kmn kmo kms knm knr kop kos krb krc krd kre krr ktl kty kut kwk kwn kws kxo kyq laa lag lar lbu lda lel len lew lgu lil lmg lmh lon lou lul luo luv ma mbr mbt mby mdg mdm mee mgu mig mis miy mke mkh mkl mko mku mlg mme mmi mmw mng mnm mns mnt mnv moa moe mok mor mou mra mrg mrl mro mrt msl msm msn mss mtu mud mun mur mus mwo mxj mxp myi mzc mzh nab naj nak nan ndo neh nga ngl ngm ngn ngz nha nia nnk nog noo nsg nti ntj ntu nue nza oir ong ord ork paa pal par per pkn pkt pms pod poh pre psw pul pur qhu qui rag ras rit rov ruk rwa saa sak seb sen shi shl shm sht sia sio sis siu skp slb slp sng sno so sob sod som son sta stl swa syu tai tak tan tas tba tbo tbu teo ter tgk tgr tia tig tin tkl tla tlp tmc tno toz trm tsi tsk tum tur tuv tvo udm uli ute uyg uzb vnm wah war wat wed wem wlf wlo wol wrb wth xar yap yko ykt yng ypk yul zag zai zan zap zen zzo,355,76475,0.00464204
