parameter_id,parameter_name,parameter_description,chapter_id,chapter_citation,value,same_value_language_ids,value_language_count,language_count_total,count_ratio
143F,Postverbal Negative Morphemes,,143,Matthew S. Dryer. 2013. Order of Negative Morpheme and Verb. In: Dryer; Matthew S. & Haspelmath; Martin (eds.) 2013. The World Atlas of Language Structures Online. Leipzig: Max Planck Institute for Evolutionary Anthropology. (Available online at https://wals.info/chapter/143),1,aab aba abu abv acl adg adz agh agm aja ajg alk aln aml amo amq anc ane ani anu aoj ara arp asm au ava bab bag bak bas baw bbf bbu ben bgo bgr bid big bii bik bir bka blt blx bmb bob bod bok bol bre brm bud bum bus buy bzi cai cak chj chp chr chs chw cmr cnl cop cti ctl dgo die dma dni dsh duk dum dut ega eip eka erk ese ewe ewo fre fye gbb gbs ger giz gla gmz goe gua gul gwa gwo hal hat hau hdi hlp hma hna iau ice ido ifm ige igs irr isa iwm jab jar jmo juk kaa kar kau kbl kbw kel ken ker kho kie kim kis kkv klw kmk kmz kng knk kpw kre krn kro krr ksg kti ktl kwy kxo kyl kyp laa lab lag lai lbu ldu lel len lew lgt lin lkt lmg lmh lmn lmu lnd lon lou lug luv ma mac mad mas may mba mbe mbm mbr mbt mby mda mdg mdo mdw mea meh mek mgk mgu mhi mig min miy miz mka mku mlu mmb moo mor mou mpu msk msm msn mtb mtu mum mup mxe myg nag nbm ndu ngm ngo ngz nma nnk non nor nrg nse nua nup nza nze olo one ong osa otr paa pat per pis plh pod pog qaw qhu rag ron rot rsu rwe sah san saw sel sgb sgl shb shi sht shy sio skk sla sme snm sro sup swe tab tac teo ter tid tiv tja tmo tpr trb tru tsz tye udm uld urk urt wec wma wna wom wrm xav yul zan,288,76475,0.0037659365
11A,Front Rounded Vowels,,11,Ian Maddieson. 2013. Front Rounded Vowels. In: Dryer; Matthew S. & Haspelmath; Martin (eds.) 2013. The World Atlas of Language Structures Online. Leipzig: Max Planck Institute for Evolutionary Anthropology. (Available online at https://wals.info/chapter/11),1,abi abk abm ach acm aco adk adz aea aeg agh aht ain aiz akn akw ala ald alw amc ame amh amo amp amu amz ana anc ani ant ao api apu arb arc arm arp asm ata ava awn awp aym bag bai baj bam baw bbf bco bee bej ben ber bet bir bis bki bkr bma bng bno bod bra brb brd brh bri brm brr brw bsq bto bua bul bur byu cac cad cah cam car cax cay cck ccp cha che chk chl chp chu chw cil cle cmn cnl cof coo cre cso cti ctl cub cve cyv dad dag dah dan dar ddf der det dgb die din dio diy diz djp dni dnw don doy dre dts dum dyi efi eka eng epe eve evn ewe ewo eya fas fef fij ful fur fye ga gan gar gbb gds geo ghb gla gmb goa goo grb grk grr grw gua gwa had hai hak ham hau haw hba hin hix hmo hmr hok htc hum hup hve hzb iba igb ign igs ijo ik ika imo ind ing ird irq irr irx iso ite ito iva iwm jak jaq jav jeb jeh jiv jng jom jpn jpr juh kab kad kal kas kay kch ked kef kek ker ket kew kfe kgu kha khm kho khr khs kio kiw kkn kkv kla klm klv kly kmp kmu knd kng knk knm knr koa kob koh koi kom kor kot koy kpa kpe krb krd krk kro kry kse ksg kss ktk kty kul kun kur kut kwa kwk kwo kws kya kyl kzy lad lah lak lam lan lat lav len lit lkk lkt llm lu lua lug lui luo lus luv maa mab mak mal mao map mar mau max may maz mba mbb mei mgg mie mku mla mne mog mor mov mpa mrd mrl mrn mro mrt mss mtp mui mum mun mxc mxm mya myi mzc nai nan nap nar nas nav ndt ndy nep new nez ngi ngz nhn nht nim nis niv nko nkt nmb nnc nob non nti ntu nug nun nuu nyg nyi oca ogb oji ond ood orh orm otm pac pae pai pau paw pec phl pit pms pnr poa poh pol prh prs psh psm pso puk pur qaw qco qui ram rap res rom ror rsc rtk ruk rus rut sab san sba scs sdh sdw seb sed sha shi shk shs shu sin sla slp sml snc snd snh snm snt som soq sor spa squ sre srn sue sui sup svs swa tab tac tag tam tas teh tel ter tgk tgr tha tic tiw tks tli tma tmn tmp tne toa tok tol ton tru try tsg tsi tso ttn ttu tug tuk tul tun twn tza umb una ung urk usa uzn vie wah wam wao wap wch wdo wic win wiy wlf wma wmu wnt woi wps wra wrd wrs wry xoo yag yan yap yaq yar yaw yay ycn yct yel yes yey ygr yid yim yny yor yuc yul yur yus zan zqc zul zun,525,76475,0.0068649887
93A,Position of Interrogative Phrases in Content Questions,,93,Matthew S. Dryer. 2013. Position of Interrogative Phrases in Content Questions. In: Dryer; Matthew S. & Haspelmath; Martin (eds.) 2013. The World Atlas of Language Structures Online. Leipzig: Max Planck Institute for Evolutionary Anthropology. (Available online at https://wals.info/chapter/93),2,aab abk abu abv acl acn adg adi adz aeg ain akh akn ala alk all amb ame amh aml amn amq anc ani anj anu any ao aoj apl apt apw arc arg arj arm aro arp arq arw asm ass ata ath au ava awi awp awt aym aze azi bag bai bar baw bbl bej bem bfi bgn bgo bgr bho bhu bii bir bkl bkn bku ble blx bmb bnk bod boj boq bra brh brm brn brp bsh bsq bto bud bug bum bur bya cah cai cax cct chc chg chk chn chs chv chw cic cmh cml cmn cmr cnt cop crn cro cti cup cze dag dan dgr dha din dio dja djm dlm dmi dmk dms don doy dre drm dul dum dun dyi efi egn eip erk err ewe ewo fij foe fur fut fye gal gap gar gbb gbs gdb geo ggu giz gmw goe gok gon grw gua gug guh guj gum gur guu gwa gyc hak ham hat haw heh hin hlp hma hmo hna hoa hop hua huc hui hum hun hup hya iau idu ifm igb ige igs ijo ina irq irr isa ite iwm izi jab jar jel jin jmo jms jng jpn jug juh juk jva kab kac kae kan kar kas kau kay kba kbw kel ker ket kew kgy kha khg khi khm khn khr khs kik kil kin kir kiw kkp kkt kkv klq kmb kmh kmj kmk kmn kmo kmz knc knd kni knk knn kob kol kor kos kqq krb krc krd kre kro krr krw ksg ksm ksn kta kty kum kun kuo kuu kuv kwo kwt kyk kyl kyr laa lab lad lag lah lai lal lan lao lav lbu lda ldu lel len lep lew lez lgt lho lim lin lis lkt lmb lmh lmn lmp lnd lon lot loz lug lun luo luv maa mab mad mag maj man mao map mas maw may mba mbi mbm mby mdl mea mee mei mer mey mga mgu mhi mie mik mis miz mka mkd mkg mlg mmw mna mnd mng mnm mns mon moo mor mou mpa mpt mpu mrl mro mru msg msl mtu mum mun mup mus myi mym nad nag naj nam nan nas nav nax nbd nbm nbr ncm ndb ndi ndj ndo ndt ndu nep new ngb ngd ngk ngm ngn ngo ngt ngz nha nif nis niu niv nke nkn nko nma nnd nnk noc non noo nph ntj nua nue nun nwd nyk nza nze obg obo olo omi one ood orh oro orw osa owi oya paa pal pan par pat paw pdp per pkt plg pms pok pra pre prh prk prs psh pso pul pum pun qhu ram rao raw rem rji rny ron rot ruk rum rwa ryu sah sak sam san sap sar sav sdw sed sem ser sgb she shk shl shn sho sid sio skk sko skp skw sla slb sle slg sme sna sng snm snn snt sob som son spi sre sro sti stl sue suk sul sun svs swa syu tab tah tam tao tas tau tbl tbt tbw tel ten ter tet tgk tgl tgr tha thk thy tid tin tja tke tki tml tmo tna tnc tng tnn tny tou toz trb trm trw tsh tsi tsn ttn ttu tul tur tvt twe udh uhi una ung urd urt uru usa uzb vai vie vnm wah wak wal wap wat wbn wed wma wme wmu wol wom wrd wrg wsk wwa xas xbi xho xoo yal yaq yar ygr yid yko yns ytu yuc yur zan zaz zhn zul zzo,615,76475,0.008041844
112A,Negative Morphemes,,112,Matthew S. Dryer. 2013. Negative Morphemes. In: Dryer; Matthew S. & Haspelmath; Martin (eds.) 2013. The World Atlas of Language Structures Online. Leipzig: Max Planck Institute for Evolutionary Anthropology. (Available online at https://wals.info/chapter/112),2,aab abi abn aco adg adn aeg agd agh ain ajg ala alb alc alk all aln alw amb ame amq ane ani anj ann anu apu ara arg arj arp asm asy au awa aym baa bag bao baq bar bbw bdm ben bfg bgo bgr bii bik bir bka blr blx bma bmb bnn bnu brf bri bsq bto bua bud bul bum bun bwc bzi cah cai cax cea cha chc chk chp chx ckl cle cmn cmy cnl cnt coo cos cpy cre crn cso cti ctl cup cya dag dan dga dgb dgo dhr dhw diy dja dji djn djp dmk dni dsh dua duk dum dut dyi ega eip eka eng eno ese est eud ewo fre fye gaa gae gap gbb gbs gds geo ger ggu gmw gnn gok goo grf grj grk grr grs gud guh guj guu hat hau haw hay heb hil hin hna hun hup hve ice ige igs ik imo iqu iri irr isa ita iwm jab jak jaq jar jmo kaa kad kae kan kar kau kdz kel ken ker kfe kho khr kkv klm kls klv klw kmk kmz knb knc kni knn koi kor kos kre krj krr ksa kse kti kty kum kuo kut kwa kwn kwt laa lab lac lag lan lar ldu lel lgt lin lkt lmg lmn lon lui luo maa mac mad mal mam mas mau may mba mbt mby mcd mch mco mda mde mdm mdo mdw mea meh mer mga mgg mgi mgk mgu mhu mir miz mkl mku mlk mlu mmn mna mnd mni mnm mno mns mny moe mog moh mok mos mou mpo mpu mra mrd mrh mri mrl mrt mrw msm msq mss mtb mtu mum mur mus mut mxc mxj mxo mxp myg myi nab nad nag naj nar nav nca ndj ndo neh nev nez ngi ngj ngm ngu ngw ngz nha nhh nhm nht nke nkk nnk nor nse nti nua nue nug nyi nyn nyu nza nze oji oks olo omi ond one ono ood osa oss otm paa pai pal pan par paw pba pip pkn plh pno pod poh pok pol por pul pur qim qum ram raw res rik rom rov rsu rus sah sam san scr ses sgb shl shp sht shu shy sid sim sio siu skw sla slb slo sme sml sna sng snn so sob som spa src srd sta sup swe tab tac tag tah tak tam tau taw tbo tbt tce tee ten tep ter tes tgh tho thy tid tim tiw tja tkl tli tmn tmo tmr tnn tno tny tou tpn trb trr tru tsg tsh tsk tsn ttn ttu tus tzo tzu ukr uld una ung urk urt usa wag wak wal wam wch wec wel wem wic wir wiy wlm wma wmu wom wor wrb wrd wrg wrm wry wsk wya xam xav yag yap yaq yei yid yin ylm yng yok yur yuw ywl zai zch zzo,502,76475,0.0065642367
42A,Pronominal and Adnominal Demonstratives,,42,Holger Diessel. 2013. Pronominal and Adnominal Demonstratives. In: Dryer; Matthew S. & Haspelmath; Martin (eds.) 2013. The World Atlas of Language Structures Online. Leipzig: Max Planck Institute for Evolutionary Anthropology. (Available online at https://wals.info/chapter/42),2,ain amb any arg bad bak bfg fre gua hlu irq kbl klb knm kok kor lan lav luo mam map mul nan ndy ngz pnn poh so tas tng war wel wly wra ygr yko,37,76475,0.00048381824
83A,Order of Object and Verb,,83,Matthew S. Dryer. 2013. Order of Object and Verb. In: Dryer; Matthew S. & Haspelmath; Martin (eds.) 2013. The World Atlas of Language Structures Online. Leipzig: Max Planck Institute for Evolutionary Anthropology. (Available online at https://wals.info/chapter/83),2,aab abi abu acg acl acm adi adz aeg agb agc agd agh aja akn alb alk aln als ama ami aml amo amq amr ams anc ane anj ann anu aoj ara arg ari arj aro arp arq asy ata au avk ayi ayo ayr ayw bab bae baf bag bai baj bak baq bar bas bbl bbu bch bco bdu ber bfg bgo bgr bgs bgz bid big bii bik bil bir bka bkl bkr bku bla ble blg blu blz bma bmb bni bnk bnn bob bol bra bre brf brn brq brr bse bsh btk bto bub bud bug bul bum buu buy bvi bwc cak cax cba ccm cea ceb cem cga cha chj chq chr chw chx cic ckl cle cme cmx cmy cnt coc coe cop cor cos cpl cqt cre crn cso ctl cua cuc cya cyv cze day deg dga dgb did dio dma dok dom don doy dre dsh dua duk ebi ega egn eko eng eno erk err esm est ewe ewo fij fin fon fre fua fut fye ga gae gbb gbs gel gir giz gjj gla gmz gnb gnd goa goe gok grb grf grk grr gto gua gud gul guw gwo hak hal hat hau haw hdi heb heh hei hem hil hlu hmo hna hnd hoa hol htc huc hun hve hya iaa iba ice ifm ifu igb ige ign igs ik ila ilo ind iqu iri irr ita ito iwa ixi izi jab jak jar jmo juh juk kad kam kan kar kas kau kba kbl kbw kby kch kdw kdz kel ken ker kfe kga kgr khm khn khs kik kil kin kir kje kkt kkv kla kls klv kmj kmu kni knk koe kom kon kos kpm kpw krb kre kri kro ksg ksm ksn ktc kte ktl kuo kut kwa kwk kwn kwy kyl kyq kzy laa lab lac lag lan lao lat lbu ldo leb leg lel len let lew lgi lgu lic lil lin lit llm lmg lmh lmp lmu lnd lon lou luc luo luv ma maa mae maj mak mal mam mao map mas mau may mba mbe mbi mbl mbm mbr mbt mby mcd mch mcv mda mdg mdm mdo mds mdw mea mee meh mga mgk mgo mgu mhu mie miy mkd mkq mkz mla mlg mlm mlu mmb mmn mmv mna mnd mng moe mof mok mon moo mor mos mov mpo mpr mpu mrl mro mrq mrt msk msm msq mtb mua mum mup mur mus mut mwb mwe mwo mxc mxe mxj mxo mxp mxy myg myn mzc nak nal nan nau nbe nbm nca ncm ndb ndi ndo ndr ndt ndu ndy neh ngd ngm ngo ngu ngw ngz nhh nhm nhn nht nia nif niu nke nkn nko nnc nne nng non noo nor nse nsg nto nua nun nup nuu nym nyn nza obg obo ocu oji olo ond one ood ora otm otr paa pai pal pam pat per pga pip pkn pkt plg plh plk pms png pnn pnu pod pog poh pol por pre psm psw pul pur qui qum rag rap rga rim rny rom ron rot rov rru rsu ruk rus rwe sah sak sal sam san sap scr sea seb sed see ses sgb sgl sgu sha shl shm shn shp shs sht shu sim sio sir sis siu skm sku sle slo sml smp sno so sob son spa squ srd sre ssa sti stn sud sul sun swa swe swt tab taf tag tah tai tal tan tas tat tbo tbw tee ten teo tep ter tes tet tgh tgk tgn tha tho tia tid tim tin tiv tiw tke tki tla tlp tmm tmn tmr tna tne tng tnk tno tob toz tpn tpr tps tri trm tsg tsi tsk tsr ttd ttn tuk tum txj tzo tzu ukr uld uli ura url urt ven vie vnm wal wam war wch wec wel wem wlf wlo wma wol wrb wrk wrm wrn wry wth wwa wya xam xar xbi xho xoo yag yao yap yay ycn yin yng yok yor yul ywl zai zan zap zch zhn zpr zqc zqo zqs zul zya zzo,705,76475,0.009218699
96A,Relationship between the Order of Object and Verb and the Order of Relative Clause and Noun,,96,Matthew S. Dryer. 2013. Relationship between the Order of Object and Verb and the Order of Relative Clause and Noun. In: Dryer; Matthew S. & Haspelmath; Martin (eds.) 2013. The World Atlas of Language Structures Online. Leipzig: Max Planck Institute for Evolutionary Anthropology. (Available online at https://wals.info/chapter/96),4,abi abu acg acl adi adz aeg alb alk aml amo amq amr anc anj anu aoj arg arj aro arq asy bab bag baj baq bar bbl bbu bco ber bfg bgr bid bii bik bir bka bkr bku bma bmb bni bob bre brf brn bsh btk bto bud bug bul bum buu bvi bwc cak cax ccm ceb cem cha chj chq chr chw cic cle cmy cop cor cpl crn cso ctl cya cze day deg did dio dom doy dre dsh duk egn eng eno erk err est ewe ewo fij fin fni fon fre fua fut fye gae gbb gel gmz gnb gnd gok grb grf grk gud gul hal hat hau haw hdi heb hei hmo hna hnd hoa hol htc huc hve hya iaa iba ice ifu igb ign igs ik ila ind iri ita izi jab jak jmo juh juk kam kan kar kau kbl kbw kch kel ken ker kfe kgr khm khs kik kir kje kkt klv kmj kni knk koe kos kpm kpw krb kre kri kro ksg ktc kte ktl kuo kwn kyl kyq lab lan lao lat lbu leg lel len let lew lgu lit lmg lmh lmp lmu lnd lon luo luv maa maj mal mam mao mas mau may mbm mbr mby mcv mdg mdo mds mea mee meh mga mgo mgu miy mlg mlu mmb mmn mna mng mof mok mos mpr mpu mrl mro mrq msk msm mum mup mur mus mut mwo mxc mxe mxo mxp mxy myg myn nal nan ncm ndo ndr ndt ndy neh ngm ngo ngz nhh nhm nht nia nif niu nkn nko non noo nor nua nun nup nza obg obo oji olo ood otm paa pai pal pat per pga pip pkt plg plh pms pod poh pol por pre psw pul pur qum rag rap rny rom ron rot rov rsu rus rwe sah sak sam san sea sed see ses sgb sgu shn sht sio sir sis sle sml so sob spa srd sre sud sul sun swa swe swt tab taf tag tah tai tat tbo tee ten teo tep ter tes tgk tgn tha tid tim tin tiw tke tla tlp tmm tmr tna tne tng tnk tno toz tpn tri trm tsi tsk ttd ttn txj tzu ukr uld uli url urt vie vnm wal war wch wel wlf wlo wma wol xbi xho xoo yag yap yor yul zai zch zhn zul zzo,416,76475,0.005439686
61A,Adjectives without Nouns,,61,David Gil. 2013. Adjectives without Nouns. In: Dryer; Matthew S. & Haspelmath; Martin (eds.) 2013. The World Atlas of Language Structures Online. Leipzig: Max Planck Institute for Evolutionary Anthropology. (Available online at https://wals.info/chapter/61),2,abk aly ame amr ava awp bae brm bsq cha drg dyi eve fin fre gaa geo goo gum heb hmd hun jam kfe kha kho knr krf kut lil luc mar mau mbg min mks mmb mos mrt nbd ngz nkk ood pnr prs qim rcp rus ses shk spa sup swa tag tam taw tha tiw tnn tuk tur tvo ura vaf war wat wir yes yid yim yng zul,73,76475,0.0009545603
97A,Relationship between the Order of Object and Verb and the Order of Adjective and Noun,,97,Matthew S. Dryer. 2013. Relationship between the Order of Object and Verb and the Order of Adjective and Noun. In: Dryer; Matthew S. & Haspelmath; Martin (eds.) 2013. The World Atlas of Language Structures Online. Leipzig: Max Planck Institute for Evolutionary Anthropology. (Available online at https://wals.info/chapter/97),4,aab abu acg acl adi adz aeg agb agh akn alb alk aln ama aml amo amq amr ams anc ane anj anu aoj arg arj aro arq asy au ayi ayo ayw bab bae baf bag baj baq bar bas bbl bch bdu ber bfg bia bid bik bir bkr bku ble blu blz bma bni bnk bnn bra bre brf brn bsh bto bub bud bum buu bvi bwc cax ccm cem cga chq chr chw cic cle cme coc cop cor cpl crn cso ctl cya day dga dgb did dio dma don doy dre dua duk ega egn eno erk err ewe ewo fij fni fon fre fua fut fye ga gae gel gjj gla gnd goa goe grb grf grr gto gua gul guw hal hat haw hdi heb heh hem hmo hna hnd hoa hol huc hya iba ifm igb ige igs ik ila ind iqu iri irr ita jab jar jmo juh juk kam kar kau kba kbl kbw kby kch kdz kel ker kfe kga kgr khm khs kik kin kir kje kkt kkv klv kmj kmu koe kom kon kos kpw krb kri kro ksg ksn ktc kte ktl kuo kwa kwn kwy kyl laa lab lag lan lao lbu ldo leb lel len let lew lgi lgu lic lin llm lmg lmh lmp lon lou luc luo luv maa mae mal mao mas may mba mbe mbi mbl mbm mbr mbt mby mda mdg mds mdw mea mee meh mga mgk mgo mgu mie miy mkd mkz mla mlg mlm mlu mmb mmv mna mng mof mok mon moo mor mpo mpr mpu mrl mro mrq mrt msk msm mtb mua mum mup mur mwe mwo mxc mxe mxj mxo mxp mxy myn mzc nak nal nan nau ncm ndb ndi ndo ndr ndt ndu neh ngd ngm ngo ngu ngz nhh nhm nht nia nif niu nkn nko nnc non noo nse nto nua nun nup nym olo otr pai pam pat per pga pkt plg plh plk pms png pnu poh por pre psw pul pur rag rap rga rny rom rot rov rru rsu sah sak sam sap sea seb sed ses sgb sgu shl shm shn sht sim sio sis sku sle sml so sob spa srd sre sti sud sul sun swa tab taf tah tat tbo tbw ten teo ter tes tgk tgn tha tia tid tim tlp tmm tmn tmr tna tne tng tnk tno toz tpr tps tri tsg tsk ttd ttn tuk tum uld uli ura url urt ven vie vnm wal wch wel wlf wlo wma wol wrk wrm wth xam xbi xho xoo yag yao yap yay yor yul zai zap zul zya zzo,456,76475,0.0059627327
37A,Definite Articles,,37,Matthew S. Dryer. 2013. Definite Articles. In: Dryer; Matthew S. & Haspelmath; Martin (eds.) 2013. The World Atlas of Language Structures Online. Leipzig: Max Planck Institute for Evolutionary Anthropology. (Available online at https://wals.info/chapter/37),1,abk adi agb agm ala amh amp amq anu ara aro ata awt bab bag bak bam baq bbf bco bdu bfi bgr bik bir blz bmb bre brf brp bsq bul ccm cem cha cmy coo cop cor crn cso day dds deg dga dgb die dim dre dut egn eng epe ewo fre fri fua fut fye ga gae gel ger gmw gnn goe goo grk gua gul gwa hau haw htc hun hve iaa iri irr ita izi jmo jms juh kan kay kba kch kel ken ker kfe khm knr koa kos kre krk kse kut kwo laa lav lep lgu lkt llm lmg lmp lnd lon lot luo mab mad mae mal mao map mar may mbi mcd mea mis miy mka mof mon mou mpt mrq msg mtb mtu mum mup mus mwb myi nbr nca ndy ney ngz nif nkn nti nyu obg oks ond ood pdp pip pir pms por qia qum ram rap ron rov run rwe sam san ser sir sis skk slb spa squ svs tar taw tbu tee tep tgk tgo tgr tid tim tin tke tla tng tnk tot tsi ttn tvl txj tzu uld ung url vai vie wch wel wlf wol wrw wsk yap zag zar zay zch zqc zqs,216,76475,0.0028244525
51A,Position of Case Affixes,,51,Matthew S. Dryer. 2013. Position of Case Affixes. In: Dryer; Matthew S. & Haspelmath; Martin (eds.) 2013. The World Atlas of Language Structures Online. Leipzig: Max Planck Institute for Evolutionary Anthropology. (Available online at https://wals.info/chapter/51),9,abi abk abu abv ace acg acl adg adi aeg agc ain ajg akh akn aln amc ame aml amr anc ang anj anu any aoj api apl apt ara arg arp asm ata au bab bag bai bar baw bco bdu bgo bik bil bir bka bkl bkr bmb bnn bri brp bto bud bul bwc car cba cbo ccm cde cem chq chr chs cle cmy cnl cnm cnt crn cro cya dan day dio doy dre drm duk dum dut egn eng ese ewe ewo fij fri fut gaa gbb gbs git gln gmw gmz goe gok grb gua gud gul hal har hat hau haw hix hmo hna hoa htc hve iaa iba ind irq irr irx ita izi jak jin jmo jng juh juk kaa kar kbw kch kdz kel kfe khm kho khs kis kkt kkv kkw klq klv kmb kmj kmn kmu kmz kni knk kob koe kom kon kos krb krd kre kri krr kse ksg ktc ktl kuo kut kyl laf lah lai lal lan lao lar ldu lel len lep lew lgt lgu lis lkt llm lmg lmh lmp lnd lon lug luo mad mae mak mam man mao mau mbm mbt mcv mde mdg mds mea meh mek mga mgu mie min miy mka mkj mku mlg mlu mmn mna mnd mng mok mon mou mpr mru msk mtu mum mun mup mwb mxc mxj mxo mxp nak nav nca ndy nev ngd ngz nht niu nko nmb noo nsg nti nua nun nup nwd nza nze obg obo olo ood oro osa paa pai pal pam paw per pga pip plh plk pms pnu poh pok por prs psw pum qum ram rap ras raw rot ruk rum run saa sah sam san sed ser sht sil sim sio sis sla slb sml snt sob som son spa src sti sul sun sup swe syu tab tac tah taj taw tbo tbu teo ter tgh tgk tgr tha tia tid tim tin tir tiw tla tmg tnc tng tnn tob tot trb tri tte ttn tuk tvl tzu uld uli una urd url urn urt vai vie wal war wch wel wlf wlo wma wog wol wsk xar xas xav yap yor yul zai zhn zzo,379,76475,0.004955868
88A,Order of Demonstrative and Noun,,88,Matthew S. Dryer. 2013. Order of Demonstrative and Noun. In: Dryer; Matthew S. & Haspelmath; Martin (eds.) 2013. The World Atlas of Language Structures Online. Leipzig: Max Planck Institute for Evolutionary Anthropology. (Available online at https://wals.info/chapter/88),2,aab aar aba abu ace acn adg adi adz aeg agb agh agm agt ajg akh akn alk all aln aly ama ame aml amo amp amq amx anc ane ang anj ano ao aoj api aro ata au avk avo awe awi ayw baa bab bag bai baj bak bas baw bbu bch bco bdu bdw bfi bgr bgs bid bik bin bir bka bkr ble blx blz bmb bni bol bra bre brf bri brp bry bse bsh bsi bsq bto bud bug buj bum buu bvi bwc ccm cct cem chh chj chr cic cle cme cnl coe cpl crn cro cso cya dag dan day ddj dds deg dga dgb dgo dha did die dim dio dma dng dni dok don dre dum dun edo efi ega egn eno erk err ewe ewo fas fij foe fon fua fut fye gae gbb gbs gel gim gla gln gmw gmz gnd gnn goa goe gok grb grf gug gul gwa gwo hal ham han hat heb hem hid hmo hna hnd hoa huc hya iaa iau iba ido ifm igb ige ila ind inn iri irq irr isa izi jab jak jar jmo jms juh juk kad kan kar kau kba kbw kch kel ken ker kfe kgr khd khm khn kik kir kis kkv klq klv kmb kmj kmo kmp kmu kmw kmz knc kni knk knm knr knz kob koe kom kon kos kpe kpw kqq krb kro krr kse ksg ksn kta ktc kte ktl ktu kuu kwa kwn kwy kyk kyl kyo laa lab lah lal lan lao lda ldo leb lel len les let lew lgi lgt lgu lho lic lis llm lmh lmp lnd lon lot lou lug luo luv luy mab mad mae maj mar maw may mbe mbi mbl mbm mbr mby mda mde mdg mdo mdw mea mei mey mgo mgq mgu min mka mkj mkq mku mkz mlg mlk mlm mlu mmb mmv mna mng mnm mnt mnz mof mok mon mor mou mpa mpo mpt mpu mrl mro msm msn mtb mud mum mup mus mwo mxc mxe mxj mxo mxy myg myn nab nak nal nam nar nbr ncm ndb nde ndi ndo ndr ndt ndu ndy neh ney ngb ngg ngk ngm ngo ngt ngu ngz nia nif nke nkn nko nnd nne nng non noo nsg ntj nua nue nun nup nus nyi nym nza obg obo olo ora orh ori oro orw ory otr pat pit plg plh pnu poh pok prh psw pul qia rag rap ras rga rny ron rot rov rum run sah sak san sea sed see sem ser ses sgb sgu shn sht sim sio sis sko sku sle slp sml so sob son sre sro sti sud sue sul sun swa tab taf tai tak tat tbo tbt tbu tdr ten teo ter tes tet tgh tgk tgn tgo tha thy tib tid tik tim tin tiv tja tke tlo tlp tmm tmn tmo tmr tna tne tng tnk tno toz tpr trb tri tsi tsk ttd tte ttn tuk tvl uld uli ung url urt usa vai vie vif vnm wah wal war wat wch wel wlf wma wmu wn woi wol wom wsk wwa xar xbi xoo yal yao yap yay yel yi yim yiw yns yor yul yus zag zai zap zar zya zzo,562,76475,0.0073488066
54A,Distributive Numerals,,54,David Gil. 2013. Distributive Numerals. In: Dryer; Matthew S. & Haspelmath; Martin (eds.) 2013. The World Atlas of Language Structures Online. Leipzig: Max Planck Institute for Evolutionary Anthropology. (Available online at https://wals.info/chapter/54),2,agm akn alx amh aml anx ass bal ben bez bgv bok bpa brh bur cah cmn dgi drg fox ga gar gdf geo hau hin hun hzb ing irq kas kbi kch kef khr kku knd kod koi kon krd kur kuy kwk kyo lak lez luo mde mei mhi min mit mmu mne mun mym myn nbd nhn nia nku pip psh pte ren rru sdh ski ssh sup swa thd tib tla tml tpn tsg ttn tuv was wly yms yor,85,76475,0.0011114744
46A,Indefinite Pronouns,,46,Martin Haspelmath. 2013. Indefinite Pronouns. In: Dryer; Matthew S. & Haspelmath; Martin (eds.) 2013. The World Atlas of Language Structures Online. Leipzig: Max Planck Institute for Evolutionary Anthropology. (Available online at https://wals.info/chapter/46),2,abu aeg ame aml amp ano bab bag bak bam bud cic dgb doy eng err ewe fon fre fue gam gbb gol hau ibi ilo ind iri irq ita kan kat kfe kji klq kob kse kwr kya kyk lan lav lel lgu lug mal may mbi mby mde mgu mis mle mlt msh nbd ndb niu nko nti nto orh orl pal pms prs qia sam san see sla som sum swa tid tis tms tmu tru tur tvl usa yap yor,85,76475,0.0011114744
8A,Lateral Consonants,,8,Ian Maddieson. 2013. Lateral Consonants. In: Dryer; Matthew S. & Haspelmath; Martin (eds.) 2013. The World Atlas of Language Structures Online. Leipzig: Max Planck Institute for Evolutionary Anthropology. (Available online at https://wals.info/chapter/8),4,abm arc ava awp cck ccp chp coo dah eya grw had hai hup hzb irq ite kal knk koa kwk lam lus mak mov nav nez ngz qui sdw shu sla squ teh ter tpa tru tsi ttu twn win wiy yuc yur zul zun,47,76475,0.00061457994
