parameter_id,parameter_name,parameter_description,chapter_id,chapter_citation,value,same_value_language_ids,value_language_count,language_count_total,count_ratio
144H,NegSVO Order,,144,Matthew S. Dryer. 2013. Position of Negative Morpheme With Respect to Subject; Object; and Verb. In: Dryer; Matthew S. & Haspelmath; Martin (eds.) 2013. The World Atlas of Language Structures Online. Leipzig: Max Planck Institute for Evolutionary Anthropology. (Available online at https://wals.info/chapter/144),4,aab abu acg adi adz aeg agh aja akn alb alk aln aml amq anc ane anu ara arg arj arm aro arp arq asy au bab bae bag bai bak bar bas bbl bch ber bgo bgr bia bik bir bka bkr bku ble blz bmb bni bnn bob bol bra bre brf brn bsh bud bul bum buy bvi cai cga chr chw cic cmy cnt ctl cze deg dga dgb dgo dio dma doy dsh dua duk dut ebi ega egn eko eng erk err est ewe ewo fin fon fre fua fut ga gbb gbs ger gku gla gmz gnb goe gok grk gua gul gwa gwo hak hal hat hau heb heh hmo hna hnd hol htc huc hun hya iaa ice ige igs ila ind irr ita izi jab jar jmo juh juk kan kar kas kau kba kbw kby kch kdw kel ken ker kfe kga khm khs kik kil kin kir kis kkv kni knk kom kon kos kpw ksg ksn ktl kwa kwy kwz kyl kzy laa lab lag lan lao lat lbu ldo ldu leb leg lel len let lew lgi lgt lic lin lit llm lmh lmp lmu lnd lon lou luc lug luv ma mad mae map mas mau may mba mbe mbm mbr mby mcd mcv mda mdg mdo mea meh mgk mgu mhu miy mkd mkz mlg mlu mmb mmv mna mnd mok mon moo mor mou mpu mro mrt msm mtb mua mum mus mut mwe mwo mxe myg nak nal nbm ncm ndb ndt ndu ndy neh ngm ngo ngu ngz nhm nke nkn nko nne noo nor nse nto nua nun nup nza obg obo ocu olo one paa pal pat per pga plg plh pms png pog poh pol por pre psw pul rim rny rom ron rot rru rsu rus sah sak san sap sed sgb sgl sgu shl shm shn sht sio sir sis skm slo sob spa srd sre ssa sti stn sul sun swa swe tab taf tal tan tbw tee teo ter tet tgk tha tid tin tiv tiw tki tmm tmr tne tob ton toz tpr tru ttn twn tzu ukr uld uli url urt ven vie vnm wal wch wlf wma wol wrk wrm wrn xar xbi xho yao yin yng yor yul zan zqs zul,392,76475,0.0051258584
7A,Glottalized Consonants,,7,Ian Maddieson. 2013. Glottalized Consonants. In: Dryer; Matthew S. & Haspelmath; Martin (eds.) 2013. The World Atlas of Language Structures Online. Leipzig: Max Planck Institute for Evolutionary Anthropology. (Available online at https://wals.info/chapter/7),3,aiz anc bag bet bra chw dan ddf dnw doy fye gbb gwa jeh kad ker kgi khm knk koh kpe kro ksg kss lam lkk lua maa mba mbm mov mrl mum ndt ngz nti nun nyg ogb pac pau phl san sdh sre ter tma tok tso tuk vie wps ygr yul,55,76475,0.0007191893
1A,Consonant Inventories,,1,Ian Maddieson. 2013. Consonant Inventories. In: Dryer; Matthew S. & Haspelmath; Martin (eds.) 2013. The World Atlas of Language Structures Online. Leipzig: Max Planck Institute for Evolutionary Anthropology. (Available online at https://wals.info/chapter/1),4,aeg aht amh anc arm awn aym bag baj bco ben bma brm bsk chl chq cof dar dre ewe ewo eya ga gbb geo gla hau hun hup igb ik irq iso ite jak kas kho khr klm knd koh krd ksg ktk kut kzy lad lah lam lat lep lkk lug luo mal mbm mie mun nav nbk ndt nep nez niv nkt ntu oca orh psh pso pur qco qui res rus san sla sml soq sre swa teh tel tgr tok twn wap win wlf yny yur yus zul,94,76475,0.0012291599
67A,The Future Tense,,67,Östen Dahl; Viveka Velupillai. 2013. The Future Tense. In: Dryer; Matthew S. & Haspelmath; Martin (eds.) 2013. The World Atlas of Language Structures Online. Leipzig: Max Planck Institute for Evolutionary Anthropology. (Available online at https://wals.info/chapter/67),1,abk aeg akn ala alw aly ame apu arp asm awn awp aze ben blc bng bnj bon bsq bui bur cbo chk coc cpl cpn cyn dag dio dni egn eve ewe fre geo goo grb grf grw gua gug hal heb hin imo ins jiv kay kew kio kji knd knk knr koa krk kui kut lat lav lda lez luv mai map mar mau mne mrt mtg mwe mxc ngi ngm nim niv ntu ond ono pan pnn qim ram ruk sla snc som spa sue swa tag tem tig tiw tml tne tuc tug tuk tur udm wch wic wly yaq yes ygr yko zul,110,76475,0.0014383786
90C,Postnominal relative clauses,,90,Matthew S. Dryer. 2013. Order of Relative Clause and Noun. In: Dryer; Matthew S. & Haspelmath; Martin (eds.) 2013. The World Atlas of Language Structures Online. Leipzig: Max Planck Institute for Evolutionary Anthropology. (Available online at https://wals.info/chapter/90),1,aar abi abo abu abv ace acg acl adi adz aeg agm ajg alb alk all aly ame aml amo amp amq amr ana anc ang anj anu any aoj apu apw arg arj aro arq arw asy awe baa bab bag baj baq bar bbl bbu bco bej ber bfg bfi bgr bid bii bik bio bir bka bkr bku blr bma bmb bni bob bok bre brf brh brn brp brs bsh bsr btk bto bud bug bul bum bus buu bvi bwc cah cak cav cax ccm cde ceb cem cha chj chp chq chr chw cic cld cle cmh cmn cmy cnm coo cop cor cpl crn cso ctl ctm cub cya cze dag dan day ddj deg des did din dio djm dni dom doy dre dsh duk dut dyi efi egn emb eme eng eno erk err est eud ewe ewo fij fin fon fre fri fua fur fut fye gae gap gbb gel geo ger ghb gmz gnb gnd gok grb grf grk grw gud gul gum gwa hal hat hau haw hdi heb hei hid hix hmo hna hnd hoa hol htc huc hui hup hve hwr hya iaa iau iba ice idn ifu igb ign igs ik ila ind iri irq isa ita izi jab jak jeb jmo juh juk kam kan kar kau kay kbl kbt kbw kch kel ken ker kfe kgr khl khm khs kik kir kis kje kkt klm klr klv klw kma kmj knc kni knk knm knr knz koe kos kpm kpw krb krd kre kri kro krr kse ksg ktc kte ktl kuo kwn kws kwz kyl kyo kyq lab lan lao lat lbu lda leg lel len let lew lgt lgu lit lmg lmh lmp lmu lnd lon lug lui luo luv maa mab mad maj mal mam mao mas mau maw may mbm mbr mby mco mcv mdg mdo mds mea mee meh men mga mgo mgq mgu min miy mkj mlg mlu mmb mmn mna mng mnm mno moa mof mok mos mot mou mpr mpu mrl mro mrq msk msl msm mud mum mup mur mus mut mwo mxc mxe mxo mxp mxy myg myi myn naj nal nan nar nat nbd ncm ndo ndr ndt ndy neh ney nez ngl ngm ngo ngz nhh nhm nht nia nif niu nkn nko nku non noo nor nrg nua nue nug nun nup nza obg obo oji olo ood orh orw otm paa pai pal par pat pau pba per pga pip pkt plg plh pms pno pnx pod poh pol por pre prs psh psw ptt pul pur qum rag rap rny rom ron rot rov rsu run rus rwe sah sak sam san sdw sea sed see ses sgb sgu shb shn sht sio sir sis skr slb sle sml snh so sob som spa src srd sre sro sud sul sun swa swe swt tab taf tag tah tai taj tak tar tat taw tbo tbt tbu tce tee ten teo tep ter tes tgk tgn tha thy tid tim tin tiw tke tla tlp tls tmm tmr tna tne tng tnk tnn tno tny toz tpn tpt trb tri trm tsi tsk ttd ttn tun tvl txj tzu ukr uld uli ung url urt ute vaf vie vnm wah wak wal war wch wel wic wlf wlo wma wol xbi xho xoo yag yap yaq yor yuc yuk yul zag zai zch zhn zul zzo,579,76475,0.0075711017
144B,Position of negative words relative to beginning and end of clause and with respect to adjacency to verb,,144,Matthew S. Dryer. 2013. Position of Negative Morpheme With Respect to Subject; Object; and Verb. In: Dryer; Matthew S. & Haspelmath; Martin (eds.) 2013. The World Atlas of Language Structures Online. Leipzig: Max Planck Institute for Evolutionary Anthropology. (Available online at https://wals.info/chapter/144),6,aab adz aja alk aln amq anc ane bag bak bbu bgo bgr bik bir bka bol bud bum chw dgo duk dut ega fye gbb gbs ger gla goe gul gwo hat hna ige igs irr jab jar jmo juk kar kbw kel ken ker kis kkv kon kpw kre kwy kyl laa lab lag lbu lel lgt lin lmg lmh lnd lon lug luv ma mad mas may mbm mbr mby mda mdg mdo mea meh mgk mgu mlu mmb mor mou mpu mum mup myg nbm ndu ngm ngz nua nup nza olo one paa pat pod ron san sgb sgl sht sio tab ter tid tiv tpr uld wma wrm,115,76475,0.0015037594
43A,Third Person Pronouns and Demonstratives,,43,D.N.S. Bhat. 2013. Third Person Pronouns and Demonstratives. In: Dryer; Matthew S. & Haspelmath; Martin (eds.) 2013. The World Atlas of Language Structures Online. Leipzig: Max Planck Institute for Evolutionary Anthropology. (Available online at https://wals.info/chapter/43),1,agm ain ame amp bag baw bma brm cha chk cnl cnt cre djr don epe eve fij fin fut goo gua hau ika imo ind ing irq jak jpn jun kch kew kfe kho kmu knr koa kob kor kos krb kse kwk kyl lah lan lep lil lkt mby mic miy mok mrt mud mun mxc mxo mxy ndy nez nku nma nti nug ond orh pme poh psm rej rem san saw scr shp sml spa tag tau tha tib tna ton toq tot tte tuk tun urk usa war wic wik yaq yko yor ypk,100,76475,0.0013076168
95A,Relationship between the Order of Object and Verb and the Order of Adposition and Noun Phrase,,95,Matthew S. Dryer. 2013. Relationship between the Order of Object and Verb and the Order of Adposition and Noun Phrase. In: Dryer; Matthew S. & Haspelmath; Martin (eds.) 2013. The World Atlas of Language Structures Online. Leipzig: Max Planck Institute for Evolutionary Anthropology. (Available online at https://wals.info/chapter/95),4,abi abu acl acm adz aeg agc aja alb alk aln als ama ami aml amq amr ams anc ane anj arg arj aro arp arq asy ata au ayw bab baf bag baj bak bar bas bbl bbu bco bdu bfg bgo bia bid bik bir bka bkl bkr blu bma bni bnk bnn bob bol bra bre brf bse bsh btk bto bud bul bum buu bvi bwc cak cba ccm ceb cem cha chj chq chr cic ckl cle cmx cmy coe cop cpl cqt crn cso ctl cuc cya cyv cze did dio dok dom don dre dsh duk egn eng eno erk err esm ewo fij fni fre fua fut fye gae gbb gel giz gla gmz gnb gnd goa goe gok grf grk grr gto gud gwo hal hat hau haw hdi heb heh hei hem hil hlu hmo hna hoa htc hve hya iaa iba ice ifm ifu igb ign igs ik ila ilo ind iri irr ita ixi izi jak jar jmo juk kam kan kar kau kbl kbw kby kdz kel ker kga kgr khm khs kik kil kin kkt kkv klv kmj kmu knk koe kon kos kpm kpw krb kre kri ksg kte kuo kwa kwk kwn kwy kyq laa lab lac lag lan lao lat lbu ldo leb lel len let lew lgi lgu lic lil lit lmg lmp lnd lon lou luo luv maa mae mal mam mao mas mau may mbe mbm mcd mdg mdm mdo mds mea meh mga mgo mgu miy mlg mlm mlu mmb mmn mna mng mof mok mon mor mov mpu mrq msm msq mua mum mup mus mwb mxc mxj mxo mxp mxy myg nak nal nan nca ndi ndo ndt ndu ndy neh ngb ngd ngm ngo ngu ngz nhh nhm nht nia nif niu nko nnc noo nor nse nsg nua nun nup nza obg obo ocu olo ora otm paa pai pal pat per pip pkt plg plh plk pms png pnn pod pog poh pol por pre psm psw pul qum rag rap rga rny rom rot ruk rus rwe sah sak sal sam san scr seb sed ses sgb sgl shl shn shu sim sio sir sis slo sml so sob son spa squ sre sti sul sun swa swe tab tah tai tal tbo tbw tee teo tep ter tes tet tgh tgk tha tho tid tim tin tiv tiw tke tla tlp tmr tna tne tng tnk tno tpr tri tsg tsi tsk ttd ttn tuk txj tzo tzu ukr uld uli url vie vnm war wch wel wlf wlo wma wol wrk wrm xar xbi xho yap yok yor yul zai zan zap zhn zqs zul zya,456,76475,0.0059627327
70A,The Morphological Imperative,,70,Johan van der Auwera; Ludo Lejeune (Umarani Pappuswamy; Valentin Goussev). 2013. The Morphological Imperative. In: Dryer; Matthew S. & Haspelmath; Martin (eds.) 2013. The World Atlas of Language Structures Online. Leipzig: Max Planck Institute for Evolutionary Anthropology. (Available online at https://wals.info/chapter/70),1,abb abk acl aco acu adk aeg ala amh amr ana anl apl ard arg arm arp ars ath ava awp ayr azi bab bam bbw bdk bej bel bem ber bfg bma bre brh brz bsk bsq bud bul bur cah cak car cay ceb chj chv cld cle cmh cml cmn coi coo cor cre cyv cze dag dbd dgr die dig diz dmi dni dyi eka emb emc epe err est eve evn far fin fua fye gam gim glc gmz goj grk grw guj gum ham heb her hin hix hlu hmi hui igb ik iri irq jak jaq jeb kas ket kew khk kil kio kis kmk kmp kms knd knm knr koa kob kod koi krb krc krd krk kro krq kse kte kty kui kut kuv kwe kwr kws kyg lad lak lan lav laz lil lim lit lng lno loz luo luv mab mac mak mam man map mar mau mbg mcd mdn meh mgo mhu miy mle mlt mme mna mns moe mop mos mrd mro msl mss mun mwe myi mym nan nap nbd nez nga nht niv nti ntn nub obo oix oka ood orh otm pan pau pip pms pol ppi prk psm pta pur qim qta ram ret rsu rus rwa scr sdw sgu shb shk shl shu slo sno snt so sou spa srd stn sue sug swa tag tas tau tbu tel tem ter tet tgr tir tiw tkl tml tms tna tnc tpn tsa tsh ttu tun tur tuv tvo tzo tzu udh udi ukr uld una uzb vai vot wap wau wch wel wic wlf wra wrd wrg wrk wwr yaq yim yko yng yny ypk yuk yur yus zaz zen zqc zqs zul,292,76475,0.0038182412
18A,Absence of Common Consonants,,18,Ian Maddieson. 2013. Absence of Common Consonants. In: Dryer; Matthew S. & Haspelmath; Martin (eds.) 2013. The World Atlas of Language Structures Online. Leipzig: Max Planck Institute for Evolutionary Anthropology. (Available online at https://wals.info/chapter/18),1,abi abk abm ach acm aco adz aea aeg agh aht aik ain aiz akn akw ala alb ald amc ame amh amo amu amz ana anc ani ao api apu arb arc arm arp asm ata ava awn awp aym aze bag bai baj bam baw bbf bco bee bej ben ber bet bir bis bki bkr bma bng bod bra brb bre brh bri brm brw bsk bsq bto bul bur cad cah cam car cax cay cck ccp cha che chk chl chq chu chv chw cil cle cmn cnl cnt cof coo cre cso cti ctl cve cyv dad dag dah dan dar ddf det dgb dgr die dio diz dni dnw don doy dre dts dum efi eja eng eve evn ewe ewo fas fef fij fin fre ful fur fuz fye ga gar gbb geo ger ghb gla gmb goa grb grk grw gua gwa had hai hak ham hau hba hin hix hmo hmr hok hop htc hum hun hup hve hzb iaa iba igb ign igs ijo ik ika imo ind ing ird irq irr irx iso ite ito iva iwm jak jaq jav jeb jeh jiv jng jom jpn jpr juh kab kad kal kas kch ked kef kek ker ket kew kfe kgi kgz kha khm kho khr khs kio kiw kkn kkv klm klv kly kmp kmu knd knk knm knr koa kob koh koi kom kor kot koy kpe krd krk kro kry kse ksg kss ktk kty kul kun kur kut kwa kwk kwo kws kyl kzy lad lah lak lam lat lav len lep lez lit lkk lkt llm lu lua lug lui luo lus luv maa mab mak mal mao map mar mau may maz mba mbm mei mgg mie mla mme mnc mnd mne mog mor mov mrd mrl mro mss mtp mui mum mun mxc mxm mya mzc nai nan nap nar nas nav nax nbk ndt ndy nep new nez nga ngi ngz nhn nht nim nis niv nko nkt nmb nnc nob non nor nti ntu nun nuu nyg nyi oca ogb oji ood orh orm otm pac pae pai pau paw pec phl pms poa poh pol prs psh psm pso puk pur qaw qco ram rap res rom ror rsc ruk rus rut sab san sba scs sdh sdw seb sed sel sha shi shk shs shu sin skp sla slp sml snc snd snh snm snt som soq sor spa squ sre srn sue sui sup svs swa tab tac tag tam tas teh tel ter tgk tgr tha tib tic tiw tks tlp tma tmn tmp tne toa tok tol ton tpa tru try tsg tsi tso ttn ttu tug tuk tul tun tur tuv twn tza umb una urk usa uzn vie wap wch win wiy wlf wma wnt woi wps wra wrs wuc xoo yan yap yaq yar yaw yay ycn yct yes yey ygr yko ykt yor ytu yuc yul yur yus zan zqc zul zun,503,76475,0.006577313
55A,Numeral Classifiers,,55,David Gil. 2013. Numeral Classifiers. In: Dryer; Matthew S. & Haspelmath; Martin (eds.) 2013. The World Atlas of Language Structures Online. Leipzig: Max Planck Institute for Evolutionary Anthropology. (Available online at https://wals.info/chapter/55),1,abk abo aco aeg agw ako ala alb amb ame amh ami amk aml amr apu ara arb arm aro ata atk ava awt bae bgv brh brl bsq bul bur but cap cba cct cha chc chi chk chv cin cjo cku cnl coo cpn cre ctm cul cyv dat den dga diz dji dre drg dum dyi eng epe err eve fij fin fma fre fur fut gaa gav gbb gdf geo ger gnn goo grr gua hau haw heb hin hix hpd hua hzb iaa igb ika imo ing irq jam jaq jiv jmm juh kat kch kew kfe kha kho kio kiw kku klm klt kmb knd knr knu kob koi kot kpe krf krk kut kzy lan lat lda let lez lim lkt luc lug lui luo maa mal map mar mau mbg mde mdk mdn mee mhi mis mit miy mkw mli mlk mll mne moe mos mrt msc mss msy mup muu mxc myi mym nah nai naj nar nas nav nbd ndy ngi ngy ngz nht ntu nug nyu ood orh ori pau pba pip pir pno pnr prc prh put pwn qcu qhu qim qui rap rcp rru ruk rus sal sdw see ses shk shs siu snc snh snt sue sul sup swa swt syu tag taw tgh tim tiw tkl tla tlf tll tmr tnn tob tol ton tps trn tso tun tuv uhi ung ura wap war was wem wgl win wor wrn xam xoo yes yid yim yko ymi yng yor yuc yuk ywl zul zun,260,76475,0.0033998038
59A,Possessive Classification,,59,Johanna Nichols; Balthasar Bickel. 2013. Possessive Classification. In: Dryer; Matthew S. & Haspelmath; Martin (eds.) 2013. The World Atlas of Language Structures Online. Leipzig: Max Planck Institute for Evolutionary Anthropology. (Available online at https://wals.info/chapter/59),2,alw amp asm bma boa brs buu chi chy dag die diy diz dni dre dum dyi eka ewe fua gbb goo grr hai hat hve iau ijo imo kat kay kch kho kim kio kiu knk knm knu koa kob koi kro lan lda lkt lug luv maa mau may mlk mne mot mrh mrt myi nai nbd ngi nim nug nyn orh oss pau poh pwn qui ram rap sal snm sul tau taw ter tgp tht tiw tkl tli ton tuk tun uhi was wem win wrn wsk yko yur,94,76475,0.0012291599
38A,Indefinite Articles,,38,Matthew S. Dryer. 2013. Indefinite Articles. In: Dryer; Matthew S. & Haspelmath; Martin (eds.) 2013. The World Atlas of Language Structures Online. Leipzig: Max Planck Institute for Evolutionary Anthropology. (Available online at https://wals.info/chapter/38),4,aar adi aeg ala arg arj asy ata bab bag bbu bco bdu bkr brn brp btk chi cmn cmy coo cpl crn deg dga dgb die doy egn eip epe gae gel gnn goe gok gua hai hnd ice ina ind iri izi jmo kan kfe kla knm kos kse kut kwo lmp mad mal map mar mas may mbi mde mka moo mpt ney ngb noo nti nyu obg oji ond ood per pms psm rwe som sun svs tbu tin tja tpn tsi tuk ung url vai wch wel xas xho yuc yuw zay,98,76475,0.0012814646
87A,Order of Adjective and Noun,,87,Matthew S. Dryer. 2013. Order of Adjective and Noun. In: Dryer; Matthew S. & Haspelmath; Martin (eds.) 2013. The World Atlas of Language Structures Online. Leipzig: Max Planck Institute for Evolutionary Anthropology. (Available online at https://wals.info/chapter/87),2,aab aar abk abn abo abu abv ace acg acl adg adi ady adz aeg agb agh agm agt ajg akh akn alb alk all aln aly ama amc ame aml amn amo amp amq amr ams amx ana anc ane ang anj ano anu any ao aoj api apl apt apu arg arj aro arq asm asy atm au awe awi awt awy ayi ayo ayw baa bab bae baf bag baj bam baq bar bas baw bbf bbl bch bdm bdu bdw bem ber bfg bfi bgm bid bik bin bir biu bkr bku ble bln blu blx blz bma bni bnk bnn bok bon bra bre brf bri brl brm brn brp brq bry bsh bsi bsq bsr bto bub bud buj bum bun bus buu bvi bwc cai cas cav cax cbo ccm cde cem cga chb chi chq chr chw cic cld cle cme cmr cnl cnm coc cop cor cpl crn cro crp cso cti ctl ctm ctw cui cup cya dag dan daw day ddj dds dga dgb dgo dha did dig dim din dio diy dji djn dma dms don doy dre dua duk dum dun dyi edo ega egn els emb eme emm eno epe erk err ese ewe ewo fas fij foe fon fre fua ful fur fut fye ga gaa gae gan gar gav gel ggu ghr gjj gku gla gln gmw gnd gnn goa goe goo grb grf grr grw gto gua gug guh gul guu guw gwa gyc hai hal ham har hat haw hdi heb heh hem hid hix hlp hma hmo hna hnd hoa hol hpd huc hup hwr hya iba idn ifm igb ige igs ik ika ila imo ina ind inn iqu iri irq irr irx isa ita jab jad jar jbt jel jin jlu jmo jms jng jrw juh juk jva kaa kae kam kar kau kba kbl kbo kbw kby kch kdz kel ker kfe kga kgr kgu kgy khd khm khs kie kik kin kir kis kje kkt kkv kll klq klv klw kma kmb kmi kmj kmn kmo kmp kmu kmw kmz knc kng knm kno knr knz koa kob koe kok kom kon kos kpe kpw kqq krb krd krh kri krk kro krr kse ksg ksn kta ktc kte ktl ktu kuo kuu kwa kwb kwm kwn kwy kwz kya kyk kyl kyn kyo kyz laa lab lad lag lal lan lao lar lav lbu lda ldo leb lel len lep les let lew lgi lgt lgu lic lin lis lkt llm lmb lmg lmh lml lmp lon lot lou luc lug lui luo luv luy maa mab mac mad mae mal man mao mar mas maw may mba mbe mbi mbl mbm mbo mbr mbt mby mda mde mdg mdl mdn mds mdw mea mee meh mek mey mga mgk mgo mgq mgu mhk mhl mie mii mij min mis miy miz mka mkd mke mkg mkj mku mkz mla mlg mlk mlm mlu mmb mmv mmw mna mng mnm mnv moa mof mok mon moo mor mot mou mpa mpo mpr mpt mpu mra mrh mrl mro mrq mrr mrt mru msc msk msl msm msn mtb mts mtu mua mud mum mup mur mwe mwo mxa mxc mxe mxj mxo mxp mxy myi myn myr mzc nab naj nak nal nam nan nar nat nau nav nax nbd nbr ncm ndb nde ndi ndj ndo ndr ndt ndu neh ney ngd ngg ngj ngk ngl ngm ngn ngo ngt ngu ngz nhh nhm nht nia nif niu nkb nkk nkn nko nku nma nnc nnd nng nnk noc non noo nph nrg nse ntj nto nua nue nun nup nus nyh nyi nyk nym nze olo omh omi orh ori ork oro orw ory osa otr pae pai pam par pat pau per pga pia pir pit pkt plg plh plk pms png pnu pnx poh pok por ppi pre prh prs psw pul pum pun pur qia rag ral ram rao rap ras raw rga rgc rny rom rot rov rru rsu rum run rwa saa sah sak sam sap sdw sea seb sed sem sen ses sgb sgu she shi shl shm shn sht sia sil sim sio sis skk sko sku sla slb sle slp sme sml smn sng snm snn snt so sob som spa spi src srd sre srn sro sti sud sue sug sul sun sup swa syu tab taf tah taj tak tao tat tau taw tba tbl tbo tbt tbu tbw tdi tdr ten teo ter tes tgk tgn tgo tha thd thy tia tib tid tik tim tkl tlf tlp tma tmm tmn tmo tmr tna tnc tne tng tnk tnn tno tny ton toz tpr tps trb tri tsg tsk tsm ttd ttn tuk tum tun tvl uhi uld uli una ung ura urk url urn urt usa ute vaf vai ven vie vif vnm wag wah wal wap wat wbn wch wed wel wic wiy wlf wlo wma wmu wn wna wog woi wol wom wra wrd wrk wrl wrm wsk wth xam xas xbi xer xho xoo yag yal yam yao yap yay yel yi yid yiw yor yrm yuc yul zag zai zap zar zaz zul zun zya zzo,879,76475,0.011493952
26A,Prefixing vs. Suffixing in Inflectional Morphology,,26,Matthew S. Dryer. 2013. Prefixing vs. Suffixing in Inflectional Morphology. In: Dryer; Matthew S. & Haspelmath; Martin (eds.) 2013. The World Atlas of Language Structures Online. Leipzig: Max Planck Institute for Evolutionary Anthropology. (Available online at https://wals.info/chapter/26),3,aeg aga amh amr amx ao arg asy awt bae bag baq bej bel ber bil bre brr bry bti bur chi chk chx cln coo cze dgb dgo drm eud fqs fua fur fye gae gds geo gku gmz goa gur heb hlp hua igs ijo ika kfe kiw kmh kmp kmr knm knw kom krd kry kut lat lav lec lot mab mcc mdn mdo mei mki mnm mok mou mrl msc mui mur mzh nak ngl ngm niv nkb nph nwd olo ong par pba pia pir pkt poh prs qia qui rut sem shp sht slb smn so sup taj tao tau ten tgr tkl tma tnn ton tsi tsz usr was wed wra wrk yur zag zpr,123,76475,0.0016083687
60A,Genitives; Adjectives and Relative Clauses,,60,David Gil. 2013. Genitives; Adjectives and Relative Clauses. In: Dryer; Matthew S. & Haspelmath; Martin (eds.) 2013. The World Atlas of Language Structures Online. Leipzig: Max Planck Institute for Evolutionary Anthropology. (Available online at https://wals.info/chapter/60),6,abk abu agw alb ath ava bae bel bgv bok brn bsq cha chk dat drg eng epe eve fin fre gav geo heb hin hpd hun hzb ika imo ing irq jam jaq kan kay kch kfe kha kor kwz kyl lai lez luc mau mee mhi miy mks msc nbd nht pba pnr qim rus ses shk snm sup tam tgh tiw tts tuk tur ura vaf war wra yid yim yko yng zul,77,76475,0.001006865
121A,Comparative Constructions,,121,Leon Stassen. 2013. Comparative Constructions. In: Dryer; Matthew S. & Haspelmath; Martin (eds.) 2013. The World Atlas of Language Structures Online. Leipzig: Max Planck Institute for Evolutionary Anthropology. (Available online at https://wals.info/chapter/121),2,ame bar cic dga dgb dua fus gbb hau igb kan kfe khm kug lin lnd mby mnd nan ngu obg rnd sap shn stn swa tha vie wlf yah yor zul,33,76475,0.00043151356
69A,Position of Tense-Aspect Affixes,,69,Matthew S. Dryer. 2013. Position of Tense-Aspect Affixes. In: Dryer; Matthew S. & Haspelmath; Martin (eds.) 2013. The World Atlas of Language Structures Online. Leipzig: Max Planck Institute for Evolutionary Anthropology. (Available online at https://wals.info/chapter/69),4,aeg agc amh amr ang anu any arg arq asy ata ats awy bag bbl bbw bdu bfg bia bkl blr bma boa bsq bti ccm chh chk chq ckl cle cya cyv cze dds dgb die dio eno gae gbs gmz gnb ham heb hup hve iri ito izi jak jms kab kan kgr kik kls kmr kon kpm krd kre kro kry ktm kuo kwy laa lar lat lbu ldo leg lel lmg lml maa mbl mcc mea meh mer mga mki mmn moh mok mrl msk mug mur mxo myi naj nak nam nan ncm ndb ndj ngo nym nyu ond pai per pkt poh prs qia rik rus rut sak sar shs sht sod src stn sup taj tee tep tes tic tim tli tlo tne tot tus txj tzo tzu vai wag wic wrw wya xho yei ygr yul zag,146,76475,0.0019091206
58B,Number of Possessive Nouns,,58,Balthasar Bickel; Johanna Nichols. 2013. Obligatory Possessive Inflection. In: Dryer; Matthew S. & Haspelmath; Martin (eds.) 2013. The World Atlas of Language Structures Online. Leipzig: Max Planck Institute for Evolutionary Anthropology. (Available online at https://wals.info/chapter/58),1,abk aco aeg ain ala alw ame amh amp ane apu arm arp asm awp awt aym baa bag bej bel bma boa brh brk brm brr brs bsq bur buu bzi cax chi chk cho chy cin cnl cre ctm cyv dag die dig diy diz djp dni dre dum dyi eka eng epe eve ewe fin fre fua fur gbb geo ger gmz goo grb grk grr grw hai hat hau heb hin hix hmo hua hun hve iau ijo ik imo ind ing jak jpn juh kat kay kch ket kew kha kho khs kim kio kln knd knk knm knp knr knu koa kob koi kor krk kro kui kut kzy lan lav lda lez lim lkt lug luv maa mal mao map mar mau may mdk mei mlk mnd mne mot mpa mrh mrt mss mto mxc myi nah nai nan nar nbd nca nez ngi nim nkk ntu nug nyn ond orh ori oss otm pai pau prh prs pso pwn qim qui ram rap res rus sah sal sam san siu sla snm snt spa squ sue sul sup swa syu tag tau taw ter tgp tha tht tib tiw tkl tlf tli ton tot tuk tun tur tuv uhi ung vie wap war wch wem wic win wra wrl wrn wrs wry wsk yag yaq yes yim yko yli yor yuc yur zqc zul,233,76475,0.0030467473
