parameter_id,parameter_name,parameter_description,chapter_id,chapter_citation,value,same_value_language_ids,value_language_count,language_count_total,count_ratio
94A,Order of Adverbial Subordinator and Clause,,94,Matthew S. Dryer. 2013. Order of Adverbial Subordinator and Clause. In: Dryer; Matthew S. & Haspelmath; Martin (eds.) 2013. The World Atlas of Language Structures Online. Leipzig: Max Planck Institute for Evolutionary Anthropology. (Available online at https://wals.info/chapter/94),1,abi ace acl aco adn aeg alb alk all aln alw aml amo amr ams ani apu arg arj arm arq arw asy ata au ayw bag baj bak baq bar bbw bdu bfg bho bik bir bka bkl bkr bma bnr bnu bre brf bsh bsk btk bto bug bul bum bvi bwc ccm cem cha chk chq chr chw chx cic ckl cle cmy coo cop cpl crn cso cya cyv cze dhr did din dio djp dom dre dsh duk dut efi eng eno erk est ewe ewo fij fin fre fua fut fye ga gae geo ger ggu gmw gok grf grk grr gud guj gwa hal hau haw heb hin hmo hna hnd hoa htc hun hve iaa iba ifm ifu igb ind iri ita ite izi jak jmo juh kam kan kau kch ker kfe khl khm khs kik kil kir kis kkt kkv klm kls klv kmj knk kno koe kos krb krd kro krr kry kse ksn kty kut kwn kwy kya laa lac lao lat lbu lda lel len lgu lit llm lmb lmg lmh lmp lnd lon lou luv maa mag mai mal mam man mao mau may mbm mbr mbt mco mcv mde mds mea mee meh mek men mer mga mgu min miy mka mkg mlg mlu mmn mng mog moh mok mon mov mra mro mrq msq mup mus mut mwb mxc mxj mxo mxp myg myi mzh naj nan nav nca ndo ndt ndy nez ngd ngm ngo nhh nhm nht nia niu nke nkn non noo nor nsg nua nue nyi obo ocu oji olo ond orh otm paa pai pal pan par pat pip pkt plg plh pms pnn poh pol prs psh psm pul qui rap rny rom rot rov rsu rus rwe sah sak sam san sar scr sdw shl shn sim sio siu som son spa squ srb srd sti sud sue sul sun sup sus swa swe swt tab tag tah taj tao tbo tbt tee ten teo tep ter tes tgh tgk tha thy tic tim tin tiw tla tlo tna tne tng tnn tno tob tou tri tsi tsk ttn tuk tvo txj tzo tzu udi ukr uld ung urd uzb vai vie vnm wal war wch wel wic wik wlf wlo wma wme wol xas yap yay yns yor yur zai zqo zul zzo,398,76475,0.0052043153
90A,Order of Relative Clause and Noun,,90,Matthew S. Dryer. 2013. Order of Relative Clause and Noun. In: Dryer; Matthew S. & Haspelmath; Martin (eds.) 2013. The World Atlas of Language Structures Online. Leipzig: Max Planck Institute for Evolutionary Anthropology. (Available online at https://wals.info/chapter/90),1,aar abi abo abu abv ace acg acl adi adz aeg agm ajg alb alk all aly ame aml amo amp amq amr ana anc ang anj anu any aoj apu apw arg arj aro arq arw asy awe baa bab bag baj baq bar bbl bbu bco bej ber bfg bfi bgr bid bii bik bio bir bka bkr bku blr bma bmb bni bob bok bre brf brh brn brp brs bsh bsr btk bto bud bug bul bum bus buu bvi bwc cah cak cav cax ccm cde ceb cem cha chj chp chq chr chw cic cld cle cmh cmn cmy cnm coo cop cor cpl crn cso ctl ctm cub cya cze dag dan day ddj deg des did din dio djm dni dom doy dre dsh duk dut dyi efi egn emb eme eng eno erk err est eud ewe ewo fij fin fon fre fri fua fur fut fye gae gap gbb gel geo ger ghb gmz gnb gnd gok grb grf grk grw gud gul gum gwa hal hat hau haw hdi heb hei hid hix hmo hna hnd hoa hol htc huc hui hup hve hwr hya iaa iau iba ice idn ifu igb ign igs ik ila ind iri irq isa ita izi jab jak jeb jmo juh juk kam kan kar kau kay kbl kbt kbw kch kel ken ker kfe kgr khl khm khs kik kir kis kje kkt klm klr klv klw kma kmj knc kni knk knm knr knz koe kos kpm kpw krb krd kre kri kro krr kse ksg ktc kte ktl kuo kwn kws kwz kyl kyo kyq lab lan lao lat lbu lda leg lel len let lew lgt lgu lit lmg lmh lmp lmu lnd lon lug lui luo luv maa mab mad maj mal mam mao mas mau maw may mbm mbr mby mco mcv mdg mdo mds mea mee meh men mga mgo mgq mgu min miy mkj mlg mlu mmb mmn mna mng mnm mno moa mof mok mos mot mou mpr mpu mrl mro mrq msk msl msm mud mum mup mur mus mut mwo mxc mxe mxo mxp mxy myg myi myn naj nal nan nar nat nbd ncm ndo ndr ndt ndy neh ney nez ngl ngm ngo ngz nhh nhm nht nia nif niu nkn nko nku non noo nor nrg nua nue nug nun nup nza obg obo oji olo ood orh orw otm paa pai pal par pat pau pba per pga pip pkt plg plh pms pno pnx pod poh pol por pre prs psh psw ptt pul pur qum rag rap rny rom ron rot rov rsu run rus rwe sah sak sam san sdw sea sed see ses sgb sgu shb shn sht sio sir sis skr slb sle sml snh so sob som spa src srd sre sro sud sul sun swa swe swt tab taf tag tah tai taj tak tar tat taw tbo tbt tbu tce tee ten teo tep ter tes tgk tgn tha thy tid tim tin tiw tke tla tlp tls tmm tmr tna tne tng tnk tnn tno tny toz tpn tpt trb tri trm tsi tsk ttd ttn tun tvl txj tzu ukr uld uli ung url urt ute vaf vie vnm wah wak wal war wch wel wic wlf wlo wma wol xbi xho xoo yag yap yaq yor yuc yuk yul zag zai zch zhn zul zzo,579,76475,0.0075711017
58A,Obligatory Possessive Inflection,,58,Balthasar Bickel; Johanna Nichols. 2013. Obligatory Possessive Inflection. In: Dryer; Matthew S. & Haspelmath; Martin (eds.) 2013. The World Atlas of Language Structures Online. Leipzig: Max Planck Institute for Evolutionary Anthropology. (Available online at https://wals.info/chapter/58),2,abk aeg ain ala alw ame amh amp ane apu arm arp awp awt aym baa bag bej bma boa brh brk brm brr bsq buu bzi cha chi chk chy cyv dag dig diy diz djp dre dum dyi eng ewe fij fin fre fua fur gbb geo ger gmz goo grb grk grr grw gua hau heb hin hmo hua hun hve iau ijo ik imo ind ing jak jpn juh kat kay kch ket kew kha khs kim kio kln knd knk knm knp knr knu kob kor kri kro kzy lan lav lda lez lkt lug luv maa mal mao map mar mau may mdk mei mlk mnd mot mpa mrh mrt mss mto mxc myi nah nai nan nar nbd nca ngi nim nkk ntu nug nyn ond orh ori otm pai pau pnr poh prh prs pso qim ram rap rus sah sam san siu sla snm snt spa squ sue sul sup swa syu tag tau taw ter tha tht tib tkl tlf tli ton tru tuk tur tuv uhi ung vie war was wem wic wra wrl wrn wrs wry wsk yag yaq yes yim yko yli yor yuc yur zqc zul,201,76475,0.00262831
66A,The Past Tense,,66,Östen Dahl; Viveka Velupillai. 2013. The Past Tense. In: Dryer; Matthew S. & Haspelmath; Martin (eds.) 2013. The World Atlas of Language Structures Online. Leipzig: Max Planck Institute for Evolutionary Anthropology. (Available online at https://wals.info/chapter/66),4,abi aco ain akn ana apu arp bag bma bng brm bui ceb cha chk cnt cpn cre cuu dio egn ewe grf grw hal hau haw hmo ind ise jak jav juh kay ket khm kio kmu krk kro kse kut lah lai lan lao lav lkt mak mal man map mar may mei mnd mtu mxc nak nca ngm niv ond pai plg pnn prh ren san shu sml snc sun tag tem tha toj tug tuk vie war wic wly yct ygr yko yor,88,76475,0.0011507028
21B,Exponence of Tense-Aspect-Mood Inflection,,21,Balthasar Bickel; Johanna Nichols. 2013. Exponence of Selected Inflectional Formatives. In: Dryer; Matthew S. & Haspelmath; Martin (eds.) 2013. The World Atlas of Language Structures Online. Leipzig: Max Planck Institute for Evolutionary Anthropology. (Available online at https://wals.info/chapter/21),1,abi abk ala ame amp ana apu arp asm atk awp bbw bej bel bma bnj brm brs bsq bur chk cho cku cnl cre cyv dig dni eka eng epe eve fij fin gar ger goo grb grw gua hai hat hau hix hmo hun iau imo ind ing jak jel jpn kha kho khs kio kis knd knm koa kor krk kro kut lah lai lav lez lkt lug luv mal mao mar mau mei mnd mrt mss mun mxc nah nan nbd ngi niv nmb ntu ond orh pai prh prs pur qim ram rap rus sla snm squ sup swa tag ter tha tli tot tru tur vie wch wem wic wra wrd wrm yag yaq yid yor yuc yur zqc zul,127,76475,0.0016606734
143A,Order of Negative Morpheme and Verb,,143,Matthew S. Dryer. 2013. Order of Negative Morpheme and Verb. In: Dryer; Matthew S. & Haspelmath; Martin (eds.) 2013. The World Atlas of Language Structures Online. Leipzig: Max Planck Institute for Evolutionary Anthropology. (Available online at https://wals.info/chapter/143),2,aab aba abv agm aja alk aln amq anc ane ani anu ara asm ava bag bak bas baw ben bgr big bik bir bka bud bum bus bzi chp chs chw cmr cnl cti dgo die dni duk dum ega ese gbs giz gla gmz goe gul gwo hat hma hna iau ige igs irr isa iwm jab jar jmo juk kaa kar kau kel ken ker kho kie kim kkv kmz kng kpw krn krr kti kxo kyl kyp laa lab lag lai lel lgt lin lkt lmh lmn lon lug mac mad mas may mba mbm mbr mby mda mdg mdo mdw mea meh mek mgu mhi mig miz mlu mmb mor mou mpu msm mtb myg nbm ngm ngz nma nnk nrg nua nup nza nze olo ong osa pat pod pog qaw ron rsu sah san saw sel sgb shb shi sht shy sio skk sla sme snm sro tab tiv tpr trb tru tsz udm uld urk wec wma wna wom wrm xav yul,171,76475,0.002236025
33A,Coding of Nominal Plurality,,33,Matthew S. Dryer. 2013. Coding of Nominal Plurality. In: Dryer; Matthew S. & Haspelmath; Martin (eds.) 2013. The World Atlas of Language Structures Online. Leipzig: Max Planck Institute for Evolutionary Anthropology. (Available online at https://wals.info/chapter/33),8,agm ajg ala amq anu bag bak bao bbf bgo bik bka bnb bry bsq bus cav cyv daw dds dim dun eme epe ewe gar goo hat hna hpd jel juh kaa kar ken kgy khd khr kis knm koa koe kpo ksa kse let lgu mak mam maw mby mcc mdg mek mgg mkj mnz mok msn new ngt nph nup nwd pum qia ram sar sem sng svs tab ter tgl tim tsf wrw ygr yul zar,81,76475,0.0010591696
63A,Noun Phrase Conjunction,,63,Leon Stassen. 2013. Noun Phrase Conjunction. In: Dryer; Matthew S. & Haspelmath; Martin (eds.) 2013. The World Atlas of Language Structures Online. Leipzig: Max Planck Institute for Evolutionary Anthropology. (Available online at https://wals.info/chapter/63),2,ace acl akn ame apl bab bar bgg bir bkr bln bma brm bui car cbo cha cil cmh cnl cop cso din dua eka evn ewe fij fni gll goa grn grw hau hcr ind jak jaq jpn kei khs kls kng knm knr kob kpe kwk lda lim lis lnd lon mao mbt mis miz mmv mnd mnm moj moo mtu mxp nav nbh nbm ngk nko ntu nue pal pip pir plr pna rot rti sam san sed shn shu sra swa tah ter tla tna tne tno tup tzu urk wlf wsk yav ykt yor zai zar zul,103,76475,0.0013468454
89A,Order of Numeral and Noun,,89,Matthew S. Dryer. 2013. Order of Numeral and Noun. In: Dryer; Matthew S. & Haspelmath; Martin (eds.) 2013. The World Atlas of Language Structures Online. Leipzig: Max Planck Institute for Evolutionary Anthropology. (Available online at https://wals.info/chapter/89),2,aab aar aba abo abu abv acl acn adg adi adz agb agh agm agt ajg akh akn alk all aln aly ama amb ame aml amo amp amq amt amx anc ane ang anj ano anu any ao aoj apt apw asm atk au awe awi awt awy baa bab bag bai bak bam bar bas baw bbl bbu bdu bem ber bfi bgm bgr bid bik bin bir bka bku ble blt blx blz bmb bni bnn boa bod bok bra bri brl brm brn brp bry bud bum bus buu bvi cai cas cct cem chg chi chs chw cic cmr cro cti ctm dag dan day dds deg dga dgb dgo dha did die dig dim din dio diy dlm dma dms doy duk dul dum dun dyi edo efi ega egn eip eka emb emm epe erk err ewe ewo fas fon for fua fur fye gah gal gap gar gbb gbs giz gln gmw goe grb grj grw gud gul gur guu gwa gwo gyc hai ham han hat hau hdi heh hem hma hna hnd hol huc hya iau idn idu ifm igb ige ik imo ina inn irq irr irx isa iwm jab jad jel jms jng juh juk kac kae kar kau kbw kch kel ken ker kew kfe kga kgr kgy khd khm kie kim kin kir kis kje kkv klq kmb kmi kmj kmn kmo kmp kmr kmu kmz knc kni knk knm knr knz koa kob koe kok kon kos kpe kpw kqq kro krr kse ksg ksn kta ktc kte kti kuu kwb kwn kwt kyk kyl kyo lab lad lag lah lai lal lan lao lar lav lbu lda ldo leb lel len lep les let lew lgi lgt lis lkt llm lmg lmh lml lmu lnd lon lot lug luo luv ma maa mab mad mae maj mal man mao mar mas maw may mba mbe mbl mbm mbr mbt mby mda mde mdg mdl mdn mdo mdw mea mee mei mey mga mgi mgo mgq mgu mhl mij miy miz mka mkd mkg mkl mku mlg mlk mlu mmi mmv mmw mni mnm mnv mnz mof mok mom mon moo mor mot mou mpo mpt mpu mrh mri mrl mro mrr mru msc msg msk msl msm mtb mts mua mud mum mup mur mwe mwo mxe myg myn nab nal nam nan nax nbd nbr ncm nde ndi ndj ndo ndt ndu new ney ngb ngg ngk ngm ngn ngo ngt ngu ngz nis nkn nko nku nma nnk non noo nph nrg ntj nto nua nue nup nus nyh nyk nym nza nze obo olo omh omi ora orh ori oro orw otr owi paa pai par pat pau paw per pia pis pit pkt plh pms pnx pod poh pok pre prh prk psw pum pun qia rag ral ram raw rgc rny ron rot rum rwa sah sak san sdw seb sem ser sgb sgu she shl shn sht sio skk sko sku sla slb sle slp smn sng snt so sob spi sro sud sue sul sup swa tab tam tao tau taw tba tbl tbt tbu tbw tdi tdr ten ter tes tet tgl tgn tgo tha thd thk thy tib tid tik tis tkl tlf tlo tmm tmn tmo tna tne tng tnn tou toz tpr trb trr ttd tte ttn tuk tum tvt uld una ung ura urt usa vai ven vif vnm wag wah wal wap wma wmu wna woi wra wsk wwa xam xas xbi xho yal yar yel ygr yi yid yiw ylm yor yqy yuc yul zag zan zar,608,76475,0.007950311
91A,Order of Degree Word and Adjective,,91,Matthew S. Dryer. 2013. Order of Degree Word and Adjective. In: Dryer; Matthew S. & Haspelmath; Martin (eds.) 2013. The World Atlas of Language Structures Online. Leipzig: Max Planck Institute for Evolutionary Anthropology. (Available online at https://wals.info/chapter/91),2,abu adi aeg agm akn ala amc ame amq amr ams anj apl asm au awe awt baw bbw bdw bfi bid bkl bmb bnn boq brn brp bry bsh bud car cct chs chw cld cmr cnm cro cso ctm dag dgb did die din djm dma dre ese fua fut gjj gln gmw goa hai hal hau haw hix hmo hnd hoa iaa isa jad jmo jms kau kbw kch kel kgr khm khn khs kkv kmz kng knr kob krb kre kri krr ksg kta kwo kwt lah lai lal lao len let lmp lon lug maa mac mad mao mau may mbe mee mgi mie min miz mku mlu mna mnm mon mpa mxj mxo mxp nab nak nam nca ndo ngd ngm ngt ngz nia niu nkn nko nnc nnd nnk nun nuu obo olo oro pit pkn plg pnu pog pok ram rot sal san seb sed sim slp sng snm snt son sre srn sro sul syu tah tak tar taw tgk tha tib tid tim tja ttd ttn tun ung urk url wal wbn wlf wlo wol wor wra wsk xav yar ycn,192,76475,0.0025106245
143E,Preverbal Negative Morphemes,,143,Matthew S. Dryer. 2013. Order of Negative Morpheme and Verb. In: Dryer; Matthew S. & Haspelmath; Martin (eds.) 2013. The World Atlas of Language Structures Online. Leipzig: Max Planck Institute for Evolutionary Anthropology. (Available online at https://wals.info/chapter/143),4,aab aar aba abv acu adi agm aja alk aln aly amc amp amq anc ane ang ani anu apl apt ara arc asm ath ava awe aze azi bag bak bas baw ben bgr big bik bio bir bka ble bln boa boj brh brn brr brs bsk bti bud bum bus but bzi can car cas cay cbo cct cde chp chs chv chw cln cmr cnl cnm coa cpn cqt crp cti ctm cub dds des deu dgo die dig dim dio dms dni duk dum efi ega egn emb epe ese fua ful ga gah gal gar gbs gim giz gla gln gmz god goe gon grw gul gwo har hat hdi hid hix hma hmi hna hpd hum hzb iau idu ige igs ijo ika ing irq irr irx isa iwm jab jar jeb jiv jmo jms jpn juk kaa kab kac kar kas kau kay kbo kel kem ken ker kha khl kho kie kim kkp kkv kmn kmo kmr kmz knd kng knm knr knw koa kob kok kol koy kpw krc krh kri krn krr kta kti kun kus kuv kwz kxo kyl kyp kyr laa lab lag lai lav lec lel lew lez lgt lin lkt lmg lmh lmn lon lug mab mac mad map mas may mba mbm mbr mby mda mdg mdo mdw mea mee meh mei mek mgu mhi mhl mig mii mik mis miz mkh mki mlg mlu mmb mnc mne mor mot mou mpt mpu mrs msc msg msl msm mtb mts mui myg mym mzc nas nbd nbm ndt nep ngl ngm ngn ngz nis niv nku nma nmb nnk noc noo nrg nsn ntj nua nup nza nze olo omh ong osa oya pae pat paw pec pia pit pme pod pog prh prk psj ptw qaw rao ret rit ron rsu rum sah san saw sba sdw sel sem sgb shb shh shi shk sht shy sia sin sio skk sla sme smn snm sro sug syu tab tan tao tba tbu tel tir tiv tlo tma tml tne ton tpr tpt trb tru tsf tsz tuc tul tun tur tuv tuy udm uld urk urn uyg uzb wai wao wap was wau wbn wec wly wma wna wom wra wrm xav yam yar ykt ypk yrm yrr yul zag zan zay,390,76475,0.005099706
68A,The Perfect,,68,Östen Dahl; Viveka Velupillai. 2013. The Perfect. In: Dryer; Matthew S. & Haspelmath; Martin (eds.) 2013. The World Atlas of Language Structures Online. Leipzig: Max Planck Institute for Evolutionary Anthropology. (Available online at https://wals.info/chapter/68),3,abk akn aly amh arm asm awn aze bar bej ben blc bng brh bsq bul bur but cnt coc cpl cpn eve fin grb grf hin imo jiv kew kha kho kik knd knr krk kro kui lah lai lat lda lez luv mai man mao mne mtg mtu mwe nak nbr ood orh pai pan plg ram rap raw ruk ses sla sup swa tah tem tgr tml toj tuc udm uyg vie wlf ygr zqc zul,80,76475,0.0010460935
117A,Predicative Possession,,117,Leon Stassen. 2013. Predicative Possession. In: Dryer; Matthew S. & Haspelmath; Martin (eds.) 2013. The World Atlas of Language Structures Online. Leipzig: Max Planck Institute for Evolutionary Anthropology. (Available online at https://wals.info/chapter/117),4,acl ala ame apl bar bri car chk cil coo dag diy dua dyi eka gid gll goa hau hix kay knr lan lda lnd mbo mbt mga mmv mtu mup mxp myi nav nbm ngl nko nue pau pit rot san sdw shn siu so som sup swa ter wsk yid yim yko zan zpi zqc zul,59,76475,0.00077149394
120A,Zero Copula for Predicate Nominals,,120,Leon Stassen. 2013. Zero Copula for Predicate Nominals. In: Dryer; Matthew S. & Haspelmath; Martin (eds.) 2013. The World Atlas of Language Structures Online. Leipzig: Max Planck Institute for Evolutionary Anthropology. (Available online at https://wals.info/chapter/120),2,abm ace acl aeg agm ahu ame amp amr aro arp asm awt baa bag ben bgo bma bod brj brm brr bui car cbo chr cil cmh cnl cop cze dab diy diz dmi dua dyi eka epe eve evn fni for frd gjj gll goa gua gud gum guu heb hix hop hun ik imo ind irq iwa jab jeb kat kew kgu kha khm klv knd knm knr kob kta ktl kty kwa kzy lah lat lda len lit lon luo mac mao mau mbt mie mku mlk mlt mme mng mnm mns mok mou myi nai nak nar nas ndi ngk ngl niu niv ntu ojs orh pau pit plh plr pol pop ptp qcu qim ram rem ret rot rti rus sal sam sed shk shl skp sng snh snm snt som sor sre sro sun tah tas tbu tel tgk tha tiw tla tml tmr tna tng tot tsh tug tuk tup uhi ung urk usa uzb vie wlo wol wrp wsk yag yaq ygr yid yur yuw,175,76475,0.0022883294
21A,Exponence of Selected Inflectional Formatives,,21,Balthasar Bickel; Johanna Nichols. 2013. Exponence of Selected Inflectional Formatives. In: Dryer; Matthew S. & Haspelmath; Martin (eds.) 2013. The World Atlas of Language Structures Online. Leipzig: Max Planck Institute for Evolutionary Anthropology. (Available online at https://wals.info/chapter/21),5,abi abk aco aeg ala ame apu arp asm atk bag bbw brr cha cho cku cnl cyv dag dni eka eng fij fre grb gua hai hat hau heb hix hmo hve iau ind jak jel kch ket kio kis kiw koi krk kro lan lav lkt luv map mau may mxc niv nmb ond otm prh san sla sup swa ter tha tiw tot vie war wch wrm yag yuc yur zul,75,76475,0.0009807127
41A,Distance Contrasts in Demonstratives,,41,Holger Diessel. 2013. Distance Contrasts in Demonstratives. In: Dryer; Matthew S. & Haspelmath; Martin (eds.) 2013. The World Atlas of Language Structures Online. Leipzig: Max Planck Institute for Evolutionary Anthropology. (Available online at https://wals.info/chapter/41),2,abk aeg afr ain ala ao apu arg arp bad bak bel bfg brm bur bya cnl cnt coo cub cze djr dre dyi egn eng epe eve evn ewe fin goo guu heb hun imo ind ing inr ita jak kab kas kay kha kho kio kis klm knd knm knr kob kok krg kwa kwm kyl lat lim lit lon mac mak mei mhi miy mlt mnd mnm moj mrt mss mul mxc mym nbd ndy nez ngi ngl ngz niv nku nun ond orh pai pan pip pnn prh prs ram ret rus sla sml so swa swe tau tiw tml tna tng tru tsi tur tus udh urd ute vie wam wel wic wly wrg wrk yag yko ynk yor yus,126,76475,0.0016475973
118A,Predicative Adjectives,,118,Leon Stassen. 2013. Predicative Adjectives. In: Dryer; Matthew S. & Haspelmath; Martin (eds.) 2013. The World Atlas of Language Structures Online. Leipzig: Max Planck Institute for Evolutionary Anthropology. (Available online at https://wals.info/chapter/118),3,acl acm akn ala arc arp bab bam bar bej bln bri brj brs bui cah che cil cmh cop cso dab dgb diz dmi dua ewe frd gbb gol grn grw gud hmr hui igb irq iwa jpn kbl kho khs kku knm knr kor kpe ksm lad lda lep lnd luo maa mao map mau maw mbt mlk mnm moo mtu mun mxp myi nar nbh ndi ngl nht nko nue nup orh otm pms pop pwn rti shl shn som sor sup swa tah tbu tep tne tsh tup ung vai wch wic wrp yim zai zan zar zul,103,76475,0.0013468454
144J,SVNegO Order,,144,Matthew S. Dryer. 2013. Position of Negative Morpheme With Respect to Subject; Object; and Verb. In: Dryer; Matthew S. & Haspelmath; Martin (eds.) 2013. The World Atlas of Language Structures Online. Leipzig: Max Planck Institute for Evolutionary Anthropology. (Available online at https://wals.info/chapter/144),7,aab abi abu acg acm adz aja akn alb alk aln amq anc ane apu arg arj arm aro arp arq asy au bab bae bag bai bak bar bbl bch ber bgo bgr bia bik bir bka bkr bku blz bmb bni bnn bob bol bra brf bsh btk bud bug bul bum buy bvi bwc cai cga chr chw cic cmy cnt coc cze deg dga dgb dgo dre dua duk dut ebi ega egn eng eno erk err est ewe fin fon fut fye gbb gbs ger gku gla goe gok grk gud gul gwa gwo hak hat hau heb heh hmo hna hnd hol htc huc hun hve hya iaa iba ige igs ila ind iqu irr ita jab jar jmo juh juk kad kan kar kba kbw kby kch kdw kel ken ker kfe kga khm khn khs kik kil kin kir kis kkv klv kmu kni knk kom kos kpw kre ksg ksn ktc kwa kwn kwy kyl kzy laa lab lac lag lan lao lat lbu ldo ldu leb leg lel let lgi lgt lic lin lit llm lmh lmp lnd lon lou luc lug luo luv ma mad mae maj mao mas mau may mbm mbr mby mcd mcv mda mdg mdo mea meh mgk mgu mhu mie mkd mlu mmb mmv mna mnd moe mok mon moo mor mos mou mpu mro mrq mrt msk mua mum mup mus mut mwe myg nad nak nal nbm ncm ndo ndu ndy neh ngd ngm ngu ngw ngz nhm nht nkn nko nne non nto nua nun nup nza obg obo ocu olo one paa pal pat per pga pkn plg plh pms png pnu poh pol por pre psw pul pur rim rny rom ron rru rus sak sal san sap scr sed ses sgb sgl sgu shl shm shn sht sio sir sis slo sno sob son spa srd sre ssa sti sud sul sun swa tab taf tal tbw tee ten tep ter tes tet tgk tha tid tin tiv tiw tki tla tmm tmn tmr tob toz tpr ttn twn tzu ukr uld uli url urt ven vie wal wma wol wrm xam xar xbi xho yao yin yng yor zqs,373,76475,0.004877411
