parameter_id,parameter_name,parameter_description,chapter_id,chapter_citation,value,same_value_language_ids,value_language_count,language_count_total,count_ratio
72A,Imperative-Hortative Systems,,72,Johan van der Auwera; Nina Dobrushina; Valentin Goussev. 2013. Imperative-Hortative Systems. In: Dryer; Matthew S. & Haspelmath; Martin (eds.) 2013. The World Atlas of Language Structures Online. Leipzig: Max Planck Institute for Evolutionary Anthropology. (Available online at https://wals.info/chapter/72),1,acu aea ala alb ame anl ark ath awn aym bkr brs bsk bul cak chk cor dag dbd dio dni est eve evn fin fua gam gbk gmz goo grk gua ham haw heb her hix hun hzb ing iri irq jak jaq jeb juh kha kho kil kim klm klv kmk knd knm koa kob kon krk krn kro krq kte kui kyl lak lep lgt loz lug luv mai mal mao mcd mdk mei mgo mhi mnm mok mss mwe nan nca nep nez ngi nht niv noo nti ntu nub nug ond oss pal pnn prh psm rap rav ret rom shn sla sno snt swa tbu tem tnc tot tur tvo txj tzo tzu udh uzb vot wai win wlf yid yim yko ypk ysi zul zun,133,76475,0.0017391305
144D,The Position of Negative Morphemes in SVO Languages,,144,Matthew S. Dryer. 2013. Position of Negative Morpheme With Respect to Subject; Object; and Verb. In: Dryer; Matthew S. & Haspelmath; Martin (eds.) 2013. The World Atlas of Language Structures Online. Leipzig: Max Planck Institute for Evolutionary Anthropology. (Available online at https://wals.info/chapter/144),4,aab aja alk aln amq anc ane bag bak bgr bik bir bka bud bum chw duk ega gbs gla goe gul gwo hat hna ige igs irr jab jar jmo juk kar kel ken ker kkv kpw kyl laa lab lag lel lin lmh lon mas may mbm mbr mby mda mdg mdo mea mgu mlu mmb mor mpu myg nbm ngm ngz nua nup nza olo pat ron san sgb sht sio tab tiv tpr uld wma wrm,81,76475,0.0010591696
65A,Perfective/Imperfective Aspect,,65,Östen Dahl; Viveka Velupillai. 2013. Perfective/Imperfective Aspect. In: Dryer; Matthew S. & Haspelmath; Martin (eds.) 2013. The World Atlas of Language Structures Online. Leipzig: Max Planck Institute for Evolutionary Anthropology. (Available online at https://wals.info/chapter/65),1,abk aeg akn ala alw aly arm atu avo awp aze bag bej bma bng bnj brh bsq bul bur but cbo ceb cha chk cnt cpn cuu dni egn eve fre geo grb grf grk haw hin hix hwc imo jak juh ket kho kik kio kji knk knr kor kro kse lan lez mak mal mau mlt mnd mwe mxc nak nbr ngm ond ood orh pan pnn por prh prs ren rom ruk rus ses shu sla snc spa sup tag tah tem tny toj tug tur uyg wic wly wor yag yaq yct ygr zqc zul,101,76475,0.0013206931
85A,Order of Adposition and Noun Phrase,,85,Matthew S. Dryer. 2013. Order of Adposition and Noun Phrase. In: Dryer; Matthew S. & Haspelmath; Martin (eds.) 2013. The World Atlas of Language Structures Online. Leipzig: Max Planck Institute for Evolutionary Anthropology. (Available online at https://wals.info/chapter/85),2,abi abu ace acl acm adz aeg agc aja alb alk aln als alw ama ami aml amq amr ams anc ane anj any arg arj aro arp arq asy ata au ayw bab baf bag baj bak bar bas bbl bbu bco bdu bfg bfi bga bgo bid bik bir bka bkl bkr blu bma bmz bni bnk bnn bob bol bra bre brf brq bse bsh bsi btk bto bud bul bum buu bvi bwc cak cba ccm ceb cem cha chj chq chr cic ckl cld cle cmx cmy coe cop cpl cqt crn cso ctl cuc cya cyv cze did dio dng dok dom don dre dsh duk dut egn eng eno erk err esm ewo fij fre fri fua fut fye gae gbb gel ger git giz gku gla gmz gnb gnd goa goe gok grf grk grr gto gud gwo hal hat hau haw hdi heb heh hei hem hil hlu hmo hna hoa htc hve hwr hya iaa iba ice ifm ifu igb ign igs ik ila ilo ind iri irq irr ita ixi izi jak jar jlu jmo juk kam kan kar kau kbl kbw kby kdz kel ker kga kgr khm khs kik kil kin kis kkt kkv klv kmi kmj kmu knk koe kon kos kpm kpw krb krd kre kri ksg kte ktu kuo kwa kwk kwm kwn kwy kya kyo kyq laa lab lac lag lan lao lat lbu lda ldo leb lel len let lew lgi lgu lic lil lit lmb lmg lmp lnd lon lou luo luv maa mae mal mam mao mas mau may mbe mbm mcd mco mdg mdm mdo mds mea meh mga mgo mgu mig min miy mko mlg mlm mlu mmb mmi mmn mna mng mnz mof mok mon mor mov mpu mra mrq msm msq mtt mua mum mup mus mwb mxa mxc mxj mxo mxp mxy myg myi mzh naj nak nal nan nca nde ndi ndo ndt ndu ndy neh ngb ngd ngm ngo ngu ngz nhh nhm nht nia nif niu nko nnc noo nor nse nsg nua nue nun nup nza obg obo ocu olo ora otm paa pai pal par pat per pip pkt plg plh plk pms png pnn pod pog poh pol por pre prs psm psw pul qum rag rap rga rny rom rot ruk rus rwe saa sah sak sal sam san scr seb sed sen ses sgb sge sgl shl shn shu sim sio sir sis slo sml so sob son spa squ srb sre sti sul sun swa swe tab tah tai taj tal tbo tbw tee teo tep ter tes tet tgh tgk tgo tgr tha tho tid tig tim tin tiv tiw tke tla tlo tlp tmr tna tne tng tnk tno tpr tpt tri trt tsg tsi tsk ttd ttn tuk tvl txj tzo tzu ukr uld uli url vie vif vnm war wch wel wlf wlo wma wol wrk wrm xar xbi xho yap yok yor yul zai zan zap zen zhn zqs zul zya,511,76475,0.0066819224
6A,Uvular Consonants,,6,Ian Maddieson. 2013. Uvular Consonants. In: Dryer; Matthew S. & Haspelmath; Martin (eds.) 2013. The World Atlas of Language Structures Online. Leipzig: Max Planck Institute for Evolutionary Anthropology. (Available online at https://wals.info/chapter/6),1,abm ach aco adk adz agh aik ain aiz akn akw ala alb ald alw amc ame amh amo amp amu amz ana anc ant ao api apu arb arp asm awp aze bag bai baj bam baw bbf bee bej ben ber bet bir bis bki bkr bng bno bod bra brb brd bre brh bri brm brr brw bsq bto bua bul byu cac cad cam car cax cay cck ccp cha che chp chq chu chv chw cil cle cmn cnl cnt cof cre cso cti ctl cub cve cyv dad dag dah dan dar der det dgb dgr din dio diy diz djp dni dnw doy dre dts dum dyi efi eja eka eng epe eve evn ewe ewo fas fef fij fin ful fur fuz fye ga gan gar gbb gds ghb gmb goa goo grb grk grr gua gwa had hak hau haw hin hix hok htc hum hun hve iaa iba igb ign igs ijo ik ika imo ind ird irr irx iso ito iva iwm jav jeb jeh jiv jng jom jpr juh kad kas kay kch ked kef ker kew kfe kgi kgu kha khm kho khr khs kio kiw kkn kkv kla klv kly kmu knd kng knk knm knr koa kob koh koi kom kor kot koy kpa kpe krb krk kro kse ksg kss ktk kty kul kun kwa kwo kws kya kyl kzy lad lam lan lat lav len lep lit lkk lkt llm lu lua lug luo luv maa mab mal mao map mau max may maz mba mbb mbm mei mie mku mla mlk mme mnc mnd mne mor mov mpa mrd mrl mrn mro mrt mss mtp mui mum mun mxc mxm mya myi mzc nai nan nar nas nav nbk ndt ndy nep new nga ngi ngz nhn nht nim nis nko nkt nmb nnc nob non nor nti ntu nug nun nyg nyi oca ogb oji ond ood orh otm pac pae pau paw pec phl pit pms pnr poa poh pol prh psm puk pur qaw ram rap res rom ror rsc rtk ruk rus sab san sba scs sdh sdw seb sed sha shi shk shs sin sla slp sml snc snd snh snm snt soq sor spa sre srn sue sup svs swa tab tac tag tam tas tel ter tgk tgr tha tib tic tiw tks tlp tma tmn tmp tne toa tok tol ton tru try tsg tso ttn tuk tul tun tur tuv twn tza umb una ung urk usa vie wah wam wao wap war wdo wic wiy wlf wma wmu wnt woi wps wra wrd wrs wry wuc yag yan yap yaq yar yaw yay ycn yct yel yes yey ygr yid yim ykt yny yor yuc yul yur zan zqc zul zun,470,76475,0.006145799
2A,Vowel Quality Inventories,,2,Ian Maddieson. 2013. Vowel Quality Inventories. In: Dryer; Matthew S. & Haspelmath; Martin (eds.) 2013. The World Atlas of Language Structures Online. Leipzig: Max Planck Institute for Evolutionary Anthropology. (Available online at https://wals.info/chapter/2),1,abk abm adz aea alw amc amp amu ana awp aym bco bma brd byu cad cah cax cay cck ccp chl chu cre diy djp dyi eya gds goo grr grw hai hup ign iva jaq jeb jiv kab kay kgu klm koa kut kya lak lus mal maz mbb mpa mrn mrt nav new ngi nhn nug nuu oji ond pae pai pau pit prh qaw qui ram ruk sel shk shs squ tac tas teh tiw tli tpa tsg tsi wam wdo wic wps yes yid yim yny yus,93,76475,0.0012160836
13A,Tone,,13,Ian Maddieson. 2013. Tone. In: Dryer; Matthew S. & Haspelmath; Martin (eds.) 2013. The World Atlas of Language Structures Online. Leipzig: Max Planck Institute for Evolutionary Anthropology. (Available online at https://wals.info/chapter/13),2,acm adk agh aik ain akn ald amo ani ant awn bam baw bee bej ber bno bod cac cad che chp chw cil cub dad dah det dgb dnw dts efi eka ewe fas ful fur fye gbb had ham hau hmr hop hve igb igs ijo ik irq iso jom jpn kal kef kew kgi kio kiw kmu knk knm knr koi krk kro kss ktk kul lan lat llm luo luv maa mab maz mbm mei mor mrl mro mui nan nar nav ndy ngz nis niv nko nkt nob nor nyg oca ogb ond otm paw pec prh psm qui res rut san sdw shs sla som sre sue tam tib tks tli tmn tmp tne twn umb una wah yag yaq yct yey ygr zan zul,132,76475,0.0017260542
19A,Presence of Uncommon Consonants,,19,Ian Maddieson. 2013. Presence of Uncommon Consonants. In: Dryer; Matthew S. & Haspelmath; Martin (eds.) 2013. The World Atlas of Language Structures Online. Leipzig: Max Planck Institute for Evolutionary Anthropology. (Available online at https://wals.info/chapter/19),1,abi abm ach acm adk adz aht aik ain akn akw ala alw amh amp amu amz ana anc ant ao api apu arb arm arp asm awn awp aym aze bag bai baj bam baw bco bee bej ben bis bki bkr bng bno bod brd bre brh bri brr brw bsq bto bua bul bur byu cac cad cah cam car cax cay cck ccp cha che chk chl chu chv chw cil cle cmn cnl cnt cof coo cre cso cti ctl cve cyv dad dag dar ddf der dgr die din dio diy diz djp dni dnw don dum dyi eka epe eve evn eya fas fef fin fre ful fur fuz fye gan gar gds geo ger ghb gla gmb goa goo grr grw gua hai hak ham hau haw hba hin hix hmo hmr hok hop hun hup iba ign ik ika imo ind ird irr irx ite ito iva iwm jak jaq jav jeb jeh jiv jng jom jpn jpr kad kal kas kay kch ked kef kek ker ket kew kfe kgi kgu kgz kha khm khr khs kio kiw kkn kkv klm klv kly kmp kmu knd kng knk knm knr koa kob koi kom kor kot koy krb krk kro kry kse kty kul kun kur kut kwa kwk kwo kws kya kyl kzy lad lah lam lan lat lav len lep lez lit lkt lu lua lui luo lus luv maa mab mak mal mao mau max may maz mbb mei mgg mie mku mla mlk mnc mnd mne mog mor mov mpa mrd mrn mrt mss mtp mui mun mya myi mzc nai nan nap nar nas nav nax nbk ndt ndy nep new nez ngz nhn nht nim nis niv nko nkt nmb nnc nob non nor nug nun nyg nyi oca oji ond ood orh orm pac pae pai pau paw pec phl pit pms pnr poa poh pol prh prs psh psm pso puk pur qaw qui ram rap res rom ror rsc rus sab sba scs sdh seb sed sel sha shi shk shs shu sin skp sla slp sml snc snh snm snt sor sre srn sue sui sup svs tab tag tam teh tel ter tgk tha tib tic tiw tks tli tlp tmn toa tol ton tpa tru try tsg tsi tso ttn tug tuk tul tun tur tuv twn tza umb una ung urk usa uzn vie wah wam wao wap war wch wdo wic win wiy wlf wma wmu wnt woi wps wra wrd wrs wry wuc yag yan yaq yar yaw ycn yct yes ygr yid yim yko ykt yny ytu yuc yur yus zqc zun,449,76475,0.0058711995
144I,SNegVO Order,,144,Matthew S. Dryer. 2013. Position of Negative Morpheme With Respect to Subject; Object; and Verb. In: Dryer; Matthew S. & Haspelmath; Martin (eds.) 2013. The World Atlas of Language Structures Online. Leipzig: Max Planck Institute for Evolutionary Anthropology. (Available online at https://wals.info/chapter/144),8,aab adi aja alk aln amq anc ane anu ara bag bak bas bgr bik bir bka ble brn bud bum chw coc dgo dio dre duk dut ega egn fua fye ga gbs ger gla gmz goe gud gul gwo hat hna ige igs iqu irr jab jar jmo juk kar kas kau kel ken ker kis kkv kpw kwz kyl laa lab lag ldu lel lew lgt lin lmh lon lug mad maj mao map mas may mba mbm mbr mbt mby mda mdg mdo mea meh mgu mlg mlu mmb mor mou mpu mrq msk msm mtb mup myg nad nbm ndt ngm ngw ngz noo nti nua nup nza olo pat pkn pog ron rsu sah san sgb sht sio tab tan ten tes tiv tmn tne ton tpr tru uld wma wrm yuk yul zan zpr,142,76475,0.001856816
144K,SVONeg Order,,144,Matthew S. Dryer. 2013. Position of Negative Morpheme With Respect to Subject; Object; and Verb. In: Dryer; Matthew S. & Haspelmath; Martin (eds.) 2013. The World Atlas of Language Structures Online. Leipzig: Max Planck Institute for Evolutionary Anthropology. (Available online at https://wals.info/chapter/144),1,aab aja alk aln amq anc ane au bag bak bgr bii bik bir bka bud bum cai chw dgo duk dut ega gbs ger gla goe gul gwo hat hna ige igs irr jab jar jmo juk kar kel ken ker kkv kpw kyl laa lab lag ldu lel lgt lin lmh lon lug mad mas may mbm mbr mby mda mdg mdo mea meh mgu mlu mmb mor mou mpu mtb myg nbm ngm ngz nua nup nza olo pat ron sah san sgb sht sio tab tiv tpr uld wma wrm,95,76475,0.001242236
56A,Conjunctions and Universal Quantifiers,,56,David Gil. 2013. Conjunctions and Universal Quantifiers. In: Dryer; Matthew S. & Haspelmath; Martin (eds.) 2013. The World Atlas of Language Structures Online. Leipzig: Max Planck Institute for Evolutionary Anthropology. (Available online at https://wals.info/chapter/56),3,ain arn ath beg bel bgv brm but cnt drg eve fin hin ind ing jaq jav jpn kha khm kku knd knr mal mhi min mnd mos mym ngz niv nvs pan qhu ses tag tam taw tel tha tml vie,43,76475,0.00056227524
86A,Order of Genitive and Noun,,86,Matthew S. Dryer. 2013. Order of Genitive and Noun. In: Dryer; Matthew S. & Haspelmath; Martin (eds.) 2013. The World Atlas of Language Structures Online. Leipzig: Max Planck Institute for Evolutionary Anthropology. (Available online at https://wals.info/chapter/86),2,abo ace acl aeg agb agc agd agh aja alb aly ami aml amr ams anc anj any aoj arg arj aro arq asy ata awe ayw bag baj bak baq bar bas bbu bch bco bdu bfg bfi bga bgo bgr bid bir bka bkr bku blr blz bma bni bnk bnn bob bol bra bre brf brn brp brq bsr btk bto bud bug bum buw bvi bwc cai cak cba ccm ceb cem cha chj chq chr chx cic cld cle cme cmx cmy cop cpl cqt crn cso ctl cya cyv day dgo did din dio dji dre dua duk dut egn eno erk err esm ewo fij fon fre fua fut fye gae gbb gbs gel ger gmz gnd goa goe gok grf grk gto gud gul gwo hal hau haw hdi heb hei hil hna hnd hoa htc hve iaa iba ice ifm ifu igb ign igs ila ind iri irq isa ita izi jak jar jeb jlu jmo juk kad kan kar kba kbl kbu kdz kel ken ker kga khm khs kik kis kkt kls kmj kmu knc knk knr koe kom kon kos kpm krb krd kre kri kro krr ktc ktl ktu kuo kut kwk kwm kwn kyo laa lac lag lan lao lar lbu lda ldo len lew lgi lgu lil lin lmb lmg lmp lmu lnd lon lou luo luv ma maa mae maj mal mam mao mas mbl mbm mbr mby mch mda mdg mdo mdw mee meh mga mgo mgq mgu min miy mla mlg mmn mna mng mnm mnt mnz mof mon mou mpa mrl mro mrq msk msl msq mtb mtt mua mud mup mur mus mwb mwe mxa mxc mxo mxp mxy myg myn naj nak nan nca ndb nde ndi ndo ndr ndt ndu neh ngb ngd ngm ngo ngu ngz nhh nht nia niu nkb nko nnc nne nng non noo nsg nue nun nup nym nza obo orh ori orw otm otr paa pai pal par per pga pip pkt plg pms pnn pod pol por pre prs psw qui qum rag rap ras rga rny rom ron rot rov rsu ruk rus saa sak sal sam san seb sed see ses sgu sha shl shn sht shu sil sim sir sis sml so son spa squ sre sti stn sun swa swt taf tag tai taj tas tat tbo tbu tbw tee ten teo tep ter tes tet tgh tgk tgr tha thy tia tik tim tin tiv tla tlp tmm tmn tna tne tng tnk tnn tno tob toz tri tsg tsi tsk tuk tvl txj tzo tzu uld ura url urt vaf vie vif vnm war wel wlf wlo wrk wrn xbi xho yap yay yns yor yul ywr zai zap zen zul zya,468,76475,0.006119647
81A,Order of Subject; Object and Verb,,81,Matthew S. Dryer. 2013. Order of Subject; Object and Verb. In: Dryer; Matthew S. & Haspelmath; Martin (eds.) 2013. The World Atlas of Language Structures Online. Leipzig: Max Planck Institute for Evolutionary Anthropology. (Available online at https://wals.info/chapter/81),2,aab abi abu acg acl acm adi adz aeg agb agh aja akn alb alk aln ama aml amq anc ane anu aoj apu ara arg ari arj aro arp arq au avk ayi ayr ayw bab bae baf bag bai bak bar bas bbl bdu ber bgo bgr bgs bgz bid bii bik bir bka bku ble blz bmb bni bnk bnn bob bol bra bre brf brn brq bsh bub bud bug bul bum buu buy bvi cga chr chw cic cme cmy cnt coc cop crn ctl cua cuc cze day deg dga dgb dio dma dok don doy dsh dua duk ebi ega egn eko eng eno erk err est ewe ewo fin fon fre fua fut fye ga gbb gbs gla gmz gnb goe gok grb gua gul guw gwo hak hal hat hau heb heh hem hmo hna hnd hol htc huc hve hya iaa iba ice ifm igb ige igs ila ind iqu irr ita ito iwa izi jab jar jmo juh juk kad kan kar kas kau kba kbw kby kch kdw kel ken ker kfe kga khm khn khs kik kil kin kir kkv kla kmu kni knk koe kom kon kos kpw kre ksg ksm ksn ktc kte ktl kwa kwn kwy kyl kzy laa lab lag lan lao lat lbu ldo leb leg lel len let lew lgi lic lin lit llm lmh lmp lmu lnd lon lou luc luo luv ma mae map mas mau may mba mbe mbi mbm mbr mbt mby mcd mcv mda mdg mdo mds mdw mea mee mga mgk mgo mgu mhu mie mkd mkq mkz mla mlg mlm mlu mmb mmv mna mnd mng moe mof mok mon moo mor mos mpr mpu mro mrt msm mtb mua mum mup mur mus mut mwe mwo mxe myg myn nak nal nbe nbm ncm ndb ndi ndo ndt ndu ndy neh ngb ngd ngm ngo ngu ngw ngz nhm nhn nht nke nkn nko nne nng non noo nor nse nto nua nun nup nza obg obo ocu olo one ora otr paa pal pam pat pau per pga pkn plg plh plk pms png pnu pog poh pol por pre psw pul pur rag rga rim rny rom ron rot rru rsu rus sah sak sal san sap scr sea sed ses sgb sgl sgu sha shl shm shn sht sio sir sis skm sku sle slo sno sob son spa srd sre ssa sti stn sud sul sun swa swe tab taf tal tan tbw teo tep ter tet tgk tgn tha tia tid tiv tiw tki tla tmm tmn tmr tne tnk toz tpr trm ttd ttn tum txj ukr uld uli ura url urt ven vie vnm wal wch wlf wma wol wrk wrm wrn wry wwa xam xar xbi xho xoo yao yay ycn yin yng yor yuk yul zan zch zhn zpr zqs zul,488,76475,0.0063811704
82A,Order of Subject and Verb,,82,Matthew S. Dryer. 2013. Order of Subject and Verb. In: Dryer; Matthew S. & Haspelmath; Martin (eds.) 2013. The World Atlas of Language Structures Online. Leipzig: Max Planck Institute for Evolutionary Anthropology. (Available online at https://wals.info/chapter/82),1,aab aar aba abi abk abn abo abu abv acg acl acm acn aco adg adi adn ady adz aeg aga agb agh agm agt ain aja ajg akh akn ala alb ale alk all aln aly ama amb ame amh aml amn amp amq amt amx ana anc ane ang ani ano anu ao aoj api apt apu apw arc arg ari arj arm aro arp arq arw asm ass ath atk atm au ava avk avo awa awi awp awt awy ayi aym ayo ayr ayw aze azi baa bab baf bag bai bak bam bao bar bas baw bbl bbw bdm bdu bdw bej bel ben ber bgm bgo bgr bgs bgz bho bhu bid bii bik bin bio bir biu bka bkb bkt bku ble blt blx blz bmb bnb bni bnj bnk bnn bnu boa bob bod bok bol bon boq bra brf bri brl brm brn brp brq bry bsh bsk bsq bsr bti bua bub bud bug bum bur bus but buu buy bvi bya bzi cah cai cam can car cas cay cct cde cga chb chc chd chg chh chi chk chn chp chr chs chv chw cic cln cme cmh cml cmn cmr cnl cnt coa coc cop cpn cpy crn cro cti ctm ctw cua cuc cui cup cze dag dam dan daw day ddj dds deg der des deu dga dgb dgo dgr dha dhb dhm die dig dim din dio diy dja dji djp djr dlm dma dmi dmk dms dni dok doy drg drm dsh dua duk dul dum dun dut dyi ebi edo ega egn eip eka eko emb eme emm ene eng eno epe erk err ese est eud eve evn ewe ewo fas fin foe fon for fqs fre fri fua fur fut fye ga gah gal gam gan gap gar gav gbb gbs gds geo ger ggu ghb ghr gim gla gln gmw gmz gnb god goe gog gok gon goo grb grg grw gua gug guh guj gul gur guu guw gwa gwo gyc hai hak hal ham han har hat hau hay heb heh hem hhu hid hin hlp hma hmi hmo hna hnd hol hop hpd hua huc hui hum hun hya hzb iat iau iba ice idn idu ifm igb ige igs iha ijo ika ila imo ina ind ing inn iqu irq irr irx isa isi ite ito iwa iwm izi jab jad jar jbt jin jiv jmo jms jng joh jpn jrw juh juk jva jwr kaa kab kac kad kae kan kar kas kau kay kba kbo kbu kbw kby kch kdw kel kem ken ker ket kew kfe kga kgu kgy kha khd khg khl khm khn kho khr khs khw kie kik kil kim kin kio kir kis kiw kkp kkq kku kkv kla klg kll klq klw kma kmb kmh kmk kmn kmo kmp kmr kms kmu kmw kmz knb knc knd kng kni knk knm knn kno knr knw knz koa kob koe kok kol kom kon kor kos koy kpw kqq krc krd kre krh krk krr krw kry krz ksa kse ksg ksm ksn kta ktc kte kti ktl kty kum kun kus kuu kuv kwa kwn kwo kwt kwy kwz kxo kya kyk kyl kyn kyp kyr kyz kzy laa lab lad lag lah lai lak lal lan lao lar lav lbu lda ldo ldu leb lec leg lel len lep les let lew lez lgi lgt lho lic lim lin lis lit lkt llm lmh lmn lmp lmu lnd lon lot lou luc lug lui luo luv ma mab mad mae mag mai man mar mas mau maw max may mba mbe mbi mbm mbo mbr mbt mby mcd mda mde mdg mdl mdn mdo mds mdw mea mee mei mek mem mer mey mga mgg mgh mgi mgk mgo mgq mgu mhi mhu mie mii mij mik mil mis miz mka mkd mke mkg mkh mki mkj mkl mkq mku mkz mla mlg mlk mlm mlu mmb mmv mnc mnd mne mng mni mnm mno mns mnv mny moe mof mog mom mon moo mor mos mot mou mpa mpt mpu mqf mrc mrd mrh mri mro mrr mrs mrt mru mrw msc msg msl msm msn mss mtb mto mts mtu mua mui mum mun mup mur mus muu mwe mwo mxe myg myi mym myn myr nab nad nag nah naj nak nal nam nar nas nat nav nbd nbe nbm nbr ncm ndb ndi ndj ndo ndt ndu ndy neh nep nev new ney nga ngd ngi ngj ngk ngm ngn ngo ngt ngu ngw ngz nhn nis niv nkb nke nkn nko nku nma nmb nmd nmm nnd nng nnk noc nog non noo nor nph nse nsn nti ntj nto ntu nua nue nun nup nus nwd nya nyi nyk nza nze obg obo ocu oir oks olo omh omi one ong ora ord orh ori ork oro orw ory osa oss otr owi oya paa pae pal pam pan par pat paw pba pdp per pia pir pis pit pkn plg plh plk pme pmn pms png pno pnu pny pog poh pok por pra pre prh prk prs psh pso psw ptt ptw pul pum pun pur qaf qaw qhu qim rag ral ram rao ras raw rem res ret rga rgc ria rik rim rmb rnd rny rom ron rot rpa rru rsu rum run rus rut rwa ryu sah sak san sap sar sav scr sdw sea sed sem ser ses sgb sgl sgu sha shb she shh shi shk shl shm shn sho sht sia sid sil sin sio sir sis skk skm sko skp skr sku skw sla slb sle slo sme smn sna sng snh snm snn sno snt sob sod som son spi srb src srd sre srn sro ssa sta sti stl stn sud sue suk sul sun sup sus svs swa swe syu tab tac taf taj tak tal tam tan tao tar tau taw tba tbl tbt tbu tbw tce tdi tdr tel teo ter tet tgk tgl tgn tgr tha thk thn thu thy tia tib tid tig tik tis tiv tiw tja tki tkl tkm tlf tli tlo tma tmc tmg tml tmm tmn tmo tmr tnb tnc tne tni tnk tnn tny tod ton tou toz tpr tpt trb trm trr tru trw tsf tsh tsz ttd tte ttn ttu tuc tul tum tun tur tuv tuy tvo tvt twe twn txj tye uby udh udi udm uhi ukr uld uli una ung ura urd urk url urt uru usa usr uyg uzb vai ven vie vnm wag wah wak wal wan wao wap was wau way wbn wch wed wiy wlf wlw wly wma wme wmu wn wna woi wol wom wra wrk wrm wrn wry wsk wtm wwa xam xar xas xav xbi xer xho xns xoo yah yal yam yaq yar yay ybi ycn yei yel ygr yi yid yim yin yko ykt ylm yng yor yqy ytu yuc yuk yul yur yus yuw zag zan zar zay zaz zch zhn zim zpr zul zun,1192,76475,0.015586793
116A,Polar Questions,,116,Matthew S. Dryer. 2013. Polar Questions. In: Dryer; Matthew S. & Haspelmath; Martin (eds.) 2013. The World Atlas of Language Structures Online. Leipzig: Max Planck Institute for Evolutionary Anthropology. (Available online at https://wals.info/chapter/116),1,aab abu ace acn adi aeg agc agd agm ain ajg akh akn alb all aln amb amc ame amn amo amp amq amr ams amx anc ani anj ann anu ao aoj api apt aro arp asm asy ata ava avk awp awt aym aze baa bab bag bai bam bar baw bbf bbw bel bem ber bfg bgn bgo bho bir bkn bkr blr blx bma bnj bnu bon bra bre brf brp bsk bsq btk bud bug bul bus bwc bya cax cbo ccm cct cea cem cga cha che chh chp chq chr chs chw chx cic cle cmh cmn cmr cnl cnm cnt coc coo cop cre crn cso cti ctm dan dds dgr dhi dji dmk dng don doy dre drm duk dul dum dun dyi ebi efi ega egn eme err ese est eud eve evn ewe ewo fin fre fua fut fye gap gav gbb gel ggu ghr git goa goe gok gon grb grk grr gua gud gug guh gul gur guw gwa hai ham hat hau hdi heb hil hin hma hmo hna hnd ho hop huc hun hve iaa iba ifm ifu ige ik imo ina ind iri ite iwa iwm izi jab jar jeb jms jng jpn juh juk kaa kar kau kbw kby kdz kel ken ker ket kew kfe kgz kha khg khm khn kho khr khs kil kim kio kiw klm kmb kmj kmo kmu knd knk kno kob kos kpw kre krj krn krw ksa kse ksg ksm ksn kta kum kut kuv kwn kwo kxo kya kyl kyp kyz laa lac lag lah lai lal lao lat lav ldo ldu lel len lep lew lgt lit lkt lmb lmg lmn lmp lnd loz lug lui lun luv maa mad mae maj mak mal mam map mas mau maw max may mbi mbm mbr mby mcc mcd mco mdo mds mea mee mei mek mey mgk mgu mhi mie mir miy miz mka mke mkh mkj mmb mmi mmn mmv mnd mno mny mok mon moo mor mos mou mpa mpr mpt mpu mri mrq mru mrw msn mtu mum mun mup mus mut mwb mxj mxo mxp mxx mxy myi mym mzh nag nam nan nar nas nav nax nbm ncm ndb nep nev new ney nez ngb ngi ngm ngn nia niu niv nkb nke nkn nko nma nnc non noo nsg nsn nti nug nun nup nwd nyn nyu nze obg obo ocu oji olo omh omi ond ood otm oya pan per pga pir pis plk pno pnx pod pok pol por prs pum qim qum rap raw res ret rit ron rot rum rus rwe sam san sap scr sed sem ser sgb she shh shi shk shu sio sis siu skk sko sla slb sle slg slo sng snn sno so sob som son squ srd sre srn sro sti sun sup swa swt tac tag tah taj tak tam tao tat tau tbo tbu tee ter tet tgh tgk tgl tha tho tib tim tin tiw tja tkl tla tlp tna tne tnn tny toz tpn trb tri tsh tsk tsn ttn ttu tuk tur tus tuv tvo tvt twe txj tzo tzu ukr uld urd urk url urt ute vie wah wal was way wbn wch wel wic wik wiy wlf wn wrl wsk wth wwa xas xav xho xoo yag yaq yar ygr yin yiw yok ypk yqy yuc yuk yul yur yuw ywl zai zap zhn zul zya,585,76475,0.0076495586
