parameter_id,parameter_name,parameter_description,chapter_id,chapter_citation,value,same_value_language_ids,value_language_count,language_count_total,count_ratio
82A,Order of Subject and Verb,,82,Matthew S. Dryer. 2013. Order of Subject and Verb. In: Dryer; Matthew S. & Haspelmath; Martin (eds.) 2013. The World Atlas of Language Structures Online. Leipzig: Max Planck Institute for Evolutionary Anthropology. (Available online at https://wals.info/chapter/82),1,aab aar aba abi abk abn abo abu abv acg acl acm acn aco adg adi adn ady adz aeg aga agb agh agm agt ain aja ajg akh akn ala alb ale alk all aln aly ama amb ame amh aml amn amp amq amt amx ana anc ane ang ani ano anu ao aoj api apt apu apw arc arg ari arj arm aro arp arq arw asm ass ath atk atm au ava avk avo awa awi awp awt awy ayi aym ayo ayr ayw aze azi baa bab baf bag bai bak bam bao bar bas baw bbl bbw bdm bdu bdw bej bel ben ber bgm bgo bgr bgs bgz bho bhu bid bii bik bin bio bir biu bka bkb bkt bku ble blt blx blz bmb bnb bni bnj bnk bnn bnu boa bob bod bok bol bon boq bra brf bri brl brm brn brp brq bry bsh bsk bsq bsr bti bua bub bud bug bum bur bus but buu buy bvi bya bzi cah cai cam can car cas cay cct cde cga chb chc chd chg chh chi chk chn chp chr chs chv chw cic cln cme cmh cml cmn cmr cnl cnt coa coc cop cpn cpy crn cro cti ctm ctw cua cuc cui cup cze dag dam dan daw day ddj dds deg der des deu dga dgb dgo dgr dha dhb dhm die dig dim din dio diy dja dji djp djr dlm dma dmi dmk dms dni dok doy drg drm dsh dua duk dul dum dun dut dyi ebi edo ega egn eip eka eko emb eme emm ene eng eno epe erk err ese est eud eve evn ewe ewo fas fin foe fon for fqs fre fri fua fur fut fye ga gah gal gam gan gap gar gav gbb gbs gds geo ger ggu ghb ghr gim gla gln gmw gmz gnb god goe gog gok gon goo grb grg grw gua gug guh guj gul gur guu guw gwa gwo gyc hai hak hal ham han har hat hau hay heb heh hem hhu hid hin hlp hma hmi hmo hna hnd hol hop hpd hua huc hui hum hun hya hzb iat iau iba ice idn idu ifm igb ige igs iha ijo ika ila imo ina ind ing inn iqu irq irr irx isa isi ite ito iwa iwm izi jab jad jar jbt jin jiv jmo jms jng joh jpn jrw juh juk jva jwr kaa kab kac kad kae kan kar kas kau kay kba kbo kbu kbw kby kch kdw kel kem ken ker ket kew kfe kga kgu kgy kha khd khg khl khm khn kho khr khs khw kie kik kil kim kin kio kir kis kiw kkp kkq kku kkv kla klg kll klq klw kma kmb kmh kmk kmn kmo kmp kmr kms kmu kmw kmz knb knc knd kng kni knk knm knn kno knr knw knz koa kob koe kok kol kom kon kor kos koy kpw kqq krc krd kre krh krk krr krw kry krz ksa kse ksg ksm ksn kta ktc kte kti ktl kty kum kun kus kuu kuv kwa kwn kwo kwt kwy kwz kxo kya kyk kyl kyn kyp kyr kyz kzy laa lab lad lag lah lai lak lal lan lao lar lav lbu lda ldo ldu leb lec leg lel len lep les let lew lez lgi lgt lho lic lim lin lis lit lkt llm lmh lmn lmp lmu lnd lon lot lou luc lug lui luo luv ma mab mad mae mag mai man mar mas mau maw max may mba mbe mbi mbm mbo mbr mbt mby mcd mda mde mdg mdl mdn mdo mds mdw mea mee mei mek mem mer mey mga mgg mgh mgi mgk mgo mgq mgu mhi mhu mie mii mij mik mil mis miz mka mkd mke mkg mkh mki mkj mkl mkq mku mkz mla mlg mlk mlm mlu mmb mmv mnc mnd mne mng mni mnm mno mns mnv mny moe mof mog mom mon moo mor mos mot mou mpa mpt mpu mqf mrc mrd mrg mrh mri mro mrr mrs mrt mru mrw msc msg msl msm msn mss mtb mto mts mtu mua mui mum mun mup mur mus muu mwe mwo mxe myg myi mym myn myr nab nad nag nah naj nak nal nam nar nas nat nav nbd nbe nbm nbr ncm ndb ndi ndj ndo ndt ndu ndy neh nep nev new ney nga ngd ngi ngj ngk ngm ngn ngo ngt ngu ngw ngz nhn nis niv nkb nke nkn nko nku nma nmb nmd nmm nnd nng nnk noc nog non noo nor nph nse nsn nti ntj nto ntu nua nue nun nup nus nwd nya nyi nyk nza nze obg obo ocu oir oks olo omh omi one ong ora ord orh ori ork oro orw ory osa oss otr oya paa pae pal pam pan par pat paw pba pdp per pia pir pis pit pkn plg plh plk pme pmn pms png pno pnu pny pog poh pok por pra pre prh prk prs psh pso psw ptt ptw pul pum pun pur qaf qaw qhu qim rag ral ram rao ras raw rem res ret rga rgc ria rik rim rmb rnd rny rom ron rot rpa rru rsu rum run rus rut rwa ryu sah sak san sap sar sav scr sdw sea sed sem ser ses sgb sgl sgu sha shb she shh shi shk shl shm shn sho sht sia sid sil sin sio sir sis skk skm sko skp skr sku skw sla slb sle slo sme smn sna sng snh snm snn sno snt sob sod som son spi srb src srd sre srn sro ssa sta sti stl stn sud sue suk sul sun sup sus svs swa swe syu tab tac taf taj tak tal tam tan tao tar tau taw tba tbl tbt tbu tbw tce tdi tdr tel teo ter tet tgk tgl tgn tgr tha thk thn thu thy tia tib tid tig tik tis tiv tiw tja tki tkl tkm tlf tli tlo tma tmc tmg tml tmm tmn tmo tmr tnb tnc tne tni tnk tnn tny tod ton tou toz tpr tpt trb trm trr tru trw tsf tsh tsz ttd tte ttn ttu tuc tul tum tun tur tuv tuy tvo tvt twe twn txj tye uby udh udi udm uhi ukr uld uli una ung ura urd urk url urt uru usa usr uyg uzb vai ven vie vnm wag wah wak wal wan wao wap was wau way wbn wch wed wiy wlf wlw wly wma wme wmu wn wna woi wol wom wra wrk wrm wrn wry wsk wtm wwa xam xar xas xav xbi xer xho xns xoo yah yal yam yaq yar yay ybi ycn yei yel ygr yi yid yim yin yko ykt ylm yng yor yqy ytu yuc yuk yul yur yus yuw zag zan zar zay zaz zch zhn zim zpr zul zun,1192,76475,0.015586793
83A,Order of Object and Verb,,83,Matthew S. Dryer. 2013. Order of Object and Verb. In: Dryer; Matthew S. & Haspelmath; Martin (eds.) 2013. The World Atlas of Language Structures Online. Leipzig: Max Planck Institute for Evolutionary Anthropology. (Available online at https://wals.info/chapter/83),1,aar aba abk abn abo abv acn acu adg ady aga agm agt ain akh ala ale aly amb amc ame amh amn amp amt amx ana ang ano ao api apl apt apw arc arw asm ass asu ath atk atm ava awa awi awp awt awy aym aze azi baa bam bao baw bbw bdm bdw bej bel ben bgm bgn bho bhu bin bio biu bkb bkt bln blt blx bnj bnu boa bod boj bok bon boq bri brl brm brp brs bry bsk bsq bsr bti bua bun bur bus but bya bzi cah can car cas cay cbo cct cde chb chc chd che chg chh chi chk chn chp chs chv cln cml cmn cmr cnl coa cpn cpy cro cti ctm ctw cub cui cup dag dan daw dds der des deu dgr dha dhb dhm die dig dim diy dja dji djp dlm dmi dmk dms dni drg drm dul dum dun dyi edo eip eka emb eme ene epe ese eud eve evn fas foe for fqs ful fur gah gal gam gan gap gar gav gds geo ghb ghr gim gln gmw god gog gon goo grw gug guh guj gur guu gyc hai ham han har hay hhu hid hin hix hlp hma hmi ho hop hpd hua hui hum hzb iat iau idn idu iha ijo ika imo inn irq irx isa isi ite iwm jad jbt jin jiv jms jng joh jpn jrw jug jva jwr kaa kab kac kae kbo kbt kbu kem ket kew kgu kgy kha khd khg khl kho khr khw kie kim kio kiw kkp kkq kku klg kll klq klr klw kma kmb kmh kmk kmn kmo kmp kmr kms kmz knb knc knd kng knm knn kno knr knw knz koa kob kok kol kop kor koy kqq krc krd krh krn krr krw kry krz ksa kse kta kti kty kum kun kus kuu kuv kwb kwo kwt kwz kxo kya kyk kyn kyp kyr kyz lad laf lah lai lak lal lar lav lep lez lho lim lis lkt lmn lot lun mab mac mag mai man mar maw max mbo mde mdl mdn mei mek mem mer mey mgg mgh mgi mhi mii mij mik mil mis miz mka mke mkg mkh mki mkj mkl mku mlk mme mnc mne mni mnm mno mns mnv mny mog mom mot mpa mpt mqf mrc mrd mrh mri mrr mrs mru msc msg msl msn mto mts mtu mui mun muu myi mym myr nab nad nag naj nam nar nas nat nav nbd nbr ndj nep nev new nga ngg ngi ngj ngn ngt nis niv nkb nku nma nmb nmd nmm nnd nnk noc nog nph nsn ntj ntu nus nwd nya nyi nyk nze oir oks omh omi ong ord orh ori ork oro orw ory osa oss oya pae pan par paw pba pdp pia pir pis pit pme pmn pno pra prh prk prs psh pso ptt ptw pun qaf qaw qhu qim ral ram rao ras raw rem res ret rgc ria rik rmb rpa rum run rut rwa ryu sar sav sdw sel sem ser shb she shh shi shk sho sia sid sil sin skk sko skp skr skw sla slb slg sme smn sna sng snh snm snn snt sod som spi srb src srn sro sta stl sue suk sup sus svs syu tac taj tak tam tao tar tau taw tba tbl tbt tbu tce tdi tdr tel tgl tgr thk thn thu thy tib tig tir tis tja tkl tkm tlf tli tlo tls tma tmc tmg tml tmo tnb tnc tni tnn tny tod ton tou tpt trb trr trw tsf tsh tsz tte ttu tuc tul tun tur tuv tuy tvl tvo tvt twe tye uby udh udi udm uhi una ung urd urk urn uru usa usr ute uyg uzb vaf vai wag wah wai wak wao wap was wau way wbn wed wic wlw wly wme wmu wn wna woi wom wra wsk wtm xas xer xns yah yal yam yaq yar ybi yei yel ygr yi yid yim yko ykt ylm yqy ytu yuc yuk yus yuw zag zay zaz zim zun,712,76475,0.0093102325
85A,Order of Adposition and Noun Phrase,,85,Matthew S. Dryer. 2013. Order of Adposition and Noun Phrase. In: Dryer; Matthew S. & Haspelmath; Martin (eds.) 2013. The World Atlas of Language Structures Online. Leipzig: Max Planck Institute for Evolutionary Anthropology. (Available online at https://wals.info/chapter/85),1,aar aba abk acg acn aco adg adi adk adn ady agm ain ajg akh ala aly amb amc ame amk amp amt ana ang ao api apl apt apu ara arc arm arw asu atk ava avo awe awp awt aym baa bac bae bam bao baw bbf bej bgs bho bil bin bkb ble bln blt blx boa boj bok bon brh bri brm brs bry bsk bsq bti bua bur bus but bya bzi cah cai cam car cas cav cbo cct cde chc che chg chi chk chn chp chs chv cln cmh cmn cmr cnl cnm coc coo cor cti ctm ctw cub cup dag dan daw dds der des dga dgb dgr dhm die dig dim dji dlm dmi dmk dms dni drg drm dul dun edo eip emb eme emm ene epe ese est eud eve evn ewe fas fin for fqs ful fur gaa gam gan gap gar gav geo ghb gim gjj gln gmw gnn gon grb grj grw gua guj gur gyc hai ham han hay hhu hid hin hix hlp hma ho hop hpd hua hum hun hup hzb iau idn idu ika imo ina ing inn iqu jbt jel jin jms jng joh jpn jug juh jva kaa kab kac kas kbo kbt kch kem ket kew kgy kgz kha khd khl kho khr khw kie kim kir kiw kje kkp kkq kku kll klm klq klr kma kmb kmh kmk kmn kmo kms kmw kmz knb knc knd kng knm knn knr knz koa kob kok kol kop kor kpo krc krh krj krk krn kry ksa kse kti kty kum kun kus kuv kwb kwo kws kwt kxo kyk kyn kyr kyz kzy lad lah lai lak lal lar lav ldu lep lez lgt lho lis lkt llm lmn lot lug lui lun mab mac mad mag mai maj man mar maw max mbo mcc mde mdl mdn mei mek mey mgg mgh mgi mhi mik mis miz mka mke mkg mkj mkl mku mme mnc mnm mno mns mnv moe mom mou mpr mpt mqf mrd mrh mri mru msg msn mtu mun muu myr mzn nab nad nag nam nar nas nat nav nbd nbr ndj nep nev new ngg ngk nis niv nkn nnd nnk noc nph nti ntj ntu nwd nyi nze oks omi orh ork oro orw ory osa oss pae pan pau paw pdp pis pit pmn pnx pra prh prk psh pso ptt ptw pum pun puq qaf qaw qhu qia qim ram raw rem res ret rik rum run rut ryu sar sav sba sdw sel sem ser shb she shh shi shk shy sid skk sko skw sla slb sle slp sme smn sna sng snh snm sno snt sor src srn sro sta stl sue sup sus svs syu tac tak tam tar tau tbl tbt tbu tbx tce tel tgl thd thn thu tir tja tkl tkm tlf tli tls tml tmo tnc tny ton tou tpn tps trb trm tru trw tsf tsm tsr tsz tte tts ttu tuc tul tun tur tuv tuy tvo tvt uby udh udm una ung urd urk urn usa ute vai wah wai wal wao was wat way wbn wir wme wna wor wra wrd wry wsk wtm xas xav xns yag yah yal yaq yar ycn yei yel ygr yi yim yiw yko ykt ylm yqy ytu yuc zag zar zaz zch zun,577,76475,0.007544949
95A,Relationship between the Order of Object and Verb and the Order of Adposition and Noun Phrase,,95,Matthew S. Dryer. 2013. Relationship between the Order of Object and Verb and the Order of Adposition and Noun Phrase. In: Dryer; Matthew S. & Haspelmath; Martin (eds.) 2013. The World Atlas of Language Structures Online. Leipzig: Max Planck Institute for Evolutionary Anthropology. (Available online at https://wals.info/chapter/95),1,aar aba abk acn adg ady agm ain akh ala aly amb amc ame amp amt ana ang ao api apl apt arc arw asu atk ava awp awt aym baa bam bao baw bej bho bin bkb bln blt blx boa boj bok bon bri brm brs bry bsk bsq bti bua bur bus but bya bzi cah car cas cbo cct cde chc che chg chi chk chn chp chs chv cln cmn cmr cnl cti ctm ctw cub cup dag dan daw dds der des dgr dhm die dig dim dji dlm dmi dmk dms dni drg drm dul dun edo eip emb eme ene epe ese eud eve evn fas for fqs ful fur gam gan gap gar gav geo ghb gim gln gmw gon grw guj gur gyc hai ham han hay hhu hid hin hix hlp hma ho hop hpd hua hum hzb iau idn idu ika imo inn jbt jin jms jng joh jpn jug jva kaa kab kac kbo kbt kem ket kew kgy kha khd khl kho khr khw kie kim kiw kkp kkq kku kll klq klr kma kmb kmh kmk kmn kmo kms kmz knb knc knd kng knm knn knr knz koa kob kok kol kop kor krc krh krn kry ksa kse kti kty kum kun kus kuv kwb kwo kwt kxo kyk kyn kyr kyz lad lah lai lak lal lar lav lep lez lho lis lkt lmn lot lun mab mac mag mai man mar maw max mbo mde mdl mdn mei mek mey mgg mgh mgi mhi mik mis miz mka mke mkg mkj mkl mku mme mnc mnm mno mns mnv mom mpt mqf mrd mrh mri mru msg msn mtu mun muu myr nab nad nag nam nar nas nat nav nbd nbr ndj nep nev new ngg nis niv nnd nnk noc nph ntj ntu nwd nyi nze oks omi orh ork oro orw ory osa oss pae pan paw pdp pis pit pmn pra prh prk psh pso ptt ptw pun qaf qaw qhu qim ram raw rem res ret rik rum run rut ryu sar sav sdw sel sem ser shb she shh shi shk sid skk sko skw sla slb sme smn sna sng snh snm snt src srn sro sta stl sue sup sus svs syu tac tak tam tar tau tbl tbt tbu tce tel tgl thn thu tir tja tkl tkm tlf tli tls tml tmo tnc tny ton tou trb trw tsf tsz tte ttu tuc tul tun tur tuv tuy tvo tvt uby udh udm una ung urd urk urn usa ute vai wah wai wao was way wbn wme wna wra wsk wtm xas xns yah yal yaq yar yei yel ygr yi yim yko ykt ylm yqy ytu yuc zag zaz zun,472,76475,0.0061719515
93A,Position of Interrogative Phrases in Content Questions,,93,Matthew S. Dryer. 2013. Position of Interrogative Phrases in Content Questions. In: Dryer; Matthew S. & Haspelmath; Martin (eds.) 2013. The World Atlas of Language Structures Online. Leipzig: Max Planck Institute for Evolutionary Anthropology. (Available online at https://wals.info/chapter/93),2,aab abk abu abv acl acn adg adi adz aeg ain akh akn ala alk all amb ame amh aml amn amq anc ani anj anu any ao aoj apl apt apw arc arg arj arm aro arp arq arw asm ass ata ath au ava awi awp awt aym aze azi bag bai bar baw bbl bej bem bfi bgn bgo bgr bho bhu bii bir bkl bkn bku ble blx bmb bnk bod boj boq bra brh brm brn brp bsh bsq bto bud bug bum bur bya cah cai cax cct chc chg chk chn chs chv chw cic cmh cml cmn cmr cnt cop crn cro cti cup cze dag dan dgr dha din dio dja djm dlm dmi dmk dms don doy dre drm dul dum dun dyi efi egn eip erk err ewe ewo fij foe fur fut fye gal gap gar gbb gbs gdb geo ggu giz gmw goe gok gon grw gua gug guh guj gum gur guu gwa gyc hak ham hat haw heh hin hlp hma hmo hna hoa hop hua huc hui hum hun hup hya iau idu ifm igb ige igs ijo ina irq irr isa ite iwm izi jab jar jel jin jmo jms jng jpn jug juh juk jva kab kac kae kan kar kas kau kay kba kbw kel ker ket kew kgy kha khg khi khm khn khr khs kik kil kin kir kiw kkp kkt kkv klq kmb kmh kmj kmk kmn kmo kmz knc knd kni knk knn kob kol kor kos kqq krb krc krd kre kro krr krw ksg ksm ksn kta kty kum kun kuo kuu kuv kwo kwt kyk kyl kyr laa lab lad lag lah lai lal lan lao lav lbu lda ldu lel len lep lew lez lgt lho lim lin lis lkt lmb lmh lmn lmp lnd lon lot loz lug lun luo luv maa mab mad mag maj man mao map mas maw may mba mbi mbm mby mdl mea mee mei mer mey mga mgu mhi mie mik mis miz mka mkd mkg mlg mmw mna mnd mng mnm mns mon moo mor mou mpa mpt mpu mrg mrl mro mru msg msl mtu mum mun mup mus myi mym nad nag naj nam nan nas nav nax nbd nbm nbr ncm ndb ndi ndj ndo ndt ndu nep new ngb ngd ngk ngm ngn ngo ngt ngz nha nif nis niu niv nke nkn nko nma nnd nnk noc non noo nph ntj nua nue nun nwd nyk nza nze obg obo olo omi one ood orh oro orw osa oya paa pal pan par pat paw pdp per pkt plg pms pok pra pre prh prk prs psh pso pul pum pun qhu ram rao raw rem rji rny ron rot ruk rum rwa ryu sah sak sam san sap sar sav sdw sed sem ser sgb she shk shl shn sho sid sio skk sko skp skw sla slb sle slg sme sna sng snm snn snt sob som son spi sre sro sti stl sue suk sul sun svs swa syu tab tah tam tao tas tau tbl tbt tbw tel ten ter tet tgk tgl tgr tha thk thy tid tin tja tke tki tml tmo tna tnc tng tnn tny tou toz trb trm trw tsh tsi tsn ttn ttu tul tur tvt twe udh uhi una ung urd urt uru usa uzb vai vie vnm wah wak wal wap wat wbn wed wma wme wmu wol wom wrd wrg wsk wwa xas xbi xho xoo yal yaq yar ygr yid yko yns ytu yuc yur zan zaz zhn zul zzo,615,76475,0.008041844
81A,Order of Subject; Object and Verb,,81,Matthew S. Dryer. 2013. Order of Subject; Object and Verb. In: Dryer; Matthew S. & Haspelmath; Martin (eds.) 2013. The World Atlas of Language Structures Online. Leipzig: Max Planck Institute for Evolutionary Anthropology. (Available online at https://wals.info/chapter/81),1,aba abk abn abo abv adg ady aga agm agt ain akh ala ale all aly amb ame amh amn amp ang ano ao api apt apw arc arw asm ass ath atm ava awa awi awp awt awy aym aze azi baa bam bao baw bdm bdw bej ben bgm bho bhu bin biu bkb bkt blt blx boa bok bon boq bri brl brm brp bsq bti bua bur bus but bzi cah can car cas cay cct cde chb chc chd chg chh chp chv cln cml cmn cnl coa cpn cpy cro ctm ctw cui cup dag dan daw dds der des deu dgr dha dhb dhm die dig dim diy dja dji djp dni drg drm dum dun edo eip eka eme ene epe ese eud eve evn foe for fqs fur gah gal gam gan gap gar gds geo ghb ghr gim gln gmw gog gon grw gug guh guj gur guu hai ham hay hhu hid hin hlp hmi hop hpd hua hui hum hzb iat idn iha ijo ika inn irq irx isa isi ite iwm jad jbt jin jiv jms jng joh jpn jrw jva kaa kab kac kae kbo kbu kem ket kew kgu kha khd khg khl kho khw kie kim kio kiw kkp kku kll klw kma kmb kmh kmn kmo kmp kmr kms kmz knb knd kng knm knn kno knr knz koa kob kok kol kor koy kqq krc krd krh krr krw kry krz kse kta kti kty kum kun kus kuv kwo kwt kya kyk kyp kyr kyz lad lah lai lal lav lep lez lis lkt lmn lot mab mag man mar maw max mde mdl mdn mek mem mer mey mgg mgh mgi mhi mij mik mis miz mka mkg mkh mki mkj mkl mku mnc mne mni mnm mno mns mnv mny mog mom mpa mpt mqf mrc mrd mrh mri mrr mrs mru msc msg msl msn mto mts mtu mun muu mym myr nab nag naj nam nar nas nat nav nbd nbr nep nev new nga ngt niv nkb nku nma nmb nmd nnd nnk noc nog ntj ntu nus nwd nyi nyk oir oks omh ong ord orh ori oro orw ory osa oss oya pae pan paw pba pdp pir pis pme pno pra prh prk prs psh pso ptt pum pun qaf qhu qim ral ram rao ras raw res ret rgc ria rik rmb rpa rum run rut rwa sar sav sdw ser shb she shh shi shk sho sia sid sil sko skp skw sla slb sme smn sna sng snh snm snn snt sod som spi srb src srn sro sta stl sue suk sup sus svs syu taj tak tam tao tar tau taw tba tbl tbu tce tdi tdr tel tgl tgr thk thn thu thy tib tig tja tkl tkm tlf tli tlo tma tmc tmg tml tmo tni tnn tod tpt trb trr trw tsf tsh tsz tte ttu tul tun tur tuv tuy tvo twe tye uby udh udi udm uhi una urd urk usa usr uyg uzb vai wag wah wak wao wap was way wbn wed wlw wly wme wmu wna wom wsk xas xer xns yah yal yam yaq yar yei yel ygr yid yiw yko ykt ylm yqy ytu yuc yuw zag zay zaz zim zun,564,76475,0.007374959
86A,Order of Genitive and Noun,,86,Matthew S. Dryer. 2013. Order of Genitive and Noun. In: Dryer; Matthew S. & Haspelmath; Martin (eds.) 2013. The World Atlas of Language Structures Online. Leipzig: Max Planck Institute for Evolutionary Anthropology. (Available online at https://wals.info/chapter/86),1,aar aba abk abu abv acg acn aco acu adg adi adk adn adz aga agm ain akh akn ala all aln als amb amc ame amh amm amn amq amt amx ana ang ani ano anu ao api apl apt apu ara arc ari arm arw asm ass ath atk ava awa awi awp awt ayi aym ayo ayr aze baa bae bai bam baw bbw bdm bej bel bho bhu bii bik bil bin bio bkt bla bln blx bmb bnb bod bok bon bri brm brs bry bsk bsq bur bus but buu bya cah can car cas cav cax cay cbo cct cde chc che chg chh chi chk chn chs chv cln cmh cml cmn cmr cnl cnm cnt coa coc cpn cpy cro cti ctm ctw cub cup dag dan daw dds der des dga dgb dgr dha dhb dhi dhm die dig diy djn dlm dmi dni dom doy drg drm dsh dul dum dun dyi edo ega eip emb eme epe ese est eud eve ewe fas fin for fqs ful fur ga gam gan gap gar gav gds geo gjj gln gmw gnn god gon grb grj grr grw gua gur gwa gyc hai har hat hay hhu hid hin hix hma hmo ho hop hpd hua huc hui hum hun hup hzb iau idn ijo ika imo ina ing iqu irr irx iwa jab jaq jel jiv jms jng jpn juh jva kaa kab kae kas kay kbt kbw kby kch kem ket kew kfe kgu kgy kha khd khg khi khl kho khw kim kio kir kiw kje kkp kkq kku kkv kla klg kll klm klq klr klv kma kmb kmh kmk kmo kmp kms kmz knb knd kng kni knm knn kno knw knz koa kob kok kol kop kor koy kpe kpw kqq krc krk krn krw kry krz ksa kse ksg kta kti kty kum kuv kwo kwt kwz kxo kyl kyn kyr kyz kzy lab lad lah lai lal lat lav ldu lep let lez lgt lim lis lit llm lmn lng lot lug lui lul mac mag man map mar mau maw mba mbo mcc mco mde mdm mdn mea mei mek men mer mey mgg mhi mie mii mik mis miz mka mke mkg mkl mku mlm mme mnd mne mni mno mns mnv mny moh mom moo mor mos mot mpr mpt mrd mri mrr mru mrw msc msg msn mts mtu mun mut mxx mym myr nab nad nam nar nav nbd nbr ncm nep nev new ney nez ngi ngt nis niv nkn nku nma nnk noc nph nrg nsn nti ntj ntu nua nwd nyi oji oks omh omi ong ord ork oro ory osa oss pae pan pat pau pba pdp pia pir pis pit plh plk pme pmn pno pnu pnx pok ppc ppi pra prh psh pso ptt pul pum pun pwn qaf qaw qhu qia qim ral ram rao raw rem res ret rgc rum run rut rwe sah sar sav sdw sec sem ser sgb she shi shk sia sid sin sio skk sko skp sla slb sle slp sme smn sna sng snm sno snt sob sod src srn sro sta stl sud sue sug suk sup sus svs swe tab tac tak tam tar tau taw tba tbt tdi tel tgl tgn thk thn tho thu tib tid tir tis tiw tja tkl tkm tlf tli tlo tls tma tml tmo tnb tnc ton tou tpn tpt trb trr trt tru trw tsf tsh tsm tsz ttd tte ttn tts ttu tul tun tur tuv tvo twe tye uby udh udm uhi uli una urd urk urn usa usr ute uzb vai wah wai wak wao wap was wat way wbn wch wed wem wik win wiy wly wma wme wmu wna wog woi wom wra wrm wrw wsk wwa xam xas xav xer xoo yag yal yaq yar ybi ycn yei yel ygr yid yim yin yiw yko ykt yqy yrm ytu yuc yuk yur yus yyg zar zay zch zpr zqc zqs zun,685,76475,0.008957176
89A,Order of Numeral and Noun,,89,Matthew S. Dryer. 2013. Order of Numeral and Noun. In: Dryer; Matthew S. & Haspelmath; Martin (eds.) 2013. The World Atlas of Language Structures Online. Leipzig: Max Planck Institute for Evolutionary Anthropology. (Available online at https://wals.info/chapter/89),2,aab aar aba abo abu abv acl acn adg adi adz agb agh agm agt ajg akh akn alk all aln aly ama amb ame aml amo amp amq amt amx anc ane ang anj ano anu any ao aoj apt apw asm atk au awe awi awt awy baa bab bag bai bak bam bar bas baw bbl bbu bdu bem ber bfi bgm bgr bid bik bin bir bka bku ble blt blx blz bmb bni bnn boa bod bok bra bri brl brm brn brp bry bud bum bus buu bvi cai cas cct cem chg chi chs chw cic cmr cro cti ctm dag dan day dds deg dga dgb dgo dha did die dig dim din dio diy dlm dma dms doy duk dul dum dun dyi edo efi ega egn eip eka emb emm epe erk err ewe ewo fas fon for fua fur fye gah gal gap gar gbb gbs giz gln gmw goe grb grj grw gud gul gur guu gwa gwo gyc hai ham han hat hau hdi heh hem hma hna hnd hol huc hya iau idn idu ifm igb ige ik imo ina inn irq irr irx isa iwm jab jad jel jms jng juh juk kac kae kar kau kbw kch kel ken ker kew kfe kga kgr kgy khd khm kie kim kin kir kis kje kkv klq kmb kmi kmj kmn kmo kmp kmr kmu kmz knc kni knk knm knr knz koa kob koe kok kon kos kpe kpw kqq kro krr kse ksg ksn kta ktc kte kti kuu kwb kwn kwt kyk kyl kyo lab lad lag lah lai lal lan lao lar lav lbu lda ldo leb lel len lep les let lew lgi lgt lis lkt llm lmg lmh lml lmu lnd lon lot lug luo luv ma maa mab mad mae maj mal man mao mar mas maw may mba mbe mbl mbm mbr mbt mby mda mde mdg mdl mdn mdo mdw mea mee mei mey mga mgi mgo mgq mgu mhl mij miy miz mka mkd mkg mkl mku mlg mlk mlu mmi mmv mmw mni mnm mnv mnz mof mok mom mon moo mor mot mou mpo mpt mpu mrg mrh mri mrl mro mrr mru msc msg msk msl msm mtb mts mua mud mum mup mur mwe mwo mxe myg myn nab nal nam nan nax nbd nbr ncm nde ndi ndj ndo ndt ndu new ney ngb ngg ngk ngm ngn ngo ngt ngu ngz nis nkn nko nku nma nnk non noo nph nrg ntj nto nua nue nup nus nyh nyk nym nza nze obo olo omh omi ora orh ori oro orw otr paa pai par pat pau paw per pia pis pit pkt plh pms pnx pod poh pok pre prh prk psw pum pun qia rag ral ram raw rgc rny ron rot rum rwa sah sak san sdw seb sem ser sgb sgu she shl shn sht sio skk sko sku sla slb sle slp smn sng snt so sob spi sro sud sue sul sup swa tab tam tao tau taw tba tbl tbt tbu tbw tdi tdr ten ter tes tet tgl tgn tgo tha thd thk thy tib tid tik tis tkl tlf tlo tmm tmn tmo tna tne tng tnn tou toz tpr trb trr ttd tte ttn tuk tum tvt uld una ung ura urt usa vai ven vif vnm wag wah wal wap wma wmu wna woi wra wsk wwa xam xas xbi xho yal yar yel ygr yi yid yiw ylm yor yqy yuc yul zag zan zar,608,76475,0.007950311
