parameter_id,parameter_name,parameter_description,chapter_id,chapter_citation,value,same_value_language_ids,value_language_count,language_count_total,count_ratio
143G,Minor morphological means of signaling negation,,143,Matthew S. Dryer. 2013. Order of Negative Morpheme and Verb. In: Dryer; Matthew S. & Haspelmath; Martin (eds.) 2013. The World Atlas of Language Structures Online. Leipzig: Max Planck Institute for Evolutionary Anthropology. (Available online at https://wals.info/chapter/143),4,aab aar aba abi abk abn abu abv ace acg acl acm aco acu adg adi adz aeg agb agc agd agh agm ain aja ajg akh akn ala alb alk all aln als alw aly amb amc ame amh aml amn amo amp amq amr ams amt amx ana anc ane ang ani anj ann anu any ao aoj apl apt apu apw ara arc arg arj arm aro arp arq arw asm ass asu asy ata ath au ava awa awe awp awt aym aze azi baa bab bac bae baf bag bai baj bak bam bao baq bar bas baw bbf bbl bbu bbw bch bco bdm bej bel ben ber bfg bgn bgo bgr bho bia bid big bii bik bil bio bir biu bka bkr bku bla bln blr blt blx blz bmb bmz bni bnn bnu boa bob bod boi boj bok bol bra bre brf brh bri brl brm brn brp brr brs bsh bsk bsq bti btk bto bua bud bug bul bum bun bur bus but buw buy bvi bwc bya bzi cah cai cak cam can car cas cax cay cba cbo ccm cct cde cea cem cga cha chb chc chd che chg chh chi chj chk chn chp chq chr chs chv chw chx cic ckl cle cln cmh cml cmn cmr cmy cnl cnm cnt coa coc coo cop cos cpl cpn cpy cqt cre crn crp crt cso cti ctl ctm cub cui cup cya cyv cze dag dan dds des deu dga dgb dgo dgr dha dhi dhm dhw did die dig dim din dio diy dja dji djm djn djp dma dmi dmk dms dni dom dre drm dsh dua duk dul dum dun dut dyi ebi efi ega eip eka eko emb eme ene eng eno eny epe erk err ese est eud eve evn ewe fij fin fon fre fua ful fur fut fye ga gaa gae gah gal gap gar gav gbb gbs gds gel geo ger ggu ghr gim gir giz gjj gku gla gln gmw gmz gnb goa god goe gok gon goo grb grf grj grk grr grs grw gua gud gug guh guj gul gur guu gwa gwo gyc hai hak hal ham han har hat hau haw hay hdi heb heh hei hid hil hin hix hlp hlu hma hmi hmo hna hnd hoa hol hop hpd htc hua huc hui hum hun hup hve hya hzb iaa iau iba ice idn ido idu ifm ifu ige ign igs ijo ik ika ila imo ina ind ing inn iqu iri irq irr irx isa ita ite iwm izi jab jak jaq jar jeb jiv jlu jmo jms jng joh jpn juh juk kaa kab kac kad kae kan kar kas kau kay kba kbl kbo kbw kby kch kdw kdz kel kem ken ker ket kew kfe kga kgr kgy kha khd khg khl khm khn kho khr khs kie kik kil kim kin kio kir kiw kkp kkt kkv kla klg kll klm kls klv klw kma kmb kmh kmi kmj kmk kmn kmo kmp kmr kms kmu kmw kmz knb knc knd kng kni knk knm knn knr knw knz koa kob koe koi kok kol kom kon kop kor kos koy kpw krb krc krd kre krh kri krj krk krn kro krr krw kry ksa kse ksg ksn kta ktc kti ktl kty kum kun kuo kus kut kuv kwa kwb kwn kwo kws kwt kwy kwz kxo kya kyl kyp kyq kyr kyz kzy laa lab lac lad lag lah lai lal lan lao lar lat lav lbu lda ldo ldu leb lec leg lel len lep les let lew lez lgi lgt lgu lho lic lim lin lis lit lkt llm lmg lmh lmn lmp lmu lnd lng lon lot lou luc lug lui luo luv ma maa mab mac mad mae mag mai maj mak mal mam man mao map mar mas mau maw may mba mbe mbi mbl mbm mbr mbt mby mcd mch mco mcv mda mde mdg mdl mdm mdn mdo mdw mea mee meh mei mek men mer mga mgg mgi mgk mgu mhi mhl mhu mie mig mii mik min mir mis miy miz mka mkd mke mkg mkh mki mkj mkl mku mkz mlg mlk mlu mmb mme mmn mmv mmw mna mnc mnd mne mni mnm mno mns mnt mny moe mog moh mok mom mon moo mor mos mot mou mov mpa mpo mpt mpu mra mrd mrg mrh mri mrl mro mrq mrr mrs mrt mru mrw msc msg msk msl msm msn msq mss mtb mts mtu mua mug mui mum mun mup mur mus mut mwb mwe mwo mxc mxe mxj mxo mxp mxx myg myi mym mzc nab nad nag nah naj nak nal nam nan nar nas nav nax nbd nbm nbr nca ncm ndb nde ndj ndo ndr ndt ndu ndy neh nep nev new nez nga ngd ngi ngj ngk ngl ngm ngn ngo ngt ngu ngw ngz nha nhh nhm nht nia nif nis niu niv nke nkk nkn nko nku nma nmb nmm nne nnk noc non noo nor nph nrg nse nsg nsn nti ntj nto ntu nua nue nug nun nup nyh nyi nyk nym nyn nyr nyu nza nze obg obo ocu oir oji oks olo omh omi ond one ong ono ood ori ork oro orw osa oss otm otr oya paa pae pai pal pan par pat pau paw pba pec per pga pia pip pis pit pkn pkt plg plh pme pms png pnn pno pnu pod pog poh pol por ppi pra pre prh prk prs psh psj psm pso psw ptt ptw pul pum pun pur pwn qaw qhu qim qui qum rag ram rao rap ras raw rem res ret rgc rik rim rit rnd rny rom ron rot rov rpa rru rsu ruk rum run rus rwa rwe sah sak sal sam san sap sar saw sba scr sdw sed see sel sem ser ses sgb sgl sgu shb she shh shi shk shl shm shn shp sht shu shy sia sid sil sin sio sir sis siu skk skm skw sla slb slo sme sml smn sna sng snm snn sno snt so sob sod som son sor spa squ srb src srd sre sro ssa sta sti stl stn sub sud sue sug sul sun sup svs swa swe swt syu tab tac taf tag tah taj tak tal tam tan tao tar tas tau taw tba tbo tbt tbu tbw tbx tce tdr tee tel ten teo tep ter tes tet tgh tgk tgl tgo tgr tha thn tho thu thy tib tid tig tim tin tir tis tiv tiw tja tke tki tkl tla tli tlo tlp tma tml tmm tmn tmo tmr tna tnc tne tng tnn tno tny tob tod tol ton tou toz tpa tpn tpr tpt trb tri trm trr tru tsf tsg tsh tsi tsn tsz tte ttn tts ttu tuc tuk tul tun tur tus tuv tuy tvl twe twn tye tzo tzu uby udh udi udm ukr uld uli una ung urd urk url urn urt uru usa usr ute uyg uzb vai ven vie vnm wag wah wai wak wal wam wao wap war was wat wau way wbn wch wec wed wel wem wic wik win wiy wlf wlm wlw wly wma wme wmu wna woi wol wom wor wra wrb wrd wrg wrk wrl wrm wrn wsk wtm wya xam xar xav xbi xho xns yag yam yao yap yaq yar ybi yei ygr yi yid yim yin yiw yko ykt ylm yng yok yor ypk yqy yrm yrr ytu yuc yuk yul yur yuw ywl ywr zag zai zan zap zar zay zaz zch zpr zqc zqo zqs zul zun zzo,1315,76475,0.017195161
105A,Ditransitive Constructions: The Verb 'Give',,105,Martin Haspelmath. 2013. Ditransitive Constructions: The Verb 'Give'. In: Dryer; Matthew S. & Haspelmath; Martin (eds.) 2013. The World Atlas of Language Structures Online. Leipzig: Max Planck Institute for Evolutionary Anthropology. (Available online at https://wals.info/chapter/105),1,abk abu akh ale alk ame aml ano ara awp bae bag bai bak bdm ber bfg bho bii biu bkt bma boz bsq bum bur but bya bzi cct chk chn chr cnl cop dhi dja drg dug epe eve fij fin fre gam gar gdf geo ger grk gua guu hai hat heb hin hix hmo hun hzb ik imo ing irq ita itz jab jak jel jng jpn kas kda kem ker kha khs klm kly kma kmu knc knd knm knr koa kod kor kro kwa kya lad lak lat lav lep lez lgu lis mac mad mai mam mao mbb mbi mbo mdg mdr mei mgg mgu mhi mle mlt mpr mup mus mxc mym nag nbd nep nia niu nsg nua nwd orh ory pae per pms prs pta ptt pur qaf qim rap raw ron rus san sap skp sla sml snm sno so spa sud sue sup tam tgl tgn tha tib tig tin tis tml tms tor trb tru trw tsi tst tsz tur tzu udh udm uku urk wir wra wrm yid yim yko ytu zaq zay zaz,189,76475,0.0024713958
92A,Position of Polar Question Particles,,92,Matthew S. Dryer. 2013. Position of Polar Question Particles. In: Dryer; Matthew S. & Haspelmath; Martin (eds.) 2013. The World Atlas of Language Structures Online. Leipzig: Max Planck Institute for Evolutionary Anthropology. (Available online at https://wals.info/chapter/92),6,aar abk acu adz aga ala alk aml ana ang ano apl apu apw ara arc arg arm arw ass ath azi bae baf bao bco bdm bej bgz bii bik bil biu bla ble bln blt bmb bod brm brn brs bsh bti bum bur cah cai can car cba chc chi chk chv cml cmy coa cpl cpy crp ctl cub cup cze des deu dha die dim din dio diy djm dlm dni dsh dut eip emb ene eng eno epe erk fas fij foe fri ful gae gah gal gar gdb gds geo ger ghb gim gln gmw gmz gnb grj grw guj gum gyc hay hix hmi hoa hpd htc hua hya hzb idu igb ijo ing irq irr ita ito jak jmo jug kab kae kan kay kba kbl kch kem khi kik kis kje kkp klv klw kma kmh kmk kmn kmr kmz knc kni knm knn knr knw koe kok kol kor kqq krc kro kun kuo kuu kws kwz kyk lab lad lan lbu lez lho lin lis lmh lon lot luo mab mac man mao mar mde mdn meh men mer mgg mik mku mlg mna mnc mne mng mni mnm mov mra mrl mrt msc msg msl mts mtt mwo mxc nab nad naj nbd ndi ndj ndr ndy nga ngd ngk ngo ngt ngz nha nht nif nmb nnd nnk noc nor nph nua nyk ora orh osa paa pae pai pal par pau paw pdp pip pme pms poh ppi prk psh pso psw ptt puq qaw qhu qui rem rny rom rov ruk run ryu sah sal sar sea ses shl sia sid skw sml smn sna snm spa src sta stl sud sue sul svs swe syu tab taf tai tar tbt tbw tbx tel ten teo thy tid tir tke tml tmo tni tob ton tps tsf tsi tsz tte tuc tun tuy tvl uby udh uli una usa usr uzb vnm wak wao wap war wem wly wma wol wra wrg wrk wrn wtm xbi yal yap yid yko yng yor zag zay zaz zch zqc zzo,355,76475,0.00464204
38A,Indefinite Articles,,38,Matthew S. Dryer. 2013. Indefinite Articles. In: Dryer; Matthew S. & Haspelmath; Martin (eds.) 2013. The World Atlas of Language Structures Online. Leipzig: Max Planck Institute for Evolutionary Anthropology. (Available online at https://wals.info/chapter/38),1,abu alb ame amq anj anu arm aro arp arq arw bik bil bir blt bre bya ceb cem cop did dio dsh duk dut eng err ewe fon fri fut fye ga gbb gul gwa hau haw hun iaa jms jpn juh juk kau kkt knr kob kyk lel lkt llm lmg luo mae mao mgg miy mok mup nab nbd ngz nia nif nkn nph nua pdp pip poh qui ram rov run sam sdw sio sir sis slb squ sup taf taj tau tgk tha tik tla tng tnk tou tvl tzu wah wlf wsk yap yaq zag,102,76475,0.0013337692
34A,Occurrence of Nominal Plurality,,34,Martin Haspelmath. 2013. Occurrence of Nominal Plurality. In: Dryer; Matthew S. & Haspelmath; Martin (eds.) 2013. The World Atlas of Language Structures Online. Leipzig: Max Planck Institute for Evolutionary Anthropology. (Available online at https://wals.info/chapter/34),4,aco ain aly amp bae bak baw bkt boz chn dja dji gar hdi hma ind jak kha khm kwa kya lmg mam mdr mgg mid mog mpr mxc nab nep ngi nha niv nph olu oya rap sea shk sun tag tau tib tkl trb ttn uli vie wam wrd yor ywl ywr,55,76475,0.0007191893
85A,Order of Adposition and Noun Phrase,,85,Matthew S. Dryer. 2013. Order of Adposition and Noun Phrase. In: Dryer; Matthew S. & Haspelmath; Martin (eds.) 2013. The World Atlas of Language Structures Online. Leipzig: Max Planck Institute for Evolutionary Anthropology. (Available online at https://wals.info/chapter/85),1,aar aba abk acg acn aco adg adi adk adn ady agm ain ajg akh ala aly amb amc ame amk amp amt ana ang ao api apl apt apu ara arc arm arw asu atk ava avo awe awp awt aym baa bac bae bam bao baw bbf bej bgs bho bil bin bkb ble bln blt blx boa boj bok bon brh bri brm brs bry bsk bsq bti bua bur bus but bya bzi cah cai cam car cas cav cbo cct cde chc che chg chi chk chn chp chs chv cln cmh cmn cmr cnl cnm coc coo cor cti ctm ctw cub cup dag dan daw dds der des dga dgb dgr dhm die dig dim dji dlm dmi dmk dms dni drg drm dul dun edo eip emb eme emm ene epe ese est eud eve evn ewe fas fin for fqs ful fur gaa gam gan gap gar gav geo ghb gim gjj gln gmw gnn gon grb grj grw gua guj gur gyc hai ham han hay hhu hid hin hix hlp hma ho hop hpd hua hum hun hup hzb iau idn idu ika imo ina ing inn iqu jbt jel jin jms jng joh jpn jug juh jva kaa kab kac kas kbo kbt kch kem ket kew kgy kgz kha khd khl kho khr khw kie kim kir kiw kje kkp kkq kku kll klm klq klr kma kmb kmh kmk kmn kmo kms kmw kmz knb knc knd kng knm knn knr knz koa kob kok kol kop kor kpo krc krh krj krk krn kry ksa kse kti kty kum kun kus kuv kwb kwo kws kwt kxo kyk kyn kyr kyz kzy lad lah lai lak lal lar lav ldu lep lez lgt lho lis lkt llm lmn lot lug lui lun mab mac mad mag mai maj man mar maw max mbo mcc mde mdl mdn mei mek mey mgg mgh mgi mhi mik mis miz mka mke mkg mkj mkl mku mme mnc mnm mno mns mnv moe mom mou mpr mpt mqf mrd mrh mri mru msg msn mtu mun muu myr mzn nab nad nag nam nar nas nat nav nbd nbr ndj nep nev new ngg ngk nis niv nkn nnd nnk noc nph nti ntj ntu nwd nyi nze oks omi orh ork oro orw ory osa oss owi pae pan pau paw pdp pis pit pmn pnx pra prh prk psh pso ptt ptw pum pun puq qaf qaw qhu qim ram raw rem res ret rik rum run rut ryu sar sav sba sdw sel sem ser shb she shh shi shk shy sid skk sko skw sla slb sle slp sme smn sna sng snh snm sno snt sor src srn sro sta stl sue sup sus svs syu tac tak tam tar tau tbl tbt tbu tbx tce tel tgl thd thn thu tir tja tkl tkm tlf tli tls tml tmo tnc tny ton tou tpn tps trb trm tru trw tsf tsm tsr tsz tte tts ttu tuc tul tun tur tuv tuy tvo tvt uby udh udm una ung urd urk urn usa ute vai wah wai wal wao was wat way wbn wir wme wna wor wra wrd wry wsk wtm xas xav xns yag yah yal yaq yar ycn yei yel ygr yi yim yiw yko ykt ylm yqy ytu yuc zag zar zaz zch zun,577,76475,0.007544949
112A,Negative Morphemes,,112,Matthew S. Dryer. 2013. Negative Morphemes. In: Dryer; Matthew S. & Haspelmath; Martin (eds.) 2013. The World Atlas of Language Structures Online. Leipzig: Max Planck Institute for Evolutionary Anthropology. (Available online at https://wals.info/chapter/112),1,aar abk acu adi adz agb akn aly amc amp amt ang ao apl apt arc arq ass ath awe awt aze azi bbl bbu bej bel ber bgn bia bio biu bku bla bln blz boa boj bol brh brl brn brr brs bsh bsk bti bur but bya cam can car cas cay cba cbo ccm cct cde cga chg chh chi chn chv cic cln cmh cnm coa cop cpl cpn cqt crp ctm cub cyv cze dds des deu dhi dhm dig dim dio dmi dms drm dul efi emb eny epe err fua ful ga gah gal gar gim gjj gku gln god gon grw gur gyc ham har heh hid hix hmi hnd hol hpd hua hui hum hya hzb idu ika ila ina ing irq irx jeb jiv jms jpn kab kac kas kay kba kbo kby kdw kem kew kga kgr kgy kha khd khg khl kik kil kin kkp klg kll kma kmb kmh kmi kmn kmo kmp kmr knd knm knr knw knz koa kob kok koy krd krh kri kta kun kus kuv kwo kwz kyz lad lat lda ldo leb lec leg les let lez lgi lit llm lmp lot luc mab mag map mcv mee mei mhl mii mik mis mkd mke mki mlg mmv mmw mnc mne mot mpt mrs msc msg msl mts mua mug mui mwe mym mzc nam nan nbd nde ndt nep new ngl ngn ngt nis niv nkn nko nku nmb nmm noc noo nph nsn ntj nto nwd nyh nym obg obo ocu omh ori ork oya pae pec pga pia pme pms png pre prh prk prs psh psj psw ptt ptw pum pwn rao ras rem ret rgc rim rit rnd rny rru rum run sak sar sba sdw sem ser sgu she shh shk shm shn sia sin smn snt sod sor srb sug sul swa syu taj tal tan tao tar tba tbu tbw tdr tel tet tgr thn tib tir tis tki tlo tlp tma tml tna tne tob tod ton toz tpt tsf tts tuc tul tun tur tuv tuy twn uby udi urn usr uyg uzb ven wai wao wap was wau wbn wly wme woi wra wrn wtm xho yam yao yar ybi ygr yim yko ykt ypk yrm yrr ytu zag zap zay zaz zul,395,76475,0.0051650866
51A,Position of Case Affixes,,51,Matthew S. Dryer. 2013. Position of Case Affixes. In: Dryer; Matthew S. & Haspelmath; Martin (eds.) 2013. The World Atlas of Language Structures Online. Leipzig: Max Planck Institute for Evolutionary Anthropology. (Available online at https://wals.info/chapter/51),6,ala amb amp ao apu awp awt aym bac bao bin bsq bzi cav cct chg chn cmr coo daw dds des die dig dim dlm dmi dms dun eip eme emm epe fas for fqs ful gar gim gnn hai hay hma hpd ika imo ina inn jpn kew kgy khd khr kll kmw knc knm knr koa krk ksa kwo kwt kyk lot mar mei mey mgg miz mnm mpt msg msn nab nar nat nbd ngg ngk nph oks ory pae pau pdp pit qhu res ret sar sdw sem shk skk sko sng snm sro svs tam tar tau tbt tbx tgl tja tmo ton tsf tuc tuy uby ung wat wbn wir wme wry yal ygr zag,123,76475,0.0016083687
88A,Order of Demonstrative and Noun,,88,Matthew S. Dryer. 2013. Order of Demonstrative and Noun. In: Dryer; Matthew S. & Haspelmath; Martin (eds.) 2013. The World Atlas of Language Structures Online. Leipzig: Max Planck Institute for Evolutionary Anthropology. (Available online at https://wals.info/chapter/88),2,aab aar aba abu ace acn adg adi adz aeg agb agh agm agt ajg akh akn alk all aln aly ama ame aml amo amp amq amx anc ane ang anj ano ao aoj api aro ata au avk avo awe awi ayw baa bab bag bai baj bak bas baw bbu bch bco bdu bdw bfi bgr bgs bid bik bin bir bka bkr ble blx blz bmb bni bol bra bre brf bri brp bry bse bsh bsi bsq bto bud bug buj bum buu bvi bwc ccm cct cem chh chj chr cic cle cme cnl coe cpl crn cro cso cya dag dan day ddj dds deg dga dgb dgo dha did die dim dio dma dng dni dok don dre dum dun edo efi ega egn eno erk err ewe ewo fas fij foe fon fua fut fye gae gbb gbs gel gim gla gln gmw gmz gnd gnn goa goe gok grb grf gug gul gwa gwo hal ham han hat heb hem hid hmo hna hnd hoa huc hya iaa iau iba ido ifm igb ige ila ind inn iri irq irr isa izi jab jak jar jmo jms juh juk kad kan kar kau kba kbw kch kel ken ker kfe kgr khd khm khn kik kir kis kkv klq klv kmb kmj kmo kmp kmu kmw kmz knc kni knk knm knr knz kob koe kom kon kos kpe kpw kqq krb kro krr kse ksg ksn kta ktc kte ktl ktu kuu kwa kwn kwy kyk kyl kyo laa lab lah lal lan lao lda ldo leb lel len les let lew lgi lgt lgu lho lic lis llm lmh lmp lnd lon lot lou lug luo luv luy mab mad mae maj mar maw may mbe mbi mbl mbm mbr mby mda mde mdg mdo mdw mea mei mey mgo mgq mgu min mka mkj mkq mku mkz mlg mlk mlm mlu mmb mmv mna mng mnm mnt mnz mof mok mon mor mou mpa mpo mpt mpu mrg mrl mro msm msn mtb mud mum mup mus mwo mxc mxe mxj mxo mxy myg myn nab nak nal nam nar nbr ncm ndb nde ndi ndo ndr ndt ndu ndy neh ney ngb ngg ngk ngm ngo ngt ngu ngz nia nif nke nkn nko nnd nne nng non noo nsg ntj nua nue nun nup nus nyi nym nza obg obo olo ora orh ori oro orw ory otr pat pit plg plh pnu poh pok prh psw pul rag rap ras rga rny ron rot rov rum run sah sak san sea sed see sem ser ses sgb sgu shn sht sim sio sis sko sku sle slp sml so sob son sre sro sti sud sue sul sun swa tab taf tai tak tat tbo tbt tbu tdr ten teo ter tes tet tgh tgk tgn tgo tha thy tib tid tik tim tin tiv tja tke tlo tlp tmm tmn tmo tmr tna tne tng tnk tno toz tpr trb tri tsi tsk ttd tte ttn tuk tvl uld uli ung url urt usa vai vie vif vnm wah wal war wat wch wel wlf wma wmu wn woi wol wom wsk wwa xar xbi xoo yal yao yap yay yel yi yim yiw yns yor yul yus zag zai zap zar zya zzo,562,76475,0.0073488066
26A,Prefixing vs. Suffixing in Inflectional Morphology,,26,Matthew S. Dryer. 2013. Prefixing vs. Suffixing in Inflectional Morphology. In: Dryer; Matthew S. & Haspelmath; Martin (eds.) 2013. The World Atlas of Language Structures Online. Leipzig: Max Planck Institute for Evolutionary Anthropology. (Available online at https://wals.info/chapter/26),3,aeg aga amh amr amx ao arg asy awt bae bag baq bej bel ber bil bre brr bry bti bur chi chk chx cln coo cze dgb dgo drm eud fqs fua fur fye gae gds geo gku gmz goa gur heb hlp hua igs ijo ika kfe kiw kmh kmp kmr knm knw kom krd kry kut lat lav lec lot mab mcc mdn mdo mei mki mnm mok mou mrg mrl msc mui mur mzh nak ngl ngm niv nkb nph nwd olo ong par pba pia pir pkt poh prs qui rut sem shp sht slb smn so sup taj tao tau ten tgr tkl tma tnn ton tsi tsz usr was wed wra wrk yur zag zpr,123,76475,0.0016083687
46A,Indefinite Pronouns,,46,Martin Haspelmath. 2013. Indefinite Pronouns. In: Dryer; Matthew S. & Haspelmath; Martin (eds.) 2013. The World Atlas of Language Structures Online. Leipzig: Max Planck Institute for Evolutionary Anthropology. (Available online at https://wals.info/chapter/46),2,abu aeg ame aml amp ano bab bag bak bam bud cic dgb doy eng err ewe fon fre fue gam gbb gol hau ibi ilo ind iri irq ita kan kat kfe kji klq kob kse kwr kya kyk lan lav lel lgu lug mal may mbi mby mde mgu mis mle mlt mrg msh nbd ndb niu nko nti nto orh orl pal pms prs sam san see sla som sum swa tid tis tms tmu tru tur tvl usa yap yor,85,76475,0.0011114744
