parameter_id,parameter_name,parameter_description,chapter_id,chapter_citation,value,same_value_language_ids,value_language_count,language_count_total,count_ratio
69A,Position of Tense-Aspect Affixes,,69,Matthew S. Dryer. 2013. Position of Tense-Aspect Affixes. In: Dryer; Matthew S. & Haspelmath; Martin (eds.) 2013. The World Atlas of Language Structures Online. Leipzig: Max Planck Institute for Evolutionary Anthropology. (Available online at https://wals.info/chapter/69),4,aeg agc amh amr ang anu any arg arq asy ata ats awy bag bbl bbw bdu bfg bia bkl blr bma boa bsq bti ccm chh chk chq ckl cle cya cyv cze dds dgb die dio eno gae gbs gmz gnb ham heb hup hve iri ito izi jak jms kab kan kgr kik kls kmr kon kpm krd kre kro kry ktm kuo kwy laa lar lat lbu ldo leg lel lmg lml maa mbl mcc mea meh mer mga mki mmn moh mok mrg mrl msk mug mur mxo myi naj nak nam nan ncm ndb ndj ngo nym nyu ond pai per pkt poh prs rik rus rut sak sar shs sht sod src stn sup taj tee tep tes tic tim tli tlo tne tot tus txj tzo tzu vai wag wic wrw wya xho yei ygr yul zag,146,76475,0.0019091206
143F,Postverbal Negative Morphemes,,143,Matthew S. Dryer. 2013. Order of Negative Morpheme and Verb. In: Dryer; Matthew S. & Haspelmath; Martin (eds.) 2013. The World Atlas of Language Structures Online. Leipzig: Max Planck Institute for Evolutionary Anthropology. (Available online at https://wals.info/chapter/143),4,abi abn ace acg acm agb agc agd ain akh akn ala alb all als alw ams amt anj ann any apu arg arj arm aro arq arw ass asy ata awa awt aym baa bac bae baf bai baj bam bao baq bar bbl bbw bch bco bdm bej ber bfg bgn bho bia bil biu bkr bku bla ble blr blz bmz bni bnn bnu bra brf bri brl brp bsh bsq btk bto bua bug bul bun bur buw bvi bwc bya cah cam cax cba ccm cea cem cga cha chb chc chd che chg chh chk chn chq chx cic ckl cle cmn cmy cnt coc coo cos cpl cpy cre crn crt cso cup cya cyv cze dag dan deg dga dgb dgr dhi dhm dhw did din diy dja dji djm djn djp dmk dre drm dua dul dyi ebi egn ene eng eno eny err est eud fij fin fon fut gaa gae gap gav gds gel geo ggu ghr gir gjj gku gmw goa gok goo grb grf grj grk grr grs gud guj gur guu gyc hak ham han haw hay heb heh hei hil hin hlu hmo hnd hoa hol hop htc hua huc hui hun hup hve hya iaa iba idn ifu ign ik ila imo ind inn iqu iri ita jak jaq jlu jng joh juh kad kae kan kba kby kch kdw kdz ket kew kfe kga kgr kgy khd khm khn khr khs kik kil kin kir kkt kla klm kls klv kmh kmi kmj kmp kms kmu kmw knb knc kni knn knz koi kom kop kor kos krb krd krj ksa kse ksn ktc kty kum kuo kut kwa kwb kwn kws kya kyq kzy lac lah lal lan lao lar lat lda ldo leb leg les let lgi lgu lic lis lit llm lmp lot luc lui luo maa mae mag mai maj mak mal mam man mao mau maw mbi mcd mch mco mcv mde mdl mdm mer mgg mgi mhu mie mir mkd mke mkg mkj mkl mlk mme mmn mmv mmw mna mnd mni mnm mno mns mnt mny moe mog moh mok mon mos mov mpa mpo mra mrd mrh mri mrl mro mrq mrr mrt mru mrw msq mss mua mug mun mur mus mut mwb mwe mxc mxj mxo mxp mxx myi nab nad nah naj nak nal nam nan nar nav nax nbr nca ncm nde ndj ndo ndr ndy neh nev new nez nga ngd ngi ngj ngk ngt ngu ngw nha nhh nhm nht nia nif niu nkk nkn nko nmm nne nsg nti nto ntu nue nug nun nwd nyh nyi nyk nym nyn nyr nyu obg obo ocu oir oji oks omi ond ono ood orh ori ork oss otm pai pal pan par pba pga pip pkn plg pms png pnn pno pnu poh pol por ppi pra pre prs psh psw ptt pul pun pur pwn qim qui qum rap ras raw rem res rgc rik rim rnd rny rom rov rpa rru ruk rus rwa sak sal sam sap scr sed see ser ses sgu she shl shm shn shp shu sid sil sir sis skw slb slo sml sna sng snn sno snt so sob sod som son sor spa squ srb src srd sre ssa sta sti stl sud sue sul sun svs swa taf tag tah taj tak tal tam tas tau taw tbo tbw tbx tce tdr tee ten tep tes tet tgh tgk tgo tgr tha thn tho thy tib tim tin tis tiw tke tki tkl tla tli tlp tmm tmr tna tng tnn tno tny tob tod tol tou toz tpa tpn tri trr tsg tsi tsk tsn ttn tts ttu tuk tus tvl twe twn tzo tzu udh udi ukr uli una ung urd url uru usa usr vai ven vie wag wah wak wal wam war wed wel wem wic wik wlm wlw wme wmu wol wor wrb wrd wrg wrl wsk wtm wya xam xar xbi xho xns yag yao yap yaq ybi yei ygr yi yid yim yin yiw yko ylm yng yok yor ytu yuc yur yuw ywl ywr zai zap zar zaz zqc zqo zqs zzo,712,76475,0.0093102325
86A,Order of Genitive and Noun,,86,Matthew S. Dryer. 2013. Order of Genitive and Noun. In: Dryer; Matthew S. & Haspelmath; Martin (eds.) 2013. The World Atlas of Language Structures Online. Leipzig: Max Planck Institute for Evolutionary Anthropology. (Available online at https://wals.info/chapter/86),1,aar aba abk abu abv acg acn aco acu adg adi adk adn adz aga agm ain akh akn ala all aln als amb amc ame amh amm amn amq amt amx ana ang ani ano anu ao api apl apt apu ara arc ari arm arw asm ass ath atk ava awa awi awp awt ayi aym ayo ayr aze baa bae bai bam baw bbw bdm bej bel bho bhu bii bik bil bin bio bkt bla bln blx bmb bnb bod bok bon bri brm brs bry bsk bsq bur bus but buu bya cah can car cas cav cax cay cbo cct cde chc che chg chh chi chk chn chs chv cln cmh cml cmn cmr cnl cnm cnt coa coc cpn cpy cro cti ctm ctw cub cup dag dan daw dds der des dga dgb dgr dha dhb dhi dhm die dig diy djn dlm dmi dni dom doy drg drm dsh dul dum dun dyi edo ega eip emb eme epe ese est eud eve ewe fas fin for fqs ful fur ga gam gan gap gar gav gds geo gjj gln gmw gnn god gon grb grj grr grw gua gur gwa gyc hai har hat hay hhu hid hin hix hma hmo ho hop hpd hua huc hui hum hun hup hzb iau idn ijo ika imo ina ing iqu irr irx iwa jab jaq jel jiv jms jng jpn juh jva kaa kab kae kas kay kbt kbw kby kch kem ket kew kfe kgu kgy kha khd khg khi khl kho khw kim kio kir kiw kje kkp kkq kku kkv kla klg kll klm klq klr klv kma kmb kmh kmk kmo kmp kms kmz knb knd kng kni knm knn kno knw knz koa kob kok kol kop kor koy kpe kpw kqq krc krk krn krw kry krz ksa kse ksg kta kti kty kum kuv kwo kwt kwz kxo kyl kyn kyr kyz kzy lab lad lah lai lal lat lav ldu lep let lez lgt lim lis lit llm lmn lng lot lug lui lul mac mag man map mar mau maw mba mbo mcc mco mde mdm mdn mea mei mek men mer mey mgg mhi mie mii mik mis miz mka mke mkg mkl mku mlm mme mnd mne mni mno mns mnv mny moh mom moo mor mos mot mpr mpt mrd mri mrr mru mrw msc msg msn mts mtu mun mut mxx mym myr nab nad nam nar nav nbd nbr ncm nep nev new ney nez ngi ngt nis niv nkn nku nma nnk noc nph nrg nsn nti ntj ntu nua nwd nyi oji oks omh omi ong ord ork oro ory osa oss owi pae pan pat pau pba pdp pia pir pis pit plh plk pme pmn pno pnu pnx pok ppc ppi pra prh psh pso ptt pul pum pun pwn qaf qaw qhu qim ral ram rao raw rem res ret rgc rum run rut rwe sah sar sav sdw sec sem ser sgb she shi shk sia sid sin sio skk sko skp sla slb sle slp sme smn sna sng snm sno snt sob sod src srn sro sta stl sud sue sug suk sup sus svs swe tab tac tak tam tar tau taw tba tbt tdi tel tgl tgn thk thn tho thu tib tid tir tis tiw tja tkl tkm tlf tli tlo tls tma tml tmo tnb tnc ton tou tpn tpt trb trr trt tru trw tsf tsh tsm tsz ttd tte ttn tts ttu tul tun tur tuv tvo twe tye uby udh udm uhi uli una urd urk urn usa usr ute uzb vai wah wai wak wao wap was wat way wbn wch wed wem wik win wiy wly wma wme wmu wna wog woi wom wra wrm wrw wsk wwa xam xas xav xer xoo yag yal yaq yar ybi ycn yei yel ygr yid yim yin yiw yko ykt yqy yrm ytu yuc yuk yur yus yyg zar zay zch zpr zqc zqs zun,685,76475,0.008957176
37A,Definite Articles,,37,Matthew S. Dryer. 2013. Definite Articles. In: Dryer; Matthew S. & Haspelmath; Martin (eds.) 2013. The World Atlas of Language Structures Online. Leipzig: Max Planck Institute for Evolutionary Anthropology. (Available online at https://wals.info/chapter/37),1,abk adi agb agm ala amh amp amq anu ara aro ata awt bab bag bak bam baq bbf bco bdu bfi bgr bik bir blz bmb bre brf brp bsq bul ccm cem cha cmy coo cop cor crn cso day dds deg dga dgb die dim dre dut egn eng epe ewo fre fri fua fut fye ga gae gel ger gmw gnn goe goo grk gua gul gwa hau haw htc hun hve iaa iri irr ita izi jmo jms juh kan kay kba kch kel ken ker kfe khm knr koa kos kre krk kse kut kwo laa lav lep lgu lkt llm lmg lmp lnd lon lot luo mab mad mae mal mao map mar may mbi mcd mea mis miy mka mof mon mou mpt mrg mrq msg mtb mtu mum mup mus mwb myi nbr nca ndy ney ngz nif nkn nti nyu obg oks ond ood pdp pip pir pms por qum ram rap ron rov run rwe sam san ser sir sis skk slb spa squ svs tar taw tbu tee tep tgk tgo tgr tid tim tin tke tla tng tnk tot tsi ttn tvl txj tzu uld ung url vai vie wch wel wlf wol wrw wsk yap zag zar zay zch zqc zqs,216,76475,0.0028244525
116A,Polar Questions,,116,Matthew S. Dryer. 2013. Polar Questions. In: Dryer; Matthew S. & Haspelmath; Martin (eds.) 2013. The World Atlas of Language Structures Online. Leipzig: Max Planck Institute for Evolutionary Anthropology. (Available online at https://wals.info/chapter/116),2,aar abk acu aga ana ang apw arc ass ath bao bco bej biu bla bln blt bmb bod brm brn brs bti bur can car cba chc chi chv coa cpy crp cub des deu die dim dni eip emb ene epe fas foe ful gae gah gal gar gdb gds gim gln gmz grw gyc hua hzb idu ijo ing irq ito jug kae kan kem khi kje kkp klw kmh kmk kmn kmr knm knn knr knw koe kok kol kor krc kro kwz kyk lad lez lho lis lot mab mar mdn men mgg mik mnc mne mni msc msg msl mts mtt nbd nga ngt nmb nnd noc nph nyk pae pau paw pdp pme prk pso ptt qaw qhu qui rem run ryu sal sia smn sna src sta stl sue syu tbx tel tml tmo tni ton tsf tsz tte tuc tun tuy uby una usr uzb wak wao wap wly wra wtm yal zag zqc,164,76475,0.0021444918
91A,Order of Degree Word and Adjective,,91,Matthew S. Dryer. 2013. Order of Degree Word and Adjective. In: Dryer; Matthew S. & Haspelmath; Martin (eds.) 2013. The World Atlas of Language Structures Online. Leipzig: Max Planck Institute for Evolutionary Anthropology. (Available online at https://wals.info/chapter/91),1,abi abk alb ao apt apw arg arj arm arw ava awa awp aym bab bgn bil bkr blt brm bsk bsq bto bug bul bur but bya cha chd che chv cle cln cmn cmy cnt coc coo cpl cup cyv dim drm dsh dul eng est eve fin fre gae ger gok gon grk grw guj gur guu gyc ham hay hin hlu hmi hop htc hum hun hve ice ika ind iqu ita ite jak jaq jiv jng jpn jva kbt ket kha khg kho kkp klm klr kmh kmk knd knm knn kor kos koy krd kty kuo kut kyn lat lez lim lis lit lkt lmn lun mab mak map mbi mco mdm mds mhi mis mkj mlk mmn mnc mnd mns moe mok mru msg msl msq nav nbd nbr new nez nhh nhm nht nor nsg nus nwd nyk oji ond ood orh osa otm pae pal pam pan pdp plk pol por prs psh psm ptt pul pum qhu qim raw rom rpa ruk rus scr sdw shk skk sna snh som spa spi srb srd swe tbo tce tee tel tep tgl tho tin tli tlp tls tml tni tno tod tpn tsi tur tvo tvt twe txj udm una urd usa usr uzb vaf wat wem wme xns yag yap yaq ytu yur zai zch zqc,227,76475,0.0029682904
143A,Order of Negative Morpheme and Verb,,143,Matthew S. Dryer. 2013. Order of Negative Morpheme and Verb. In: Dryer; Matthew S. & Haspelmath; Martin (eds.) 2013. The World Atlas of Language Structures Online. Leipzig: Max Planck Institute for Evolutionary Anthropology. (Available online at https://wals.info/chapter/143),3,agb akn amt arq ass awt bbl bej ber bgn bia biu bku bla blz brl bsh bur bya cam cba ccm cga chg chh chn cic cpl cyv cze dhi dhm drm dul eny err gjj gku gur gyc ham heh hnd hol hua hui hya ila kba kby kdw kew kga kgr kgy khd kik kil kin kmh kmi kmp knz krd lat lda ldo leb leg les let lgi lit llm lmp lot luc mag mcv mkd mke mmv mmw mua mug mwe nam nan nde new ngt nkn nko nmm nto nyh nym obg obo ocu ori ork pga pms png pre prs psh psw ptt pwn ras rem rgc rim rnd rny rru sak ser sgu she shm shn snt sod sor srb sul swa taj tal tbw tdr tet tgr thn tib tis tki tlp tna tob tod toz tts twn udi usr ven wme wtm xho yao ybi ygr yim yko ytu zap zaz,162,76475,0.0021183393
87A,Order of Adjective and Noun,,87,Matthew S. Dryer. 2013. Order of Adjective and Noun. In: Dryer; Matthew S. & Haspelmath; Martin (eds.) 2013. The World Atlas of Language Structures Online. Leipzig: Max Planck Institute for Evolutionary Anthropology. (Available online at https://wals.info/chapter/87),2,aab aar abk abn abo abu abv ace acg acl adg adi ady adz aeg agb agh agm agt ajg akh akn alb alk all aln aly ama amc ame aml amn amo amp amq amr ams amx ana anc ane ang anj ano anu any ao aoj api apl apt apu arg arj aro arq asm asy atm au awe awi awt awy ayi ayo ayw baa bab bae baf bag baj bam baq bar bas baw bbf bbl bch bdm bdu bdw bem ber bfg bfi bgm bid bik bin bir biu bkr bku ble bln blu blx blz bma bni bnk bnn bok bon bra bre brf bri brl brm brn brp brq bry bsh bsi bsq bsr bto bub bud buj bum bun bus buu bvi bwc cai cas cav cax cbo ccm cde cem cga chb chi chq chr chw cic cld cle cme cmr cnl cnm coc cop cor cpl crn cro crp cso cti ctl ctm ctw cui cup cya dag dan daw day ddj dds dga dgb dgo dha did dig dim din dio diy dji djn dma dms don doy dre dua duk dum dun dyi edo ega egn els emb eme emm eno epe erk err ese ewe ewo fas fij foe fon fre fua ful fur fut fye ga gaa gae gan gar gav gel ggu ghr gjj gku gla gln gmw gnd gnn goa goe goo grb grf grr grw gto gua gug guh gul guu guw gwa gyc hai hal ham har hat haw hdi heb heh hem hid hix hlp hma hmo hna hnd hoa hol hpd huc hup hwr hya iba idn ifm igb ige igs ik ika ila imo ina ind inn iqu iri irq irr irx isa ita jab jad jar jbt jel jin jlu jmo jms jng jrw juh juk jva kaa kae kam kar kau kba kbl kbo kbw kby kch kdz kel ker kfe kga kgr kgu kgy khd khm khs kie kik kin kir kis kje kkt kkv kll klq klv klw kma kmb kmi kmj kmn kmo kmp kmu kmw kmz knc kng knm kno knr knz koa kob koe kok kom kon kos kpe kpw kqq krb krd krh kri krk kro krr kse ksg ksn kta ktc kte ktl ktu kuo kuu kwa kwb kwm kwn kwy kwz kya kyk kyl kyn kyo kyz laa lab lad lag lal lan lao lar lav lbu lda ldo leb lel len lep les let lew lgi lgt lgu lic lin lis lkt llm lmb lmg lmh lml lmp lon lot lou luc lug lui luo luv luy maa mab mac mad mae mal man mao mar mas maw may mba mbe mbi mbl mbm mbo mbr mbt mby mda mde mdg mdl mdn mds mdw mea mee meh mek mey mga mgk mgo mgq mgu mhk mhl mie mii mij min mis miy miz mka mkd mke mkg mkj mku mkz mla mlg mlk mlm mlu mmb mmv mmw mna mng mnm mnv moa mof mok mon moo mor mot mou mpa mpo mpr mpt mpu mra mrg mrh mrl mro mrq mrr mrt mru msc msk msl msm msn mtb mts mtu mua mud mum mup mur mwe mwo mxa mxc mxe mxj mxo mxp mxy myi myn myr mzc nab naj nak nal nam nan nar nat nau nav nax nbd nbr ncm ndb nde ndi ndj ndo ndr ndt ndu neh ney ngd ngg ngj ngk ngl ngm ngn ngo ngt ngu ngz nhh nhm nht nia nif niu nkb nkk nkn nko nku nma nnc nnd nng nnk noc non noo nph nrg nse ntj nto nua nue nun nup nus nyh nyi nyk nym nze olo omh omi orh ori ork oro orw ory osa otr pae pai pam par pat pau per pga pia pir pit pkt plg plh plk pms png pnu pnx poh pok por ppi pre prh prs psw pul pum pun pur rag ral ram rao rap ras raw rga rgc rny rom rot rov rru rsu rum run rwa saa sah sak sam sap sdw sea seb sed sem sen ses sgb sgu she shi shl shm shn sht sia sil sim sio sis skk sko sku sla slb sle slp sme sml smn sng snm snn snt so sob som spa spi src srd sre srn sro sti sud sue sug sul sun sup swa syu tab taf tah taj tak tao tat tau taw tba tbl tbo tbt tbu tbw tdi tdr ten teo ter tes tgk tgn tgo tha thd thy tia tib tid tik tim tkl tlf tlp tma tmm tmn tmo tmr tna tnc tne tng tnk tnn tno tny ton toz tpr tps trb tri tsg tsk tsm ttd ttn tuk tum tun tvl uhi uld uli una ung ura urk url urn urt usa ute vaf vai ven vie vif vnm wag wah wal wap wat wbn wch wed wel wic wiy wlf wlo wma wmu wn wna wog woi wol wom wra wrd wrk wrl wrm wsk wth xam xas xbi xer xho xoo yag yal yam yao yap yay yel yi yid yiw yor yrm yuc yul zag zai zap zar zaz zul zun zya zzo,879,76475,0.011493952
124A,'Want' Complement Subjects,,124,Martin Haspelmath. 2013. 'Want' Complement Subjects. In: Dryer; Matthew S. & Haspelmath; Martin (eds.) 2013. The World Atlas of Language Structures Online. Leipzig: Max Planck Institute for Evolutionary Anthropology. (Available online at https://wals.info/chapter/124),4,aga ale ana apu ara awp chk eve gua hum jam jpn kay kma kob kwk kyk lad mac mak mcv mku mts nab ngl nmb nmi oji olu ood pno prh see shk sho tgn tob tps udh yaq yir ypk ytu zch,45,76475,0.0005884276
143E,Preverbal Negative Morphemes,,143,Matthew S. Dryer. 2013. Order of Negative Morpheme and Verb. In: Dryer; Matthew S. & Haspelmath; Martin (eds.) 2013. The World Atlas of Language Structures Online. Leipzig: Max Planck Institute for Evolutionary Anthropology. (Available online at https://wals.info/chapter/143),2,abk adz agb akn amh amr amt ana ao arq ass asu awt bbl bbu bej bel ber bgn bia biu bku bla blx blz bol brl brm bsh bur bya cam cba ccm cga chg chh chi chn cic cml cpl cyv cze deg dhi dhm dmi drm dul dun eko eme eny err fur gjj gku gur gyc ham heh hnd hol hua hui hya ila kba kbw kby kdw kew kga kgr kgy khd khg kik kil kin klg kll kma kmb kmh kmi kmp knz krd krw kry kwy kyz lad lat lbu lda ldo leb leg len lep les let lgi lim lit llm lmp lnd lng lot luc ma mag mar mbl mcv mdn mkd mke mkz mmv mmw mua mug mwe mxe nam nan ndb nde ndu new ngo ngt nkn nko nmm nph nse nto nwd nyh nym obg obo ocu orh ori ork pga pms png pre prs psh psw ptt pum pwn ras rem rgc rim rnd rny rru sak sar ser sgl sgu she shm shn skm snt sod sor srb sub sul swa swt taj tal tar tbl tbw tdr tet tgl tgr thn tib tig tis tki tlp tna tob tod toz tte tts twn uby udi usr ute ven vnm way wme wrn wtm xho yao ybi ygr yim yko yqy ytu zap zaz zul,230,76475,0.0030075188
64A,Nominal and Verbal Conjunction,,64,Martin Haspelmath. 2013. Nominal and Verbal Conjunction. In: Dryer; Matthew S. & Haspelmath; Martin (eds.) 2013. The World Atlas of Language Structures Online. Leipzig: Max Planck Institute for Evolutionary Anthropology. (Available online at https://wals.info/chapter/64),1,abk abu ace aco aeg alk aml ara baw bbw bkr boz brh bsq bum bur cah cha chc chk cic coa coo drg dug eng err eve fin fre gap gar geo ger gnb gol grg grk grw gua guj haw heb hin hmo hun hzb ind irq ita itz jab kam kas kat ker ket kgu kho khs kku kmh kol kpw krw kuk kuo kut kwa lak lat lav laz lez lgu lkt mai mam map may mbo mcv mdr mhi moh mos mun mus mxc mym nab nav ndb ndj nel nep ngl nht nia nif niu nmb nmi nua obo oji ood otm pal pit pop prh prs psm pul pur qim rot rus san sir siu ski skp sno spa squ sud sue sun tab taf tag tgn tha tho tid tik tin tis tlo tps ttn tuk tur txj tzu udh udm uli usa vaf vie wal war yaq ywl ywr zaq zch,161,76475,0.002105263
33A,Coding of Nominal Plurality,,33,Matthew S. Dryer. 2013. Coding of Nominal Plurality. In: Dryer; Matthew S. & Haspelmath; Martin (eds.) 2013. The World Atlas of Language Structures Online. Leipzig: Max Planck Institute for Evolutionary Anthropology. (Available online at https://wals.info/chapter/33),8,agm ajg ala amq anu bag bak bao bbf bgo bik bka bnb bry bsq bus cav cyv daw dds dim dun eme epe ewe gar goo hat hna hpd jel juh kaa kar ken kgy khd khr kis knm koa koe kpo ksa kse let lgu mak mam maw mby mcc mdg mek mgg mkj mnz mok mrg msn new ngt nph nup nwd pum ram sar sem sng svs tab ter tgl tim tsf wrw ygr yul zar,81,76475,0.0010591696
89A,Order of Numeral and Noun,,89,Matthew S. Dryer. 2013. Order of Numeral and Noun. In: Dryer; Matthew S. & Haspelmath; Martin (eds.) 2013. The World Atlas of Language Structures Online. Leipzig: Max Planck Institute for Evolutionary Anthropology. (Available online at https://wals.info/chapter/89),2,aab aar aba abo abu abv acl acn adg adi adz agb agh agm agt ajg akh akn alk all aln aly ama amb ame aml amo amp amq amt amx anc ane ang anj ano anu any ao aoj apt apw asm atk au awe awi awt awy baa bab bag bai bak bam bar bas baw bbl bbu bdu bem ber bfi bgm bgr bid bik bin bir bka bku ble blt blx blz bmb bni bnn boa bod bok bra bri brl brm brn brp bry bud bum bus buu bvi cai cas cct cem chg chi chs chw cic cmr cro cti ctm dag dan day dds deg dga dgb dgo dha did die dig dim din dio diy dlm dma dms doy duk dul dum dun dyi edo efi ega egn eip eka emb emm epe erk err ewe ewo fas fon for fua fur fye gah gal gap gar gbb gbs giz gln gmw goe grb grj grw gud gul gur guu gwa gwo gyc hai ham han hat hau hdi heh hem hma hna hnd hol huc hya iau idn idu ifm igb ige ik imo ina inn irq irr irx isa iwm jab jad jel jms jng juh juk kac kae kar kau kbw kch kel ken ker kew kfe kga kgr kgy khd khm kie kim kin kir kis kje kkv klq kmb kmi kmj kmn kmo kmp kmr kmu kmz knc kni knk knm knr knz koa kob koe kok kon kos kpe kpw kqq kro krr kse ksg ksn kta ktc kte kti kuu kwb kwn kwt kyk kyl kyo lab lad lag lah lai lal lan lao lar lav lbu lda ldo leb lel len lep les let lew lgi lgt lis lkt llm lmg lmh lml lmu lnd lon lot lug luo luv ma maa mab mad mae maj mal man mao mar mas maw may mba mbe mbl mbm mbr mbt mby mda mde mdg mdl mdn mdo mdw mea mee mei mey mga mgi mgo mgq mgu mhl mij miy miz mka mkd mkg mkl mku mlg mlk mlu mmi mmv mmw mni mnm mnv mnz mof mok mom mon moo mor mot mou mpo mpt mpu mrg mrh mri mrl mro mrr mru msc msg msk msl msm mtb mts mua mud mum mup mur mwe mwo mxe myg myn nab nal nam nan nax nbd nbr ncm nde ndi ndj ndo ndt ndu new ney ngb ngg ngk ngm ngn ngo ngt ngu ngz nis nkn nko nku nma nnk non noo nph nrg ntj nto nua nue nup nus nyh nyk nym nza nze obo olo omh omi ora orh ori oro orw otr owi paa pai par pat pau paw per pia pis pit pkt plh pms pnx pod poh pok pre prh prk psw pum pun rag ral ram raw rgc rny ron rot rum rwa sah sak san sdw seb sem ser sgb sgu she shl shn sht sio skk sko sku sla slb sle slp smn sng snt so sob spi sro sud sue sul sup swa tab tam tao tau taw tba tbl tbt tbu tbw tdi tdr ten ter tes tet tgl tgn tgo tha thd thk thy tib tid tik tis tkl tlf tlo tmm tmn tmo tna tne tng tnn tou toz tpr trb trr ttd tte ttn tuk tum tvt uld una ung ura urt usa vai ven vif vnm wag wah wal wap wma wmu wna woi wra wsk wwa xam xas xbi xho yal yar yel ygr yi yid yiw ylm yor yqy yuc yul zag zan zar,608,76475,0.007950311
90B,Prenominal relative clauses,,90,Matthew S. Dryer. 2013. Order of Relative Clause and Noun. In: Dryer; Matthew S. & Haspelmath; Martin (eds.) 2013. The World Atlas of Language Structures Online. Leipzig: Max Planck Institute for Evolutionary Anthropology. (Available online at https://wals.info/chapter/90),1,abk acn ain akh ala amb amh ami apt asm ath awa awt bai bel blt bod brl brm bsk bsq bur chc che chh chn chs chv cml cnt cpn cpy dgr dhi dhm dig dms drg eip eve evn gal gam gar gur gyc hak han hay hhu ho hpd hua hum hzb ijo ing jng jpn kab kem kgy kha khd khg kho khw kkp kku kmh kmk kol kor koy krc kty kuv kwo kwt lah lez lim lis lmn mei mgg mhi mnd mne mns mru msg mun mym new ngt niv nma nmm noc nph nwd prk pum qaf qhu qim raw rum sar sid skk sng svs tam tel tgl tgr thu tib tkm tli tml tmo tsf ttu tuc tur tvo uby una urn uyg uzb yal yar ygr yko ykt zay,141,76475,0.0018437398
90A,Order of Relative Clause and Noun,,90,Matthew S. Dryer. 2013. Order of Relative Clause and Noun. In: Dryer; Matthew S. & Haspelmath; Martin (eds.) 2013. The World Atlas of Language Structures Online. Leipzig: Max Planck Institute for Evolutionary Anthropology. (Available online at https://wals.info/chapter/90),2,abk acn ain akh ala amb amh ami apt asm ath awa awt bai bel blt bod brl brm bsk bsq bur chc che chh chn chs chv cml cnt cpn cpy dgr dhi dhm dig dms drg eip eve evn gal gam gar gur gyc hak han hay hhu ho hpd hua hum hzb ijo ing jng jpn kab kem kgy kha khd khg kho khw kkp kku kmh kmk kol kor koy krc kty kuv kwo kwt lah lez lim lis lmn mei mgg mhi mnd mne mns mru msg mun mym new ngt niv nma nmm noc nph nwd prk pum qaf qhu qim raw rum sar sid skk sng svs tam tel tgl tgr thu tib tkm tli tml tmo tsf ttu tuc tur tvo uby una urn uyg uzb yal yar ygr yko ykt zay,141,76475,0.0018437398
115A,Negative Indefinite Pronouns and Predicate Negation,,115,Martin Haspelmath. 2013. Negative Indefinite Pronouns and Predicate Negation. In: Dryer; Matthew S. & Haspelmath; Martin (eds.) 2013. The World Atlas of Language Structures Online. Leipzig: Max Planck Institute for Evolutionary Anthropology. (Available online at https://wals.info/chapter/115),1,abk abu ace ady aeg ain ana ano ass awp bab bae bag baw bbw biu bkr bma boz brh brm bsq bud bul chk chn cnl cnt coo cop ctl dgr dji epe eve fin fon goo grg grk grw gua guj hai hau heb hin hmo hun hzb ind iri jam jel jpn kan kas kaz ker ket kfe khm khs kio kkp kku klv kma kmh kmu knd knr koa kob kod kor kse kty kug kzy lak lat lav lel lez lil lin lit lkt mac mad mao map may mbi mby mdg mgu mhi miy mle mme mnd moe mos mto mun mym nai nav ndj nep ngi niu niv nti nua nwd oji ood orh pae pai pms pno pol pop prs qhu qim raw ret rom rus scr shk skp sla sno som squ sup swa tag tam tha tid tja tml tms tpn trb tru ttn tur tuv udh udm urk vie wch wlf yko ykt ytu zaq zaz zul zun,170,76475,0.0022229487
