parameter_id,parameter_name,parameter_description,chapter_id,chapter_citation,value,same_value_language_ids,value_language_count,language_count_total,count_ratio
48A,Person Marking on Adpositions,,48,Dik Bakker. 2013. Person Marking on Adpositions. In: Dryer; Matthew S. & Haspelmath; Martin (eds.) 2013. The World Atlas of Language Structures Online. Leipzig: Max Planck Institute for Evolutionary Anthropology. (Available online at https://wals.info/chapter/48),2,abi abu ace aco adz ala alb ame amu ana ani arm asm ata atk awp baa bab bam bar baw bej bkr bln brh bri brm brn bro brs bsq bya cah cap cav cax chk chr ckl cmn cmx cpn cri cub dag dga dgr dio diz don doy dre dum dut eka eng epe fre fua geo ger gmw god goo grb grk gud hai hat hin hmo hua hzb igb ika imo ind ing irq ita jpn juh kas kch ker kew kha khm kho khs kis kjo klk kmu knd knm knr kob kom kon kor kpm krk kro kse kuk kyl lad lah lak lat lel lep lez lim luv mao map mau mcr mde mei mis miz mku mlm mna mnd moa mrd msn mum mun nad nak nan nas nbr ndo ndy nup nyu orh oss otm pai pal par pau pit pol prh psj pso pur qaw qim rap rem rus sah sam san sem shk slp sml snm snt spa srm sue sun sup swa syu tab tha tid tin tiw tla tms tna tol ton tot trb tru tsi tso tuk tun tur una vie wao wap wbn wma wra xok yaq yko yor yur zan zul,209,76475,0.0027329193
113A,Symmetric and Asymmetric Standard Negation,,113,Matti Miestamo. 2013. Symmetric and Asymmetric Standard Negation. In: Dryer; Matthew S. & Haspelmath; Martin (eds.) 2013. The World Atlas of Language Structures Online. Leipzig: Max Planck Institute for Evolutionary Anthropology. (Available online at https://wals.info/chapter/113),1,adk aeg ain alb apu bir bkr brs bur cba cha ckl cle cnl cnm coo cre crt cyv dag dre dum fre fur geo ger gku gnn goo grk grr hai hmo hui hun ice ind ing ita jeb juh ket kew kfe khm klm klv kmu kob kon kun kut kwz lan lkt mal map mar mas may mku mne mns mos mrl mrt mss mun mxc nca ndy nez ngi nht nti ono pau pba prh prs psj pur qaw rus san sap shk siu sla spa tab tag tau tha tol ton tpa tuk tuy ukr una urk vie was wrd wrm yag yaq yid yrr yuc ywl zaz,114,76475,0.0014906832
56A,Conjunctions and Universal Quantifiers,,56,David Gil. 2013. Conjunctions and Universal Quantifiers. In: Dryer; Matthew S. & Haspelmath; Martin (eds.) 2013. The World Atlas of Language Structures Online. Leipzig: Max Planck Institute for Evolutionary Anthropology. (Available online at https://wals.info/chapter/56),1,amr arm bae brh bsq epe fre gaa geo hai hix hzb ika jam kch kho kut lan lat mao mar mau may nbd ndy nht pba pnr qim sml tiw tps trb tuk tur vaf war was yim,40,76475,0.00052304677
114A,Subtypes of Asymmetric Standard Negation,,114,Matti Miestamo. 2013. Subtypes of Asymmetric Standard Negation. In: Dryer; Matthew S. & Haspelmath; Martin (eds.) 2013. The World Atlas of Language Structures Online. Leipzig: Max Planck Institute for Evolutionary Anthropology. (Available online at https://wals.info/chapter/114),7,adk aeg ain alb apu bir bkr brs bur cba cha ckl cle cnl cnm coo cre crt cyv dag dre dum fre fur geo ger gku gnn goo grk grr hai hmo hui hun ice ind ing ita jeb juh ket kew kfe khm klm klv kmu kob kon kun kut kwz lan lkt mal map mar mas may mku mne mns mos mrl mrt mss mun mxc nca ndy nez ngi nht nti ono pau pba prh prs psj pur qaw rus san sap shk siu sla spa tab tag tau tha tol ton tpa tuk tuy ukr una urk vie was wrd wrm yag yaq yid yrr yuc ywl zaz,114,76475,0.0014906832
100A,Alignment of Verbal Person Marking,,100,Anna Siewierska. 2013. Alignment of Verbal Person Marking. In: Dryer; Matthew S. & Haspelmath; Martin (eds.) 2013. The World Atlas of Language Structures Online. Leipzig: Max Planck Institute for Evolutionary Anthropology. (Available online at https://wals.info/chapter/100),1,abn abu adz ana awt bab bam bar bnj bri brm bro chr dga don dre epe gar god grb gud guu hai hau hmo hmr igb imo ing jpn juh kay kch kha khm klk kmu kor kro kse kuk kyl lad lah lep lez mal mao mcr mde mei mle mlm mnd mrt mum nbr ndy niv nup pai pso qaw rap sam san shk snm srm sun sup tag tha uhi vie wap wik xok yaq yes yid yor zun,84,76475,0.0010983981
107A,Passive Constructions,,107,Anna Siewierska. 2013. Passive Constructions. In: Dryer; Matthew S. & Haspelmath; Martin (eds.) 2013. The World Atlas of Language Structures Online. Leipzig: Max Planck Institute for Evolutionary Anthropology. (Available online at https://wals.info/chapter/107),2,abi abk abn abu ace acm aco adz ala ame ane anj arp asm ata atk au awp awt baa bab bag bam baw bkr bnj brh bri brm brn bro brs bya cah can cap cav cax cba cbo chk chr ckl cnl cpn cre dag dga dni dum eka epe err ewe gar gmw god goo gua gud guu hai ham hat hua hzb igb ika imo ing iqu jaq juh ker kew kfe kgu khm khs kio kjo kkv klv kmu kob kom kpm kwz kyl lad lah lak lan lav lel lez lkt luv mak mau may mby mcr mde mei mis miz mku mlk mlm mna mne moa moh mrd msn mum mup mxc myi nak nan nas ndy ngi ngk ngl niv nti nug nup nyu ond orh otm pai pec pit pms prh pso pur qaw ram rap rem ret sah sal sam san sel sem shk slp snt srm sue sup syu tag tap tau taw tgk tid tir tiw tja tla tli tmr tms tol ton tot trb tri tru tsi tso tun uhi uma una ung ura urk usa wam wao was wbn wch wic wma wrd wrk wsk yag yap yel yes yid yim yko yor ypk yuc zqc,211,76475,0.0027590715
104A,Order of Person Markers on the Verb,,104,Anna Siewierska. 2013. Order of Person Markers on the Verb. In: Dryer; Matthew S. & Haspelmath; Martin (eds.) 2013. The World Atlas of Language Structures Online. Leipzig: Max Planck Institute for Evolutionary Anthropology. (Available online at https://wals.info/chapter/104),1,abn abu adz ana ani anj arm ata awp awt bab bam bar bkr bnj brh bri brm brn bro brs bya cap cav cha chr cle cnl cop cpn cri cub dga dgr diz don dre dum dut eng epe eve fin fre fur gar ger god grb gud guu hai hat hau heb hin hmo hmr hmu hzb igb ijo imo ind ing iqu iri irq ita jpn juh kay kch ker kew kgu kha khm kho khs kio kis klk kmu kna knd kob kor kro kse kuk kyl lad lah lak lat lep lez mal mao may mcr mde mei mis mle mlm mnd mne mrt mum mup mxc nad nai nak nbd nbr ndy niv noo ntu nup nuu orh pai pau plk pny pol pso qaw ram rap rem rus sam san sel sem shk sml snm so srm sue sun sup syu tab tag tgk tha tid tin tir tla tmr tms trb tri tru tso tur udh uhi urk vie wao wap wbn wel wik win wma wra wsk xok yap yaq yaw yes yid yko yor zun,187,76475,0.0024452435
143E,Preverbal Negative Morphemes,,143,Matthew S. Dryer. 2013. Order of Negative Morpheme and Verb. In: Dryer; Matthew S. & Haspelmath; Martin (eds.) 2013. The World Atlas of Language Structures Online. Leipzig: Max Planck Institute for Evolutionary Anthropology. (Available online at https://wals.info/chapter/143),4,aab aar aba abv acu adi agm aja alk aln aly amc amp amq anc ane ang ani anu apl apt ara arc asm ath ava awe aze azi bag bak bas baw ben bgr big bik bio bir bka ble bln boa boj brh brn brr brs bsk bti bud bum bus but bzi can car cas cay cbo cct cde chp chs chv chw cln cmr cnl cnm coa cpn cqt crp cti ctm cub dds des deu dgo die dig dim dio dms dni duk dum efi ega egn emb epe ese fua ful ga gah gal gar gbs gim giz gla gln gmz god goe gon grw gul gwo har hat hdi hid hix hma hmi hna hpd hum hzb iau idu ige igs ijo ika ing irq irr irx isa iwm jab jar jeb jiv jmo jms jpn juk kaa kab kac kar kas kau kay kbo kel kem ken ker kha khl kho kie kim kkp kkv kmn kmo kmr kmz knd kng knm knr knw koa kob kok kol koy kpw krc krh kri krn krr kta kti kun kus kuv kwz kxo kyl kyp kyr laa lab lag lai lav lec lel lew lez lgt lin lkt lmg lmh lmn lon lug mab mac mad map mas may mba mbm mbr mby mda mdg mdo mdw mea mee meh mei mek mgu mhi mhl mig mii mik mis miz mkh mki mlg mlu mmb mnc mne mor mot mou mpt mpu mrg mrs msc msg msl msm mtb mts mui myg mym mzc nas nbd nbm ndt nep ngl ngm ngn ngz nis niv nku nma nmb nnk noc noo nrg nsn ntj nua nup nza nze olo omh ong osa oya pae pat paw pec pia pit pme pod pog prh prk psj ptw qaw rao ret rit ron rsu rum sah san sba sdw sel sem sgb shb shh shi shk sht shy sia sin sio skk sla sme smn snm sro sug syu tab tan tao tba tbu tel tir tiv tlo tma tml tne ton tpr tpt trb tru tsf tsz tuc tul tun tur tuv tuy udm uld urk urn uyg uzb wai wao wap was wau wbn wec wly wma wna wom wra wrm xav yam yar ykt ypk yrm yrr yul zag zan zay,390,76475,0.005099706
143G,Minor morphological means of signaling negation,,143,Matthew S. Dryer. 2013. Order of Negative Morpheme and Verb. In: Dryer; Matthew S. & Haspelmath; Martin (eds.) 2013. The World Atlas of Language Structures Online. Leipzig: Max Planck Institute for Evolutionary Anthropology. (Available online at https://wals.info/chapter/143),4,aab aar aba abi abk abn abu abv ace acg acl acm aco acu adg adi adz aeg agb agc agd agh agm ain aja ajg akh akn ala alb alk all aln als alw aly amb amc ame amh aml amn amo amp amq amr ams amt amx ana anc ane ang ani anj ann anu any ao aoj apl apt apu apw ara arc arg arj arm aro arp arq arw asm ass asu asy ata ath au ava awa awe awp awt aym aze azi baa bab bac bae baf bag bai baj bak bam bao baq bar bas baw bbf bbl bbu bbw bch bco bdm bej bel ben ber bfg bgn bgo bgr bho bia bid big bii bik bil bio bir biu bka bkr bku bla bln blr blt blx blz bmb bmz bni bnn bnu boa bob bod boi boj bok bol bra bre brf brh bri brl brm brn brp brr brs bsh bsk bsq bti btk bto bua bud bug bul bum bun bur bus but buw buy bvi bwc bya bzi cah cai cak cam can car cas cax cay cba cbo ccm cct cde cea cem cga cha chb chc chd che chg chh chi chj chk chn chp chq chr chs chv chw chx cic ckl cle cln cmh cml cmn cmr cmy cnl cnm cnt coa coc coo cop cos cpl cpn cpy cqt cre crn crp crt cso cti ctl ctm cub cui cup cya cyv cze dag dan dds des deu dga dgb dgo dgr dha dhi dhm dhw did die dig dim din dio diy dja dji djm djn djp dma dmi dmk dms dni dom dre drm dsh dua duk dul dum dun dut dyi ebi efi ega eip eka eko emb eme ene eng eno eny epe erk err ese est eud eve evn ewe fij fin fon fre fua ful fur fut fye ga gaa gae gah gal gap gar gav gbb gbs gds gel geo ger ggu ghr gim gir giz gjj gku gla gln gmw gmz gnb goa god goe gok gon goo grb grf grj grk grr grs grw gua gud gug guh guj gul gur guu gwa gwo gyc hai hak hal ham han har hat hau haw hay hdi heb heh hei hid hil hin hix hlp hlu hma hmi hmo hna hnd hoa hol hop hpd htc hua huc hui hum hun hup hve hya hzb iaa iau iba ice idn ido idu ifm ifu ige ign igs ijo ik ika ila imo ina ind ing inn iqu iri irq irr irx isa ita ite iwm izi jab jak jaq jar jeb jiv jlu jmo jms jng joh jpn juh juk kaa kab kac kad kae kan kar kas kau kay kba kbl kbo kbw kby kch kdw kdz kel kem ken ker ket kew kfe kga kgr kgy kha khd khg khl khm khn kho khr khs kie kik kil kim kin kio kir kiw kkp kkt kkv kla klg kll klm kls klv klw kma kmb kmh kmi kmj kmk kmn kmo kmp kmr kms kmu kmw kmz knb knc knd kng kni knk knm knn knr knw knz koa kob koe koi kok kol kom kon kop kor kos koy kpw krb krc krd kre krh kri krj krk krn kro krr krw kry ksa kse ksg ksn kta ktc kti ktl kty kum kun kuo kus kut kuv kwa kwb kwn kwo kws kwt kwy kwz kxo kya kyl kyp kyq kyr kyz kzy laa lab lac lad lag lah lai lal lan lao lar lat lav lbu lda ldo ldu leb lec leg lel len lep les let lew lez lgi lgt lgu lho lic lim lin lis lit lkt llm lmg lmh lmn lmp lmu lnd lng lon lot lou luc lug lui luo luv ma maa mab mac mad mae mag mai maj mak mal mam man mao map mar mas mau maw may mba mbe mbi mbl mbm mbr mbt mby mcd mch mco mcv mda mde mdg mdl mdm mdn mdo mdw mea mee meh mei mek men mer mga mgg mgi mgk mgu mhi mhl mhu mie mig mii mik min mir mis miy miz mka mkd mke mkg mkh mki mkj mkl mku mkz mlg mlk mlu mmb mme mmn mmv mmw mna mnc mnd mne mni mnm mno mns mnt mny moe mog moh mok mom mon moo mor mos mot mou mov mpa mpo mpt mpu mra mrd mrg mrh mri mrl mro mrq mrr mrs mrt mru mrw msc msg msk msl msm msn msq mss mtb mts mtu mua mug mui mum mun mup mur mus mut mwb mwe mwo mxc mxe mxj mxo mxp mxx myg myi mym mzc nab nad nag nah naj nak nal nam nan nar nas nav nax nbd nbm nbr nca ncm ndb nde ndj ndo ndr ndt ndu ndy neh nep nev new nez nga ngd ngi ngj ngk ngl ngm ngn ngo ngt ngu ngw ngz nha nhh nhm nht nia nif nis niu niv nke nkk nkn nko nku nma nmb nmm nne nnk noc non noo nor nph nrg nse nsg nsn nti ntj nto ntu nua nue nug nun nup nyh nyi nyk nym nyn nyr nyu nza nze obg obo ocu oir oji oks olo omh omi ond one ong ono ood ori ork oro orw osa oss otm otr oya paa pae pai pal pan par pat pau paw pba pec per pga pia pip pis pit pkn pkt plg plh pme pms png pnn pno pnu pod pog poh pol por ppi pra pre prh prk prs psh psj psm pso psw ptt ptw pul pum pun pur pwn qaw qhu qia qim qui qum rag ram rao rap ras raw rem res ret rgc rik rim rit rnd rny rom ron rot rov rpa rru rsu ruk rum run rus rwa rwe sah sak sal sam san sap sar sba scr sdw sed see sel sem ser ses sgb sgl sgu shb she shh shi shk shl shm shn shp sht shu shy sia sid sil sin sio sir sis siu skk skm skw sla slb slo sme sml smn sna sng snm snn sno snt so sob sod som son sor spa squ srb src srd sre sro ssa sta sti stl stn sub sud sue sug sul sun sup svs swa swe swt syu tab tac taf tag tah taj tak tal tam tan tao tar tas tau taw tba tbo tbt tbu tbw tbx tce tdr tee tel ten teo tep ter tes tet tgh tgk tgl tgo tgr tha thn tho thu thy tib tid tig tim tin tir tis tiv tiw tja tke tki tkl tla tli tlo tlp tma tml tmm tmn tmo tmr tna tnc tne tng tnn tno tny tob tod tol ton tou toz tpa tpn tpr tpt trb tri trm trr tru tsf tsg tsh tsi tsn tsz tte ttn tts ttu tuc tuk tul tun tur tus tuv tuy tvl twe twn tye tzo tzu uby udh udi udm ukr uld uli una ung urd urk url urn urt uru usa usr ute uyg uzb vai ven vie vnm wag wah wai wak wal wam wao wap war was wat wau way wbn wch wec wed wel wem wic wik win wiy wlf wlm wlw wly wma wme wmu wna woi wol wom wor wra wrb wrd wrg wrk wrl wrm wrn wsk wtm wya xam xar xav xbi xho xns yag yam yao yap yaq yar ybi yei ygr yi yid yim yin yiw yko ykt ylm yng yok yor ypk yqy yrm yrr ytu yuc yuk yul yur yuw ywl ywr zag zai zan zap zar zay zaz zch zpr zqc zqo zqs zul zun zzo,1315,76475,0.017195161
143A,Order of Negative Morpheme and Verb,,143,Matthew S. Dryer. 2013. Order of Negative Morpheme and Verb. In: Dryer; Matthew S. & Haspelmath; Martin (eds.) 2013. The World Atlas of Language Structures Online. Leipzig: Max Planck Institute for Evolutionary Anthropology. (Available online at https://wals.info/chapter/143),2,aab aba abv agm aja alk aln amq anc ane ani anu ara asm ava bag bak bas baw ben bgr big bik bir bka bud bum bus bzi chp chs chw cmr cnl cti dgo die dni duk dum ega ese gbs giz gla gmz goe gul gwo hat hma hna iau ige igs irr isa iwm jab jar jmo juk kaa kar kau kel ken ker kho kie kim kkv kmz kng kpw krn krr kti kxo kyl kyp laa lab lag lai lel lgt lin lkt lmh lmn lon lug mac mad mas may mba mbm mbr mby mda mdg mdo mdw mea meh mek mgu mhi mig miz mlu mmb mor mou mpu mrg msm mtb myg nbm ngm ngz nma nnk nrg nua nup nza nze olo ong osa pat pod pog qaw ron rsu sah san sel sgb shb shi sht shy sio skk sla sme snm sro tab tiv tpr trb tru tsz udm uld urk wec wma wna wom wrm xav yul,171,76475,0.002236025
31A,Sex-based and Non-sex-based Gender Systems,,31,Greville G. Corbett. 2013. Sex-based and Non-sex-based Gender Systems. In: Dryer; Matthew S. & Haspelmath; Martin (eds.) 2013. The World Atlas of Language Structures Online. Leipzig: Max Planck Institute for Evolutionary Anthropology. (Available online at https://wals.info/chapter/31),1,abn aco ain ale ame arm asm awp bag baw bkr brh brm bsq cah car ccp cha chi chk chv cmn cnl cnt coo cyv dag djr dni don epe err eve ewe fij fin geo goo grw gua guu hai hat haw hay hmo hun iaa igb ika imo ind ite jaq kam kay kew kgz kha khk khl khm klv knr koa kob krk kse kut lad lah lan lep lez mak mal mao map mar mei mnd mns mny mok mrl mrt mss nbd ndy nez ngi nht niv ntu ork otm pai pal pil pip pit pmc prs qim ram rap san shk sml smt snt srn sue tab tha tho tib tol tot tsh tsi tuk tur tvl uhi una urk usa uzb vie wat wic wra yaq yel yid yko ykt ylb yor ypk yur zqc zun,145,76475,0.0018960445
30A,Number of Genders,,30,Greville G. Corbett. 2013. Number of Genders. In: Dryer; Matthew S. & Haspelmath; Martin (eds.) 2013. The World Atlas of Language Structures Online. Leipzig: Max Planck Institute for Evolutionary Anthropology. (Available online at https://wals.info/chapter/30),1,abn aco ain ale ame arm asm awp bag baw bkr brh brm bsq cah car ccp cha chi chk chv cmn cnl cnt coo cyv dag djr dni don epe err eve ewe fij fin geo goo grw gua guu hai hat haw hay hmo hun iaa igb ika imo ind ite jaq kam kay kew kgz kha khk khl khm klv knr koa kob krk kse kut lad lah lan lep lez mak mal mao map mar mei mnd mns mny mok mrl mrt mss nbd ndy nez ngi nht niv ntu ork otm pai pal pil pip pit pmc prs qim ram rap san shk sml smt snt srn sue tab tha tho tib tol tot tsh tsi tuk tur tvl uhi una urk usa uzb vie wat wic wra yaq yel yid yko ykt ylb yor ypk yur zqc zun,145,76475,0.0018960445
32A,Systems of Gender Assignment,,32,Greville G. Corbett. 2013. Systems of Gender Assignment. In: Dryer; Matthew S. & Haspelmath; Martin (eds.) 2013. The World Atlas of Language Structures Online. Leipzig: Max Planck Institute for Evolutionary Anthropology. (Available online at https://wals.info/chapter/32),1,abn aco ain ale ame arm asm awp bag baw bkr brh brm bsq cah car ccp cha chi chk chv cmn cnl cnt coo cyv dag djr dni don epe err eve ewe fij fin geo goo grw gua guu hai hat haw hay hmo hun iaa igb ika imo ind ite jaq kam kay kew kgz kha khk khl khm klv knr koa kob krk kse kut lad lah lan lep lez mak mal mao map mar mei mnd mns mny mok mrl mrt mss nbd ndy nez ngi nht niv ntu ork otm pai pal pil pip pit pmc prs qim ram rap san shk sml smt snt srn sue tab tha tho tib tol tot tsh tsi tuk tur tvl uhi una urk usa uzb vie wat wic wra yaq yel yid yko ykt ylb yor ypk yur zqc zun,145,76475,0.0018960445
111A,Nonperiphrastic Causative Constructions,,111,Jae Jung Song. 2013. Nonperiphrastic Causative Constructions. In: Dryer; Matthew S. & Haspelmath; Martin (eds.) 2013. The World Atlas of Language Structures Online. Leipzig: Max Planck Institute for Evolutionary Anthropology. (Available online at https://wals.info/chapter/111),2,abi abk ace aeg ain aji aly ame amh ana apu arm aro asm atc awn awp aym bab baj bal bam bej bkr bla bma brh brr brs bsq bur but cah car cax cct ceb cha chk chv cld cle cmn coa coo cor cre cui dgr die dio diy doy dre eng epe eve fij fin fut gar geo ger grb grw gua guj guu hai hau haw heb hin hix hmi hun hzb iaa igb ika ila ind ing irq jak jaq jpn kam kas kay kdz kem ket kew kfe kgu kha khm khs kin kio kis kls kmk knd knm knr kol kon kor kos krb krk krn kut kwa lad lan lat lav lep let lez lim lmp luv maa mab mac mak mal mao map mau mei men mhi mna mnm mns mny mrl mrt mss mwb mxc mym nbd nca ndo neh nez ngi ngl nht niu niv nko nti ntu nug nym oji ond orh orw pai pal pan pau pip pkn pny ppi prh prs psh psm pso pul pwn qim rap ret rot ruk rus sam sel shn shp shu sla sml snh snm son sor squ srn sun sup swa swt tab tag tah tas tel tim tiw tli tml tmr tna tng tno ton tsi tsw tuk tur tus tvl tzo uhi uli una urk usa ute uzb wam wat wch wic wma wol wra wrl yag yap yaq yel yid yko ykt ynk ypk yus yuw zul zun,254,76475,0.0033213468
102A,Verbal Person Marking,,102,Anna Siewierska. 2013. Verbal Person Marking. In: Dryer; Matthew S. & Haspelmath; Martin (eds.) 2013. The World Atlas of Language Structures Online. Leipzig: Max Planck Institute for Evolutionary Anthropology. (Available online at https://wals.info/chapter/102),1,abn abu adz ana awt bab bam bar bnj bri brm bro chr dga dre epe gar god grb gud guu hai hau hmo hmr igb imo ing jpn juh kay kch kha khm klk kmu kor kro kse kuk kyl lad lah lep lez mal mao mcr mde mei mlm mnd mrt mum nbr ndy niv nup pai pso qaw rap sam san shk snm srm sun sup tag tha uhi vie wap wik xok yaq yes yid yor zun,82,76475,0.0010722459
103A,Third Person Zero of Verbal Person Marking,,103,Anna Siewierska. 2013. Third Person Zero of Verbal Person Marking. In: Dryer; Matthew S. & Haspelmath; Martin (eds.) 2013. The World Atlas of Language Structures Online. Leipzig: Max Planck Institute for Evolutionary Anthropology. (Available online at https://wals.info/chapter/103),1,abn abu adz ana ani awt bab bam bar bnj bri brm bro chr dga don dre epe gar god grb gud guu hai hau hmo hmr hzb igb ijo imo ing jpn juh kay kch ker kha khm kho kis klk kmu kor kro kse kuk kyl lad lah lep lez mal mao mcr mde mei mle mlm mnd mrt mum mup nbr ndy niv noo nup pai pny pso qaw rap sam san sel sem shk snm srm sun sup tag tgk tha uhi vie wap wik wra yaq yes yid yor zun,96,76475,0.0012553122
71A,The Prohibitive,,71,Johan van der Auwera; Ludo Lejeune (Valentin Goussev). 2013. The Prohibitive. In: Dryer; Matthew S. & Haspelmath; Martin (eds.) 2013. The World Atlas of Language Structures Online. Leipzig: Max Planck Institute for Evolutionary Anthropology. (Available online at https://wals.info/chapter/71),2,ace aco aga agu ain alb anu ao arg ark arm arp ava aym bae baf baj baw bej bkr brm ceb cha chc chr chv cnt cre crg csh egn emb emc epe ewe fij fin fua fue fur gim gll gmz goj gum haw hay hin hmi hmo hun ijo ika ind ing iqu iri irq jar jpn juh kam kas kdw kei ket kha khk khm kho klv kmk kmu knm kok kon kor krb krn kty kuv kwr kyl lad lak lim lon lot mac mam may mbb mbo mby mde mdg mdk mdn mik mku mna mnd mns moe mok mrd msl mul mxc mxy myi mym nad nbd nbm nca nel nko nma nnn ntn nub nug nun nya oix ond orh otm pan pau pba pip plh pno prk pta pur qim rav rka sap sel sem shb shl slb sml snm snt sou sup sus tab tag tau tel tha thk tin tke tms tno tsi ttn tuv url vag vie war wau wel wlf wll wlo wrk yap yid ykm yko zun,182,76475,0.0023798626
128A,Utterance Complement Clauses,,128,Sonia Cristofaro. 2013. Utterance Complement Clauses. In: Dryer; Matthew S. & Haspelmath; Martin (eds.) 2013. The World Atlas of Language Structures Online. Leipzig: Max Planck Institute for Evolutionary Anthropology. (Available online at https://wals.info/chapter/128),1,abu ace aco ain akn ame any apu arp bdc bkr brh brs bsq bur cnl djp dre eng epe err fij geo gim goo grk gum heb hin hix hmo ho hun igb ika ind iri itz jak jpn juh kan kas kay kch kew kho khs kio kmj kmu knr kor lan lim lkt lnd may mei mhi miy mna mnd mxc myi mym nan nbd nbm ndy ngi ngt nht nko noo npi nug nun orb otm pan per pit pms prh prs qhu ram ret rus sla sml sup swa tab tag tpi tsh tuk tvl tzu ung urk ute vai vie war way wma wra yag yaq yor,114,76475,0.0014906832
70A,The Morphological Imperative,,70,Johan van der Auwera; Ludo Lejeune (Umarani Pappuswamy; Valentin Goussev). 2013. The Morphological Imperative. In: Dryer; Matthew S. & Haspelmath; Martin (eds.) 2013. The World Atlas of Language Structures Online. Leipzig: Max Planck Institute for Evolutionary Anthropology. (Available online at https://wals.info/chapter/70),4,aga ago ain ao apt asm aym bae bii bkr bkt brs ccm chc cnl csh cte dam des dja dsh dut gar god hai hya hzb ido imo ing jpn kay kbl kfe kha kiw kkn klm kok kor kow krt lep lez lgt lob lot lug mai mal mbb mby mde mei mhi mik mnx mrt msg mup mxc ngi ngt nkn nor npn nya ond pai pba pit pnn pny pso see sel sem sus swe tah thk tke tor wat wiy wlo wth yid,89,76475,0.0011637791
143F,Postverbal Negative Morphemes,,143,Matthew S. Dryer. 2013. Order of Negative Morpheme and Verb. In: Dryer; Matthew S. & Haspelmath; Martin (eds.) 2013. The World Atlas of Language Structures Online. Leipzig: Max Planck Institute for Evolutionary Anthropology. (Available online at https://wals.info/chapter/143),1,aab aba abu abv acl adg adz agh agm aja ajg alk aln aml amo amq anc ane ani anu aoj ara arp asm au ava bab bag bak bas baw bbf bbu ben bgo bgr bid big bii bik bir bka blt blx bmb bob bod bok bol bre brm bud bum bus buy bzi cai cak chj chp chr chs chw cmr cnl cop cti ctl dgo die dma dni dsh duk dum dut ega eip eka erk ese ewe ewo fre fye gbb gbs ger giz gla gmz goe gua gul gwa gwo hal hat hau hdi hlp hma hna iau ice ido ifm ige igs irr isa iwm jab jar jmo juk kaa kar kau kbl kbw kel ken ker kho kie kim kis kkv klw kmk kmz kng knk kpw kre krn kro krr ksg kti ktl kwy kxo kyl kyp laa lab lag lai lbu ldu lel len lew lgt lin lkt lmg lmh lmn lmu lnd lon lou lug luv ma mac mad mas may mba mbe mbm mbr mbt mby mda mdg mdo mdw mea meh mek mgk mgu mhi mig min miy miz mka mku mlu mmb moo mor mou mpu mrg msk msm msn mtb mtu mum mup mxe myg nag nbm ndu ngm ngo ngz nma nnk non nor nrg nse nua nup nza nze olo one ong osa otr paa pat per pis plh pod pog qaw qhu rag ron rot rsu rwe sah san sel sgb sgl shb shi sht shy sio skk sla sme snm sro sup swe tab tac teo ter tid tiv tja tmo tpr trb tru tsz tye udm uld urk urt wec wma wna wom wrm xav yul zan,288,76475,0.0037659365
55A,Numeral Classifiers,,55,David Gil. 2013. Numeral Classifiers. In: Dryer; Matthew S. & Haspelmath; Martin (eds.) 2013. The World Atlas of Language Structures Online. Leipzig: Max Planck Institute for Evolutionary Anthropology. (Available online at https://wals.info/chapter/55),3,abu aln ass ath bel ben bnv bok brm chw chx cme cnt crq cuu eya gar hmd hyo jak jpn kam kan kei keo khu klp klv kmh kmu kor kos krb ktp kua kwz kyl lah lai lch lon lov lrk mlm mnd mok nau nel new ngd niv nvs nyl plk poh pur rem sim smd sml so tab tha tht tli tou tpa trb tsi tuy tze uli vie wao wrk yag yct,78,76475,0.0010199412
125A,Purpose Clauses,,125,Sonia Cristofaro. 2013. Purpose Clauses. In: Dryer; Matthew S. & Haspelmath; Martin (eds.) 2013. The World Atlas of Language Structures Online. Leipzig: Max Planck Institute for Evolutionary Anthropology. (Available online at https://wals.info/chapter/125),1,ace ain arp bkr cle dre fij gua hmo ind juh kay kho klv kmu kor lkt lnd mal may mku mna mnd mxc nun pai sla sml som tab tin tpi vie war wma yaq yor,38,76475,0.0004968944
