parameter_id,parameter_name,parameter_description,chapter_id,chapter_citation,value,same_value_language_ids,value_language_count,language_count_total,count_ratio
143E,Preverbal Negative Morphemes,,143,Matthew S. Dryer. 2013. Order of Negative Morpheme and Verb. In: Dryer; Matthew S. & Haspelmath; Martin (eds.) 2013. The World Atlas of Language Structures Online. Leipzig: Max Planck Institute for Evolutionary Anthropology. (Available online at https://wals.info/chapter/143),4,aab aar aba abv acu adi agm aja alk aln aly amc amp amq anc ane ang ani anu apl apt ara arc asm ath ava awe aze azi bag bak bas baw ben bgr big bik bio bir bka ble bln boa boj brh brn brr brs bsk bti bud bum bus but bzi can car cas cay cbo cct cde chp chs chv chw cln cmr cnl cnm coa cpn cqt crp cti ctm cub dds des deu dgo die dig dim dio dms dni duk dum efi ega egn emb epe ese fua ful ga gah gal gar gbs gim giz gla gln gmz god goe gon grw gul gwo har hat hdi hid hix hma hmi hna hpd hum hzb iau idu ige igs ijo ika ing irq irr irx isa iwm jab jar jeb jiv jmo jms jpn juk kaa kab kac kar kas kau kay kbo kel kem ken ker kha khl kho kie kim kkp kkv kmn kmo kmr kmz knd kng knm knr knw koa kob kok kol koy kpw krc krh kri krn krr kta kti kun kus kuv kwz kxo kyl kyp kyr laa lab lag lai lav lec lel lew lez lgt lin lkt lmg lmh lmn lon lug mab mac mad map mas may mba mbm mbr mby mda mdg mdo mdw mea mee meh mei mek mgu mhi mhl mig mii mik mis miz mkh mki mlg mlu mmb mnc mne mor mot mou mpt mpu mrg mrs msc msg msl msm mtb mts mui myg mym mzc nas nbd nbm ndt nep ngl ngm ngn ngz nis niv nku nma nmb nnk noc noo nrg nsn ntj nua nup nza nze olo omh ong osa oya pae pat paw pec pia pit pme pod pog prh prk psj ptw qaw rao ret rit ron rsu rum sah san saw sba sdw sel sem sgb shb shh shi shk sht sia sin sio skk sla sme smn snm sro sug syu tab tan tao tba tbu tel tir tiv tlo tma tml tne ton tpr tpt trb tru tsf tsz tuc tul tun tur tuv tuy udm uld urk urn uyg uzb wai wao wap was wau wbn wec wly wma wna wom wra wrm xav yam yar ykt ypk yrm yrr yul zag zan zay,390,76475,0.005099706
69A,Position of Tense-Aspect Affixes,,69,Matthew S. Dryer. 2013. Position of Tense-Aspect Affixes. In: Dryer; Matthew S. & Haspelmath; Martin (eds.) 2013. The World Atlas of Language Structures Online. Leipzig: Max Planck Institute for Evolutionary Anthropology. (Available online at https://wals.info/chapter/69),2,aar abi abk abn abv acg acm aco acu adn aga agm agt ain ala alb alc ale alw aly amb amc ame amn amp amx ana ani ann ao apl apt apu ara arc arm arw asm ass ath atk ava avo awa awe awi awp awt aym aze azi baa bac bae bam bao baq bau bco bdm bej bel ber bgn bho bii bil bin bio bkb bkr bln blt blx bmb bmr bnj bnr bnu bod boi boj bre brh bri brm brn brr brs bry bsk bua bul bun bur but bya bzi cah car cas cax cay cba cbo cct cde chb chc che chg chi chn chv chx cld cln cmh cmn cmy cnm cnt coa coo cos cpy crn crp ctm cub cui cup dag dan daw der des deu dgo dgr dhb dhm dhr dhw dig dim diy dja dji djm djn djp djr dlm dmi dmk dms dni dom drm dsh duk dun dut dyi eip eka emb eme ene eng epe ese est eud eve evn fas fin for fqs fre fua fur fye gaa gah gal gan gar gbb gds geo ger ggu gid gim gln gnn goa gog gon grb grf grj grk grr grs grw gud gug guh guj gum gur guu hai hak hal har hay hin hix hlp hmi ho hop hpd hua hui hum hun hzb iat ice igb ign igs iha ijo ik ika imo ina ind ing inn iqu irx ita ite iwa jam jaq jeb jiv jpn jva jwr kac kar kay kbo kbu kem ker kew kfe kgu kgz kha khg khi khl kio kiw kkp kku klm klq kma kmb kmh kmj kmk kmn kmo kmp kms knb knc knd kni knk knm knn knr knw kob koe kok kol kop kor koy krc krh kri krj krk krw ksa kta kti ktl kty kum kus kuu kuv kwk kwo kwt kwz kya kyk kyq kyz lac lad lav ldu lec lep lez lho lim lit lkt lmn lng lot lui lun mab mac mag mak map mar mau mbt mcd mco mcv mde mdm mdn mdo mee mei mem mgg mgi mhi mhk mij mik mis mkg mkh mkr mme mmi mnc mnd mne mni mnm mno mns mny moe mog mom moo mos mot mou mpr mpt mqf mra mrh mri mrr mrs mrt mrw msc msg msl mss mtk mts mui mun mut nab nag nah nar nas nbd nbr nca ndo ndt nep nev new nez nga ngi ngj ngl ngn ngt ngw ngz nha nhh nhm nhn nht nis niv nkb nmb nmd noc nog non nor nph nsn nti ntj ntu nug nwd nyi nze oks olo omh omi one ong ood ord orh ork oro orw osa oss oya paa pae pan pau paw pba pdp pga pia pip pir pis pkn plk pme pno pny pol por ppi prh prk psh pso ptw pum pur pwn qaw qhu qim ram rao raw rem res ret rit rmb rom rot rum run rwa rwe sav sba sdw sem shd she shh shi shk sho shp sia sid sin siu skp skr slb slg slp sme smn sna snh sno snt som spa srd srn sro sta stl sue sug suk sus svs swe syu tac tam tan tao tau tba tbl tbu tbx tce tel tgl thn thu thy tir tja tkl tma tmc tmg tml tmo tnn tny tob ton tpn tps tpt trb trr tru trw tsf tsh tte ttu tuc tun tur tuv tvo tvt twe twn uby udi udm uhi ukr una urd usa usr ute uyg uzb wah wai wak wam wao wap was wat wau way wbn wch wel wem wik win wir wly wmu wog wra wrb wrg wrk wrn wsk wtm yag yah yal yaq yar ycn yid yim yin yko ykt ylm yng yok ypk yrm ytu yuc yuw ywl yyg zay zch zpr zqc zqo zqs zun,667,76475,0.008721804
33A,Coding of Nominal Plurality,,33,Matthew S. Dryer. 2013. Coding of Nominal Plurality. In: Dryer; Matthew S. & Haspelmath; Martin (eds.) 2013. The World Atlas of Language Structures Online. Leipzig: Max Planck Institute for Evolutionary Anthropology. (Available online at https://wals.info/chapter/33),2,abi abk abn acg aco agt ain alb ale aln amh amx any ao apu ara arc arm arp arw asm ath ava avo awa awe awp awt aym aze azi baa bae bam baq bar bdm bej bgn bho bid big bkb bla bln blt bmz bnu bod bre brh bri brn brs bsk bti bud bul bun bur but bya cah cai cam car cas cax cde chb chc chg chk chn chs chv chx ckl cld cln cmh cmn cmy coc cpy cqt cre crn cro crp ctm cup cze des deu dgb dgo dhr dhw did dji djn dmk dms dom doy drg dsh dut eip emb ene eng est eve evn fin for fre fua ful ga gah gal gam gds geo ger ggu gil gim gmw gnd goa god gon grb grf grk grw gud guh gum guu gyc hai hau hay hdi heb hhu hid hin hlp hma hmi ho hop htc hui hum hun hzb ice idn ign igs ijo ik ina ing inn irq ita ite ito jaq jeb jiv jlu jpn jug jva kab kac kai kbu kdw kem ket kew kfe kgz khg khi khl kho kie kio kir kiw kkp kku kla klw kma kmh kmk kmo kms knd kni knk knn knr knw kob kok kol kop kor koy kpe krc krd kri krk krn krw kry kta kty kum kuv kws kwt kxo kyq lad lah lan lar lat lav ldu lec lel les lez lit lmg lmn lng lug lui lul lun luo ma maa mab mac mag maj man mas mba mbr mcv mde mdn mea mee meh men mer mgh mgq mgu mij miy mkg mkh mkr mlg mme mmi mna mnc mnd mne mno mns mny moe mog mor mos mot mou mpr mpt mrl mrt msl mss mts mtt mui mun mur mut muu myi mzn nab nag naj nan nar nav nbd nbr ndt nep ngi ngj ngm ngz nha nhh nhn nht niv nkb noc nog nor nrg ntu nua oir oji oks olo one ong ord ork oss oya paa pae pan pdp pga pia pip plh plk pme pol por prk prs psh psm pso ptt ptw pur pwn qhu qim ras rem res rgc rit rny rom run rus rut rwe sal sav scr sdw seb sec ser sgb shd shk shl sho shp sht sid sil sin siu skp sla slb slo slp smn sna sno so sob som sor spa spi src srd sta stl sug suk sup swe taj tao tar tbu tel ten tep thk thn tic tig tir tiw tkl tlf tli tma tmc tml tnc tny tob ton tou tpt trb trm trr trw tsh tsz tts ttu tuc tul tun tur tuv tvo twn tzo uby udi udm ukr urd urk urn usr ute uyg uzb wak wal wao wap wau wbn wch wel wik wly wra wrd wrk wrl xas xoo yag yam yaq yar ycn yim yin yko ykt yok ypk ytu yuk yuw ywl zay zpr zqc zun,513,76475,0.0067080744
143G,Minor morphological means of signaling negation,,143,Matthew S. Dryer. 2013. Order of Negative Morpheme and Verb. In: Dryer; Matthew S. & Haspelmath; Martin (eds.) 2013. The World Atlas of Language Structures Online. Leipzig: Max Planck Institute for Evolutionary Anthropology. (Available online at https://wals.info/chapter/143),4,aab aar aba abi abk abn abu abv ace acg acl acm aco acu adg adi adz aeg agb agc agd agh agm ain aja ajg akh akn ala alb alk all aln als alw aly amb amc ame amh aml amn amo amp amq amr ams amt amx ana anc ane ang ani anj ann anu any ao aoj apl apt apu apw ara arc arg arj arm aro arp arq arw asm ass asu asy ata ath au ava awa awe awp awt aym aze azi baa bab bac bae baf bag bai baj bak bam bao baq bar bas baw bbf bbl bbu bbw bch bco bdm bej bel ben ber bfg bgn bgo bgr bho bia bid big bii bik bil bio bir biu bka bkr bku bla bln blr blt blx blz bmb bmz bni bnn bnu boa bob bod boi boj bok bol bra bre brf brh bri brl brm brn brp brr brs bsh bsk bsq bti btk bto bua bud bug bul bum bun bur bus but buw buy bvi bwc bya bzi cah cai cak cam can car cas cax cay cba cbo ccm cct cde cea cem cga cha chb chc chd che chg chh chi chj chk chn chp chq chr chs chv chw chx cic ckl cle cln cmh cml cmn cmr cmy cnl cnm cnt coa coc coo cop cos cpl cpn cpy cqt cre crn crp crt cso cti ctl ctm cub cui cup cya cyv cze dag dan dds des deu dga dgb dgo dgr dha dhi dhm dhw did die dig dim din dio diy dja dji djm djn djp dma dmi dmk dms dni dom dre drm dsh dua duk dul dum dun dut dyi ebi efi ega eip eka eko emb eme ene eng eno eny epe erk err ese est eud eve evn ewe fij fin fon fre fua ful fur fut fye ga gaa gae gah gal gap gar gav gbb gbs gds gel geo ger ggu ghr gim gir giz gjj gku gla gln gmw gmz gnb goa god goe gok gon goo grb grf grj grk grr grs grw gua gud gug guh guj gul gur guu gwa gwo gyc hai hak hal ham han har hat hau haw hay hdi heb heh hei hid hil hin hix hlp hlu hma hmi hmo hna hnd hoa hol hop hpd htc hua huc hui hum hun hup hve hya hzb iaa iau iba ice idn ido idu ifm ifu ige ign igs ijo ik ika ila imo ina ind ing inn iqu iri irq irr irx isa ita ite iwm izi jab jak jaq jar jeb jiv jlu jmo jms jng joh jpn juh juk kaa kab kac kad kae kan kar kas kau kay kba kbl kbo kbw kby kch kdw kdz kel kem ken ker ket kew kfe kga kgr kgy kha khd khg khl khm khn kho khr khs kie kik kil kim kin kio kir kiw kkp kkt kkv kla klg kll klm kls klv klw kma kmb kmh kmi kmj kmk kmn kmo kmp kmr kms kmu kmw kmz knb knc knd kng kni knk knm knn knr knw knz koa kob koe koi kok kol kom kon kop kor kos koy kpw krb krc krd kre krh kri krj krk krn kro krr krw kry ksa kse ksg ksn kta ktc kti ktl kty kum kun kuo kus kut kuv kwa kwb kwn kwo kws kwt kwy kwz kxo kya kyl kyp kyq kyr kyz kzy laa lab lac lad lag lah lai lal lan lao lar lat lav lbu lda ldo ldu leb lec leg lel len lep les let lew lez lgi lgt lgu lho lic lim lin lis lit lkt llm lmg lmh lmn lmp lmu lnd lng lon lot lou luc lug lui luo luv ma maa mab mac mad mae mag mai maj mak mal mam man mao map mar mas mau maw may mba mbe mbi mbl mbm mbr mbt mby mcd mch mco mcv mda mde mdg mdl mdm mdn mdo mdw mea mee meh mei mek men mer mga mgg mgi mgk mgu mhi mhl mhu mie mig mii mik min mir mis miy miz mka mkd mke mkg mkh mki mkj mkl mku mkz mlg mlk mlu mmb mme mmn mmv mmw mna mnc mnd mne mni mnm mno mns mnt mny moe mog moh mok mom mon moo mor mos mot mou mov mpa mpo mpt mpu mra mrd mrg mrh mri mrl mro mrq mrr mrs mrt mru mrw msc msg msk msl msm msn msq mss mtb mts mtu mua mug mui mum mun mup mur mus mut mwb mwe mwo mxc mxe mxj mxo mxp mxx myg myi mym mzc nab nad nag nah naj nak nal nam nan nar nas nav nax nbd nbm nbr nca ncm ndb nde ndj ndo ndr ndt ndu ndy neh nep nev new nez nga ngd ngi ngj ngk ngl ngm ngn ngo ngt ngu ngw ngz nha nhh nhm nht nia nif nis niu niv nke nkk nkn nko nku nma nmb nmm nne nnk noc non noo nor nph nrg nse nsg nsn nti ntj nto ntu nua nue nug nun nup nyh nyi nyk nym nyn nyr nyu nza nze obg obo ocu oir oji oks olo omh omi ond one ong ono ood ori ork oro orw osa oss otm otr oya paa pae pai pal pan par pat pau paw pba pec per pga pia pip pis pit pkn pkt plg plh pme pms png pnn pno pnu pod pog poh pol por ppi pra pre prh prk prs psh psj psm pso psw ptt ptw pul pum pun pur pwn qaw qhu qia qim qui qum rag ram rao rap ras raw rem res ret rgc rik rim rit rnd rny rom ron rot rov rpa rru rsu ruk rum run rus rwa rwe sah sak sal sam san sap sar saw sba scr sdw sed see sel sem ser ses sgb sgl sgu shb she shh shi shk shl shm shn shp sht shu sia sid sil sin sio sir sis siu skk skm skw sla slb slo sme sml smn sna sng snm snn sno snt so sob sod som son sor spa squ srb src srd sre sro ssa sta sti stl stn sub sud sue sug sul sun sup svs swa swe swt syu tab tac taf tag tah taj tak tal tam tan tao tar tas tau taw tba tbo tbt tbu tbw tbx tce tdr tee tel ten teo tep ter tes tet tgh tgk tgl tgo tgr tha thn tho thu thy tib tid tig tim tin tir tis tiv tiw tja tke tki tkl tla tli tlo tlp tma tml tmm tmn tmo tmr tna tnc tne tng tnn tno tny tob tod tol ton tou toz tpa tpn tpr tpt trb tri trm trr tru tsf tsg tsh tsi tsn tsz tte ttn tts ttu tuc tuk tul tun tur tus tuv tuy tvl twe twn tye tzo tzu uby udh udi udm ukr uld uli una ung urd urk url urn urt uru usa usr ute uyg uzb vai ven vie vnm wag wah wai wak wal wam wao wap war was wat wau way wbn wch wec wed wel wem wic wik win wiy wlf wlm wlw wly wma wme wmu wna woi wol wom wor wra wrb wrd wrg wrk wrl wrm wrn wsk wtm wya xam xar xav xbi xho xns yag yam yao yap yaq yar ybi yei ygr yi yid yim yin yiw yko ykt ylm yng yok yor ypk yqy yrm yrr ytu yuc yuk yul yur yuw ywl ywr zag zai zan zap zar zay zaz zch zpr zqc zqo zqs zul zun zzo,1315,76475,0.017195161
51A,Position of Case Affixes,,51,Matthew S. Dryer. 2013. Position of Case Affixes. In: Dryer; Matthew S. & Haspelmath; Martin (eds.) 2013. The World Atlas of Language Structures Online. Leipzig: Max Planck Institute for Evolutionary Anthropology. (Available online at https://wals.info/chapter/51),1,aar abn acm acu adk adn ady aga agt alb ale all alw aly amh amn ams ana apw arc arm arw ass ath ats ava awa awe ayo aze azi baa bae baq bbw bej bel ben bho bii bio biu bkb blr blx bmr bnj bnr bnu bod boi brh brm brr brs bry bsk bti bun bur but bya cah cai cam cas cax cay cea chc chi chk chv cln cmh cml cmn coa coc cos cpy cre crp ctm cub cup cze dag dgr dhb dhr dhw did diy dja dji djm djn djp djr dmk dni dom drg dsh dyi emb ene esm ess est eud eve evn fin fur gah gal gam gan gds geo ger ggu gid gil gku goa god gog gon grk grr grw gug guh gum guu hin hlp hmi ho hop hua hui hum hun hup hzb ice ijo ik ing iqu ite jab jaq jeb jiv kab kac kay kbu kem ken ker ket kgu kgz kha khg khi khl kio kiw kje kkp kku klg klm klw kma kmh kmk kmo kmp kmr kms knd knn kno knw kok kol kop kor koy krc krj krn krw kry kta kty kum kuv kws kwz kya kyp kzy lad lak lat lav lec lez lho lim lit lml lmn lui mac mag mai maj map maw mba mby mcc mch mdm mdn mee men mer mgh mhi mhk mhl mii mik mir mkh mki mlk mme mnc mne mno mns mny moe mog moh moo mqf mrl mrt mrw msc msl mts mui mur mut nah nas nbr ndj nep new nez nga ngi ngj ngl ngm ngn ngt ngw nha nis niv nkb noc nog nor nsn ntj ntu nug nya nyi oir oji omi ond one ong ord orh ork orw oss otr oya pan par pba pia pir pkn pkt pme pny pol ppi prh prk psh psm pso ptt ptw puq pur pwn qim qui rem rit rmb rom rus rut rwe sav scr shb shh shi sho shp sia sin skp slo slp sna snh sno so sor sta stl sue suk tao tce tel ten thn thu tic tli tlo tlp tma tml tmn tpn tpt trm trr tru tsh tsz ttu tul tun tur tus tuv tvo twe twn udi udm uhi ukr uru usr ute uyg uzb wag wah wak wam wan wap was wau wed wem wic wik win wiy wly wmu wn wom wrb wrd wrg wrk wrl wrn wth xbi yag yah yam yaq yar yid yim yin yko ykt yng yok ypk ytu yuc yuk yur yuw ywl yyg zan zay zpr zqc zqo zqs zun,452,76475,0.0059104282
143F,Postverbal Negative Morphemes,,143,Matthew S. Dryer. 2013. Order of Negative Morpheme and Verb. In: Dryer; Matthew S. & Haspelmath; Martin (eds.) 2013. The World Atlas of Language Structures Online. Leipzig: Max Planck Institute for Evolutionary Anthropology. (Available online at https://wals.info/chapter/143),1,aab aba abu abv acl adg adz agh agm aja ajg alk aln aml amo amq anc ane ani anu aoj ara arp asm au ava bab bag bak bas baw bbf bbu ben bgo bgr bid big bii bik bir bka blt blx bmb bob bod bok bol bre brm bud bum bus buy bzi cai cak chj chp chr chs chw cmr cnl cop cti ctl dgo die dma dni dsh duk dum dut ega eip eka erk ese ewe ewo fre fye gbb gbs ger giz gla gmz goe gua gul gwa gwo hal hat hau hdi hlp hma hna iau ice ido ifm ige igs irr isa iwm jab jar jmo juk kaa kar kau kbl kbw kel ken ker kho kie kim kis kkv klw kmk kmz kng knk kpw kre krn kro krr ksg kti ktl kwy kxo kyl kyp laa lab lag lai lbu ldu lel len lew lgt lin lkt lmg lmh lmn lmu lnd lon lou lug luv ma mac mad mas may mba mbe mbm mbr mbt mby mda mdg mdo mdw mea meh mek mgk mgu mhi mig min miy miz mka mku mlu mmb moo mor mou mpu mrg msk msm msn mtb mtu mum mup mxe myg nag nbm ndu ngm ngo ngz nma nnk non nor nrg nse nua nup nza nze olo one ong osa otr paa pat per pis plh pod pog qaw qhu rag ron rot rsu rwe sah san saw sel sgb sgl shb shi sht sio skk sla sme snm sro sup swe tab tac teo ter tid tiv tja tmo tpr trb tru tsz tye udm uld urk urt wec wma wna wom wrm xav yul zan,288,76475,0.0037659365
85A,Order of Adposition and Noun Phrase,,85,Matthew S. Dryer. 2013. Order of Adposition and Noun Phrase. In: Dryer; Matthew S. & Haspelmath; Martin (eds.) 2013. The World Atlas of Language Structures Online. Leipzig: Max Planck Institute for Evolutionary Anthropology. (Available online at https://wals.info/chapter/85),1,aar aba abk acg acn aco adg adi adk adn ady agm ain ajg akh ala aly amb amc ame amk amp amt ana ang ao api apl apt apu ara arc arm arw asu atk ava avo awe awp awt aym baa bac bae bam bao baw bbf bej bgs bho bil bin bkb ble bln blt blx boa boj bok bon brh bri brm brs bry bsk bsq bti bua bur bus but bya bzi cah cai cam car cas cav cbo cct cde chc che chg chi chk chn chp chs chv cln cmh cmn cmr cnl cnm coc coo cor cti ctm ctw cub cup dag dan daw dds der des dga dgb dgr dhm die dig dim dji dlm dmi dmk dms dni drg drm dul dun edo eip emb eme emm ene epe ese est eud eve evn ewe fas fin for fqs ful fur gaa gam gan gap gar gav geo ghb gim gjj gln gmw gnn gon grb grj grw gua guj gur gyc hai ham han hay hhu hid hin hix hlp hma ho hop hpd hua hum hun hup hzb iau idn idu ika imo ina ing inn iqu jbt jel jin jms jng joh jpn jug juh jva kaa kab kac kas kbo kbt kch kem ket kew kgy kgz kha khd khl kho khr khw kie kim kir kiw kje kkp kkq kku kll klm klq klr kma kmb kmh kmk kmn kmo kms kmw kmz knb knc knd kng knm knn knr knz koa kob kok kol kop kor kpo krc krh krj krk krn kry ksa kse kti kty kum kun kus kuv kwb kwo kws kwt kxo kyk kyn kyr kyz kzy lad lah lai lak lal lar lav ldu lep lez lgt lho lis lkt llm lmn lot lug lui lun mab mac mad mag mai maj man mar maw max mbo mcc mde mdl mdn mei mek mey mgg mgh mgi mhi mik mis miz mka mke mkg mkj mkl mku mme mnc mnm mno mns mnv moe mom mou mpr mpt mqf mrd mrh mri mru msg msn mtu mun muu myr mzn nab nad nag nam nar nas nat nav nbd nbr ndj nep nev new ngg ngk nis niv nkn nnd nnk noc nph nti ntj ntu nwd nyi nze oks omi orh ork oro orw ory osa oss owi pae pan pau paw pdp pis pit pmn pnx pra prh prk psh pso ptt ptw pum pun puq qaf qaw qhu qia qim ram raw rem res ret rik rum run rut ryu sar sav sba sdw sel sem ser shb she shh shi shk sid skk sko skw sla slb sle slp sme smn sna sng snh snm sno snt sor src srn sro sta stl sue sup sus svs syu tac tak tam tar tau tbl tbt tbu tbx tce tel tgl thd thn thu tir tja tkl tkm tlf tli tls tml tmo tnc tny ton tou tpn tps trb trm tru trw tsf tsm tsr tsz tte tts ttu tuc tul tun tur tuv tuy tvo tvt uby udh udm una ung urd urk urn usa ute vai wah wai wal wao was wat way wbn wir wme wna wor wra wrd wry wsk wtm xas xav xns yag yah yal yaq yar ycn yei yel ygr yi yim yiw yko ykt ylm yqy ytu yuc zag zar zaz zch zun,577,76475,0.007544949
143A,Order of Negative Morpheme and Verb,,143,Matthew S. Dryer. 2013. Order of Negative Morpheme and Verb. In: Dryer; Matthew S. & Haspelmath; Martin (eds.) 2013. The World Atlas of Language Structures Online. Leipzig: Max Planck Institute for Evolutionary Anthropology. (Available online at https://wals.info/chapter/143),2,aab aba abv agm aja alk aln amq anc ane ani anu ara asm ava bag bak bas baw ben bgr big bik bir bka bud bum bus bzi chp chs chw cmr cnl cti dgo die dni duk dum ega ese gbs giz gla gmz goe gul gwo hat hma hna iau ige igs irr isa iwm jab jar jmo juk kaa kar kau kel ken ker kho kie kim kkv kmz kng kpw krn krr kti kxo kyl kyp laa lab lag lai lel lgt lin lkt lmh lmn lon lug mac mad mas may mba mbm mbr mby mda mdg mdo mdw mea meh mek mgu mhi mig miz mlu mmb mor mou mpu mrg msm mtb myg nbm ngm ngz nma nnk nrg nua nup nza nze olo ong osa pat pod pog qaw ron rsu sah san saw sel sgb shb shi sht sio skk sla sme snm sro tab tiv tpr trb tru tsz udm uld urk wec wma wna wom wrm xav yul,171,76475,0.002236025
112A,Negative Morphemes,,112,Matthew S. Dryer. 2013. Negative Morphemes. In: Dryer; Matthew S. & Haspelmath; Martin (eds.) 2013. The World Atlas of Language Structures Online. Leipzig: Max Planck Institute for Evolutionary Anthropology. (Available online at https://wals.info/chapter/112),2,aab abi abn aco adg adn aeg agd agh ain ajg ala alb alc alk all aln alw amb ame amq ane ani anj ann anu apu ara arg arj arp asm asy au awa aym baa bag bao baq bar bbw bdm ben bfg bgo bgr bii bik bir bka blr blx bma bmb bnn bnu brf bri bsq bto bua bud bul bum bun bwc bzi cah cai cax cea cha chc chk chp chx ckl cle cmn cmy cnl cnt coo cos cpy cre crn cso cti ctl cup cya dag dan dga dgb dgo dhr dhw diy dja dji djn djp dmk dni dsh dua duk dum dut dyi ega eip eka eng eno ese est eud ewo fre fye gaa gae gap gbb gbs gds geo ger ggu gmw gnn gok goo grf grj grk grr grs gud guh guj guu hat hau haw hay heb hil hin hna hun hup hve ice ige igs ik imo iqu iri irr isa ita iwm jab jak jaq jar jmo kaa kad kae kan kar kau kdz kel ken ker kfe kho khr kkv klm kls klv klw kmk kmz knb knc kni knn koi kor kos kre krj krr ksa kse kti kty kum kuo kut kwa kwn kwt laa lab lac lag lan lar ldu lel lgt lin lkt lmg lmn lon lui luo maa mac mad mal mam mas mau may mba mbt mby mcd mch mco mda mde mdm mdo mdw mea meh mer mga mgg mgi mgk mgu mhu mir miz mkl mku mlk mlu mmn mna mnd mni mnm mno mns mny moe mog moh mok mos mou mpo mpu mra mrd mrg mrh mri mrl mrt mrw msm msq mss mtb mtu mum mur mus mut mxc mxj mxo mxp myg myi nab nad nag naj nar nav nca ndj ndo neh nev nez ngi ngj ngm ngu ngw ngz nha nhh nhm nht nke nkk nnk nor nse nti nua nue nug nyi nyn nyu nza nze oji oks olo omi ond one ono ood osa oss otm paa pai pal pan par paw pba pip pkn plh pno pod poh pok pol por pul pur qim qum ram raw res rik rom rov rsu rus sah sam san scr ses sgb shl shp sht shu sid sim sio siu skw sla slb slo sme sml sna sng snn so sob som spa src srd sta sup swe tab tac tag tah tak tam tau taw tbo tbt tce tee ten tep ter tes tgh tho thy tid tim tiw tja tkl tli tmn tmo tmr tnn tno tny tou tpn trb trr tru tsg tsh tsk tsn ttn ttu tus tzo tzu ukr uld una ung urk urt usa wag wak wal wam wch wec wel wem wic wir wiy wlm wma wmu wom wor wrb wrd wrg wrm wry wsk wya xam xav yag yap yaq yei yid yin ylm yng yok yur yuw ywl zai zch zzo,502,76475,0.0065642367
