parameter_id,parameter_name,parameter_description,chapter_id,chapter_citation,value,same_value_language_ids,value_language_count,language_count_total,count_ratio
4A,Voicing in Plosives and Fricatives,,4,Ian Maddieson. 2013. Voicing in Plosives and Fricatives. In: Dryer; Matthew S. & Haspelmath; Martin (eds.) 2013. The World Atlas of Language Structures Online. Leipzig: Max Planck Institute for Evolutionary Anthropology. (Available online at https://wals.info/chapter/4),4,abk aeg agh aik aiz akw alb ald amo ana anc arc ava awn aze bam baw bbf bet bir bis bki bma bod brb bre brh bri brm bsk bul bur chv cil cof cti ctl dah dan dgb dgr diz dnw doy dre eng ewe ewo fef fin fre ful ga gbb geo ger ghb grk gwa hau hin hmr hum hun hzb iaa igb ijo ik ind ing ird iso jpn juh kab kad kal ker kfe kgi kgz kha kly kmp knr koh kpa kpe krd kzy lad lah lak lam lat lep lez lit llm lu lug mab mal mba mbm mgg mog mrd mrg mui mum mxc nap nax ndy ngz nko nti oca ogb orh orm otm pai pau paw phl pol prs psh puk rom rsc ruk rus rut san sba sdh snd soq sui sup swa ter tgr tmp tok ttu tug tur uzn yey ykt yul zan,158,76475,0.0020660346
94A,Order of Adverbial Subordinator and Clause,,94,Matthew S. Dryer. 2013. Order of Adverbial Subordinator and Clause. In: Dryer; Matthew S. & Haspelmath; Martin (eds.) 2013. The World Atlas of Language Structures Online. Leipzig: Max Planck Institute for Evolutionary Anthropology. (Available online at https://wals.info/chapter/94),5,abu adi akn amb anj ann arp avo awp bil bmb bur bya cnt coc dmk dni eip epe eud hpd idn ijo kbw khr kma knd knr kok kpw ksg kyl kyz kzy lag lav lug mab maj mar mei mgk mke mna mns mou mun nas nev new ngt ngz nun nwd ood oss pau per qaw ram rum run sav see sla sna sng snh sod src tar tau taw tbu tel tgr tir tmo trm tsh ttu tur twe wap wau yag yaq ygr zap zhn zqc zya,93,76475,0.0012160836
47A,Intensifiers and Reflexive Pronouns,,47,Ekkehard König; Peter Siemund (Stephan Töpper). 2013. Intensifiers and Reflexive Pronouns. In: Dryer; Matthew S. & Haspelmath; Martin (eds.) 2013. The World Atlas of Language Structures Online. Leipzig: Max Planck Institute for Evolutionary Anthropology. (Available online at https://wals.info/chapter/47),1,afr ala ame amh arg arm asm bag ben bgv brh brm bur cha cle cnt dsh dut eng eve fin fur gar geo god goo grw guj heb hin hmo hun imo ind ing iri jpn juh jun kas kay kfe kha khm knd kob kor lan lav lez mal mar mei mhi miy miz mlt mnd mns mup mxc mym ndy nko nor otm oya pan pit pod prs qhu rap snh snn sue swe tel tha tiw tml tna tru tsa tuk tur ung urh vie wel wlf wra yim,94,76475,0.0012291599
9A,The Velar Nasal,,9,Gregory D.S. Anderson. 2013. The Velar Nasal. In: Dryer; Matthew S. & Haspelmath; Martin (eds.) 2013. The World Atlas of Language Structures Online. Leipzig: Max Planck Institute for Evolutionary Anthropology. (Available online at https://wals.info/chapter/9),3,abi abk abm abz aco adk ady aeg agu aho aik ain ala alb aln ame amh amr amu amz ana apu ara arb arc arm arp asm awp axv aym aze bdk bej bez bgv bla blc bma bor brh bri brr brs bsq bth car cas cav ccp cct chc chh chi chl chm cht chv cmk cmn cmy coo cor cre crj cui cyv dag emb epe ess ets fre gag gap geo god grf grk gto gua guj guq hai hau hav heb hia hid hin hix hnk hpd hrs hun hzb ika imo ing iri ito ixi jak jbt jeb jib jpn jrn jva kab kew kfy khi kho khv kio kit klv knd koa krk krt krz ksh ksr kut kwo kws kwz lak lat lez lil lkt mak mam mar max may meh mkw mlt mma mos mov mui mxc mxt naa nam nav ndy nev nez ngz nhn nko nti oca ond orh orl osa oss otm pau pip prh prs psm pso qec qim qui rus rut san sba sel shk shw sla snm snt sod som soq spa squ sue swr tac tce tec teh tew til tin tli tlp tnd tps tru tsi tsz ttu tun tur twn uby udi umu usa wap war wch wic win wnb wra wrm xav yag yaq yki ykp ynm yor yrc yta yuc yur zso zun,235,76475,0.0030728995
12A,Syllable Structure,,12,Ian Maddieson. 2013. Syllable Structure. In: Dryer; Matthew S. & Haspelmath; Martin (eds.) 2013. The World Atlas of Language Structures Online. Leipzig: Max Planck Institute for Evolutionary Anthropology. (Available online at https://wals.info/chapter/12),3,abi abk aea aeg aht aiz ala alb alw amz anc arc ava awp bco bej ben bma bra brd bre brh brw bsk bsq bua bul bur cah cam ccp chk chl chv chw cnl coo dgr dio diz djp doy eng eya fre ful geo ger grk gwa hai ham hba hin hop hun hup ik imo ind ing ird ite jeh ket kgz khm khs klm kly kmu knd kot koy kpa krd kry ktk kut kwk kzy lad lak lat lep lez lit lkt lus mab mak mar mau mku mlk mog mpa mtp myi nap nez nis niv nkt nmb non nor ntu nuu ond ood orm otm pae poh pol prs psh psm qaw rsc rus rut sab scs sel shu soq squ sre tab tli tmp tne tsi tso ttn ttu tug tul tuv tza uzn wlf wrd ygr ykt ytu yur zqc,151,76475,0.0019745014
3A,Consonant-Vowel Ratio,,3,Ian Maddieson. 2013. Consonant-Vowel Ratio. In: Dryer; Matthew S. & Haspelmath; Martin (eds.) 2013. The World Atlas of Language Structures Online. Leipzig: Max Planck Institute for Evolutionary Anthropology. (Available online at https://wals.info/chapter/3),5,abk aco aea amp amu ani arc ava aym bco bma bur cad chl chp coo dah det diy djp eya fye had hai hmo hup ing irq jaq juh kab kgu klm kut kwk lad lak lez lus mak mal maz mrg mrt nav ngz nuu pae pau qaw qui rus rut scs sdw sel squ sui teh ter tli tsi ttu xoo yey yny yus zul,69,76475,0.00090225565
33A,Coding of Nominal Plurality,,33,Matthew S. Dryer. 2013. Coding of Nominal Plurality. In: Dryer; Matthew S. & Haspelmath; Martin (eds.) 2013. The World Atlas of Language Structures Online. Leipzig: Max Planck Institute for Evolutionary Anthropology. (Available online at https://wals.info/chapter/33),6,acl aeg akn ame amr arg arj arq asy ber bfg bin bma brf bsi cak coo fur gae igb iha iri jms kha klm klv krb ktm lag lot mad mga mki mmv mrw msg mtu ncm ngb ngk nhm nma ond pam par pba pkt pno sud tee tes tgh tgr tmn tna tot tsk wlf yur,60,76475,0.0007845701
93A,Position of Interrogative Phrases in Content Questions,,93,Matthew S. Dryer. 2013. Position of Interrogative Phrases in Content Questions. In: Dryer; Matthew S. & Haspelmath; Martin (eds.) 2013. The World Atlas of Language Structures Online. Leipzig: Max Planck Institute for Evolutionary Anthropology. (Available online at https://wals.info/chapter/93),2,aab abk abu abv acl acn adg adi adz aeg ain akh akn ala alk all amb ame amh aml amn amq anc ani anj anu any ao aoj apl apt apw arc arg arj arm aro arp arq arw asm ass ata ath au ava awi awp awt aym aze azi bag bai bar baw bbl bej bem bfi bgn bgo bgr bho bhu bii bir bkl bkn bku ble blx bmb bnk bod boj boq bra brh brm brn brp bsh bsq bto bud bug bum bur bya cah cai cax cct chc chg chk chn chs chv chw cic cmh cml cmn cmr cnt cop crn cro cti cup cze dag dan dgr dha din dio dja djm dlm dmi dmk dms don doy dre drm dul dum dun dyi efi egn eip erk err ewe ewo fij foe fur fut fye gal gap gar gbb gbs gdb geo ggu giz gmw goe gok gon grw gua gug guh guj gum gur guu gwa gyc hak ham hat haw heh hin hlp hma hmo hna hoa hop hua huc hui hum hun hup hya iau idu ifm igb ige igs ijo ina irq irr isa ite iwm izi jab jar jel jin jmo jms jng jpn jug juh juk jva kab kac kae kan kar kas kau kay kba kbw kel ker ket kew kgy kha khg khi khm khn khr khs kik kil kin kir kiw kkp kkt kkv klq kmb kmh kmj kmk kmn kmo kmz knc knd kni knk knn kob kol kor kos kqq krb krc krd kre kro krr krw ksg ksm ksn kta kty kum kun kuo kuu kuv kwo kwt kyk kyl kyr laa lab lad lag lah lai lal lan lao lav lbu lda ldu lel len lep lew lez lgt lho lim lin lis lkt lmb lmh lmn lmp lnd lon lot loz lug lun luo luv maa mab mad mag maj man mao map mas maw may mba mbi mbm mby mdl mea mee mei mer mey mga mgu mhi mie mik mis miz mka mkd mkg mlg mmw mna mnd mng mnm mns mon moo mor mou mpa mpt mpu mrg mrl mro mru msg msl mtu mum mun mup mus myi mym nad nag naj nam nan nas nav nax nbd nbm nbr ncm ndb ndi ndj ndo ndt ndu nep new ngb ngd ngk ngm ngn ngo ngt ngz nha nif nis niu niv nke nkn nko nma nnd nnk noc non noo nph ntj nua nue nun nwd nyk nza nze obg obo olo omi one ood orh oro orw osa owi oya paa pal pan par pat paw pdp per pkt plg pms pok pra pre prh prk prs psh pso pul pum pun qhu ram rao raw rem rji rny ron rot ruk rum rwa ryu sah sak sam san sap sar sav sdw sed sem ser sgb she shk shl shn sho sid sio skk sko skp skw sla slb sle slg sme sna sng snm snn snt sob som son spi sre sro sti stl sue suk sul sun svs swa syu tab tah tam tao tau tbl tbt tbw tel ten ter tet tgk tgl tgr tha thk thy tid tin tja tke tki tml tmo tna tnc tng tnn tny tou toz trb trm trw tsh tsi tsn ttn ttu tul tur tvt twe udh uhi una ung urd urt uru usa uzb vai vie vnm wah wak wal wap wat wbn wed wma wme wmu wol wom wrd wrg wsk wwa xas xbi xho xoo yal yaq yar ygr yid yko yns ytu yuc yur zan zaz zhn zul zzo,615,76475,0.008041844
71A,The Prohibitive,,71,Johan van der Auwera; Ludo Lejeune (Valentin Goussev). 2013. The Prohibitive. In: Dryer; Matthew S. & Haspelmath; Martin (eds.) 2013. The World Atlas of Language Structures Online. Leipzig: Max Planck Institute for Evolutionary Anthropology. (Available online at https://wals.info/chapter/71),1,ago akn apa apl au ayr azi bag bfg bii brs brz bsk bsq bur cay cnl coo cze die dja djp don dsh dut eka eng err eve far fre fri ger gwa ham hat hix iaa ice ido igb jab kew kis klm kob kpe krc lat lew lit lkt lnd lng lug mad mai mar mgo mon mum ndg ndy ngt nht nor npn obo pal pec pit pol ppi prs pso rap rsu rus rwa san scr shk sko slo sno so swe tet tir ton tpn tri tsh ttu tur tvo txj udh ukr uma urk uzb wao wap wic wra wrl wrm yag yng ypk yrm,113,76475,0.0014776071
8A,Lateral Consonants,,8,Ian Maddieson. 2013. Lateral Consonants. In: Dryer; Matthew S. & Haspelmath; Martin (eds.) 2013. The World Atlas of Language Structures Online. Leipzig: Max Planck Institute for Evolutionary Anthropology. (Available online at https://wals.info/chapter/8),2,abi abk acm aea aeg agh aiz alb ald alw ame amh amo amp amz ana anc ao arm arp ata awn aym aze bag bai baj bam baw bbf bco bee bej ben ber bet bir bis bki bkr bma bng bod bra brb brd bre brh brm brw bsk bsq bto bua bul bur byu cac cah cam cay cha che chl chq chu chv chw cil cle cnl cnt cso cti ctl dan dar ddf dgb dgr die din dio diy diz djp dni dnw don doy dre dts dum dyi eng eve evn ewe ewo fij fin fre ful fur fuz fye ga gbb ger ghb gla gmb goo grb grk grr gua gwa hak hau haw hba hin hmo hmr htc hun hve iba igb ign igs ijo ik imo ind ing ird irx iso ito iva jak jaq jav jeb jeh jng juh kad kas kay kch ked kef kek ker kfe kgi kgu kgz kha khr khs kkn kkv klm klv kly kmp kmu knd knm knr kob koi kom kor kot koy kpe krd kro kry kse ksg kss ktk kty kul kun kur kwa kws kya kyl kzy lad lah lak lan lat lav len lep lez lkk lkt llm lu lua lui luo maa mab mal map mar mau maz mba mbb mbm mei mgg mie mku mla mlk mme mnc mnd mne mog mpa mrl mrn mro mrt mss mum mun mxc mxm mya myi mzc nai nan nap nar nax nbk ndt ndy nep new nga ngi nhn nis niv nkt nnc nob non nor nti ntu nug nun nyg nyi ogb oji ond orh orm otm pac pae pec phl pit pms poa poh pol prs psm pso puk pur qaw qco ram rom rsc ruk rus rut sab san sba scs sdh seb sed sel sha skp slp sml snd snh som soq sor spa sre sui sup svs swa tab tag tam tel tgr tha tib tiw tks tlp tma tmn tmp tne toa tok tol ton try tsg ttn tug tuk tul tun tur tuv tza umb una ung uzn vie wah wam wap wch wdo wlf wma wmu woi wrd wrs wry wuc xoo yan yap yaq yay yct yel yes yid yim yko yny yor ytu yul yus zqc,388,76475,0.0050735534
111A,Nonperiphrastic Causative Constructions,,111,Jae Jung Song. 2013. Nonperiphrastic Causative Constructions. In: Dryer; Matthew S. & Haspelmath; Martin (eds.) 2013. The World Atlas of Language Structures Online. Leipzig: Max Planck Institute for Evolutionary Anthropology. (Available online at https://wals.info/chapter/111),2,abi abk ace aeg ain aji aly ame amh ana apu arm aro asm atc awn awp aym bab baj bal bam bej bkr bla bma brh brr brs bsq bur but cah car cax cct ceb cha chk chv cld cle cmn coa coo cor cre cui dgr die dio diy doy dre eng epe eve fij fin fut gar geo ger grb grw gua guj guu hai hau haw heb hin hix hmi hun hzb iaa igb ika ila ind ing irq jak jaq jpn kam kas kay kdz kem ket kew kfe kgu kha khm khs kin kio kis kls kmk knd knm knr kol kon kor kos krb krk krn kut kwa lad lan lat lav lep let lez lim lmp luv maa mab mac mak mal mao map mau mei men mhi mna mnm mns mny mrl mrt mss mwb mxc mym nbd nca ndo neh nez ngi ngl nht niu niv nko nti ntu nug nym oji ond orh orw pai pal pan pau pip pkn pny ppi prh prs psh psm pso pul pwn qim rap ret rot ruk rus sam saw sel shn shp shu sla sml snh snm son sor squ srn sun sup swa swt tab tag tah tel tim tiw tli tml tmr tna tng tno ton tsi tsw tuk tur tus tvl tzo uhi uli una urk usa ute uzb wam wat wch wic wma wol wra wrl yag yap yaq yel yid yko ykt ynk ypk yus yuw zul zun,254,76475,0.0033213468
82A,Order of Subject and Verb,,82,Matthew S. Dryer. 2013. Order of Subject and Verb. In: Dryer; Matthew S. & Haspelmath; Martin (eds.) 2013. The World Atlas of Language Structures Online. Leipzig: Max Planck Institute for Evolutionary Anthropology. (Available online at https://wals.info/chapter/82),3,ace alw amc any apl ara asy bac bae baj bbu bch bil bkr bla bln blr brs btk bul bwc cav cax cbo cea che cre ctl dhr djm don dre gid git gku gnn grj grk grr gum hup ita jam jeb klm krn kwk kws lac lat lml mac mdm meh men min miy moa moh mok mpo mpr mra msk mtt mut mxx mzh nau nez ngg ngl nha nht nne nug nym nyn pol ppi psm rit rwe shs siu sml snc spa swt tin tla tno tob tus tzu ute wai wam wic wik win wrd wrg wrl wrw yao ypk ywl zqs,110,76475,0.0014383786
41A,Distance Contrasts in Demonstratives,,41,Holger Diessel. 2013. Distance Contrasts in Demonstratives. In: Dryer; Matthew S. & Haspelmath; Martin (eds.) 2013. The World Atlas of Language Structures Online. Leipzig: Max Planck Institute for Evolutionary Anthropology. (Available online at https://wals.info/chapter/41),3,abn ace aco aly amb ame amp ani any apl brs bsq cha chk cle cmn cre don drg ewo fij fut geo grk grw gua haw hdi hix hlu hmo hua hzb ika iri jpn juh kbl ket khs klb klv kor kos kro krr kut lan lav lez lkt luo mao map mau may mok nan nko nti nug pau poh psm qhu rap sam snm spa swt tag tin ton tsh tuk tvl twn tzu uri urk war wat wra wrd ygr yid yim,88,76475,0.0011507028
112A,Negative Morphemes,,112,Matthew S. Dryer. 2013. Negative Morphemes. In: Dryer; Matthew S. & Haspelmath; Martin (eds.) 2013. The World Atlas of Language Structures Online. Leipzig: Max Planck Institute for Evolutionary Anthropology. (Available online at https://wals.info/chapter/112),5,arm dom dun gug ijo kmj krc kyr lav lho mkh mxx nas ngo oro pau pit pra tgl wat,21,76475,0.00027459953
42A,Pronominal and Adnominal Demonstratives,,42,Holger Diessel. 2013. Pronominal and Adnominal Demonstratives. In: Dryer; Matthew S. & Haspelmath; Martin (eds.) 2013. The World Atlas of Language Structures Online. Leipzig: Max Planck Institute for Evolutionary Anthropology. (Available online at https://wals.info/chapter/42),2,ain amb any arg bad bak bfg fre gua hlu irq kbl klb knm kok kor lan lav luo mam map mrg mul nan ndy ngz pnn poh so tng war wel wly wra ygr yko,37,76475,0.00048381824
16A,Weight Factors in Weight-Sensitive Stress Systems,,16,Rob Goedemans; Harry van der Hulst. 2013. Weight Factors in Weight-Sensitive Stress Systems. In: Dryer; Matthew S. & Haspelmath; Martin (eds.) 2013. The World Atlas of Language Structures Online. Leipzig: Max Planck Institute for Evolutionary Anthropology. (Available online at https://wals.info/chapter/16),1,acg agt aln alw aly ana ara aro arp atb awe awt aym bae bag bal baw bbm bbw bdm bej ben bik bim blk bma bna bnl bnt bqb bql bqn bqo bqr bqs bre bsk bto bua bug buu cav chk cle cmn cnl coo cpa cpn cre crn cup cya cyv cze daa dak dio diy dji dni dou dre dri dyi eno ese far fin frd gae geo gll glp grr gua gug guu heb hln hmu iaa ice ind ing irr jak jaq jum kal kam kap kaw kei kfe kgu khs kit kjn kjo kli klp kmu kob kon ksr kwa kya lan lat lav len liv lje lla lmp lrk luv mae mal map mar mau may mbb mcd mea min mis mks mku mms mna mnj mns mnt mnx mny moh mrd mta myi myn myy naj nbb nbo ngl ngr nht nia nin niv nju nkb nmb nne npu nsy nua nug olm ond ono orc pad pag pai pau pin pir pit pkm pkn plh plp pme pms pna pol ppi prs psh put qay qch qim que rap rit rnr rti sah sbg sdh sed sgr skl slp sly sml snm sno srb srd sro sup svk swa tab tac taj taw tbr teh tgk thp tiw tla tld tmc tor trd tru try tse tsi tua tuk tun tzo uhi uli uma urk uzn vot wah wan wao war wbn wch wel wer wet wlm wnb wra wrd wrl yel yim yir ymd yny ywl zqc zul zun,261,76475,0.00341288
14A,Fixed Stress Locations,,14,Rob Goedemans; Harry van der Hulst. 2013. Fixed Stress Locations. In: Dryer; Matthew S. & Haspelmath; Martin (eds.) 2013. The World Atlas of Language Structures Online. Leipzig: Max Planck Institute for Evolutionary Anthropology. (Available online at https://wals.info/chapter/14),7,ace asm bag bal baw bma bsk ccp cnl cya dni dri grw gua heb hln irr kal kaw kei khm khs kjn kmu lmp mac mar mrd mta nmb orc pkm prs qch que rnr sed shi skl sml taj tbb tru tsa tsi urk uzn wah war wer,51,76475,0.0006668846
70A,The Morphological Imperative,,70,Johan van der Auwera; Ludo Lejeune (Umarani Pappuswamy; Valentin Goussev). 2013. The Morphological Imperative. In: Dryer; Matthew S. & Haspelmath; Martin (eds.) 2013. The World Atlas of Language Structures Online. Leipzig: Max Planck Institute for Evolutionary Anthropology. (Available online at https://wals.info/chapter/70),1,abb abk acl aco acu adk aeg ala amh amr ana anl apl ard arg arm arp ars ath ava awp ayr azi bab bam bbw bdk bej bel bem ber bfg bma bre brh brz bsk bsq bud bul bur cah cak car cay ceb chj chv cld cle cmh cml cmn coi coo cor cre cyv cze dag dbd dgr die dig diz dmi dni dyi eka emb emc epe err est eve evn far fin fua fye gam gim glc gmz goj grk grw guj gum ham heb her hin hix hlu hmi hui igb ik iri irq jak jaq jeb kas ket kew khk kil kio kis kmk kmp kms knd knm knr koa kob kod koi krb krc krd krk kro krq kse kte kty kui kut kuv kwe kwr kws kyg lad lak lan lav laz lil lim lit lng lno loz luo luv mab mac mak mam man map mar mau mbg mcd mdn meh mgo mhu miy mle mlt mme mna mns moe mop mos mrd mrg mro msl mss mun mwe myi mym nan nap nbd nez nga nht niv nti ntn nub obo oix oka ood orh otm pan pau pip pms pol ppi prk psm pta pur qim qta ram ret rsu rus rwa scr sdw sgu shb shk shl shu slo sno snt so sou spa srd stn sue sug swa tag tau tbu tel tem ter tet tgr tir tiw tkl tml tms tna tnc tpn tsa tsh ttu tun tur tuv tvo tzo tzu udh udi ukr uld una uzb vai vot wap wau wch wel wic wlf wra wrd wrg wrk wwr yaq yim yko yng yny ypk yuk yur yus zaz zen zqc zqs zul,292,76475,0.0038182412
13A,Tone,,13,Ian Maddieson. 2013. Tone. In: Dryer; Matthew S. & Haspelmath; Martin (eds.) 2013. The World Atlas of Language Structures Online. Leipzig: Max Planck Institute for Evolutionary Anthropology. (Available online at https://wals.info/chapter/13),1,abk aea aeg aht akw ala alb alw ame amh amp amu ana api apu arb arc arm arp asm ata ava awp aym aze baj bco ben bis bki bkr bma bng brd bre brh brr brw bsk bsq bto bua bul bur byu cah cam car cax cck ccp cha chk chl chu chv cmn cnl coo cre ctl cyv dar ddf der dgr die dio diy djp dni dre dyi eng epe eve evn eya fij fin fre gan gar geo ger goo grk grr grw gua hai haw hba hin hix htc hum hun hup hzb iaa iba ika imo ind ing ird irr irx iva jak jaq jav jeb jeh jpr kab kas kay kch ked ket kfe kgu kgz kha khm khr khs kkn kkv klm klv kly kmp knd kng kob kor kot koy krb krd kry kty kun kut kwa kwk kws kya kzy lad lak lav len lez lkt lui lus mak mal mao map mar mau max may mbb mgg mku mlk mne mog mov mpa mrd mrn mrt mss mtp mun myi nai nap nep new nez nga ngi nhn nht nnc ntu nug nuu oji ood orm pac pae pai pau pit pms pnr poh pol prs psh puk pur qaw qco ram rap rom ror rsc rtk ruk rus sba scs sdh sed sel shi shk shu sml snc snh snm soq sor spa squ srn svs swa tab tac tag teh tel tgk tgr tiw toa tol ton tpa tru try tsg tsi tso ttn ttu tug tuk tul tur tuv tza ung urk usa uzn wam wao wap war wch wdo wic win wiy wlf wma wmu wnt woi wps wra wrd wry yan yap yar yaw ycn yel yes yid yim yko ykt yny ytu yuc yur yus zqc zun,307,76475,0.004014384
116A,Polar Questions,,116,Matthew S. Dryer. 2013. Polar Questions. In: Dryer; Matthew S. & Haspelmath; Martin (eds.) 2013. The World Atlas of Language Structures Online. Leipzig: Max Planck Institute for Evolutionary Anthropology. (Available online at https://wals.info/chapter/116),3,amh chg chn djp ika kas kgy mis mns mrd mro ong oro prh,15,76475,0.00019614253
17A,Rhythm Types,,17,Rob Goedemans; Harry van der Hulst. 2013. Rhythm Types. In: Dryer; Matthew S. & Haspelmath; Martin (eds.) 2013. The World Atlas of Language Structures Online. Leipzig: Max Planck Institute for Evolutionary Anthropology. (Available online at https://wals.info/chapter/17),5,agu aln ame arc ava awd bbm bbw ben bgv bnt bqb bqg bqh bql bqn bqo bqr bqz bsk bso bua chv coo ctl cub cya dak dhu dhw djr dob dou eka for gll god gor grb htc irq irr kal ker kew kfe kha kob kop ktn lat mah mal mar mcd mea mme mmo moh nbo obk olm ond oss pai pkm psh que rit rot rus scr sea sed sio skr sla slo sly sml squ sto swe swi tah tgk tsa tua tun tur war wiy woi yan yir ymd yzv,98,76475,0.0012814646
11A,Front Rounded Vowels,,11,Ian Maddieson. 2013. Front Rounded Vowels. In: Dryer; Matthew S. & Haspelmath; Martin (eds.) 2013. The World Atlas of Language Structures Online. Leipzig: Max Planck Institute for Evolutionary Anthropology. (Available online at https://wals.info/chapter/11),1,abi abk abm ach acm aco adk adz aea aeg agh aht ain aiz akn akw ala ald alw amc ame amh amo amp amu amz ana anc ani ant ao api apu arb arc arm arp asm ata ava awn awp aym bag bai baj bam baw bbf bco bee bej ben ber bet bir bis bki bkr bma bng bno bod bra brb brd brh bri brm brr brw bsq bto bua bul bur byu cac cad cah cam car cax cay cck ccp cha che chk chl chp chu chw cil cle cmn cnl cof coo cre cso cti ctl cub cve cyv dad dag dah dan dar ddf der det dgb die din dio diy diz djp dni dnw don doy dre dts dum dyi efi eka eng epe eve evn ewe ewo eya fas fef fij ful fur fye ga gan gar gbb gds geo ghb gla gmb goa goo grb grk grr grw gua gwa had hai hak ham hau haw hba hin hix hmo hmr hok htc hum hup hve hzb iba igb ign igs ijo ik ika imo ind ing ird irq irr irx iso ite ito iva iwm jak jaq jav jeb jeh jiv jng jom jpn jpr juh kab kad kal kas kay kch ked kef kek ker ket kew kfe kgu kha khm kho khr khs kio kiw kkn kkv kla klm klv kly kmp kmu knd kng knk knm knr koa kob koh koi kom kor kot koy kpa kpe krb krd krk kro kry kse ksg kss ktk kty kul kun kur kut kwa kwk kwo kws kya kyl kzy lad lah lak lam lan lat lav len lit lkk lkt llm lu lua lug lui luo lus luv maa mab mak mal mao map mar mau max may maz mba mbb mei mgg mie mku mla mne mog mor mov mpa mrd mrg mrl mrn mro mrt mss mtp mui mum mun mxc mxm mya myi mzc nai nan nap nar nas nav ndt ndy nep new nez ngi ngz nhn nht nim nis niv nko nkt nmb nnc nob non nti ntu nug nun nuu nyg nyi oca ogb oji ond ood orh orm otm pac pae pai pau paw pec phl pit pms pnr poa poh pol prh prs psh psm pso puk pur qaw qco qui ram rap res rom ror rsc rtk ruk rus rut sab san sba scs sdh sdw seb sed sha shi shk shs shu sin sla slp sml snc snd snh snm snt som soq sor spa squ sre srn sue sui sup svs swa tab tac tag tam teh tel ter tgk tgr tha tic tiw tks tli tma tmn tmp tne toa tok tol ton tru try tsg tsi tso ttn ttu tug tuk tul tun twn tza umb una ung urk usa uzn vie wah wam wao wap wch wdo wic win wiy wlf wma wmu wnt woi wps wra wrd wrs wry xoo yag yan yap yaq yar yaw yay ycn yct yel yes yey ygr yid yim yny yor yuc yul yur yus zan zqc zul zun,525,76475,0.0068649887
118A,Predicative Adjectives,,118,Leon Stassen. 2013. Predicative Adjectives. In: Dryer; Matthew S. & Haspelmath; Martin (eds.) 2013. The World Atlas of Language Structures Online. Leipzig: Max Planck Institute for Evolutionary Anthropology. (Available online at https://wals.info/chapter/118),1,abk abm abz ace aco ady agm ain aro bag bgo bik bla blx bma bod brm brr bto ccm ccp cct ceb cha chr cmr cnl coo cre cro din epe fij fni gar gdi gjj gll goa grb gua hcr hei hop hup iaa ik ilo ind jak jeb juh kab khm kic kio kko kls klv kpm krk kro ktl kwa kwk lah lao len lil lis lkt lnw mal mam mei men mie miz mka mnd mng moj mok mou mrl mut mwb nak nav nbb nca niu niv nuu ojs ond ood otr pai pap pau pir plh plr pna ptp rot sal sam sed sel sey siu sla snc snm squ sra sre sun tag tes tgk tha tiv tla tli tmr tna tng tno tpi tug tuk tus tzo tzu uby urk vie wap wlf wlo wol yaq yav yko yor yur zqc,151,76475,0.0019745014
