parameter_id,parameter_name,parameter_description,chapter_id,chapter_citation,value,same_value_language_ids,value_language_count,language_count_total,count_ratio
83A,Order of Object and Verb,,83,Matthew S. Dryer. 2013. Order of Object and Verb. In: Dryer; Matthew S. & Haspelmath; Martin (eds.) 2013. The World Atlas of Language Structures Online. Leipzig: Max Planck Institute for Evolutionary Anthropology. (Available online at https://wals.info/chapter/83),2,aab abi abu acg acl acm adi adz aeg agb agc agd agh aja akn alb alk aln als ama ami aml amo amq amr ams anc ane anj ann anu aoj ara arg ari arj aro arp arq asy ata au avk ayi ayo ayr ayw bab bae baf bag bai baj bak baq bar bas bbl bbu bch bco bdu ber bfg bgo bgr bgs bgz bid big bii bik bil bir bka bkl bkr bku bla ble blg blu blz bma bmb bni bnk bnn bob bol bra bre brf brn brq brr bse bsh btk bto bub bud bug bul bum buu buy bvi bwc cak cax cba ccm cea ceb cem cga cha chj chq chr chw chx cic ckl cle cme cmx cmy cnt coc coe cop cor cos cpl cqt cre crn cso ctl cua cuc cya cyv cze day deg dga dgb did dio dma dok dom don doy dre dsh dua duk ebi ega egn eko eng eno erk err esm est ewe ewo fij fin fon fre fua fut fye ga gae gbb gbs gel gir giz gjj gla gmz gnb gnd goa goe gok grb grf grk grr gto gua gud gul guw gwo hak hal hat hau haw hdi heb heh hei hem hil hlu hmo hna hnd hoa hol htc huc hun hve hya iaa iba ice ifm ifu igb ige ign igs ik ila ilo ind iqu iri irr ita ito iwa ixi izi jab jak jar jmo juh juk kad kam kan kar kas kau kba kbl kbw kby kch kdw kdz kel ken ker kfe kga kgr khm khn khs kik kil kin kir kje kkt kkv kla kls klv kmj kmu kni knk koe kom kon kos kpm kpw krb kre kri kro ksg ksm ksn ktc kte ktl kuo kut kwa kwk kwn kwy kyl kyq kzy laa lab lac lag lan lao lat lbu ldo leb leg lel len let lew lgi lgu lic lil lin lit llm lmg lmh lmp lmu lnd lon lou luc luo luv ma maa mae maj mak mal mam mao map mas mau may mba mbe mbi mbl mbm mbr mbt mby mcd mch mcv mda mdg mdm mdo mds mdw mea mee meh mga mgk mgo mgu mhu mie miy mkd mkq mkz mla mlg mlm mlu mmb mmn mmv mna mnd mng moe mof mok mon moo mor mos mov mpo mpr mpu mrg mrl mro mrq mrt msk msm msq mtb mua mum mup mur mus mut mwb mwe mwo mxc mxe mxj mxo mxp mxy myg myn mzc nak nal nan nau nbe nbm nca ncm ndb ndi ndo ndr ndt ndu ndy neh ngd ngm ngo ngu ngw ngz nhh nhm nhn nht nia nif niu nke nkn nko nnc nne nng non noo nor nse nsg nto nua nun nup nuu nym nyn nza obg obo ocu oji olo ond one ood ora otm otr paa pai pal pam pat per pga pip pkn pkt plg plh plk pms png pnn pnu pod pog poh pol por pre psm psw pul pur qui qum rag rap rga rim rny rom ron rot rov rru rsu ruk rus rwe sah sak sal sam san sap scr sea seb sed see ses sgb sgl sgu sha shl shm shn shp shs sht shu sim sio sir sis siu skm sku sle slo sml smp sno so sob son spa squ srd sre ssa sti stn sud sul sun swa swe swt tab taf tag tah tai tal tan tat tbo tbw tee ten teo tep ter tes tet tgh tgk tgn tha tho tia tid tim tin tiv tiw tke tki tla tlp tmm tmn tmr tna tne tng tnk tno tob toz tpn tpr tps tri trm tsg tsi tsk tsr ttd ttn tuk tum txj tzo tzu ukr uld uli ura url urt ven vie vnm wal wam war wch wec wel wem wlf wlo wma wol wrb wrk wrm wrn wry wth wwa wya xam xar xbi xho xoo yag yao yap yay ycn yin yng yok yor yul ywl zai zan zap zch zhn zpr zqc zqo zqs zul zya zzo,705,76475,0.009218699
52A,Comitatives and Instrumentals,,52,Thomas Stolz; Cornelia Stroh; Aina Urdze. 2013. Comitatives and Instrumentals. In: Dryer; Matthew S. & Haspelmath; Martin (eds.) 2013. The World Atlas of Language Structures Online. Leipzig: Max Planck Institute for Evolutionary Anthropology. (Available online at https://wals.info/chapter/52),2,abk acg aco aeg agt ain ala aly ame arg arm arp arr auy ava bag bah bis bla bma bnm bou brh bsq bur car cem chk cmh cmn cog com cor crg dah dam des dgr dmi dni dre dug efi ena eve evn fij fin fni gds gnn goa gol gon goo grj grw gua gum guu hin hix ho hua hui hup hve hzb imo ite jak jpn kam kat kay kha khm khr khs kin klv knd kng knm knr koa kob koi kor krk kro kry ktt kur kwe kwm kxo lad lah lak laz les lez lim lkt lug lui luo mah mao map maw mei mgg mjk mlt mmv mnc mnd mne moa mrd mrg mrt mrw msh mun mup myi myo nah nan nav ngi niv nkr nmi nob nti nwd nya orh ots pae pai pal per pia pol ppi prh psj pur qaw qch rap sam shn siu sla slb slp so som ssh swa syu tag tah tau tbs tbu tel tha tin tke tli tml tng toq tri trr tru tug tup txj uby udi uhi una urd urk usr vai ven wan way wch win wra wrg wrw wsk yaq yel yir yko ykt yor ypk yuk zch,213,76475,0.002785224
57A,Position of Pronominal Possessive Affixes,,57,Matthew S. Dryer. 2013. Position of Pronominal Possessive Affixes. In: Dryer; Matthew S. & Haspelmath; Martin (eds.) 2013. The World Atlas of Language Structures Online. Leipzig: Max Planck Institute for Evolutionary Anthropology. (Available online at https://wals.info/chapter/57),2,acl acu aeg agc ajg ale alk alw aly ama ame amh aml amo amp amr ams anc ane anj ann arg ari arm aro arq arw asy aym aze azi bag bak bau bbu bch bco bej ber bfg bgo bgr bia bid big bik bkr blg bma bmr bnn bre brf brh brn bsi bsk btk bto bud but bvi bwc cai cem cha chh chv cld cmh cmy dag dgo dgr did din dio dom doy dre ene eno erk esm eve evn ewe fij fin fua fut fye gbb gbs gel giz gku gln gmw gmz gok goo grs grw gud hal hau hdi heb hhu hlu hoa hun iaa igs ila irq jab jaq jar jeb jlu kad kam kar kau kbu ken ker kga kgz kha khl kkp kkt kkv klv kmk kmn kmo kms knm knr kop kos krb krc krd kre krr ktl kty kut kwk kwn kws kxo kyq laa lag lar lbu lda lel len lew lgu lil lmg lmh lon lou lul luo luv ma mbr mbt mby mdg mdm mee mgu mig mis miy mke mkh mkl mko mku mlg mme mmi mmw mna mng mnm mns mnt mnv moa moe mok mor mou mra mrg mrl mro mrt msl msm msn mss mtu mud mun mur mus mwo mxj mxp myi mzc mzh nab naj nak nan ndo neh nga ngl ngm ngn ngz nha nia nnk nog noo nsg nti ntj ntu nue nza oir ong ord ork paa pal par per pkn pkt pms pod poh pre psw pul pur qhu qui rag ras rit rov ruk rwa saa sak seb sen shi shl shm sht sia sio sis siu skp slb slp sng sno so sob sod som son sta stl swa syu tai tak tan tba tbo tbu teo ter tgk tgr tia tig tin tkl tla tlp tmc tno toz trm tsi tsk tum tur tuv tvo udm uli ute uyg uzb vnm wah war wat wed wem wlf wlo wol wrb wth xar yap yko ykt yng ypk yul zag zai zan zap zen zzo,355,76475,0.00464204
143A,Order of Negative Morpheme and Verb,,143,Matthew S. Dryer. 2013. Order of Negative Morpheme and Verb. In: Dryer; Matthew S. & Haspelmath; Martin (eds.) 2013. The World Atlas of Language Structures Online. Leipzig: Max Planck Institute for Evolutionary Anthropology. (Available online at https://wals.info/chapter/143),7,arm arw kmj maa mra nad pra zqc,9,76475,0.000117685515
19A,Presence of Uncommon Consonants,,19,Ian Maddieson. 2013. Presence of Uncommon Consonants. In: Dryer; Matthew S. & Haspelmath; Martin (eds.) 2013. The World Atlas of Language Structures Online. Leipzig: Max Planck Institute for Evolutionary Anthropology. (Available online at https://wals.info/chapter/19),4,abk aeg arc ata ava bma bra hzb ing irq krd lak nuu rut som soq squ tgr tma ttu,21,76475,0.00027459953
26A,Prefixing vs. Suffixing in Inflectional Morphology,,26,Matthew S. Dryer. 2013. Prefixing vs. Suffixing in Inflectional Morphology. In: Dryer; Matthew S. & Haspelmath; Martin (eds.) 2013. The World Atlas of Language Structures Online. Leipzig: Max Planck Institute for Evolutionary Anthropology. (Available online at https://wals.info/chapter/26),5,adi amo amq aoj arp au bar bbu bbw bfg bgo bgr bik bla bnn brf brp bua cam che ckl cop cyv die eno erk gnn goo gyc hup idn kan kbw ket kkv kls klv kmj kmz kro ksa ktc lar lbu len lew lkt lmh lon lug maa mam mau mba mea mmv moh mra mro msn mxp nhm nua nyu nza ond otm otr pal pam pga pms ras sak sng src srn swa taw tbo tee tgh tja tmn tno tou tuk tus urk wal wic wrw xav,94,76475,0.0012291599
88A,Order of Demonstrative and Noun,,88,Matthew S. Dryer. 2013. Order of Demonstrative and Noun. In: Dryer; Matthew S. & Haspelmath; Martin (eds.) 2013. The World Atlas of Language Structures Online. Leipzig: Max Planck Institute for Evolutionary Anthropology. (Available online at https://wals.info/chapter/88),4,agc any ber big brn din gud igs ik klw lag mba mbt mdn mee mno mnv moo msk mur mxp nan pkt seb som tao ton,28,76475,0.00036613274
2A,Vowel Quality Inventories,,2,Ian Maddieson. 2013. Vowel Quality Inventories. In: Dryer; Matthew S. & Haspelmath; Martin (eds.) 2013. The World Atlas of Language Structures Online. Leipzig: Max Planck Institute for Evolutionary Anthropology. (Available online at https://wals.info/chapter/2),1,abk abm adz aea alw amc amp amu ana awp aym bco bma brd byu cad cah cax cay cck ccp chl chu cre diy djp dyi eya gds goo grr grw hai hup ign iva jaq jeb jiv kab kay kgu klm koa kut kya lak lus mal maz mbb mpa mrg mrn mrt nav new ngi nhn nug nuu oji ond pae pai pau pit prh qaw qui ram ruk sel shk shs squ tac teh tiw tli tpa tsg tsi wam wdo wic wps yes yid yim yny yus,93,76475,0.0012160836
51A,Position of Case Affixes,,51,Matthew S. Dryer. 2013. Position of Case Affixes. In: Dryer; Matthew S. & Haspelmath; Martin (eds.) 2013. The World Atlas of Language Structures Online. Leipzig: Max Planck Institute for Evolutionary Anthropology. (Available online at https://wals.info/chapter/51),2,bfg bma brf bua chx cua eno erk gap grg hnd kan kls kro lbu luc may mra mwo ndb ndo nia non ocu pra shu tal tee tep tes tkl tmr toz tsk xho zap zul,38,76475,0.0004968944
