parameter_id,parameter_name,parameter_description,chapter_id,chapter_citation,value,same_value_language_ids,value_language_count,language_count_total,count_ratio
16A,Weight Factors in Weight-Sensitive Stress Systems,,16,Rob Goedemans; Harry van der Hulst. 2013. Weight Factors in Weight-Sensitive Stress Systems. In: Dryer; Matthew S. & Haspelmath; Martin (eds.) 2013. The World Atlas of Language Structures Online. Leipzig: Max Planck Institute for Evolutionary Anthropology. (Available online at https://wals.info/chapter/16),2,agu apu arg bgg bui bwa dhu dhw djr epe est eve fij gid haw htc hun hzb iri irm kha koa kop krk kuu kws lar let lui mah mai mak mao men mme mrk mrl mrs mrt mrw mym nep ngi oss oto plb ror rot sea ser sio skp tah tib tlo tng tsh ung wam wlo yid yin ysl yuw,65,76475,0.00084995094
27A,Reduplication,,27,Carl Rubino. 2013. Reduplication. In: Dryer; Matthew S. & Haspelmath; Martin (eds.) 2013. The World Atlas of Language Structures Online. Leipzig: Max Planck Institute for Evolutionary Anthropology. (Available online at https://wals.info/chapter/27),1,abk abm aeg agc akn ala alw aly ame amh amp api apl arp asm ass asy aym baj bal bco bej bis bkl blq blx bma bnj bsm bsq buw cah cax cba cck cct cha chh chk chl chr cin cla cmk cmn cmx cnl coe col coo cos cre cuu cwe cyv dag dah dga dhm diy dji djp djr dre dri dyi epe ewe fox fua gar geo goo gum ham hau haw heb hil hin hlp hlu hmo hop hrr htc hui hun hzb iaa igb ilo itz jak jaq kay kha khm kho khs kik kjn kkv klm kls klv kma knd knr koa kol koo kor koy kpm krb krk krw kuo kwk kya lac lav lil lkt lmp lrd lui lus luv maj mal mao mar mau maw may mcs mdr mei men min miy mki mks mlk mmb mnd mnm mok moo mos mpa mra mrq msh muh myi nak nau ndb nde ndy nez ngi ngk ngl nhc nia nkr nnc nug nuu nyn ojs oka olo ood orh oro pac pai pan pau pgl pip pms pnn poh prs psh pul put qay qui rit rmb rnd rny rot ruk sam sed ses shp shu siu sml som spo squ srn sro sry sst stl sun swa swi swt tag tgk tgr tha tho thw tid tig til tim tin tiw tja tkm tlp tml tmr tng toj tru tsg tsi tso tuk tur tuv twa tze tzo uhi ung uyg vie war was wat wik wmu wrd wrk wrl wry wsk wwy xho yaq yct yid yim yin yir yny yor yuc yuk yur ywl,278,76475,0.0036351748
106A,Reciprocal Constructions,,106,Elena Maslova; Vladimir P. Nedjalkov. 2013. Reciprocal Constructions. In: Dryer; Matthew S. & Haspelmath; Martin (eds.) 2013. The World Atlas of Language Structures Online. Leipzig: Max Planck Institute for Evolutionary Anthropology. (Available online at https://wals.info/chapter/106),2,abk acg aeg ain amu anc apu asm bag bam bma bsq bur but cea cha chk cnt csh eng eve evn fij fin fue gbb geo goa grb gua hau hin hmo ign ind ite jpn jva kab kay kgz kha kho knd koa kor krc krk kse kut kyp lkt lrd lye mal mei mku mnd mne mno mrt mun nel ngi niv nko nom nug ojm orh pir prs pso qbo qcu sla snm swa tag tce tha tiw tml tuc tuk tur tuv vie wgu win wur xok ygd yko ykt ytu yuk zul,99,76475,0.0012945407
15A,Weight-Sensitive Stress,,15,Rob Goedemans; Harry van der Hulst. 2013. Weight-Sensitive Stress. In: Dryer; Matthew S. & Haspelmath; Martin (eds.) 2013. The World Atlas of Language Structures Online. Leipzig: Max Planck Institute for Evolutionary Anthropology. (Available online at https://wals.info/chapter/15),8,ace acg agt aln alw aly ana ara aro arp asm atb awe awt aym bae bag bal baw bbm bbw bdm ben bik bim blk bma bnl bnt bqb bql bqn bqo bqr bqs bre bsk bto bua bug buu cah cav chk cmn cnl cpn cre crn cup cya cyv cze daa dak dio diy dji dni dob dou dre dri dyi eno ese est far fin frd gae geo gid gll glp goo grk grr grw gua gug guu haw heb hln hmu hnn hun iaa ice ind ing iri irr jak jaq jum kal kam kap kaw kay kei kfe kgu khm khs kjn kjo kli klp kmu kob kon koo koy krl ksr kut kwa kya lan lat lav len liv lje lla lmp lrk luv mac mae mal map mar mau may mbb mcd mgd min mis mks mku mms mna mnj mns mnt mnx mny moh mrd mrt mta myi myn myy naj nbb nbo ngl ngr nht nia nin niv nju nkb nmb nne npu nsy ntu nua nug olm ond ono orc pad pag pai pau pin pir pit pkm pkn plh plp pme pms pna pol ppi prs pur put qay qch qim que rap rit rnr rti sah sbg sed sgr shi skl slp sly sml snm sno squ srb sro sto sup svk swa tab tac tag taj tas taw tbr teh tgk thp tiw tla tld tmc tor trd tru try tsa tse tsi tua tuk tun tzo uhi uma urk uzn vot wah wan wao war wbn wch wel wer wet wlm wnb wra wrd wrl yaq yel yim yir ymd yny ywl zqc zul zun,281,76475,0.0036744033
9A,The Velar Nasal,,9,Gregory D.S. Anderson. 2013. The Velar Nasal. In: Dryer; Matthew S. & Haspelmath; Martin (eds.) 2013. The World Atlas of Language Structures Online. Leipzig: Max Planck Institute for Evolutionary Anthropology. (Available online at https://wals.info/chapter/9),2,agr amn aso ats awn bsk bur but cah cly cmh cri dgr dni eng fin gar ger grw hlp hmi hmo iql jiv juh kaz ket kfe kgz kha khk khm kiq kkp kmk kob kor krc krd krm kty kuo kuq kym lrk mcs mgg mid mnd mns mog mss mun mwn nog nok olo pno psh put rwa shr skp slr sol sss sta syg tex tkm tlb tof ttb tuv tvo twx una urk urm ute uyg uzb ykt ysi yug zqc,87,76475,0.0011376267
14A,Fixed Stress Locations,,14,Rob Goedemans; Harry van der Hulst. 2013. Fixed Stress Locations. In: Dryer; Matthew S. & Haspelmath; Martin (eds.) 2013. The World Atlas of Language Structures Online. Leipzig: Max Planck Institute for Evolutionary Anthropology. (Available online at https://wals.info/chapter/14),7,ace asm bag bal baw bma bsk ccp cnl cya dni dri grw gua heb hln irr kal kaw kei khm khs kjn kmu lmp mac mar mrd mta nmb orc pkm prs qch que rnr sed shi skl sml taj tas tru tsa tsi urk uzn wah war wer,51,76475,0.0006668846
17A,Rhythm Types,,17,Rob Goedemans; Harry van der Hulst. 2013. Rhythm Types. In: Dryer; Matthew S. & Haspelmath; Martin (eds.) 2013. The World Atlas of Language Structures Online. Leipzig: Max Planck Institute for Evolutionary Anthropology. (Available online at https://wals.info/chapter/17),1,abe ace aeg agt aly apa apu ara arv asy awe awt bdm bkl blk bna bto bur cah cap cav cmn cre crn cyv cze diy dji dni dre dri dut dyi eng ese est fij fin gay geo ger goo grk grr gug guu haw heb hun iaa ice iga ind jaq kaj kay kei kgu kjo klm kon krl ksr kut kuu kya lar lav len let liv luv mai mau may mdm mku mlc mlk mna mne mnj mnm mns mny mrs mrt mrw mss mta myi myy ngi ngl ngr nin nju nkb nne ntu nua nug nya ono pin pir pit pkn pol ppi ram rti skp slp snm sno snt spa srb sru svk tab tac tag taw tgw tiw tmc tng tns tps try tsh tuk uzn vot wam wan wao wch wlm wra wrd wrg wrl yaq yel yim yin yny zqc zul,153,76475,0.0020006539
