parameter_id,parameter_name,parameter_description,chapter_id,chapter_citation,value,same_value_language_ids,value_language_count,language_count_total,count_ratio
130A,Finger and Hand,,130,Cecil H. Brown. 2013. Finger and Hand. In: Dryer; Matthew S. & Haspelmath; Martin (eds.) 2013. The World Atlas of Language Structures Online. Leipzig: Max Planck Institute for Evolutionary Anthropology. (Available online at https://wals.info/chapter/130),2,abi abk abm abw acg acm acu afr agr aht akr ale alg amh amk amr amu apc api apj ara aro arw arx atq ats awa awp aym ayo aze bab bae bam bca bem bgr bkd bkl bla blj blr blx bno bnq bnv bok bor bpb brc bre brs bsq btk bur but cab cac cai cak cam cap car cas cat cav cax cay cch cck cct ceb cec cha che chi chj chl cho chp chr chu chw cin cla clc cle cma cmh cmn cmy cnl cnt cof cog col cor cpa cre crg crk crl crn cro crp crq crt csf csh csk ctc ctl ctt ctw cub cui cur cut cuu cyn cze dak dam dca des dgx dig djp dre dsh dut efi eka emb ena eng ese eve eya fij fin for fox fre fut gad gae geo ger ghb gid git gjj gku gmb gna gno goa gre grk grm gto gua gul guu gyb hai hau heb hid hil hmb hmd hmi hmu hop hpd htc hui hum hun hve ifu igb ik ika ill ilo ind iql iri ita itw itz ixc ixi jak jeh jmo jpn juh kas kat kaz kdg kdz kea kek kew kfe kgt kgz kha khg khk kic kio kis kje kky klm klw klz kmh kmk knc knd kng knr koa kon kor kos kpn krc kro ktb kth ktu kul kun kuq kut kwa kwe kws kyn lao lau len lez lit lnw lui lus mab mai mal mao map maz mby mcg mch mcn mco mcs mcv men mer mgg mhc mhi mic mid mij mis miz mjc mkb mnc mnd mne moc mog moj mok mop mos mov mpy mrt mse msh mss mtg mti mtp mtt mui mum mup mut muy mwb mwl mxg mxu myi mym myo myr mzc nas nbd nbr nep ngn nht nhu nhx niu nju nko nkr nlu nne nnm nog nom nor npa nro nsk nsn nsz ntj nuk nun nuu nya nym oca oji oka oko olu ood ore osa osm owc pae pal pan pcm pem per pia pip pir pla pme pnn pno poh pol por pow ppc prt psj psm psv pui pul pur qan qaw qca qch qec rad ram rap res ret rgn rng rnn rom rus sal sam say sba scr sea sec sed sel shk shl shn sho shu shw sin sla slv smj smt snh sno sol son spa spo squ sri sss stl sum sus sva svk swa tac tag tar tbe tce teh tga tha tib tic tkm tlf tlp tml tna tnb tnj tnl toa tob toj tol tos tpa tpt trb trc tsf tsg tsh tsi tsj tsw tty tub tuc tup tur tus tut tuy tvo twn txj tze tzo tzt udh uhi ukr ute uzb ved wap way wch wel wem wic wir wiy wmu wol wra wrd wth wwr xar xer xoo yah yak yap yar yav ycn yct yki ypk yrt yus yyo zai zaj zam zap zfl zqc zqr zqs zul zun zzo,521,76475,0.006812684
120A,Zero Copula for Predicate Nominals,,120,Leon Stassen. 2013. Zero Copula for Predicate Nominals. In: Dryer; Matthew S. & Haspelmath; Martin (eds.) 2013. The World Atlas of Language Structures Online. Leipzig: Max Planck Institute for Evolutionary Anthropology. (Available online at https://wals.info/chapter/120),1,abk abz acm aco ady ain akn ala alb amh apl arc arm ava awp bab bam bar bej bik bla blc bln blx bre bri brs bsq bto bul bur but cah ccm ccp cct ceb cha chc che chk cmr coo cre cro cso dag dgb din dut eng est ewe fij fin fre gae gar gbb gdi geo god gol grb grk grn grw hau hcr hei hin hmr hui hup hzb iaa ice igb ilo iri jak jpn juh kab kbl ket kho khs kic kio kko kku kls knk kor kpe kpm krk kro ksm kur kwk lad lao laz lep lez lil lis lkt lnd lnw maa mal mam map maw mei men mis miz mka mnc mnd moe moj moo mrd mrl mtu mun mut mwb mxp mym nav nbb nbh nca nep nez ngi ngz nht nko nue nup nuu ond ood otm otr pai pap pir pms pna prd prs pwn ras rka rom scr sel sey shn siu sla smt snc spa squ sra sup swa swe tag tep tes tgr tiv tli tne tno tur tus tvo tzo tzu uby vai vot wap wau wch wel wic wlf yav yim yko ykt yor zai zan zar zaz zqc zul,211,76475,0.0027590715
127A,Reason Clauses,,127,Sonia Cristofaro. 2013. Reason Clauses. In: Dryer; Matthew S. & Haspelmath; Martin (eds.) 2013. The World Atlas of Language Structures Online. Leipzig: Max Planck Institute for Evolutionary Anthropology. (Available online at https://wals.info/chapter/127),1,abu ace ain ame any apu bkr brh bur cha cle cnl dre emb epe ewe fij fua geo ger grk gua hau heb hmo hun ika imo ind jpn juh kan kay kew kfe kho khs klv knr kor krb kro lan lkt lnd mal mao may miy mku mna mnd mok mxc myi ndy nht noo npi nti nun orh otm pai per prh prs san sla sml sng som sup tab tin tiw tru tuk tzu ung urk vie wam wma wra wrd yaq yim yor,90,76475,0.0011768552
118A,Predicative Adjectives,,118,Leon Stassen. 2013. Predicative Adjectives. In: Dryer; Matthew S. & Haspelmath; Martin (eds.) 2013. The World Atlas of Language Structures Online. Leipzig: Max Planck Institute for Evolutionary Anthropology. (Available online at https://wals.info/chapter/118),1,abk abm abz ace aco ady agm ain aro bag bgo bik bla blx bma bod brm brr bto ccm ccp cct ceb cha chr cmr cnl coo cre cro din epe fij fni gar gdi gjj gll goa grb gua hcr hei hop hup iaa ik ilo ind jak jeb juh kab khm kic kio kko kls klv kpm krk kro ktl kwa kwk lah lao len lil lis lkt lnw mal mam mei men mie miz mka mnd mng moj mok mou mrl mut mwb nak nav nbb nca niu niv nuu ojs ond ood otr pai pap pau pir plh plr pna ptp rot sal sam sed sel sey siu sla snc snm squ sra sre sun tag tas tes tgk tha tiv tla tli tmr tna tng tno tug tuk tus tzo tzu uby urk vie wap wlf wlo wol yaq yav yko yor yur zqc,151,76475,0.0019745014
129A,Hand and Arm,,129,Cecil H. Brown. 2013. Hand and Arm. In: Dryer; Matthew S. & Haspelmath; Martin (eds.) 2013. The World Atlas of Language Structures Online. Leipzig: Max Planck Institute for Evolutionary Anthropology. (Available online at https://wals.info/chapter/129),1,ain amh amr apj apw aro arw arx awa aym ayn aze bam bgr bla blj blr bnq brc btk cab cah cak car cay cch cck ccp cha chj chl cho chr chw cin cmc cmy cof col cor crl csf csk ctt ctw cuu cyn cze dam dca die efi eka ena eud for fut gad geo git gku grm gul hau haw hop hui ifu igb ika ilo itw itz ixi jak jeh jmo jpn kat kaz kdz kea kfe kha khg khk khm kio kis kje kky klw kmh kmk knr kon kos kpn kro ktb kuq kwa kwe lau len lez lit lnw lui mab mai mao maz mby mer mgg mhi mid mij mnc moj mok mop mos mse msh mtp mum mup muy mwb mxg mxu mym nas nbd ngz nht niu nkr nnm nog nom npa nsz nym obg oka oko olu ood ore osm pac pae pal per poh prt pul pur qch qui rad ram rgn rng rnn rus sam say scr sed ser shn shu sin smj smt snh sno sol son squ stl sus svk swa tah tbe tce tga tib tkm tlp tml tna tnj toa toj tsf tua tuc tvo tze tzo tzt udh ukr uzb ved wol xoo yak yap yar yav yct ygr ykp ylb zai zaj zam zfl zun zzo,228,76475,0.0029813664
36A,The Associative Plural,,36,Michael Daniel; Edith Moravcsik. 2013. The Associative Plural. In: Dryer; Matthew S. & Haspelmath; Martin (eds.) 2013. The World Atlas of Language Structures Online. Leipzig: Max Planck Institute for Evolutionary Anthropology. (Available online at https://wals.info/chapter/36),1,agl ain akn alu ana apl awt bam bdc bel bgv bnd brm bsk cha chk chn chv cmn cri dni eve ewe fma fua gag gar gbb goo hay hix jcr jpn kab kaz kha khk klg kls knr kop kor kpe kro kry kse kty kuq kyn kzy lah lak lda lep lez lim lma lok lug luv mag mak mal mbu mcr mdk mmb mnc mrg mup mym nai nep new nga ngg ngi nia niv nob nwd oss pan pap pol rut san ses snh tar tkl tms tof tuc tur udh udm urk uyg uzb wch yor zul,104,76475,0.0013599215
53A,Ordinal Numerals,,53,Thomas Stolz; Ljuba N. Veselinova. 2013. Ordinal Numerals. In: Dryer; Matthew S. & Haspelmath; Martin (eds.) 2013. The World Atlas of Language Structures Online. Leipzig: Max Planck Institute for Evolutionary Anthropology. (Available online at https://wals.info/chapter/53),4,ava bsk car cem chv cnt cor hop hzb jpn kaz kgz khm kmk kod kor kug kwr lez mao mlc mnd msh mup otm pai per som srd tin tkm tsa tuv tvo txj una uyg uzb yaq yor,41,76475,0.00053612294
119A,Nominal and Locational Predication,,119,Leon Stassen. 2013. Nominal and Locational Predication. In: Dryer; Matthew S. & Haspelmath; Martin (eds.) 2013. The World Atlas of Language Structures Online. Leipzig: Max Planck Institute for Evolutionary Anthropology. (Available online at https://wals.info/chapter/119),1,abk abm abz ace acl acm aco ady agm ain akn ala ame aro arp awt baa bag bam bar bgo bik bla blx bma bod bri brj brm brr bsq bto bui cah ccm cct ceb cha che chk chr cmh cmr cnl coo cop cre cro cso dab dgb din diz dmi dyi epe ewe fij fni for frd gae gar gbb gdi gjj gll goa gol grb grn grw gua gud gum guu hau hcr hei hmr hop hui iaa igb ik ilo imo ind iri irq iwa jab jak jeb jpn kab kat kbl ket kew kgu khm kho khs kic kio kko kls klv knk knm knr kor kpe kpm krk kro ksm kta ktl kur kwa kwk lad lah lao len lep lez lil lis lkt lnd lnw lon luo maa mal mam mao map mau maw mei men mie miz mka mku mlk mnc mnd mng mnm mok moo mou mrg mrl mtu mun mut mwb mxp mym nak nar nas nav nbb nbh nca ndi nep ngz niu niv nue nup nuu ojs ond ood otm otr pai pap pau pir pit plh plr pms pna pop prd ptp ras rem rot rti sal sam sed sel sey shl siu sla snc sng snh snt som sor spa squ sra sre sun sup tag tah tas tbu tep tes tgk tha tiv tiw tla tmr tna tne tng tno tot tsh tug tuk tup tus tzo tzu uby uhi urk vai vie wap wch wel wlf wlo wol wrp wsk yaq yim yko yor yur yuw zai zan zar zqc,269,76475,0.0035174894
67A,The Future Tense,,67,Östen Dahl; Viveka Velupillai. 2013. The Future Tense. In: Dryer; Matthew S. & Haspelmath; Martin (eds.) 2013. The World Atlas of Language Structures Online. Leipzig: Max Planck Institute for Evolutionary Anthropology. (Available online at https://wals.info/chapter/67),2,abi aco afr ain amh ana arm atc atu avo bag bar bej bma brh brm brs bul but ceb cha cnl cnt cre cuu did eng fij fin ger grk hau haw hix hmo hun hwc ice ind ise jak jav jpn juh ket kfc kha khm kho kik kmu kor kro kse kya lah lai lan lao lkt mak mal man mao may mei mlt mnd mtu myi nak nbr nca ood orh pai plg por prh prs qco rap raw ren rom rus san ses shu sml snm sun sup swe tah tga tgr tha tny toj uyg vie war wlf wor wra yag yct yor zqc zun,112,76475,0.001464531
125A,Purpose Clauses,,125,Sonia Cristofaro. 2013. Purpose Clauses. In: Dryer; Matthew S. & Haspelmath; Martin (eds.) 2013. The World Atlas of Language Structures Online. Leipzig: Max Planck Institute for Evolutionary Anthropology. (Available online at https://wals.info/chapter/125),1,ace ain arp bkr cle dre fij gua hmo ind juh kay kho klv kmu kor lkt lnd mal may mku mna mnd mxc nun pai saw sla sml som tab tin vie war wma yaq yor,38,76475,0.0004968944
68A,The Perfect,,68,Östen Dahl; Viveka Velupillai. 2013. The Perfect. In: Dryer; Matthew S. & Haspelmath; Martin (eds.) 2013. The World Atlas of Language Structures Online. Leipzig: Max Planck Institute for Evolutionary Anthropology. (Available online at https://wals.info/chapter/68),4,abi aco aeg ain ala alw ana apu arp atc atu avo awp bag bma bnj brs cbo ceb cha chk cnl cre cuu cyn dag did dio dni ewe geo goo grw gua gug hal hau haw heb hix hmo hun hwc jak jpn juh kay ket kfc kio kji knk koa kor kse kut kya lan lav lkt mak mal map mar mau may mlt mnd mrt mxc myi nca ngi ngm nim niv ntu ond ono pnn por prh prs qco qim ren rom rus san shu snc snm som sue tag tga tig tiw tug tuk tur war wch wic wly wor wra yag yaq yct yes yko zun,114,76475,0.0014906832
66A,The Past Tense,,66,Östen Dahl; Viveka Velupillai. 2013. The Past Tense. In: Dryer; Matthew S. & Haspelmath; Martin (eds.) 2013. The World Atlas of Language Structures Online. Leipzig: Max Planck Institute for Evolutionary Anthropology. (Available online at https://wals.info/chapter/66),1,abk aeg afr alw aly amh arm atc atu avo awn awp aze bar bej ben bnj brh bsq bul bur dag did eng eve fij fin fre geo ger goo grk gua gug heb hin hun hwc ice imo jiv jpn kfc kha kji knd knk knr kor kui kya lat lez mai mao mau mlt mrt mtg myi ngi ntu orh pan por prs qco qim ram rap raw rom ruk rus som spa swa swe tah tga tgr tig tiw tml tne tny tur wlf wor wra yaq zqc zun,94,76475,0.0012291599
63A,Noun Phrase Conjunction,,63,Leon Stassen. 2013. Noun Phrase Conjunction. In: Dryer; Matthew S. & Haspelmath; Martin (eds.) 2013. The World Atlas of Language Structures Online. Leipzig: Max Planck Institute for Evolutionary Anthropology. (Available online at https://wals.info/chapter/63),1,abk abm adk aeg ahu ain ala alb ale amh amp arc arm asm ava awt bam bej bla bre bri bsq bul bur cct chk ckl coo cre dag diy dut dyi eng est fin fre gae geo gid grk gua gum heb hin hix hun ice igb iri jab juh kat ket kha khm kho kio kku knd kor kty kwa lah lat lep lez lil lit lkt maa mal map mcf mei men mlt mnc moe mok mrd mun mut myi nar nca ngl ojs orh otm pit pol prd prs psm qim rka rom rus scr sel siu sla snh som spa squ srr swe tag tbu tgk tgr tha tiw tli tml tsi tur tus usa uzb vie wap wrp yaq yid yko yur zqc,131,76475,0.0017129781
126A,'When' Clauses,,126,Sonia Cristofaro. 2013. 'When' Clauses. In: Dryer; Matthew S. & Haspelmath; Martin (eds.) 2013. The World Atlas of Language Structures Online. Leipzig: Max Planck Institute for Evolutionary Anthropology. (Available online at https://wals.info/chapter/126),1,abu ace aco ain any apu bdc bkr brh cah cha cle cnl djp dre emb epe err ewe fij grb grk gua gum heb hun imo ind juh kan kay kew kfe kho khs klv knr kob kor krb kro lan lkt lnd mal mau may miy mna mnd mok mxc ndy nht npi nti nun orh otm pai pau per pms prh prs pso rap san sla sml sng som tab tin tiw tzu ung urk vie wam wma yaq yor,84,76475,0.0010983981
128A,Utterance Complement Clauses,,128,Sonia Cristofaro. 2013. Utterance Complement Clauses. In: Dryer; Matthew S. & Haspelmath; Martin (eds.) 2013. The World Atlas of Language Structures Online. Leipzig: Max Planck Institute for Evolutionary Anthropology. (Available online at https://wals.info/chapter/128),1,abu ace aco ain akn ame any apu arp bdc bkr brh brs bsq bur cnl djp dre eng epe err fij geo gim goo grk gum heb hin hix hmo ho hun igb ika ind iri itz jak jpn juh kan kas kay kch kew kho khs kio kmj kmu knr kor lan lim lkt lnd may mei mhi miy mna mnd mxc myi mym nan nbd nbm ndy ngi ngt nht nko noo npi nug nun orb otm pan per pit pms prh prs qhu ram ret rus saw sla sml sup swa tab tag tsh tuk tvl tzu ung urk ute vai vie war way wma wra yag yaq yor,114,76475,0.0014906832
65A,Perfective/Imperfective Aspect,,65,Östen Dahl; Viveka Velupillai. 2013. Perfective/Imperfective Aspect. In: Dryer; Matthew S. & Haspelmath; Martin (eds.) 2013. The World Atlas of Language Structures Online. Leipzig: Max Planck Institute for Evolutionary Anthropology. (Available online at https://wals.info/chapter/65),2,abi aco afr ain ame amh ana apu arp asm atc awn bar ben blc bon brm brs bui cnl coc cpl cre cyn dag did dio eng ewe fij fin ger goo grw gua gug hal hau heb hmo hun ice ind ins ise jav jiv jpn kay kew kfc kha khm kmu knd koa krk kui kut kya lah lai lao lat lav lda lkt luv mai man mao map mar may mei mne mrt mtg mtu myi nca ngi nim niv ntu ono pai plg qco qim ram rap raw san sml snm som sue sun swa swe tga tgr tha tig tiw tml tne tuc tuk udm vie war wch wlf wra yes yko yor zun,121,76475,0.0015822164
