parameter_id,parameter_name,parameter_description,chapter_id,chapter_citation,value,same_value_language_ids,value_language_count,language_count_total,count_ratio
9A,The Velar Nasal,,9,Gregory D.S. Anderson. 2013. The Velar Nasal. In: Dryer; Matthew S. & Haspelmath; Martin (eds.) 2013. The World Atlas of Language Structures Online. Leipzig: Max Planck Institute for Evolutionary Anthropology. (Available online at https://wals.info/chapter/9),3,abi abk abm abz aco adk ady aeg agu aho aik ain ala alb aln ame amh amr amu amz ana apu ara arb arc arm arp asm awp axv aym aze bdk bej bez bgv bla blc bma bor brh bri brr brs bsq bth car cas cav ccp cct chc chh chi chl chm cht chv cmk cmn cmy coo cor cre crj cui cyv dag emb epe ess ets fre gag gap geo god grf grk gto gua guj guq hai hau hav heb hia hid hin hix hnk hpd hrs hun hzb ika imo ing iri ito ixi jak jbt jeb jib jpn jrn jva kab kew kfy khi kho khv kio kit klv knd koa krk krt krz ksh ksr kut kwo kws kwz lak lat lez lil lkt mak mam mar max may meh mkw mlt mma mos mov mui mxc mxt naa nam nav ndy nev nez ngz nhn nko nti oca ond orh orl osa oss otm pau pip prh prs psm pso qec qim qui rus rut san sba sel shk shw sla snm snt sod som soq spa squ sue swr tac tas tce tec teh tew til tin tli tlp tnd tru tsi tsz ttu tun tur twn uby udi umu usa wap war wch wic win wnb wra wrm xav yag yaq yki ykp ynm yor yrc yta yuc yur zso zun,235,76475,0.0030728995
38A,Indefinite Articles,,38,Matthew S. Dryer. 2013. Indefinite Articles. In: Dryer; Matthew S. & Haspelmath; Martin (eds.) 2013. The World Atlas of Language Structures Online. Leipzig: Max Planck Institute for Evolutionary Anthropology. (Available online at https://wals.info/chapter/38),2,abk agm amh ao aoj ara arc awt aym azi bbw bin brf bsq bwc cas ccm chh chs cnt ctl ddj fre ger gil gmw grk gwo heb hmo hoa htc ita jak kay kbw kgz khl kkp knd knn krc lah lat lav len lep lew lez lmh lon mam mea mei mgu mis moa mrq mtu mum mxy myn mzc mzn naj nca ndy nev nne nor nwd nym obo ocu osa paa por pra pur qum rap rem rom skk spa stl swe tah tam tar tce tee tep tgl tgr tid tig tmo tri ttn tts tur twe ura wal wme wol xbi ygr zai zar,112,76475,0.001464531
64A,Nominal and Verbal Conjunction,,64,Martin Haspelmath. 2013. Nominal and Verbal Conjunction. In: Dryer; Matthew S. & Haspelmath; Martin (eds.) 2013. The World Atlas of Language Structures Online. Leipzig: Max Planck Institute for Evolutionary Anthropology. (Available online at https://wals.info/chapter/64),1,abk abu ace aco aeg alk aml ara baw bbw bkr boz brh bsq bum bur cah cha chc chk cic coa coo drg dug eng err eve fin fre gap gar geo ger gnb gol grg grk grw gua guj haw heb hin hmo hun hzb ind irq ita itz jab kam kas kat ker ket kgu kho khs kku kmh kol kpw krw kuk kuo kut kwa lak lat lav laz lez lgu lkt mai mam map may mbo mcv mdr mhi moh mos mun mus mxc mym nab nav ndb ndj nel nep ngl nht nia nif niu nmb nmi nua obo oji ood otm pal pit pop prh prs psm pul pur qia qim rot rus san sir siu ski skp sno spa squ sud sue sun tab taf tag tgn tha tho tid tik tin tis tlo ttn tuk tur txj tzu udh udm uli usa vaf vie wal war yaq ywl ywr zaq zch,161,76475,0.002105263
55A,Numeral Classifiers,,55,David Gil. 2013. Numeral Classifiers. In: Dryer; Matthew S. & Haspelmath; Martin (eds.) 2013. The World Atlas of Language Structures Online. Leipzig: Max Planck Institute for Evolutionary Anthropology. (Available online at https://wals.info/chapter/55),1,abk abo aco aeg agw ako ala alb amb ame amh ami amk aml amr apu ara arb arm aro ata atk ava awt bae bgv brh brl bsq bul bur but cap cba cct cha chc chi chk chv cin cjo cku cnl coo cpn cre ctm cul cyv dat den dga diz dji dre drg dum dyi eng epe err eve fij fin fma fre fur fut gaa gav gbb gdf geo ger gnn goo grr gua hau haw heb hin hix hpd hua hzb iaa igb ika imo ing irq jam jaq jiv jmm juh kat kch kew kfe kha kho kio kiw kku klm klt kmb knd knr knu kob koi kot kpe krf krk kut kzy lan lat lda let lez lim lkt luc lug lui luo maa mal map mar mau mbg mde mdk mdn mee mhi mis mit miy mkw mli mlk mll mne moe mos mrg mrt msc mss msy mup muu mxc myi mym nah nai naj nar nas nav nbd ndy ngi ngy ngz nht ntu nug nyu ood orh ori pau pba pip pir pno pnr prc prh put pwn qcu qhu qim qui rap rcp rru ruk rus sal sdw see ses shk shs siu snc snh snt sue sul sup swa swt syu tag taw tgh tim tiw tkl tla tlf tll tmr tnn tob tol ton trn tso tun tuv uhi ung ura wap war was wem wgl win wor wrn xam xoo yes yid yim yko ymi yng yor yuc yuk ywl zul zun,260,76475,0.0033998038
69A,Position of Tense-Aspect Affixes,,69,Matthew S. Dryer. 2013. Position of Tense-Aspect Affixes. In: Dryer; Matthew S. & Haspelmath; Martin (eds.) 2013. The World Atlas of Language Structures Online. Leipzig: Max Planck Institute for Evolutionary Anthropology. (Available online at https://wals.info/chapter/69),2,aar abi abk abn abv acg acm aco acu adn aga agm agt ain ala alb alc ale alw aly amb amc ame amn amp amx ana ani ann ao apl apt apu ara arc arm arw asm ass ath atk ava avo awa awe awi awp awt aym aze azi baa bac bae bam bao baq bau bco bdm bej bel ber bgn bho bii bil bin bio bkb bkr bln blt blx bmb bmr bnj bnr bnu bod boi boj bre brh bri brm brn brr brs bry bsk bua bul bun bur but bya bzi cah car cas cax cay cba cbo cct cde chb chc che chg chi chn chv chx cld cln cmh cmn cmy cnm cnt coa coo cos cpy crn crp ctm cub cui cup dag dan daw der des deu dgo dgr dhb dhm dhr dhw dig dim diy dja dji djm djn djp djr dlm dmi dmk dms dni dom drm dsh duk dun dut dyi eip eka emb eme ene eng epe ese est eud eve evn fas fin for fqs fre fua fur fye gaa gah gal gan gar gbb gds geo ger ggu gid gim gln gnn goa gog gon grb grf grj grk grr grs grw gud gug guh guj gum gur guu hai hak hal har hay hin hix hlp hmi ho hop hpd hua hui hum hun hzb iat ice igb ign igs iha ijo ik ika imo ina ind ing inn iqu irx ita ite iwa jam jaq jeb jiv jpn jva jwr kac kar kay kbo kbu kem ker kew kfe kgu kgz kha khg khi khl kio kiw kkp kku klm klq kma kmb kmh kmj kmk kmn kmo kmp kms knb knc knd kni knk knm knn knr knw kob koe kok kol kop kor koy krc krh kri krj krk krw ksa kta kti ktl kty kum kus kuu kuv kwk kwo kwt kwz kya kyk kyq kyz lac lad lav ldu lec lep lez lho lim lit lkt lmn lng lot lui lun mab mac mag mak map mar mau mbt mcd mco mcv mde mdm mdn mdo mee mei mem mgg mgi mhi mhk mij mik mis mkg mkh mkr mme mmi mnc mnd mne mni mnm mno mns mny moe mog mom moo mos mot mou mpr mpt mqf mra mrh mri mrr mrs mrt mrw msc msg msl mss mtk mts mui mun mut nab nag nah nar nas nbd nbr nca ndo ndt nep nev new nez nga ngi ngj ngl ngn ngt ngw ngz nha nhh nhm nhn nht nis niv nkb nmb nmd noc nog non nor nph nsn nti ntj ntu nug nwd nyi nze oks olo omh omi one ong ood ord orh ork oro orw osa oss oya paa pae pan pau paw pba pdp pga pia pip pir pis pkn plk pme pno pny pol por ppi prh prk psh pso ptw pum pur pwn qaw qhu qim ram rao raw rem res ret rit rmb rom rot rum run rwa rwe sav sba sdw sem shd she shh shi shk sho shp shy sia sid sin siu skp skr slb slg slp sme smn sna snh sno snt som spa srd srn sro sta stl sue sug suk sus svs swe syu tac tam tan tao tau tba tbl tbu tbx tce tel tgl thn thu thy tir tja tkl tma tmc tmg tml tmo tnn tny tob ton tpn tpt trb trr tru trw tsf tsh tte ttu tuc tun tur tuv tvo tvt twe twn uby udi udm uhi ukr una urd usa usr ute uyg uzb wah wai wak wam wao wap was wat wau way wbn wch wel wem wik win wir wly wmu wog wra wrb wrg wrk wrn wsk wtm yag yah yal yaq yar ycn yid yim yin yko ykt ylm yng yok ypk yrm ytu yuc yuw ywl yyg zay zch zpr zqc zqo zqs zun,667,76475,0.008721804
15A,Weight-Sensitive Stress,,15,Rob Goedemans; Harry van der Hulst. 2013. Weight-Sensitive Stress. In: Dryer; Matthew S. & Haspelmath; Martin (eds.) 2013. The World Atlas of Language Structures Online. Leipzig: Max Planck Institute for Evolutionary Anthropology. (Available online at https://wals.info/chapter/15),1,arc atq ava bqi bwa cap dhu dhw eka hop lez lui mak mcs mdm mlk mne mss mwn mym nep nya oss oto ror shk skp tsh ung wam wrg ych yil yin ypk yun,37,76475,0.00048381824
27A,Reduplication,,27,Carl Rubino. 2013. Reduplication. In: Dryer; Matthew S. & Haspelmath; Martin (eds.) 2013. The World Atlas of Language Structures Online. Leipzig: Max Planck Institute for Evolutionary Anthropology. (Available online at https://wals.info/chapter/27),2,ain arm arw bag brm bua ccp cle cvc err fij gmt hve ind jpn kaa luo mku mny mrt mwe mxl mym ngw niv pkn ppi qim rap tsw wlf ynk zhn zul,35,76475,0.0004576659
56A,Conjunctions and Universal Quantifiers,,56,David Gil. 2013. Conjunctions and Universal Quantifiers. In: Dryer; Matthew S. & Haspelmath; Martin (eds.) 2013. The World Atlas of Language Structures Online. Leipzig: Max Planck Institute for Evolutionary Anthropology. (Available online at https://wals.info/chapter/56),1,amr arm bae brh bsq epe fre gaa geo hai hix hzb ika jam kch kho kut lan lat mao mar mau may nbd ndy nht pba pnr qim saw sml tiw trb tuk tur vaf war was yim,40,76475,0.00052304677
82A,Order of Subject and Verb,,82,Matthew S. Dryer. 2013. Order of Subject and Verb. In: Dryer; Matthew S. & Haspelmath; Martin (eds.) 2013. The World Atlas of Language Structures Online. Leipzig: Max Planck Institute for Evolutionary Anthropology. (Available online at https://wals.info/chapter/82),2,agc agd als ami amr ams anj ann asu ata baq bco bfg bkl bma bre bto cak cba ccm ceb cem cha chj chq chx ckl cle cmx cmy coe coo cor cos cpl cso cub cya cyv did dom esm fij gae gel gjj goa grf gto gud haw hdi hei hil hix hlu hoa htc hve iaa ifu ign ik ilo iri ixi jak kam kbl kdz kje kkt kls klv kmj kpm krb kri kro ktm kuo kut kyq lgu lil lmg maa maj mak mal mam mao map mch mcv mmn mna mnt mov mrl mrq msq mwb mxc mxj mxo mxp mxy mzc nan nca ndr ngr nhh nhm nia nif niu nnc nsg nuu oji ond ood otm pai pau pga pip pkt pnn pnx pod qui qum rap rov ruk sal sam seb see sel shp shu sim smp so squ tag tah tai tat tbo tee ten tep tes tho tim tir tke tlp tna tng tpn tri tsg tsi tsk tsr tuk tvl tzo urn war wec wel wem wlo wrb wth wya yag yap yok ywr zai zap zqc zqo zya zzo,194,76475,0.0025367767
46A,Indefinite Pronouns,,46,Martin Haspelmath. 2013. Indefinite Pronouns. In: Dryer; Matthew S. & Haspelmath; Martin (eds.) 2013. The World Atlas of Language Structures Online. Leipzig: Max Planck Institute for Evolutionary Anthropology. (Available online at https://wals.info/chapter/46),1,abm ace aco agt ain aly amu ana aso ass atc awp aze bao baw bdm blr bsk bsq bug bul bur but cah cch chk chn chv cmn cnl coo crk ctm diy dja dji djp djr dyi ene est eve evn ful gaa gag gar geo goa goo grg grk grw gum guu hay heb hmo htc hun hup hzb ice itz jak jam jaq jpn kay ket kgz khk khs kio kku kma kmh knc knd kng koa kod kop kor krc krk krl krm kry ksi kty kut kzy lak lat lez lil lit lkt lml mac mah mai mar mei mhi mic mlk mme mmo moe mra mrh mrt mrw mss mun myi mym nai nav ndj neg nez nga ngi ngk ngn nha nht niv nsg ntu nug nwd oss pae pkn pno pny pol ppi psh psm pur qhu qim rom rus scr shk sho shr siu ski skp sno squ stl tab taj tha tiw tja tkl tml ton tst tun tuv tvo txj udh udm ukr uku uzb vie wam wic wmu wrd wrn wry yaq yid yin yko ykt yng ypk yuw zun,194,76475,0.0025367767
83A,Order of Object and Verb,,83,Matthew S. Dryer. 2013. Order of Object and Verb. In: Dryer; Matthew S. & Haspelmath; Martin (eds.) 2013. The World Atlas of Language Structures Online. Leipzig: Max Planck Institute for Evolutionary Anthropology. (Available online at https://wals.info/chapter/83),2,aab abi abu acg acl acm adi adz aeg agb agc agd agh aja akn alb alk aln als ama ami aml amo amq amr ams anc ane anj ann anu aoj ara arg ari arj aro arp arq asy ata au avk ayi ayo ayr ayw bab bae baf bag bai baj bak baq bar bas bbl bbu bch bco bdu ber bfg bgo bgr bgs bgz bid big bii bik bil bir bka bkl bkr bku bla ble blg blu blz bma bmb bni bnk bnn bob bol bra bre brf brn brq brr bse bsh btk bto bub bud bug bul bum buu buy bvi bwc cak cax cba ccm cea ceb cem cga cha chj chq chr chw chx cic ckl cle cme cmx cmy cnt coc coe cop cor cos cpl cqt cre crn cso ctl cua cuc cya cyv cze day deg dga dgb did dio dma dok dom don doy dre dsh dua duk ebi ega egn eko eng eno erk err esm est ewe ewo fij fin fon fre fua fut fye ga gae gbb gbs gel gir giz gjj gla gmz gnb gnd goa goe gok grb grf grk grr gto gua gud gul guw gwo hak hal hat hau haw hdi heb heh hei hem hil hlu hmo hna hnd hoa hol htc huc hun hve hya iaa iba ice ifm ifu igb ige ign igs ik ila ilo ind iqu iri irr ita ito iwa ixi izi jab jak jar jmo juh juk kad kam kan kar kas kau kba kbl kbw kby kch kdw kdz kel ken ker kfe kga kgr khm khn khs kik kil kin kir kje kkt kkv kla kls klv kmj kmu kni knk koe kom kon kos kpm kpw krb kre kri kro ksg ksm ksn ktc kte ktl kuo kut kwa kwk kwn kwy kyl kyq kzy laa lab lac lag lan lao lat lbu ldo leb leg lel len let lew lgi lgu lic lil lin lit llm lmg lmh lmp lmu lnd lon lou luc luo luv ma maa mae maj mak mal mam mao map mas mau may mba mbe mbi mbl mbm mbr mbt mby mcd mch mcv mda mdg mdm mdo mds mdw mea mee meh mga mgk mgo mgu mhu mie miy mkd mkq mkz mla mlg mlm mlu mmb mmn mmv mna mnd mng moe mof mok mon moo mor mos mov mpo mpr mpu mrg mrl mro mrq mrt msk msm msq mtb mua mum mup mur mus mut mwb mwe mwo mxc mxe mxj mxo mxp mxy myg myn mzc nak nal nan nau nbe nbm nca ncm ndb ndi ndo ndr ndt ndu ndy neh ngd ngm ngo ngu ngw ngz nhh nhm nhn nht nia nif niu nke nkn nko nnc nne nng non noo nor nse nsg nto nua nun nup nuu nym nyn nza obg obo ocu oji olo ond one ood ora otm otr paa pai pal pam pat per pga pip pkn pkt plg plh plk pms png pnn pnu pod pog poh pol por pre psm psw pul pur qui qum rag rap rga rim rny rom ron rot rov rru rsu ruk rus rwe sah sak sal sam san sap scr sea seb sed see ses sgb sgl sgu sha shl shm shn shp shs sht shu sim sio sir sis siu skm sku sle slo sml smp sno so sob son spa squ srd sre ssa sti stn sud sul sun swa swe swt tab taf tag tah tai tal tan tas tat tbo tbw tee ten teo tep ter tes tet tgh tgk tgn tha tho tia tid tim tin tiv tiw tke tki tla tlp tmm tmn tmr tna tne tng tnk tno tob toz tpn tpr tri trm tsg tsi tsk tsr ttd ttn tuk tum txj tzo tzu ukr uld uli ura url urt ven vie vnm wal wam war wch wec wel wem wlf wlo wma wol wrb wrk wrm wrn wry wth wwa wya xam xar xbi xho xoo yag yao yap yay ycn yin yng yok yor yul ywl zai zan zap zch zhn zpr zqc zqo zqs zul zya zzo,705,76475,0.009218699
105A,Ditransitive Constructions: The Verb 'Give',,105,Martin Haspelmath. 2013. Ditransitive Constructions: The Verb 'Give'. In: Dryer; Matthew S. & Haspelmath; Martin (eds.) 2013. The World Atlas of Language Structures Online. Leipzig: Max Planck Institute for Evolutionary Anthropology. (Available online at https://wals.info/chapter/105),3,ain akw ala all bbw bco bel bla bnn brs cha che coo cre err gaa gap goo grg grw hau hay hli hui jam juh kfe klv kmh krr kut lai laz lil lml map mar mos mot mrt nab ndj ngi ngl niv nko nmb oji pal qhu sng som tau tbt tiw usa war wch wrd yag yaq yng yor zch,65,76475,0.00084995094
33A,Coding of Nominal Plurality,,33,Matthew S. Dryer. 2013. Coding of Nominal Plurality. In: Dryer; Matthew S. & Haspelmath; Martin (eds.) 2013. The World Atlas of Language Structures Online. Leipzig: Max Planck Institute for Evolutionary Anthropology. (Available online at https://wals.info/chapter/33),1,adi alw amo anj ann ayi bas bbu bbw bco bdu bfi bga bir bku blg blu bnk bob bsh btk che cic dio eno eny eud ewo fye gbs git hem hnd hve hya ifm ila jar juk kad kba ker kga kgr kik kkv kmj kom kon kro ktc ktl kut kwn kwy kyo laf lbu lda ldo leg llm lmb luv mbi mbl mbt mdo mgk moh mra mro msk mtb mua mwe myg ndb nde ndo ndu nev ngn ngo nia nke nkn nko non nug nym nza obg ocu ood otr pal pre qui ruk sak san shm shn sre stn sub sul swa tbw tgo tia tne tnn toz tpn tsi tus wed wrn xho yny zan zap zul,126,76475,0.0016475973
97A,Relationship between the Order of Object and Verb and the Order of Adjective and Noun,,97,Matthew S. Dryer. 2013. Relationship between the Order of Object and Verb and the Order of Adjective and Noun. In: Dryer; Matthew S. & Haspelmath; Martin (eds.) 2013. The World Atlas of Language Structures Online. Leipzig: Max Planck Institute for Evolutionary Anthropology. (Available online at https://wals.info/chapter/97),4,aab abu acg acl adi adz aeg agb agh akn alb alk aln ama aml amo amq amr ams anc ane anj anu aoj arg arj aro arq asy au ayi ayo ayw bab bae baf bag baj baq bar bas bbl bch bdu ber bfg bia bid bik bir bkr bku ble blu blz bma bni bnk bnn bra bre brf brn bsh bto bub bud bum buu bvi bwc cax ccm cem cga chq chr chw cic cle cme coc cop cor cpl crn cso ctl cya day dga dgb did dio dma don doy dre dua duk ega egn eno erk err ewe ewo fij fni fon fre fua fut fye ga gae gel gjj gla gnd goa goe grb grf grr gto gua gul guw hal hat haw hdi heb heh hem hmo hna hnd hoa hol huc hya iba ifm igb ige igs ik ila ind iqu iri irr ita jab jar jmo juh juk kam kar kau kba kbl kbw kby kch kdz kel ker kfe kga kgr khm khs kik kin kir kje kkt kkv klv kmj kmu koe kom kon kos kpw krb kri kro ksg ksn ktc kte ktl kuo kwa kwn kwy kyl laa lab lag lan lao lbu ldo leb lel len let lew lgi lgu lic lin llm lmg lmh lmp lon lou luc luo luv maa mae mal mao mas may mba mbe mbi mbl mbm mbr mbt mby mda mdg mds mdw mea mee meh mga mgk mgo mgu mie miy mkd mkz mla mlg mlm mlu mmb mmv mna mng mof mok mon moo mor mpo mpr mpu mrg mrl mro mrq mrt msk msm mtb mua mum mup mur mwe mwo mxc mxe mxj mxo mxp mxy myn mzc nak nal nan nau ncm ndb ndi ndo ndr ndt ndu neh ngd ngm ngo ngu ngz nhh nhm nht nia nif niu nkn nko nnc non noo nse nto nua nun nup nym olo otr pai pam pat per pga pkt plg plh plk pms png pnu poh por pre psw pul pur rag rap rga rny rom rot rov rru rsu sah sak sam sap sea seb sed ses sgb sgu shl shm shn sht sim sio sis sku sle sml so sob spa srd sre sti sud sul sun swa tab taf tah tat tbo tbw ten teo ter tes tgk tgn tha tia tid tim tlp tmm tmn tmr tna tne tng tnk tno toz tpr tri tsg tsk ttd ttn tuk tum uld uli ura url urt ven vie vnm wal wch wel wlf wlo wma wol wrk wrm wth xam xbi xho xoo yag yao yap yay yor yul zai zap zul zya zzo,456,76475,0.0059627327
16A,Weight Factors in Weight-Sensitive Stress Systems,,16,Rob Goedemans; Harry van der Hulst. 2013. Weight Factors in Weight-Sensitive Stress Systems. In: Dryer; Matthew S. & Haspelmath; Martin (eds.) 2013. The World Atlas of Language Structures Online. Leipzig: Max Planck Institute for Evolutionary Anthropology. (Available online at https://wals.info/chapter/16),4,abe arh arl asy awd car cct ceb dsh eng goo gor grw hin hix hop klm klv koy krl ksh mac mcs mgd mss mwn nbd ndy nor ram swe tns yan yko,35,76475,0.0004576659
95A,Relationship between the Order of Object and Verb and the Order of Adposition and Noun Phrase,,95,Matthew S. Dryer. 2013. Relationship between the Order of Object and Verb and the Order of Adposition and Noun Phrase. In: Dryer; Matthew S. & Haspelmath; Martin (eds.) 2013. The World Atlas of Language Structures Online. Leipzig: Max Planck Institute for Evolutionary Anthropology. (Available online at https://wals.info/chapter/95),3,acg adi ara bae bgs bil ble cea coc cor dga dgb est ewe fin gjj grb gua hun iqu juh kas kch kir kje kzy llm maj moe mpr nkn sle sno tpn trm tsr wal wry yag ycn zch,42,76475,0.00054919906
14A,Fixed Stress Locations,,14,Rob Goedemans; Harry van der Hulst. 2013. Fixed Stress Locations. In: Dryer; Matthew S. & Haspelmath; Martin (eds.) 2013. The World Atlas of Language Structures Online. Leipzig: Max Planck Institute for Evolutionary Anthropology. (Available online at https://wals.info/chapter/14),1,abe abk aeg ael agu ahs akl ala ame apa apu arc arg arh arl arm arv asy atq au ava awd bej bgg bgv bho bkl bkr bna bqg bqh bqi bqz bso bui bur bwa cap car cct ceb cha chv cle coo cpa crk ctl cub cyg des dhu dhw die djr dsh dut eka emc eng epe eve fij for fre gay ger god gor grb guj hin hix hno hop htc hzb iga irm irq ita jav kaj ker kew kha kit klm klv knm koa kop kra krk kro ksh ktn kuu kuz kwk kws lar let lez lit lmh lui mah mai mak mam mao mcs mdm mea meb men mlc mlk mlt mly mme mmo mnd mne mng mnm mrk mrl mrs mrw mse mss mun mwn mym nav nbd ndy nep nez ngd ngi nor nya obk occ oss oto plb por prh psh psm pul ram rom ror rot rsm rus sak sao scr sdh sea ser shk sio skp skr sla slo snc snt spa spo sps srd sru sun svc swe swi tah tbl tgw tib tlo tng tno tns tnt tol tsh tur uli ung unm usa wam wic wiy wlo woi wrg yan yap ych yid yil yin yko ypk ysl yuc yun yuw yzv,220,76475,0.0028767572
35A,Plurality in Independent Personal Pronouns,,35,Michael Daniel. 2013. Plurality in Independent Personal Pronouns. In: Dryer; Matthew S. & Haspelmath; Martin (eds.) 2013. The World Atlas of Language Structures Online. Leipzig: Max Planck Institute for Evolutionary Anthropology. (Available online at https://wals.info/chapter/35),3,ain ale apu cle coo cre cyv jak kam kfe kho koa lan lkt mun oji otm pau pit psm tsi tun wic yuc,25,76475,0.0003269042
34A,Occurrence of Nominal Plurality,,34,Martin Haspelmath. 2013. Occurrence of Nominal Plurality. In: Dryer; Matthew S. & Haspelmath; Martin (eds.) 2013. The World Atlas of Language Structures Online. Leipzig: Max Planck Institute for Evolutionary Anthropology. (Available online at https://wals.info/chapter/34),6,abk ady aeg ala apu arm bab bag bao bla blj brh brs bsq bud bur chk cic cop cre dah deg dgb dha did drg dug dut eng err eve fin fon fre fye geo ger gol grb grk grw guj gus hau heb hin hoa hun hzb ice ik iri irq ita itz juh kch kda kem ket kfe kkn kmh knr kol krd kro kuk kuo lak lat lav lep lez lil lit luv maj mao mdg mig miy mlt mok mym nbd ndb niu nmi nse nua oji pan pga por ptt qaf qim rom rus scr sgu sho sir ski skp sno som soq spa sup swa swe taf tgn tig tik tpn trw tur tvl tzu udm yaq yey yim ypk zay zaz zch zul zun,133,76475,0.0017391305
124A,'Want' Complement Subjects,,124,Martin Haspelmath. 2013. 'Want' Complement Subjects. In: Dryer; Matthew S. & Haspelmath; Martin (eds.) 2013. The World Atlas of Language Structures Online. Leipzig: Max Planck Institute for Evolutionary Anthropology. (Available online at https://wals.info/chapter/124),4,aga ale ana apu ara awp chk eve gua hum jam jpn kay kma kob kwk kyk lad mac mak mcv mku mts nab ngl nmb nmi oji olu ood pno prh qia see shk sho tgn tob udh yaq yir ypk ytu zch,45,76475,0.0005884276
87A,Order of Adjective and Noun,,87,Matthew S. Dryer. 2013. Order of Adjective and Noun. In: Dryer; Matthew S. & Haspelmath; Martin (eds.) 2013. The World Atlas of Language Structures Online. Leipzig: Max Planck Institute for Evolutionary Anthropology. (Available online at https://wals.info/chapter/87),2,aab aar abk abn abo abu abv ace acg acl adg adi ady adz aeg agb agh agm agt ajg akh akn alb alk all aln aly ama amc ame aml amn amo amp amq amr ams amx ana anc ane ang anj ano anu any ao aoj api apl apt apu arg arj aro arq asm asy atm au awe awi awt awy ayi ayo ayw baa bab bae baf bag baj bam baq bar bas baw bbf bbl bch bdm bdu bdw bem ber bfg bfi bgm bid bik bin bir biu bkr bku ble bln blu blx blz bma bni bnk bnn bok bon bra bre brf bri brl brm brn brp brq bry bsh bsi bsq bsr bto bub bud buj bum bun bus buu bvi bwc cai cas cav cax cbo ccm cde cem cga chb chi chq chr chw cic cld cle cme cmr cnl cnm coc cop cor cpl crn cro crp cso cti ctl ctm ctw cui cup cya dag dan daw day ddj dds dga dgb dgo dha did dig dim din dio diy dji djn dma dms don doy dre dua duk dum dun dyi edo ega egn els emb eme emm eno epe erk err ese ewe ewo fas fij foe fon fre fua ful fur fut fye ga gaa gae gan gar gav gel ggu ghr gjj gku gla gln gmw gnd gnn goa goe goo grb grf grr grw gto gua gug guh gul guu guw gwa gyc hai hal ham har hat haw hdi heb heh hem hid hix hlp hma hmo hna hnd hoa hol hpd huc hup hwr hya iba idn ifm igb ige igs ik ika ila imo ina ind inn iqu iri irq irr irx isa ita jab jad jar jbt jel jin jlu jmo jms jng jrw juh juk jva kaa kae kam kar kau kba kbl kbo kbw kby kch kdz kel ker kfe kga kgr kgu kgy khd khm khs kie kik kin kir kis kje kkt kkv kll klq klv klw kma kmb kmi kmj kmn kmo kmp kmu kmw kmz knc kng knm kno knr knz koa kob koe kok kom kon kos kpe kpw kqq krb krd krh kri krk kro krr kse ksg ksn kta ktc kte ktl ktu kuo kuu kwa kwb kwm kwn kwy kwz kya kyk kyl kyn kyo kyz laa lab lad lag lal lan lao lar lav lbu lda ldo leb lel len lep les let lew lgi lgt lgu lic lin lis lkt llm lmb lmg lmh lml lmp lon lot lou luc lug lui luo luv luy maa mab mac mad mae mal man mao mar mas maw may mba mbe mbi mbl mbm mbo mbr mbt mby mda mde mdg mdl mdn mds mdw mea mee meh mek mey mga mgk mgo mgq mgu mhk mhl mie mii mij min mis miy miz mka mkd mke mkg mkj mku mkz mla mlg mlk mlm mlu mmb mmv mmw mna mng mnm mnv moa mof mok mon moo mor mot mou mpa mpo mpr mpt mpu mra mrg mrh mrl mro mrq mrr mrt mru msc msk msl msm msn mtb mts mtu mua mud mum mup mur mwe mwo mxa mxc mxe mxj mxo mxp mxy myi myn myr mzc nab naj nak nal nam nan nar nat nau nav nax nbd nbr ncm ndb nde ndi ndj ndo ndr ndt ndu neh ney ngd ngg ngj ngk ngl ngm ngn ngo ngt ngu ngz nhh nhm nht nia nif niu nkb nkk nkn nko nku nma nnc nnd nng nnk noc non noo nph nrg nse ntj nto nua nue nun nup nus nyh nyi nyk nym nze olo omh omi orh ori ork oro orw ory osa otr pae pai pam par pat pau per pga pia pir pit pkt plg plh plk pms png pnu pnx poh pok por ppi pre prh prs psw pul pum pun pur qia rag ral ram rao rap ras raw rga rgc rny rom rot rov rru rsu rum run rwa saa sah sak sam sap sdw sea seb sed sem sen ses sgb sgu she shi shl shm shn sht sia sil sim sio sis skk sko sku sla slb sle slp sme sml smn sng snm snn snt so sob som spa spi src srd sre srn sro sti sud sue sug sul sun sup swa syu tab taf tah taj tak tao tat tau taw tba tbl tbo tbt tbu tbw tdi tdr ten teo ter tes tgk tgn tgo tha thd thy tia tib tid tik tim tkl tlf tlp tma tmm tmn tmo tmr tna tnc tne tng tnk tnn tno tny ton toz tpr trb tri tsg tsk tsm ttd ttn tuk tum tun tvl uhi uld uli una ung ura urk url urn urt usa ute vaf vai ven vie vif vnm wag wah wal wap wat wbn wch wed wel wic wiy wlf wlo wma wmu wn wna wog woi wol wom wra wrd wrk wrl wrm wsk wth xam xas xbi xer xho xoo yag yal yam yao yap yay yel yi yid yiw yor yrm yuc yul zag zai zap zar zaz zul zun zya zzo,879,76475,0.011493952
