parameter_id,parameter_name,parameter_description,chapter_id,chapter_citation,value,same_value_language_ids,value_language_count,language_count_total,count_ratio
85A,Order of Adposition and Noun Phrase,,85,Matthew S. Dryer. 2013. Order of Adposition and Noun Phrase. In: Dryer; Matthew S. & Haspelmath; Martin (eds.) 2013. The World Atlas of Language Structures Online. Leipzig: Max Planck Institute for Evolutionary Anthropology. (Available online at https://wals.info/chapter/85),1,aar aba abk acg acn aco adg adi adk adn ady agm ain ajg akh ala aly amb amc ame amk amp amt ana ang ao api apl apt apu ara arc arm arw asu atk ava avo awe awp awt aym baa bac bae bam bao baw bbf bej bgs bho bil bin bkb ble bln blt blx boa boj bok bon brh bri brm brs bry bsk bsq bti bua bur bus but bya bzi cah cai cam car cas cav cbo cct cde chc che chg chi chk chn chp chs chv cln cmh cmn cmr cnl cnm coc coo cor cti ctm ctw cub cup dag dan daw dds der des dga dgb dgr dhm die dig dim dji dlm dmi dmk dms dni drg drm dul dun edo eip emb eme emm ene epe ese est eud eve evn ewe fas fin for fqs ful fur gaa gam gan gap gar gav geo ghb gim gjj gln gmw gnn gon grb grj grw gua guj gur gyc hai ham han hay hhu hid hin hix hlp hma ho hop hpd hua hum hun hup hzb iau idn idu ika imo ina ing inn iqu jbt jel jin jms jng joh jpn jug juh jva kaa kab kac kas kbo kbt kch kem ket kew kgy kgz kha khd khl kho khr khw kie kim kir kiw kje kkp kkq kku kll klm klq klr kma kmb kmh kmk kmn kmo kms kmw kmz knb knc knd kng knm knn knr knz koa kob kok kol kop kor kpo krc krh krj krk krn kry ksa kse kti kty kum kun kus kuv kwb kwo kws kwt kxo kyk kyn kyr kyz kzy lad lah lai lak lal lar lav ldu lep lez lgt lho lis lkt llm lmn lot lug lui lun mab mac mad mag mai maj man mar maw max mbo mcc mde mdl mdn mei mek mey mgg mgh mgi mhi mik mis miz mka mke mkg mkj mkl mku mme mnc mnm mno mns mnv moe mom mou mpr mpt mqf mrd mrh mri mru msg msn mtu mun muu myr mzn nab nad nag nam nar nas nat nav nbd nbr ndj nep nev new ngg ngk nis niv nkn nnd nnk noc nph nti ntj ntu nwd nyi nze oks omi orh ork oro orw ory osa oss owi pae pan pau paw pdp pis pit pmn pnx pra prh prk psh pso ptt ptw pum pun puq qaf qaw qhu qia qim ram raw rem res ret rik rum run rut ryu sar sav sba sdw sel sem ser shb she shh shi shk shy sid skk sko skw sla slb sle slp sme smn sna sng snh snm sno snt sor src srn sro sta stl sue sup sus svs syu tac tak tam tar tau tbl tbt tbu tbx tce tel tgl thd thn thu tir tja tkl tkm tlf tli tls tml tmo tnc tny ton tou tpn trb trm tru trw tsf tsm tsr tsz tte tts ttu tuc tul tun tur tuv tuy tvo tvt uby udh udm una ung urd urk urn usa ute vai wah wai wal wao was wat way wbn wir wme wna wor wra wrd wry wsk wtm xas xav xns yag yah yal yaq yar ycn yei yel ygr yi yim yiw yko ykt ylm yqy ytu yuc zag zar zaz zch zun,577,76475,0.007544949
88A,Order of Demonstrative and Noun,,88,Matthew S. Dryer. 2013. Order of Demonstrative and Noun. In: Dryer; Matthew S. & Haspelmath; Martin (eds.) 2013. The World Atlas of Language Structures Online. Leipzig: Max Planck Institute for Evolutionary Anthropology. (Available online at https://wals.info/chapter/88),1,abi abk abv aco adk ain ala alb als alw amb amc amh ami amk amn amr ams ana ani ann anu apt apu apw ara arc arm arp arw asm ass ath atk ats ava awa awp awt aym bae baq bar bdm bfg bho bii bil bkt bku bla blg blr blt bnb bnj bnn bnr bod brh brl brm brs bsk bub bul bur but bya cak car cas cay cde cea cha chc chd che chg chk chn chp chs chv ckl cld cln cml cmn cnm cnt coc coo cor cpn cpy cre crp cti ctl cup cyv cze daw des dgr dhi dhm diy djm djn djp djr dlm dmi dms dom drm dsh dua duk dul dut dyi emb eme eng epe est eud eve fin for fre fri fur ga gaa gam gar gav geo ger gid gjj gnb god gon goo grg grj grk grr gto gua guj gur guu gyc hai hak haw hay hei hhu hil hin hlu hmi hop hpd htc hua hun hup hve hwr hzb ice idn idu ifu ijo ilo ing iqu ita ite ito iwa jaq jbt jeb jng joh jpn jva kaa kab kac kae kas kay kbt kem ket kew kgy kha khg khl kho khr khs kin kio kiw kkp kkt kku kkw klm klr kls kma kmh kmn kms knd knn kno koa kok kol kor koy krc kri krk krn krw kry krz ksa ktm kty kum kuo kut kuv kwo kwt kxo kyn kyr lac lad lat ldu lec lep lez lil lim lit lmn lui lun maa mac mai mak mam map mau mcd mco mcv mdm mds mek men mgg mgi mhi mie mik mis miy mkg mmn mnd mne mns moa moh mot mra mrc mrt mru msc msg msq mss mto mtt mun mut mwb mxx myi mym naj nas nav nax nbd nca ndj nep nev new nez ngi ngl ngn ngw nhh nhm nhn nht niv nku nnc noc nor nph nrg nsn nti ntu nug nwd nyk nyn nyr nyu nze ocu oji omh omi ond ood oss otm pae pai pal pam pan pau paw pba pdp pga pia pir plk pno pny pod pol por ppc pra pre prk prs psh psm pso ptt pum pur qaf qhu qim qui qum ram raw rem res ret rgc rmb rsu ruk rus rut rwe sal sar sav scr sdw sec she shh shi shk shm sho shp sid sin siu skp sla slb slo sme smn sna sng snm snt spa spi squ src srn stl suk sup sus svs swe swt tac tah taj tam tar tau taw tbl tce tee tel tgl thd thk thn thu tic tig tiw tkl tkm tla tli tls tml tnc tni tnn tob tot tpn tpt trr tru trw tsf tsz ttu tuc tul tur tuv tuy tvo tvt twe txj udi udm uhi ukr una urd urk urn usr ute uzb vaf wak wam wao wap was wbn wed wem wic wik wiy wlo wly wme wra wrd wrk xam xas xer yag yaq ybi ycn yin yko ykt yng yny yok yuc yuk yur yuw zay zaz zch zqc zqs zun,542,76475,0.0070872833
92A,Position of Polar Question Particles,,92,Matthew S. Dryer. 2013. Position of Polar Question Particles. In: Dryer; Matthew S. & Haspelmath; Martin (eds.) 2013. The World Atlas of Language Structures Online. Leipzig: Max Planck Institute for Evolutionary Anthropology. (Available online at https://wals.info/chapter/92),6,aar abk acu adz aga ala alk aml ana ang ano apl apu apw ara arc arg arm arw ass ath azi bae baf bao bco bdm bej bgz bii bik bil biu bla ble bln blt bmb bod brm brn brs bsh bti bum bur cah cai can car cba chc chi chk chv cml cmy coa cpl cpy crp ctl cub cup cze des deu dha die dim din dio diy djm dlm dni dsh dut eip emb ene eng eno epe erk fas fij foe fri ful gae gah gal gar gdb gds geo ger ghb gim gln gmw gmz gnb grj grw guj gum gyc hay hix hmi hoa hpd htc hua hya hzb idu igb ijo ing irq irr ita ito jak jmo jug kab kae kan kay kba kbl kch kem khi kik kis kje kkp klv klw kma kmh kmk kmn kmr kmz knc kni knm knn knr knw koe kok kol kor kqq krc kro kun kuo kuu kws kwz kyk lab lad lan lbu lez lho lin lis lmh lon lot luo mab mac man mao mar mde mdn meh men mer mgg mik mku mlg mna mnc mne mng mni mnm mov mra mrl mrt msc msg msl mts mtt mwo mxc nab nad naj nbd ndi ndj ndr ndy nga ngd ngk ngo ngt ngz nha nht nif nmb nnd nnk noc nor nph nua nyk ora orh osa paa pae pai pal par pau paw pdp pip pme pms poh ppi prk psh pso psw ptt puq qaw qhu qia qui rem rny rom rov ruk run ryu sah sal sar sea ses shl sia sid skw sml smn sna snm spa src sta stl sud sue sul svs swe syu tab taf tai tar tbt tbw tbx tel ten teo thy tid tir tke tml tmo tni tob ton tsf tsi tsz tte tuc tun tuy tvl uby udh uli una usa usr uzb vnm wak wao wap war wem wly wma wol wra wrg wrk wrn wtm xbi yal yap yid yko yng yor zag zay zaz zch zqc zzo,355,76475,0.00464204
57A,Position of Pronominal Possessive Affixes,,57,Matthew S. Dryer. 2013. Position of Pronominal Possessive Affixes. In: Dryer; Matthew S. & Haspelmath; Martin (eds.) 2013. The World Atlas of Language Structures Online. Leipzig: Max Planck Institute for Evolutionary Anthropology. (Available online at https://wals.info/chapter/57),1,abk abv acg aco adg ady aga ain akn amc amx ao api apl apu ara ath atm awa awi ayo ayr bae baq bel bil bla blx boa bod brr bry bti bua bun bur cah car cax cba cct cde che chg chj chp chx ckl cln cml cmx cnl cnm coa cor cqt cre cro cti cup die dmi dni eme ess eud ful gan gav gds gjj gnn goa grf gto gua gyc ham hat hix hlp hui hup hve ign ijo ika ina iqu irr ito iwa ixi jak jbt jrw jva kaa kbw kdw ket khg kio klg klw kma kmb kmh kmj kmr knw koa kob kok krh kri krk krw ksa ktm kyp kyz lav ldu lec lkt lng lui mac mam mar mau max may mba mco mcv mdn mea mei mek men mik mki mmv mne mno moh mot mpr mpu mrd mrs mtt mug mui mut muu nag nas nav nbd ncm nev nez nhh nhm nhn nht niv nkk nmb nsn nyu ocu ond ood pba pga pia pip pir plk pme pwn qum ram res rgc rik run sem ser sgb shp sla smn src srn sul tar tau tee tep tgn tic tid tir tja tli tlo tnc tob ton tot tpn tpt trr tte tun tus twn txj tzo tzu uby una urk wap was way wbn wch wic wiy wma wor wra wrk wrn wrw wsk wya xav xer yag yel yqy yuc yur zpr zqc zqo zqs,255,76475,0.003334423
116A,Polar Questions,,116,Matthew S. Dryer. 2013. Polar Questions. In: Dryer; Matthew S. & Haspelmath; Martin (eds.) 2013. The World Atlas of Language Structures Online. Leipzig: Max Planck Institute for Evolutionary Anthropology. (Available online at https://wals.info/chapter/116),6,adz ala alk aml ano apl apu ara arg arm arw azi bae baf bdm bgz bii bik bil ble bsh bum cah cai chk cml cmy cpl ctl cup dha dio diy djm dlm eno erk fij geo ghb gmw gnb grj guj gum hay hix hmi hoa htc hya igb irr ita jak jmo kay kba kbl kch kik kis klv kma kmz knc kni kqq kun kuo kuu kws lab lan lbu lin lmh lon luo mac man mao mde meh mer mku mlg mna mnm mov mra mrl mrt mwo nab nad naj ndi ndj ndr ndy ngd ngk ngo ngz nha nht nif nnk nua ora orh osa paa pai par pip pms poh ppi psh psw rny rom rov ruk sah sar sea ses shl sid skw sml snm sud sul svs tab taf tai tar tbt tbw ten teo thy tid tir tke tob tsi tvl udh uli usa vnm war wem wma wol wrg wrn xbi yap yid yko yng yor zaz zch zzo,173,76475,0.0022621772
17A,Rhythm Types,,17,Rob Goedemans; Harry van der Hulst. 2013. Rhythm Types. In: Dryer; Matthew S. & Haspelmath; Martin (eds.) 2013. The World Atlas of Language Structures Online. Leipzig: Max Planck Institute for Evolutionary Anthropology. (Available online at https://wals.info/chapter/17),1,abe ace aeg agt aly apa apu ara arv asy awe awt bdm bkl blk bna bto bur cah cap cav cmn cre crn cyv cze diy dji dni dre dri dut dyi eng ese est fij fin gay geo ger goo grk grr gug guu haw heb hun iaa ice iga ind jaq kaj kay kei kgu kjo klm kon krl ksr kut kuu kya lar lav len let liv luv mai mau may mdm mku mlc mlk mna mne mnj mnm mns mny mrs mrt mrw mss mta myi myy ngi ngl ngr nin nju nkb nne ntu nua nug nya ono pin pir pit pkn pol ppi ram rti skp slp snm sno snt spa srb sru svk tab tac tag taw tbb tgw tiw tmc tng tns try tsh tuk uzn vot wam wan wao wch wlm wra wrd wrg wrl yaq yel yim yin yny zqc zul,153,76475,0.0020006539
101A,Expression of Pronominal Subjects,,101,Matthew S. Dryer. 2013. Expression of Pronominal Subjects. In: Dryer; Matthew S. & Haspelmath; Martin (eds.) 2013. The World Atlas of Language Structures Online. Leipzig: Max Planck Institute for Evolutionary Anthropology. (Available online at https://wals.info/chapter/101),2,aar abk acg acl aco aeg aga ain aja ala alb all amh amq amr amx ane ang any aoj apl apu apw ara arg arm arp arq arw asm ass asy ath awa awp aym ayr bae bbl bbw bco bej bel bem bfg bgr big bii bik bin bio bir bku bln blx blz bma bnb bob bol bre brf brh brp brr brs bsh bsk bsq bsr bul bum bur cah cai cax cba cct cde che chh chi chk chx cic cld cle cln cmy coo crn cro ctl cub cyv cze dag dds des dhi die dig dim dio dlm dni dom efi eip eko emb eme ene err esm est ewe ewo fua fur ga gaa gah gds gjj gln gmw gmz goo grg grk grw gua gul gyc ham hat hay heh hix hlu hmi hnd hua hun hya ifu ige ik ika ila ina irq isa ita ite ito izi jab jam jmo kab kae kam kan kba kdw kew kfe kga kgr kgz kik kio kkv klv kma kmb kmh kmj kmp kms kmz knd knm kno knr koa kob koe kon krc krd kre krk krr krw ksa kty kwk kwn kwt kwz kyk lan lav lbu lda ldo leg len let lgi lil lim lin lit lkt llm lml luc lul luo luv luy maa mab mac maj map mar mau mbl mbo mbt mby mcc mcv mdn mea mee meh mir mkd mki mku mlu mme mmw mna mne mnm mns moe moh mou mpr mpt mpu mra mrl mro msc msl mss mtb mua myi mzh nab nag naj nan nav nbd ndb ndj nez nga ngo nhh nhm nhn nht nko nmb nnd nse nti ntu nua nue nug nwd nym nyn nyu obg obo ocu olo ond orh oro osa otm pai pan pau pga pkn pkt plh pms pog por pra pre prs pwn qim qum ram rem rim rny rru ruk run rut sak san sar scr ser sgb sgl sgu shm shu sid sio siu skm skp sla slb slo sml so sob spa squ srb src sro stn sul swa taj tar tau tbw ten tep tes tet tgh tgn tgr tiw tja tki tkl tkm tli tlo tmc tmr tna tnc tob ton toz trb trr tsk tsz tte tuk tun tur tus tuv tvo uby udm uld una ung ura urk urn usa usr uzb ven wai wal was way wic wiy wma wrd wrk wrm wrw wry wya yal yao yar yel ygr yim yko ypk yuc yur ywl zai zap zay zqc zul,437,76475,0.0057142857
