parameter_id,parameter_name,parameter_description,chapter_id,chapter_citation,value,same_value_language_ids,value_language_count,language_count_total,count_ratio
16A,Weight Factors in Weight-Sensitive Stress Systems,,16,Rob Goedemans; Harry van der Hulst. 2013. Weight Factors in Weight-Sensitive Stress Systems. In: Dryer; Matthew S. & Haspelmath; Martin (eds.) 2013. The World Atlas of Language Structures Online. Leipzig: Max Planck Institute for Evolutionary Anthropology. (Available online at https://wals.info/chapter/16),5,ace ala arc arm au chv cub for fre gay god guj hno jav kaj khm kro kuz lmh mdm meb mlk mmo mng ngd obk pul sak scr shi skr slo snc squ sun swi tbl wic yil yzv,41,76475,0.00053612294
53A,Ordinal Numerals,,53,Thomas Stolz; Ljuba N. Veselinova. 2013. Ordinal Numerals. In: Dryer; Matthew S. & Haspelmath; Martin (eds.) 2013. The World Atlas of Language Structures Online. Leipzig: Max Planck Institute for Evolutionary Anthropology. (Available online at https://wals.info/chapter/53),4,ava bsk car cem chv cnt cor hop hzb jpn kaz kgz khm kmk kod kor kug kwr lez mao mlc mnd msh mup otm pai per som srd tin tkm tpi tuv tvo txj una uyg uzb yaq yor,41,76475,0.00053612294
72A,Imperative-Hortative Systems,,72,Johan van der Auwera; Nina Dobrushina; Valentin Goussev. 2013. Imperative-Hortative Systems. In: Dryer; Matthew S. & Haspelmath; Martin (eds.) 2013. The World Atlas of Language Structures Online. Leipzig: Max Planck Institute for Evolutionary Anthropology. (Available online at https://wals.info/chapter/72),4,abk aco aeg ain amh amr ana apl apu arm arp asm ava awp ayr bag bem ber bma brh brm brr bsq bur cah car cay cha chr chv cld cmn cnl coi cop cre crg csh ctl cze die dig dre dsh dut eka emb eng epe err ewe far fre fur fye gar geo ger grw gum hai hay hin hlu hmd hmo hum iaa ice igb ika imo ind ita jav jpn kay kek ket kew kgm kio kiw kkn kmp kmu knr kok kor krb krt ksm kut kuv lad lan lat lav laz lez lit lkt lnd lno luo mab mac mak mam map mar may mdg mik miy mkn mku mle mlt mme mna mnd mon mop mrd mrl mro mrt msg msl mul mxc myi mym nav nbd ngl nim nor nun obo oix ong orh otm pai pau pec pip pit pms pol por ppi pso pta pur qim rus scr sdw see shk shl shu slo sml snh snm so spa squ stn sue sug swe tag tgr tha thk tir tiw tja tms tsf tuk ukr uma urk url vie wau wch wel wlo wrk yah yaq yur zqc,201,76475,0.00262831
70A,The Morphological Imperative,,70,Johan van der Auwera; Ludo Lejeune (Umarani Pappuswamy; Valentin Goussev). 2013. The Morphological Imperative. In: Dryer; Matthew S. & Haspelmath; Martin (eds.) 2013. The World Atlas of Language Structures Online. Leipzig: Max Planck Institute for Evolutionary Anthropology. (Available online at https://wals.info/chapter/70),1,abb abk acl aco acu adk aeg ala amh amr ana anl apl ard arg arm arp ars ath ava awp ayr azi bab bam bbw bdk bej bel bem ber bfg bma bre brh brz bsk bsq bud bul bur cah cak car cay ceb chj chv cld cle cmh cml cmn coi coo cor cre cyv cze dag dbd dgr die dig diz dmi dni dyi eka emb emc epe err est eve evn far fin fua fye gam gim glc gmz goj grk grw guj gum ham heb her hin hix hlu hmi hui igb ik iri irq jak jaq jeb kas ket kew khk kil kio kis kmk kmp kms knd knm knr koa kob kod koi krb krc krd krk kro krq kse kte kty kui kut kuv kwe kwr kws kyg lad lak lan lav laz lil lim lit lng lno loz luo luv mab mac mak mam man map mar mau mbg mcd mdn meh mgo mhu miy mle mlt mme mna mns moe mop mos mrd mrg mro msl mss mun mwe myi mym nan nap nbd nez nga nht niv nti ntn nub obo oix oka ood orh otm pan pau pip pms pol ppi prk psm pta pur qim qta ram ret rsu rus rwa scr sdw sgu shb shk shl shu slo sno snt so sou spa srd stn sue sug swa tag tas tau tbu tel tem ter tet tgr tir tiw tkl tml tms tna tnc tpn tsh ttu tun tur tuv tvo tzo tzu udh udi ukr uld una uzb vai vot wap wau wch wel wic wlf wra wrd wrg wrk wwr yaq yim yko yng yny ypk yuk yur yus zaz zen zqc zqs zul,292,76475,0.0038182412
71A,The Prohibitive,,71,Johan van der Auwera; Ludo Lejeune (Valentin Goussev). 2013. The Prohibitive. In: Dryer; Matthew S. & Haspelmath; Martin (eds.) 2013. The World Atlas of Language Structures Online. Leipzig: Max Planck Institute for Evolutionary Anthropology. (Available online at https://wals.info/chapter/71),4,acl acu ala ame amh ana apt ars awp bab bam bdk bem ber bhu bri brr buk bul chk cml cmn coi dbd dig dio diz dni dre dyi gar god grb grk grw gua hau heb her hmr hya hzb imo jeb kay ker kfe kil kim kio kiw kkn kmp kms knd knr koa kod koi kow krk kro krq krt kse kui kwa kwk kws kyg lan lav laz lep lez lil lob loz luo luv mab mal mao map mau mbg mcd mei mhi miy mle mlt mme mnm mro msg mun mwe mwo nav nen nga ngi noo ntu oka oss pai pms pnn psm qta ram ret sgu shu squ stn sug swa tah tbu tem teo tiw tml tor tot tuk tun udi una way wch wiy wrg wwr yaq yim yny yuk yus zaz zqc zul,146,76475,0.0019091206
73A,The Optative,,73,Nina Dobrushina; Johan van der Auwera; Valentin Goussev. 2013. The Optative. In: Dryer; Matthew S. & Haspelmath; Martin (eds.) 2013. The World Atlas of Language Structures Online. Leipzig: Max Planck Institute for Evolutionary Anthropology. (Available online at https://wals.info/chapter/73),1,abk abz adt agl alb arc ava aym aze bez bgv but chc cle dmi drg eve geo god gua hay hzb ing jeb kab kha klg krm kuq lad lez lim mar mei mrd mun nep nog pso rut stl tag taz tsz wic win zun,48,76475,0.0006276561
47A,Intensifiers and Reflexive Pronouns,,47,Ekkehard König; Peter Siemund (Stephan Töpper). 2013. Intensifiers and Reflexive Pronouns. In: Dryer; Matthew S. & Haspelmath; Martin (eds.) 2013. The World Atlas of Language Structures Online. Leipzig: Max Planck Institute for Evolutionary Anthropology. (Available online at https://wals.info/chapter/47),1,afr ala ame amh arg arm asm bag ben bgv brh brm bur cha cle cnt dsh dut eng eve fin fur gar geo god goo grw guj heb hin hmo hun imo ind ing iri jpn juh jun kas kay kfe kha khm knd kob kor lan lav lez mal mar mei mhi miy miz mlt mnd mns mup mxc mym ndy nko nor otm oya pan pit pod prs qhu rap snh snn sue swe tas tel tha tiw tml tna tru tuk tur ung urh vie wel wlf wra yim,94,76475,0.0012291599
62A,Action Nominal Constructions,,62,Maria Koptjevskaja-Tamm. 2013. Action Nominal Constructions. In: Dryer; Matthew S. & Haspelmath; Martin (eds.) 2013. The World Atlas of Language Structures Online. Leipzig: Max Planck Institute for Evolutionary Anthropology. (Available online at https://wals.info/chapter/62),6,aeg agl eng est heb iri knd knr lel mao sup tha tvl,14,76475,0.00018306637
17A,Rhythm Types,,17,Rob Goedemans; Harry van der Hulst. 2013. Rhythm Types. In: Dryer; Matthew S. & Haspelmath; Martin (eds.) 2013. The World Atlas of Language Structures Online. Leipzig: Max Planck Institute for Evolutionary Anthropology. (Available online at https://wals.info/chapter/17),5,agu aln ame arc ava awd bbm bbw ben bgv bnt bqb bqg bqh bql bqn bqo bqr bqz bsk bso bua chv coo ctl cub cya dak dhu dhw djr dob dou eka for gll god gor grb htc irq irr kal ker kew kfe kha kob kop ktn lat mah mal mar mcd mea mme mmo moh nbo obk olm ond oss pai pkm psh que rit rot rus scr sea sed sio skr sla slo sly sml squ sto swe swi tah tas tgk tua tun tur war wiy woi yan yir ymd yzv,98,76475,0.0012814646
54A,Distributive Numerals,,54,David Gil. 2013. Distributive Numerals. In: Dryer; Matthew S. & Haspelmath; Martin (eds.) 2013. The World Atlas of Language Structures Online. Leipzig: Max Planck Institute for Evolutionary Anthropology. (Available online at https://wals.info/chapter/54),7,abk agl arm bat btk cha chk jav kab kay mmo moe msh niv nvs ork pnn stl tag taw udh yes,23,76475,0.00030075188
14A,Fixed Stress Locations,,14,Rob Goedemans; Harry van der Hulst. 2013. Fixed Stress Locations. In: Dryer; Matthew S. & Haspelmath; Martin (eds.) 2013. The World Atlas of Language Structures Online. Leipzig: Max Planck Institute for Evolutionary Anthropology. (Available online at https://wals.info/chapter/14),7,ace asm bag bal baw bma bsk ccp cnl cya dni dri grw gua heb hln irr kal kaw kei khm khs kjn kmu lmp mac mar mrd mta nmb orc pkm prs qch que rnr sed shi skl sml taj tas tbb tru tsi urk uzn wah war wer,51,76475,0.0006668846
15A,Weight-Sensitive Stress,,15,Rob Goedemans; Harry van der Hulst. 2013. Weight-Sensitive Stress. In: Dryer; Matthew S. & Haspelmath; Martin (eds.) 2013. The World Atlas of Language Structures Online. Leipzig: Max Planck Institute for Evolutionary Anthropology. (Available online at https://wals.info/chapter/15),8,ace acg agt aln alw aly ana ara aro arp asm atb awe awt aym bae bag bal baw bbm bbw bdm ben bik bim blk bma bnl bnt bqb bql bqn bqo bqr bqs bre bsk bto bua bug buu cah cav chk cmn cnl cpn cre crn cup cya cyv cze daa dak dio diy dji dni dob dou dre dri dyi eno ese est far fin frd gae geo gid gll glp goo grk grr grw gua gug guu haw heb hln hmu hnn hun iaa ice ind ing iri irr jak jaq jum kal kam kap kaw kay kei kfe kgu khm khs kjn kjo kli klp kmu kob kon koo koy krl ksr kut kwa kya lan lat lav len liv lje lla lmp lrk luv mac mae mal map mar mau may mbb mcd mgd min mis mks mku mms mna mnj mns mnt mnx mny moh mrd mrt mta myi myn myy naj nbb nbo ngl ngr nht nia nin niv nju nkb nmb nne npu nsy ntu nua nug olm ond ono orc pad pag pai pau pin pir pit pkm pkn plh plp pme pms pna pol ppi prs pur put qay qch qim que rap rit rnr rti sah sbg sed sgr shi skl slp sly sml snm sno squ srb sro sto sup svk swa tab tac tag taj tas taw tbb tbr teh tgk thp tiw tla tld tmc tor trd tru try tse tsi tua tuk tun tzo uhi uma urk uzn vot wah wan wao war wbn wch wel wer wet wlm wnb wra wrd wrl yaq yel yim yir ymd yny ywl zqc zul zun,281,76475,0.0036744033
