parameter_id,parameter_name,parameter_description,chapter_id,chapter_citation,value,same_value_language_ids,value_language_count,language_count_total,count_ratio
18A,Absence of Common Consonants,,18,Ian Maddieson. 2013. Absence of Common Consonants. In: Dryer; Matthew S. & Haspelmath; Martin (eds.) 2013. The World Atlas of Language Structures Online. Leipzig: Max Planck Institute for Evolutionary Anthropology. (Available online at https://wals.info/chapter/18),1,abi abk abm ach acm aco adz aea aeg agh aht aik ain aiz akn akw ala alb ald amc ame amh amo amu amz ana anc ani ao api apu arb arc arm arp asm ata ava awn awp aym aze bag bai baj bam baw bbf bco bee bej ben ber bet bir bis bki bkr bma bng bod bra brb bre brh bri brm brw bsk bsq bto bul bur cad cah cam car cax cay cck ccp cha che chk chl chq chu chv chw cil cle cmn cnl cnt cof coo cre cso cti ctl cve cyv dad dag dah dan dar ddf det dgb dgr die dio diz dni dnw don doy dre dts dum efi eja eng eve evn ewe ewo fas fef fij fin fre ful fur fuz fye ga gar gbb geo ger ghb gla gmb goa grb grk grw gua gwa had hai hak ham hau hba hin hix hmo hmr hok hop htc hum hun hup hve hzb iaa iba igb ign igs ijo ik ika imo ind ing ird irq irr irx iso ite ito iva iwm jak jaq jav jeb jeh jiv jng jom jpn jpr juh kab kad kal kas kch ked kef kek ker ket kew kfe kgi kgz kha khm kho khr khs kio kiw kkn kkv klm klv kly kmp kmu knd knk knm knr koa kob koh koi kom kor kot koy kpe krd krk kro kry kse ksg kss ktk kty kul kun kur kut kwa kwk kwo kws kyl kzy lad lah lak lam lat lav len lep lez lit lkk lkt llm lu lua lug lui luo lus luv maa mab mak mal mao map mar mau may maz mba mbm mei mgg mie mla mme mnc mnd mne mog mor mov mrd mrg mrl mro mss mtp mui mum mun mxc mxm mya mzc nai nan nap nar nas nav nax nbk ndt ndy nep new nez nga ngi ngz nhn nht nim nis niv nko nkt nmb nnc nob non nor nti ntu nun nuu nyg nyi oca ogb oji ood orh orm otm pac pae pai pau paw pec phl pms poa poh pol prs psh psm pso puk pur qaw qco ram rap res rom ror rsc ruk rus rut sab san sba scs sdh sdw seb sed sel sha shi shk shs shu sin skp sla slp sml snc snd snh snm snt som soq sor spa squ sre srn sue sui sup svs swa tab tac tag tam tas teh tel ter tgk tgr tha tib tic tiw tks tlp tma tmn tmp tne toa tok tol ton tpa tru try tsg tsi tso ttn ttu tug tuk tul tun tur tuv twn tza umb una urk usa uzn vie wap wch win wiy wlf wma wnt woi wra wrs wuc xoo yan yap yaq yar yaw yay ycn yct yes yey ygr yko ykt yor ytu yuc yul yur yus zan zqc zul zun,503,76475,0.006577313
8A,Lateral Consonants,,8,Ian Maddieson. 2013. Lateral Consonants. In: Dryer; Matthew S. & Haspelmath; Martin (eds.) 2013. The World Atlas of Language Structures Online. Leipzig: Max Planck Institute for Evolutionary Anthropology. (Available online at https://wals.info/chapter/8),1,aco adk adz ain akn akw ala amc ani api apu arb asm bno bri brr cad car cax cmn cof cre cub cve cyv dad dag der det efi eja epe fas fef gar gds ham hok hop hum ika irr iwm jiv jom jpn kho kiw kla kng koh kpa krb krk kwo mao max may mor mtp mui nas nht nim nko oca pau pnr prh rap res ror rtk shi shk shs sin snc snm snt srn sue tac tic tso urk usa wao war wic wnt yag yar yaw,95,76475,0.001242236
12A,Syllable Structure,,12,Ian Maddieson. 2013. Syllable Structure. In: Dryer; Matthew S. & Haspelmath; Martin (eds.) 2013. The World Atlas of Language Structures Online. Leipzig: Max Planck Institute for Evolutionary Anthropology. (Available online at https://wals.info/chapter/12),2,aco agh aik ain akn akw ald ame amh amo amp amu ani ant ao arb arp asm awn aym aze bag bai baj baw bee ber bet bir bis bkr bng bod brm byu cac cad car cax cck cha che chp cil cle cmn cnt cre cti ctl dad dag dan dar ddf der det dgb din diy dni dnw don dre dyi efi eja epe eve ewe ewo fef fin fur fuz fye ga gan gar gbb gds gla gmb goo grr grw hak hau hix hmo hmr hok htc hve hzb iaa iba igs ika irq irr irx iso ito iva jak jaq jeb jng jom jpn jpr kad kal kay kch ked kef ker kfe kgu kho khr kio kkv klv kmp kng knk knm knr koa kob kom kor kpe krb kro ksg kss kty kul kun kwo kya kyl lah lan lav len lkk lu lua lug luo maa mal map max mbb mei mgg mla mnd mne mrd mrl mro mrt mss mum mun mya mzc nai nan nar nav ndt ndy new nga ngi ngz nhn nht nko nnc nob nug nyg nyi ogb orh pac pai paw pec phl pit pms pnr poa puk pur ram res ruk sdw sed sha shi shk shs skp sla sml snm som sor spa sui sup tag tam tel ter tgk tgr tha tib tiw tma tmn tok tol ton tru try tsg tur una ung urk usa vie wah wam war wch win wma wmu wnt woi wrs xoo yag yap yaq yaw yay ycn yes yey yid yim yko yny yul yus zul zun,274,76475,0.0035828701
4A,Voicing in Plosives and Fricatives,,4,Ian Maddieson. 2013. Voicing in Plosives and Fricatives. In: Dryer; Matthew S. & Haspelmath; Martin (eds.) 2013. The World Atlas of Language Structures Online. Leipzig: Max Planck Institute for Evolutionary Anthropology. (Available online at https://wals.info/chapter/4),2,abm adk adz akn ala ame amh ani arp bag baj bej ben bkr bno brr brw bsq bto cad cam car cay cck cha cle coo cso cub cve cyv dag dar ddf der det din dio dts dum efi eja epe eve evn eya fur gan gar grb had hba hix hve iba ign igs ika irq irx ito iva jeh jng jpr kas kch ked kef ket khr khs kio kiw kkn kla klm klv knd knk knm koa koi kom kot koy kse ktk kul kun kur kwk kws kyl lan lav lua luo lus mak mei mie mla mnc mpa mrl mrn mro mtp mun mya nai nar ndt nep new nga nim nis nkt nob non nor ntu nyi ood pec prh pso pur qui ram res sab scs sdw sml snh snt som sor sre srn sue tab tac tag teh tel tgk tha tib tic tks tlp tma tmn tne tru try tsg tsi ttn tul tun tuv twn tza una usa wao wap win wlf wma woi xoo yan yap yaq yar yaw yay ygr yko yor ytu yuc,189,76475,0.0024713958
19A,Presence of Uncommon Consonants,,19,Ian Maddieson. 2013. Presence of Uncommon Consonants. In: Dryer; Matthew S. & Haspelmath; Martin (eds.) 2013. The World Atlas of Language Structures Online. Leipzig: Max Planck Institute for Evolutionary Anthropology. (Available online at https://wals.info/chapter/19),1,abi abm ach acm adk adz aht aik ain akn akw ala alw amh amp amu amz ana anc ant ao api apu arb arm arp asm awn awp aym aze bag bai baj bam baw bco bee bej ben bis bki bkr bng bno bod brd bre brh bri brr brw bsq bto bua bul bur byu cac cad cah cam car cax cay cck ccp cha che chk chl chu chv chw cil cle cmn cnl cnt cof coo cre cso cti ctl cve cyv dad dag dar ddf der dgr die din dio diy diz djp dni dnw don dum dyi eka epe eve evn eya fas fef fin fre ful fur fuz fye gan gar gds geo ger ghb gla gmb goa goo grr grw gua hai hak ham hau haw hba hin hix hmo hmr hok hop hun hup iba ign ik ika imo ind ird irr irx ite ito iva iwm jak jaq jav jeb jeh jiv jng jom jpn jpr kad kal kas kay kch ked kef kek ker ket kew kfe kgi kgu kgz kha khm khr khs kio kiw kkn kkv klm klv kly kmp kmu knd kng knk knm knr koa kob koi kom kor kot koy krb krk kro kry kse kty kul kun kur kut kwa kwk kwo kws kya kyl kzy lad lah lam lan lat lav len lep lez lit lkt lu lua lui luo lus luv maa mab mak mal mao mau max may maz mbb mei mgg mie mku mla mlk mnc mnd mne mog mor mov mpa mrd mrg mrn mrt mss mtp mui mun mya myi mzc nai nan nap nar nas nav nax nbk ndt ndy nep new nez ngz nhn nht nim nis niv nko nkt nmb nnc nob non nor nug nun nyg nyi oca oji ond ood orh orm pac pae pai pau paw pec phl pit pms pnr poa poh pol prh prs psh psm pso puk pur qaw qui ram rap res rom ror rsc rus sab sba scs sdh seb sed sel sha shi shk shs shu sin skp sla slp sml snc snh snm snt sor sre srn sue sui sup svs tab tag tam teh tel ter tgk tha tib tic tiw tks tli tlp tmn toa tol ton tpa tru try tsg tsi tso ttn tug tuk tul tun tur tuv twn tza umb una ung urk usa uzn vie wah wam wao wap war wch wdo wic win wiy wlf wma wmu wnt woi wra wrd wrs wry wuc yag yan yaq yar yaw ycn yct yes ygr yid yim yko ykt yny ytu yuc yur yus zqc zun,449,76475,0.0058711995
5A,Voicing and Gaps in Plosive Systems,,5,Ian Maddieson. 2013. Voicing and Gaps in Plosive Systems. In: Dryer; Matthew S. & Haspelmath; Martin (eds.) 2013. The World Atlas of Language Structures Online. Leipzig: Max Planck Institute for Evolutionary Anthropology. (Available online at https://wals.info/chapter/5),1,abi abm ach acm aco aea aht ain alw amc amp amu amz ant ao api apu arb arc arm asm ata ava awp aym bai bco bee ber bng bra brd bua byu cac cah cax cck ccp che chk chl chp chq chu chw cmn cnl cnt cre dad die diy djp dni don dum dyi eya fas fij ful fuz fye gds geo gla gmb goa goo grr grw gua hai hak ham haw hmo hop htc hup imo irr ite iwm jak jaq jav jeb jiv jom jpr kay kek kew kgu khm kho kkv kmu kng koa kob kor krb krk kro kry ksg kss kty kut kwa kwo kya len lkk lkt lui luv maa mao map mar mau max may maz mbb mku mlk mme mnd mne mor mov mrt mss mtp mxc mxm myi mzc nan nas nav nbk nez ngi nhn nht niv nmb nnc ntu nug nun nuu nyg oca oji ond pac pae pec phl pit pms pnr poa poh prh psm qaw qco rap ror rtk seb sed sel sha shi shk shs shu sin skp sla slp snc snm snt spa squ svs tam tgk tiw tli toa tol ton tpa tru tso ttu tuk umb ung urk usa vie wah wam war wch wdo wic wiy wmu wnt wra wrd wrs wry wuc yag yaq ycn yct yel yes yid yim yny yur yus zqc zul zun,242,76475,0.0031644327
7A,Glottalized Consonants,,7,Ian Maddieson. 2013. Glottalized Consonants. In: Dryer; Matthew S. & Haspelmath; Martin (eds.) 2013. The World Atlas of Language Structures Online. Leipzig: Max Planck Institute for Evolutionary Anthropology. (Available online at https://wals.info/chapter/7),3,aiz anc bag bet bra chw dan ddf dnw doy fye gbb gwa jeh kad ker kgi khm knk koh kpe kro ksg kss lam lkk lua maa mba mbm mov mrg mrl mum ndt ngz nti nun nyg ogb pac pau phl san sdh sre ter tma tok tso tuk vie ygr yul,55,76475,0.0007191893
6A,Uvular Consonants,,6,Ian Maddieson. 2013. Uvular Consonants. In: Dryer; Matthew S. & Haspelmath; Martin (eds.) 2013. The World Atlas of Language Structures Online. Leipzig: Max Planck Institute for Evolutionary Anthropology. (Available online at https://wals.info/chapter/6),1,abm ach aco adk adz agh aik ain aiz akn akw ala alb ald alw amc ame amh amo amp amu amz ana anc ant ao api apu arb arp asm awp aze bag bai baj bam baw bbf bee bej ben ber bet bir bis bki bkr bng bno bod bra brb brd bre brh bri brm brr brw bsq bto bua bul byu cac cad cam car cax cay cck ccp cha che chp chq chu chv chw cil cle cmn cnl cnt cof cre cso cti ctl cub cve cyv dad dag dah dan dar der det dgb dgr din dio diy diz djp dni dnw doy dre dts dum dyi efi eja eka eng epe eve evn ewe ewo fas fef fij fin ful fur fuz fye ga gan gar gbb gds ghb gmb goa goo grb grk grr gua gwa had hak hau haw hin hix hok htc hum hun hve iaa iba igb ign igs ijo ik ika imo ind ird irr irx iso ito iva iwm jav jeb jeh jiv jng jom jpr juh kad kas kay kch ked kef ker kew kfe kgi kgu kha khm kho khr khs kio kiw kkn kkv kla klv kly kmu knd kng knk knm knr koa kob koh koi kom kor kot koy kpa kpe krb krk kro kse ksg kss ktk kty kul kun kwa kwo kws kya kyl kzy lad lam lan lat lav len lep lit lkk lkt llm lu lua lug luo luv maa mab mal mao map mau max may maz mba mbb mbm mei mie mku mla mlk mme mnc mnd mne mor mov mpa mrd mrg mrl mrn mro mrt mss mtp mui mum mun mxc mxm mya myi mzc nai nan nar nas nav nbk ndt ndy nep new nga ngi ngz nhn nht nim nis nko nkt nmb nnc nob non nor nti ntu nug nun nyg nyi oca ogb oji ond ood orh otm pac pae pau paw pec phl pit pms pnr poa poh pol prh psm puk pur qaw ram rap res rom ror rsc rtk ruk rus sab san sba scs sdh sdw seb sed sha shi shk shs sin sla slp sml snc snd snh snm snt soq sor spa sre srn sue sup svs swa tab tac tag tam tas tel ter tgk tgr tha tib tic tiw tks tlp tma tmn tmp tne toa tok tol ton tru try tsg tso ttn tuk tul tun tur tuv twn tza umb una ung urk usa vie wah wam wao wap war wdo wic wiy wlf wma wmu wnt woi wra wrd wrs wry wuc yag yan yap yaq yar yaw yay ycn yct yel yes yey ygr yid yim ykt yny yor yuc yul yur zan zqc zul zun,470,76475,0.006145799
11A,Front Rounded Vowels,,11,Ian Maddieson. 2013. Front Rounded Vowels. In: Dryer; Matthew S. & Haspelmath; Martin (eds.) 2013. The World Atlas of Language Structures Online. Leipzig: Max Planck Institute for Evolutionary Anthropology. (Available online at https://wals.info/chapter/11),1,abi abk abm ach acm aco adk adz aea aeg agh aht ain aiz akn akw ala ald alw amc ame amh amo amp amu amz ana anc ani ant ao api apu arb arc arm arp asm ata ava awn awp aym bag bai baj bam baw bbf bco bee bej ben ber bet bir bis bki bkr bma bng bno bod bra brb brd brh bri brm brr brw bsq bto bua bul bur byu cac cad cah cam car cax cay cck ccp cha che chk chl chp chu chw cil cle cmn cnl cof coo cre cso cti ctl cub cve cyv dad dag dah dan dar ddf der det dgb die din dio diy diz djp dni dnw don doy dre dts dum dyi efi eka eng epe eve evn ewe ewo eya fas fef fij ful fur fye ga gan gar gbb gds geo ghb gla gmb goa goo grb grk grr grw gua gwa had hai hak ham hau haw hba hin hix hmo hmr hok htc hum hup hve hzb iba igb ign igs ijo ik ika imo ind ing ird irq irr irx iso ite ito iva iwm jak jaq jav jeb jeh jiv jng jom jpn jpr juh kab kad kal kas kay kch ked kef kek ker ket kew kfe kgu kha khm kho khr khs kio kiw kkn kkv kla klm klv kly kmp kmu knd kng knk knm knr koa kob koh koi kom kor kot koy kpa kpe krb krd krk kro kry kse ksg kss ktk kty kul kun kur kut kwa kwk kwo kws kya kyl kzy lad lah lak lam lan lat lav len lit lkk lkt llm lu lua lug lui luo lus luv maa mab mak mal mao map mar mau max may maz mba mbb mei mgg mie mku mla mne mog mor mov mpa mrd mrg mrl mrn mro mrt mss mtp mui mum mun mxc mxm mya myi mzc nai nan nap nar nas nav ndt ndy nep new nez ngi ngz nhn nht nim nis niv nko nkt nmb nnc nob non nti ntu nug nun nuu nyg nyi oca ogb oji ond ood orh orm otm pac pae pai pau paw pec phl pit pms pnr poa poh pol prh prs psh psm pso puk pur qaw qco qui ram rap res rom ror rsc rtk ruk rus rut sab san sba scs sdh sdw seb sed sha shi shk shs shu sin sla slp sml snc snd snh snm snt som soq sor spa squ sre srn sue sui sup svs swa tab tac tag tam tas teh tel ter tgk tgr tha tic tiw tks tli tma tmn tmp tne toa tok tol ton tru try tsg tsi tso ttn ttu tug tuk tul tun twn tza umb una ung urk usa uzn vie wah wam wao wap wch wdo wic win wiy wlf wma wmu wnt woi wra wrd wrs wry xoo yag yan yap yaq yar yaw yay ycn yct yel yes yey ygr yid yim yny yor yuc yul yur yus zan zqc zul zun,525,76475,0.0068649887
1A,Consonant Inventories,,1,Ian Maddieson. 2013. Consonant Inventories. In: Dryer; Matthew S. & Haspelmath; Martin (eds.) 2013. The World Atlas of Language Structures Online. Leipzig: Max Planck Institute for Evolutionary Anthropology. (Available online at https://wals.info/chapter/1),2,abi acm adz ala ame arp bai bee bis bki bkr bod brb brd bri bto bua car cax cck chk cso cyv dts epe eve evn fef fin fur gar ghb gmb gua hak hba hix hum ika jiv jpn kay kch ked ket kew kfe kkv kly kmp krk kry kse kss kty kun kwa lan lav len luv mau mnc mne mov mrd mss mxc mxm myi nai ndy nhn nht nis nnc nob nyg nyi oji pec pit pms poa psm ram shk shs sin skp slp sor svs tab tac tag tic tmn tne ton tpa try tsg tso tun ung urk wah wam war wdo wma wnt woi wrd wry yaq ycn yes yor zqc,122,76475,0.0015952926
3A,Consonant-Vowel Ratio,,3,Ian Maddieson. 2013. Consonant-Vowel Ratio. In: Dryer; Matthew S. & Haspelmath; Martin (eds.) 2013. The World Atlas of Language Structures Online. Leipzig: Max Planck Institute for Evolutionary Anthropology. (Available online at https://wals.info/chapter/3),3,abi acm aik alb ald amc ame amz apu ata awn awp bag baj bam bbf bee bej ben bir bis bng bra brd bre bri brm bsk bto bua bul byu cam cha chq cil cle cso cti ctl ddf dgr din diz dnw don doy dre dyi eja eve evn ewe ewo fij ful ga gan gar gbb gds ghb gla gmb goa grk gua gwa hak hba hix hok hop htc hun hve hzb iaa iba igb igs ik ind irx iso ito jeh jiv jpn kad kas kch kef kek ker kew kgz khs kio kkv klv kly kmp knk knm knr koh kom koy kpe krd krk kry kse ksg ktk kty kur kwa kwo kws kya kzy lah lat lav lep llm lua lug lui luo luv mab map mau mba mei mlk mme mnc mnd mne mor mov mrd mrn mro mui mum mxc mxm mya myi mzc nai nar nax nbk ndt ndy nhn nht nko nkt nob nun oji ood orm otm pec phl pms prs psm puk rom san sba sha shk shs sin sml snd snh sor spa sre sup svs tab tag tam tib tic tks tok tol ton tru tso tug tuk tul tur twn umb ung uzn wah wch wic wlf wma wrd wry wuc yan yap yaq yaw yay ycn yct yes ygr yid yko ytu zan zun,234,76475,0.0030598235
13A,Tone,,13,Ian Maddieson. 2013. Tone. In: Dryer; Matthew S. & Haspelmath; Martin (eds.) 2013. The World Atlas of Language Structures Online. Leipzig: Max Planck Institute for Evolutionary Anthropology. (Available online at https://wals.info/chapter/13),1,abk aea aeg aht akw ala alb alw ame amh amp amu ana api apu arb arc arm arp asm ata ava awp aym aze baj bco ben bis bki bkr bma bng brd bre brh brr brw bsk bsq bto bua bul bur byu cah cam car cax cck ccp cha chk chl chu chv cmn cnl coo cre ctl cyv dar ddf der dgr die dio diy djp dni dre dyi eng epe eve evn eya fij fin fre gan gar geo ger goo grk grr grw gua hai haw hba hin hix htc hum hun hup hzb iaa iba ika imo ind ing ird irr irx iva jak jaq jav jeb jeh jpr kab kas kay kch ked ket kfe kgu kgz kha khm khr khs kkn kkv klm klv kly kmp knd kng kob kor kot koy krb krd kry kty kun kut kwa kwk kws kya kzy lad lak lav len lez lkt lui lus mak mal mao map mar mau max may mbb mgg mku mlk mne mog mov mpa mrd mrn mrt mss mtp mun myi nai nap nep new nez nga ngi nhn nht nnc ntu nug nuu oji ood orm pac pae pai pau pit pms pnr poh pol prs psh puk pur qaw qco ram rap rom ror rsc rtk ruk rus sba scs sdh sed sel shi shk shu sml snc snh snm soq sor spa squ srn svs swa tab tac tag tas teh tel tgk tgr tiw toa tol ton tpa tru try tsg tsi tso ttn ttu tug tuk tul tur tuv tza ung urk usa uzn wam wao wap war wch wdo wic win wiy wlf wma wmu wnt woi wra wrd wry yan yap yar yaw ycn yel yes yid yim yko ykt yny ytu yuc yur yus zqc zun,307,76475,0.004014384
2A,Vowel Quality Inventories,,2,Ian Maddieson. 2013. Vowel Quality Inventories. In: Dryer; Matthew S. & Haspelmath; Martin (eds.) 2013. The World Atlas of Language Structures Online. Leipzig: Max Planck Institute for Evolutionary Anthropology. (Available online at https://wals.info/chapter/2),1,abk abm adz aea alw amc amp amu ana awp aym bco bma brd byu cad cah cax cay cck ccp chl chu cre diy djp dyi eya gds goo grr grw hai hup ign iva jaq jeb jiv kab kay kgu klm koa kut kya lak lus mal maz mbb mpa mrg mrn mrt nav new ngi nhn nug nuu oji ond pae pai pau pit prh qaw qui ram ruk sel shk shs squ tac tas teh tiw tli tpa tsg tsi wam wdo wic yes yid yim yny yus,93,76475,0.0012160836
